Title;Content;Date;URL;Cleaned Article
         Tertarik Beli Saham Google? Ketahui Dulu Cara Beli Saham hingga Risikonya    ;Saham Induk Google bernama Alphabet Inc pada perdagangan akhir pekan ini menurun saat Indeks Nasdaq menyentuh rekor tertinggi. Menurut CNBC Indonesia, harga saham Alphabet drop tipis 0,06% ke level US$ 1.576,19/unit. Harga saham berkode GOOG ini sebenarnya menunjukkan peforma yang menggembirkan di tengah pandemi covid-19, dimana secara year to date naik 17,68%. Membeli saham menjadi salah satu investasi yang cukup populer selain membeli emas hingga rumah. Google menjadi salah satu perusahaan IT terbesar di dunia. Selain Google, saham teknologi terbesar lainnya yang bisa kamu lirik adalah Apple, Facebook atau Microsoft.      ADVERTISEMENT         SCROLL TO CONTINUE WITH CONTENT      Bagi kamu yang tertarik membeli saham Google, sebaiknya ketahui dulu bagaimana cara membeli saham teknologi hingga apa saja risiko-risiko yang mungkin kamu akan hadapi.   FAANG terdiri dari lima perusahaan yaitu Facebook, Apple, Amazon, Netflix dan Google). Kelima perusahaan ini terdaftar dalam saham Nasdaq (National Association of Securities Dealers Automated Quotations).   Cara membeli saham teknologi lokal ataupun asing sebenarnya sama saja. Perbedaannya adalah di pendaftaran sekuritas asing yang memiliki link ke bursa saham internasional seperti Amerika Serikat, Singapura dan sebagian negara Eropa untuk saham asing. Harga saham Google dalam rupiah hari ini (23/08/2020) adalah 1.575,57 USD atau 23.262.188,15 rupiah. Jika kamu tertarik untuk membeli saham Google atau teknologi lain, kamu perlu mempertimbangkan setiap kemungkinannya baik keuntungan atau risikonya. Berinvestasi saham Google bisa menggunakan jasa pialang atau broker saham terbaik dan terpercaya seperti eToro Broker, Interactive Broker, hingga Saxo Bank.   Ketika membeli saham teknologi tentu tujuan kita adalah untuk mendapatkan keuntungan. Google menjadi salah satu sektor perusahaan yang bergerak cepat di bidang teknologi. Namun dibalik keuntungannya, saham teknologi juga memiliki risiko tinggi yang bisa mengakibatkan kerugian. Saham teknologi dengan harga yang tak murah ini benar-benar perlu dipahami pergerakan di bursa saham. Saham teknologi yang sedang naik sejalan dengan fundamental perusahaan khususnya pendapatan, dapat menurun secara drastis juga. Sebagai contoh di awal Maret 2020 saat pendemi COVID-19, hampir seluruh negara termasuk Amerika Serikat saham Google turun hingga 23 persen dan naik secara perlahan. Kondisi ini tentu akan mengejutkan dan mengharuskan kamu mengambil setiap keputusan untuk berbagai kemungkinan yang akan terjadi. ;23-08-2020;https://finance.detik.com/bursa-dan-valas/d-5143621/tertarik-beli-saham-google-ketahui-dulu-cara-beli-saham-hingga-risikonya;saham induk google bernama alphabet inc pada perdagangan akhir pekan ini menurun saat indeks nasdaq menyentuh rekor tertinggi. menurut cnbc indonesia, harga saham alphabet drop tipis 0,06% ke level us$ 1.576,19/unit. harga saham berkode goog ini sebenarnya menunjukkan peforma yang menggembirkan di tengah pandemi covid-19, dimana secara year to date naik 17,68%. membeli saham menjadi salah satu investasi yang cukup populer selain membeli emas hingga rumah. google menjadi salah satu perusahaan it terbesar di dunia. selain google, saham teknologi terbesar lainnya yang bisa kamu lirik adalah apple, facebook atau microsoft. bagi kamu yang tertarik membeli saham google, sebaiknya ketahui dulu bagaimana cara membeli saham teknologi hingga apa saja risiko-risiko yang mungkin kamu akan hadapi. faang terdiri dari lima perusahaan yaitu facebook, apple, amazon, netflix dan google). kelima perusahaan ini terdaftar dalam saham nasdaq (national association of securities dealers automated quotations). cara membeli saham teknologi lokal ataupun asing sebenarnya sama saja. perbedaannya adalah di pendaftaran sekuritas asing yang memiliki link ke bursa saham internasional seperti amerika serikat, singapura dan sebagian negara eropa untuk saham asing. harga saham google dalam rupiah hari ini (23/08/2020) adalah 1.575,57 usd atau 23.262.188,15 rupiah. jika kamu tertarik untuk membeli saham google atau teknologi lain, kamu perlu mempertimbangkan setiap kemungkinannya baik keuntungan atau risikonya. berinvestasi saham google bisa menggunakan jasa pialang atau broker saham terbaik dan terpercaya seperti etoro broker, interactive broker, hingga saxo bank. ketika membeli saham teknologi tentu tujuan kita adalah untuk mendapatkan keuntungan. google menjadi salah satu sektor perusahaan yang bergerak cepat di bidang teknologi. namun dibalik keuntungannya, saham teknologi juga memiliki risiko tinggi yang bisa mengakibatkan kerugian. saham teknologi dengan harga yang tak murah ini benar-benar perlu dipahami pergerakan di bursa saham. saham teknologi yang sedang naik sejalan dengan fundamental perusahaan khususnya pendapatan, dapat menurun secara drastis juga. sebagai contoh di awal maret 2020 saat pendemi covid-19, hampir seluruh negara termasuk amerika serikat saham google turun hingga 23 persen dan naik secara perlahan. kondisi ini tentu akan mengejutkan dan mengharuskan kamu mengambil setiap keputusan untuk berbagai kemungkinan yang akan terjadi. 
Peluang Investasi Lewat Iklan di Masa Pandemi;"Laporan Wartawan Tribunnews.com, Willem Jonata TRIBUNNEWS.COM. JAKARTA  - Pandemi Covid-19 mempengaruhi sektor perekonomian. Tak sedikit perusahaan terpaksa melakukan pengurangan karyawan untuk bertahan. Di sisi lain, pelaku bisnis yang bergerak di bidang periklanan, media maupun biro iklan, atau advertising agency, bisa menjadikan kondisi ini sebagai tantangan. Berkurangnya masa operasional perusahaan selama pandemi covid-19 bukan berarti kegiatan menjaga komunikasi brand terhenti. Justru hal ini menjadi momentum untuk memperkuat promosi/iklan, agar nantinya dapat memperkuat kepemimpinan di pasar. ""Masa sulit pandemi Covid-19 memang berdampak luar biasa ke hampir semua bisnis. Namun, bagi pemilik bisnis yang punya alokasi bujet iklan yang mencukupi, bisa mencoba berpikir terbalik dari pemilik bisnis pada umumnya, yakni memanfaatkan momentum sekarang ini untuk berinvestasi lewat promosi pasang iklan di berbagai media,"" tutur Direktur Marketing Doremindo Agency (DO'A), Suardi dalam keterangan resminya. Baca: Sido Muncul Dukung Omnibus Law Lewat Iklan: Kalau Lapangan Kerja Banyak, Gaji Karyawan Naik Pada saat kompetitor tengah berjibaku dengan permasalahan yang ada, ini menjadi peluang untuk menanamkan persepsi brand kepada para konsumen.  .recads_wrapper{height:134px;position:relative;margin:10px 0 30px;padding:10px 15px;overflow:hidden;box-shadow:0 0 10px rgb(0 0 0 / 20%);}.recads_title{margin-bottom:10px;font-size:16px;font-weight:700}.arjW-list{overflow-x:scroll;overflow-y:hidden;white-space:nowrap;width:auto;padding:10px 0;position:relative;display:flex;scroll-snap-type:x;flex-wrap:nowrap}.recads_item{scroll-snap-align:start;width:280px;flex:0 0 280px;margin-right:20px;display: flex;white-space: normal;gap: 10px;}.recads_item a {display:flex;white-space:normal;gap:10px;}.recads_image{position:relative;height:auto}.recads_image img{width:auto;height: 73px!important;max-width:165px!important;border-radius:8px}.article_datas_title{font-size:14px;font-weight:700;line-height:1.2;margin:0;overflow:hidden;display:-webkit-box;-webkit-line-clamp:4;-webkit-box-orient:vertical;}.arjW-img-overlay{position:absolute;z-index:3;bottom:8px;left:0;padding:0 0 0 10px}.arjW-img-overlay>img{width:auto;height: 16px!important;}.recads_image::after{z-index:2;position:absolute;top:50%;bottom:4px;left:0;right:0;content:'';background:linear-gradient(to top,#d6d6d6,transparent);width:100%;border-radius: 8px;}             BERITA REKOMENDASI           Apabila pandemi ini berakhir, akan dibutuhkan waktu untuk bisa kembali seperti sedia kala. Namun, jika telah melakukan investasi untuk promosi/ pemasangan iklan, maka penguasaan market yang ditargetkan akan lebih dekat di genggaman.  Ilustrasi  Banyak saluran yang bisa dipergunakan berinvestasi iklan, misal pasang iklan melalui media konvensional di antaranya koran atau majalah, maupun media digital, hingga media online. Pilihan terbaiknya, kata Suardi, adalah menggunakan kombinasi kedua jenis media tersebut. ""Pada kondisi sekarang, beberapa media menyediakan diskon spesial dan paket-paket harga pemasangan iklan hemat untuk membantu promosi perusahaan,"" ungkap Suardi, Doremindo Agency. ""Biasanya pada masa normal tidak ada krisis/ pandemi, harga iklan di media cenderung lebih tinggi dan diskonnya lebih kecil, karena banyak brand yang mengantre atau rebutan memasang iklan di posisi terbaik. Investasi lewat promosi iklan di media yang tepat pada masa sekarang, ibarat membeli saham ketika harga lagi turun,"" paparnya. Baca: Tekan Pengangguran, Perusahaan Farmasi Edukasi Masyarakat Lewat Iklan Semenjak seluruh masyarakat dianjurkan berada di rumah untuk memutus rantai penyebaran Covid-19 hingga diterapkannya adaptasi kebiasaan baru, terdapat perubahan pola hidup masyarakat. Selain penerapan protokol kesehatan, aktivitas masyarakat kini lebih banyak ke ranah digital. Alhasil, iklan digital akan terus tumbuh, namun tetap diperlukan pemasangan iklan secara konvensional guna menjangkau pengguna nondigital.";24-08-2020;https://www.tribunnews.com/bisnis/2020/08/24/peluang-investasi-lewat-iklan-di-masa-pandemi;"laporan wartawan tribunnews.com, willem jonata tribunnews.com. jakarta - pandemi covid-19 mempengaruhi sektor perekonomian. tak sedikit perusahaan terpaksa melakukan pengurangan karyawan untuk bertahan. di sisi lain, pelaku bisnis yang bergerak di bidang periklanan, media maupun biro iklan, atau advertising agency, bisa menjadikan kondisi ini sebagai tantangan. berkurangnya masa operasional perusahaan selama pandemi covid-19 bukan berarti kegiatan menjaga komunikasi brand terhenti. justru hal ini menjadi momentum untuk memperkuat promosi/iklan, agar nantinya dapat memperkuat kepemimpinan di pasar. ""masa sulit pandemi covid-19 memang berdampak luar biasa ke hampir semua bisnis. namun, bagi pemilik bisnis yang punya alokasi bujet iklan yang mencukupi, bisa mencoba berpikir terbalik dari pemilik bisnis pada umumnya, yakni memanfaatkan momentum sekarang ini untuk berinvestasi lewat promosi pasang iklan di berbagai media,"" tutur direktur marketing doremindo agency (do'a), suardi dalam keterangan resminya. baca: sido muncul dukung omnibus law lewat iklan: kalau lapangan kerja banyak, gaji karyawan naik pada saat kompetitor tengah berjibaku dengan permasalahan yang ada, ini menjadi peluang untuk menanamkan persepsi brand kepada para konsumen. berita rekomendasi apabila pandemi ini berakhir, akan dibutuhkan waktu untuk bisa kembali seperti sedia kala. namun, jika telah melakukan investasi untuk promosi/ pemasangan iklan, maka penguasaan market yang ditargetkan akan lebih dekat di genggaman. ilustrasi banyak saluran yang bisa dipergunakan berinvestasi iklan, misal pasang iklan melalui media konvensional di antaranya koran atau majalah, maupun media digital, hingga media online. pilihan terbaiknya, kata suardi, adalah menggunakan kombinasi kedua jenis media tersebut. ""pada kondisi sekarang, beberapa media menyediakan diskon spesial dan paket-paket harga pemasangan iklan hemat untuk membantu promosi perusahaan,"" ungkap suardi, doremindo agency. ""biasanya pada masa normal tidak ada krisis/ pandemi, harga iklan di media cenderung lebih tinggi dan diskonnya lebih kecil, karena banyak brand yang mengantre atau rebutan memasang iklan di posisi terbaik. investasi lewat promosi iklan di media yang tepat pada masa sekarang, ibarat membeli saham ketika harga lagi turun,"" paparnya. baca: tekan pengangguran, perusahaan farmasi edukasi masyarakat lewat iklan semenjak seluruh masyarakat dianjurkan berada di rumah untuk memutus rantai penyebaran covid-19 hingga diterapkannya adaptasi kebiasaan baru, terdapat perubahan pola hidup masyarakat. selain penerapan protokol kesehatan, aktivitas masyarakat kini lebih banyak ke ranah digital. alhasil, iklan digital akan terus tumbuh, namun tetap diperlukan pemasangan iklan secara konvensional guna menjangkau pengguna nondigital."
5 Jajanan Khas Indonesia yang Mudah Dibuat di Rumah, Cocok untuk Mulai Bisnis UMKM;"TRIBUNNEWS.COM - Simak rekomendasi jajanan khas Indonesia yang bisa kamu buat di rumah. Jajanan klasik khas Indonesia ini juga bisa jadi inspirasi bagi yang ingin memulai usaha bisnis UMKM. Indonesia terkenal dengan banyak kulinernya yang lezat, bahkan jenis-jenisnya pun bervariasi. Namun, saat ini untuk menemukan kembali kue-kue tradisonal ini tidak semudah dulu. Untuk itu, pelaku UMKM bisa kembali menjajakan jajanan khas Indonesia ini dengan berbagai inovasi baru. Saat ini, pelaku UMKM tengah didukung oleh pemerintah dalam menjalankan usaha mandiri melalui gerakan Bangga Buatan Indonesia. Pelaku UMKM juga bisa memasarkan produknya di Bangga Buatan Indonesia Tokopedia.  .recads_wrapper{height:134px;position:relative;margin:10px 0 30px;padding:10px 15px;overflow:hidden;box-shadow:0 0 10px rgb(0 0 0 / 20%);}.recads_title{margin-bottom:10px;font-size:16px;font-weight:700}.arjW-list{overflow-x:scroll;overflow-y:hidden;white-space:nowrap;width:auto;padding:10px 0;position:relative;display:flex;scroll-snap-type:x;flex-wrap:nowrap}.recads_item{scroll-snap-align:start;width:280px;flex:0 0 280px;margin-right:20px;display: flex;white-space: normal;gap: 10px;}.recads_item a {display:flex;white-space:normal;gap:10px;}.recads_image{position:relative;height:auto}.recads_image img{width:auto;height: 73px!important;max-width:165px!important;border-radius:8px}.article_datas_title{font-size:14px;font-weight:700;line-height:1.2;margin:0;overflow:hidden;display:-webkit-box;-webkit-line-clamp:4;-webkit-box-orient:vertical;}.arjW-img-overlay{position:absolute;z-index:3;bottom:8px;left:0;padding:0 0 0 10px}.arjW-img-overlay>img{width:auto;height: 16px!important;}.recads_image::after{z-index:2;position:absolute;top:50%;bottom:4px;left:0;right:0;content:'';background:linear-gradient(to top,#d6d6d6,transparent);width:100%;border-radius: 8px;}             BERITA REKOMENDASI           Bisa jadi inspirasi produk UMKM-mu, simak jenis-jenis jajanan khas Indonesia berikut ini. 1. Kue Mangkok  Kue mangkok (Instagram)  Kue mangkok adalah salah satu kue tradisional Indonesia yang bertekstur agak basah dan sedikit kenyal. Kue ini dimasak dengan cara dikukus. Bahan utama kue mangkok adalah tepung beras, tepung terigu, dan juga tapai. Karena menggunakan tapai, kue mangkok memiliki rasa manis dan sedikit asam. Kue mangkok ini biasanya diberikan pewarna makanan yang cerah, seperti merah muda, hijau, atau kuning.  2. Gethuk  Ini namanya Lenjongan, terdiri dari beberapa macam jajanan, yakni tiwul, ketan ireng, ketan putih, gethuk, sawut, cenil, dan klepon. (TRIBUNSOLO.COM/ BAYU ARDI ISNANTO) (TRIBUNSOLO.COM/ BAYU ARDI ISNANTO)  Getuk adalah kue yang terbuat dari singkong.  Cara untuk membuat getuk sebenarnya cukup sederhana, yakni singkong direbus hingga matang. Setelah itu, singkong pun ditumbuk, diberi pewarna, dan kemudian diberikan taburan kelapa. Getuk yang dikenal ada dua macam, yakni getuk biasa (getuk yang tumbukannya kasar dan berwarna cokelat, karena diberikan gula jawa saat akan ditumbuh). Getuk lindri (getuk yang digiling halus dan diberikan pewarna makanan serta vanili. Getuk ini berbentuk seperti mie). 3. Kue Pancong  Kue pancong singkong (Sajian Sedap)  Bagi kamu yang tinggal di sekitaran Jakarta, sudah tidak asing lagi dengan kue yang satu ini. Ini adalah kue yang terbuat dari tepung beras, parutan kelapa, dan juga santan. Biasanya, kue ini diberikan taburan gula pasir diatasnya.  Beberapa daerah di Indonesia memiliki nama tersendiri untuk kue ini. Di daerah Jawa, kue ini dikenal dengan sebutan gandos. Di Bandung, kue ini disebut bandros. Di Bojonegoro, kue ini disebut tratak jaran. Dan di Bali, kue ini disebut dengan daluman. 4. Klepon  Resep Jajanan Tradisional Klepon, Berikut Tips Membuat Klepon agar Tidak Pecah saat Direbus (sajiansedap.grid.id)  Klepon adalah kue tradisonal yang terbuat dari tepung beras ketan.  Kue yang dimasak dengan cara direbus ini biasanya berbentuk bulat dan berwarna hijau. Biasanya kue ini diisi dengan gula merah dan dibalut dengan parutan kelapa. Kue yang biasa dijadikan camilan ini banyak dijual di pasar-pasar tradisional. Para penjual biasa membungkus kue klepon dengan daun pisang. 5. Bika Ambon  Bika Ambon Zulaikha (travelicious.co.id)  Namanya memang bika ambon, tapi kue ini merupakan makanan khas dari Medan, bukan Ambon. Bahan utama untuk membuat kue bertekstur basah, lembut, dan kenyal ini adalah telur, gula, dan juga santan. Jadi, jangan heran kalau kue ini memiliki rasa manis dan gurih. Kue ini memiliki rongga yang cukup banyak di bagian dalamnya.  Konon, rongga-rongga dalam kue bika ambon itu disebabkan oleh penggunaan Nira/Tuak Enau sebagai bahan pengembangnya. Berikut 5 jenis jajanan khas Indonesia yang bisa kamu coba sendiri di rumah atau sebagai inspirasi produk UMKM. Dukung gerakan pemerintah terkait pemberdayaan UMKM dengan Belanja Online Produk Lokal. Kamu juga bisa berbelanja sambil mendapatkan penawaran menarik Promo Bangga Buatan Indonesia di Tokopedia. (Tribunnews.com/Ayumiftakhul)";23-08-2020;https://m.tribunnews.com/bisnis/2020/08/23/5-jajanan-khas-indonesia-yang-mudah-dibuat-di-rumah-cocok-untuk-mulai-bisnis-umkm?page=all;tribunnews.com - simak rekomendasi jajanan khas indonesia yang bisa kamu buat di rumah. jajanan klasik khas indonesia ini juga bisa jadi inspirasi bagi yang ingin memulai usaha bisnis umkm. indonesia terkenal dengan banyak kulinernya yang lezat, bahkan jenis-jenisnya pun bervariasi. namun, saat ini untuk menemukan kembali kue-kue tradisonal ini tidak semudah dulu. untuk itu, pelaku umkm bisa kembali menjajakan jajanan khas indonesia ini dengan berbagai inovasi baru. saat ini, pelaku umkm tengah didukung oleh pemerintah dalam menjalankan usaha mandiri melalui gerakan bangga buatan indonesia. pelaku umkm juga bisa memasarkan produknya di bangga buatan indonesia tokopedia. berita rekomendasi bisa jadi inspirasi produk umkm-mu, simak jenis-jenis jajanan khas indonesia berikut ini. 1. kue mangkok kue mangkok (instagram) kue mangkok adalah salah satu kue tradisional indonesia yang bertekstur agak basah dan sedikit kenyal. kue ini dimasak dengan cara dikukus. bahan utama kue mangkok adalah tepung beras, tepung terigu, dan juga tapai. karena menggunakan tapai, kue mangkok memiliki rasa manis dan sedikit asam. kue mangkok ini biasanya diberikan pewarna makanan yang cerah, seperti merah muda, hijau, atau kuning. 2. gethuk ini namanya lenjongan, terdiri dari beberapa macam jajanan, yakni tiwul, ketan ireng, ketan putih, gethuk, sawut, cenil, dan klepon. (tribunsolo.com/ bayu ardi isnanto) (tribunsolo.com/ bayu ardi isnanto) getuk adalah kue yang terbuat dari singkong. cara untuk membuat getuk sebenarnya cukup sederhana, yakni singkong direbus hingga matang. setelah itu, singkong pun ditumbuk, diberi pewarna, dan kemudian diberikan taburan kelapa. getuk yang dikenal ada dua macam, yakni getuk biasa (getuk yang tumbukannya kasar dan berwarna cokelat, karena diberikan gula jawa saat akan ditumbuh). getuk lindri (getuk yang digiling halus dan diberikan pewarna makanan serta vanili. getuk ini berbentuk seperti mie). 3. kue pancong kue pancong singkong (sajian sedap) bagi kamu yang tinggal di sekitaran jakarta, sudah tidak asing lagi dengan kue yang satu ini. ini adalah kue yang terbuat dari tepung beras, parutan kelapa, dan juga santan. biasanya, kue ini diberikan taburan gula pasir diatasnya. beberapa daerah di indonesia memiliki nama tersendiri untuk kue ini. di daerah jawa, kue ini dikenal dengan sebutan gandos. di bandung, kue ini disebut bandros. di bojonegoro, kue ini disebut tratak jaran. dan di bali, kue ini disebut dengan daluman. 4. klepon resep jajanan tradisional klepon, berikut tips membuat klepon agar tidak pecah saat direbus (sajiansedap.grid.id) klepon adalah kue tradisonal yang terbuat dari tepung beras ketan. kue yang dimasak dengan cara direbus ini biasanya berbentuk bulat dan berwarna hijau. biasanya kue ini diisi dengan gula merah dan dibalut dengan parutan kelapa. kue yang biasa dijadikan camilan ini banyak dijual di pasar-pasar tradisional. para penjual biasa membungkus kue klepon dengan daun pisang. 5. bika ambon bika ambon zulaikha (travelicious.co.id) namanya memang bika ambon, tapi kue ini merupakan makanan khas dari medan, bukan ambon. bahan utama untuk membuat kue bertekstur basah, lembut, dan kenyal ini adalah telur, gula, dan juga santan. jadi, jangan heran kalau kue ini memiliki rasa manis dan gurih. kue ini memiliki rongga yang cukup banyak di bagian dalamnya. konon, rongga-rongga dalam kue bika ambon itu disebabkan oleh penggunaan nira/tuak enau sebagai bahan pengembangnya. berikut 5 jenis jajanan khas indonesia yang bisa kamu coba sendiri di rumah atau sebagai inspirasi produk umkm. dukung gerakan pemerintah terkait pemberdayaan umkm dengan belanja online produk lokal. kamu juga bisa berbelanja sambil mendapatkan penawaran menarik promo bangga buatan indonesia di tokopedia. (tribunnews.com/ayumiftakhul)
ICW Temukan Anggaran Influencer Rp 90 Miliar, Ini Tanggapan Menkominfo;"JAKARTA, KOMPAS.com - Menteri Komunikasi dan Informatika Johnny G Plate mengaku tak mengetahui temuan Indonesian Corruption Watch (ICW) soal belanja pemerintah untuk membayar influencer sejak 2017.  Menurut dia, Kemenkominfo memiliki program coaching clinic yang merupakan bagian dari Gerakan Nasional Siberkreasi pada 2018 lalu. Program itu memang melibatkan influencer.  ""Namun program coaching clinic school of influencer oleh Kominfo tersebut bukan untuk membiayai influencer, tetapi pelatihan bagi yang berminat berprofesi sebagai influencer,"" kata Johnny saat dihubungi, Jumat (21/8/2020).  Dia mengatakan, program tersebut dibuat agar peserta mempunyai kemampuan sebagai influencer yang baik. Dalam program itulah pemerintah membayar influencer untuk memberikan pelatihan.  ""Literasi digital membutuhkan banyak influencer yang mengerti tentang transformasi digital dan kegiatan literasi digital tersebut berlangsung terus sampai sekarang bahkan lebih agresif,"" kata dia.  Menurut dia, program ini untuk membantu pemahaman yang lebih baik terkait digital, khususnya digital ekonomi bagi masyarakat pedesaan seperti petani, peternak, dan nelayan.   ""Kominfo melibatkan banyak lembaga swadaya maupun organisasi kemasyarakatan untuk mendukung kegiatan literasi digital,"" ujar dia.   Johnny tak merinci besaran anggaran untuk program tersebut. Meski begitu, dia menegaskan, anggaran yang dialokasikan untuk program tersebut tak sebesar yang disebut ICW yakni Rp 10,83 miliar untuk kementeriannya.  ICW mencatat, pemerintah pusat menggelontorkan dana mencapai Rp 90,45 miliar untuk Influencer. Data tersebut merupakan belanja pemerintah dari tahun 2017-2020 yang dihimpun ICW dari Layanan Pengadaan Secara Elektronik (LPSE). Peneliti Indonesia Corruption Watch (ICW) Egi Primayogha mengatakan, ICW menggunakan kata kunci influencer dan key opinion leader dalam melakukan pencarian anggaran di LPSE. Hasilnya, terdapat jumlah paket pengadaan mencapai 40 dengan kata kunci tersebut sejak 2017.  Pada 2017, ada 5 paket pengadaan dengan nilai Rp 17,68 miliar. Lalu, jumlahnya meningkat pesat menjadi Rp 56,55 miliar untuk 15 paket pengadaan pada 2018.   Pada tahun selanjutnya, jumlahnya menurun ke angka Rp 6,67 miliar untuk 13 paket pengadaan. ";21-08-2020;https://nasional.kompas.com/read/2020/08/21/15375341/icw-temukan-anggaran-influencer-rp-90-miliar-ini-tanggapan-menkominfo?page=all;"jakarta,menteri komunikasi dan informatika johnny g plate mengaku tak mengetahui temuan indonesian corruption watch (icw) soal belanja pemerintah untuk membayar influencer sejak 2017. menurut dia, kemenkominfo memiliki program coaching clinic yang merupakan bagian dari gerakan nasional siberkreasi pada 2018 lalu. program itu memang melibatkan influencer. ""namun program coaching clinic school of influencer oleh kominfo tersebut bukan untuk membiayai influencer, tetapi pelatihan bagi yang berminat berprofesi sebagai influencer,"" kata johnny saat dihubungi, jumat (21/8/2020). dia mengatakan, program tersebut dibuat agar peserta mempunyai kemampuan sebagai influencer yang baik. dalam program itulah pemerintah membayar influencer untuk memberikan pelatihan. ""literasi digital membutuhkan banyak influencer yang mengerti tentang transformasi digital dan kegiatan literasi digital tersebut berlangsung terus sampai sekarang bahkan lebih agresif,"" kata dia. menurut dia, program ini untuk membantu pemahaman yang lebih baik terkait digital, khususnya digital ekonomi bagi masyarakat pedesaan seperti petani, peternak, dan nelayan. ""kominfo melibatkan banyak lembaga swadaya maupun organisasi kemasyarakatan untuk mendukung kegiatan literasi digital,"" ujar dia. johnny tak merinci besaran anggaran untuk program tersebut. meski begitu, dia menegaskan, anggaran yang dialokasikan untuk program tersebut tak sebesar yang disebut icw yakni rp 10,83 miliar untuk kementeriannya. icw mencatat, pemerintah pusat menggelontorkan dana mencapai rp 90,45 miliar untuk influencer. data tersebut merupakan belanja pemerintah dari tahun 2017-2020 yang dihimpun icw dari layanan pengadaan secara elektronik (lpse). peneliti indonesia corruption watch (icw) egi primayogha mengatakan, icw menggunakan kata kunci influencer dan key opinion leader dalam melakukan pencarian anggaran di lpse. hasilnya, terdapat jumlah paket pengadaan mencapai 40 dengan kata kunci tersebut sejak 2017. pada 2017, ada 5 paket pengadaan dengan nilai rp 17,68 miliar. lalu, jumlahnya meningkat pesat menjadi rp 56,55 miliar untuk 15 paket pengadaan pada 2018. pada tahun selanjutnya, jumlahnya menurun ke angka rp 6,67 miliar untuk 13 paket pengadaan. "
