Title;Content;Date;URL;Cleaned Article
Besaran Zakat Fitrah Uang Tunai di Jakarta dan Jawa Barat Lengkap;"JAKARTA, KOMPAS.com - Lebaran Idul Fitri 1441 tinggal menghitung hari. Di penghujung bulan Ramadhan ini, umat Muslim diingatkan untuk membayar zakat fitrah yang hukumnya wajib dan dibayar setahun sekali. Zakat ini dibayarkan dalam bentuk makanan pokok yang harus dilakukan sebelum batas akhir atau sebelum waktu shalat Idul Fitri. Besaran zakat fitrah 2020 yakni 2,5 kilogram beras atau makanan pokok lain. Direktur Utama Badan Amil Zakat Nasional (Baznas), Mohamad Arifin Purwakananta, mengatakan untuk DKI Jakarta perhitungan zakat fitrah 2020 yang dibayarkan dengan uang tunai yakni sebesar Rp 40.000 sampai Rp 50.000. Besaran zakat fitrah ini berpedoman pada harga bahan pokok berupa beras untuk berat 2,5 kilogram atau setara dengan 3,5 liter. ""Standar yang dipakai dalam zakat fitrah 2,5 kilogram beras dengan harga beras setempat. Artinya untuk Jakarta dan sekitarnya, kalau bayar zakat fitrah dengan uang tunai yakni sebesar range Rp 40.000 - 50.000 per orang,"" jelas Arifin kepada Kompas.com, Rabu (20/5/2020). Menurut dia, jumlah beras yang dibayarkan untuk zakat fitrah yakni berlaku sama di daerah manapun di Indonesia. Namun untuk pembayaran dengan uang tunai, besarannya berbeda-beda sesuai dengan harga beras atau makanan pokok lainnya di wilayah tersebut. Standar pembayaran zakat fitrah ini dijelaskan dalam SK Ketua Baznas Nomor 27 Tahun 2020 tentang Nilai Zakat Fitrah dan Fidyah (bayar zakat fitrah 2020 atau zakat fitrah 2020 berapa). Di Jakarta, dengan standar zakat fitrah uang tunai Rp 40.000, jika dalam sebuah keluarga terdapat 3 orang, berarti zakat yang dikeluarkan sebesar Rp 120.000. Sementara itu, berdasarkan standar yang ditetapkan Baznas, berikut besaran zakat fitrah uang tunai di Jawa Barat per kota dan kabupaten selengkapnya: Lalu contoh daerah lain seperti Banten yakni Rp 30.000, DIY Rp 30.000. Begitupun untuk wilayah lainnya, disesuaikan mengikuti harga 2,5 kilogram beras atau makanan pokok lain di daerahnya masing-masing. Untuk penerima zakat, kriterianya yakni mereka yang tergolong miskin. Namun begitu, kriteria miskin untuk penerima zakat berbeda dengan defisini miskin versi pemerintah atau BPS.   ""Penentuan mustahiq ini berbeda dengan pengertian miskin versi pemerintah atau BPS. Untuk zakat ada pedoman tersendiri, selama dia bukan muzakki (pembayar zakat), artinya dia mustahiq,"" jelas Arifin. Di Indonesia, Baznas memiliki pertimbangan tersendiri. Penerima zakat idealnya adalah masyarakat yang berpenghasilan di bawah Rp 6 juta. ""Yang dibantu adalah mereka yang di bawah nisab yaitu berpenghasilan sebesar di bawah Rp 6 juta (per bulan) menurut nisab emas. Tapi Baznas akan memabantu yang paling miskin dari kelompok ini"" kata Arifin. Dengan begitu, menurut Arifin, penerima zakat yang diprioritaskan adalah mereka yang paling tidak mampu di tengah masyarakat. Dalam pengertian lain penerima zakat, miskin adalah orang yang tidak punya harta yang cukup untuk memenuhi kebutuhan dasar hidupnya, namun masih ada sedikit kemampuan untuk mendapatkannya. Orang miskin dalam kategori penerima zakat yakni mereka yang punya sesuatu yang bisa menghasilkan kebutuhan dasarnya, namun dalam jumlah yang teramat kecil dan jauh dari cukup untuk sekedar menyambung hidup dan bertahan. Kemudian, menurut Arifin, penerima zakat ada 8 golongan. Selain fakir dan miskin ada 5 golongan lain yakni amil, ghorimin, ibnu sabil, mualaf, dan fisabilillah. ";20-05-2020;https://money.kompas.com/read/2020/05/20/180412726/besaran-zakat-fitrah-uang-tunai-di-jakarta-dan-jawa-barat-lengkap?page=all&jxrecoid=754790a1-e070-4844-bc5b-d99fe9245a2b~lfa_kompas&source=widgetML&engine=V;"jakarta,lebaran idul fitri 1441 tinggal menghitung hari. di penghujung bulan ramadhan ini, umat muslim diingatkan untuk membayar zakat fitrah yang hukumnya wajib dan dibayar setahun sekali. zakat ini dibayarkan dalam bentuk makanan pokok yang harus dilakukan sebelum batas akhir atau sebelum waktu shalat idul fitri. besaran zakat fitrah 2020 yakni 2,5 kilogram beras atau makanan pokok lain. direktur utama badan amil zakat nasional (baznas), mohamad arifin purwakananta, mengatakan untuk dki jakarta perhitungan zakat fitrah 2020 yang dibayarkan dengan uang tunai yakni sebesar rp 40.000 sampai rp 50.000. besaran zakat fitrah ini berpedoman pada harga bahan pokok berupa beras untuk berat 2,5 kilogram atau setara dengan 3,5 liter. ""standar yang dipakai dalam zakat fitrah 2,5 kilogram beras dengan harga beras setempat. artinya untuk jakarta dan sekitarnya, kalau bayar zakat fitrah dengan uang tunai yakni sebesar range rp50.000 per orang,"" jelas arifin kepada kompas.com, rabu (20/5/2020). menurut dia, jumlah beras yang dibayarkan untuk zakat fitrah yakni berlaku sama di daerah manapun di indonesia. namun untuk pembayaran dengan uang tunai, besarannya berbeda-beda sesuai dengan harga beras atau makanan pokok lainnya di wilayah tersebut. standar pembayaran zakat fitrah ini dijelaskan dalam sk ketua baznas nomor 27 tahun 2020 tentang nilai zakat fitrah dan fidyah (bayar zakat fitrah 2020 atau zakat fitrah 2020 berapa). di jakarta, dengan standar zakat fitrah uang tunai rp 40.000, jika dalam sebuah keluarga terdapat 3 orang, berarti zakat yang dikeluarkan sebesar rp 120.000. sementara itu, berdasarkan standar yang ditetapkan baznas, berikut besaran zakat fitrah uang tunai di jawa barat per kota dan kabupaten selengkapnya: lalu contoh daerah lain seperti banten yakni rp 30.000, diy rp 30.000. begitupun untuk wilayah lainnya, disesuaikan mengikuti harga 2,5 kilogram beras atau makanan pokok lain di daerahnya masing-masing. untuk penerima zakat, kriterianya yakni mereka yang tergolong miskin. namun begitu, kriteria miskin untuk penerima zakat berbeda dengan defisini miskin versi pemerintah atau bps. ""penentuan mustahiq ini berbeda dengan pengertian miskin versi pemerintah atau bps. untuk zakat ada pedoman tersendiri, selama dia bukan muzakki (pembayar zakat), artinya dia mustahiq,"" jelas arifin. di indonesia, baznas memiliki pertimbangan tersendiri. penerima zakat idealnya adalah masyarakat yang berpenghasilan di bawah rp 6 juta. ""yang dibantu adalah mereka yang di bawah nisab yaitu berpenghasilan sebesar di bawah rp 6 juta (per bulan) menurut nisab emas. tapi baznas akan memabantu yang paling miskin dari kelompok ini"" kata arifin. dengan begitu, menurut arifin, penerima zakat yang diprioritaskan adalah mereka yang paling tidak mampu di tengah masyarakat. dalam pengertian lain penerima zakat, miskin adalah orang yang tidak punya harta yang cukup untuk memenuhi kebutuhan dasar hidupnya, namun masih ada sedikit kemampuan untuk mendapatkannya. orang miskin dalam kategori penerima zakat yakni mereka yang punya sesuatu yang bisa menghasilkan kebutuhan dasarnya, namun dalam jumlah yang teramat kecil dan jauh dari cukup untuk sekedar menyambung hidup dan bertahan. kemudian, menurut arifin, penerima zakat ada 8 golongan. selain fakir dan miskin ada 5 golongan lain yakni amil, ghorimin, ibnu sabil, mualaf, dan fisabilillah. "
Duit Insentif Kartu Prakerja Belum Cair ke Rekening? Ini Penyebabnya;"JAKARTA, KOMPAS.com - Para peserta program Kartu Prakerja mengeluhkan uang insentif yang belum sampai ke rekening. Padahal, mereka mengaku sudah menyelesaikan pelatihan online Kartu Prakerja. Direktur Eksekutif Manajemen Pelaksana Prakerja Denni Puspa Purbasari, mengungkapkan keterlambatan pencairan duit insentif Kartu Prakerja karena pihaknya masih membutuhkan waktu tambahan untuk melakukan verifikasi. ""Saya perlu sampaikan ke teman-teman, kita minta maaf apabila terjadi keterlambatan dalam transfer insentif ke rekening bank maupun e-wallet,"" ucap Denni dalam keterangannya seperti dikutip Senin (18/5/2020). ""Kita harus pastikan dulu bahwa semua transaksi teman-teman yang dilakukan di digital platform, kemudian belanja apa saja, dan sebagainya, itu kami masih verifikasi datanya,"" kata dia lagi. Menurut Denni, PMO masih melakukan pengumpulan dan verifikasi data apakah peserta sudah menyelesaikan pelatihan Kartu Prakerja dan mendapatkan sertifikatnya. ""Kedua apakah teman-teman sudah berikan ulasan dan rating, kalau itu semua belum masuk ke PMO, maka PMO tidak bisa kemudian transfer uang insentif ke rekening. Semua dilakukan dengan sistem,"" jelas Denni. Selain itu, sambung dia, program Kartu Pekerja masih berusia seumur jagung. Sehingga pihaknya juga masih perlu melakukan beberapa perbaikan pada pelaksanaannya, terutama dalam hal kesiapan IT. ""Awal-awal kita masih semi manual, padahal ini kan banyak sekali yang melakukan transaksi. Kami sudah kejar, per hari ini sudah lebih dari 250.000 penerima manfaat di gelombang sebelumnya yang sudah terima insentif sebesar Rp 600.000 ke rekening masing-masing. Semoga ke depan akan lebih lancar,"" tutur Denni. Pihaknya memastikan program Kartu Prakerja memastikan pendaftaran Kartu Prakerja gelombang 4 dibuka setelah Lebaran Idul Fitri, tepatnya mulai 26 Mei 2020. ""Jadi gelombang 4 akan dibuka pada 26 (Mei), begitu setelah Lebaran langsung dibuka. Setelah Lebaran, masih kenyang makan ketupat, mainkan handphone-nya untuk daftar Kartu Prakerja,"" kata Denni. Soal keterlambatan pembukaan pendaftaran Kartu Prakerja yang mundur dari target awal, hal itu dilakukan karena pihaknya masih melakukan perbaikan dan penyelesaian beberapa masalah teknis di 3 gelombang sebelumnya. ";18-05-2020;https://money.kompas.com/read/2020/05/18/181131626/duit-insentif-kartu-prakerja-belum-cair-ke-rekening-ini-penyebabnya?page=all;"jakarta,para peserta program kartu prakerja mengeluhkan uang insentif yang belum sampai ke rekening. padahal, mereka mengaku sudah menyelesaikan pelatihan online kartu prakerja. direktur eksekutif manajemen pelaksana prakerja denni puspa purbasari, mengungkapkan keterlambatan pencairan duit insentif kartu prakerja karena pihaknya masih membutuhkan waktu tambahan untuk melakukan verifikasi. ""saya perlu sampaikan ke teman-teman, kita minta maaf apabila terjadi keterlambatan dalam transfer insentif ke rekening bank maupun e-wallet,"" ucap denni dalam keterangannya seperti dikutip senin (18/5/2020). ""kita harus pastikan dulu bahwa semua transaksi teman-teman yang dilakukan di digital platform, kemudian belanja apa saja, dan sebagainya, itu kami masih verifikasi datanya,"" kata dia lagi. menurut denni, pmo masih melakukan pengumpulan dan verifikasi data apakah peserta sudah menyelesaikan pelatihan kartu prakerja dan mendapatkan sertifikatnya. ""kedua apakah teman-teman sudah berikan ulasan dan rating, kalau itu semua belum masuk ke pmo, maka pmo tidak bisa kemudian transfer uang insentif ke rekening. semua dilakukan dengan sistem,"" jelas denni. selain itu, sambung dia, program kartu pekerja masih berusia seumur jagung. sehingga pihaknya juga masih perlu melakukan beberapa perbaikan pada pelaksanaannya, terutama dalam hal kesiapan it. ""awal-awal kita masih semi manual, padahal ini kan banyak sekali yang melakukan transaksi. kami sudah kejar, per hari ini sudah lebih dari 250.000 penerima manfaat di gelombang sebelumnya yang sudah terima insentif sebesar rp 600.000 ke rekening masing-masing. semoga ke depan akan lebih lancar,"" tutur denni. pihaknya memastikan program kartu prakerja memastikan pendaftaran kartu prakerja gelombang 4 dibuka setelah lebaran idul fitri, tepatnya mulai 26 mei 2020. ""jadi gelombang 4 akan dibuka pada 26 (mei), begitu setelah lebaran langsung dibuka. setelah lebaran, masih kenyang makan ketupat, mainkan handphone-nya untuk daftar kartu prakerja,"" kata denni. soal keterlambatan pembukaan pendaftaran kartu prakerja yang mundur dari target awal, hal itu dilakukan karena pihaknya masih melakukan perbaikan dan penyelesaian beberapa masalah teknis di 3 gelombang sebelumnya. "
10 Pegawai Pertama Facebook, Bagaimana Karier Mereka Saat Ini?;NEW YORK, KOMPAS.com - Saat ini, siapa yang tidak kenal dengan media sosial Facebook? Besar kemungkinan Anda punya akun jejaring sosial itu. Facebook diluncurkan pada Februari 2004 silam. Dalam 16 tahun perjalanannya, Facebook berkembang pesat dari perusahaan rintisan (startup) menjadi raksasa global seperti saat ini. Namun, pernahkah Anda mengetahui sosok-sosok di balik lahirnya Facebook? Barangkali yang paling dikenal luas adalah Mark Zuckerberg, satu dari beberapa pendirinya. Faktanya, dari 20 pegawai pertama Facebook, hanya dua orang yang masih bertahan bekerja di sana hingga kini. Pastinya Anda tahu siapa salah satunya. Dikutip dari Business Insider, Sabtu (16/5/2020), berikut ini 10 pegawai pertama Facebook dan karier mereka sekarang. reuters.com CEO Facebook, Mark Zuckerberg Zuckerberg merupakan pendiri Facebook dan saat ini menjabat sebagai CEO. Dengan demikian, ia bekerja di Facebook sejak Februari 2004 hingga sekarang. Faktanya, desain warna biru yang menjadi ciri khas Facebook diciptakan bukan tanpa alasan. Salah satunya adalah lantaran Zuckerberg menderita buta warna merah-hijau. Facebook pun membuat Zuckerberg menyandang gelar miliarder. Forbes mengestimasi kekayaan Zuckerberg mencapai 69,5 miliar dollar AS atau setara sekira Rp 1.036 triliun (kurs Rp 14.907 per dollar AS). telegraph.co.uk Dustin Moskovitz Moskovitz, rekan sekamar Zuckerberg di asrama Harvard University, merupakan direktur teknologi pertama Facebook. Keduanya sama-sama keluar dari Harvard untuk pindah ke California. Di negara bagian itu, mereka membangun Facebook. Moskovitz bekerja di Facebook pada Fabruari 2004 hingga November 2009. Saat ini, Moskovitz merupakan pendiri dan CEO di perusahaan software Asana. Ia juga mendirikan perusahaan filantropi Good Ventures. Menurut Forbes, kekayaan Moskovitz mencapai 11,6 miliar dollar AS atau setara sekira Rp 172,9 triliun. Hughes merupakan salah satu pendiri Facebook dan bertindak sebagai juru bicara pertama. Ia bekerja di Facebook sejak Februari 2004 hingga tahun 2007. Hughes kemudian menjadi koordinator untuk seluruh media sosial dalam kampanye calon presiden AS Barack Obama pada 2008. Setelah itu, ia menjadi direktur eksekutif startup Jumo. Hughes memperoleh 500 juta dollar AS ketika Facebook melantai di bursa saham. Baru-baru ini, ia menulis buku berjudul The Fair Shot: Rethinking Inequality and How We Earn. Ia diketahui memiliki 2 persen saham Facebook. Saat ini Hughes merupakan salah satu pimpinan Economic Security Project, sebuah kelompok yang mendorong upah dasar universal menjadi kenyataan di AS. The Straits Times Co-founder Facebook Eduardo Saverin dan Elaine Andriejanssen Saverin juga merupakan salah satu pendiri Facebook dan direktur keuangannya yang pertama. Ia bekerja di sana sejak Februari 2004 hingga 2005. Saverin dikenal karena sempat menuntut Zuckerberg, namun keduanya mencapai kesepakatan. Setelah memenangkan tuntutan hukum dengan Facebook yang memungkinkannya mempertahankan status pendiri, Saverin mulai menjadi angel investor. Pada tahun 2011, Saverin melepas kewarganegaraan AS dan pindah ke Singapura. Ia kemudian menjadi investor pada beberapa startup Asia Tenggara dan India, termasuk Kopi Kenangan. Forbes memperkirakan kekayaan Saverin mencapai 10,5 miliar dollar AS atau setara sekira Rp 156,5 triliun. McCollum mendesain logo pertama Facebook. Ia merupakan salah satu pendiri dan engineer Facebook. McCollum bekerja di Facebook sejak Februari 2004 hingga September 2006. Ia juga sempat bekerja di proyek sampingan bersama Zuckerberg, yakni Wirehog. Saat ini, ia merupakan CEO perusahaan layanan streaming Philo. Pasca kariernya di Facebook, McCollum menjadi investor dan terlibat dalam pendanaan berbagai startup teknologi. Halicioglu merupakan pegawai pertama Facebook di luar para pendirinya. Ia bekerja di Facebook sejak Oktober 2004 hingga November 2009. Di Facebook, Halicioglu membangun seluruh infrastruktur awal perangkat keras. Jabatannya adalah senior software/operations engineer. Saat ini, Halicioglu merupakan pengajar di departemen ilmu dan teknik komputer di University of California San Diego. Ia pun baru-baru ini mendonasikan 75 juta dollar AS ke kampus itu untuk mendirikan Halicioglu Data Science Institute. Pereira merupakan pegawai ketujuh Facebook. Ia bekerja di sana sejak Juli 2004 hingga Agustus 2007. Di Facebook, ia bekerja sebagai engineer. Saat ini, Pereira merupakan software engineer di Boy Gorilla Enterprises di Portland, negara bagian Oregon. Parker merupakan salah satu pendiri Napster dan presiden di Facebook. Ia bekerja di Facebook sejak Juni 2004 hingga Januari 2006. Lepas dari Facebook, Parker berinvestasi di banyak startup teknologi, termasuk Spotify dan Asana. Ia pun merupakan partner di perusahaan modal ventura Founder's Fund sampai tahun 2014. Forbes mengestimasikan kekayaan Parker mencapai 2,7 miliar dollar AS atau setara sekira Rp 40,2 triliun. Di kampus, Ezra Callahan merupakan rekan sekamar asrama Parker. Ia bekerja di Facebook sejak Desember 2004 hingga Juli 2010. Callahan merupakan manajer komunikasi internal dan manajer produk di Facebook. Lepas dari Facebook, Callahan mendirikan perusahaan hotel Arrive, sekaligus direktur investasi di sana. Gleit awalnya ditugaskan untuk memastikan semua orang di dunia memiliki akun Facebook. Ia bekerja di Facebook sejak April 2005 hingga sekarang. Saat ini, Gleit menjabat vice president of social good Facebook. Ia memimpin seluruh upaya Facebook terkait pengecekan keamanan, perangkat penggalangan dana, dan fitur-fitur sejenisnya. ;16-05-2020;https://money.kompas.com/read/2020/05/16/161600426/10-pegawai-pertama-facebook-bagaimana-karier-mereka-saat-ini-?page=all&jxrecoid=7057b51c-9dd9-497c-ac54-9f5d1995ecd3~lfa_kompas&source=widgetML&engine=V;new york,saat ini, siapa yang tidak kenal dengan media sosial facebook? besar kemungkinan anda punya akun jejaring sosial itu. facebook diluncurkan pada februari 2004 silam. dalam 16 tahun perjalanannya, facebook berkembang pesat dari perusahaan rintisan (startup) menjadi raksasa global seperti saat ini. namun, pernahkah anda mengetahui sosok-sosok di balik lahirnya facebook? barangkali yang paling dikenal luas adalah mark zuckerberg, satu dari beberapa pendirinya. faktanya, dari 20 pegawai pertama facebook, hanya dua orang yang masih bertahan bekerja di sana hingga kini. pastinya anda tahu siapa salah satunya. dikutip dari business insider, sabtu (16/5/2020), berikut ini 10 pegawai pertama facebook dan karier mereka sekarang. reuters.com ceo facebook, mark zuckerberg zuckerberg merupakan pendiri facebook dan saat ini menjabat sebagai ceo. dengan demikian, ia bekerja di facebook sejak februari 2004 hingga sekarang. faktanya, desain warna biru yang menjadi ciri khas facebook diciptakan bukan tanpa alasan. salah satunya adalah lantaran zuckerberg menderita buta warna merah-hijau. facebook pun membuat zuckerberg menyandang gelar miliarder. forbes mengestimasi kekayaan zuckerberg mencapai 69,5 miliar dollar as atau setara sekira rp 1.036 triliun (kurs rp 14.907 per dollar as). telegraph.co.uk dustin moskovitz moskovitz, rekan sekamar zuckerberg di asrama harvard university, merupakan direktur teknologi pertama facebook. keduanya sama-sama keluar dari harvard untuk pindah ke california. di negara bagian itu, mereka membangun facebook. moskovitz bekerja di facebook pada fabruari 2004 hingga november 2009. saat ini, moskovitz merupakan pendiri dan ceo di perusahaan software asana. ia juga mendirikan perusahaan filantropi good ventures. menurut forbes, kekayaan moskovitz mencapai 11,6 miliar dollar as atau setara sekira rp 172,9 triliun. hughes merupakan salah satu pendiri facebook dan bertindak sebagai juru bicara pertama. ia bekerja di facebook sejak februari 2004 hingga tahun 2007. hughes kemudian menjadi koordinator untuk seluruh media sosial dalam kampanye calon presiden as barack obama pada 2008. setelah itu, ia menjadi direktur eksekutif startup jumo. hughes memperoleh 500 juta dollar as ketika facebook melantai di bursa saham. baru-baru ini, ia menulis buku berjudul the fair shot: rethinking inequality and how we earn. ia diketahui memiliki 2 persen saham facebook. saat ini hughes merupakan salah satu pimpinan economic security project, sebuah kelompok yang mendorong upah dasar universal menjadi kenyataan di as. the straits times co-founder facebook eduardo saverin dan elaine andriejanssen saverin juga merupakan salah satu pendiri facebook dan direktur keuangannya yang pertama. ia bekerja di sana sejak februari 2004 hingga 2005. saverin dikenal karena sempat menuntut zuckerberg, namun keduanya mencapai kesepakatan. setelah memenangkan tuntutan hukum dengan facebook yang memungkinkannya mempertahankan status pendiri, saverin mulai menjadi angel investor. pada tahun 2011, saverin melepas kewarganegaraan as dan pindah ke singapura. ia kemudian menjadi investor pada beberapa startup asia tenggara dan india, termasuk kopi kenangan. forbes memperkirakan kekayaan saverin mencapai 10,5 miliar dollar as atau setara sekira rp 156,5 triliun. mccollum mendesain logo pertama facebook. ia merupakan salah satu pendiri dan engineer facebook. mccollum bekerja di facebook sejak februari 2004 hingga september 2006. ia juga sempat bekerja di proyek sampingan bersama zuckerberg, yakni wirehog. saat ini, ia merupakan ceo perusahaan layanan streaming philo. pasca kariernya di facebook, mccollum menjadi investor dan terlibat dalam pendanaan berbagai startup teknologi. halicioglu merupakan pegawai pertama facebook di luar para pendirinya. ia bekerja di facebook sejak oktober 2004 hingga november 2009. di facebook, halicioglu membangun seluruh infrastruktur awal perangkat keras. jabatannya adalah senior software/operations engineer. saat ini, halicioglu merupakan pengajar di departemen ilmu dan teknik komputer di university of california san diego. ia pun baru-baru ini mendonasikan 75 juta dollar as ke kampus itu untuk mendirikan halicioglu data science institute. pereira merupakan pegawai ketujuh facebook. ia bekerja di sana sejak juli 2004 hingga agustus 2007. di facebook, ia bekerja sebagai engineer. saat ini, pereira merupakan software engineer di boy gorilla enterprises di portland, negara bagian oregon. parker merupakan salah satu pendiri napster dan presiden di facebook. ia bekerja di facebook sejak juni 2004 hingga januari 2006. lepas dari facebook, parker berinvestasi di banyak startup teknologi, termasuk spotify dan asana. ia pun merupakan partner di perusahaan modal ventura founder's fund sampai tahun 2014. forbes mengestimasikan kekayaan parker mencapai 2,7 miliar dollar as atau setara sekira rp 40,2 triliun. di kampus, ezra callahan merupakan rekan sekamar asrama parker. ia bekerja di facebook sejak desember 2004 hingga juli 2010. callahan merupakan manajer komunikasi internal dan manajer produk di facebook. lepas dari facebook, callahan mendirikan perusahaan hotel arrive, sekaligus direktur investasi di sana. gleit awalnya ditugaskan untuk memastikan semua orang di dunia memiliki akun facebook. ia bekerja di facebook sejak april 2005 hingga sekarang. saat ini, gleit menjabat vice president of social good facebook. ia memimpin seluruh upaya facebook terkait pengecekan keamanan, perangkat penggalangan dana, dan fitur-fitur sejenisnya. 
