Title;Content;Date;URL;Cleaned Article
Update Kurs Dolar AS Hari Ini, 24 Desember 2023, Meningkat Jadi Rp 15.610;"TRIBUNNEWS.COM - Inilah update kurs terbaru dolar Amerika Serikat (USD) hari ini, 24 Desember 2023. Harga jual dolar AS hari ini kembali meningkat tipis jadi Rp15.610. Menurut informasi dari Bank Indonesia, kurs beli dolar hari ini juga meningkat tipis, jadi Rp 15.455. Untuk kurs dolar di BCA turut mengalami kenaikan tipis, jadi Rp 15.335-Rp15.635. Sementara kurs dolar AS di Bank Mandiri berada di level Rp15.250-Rp15.600. Sejumlah mata uang asing lainnya juga mengalami perubahan harga jual dan beli pada Minggu (24/12/2023).  Karyawan menunjukkan mata uang Rupiah dan Dolar AS di tempat penukaran uang di Jakarta, Kamis (14/10/2021). (TRIBUNNEWS/IRWAN RISMAWAN)  Kurs Jual Mata Uang Asing per 24 Desember 2023:  .recads_wrapper{height:134px;position:relative;margin:10px 0 30px;padding:10px 15px;overflow:hidden;box-shadow:0 0 10px rgb(0 0 0 / 20%);}.recads_title{margin-bottom:10px;font-size:16px;font-weight:700}.arjW-list{overflow-x:scroll;overflow-y:hidden;white-space:nowrap;width:auto;padding:10px 0;position:relative;display:flex;scroll-snap-type:x;flex-wrap:nowrap}.recads_item{scroll-snap-align:start;width:280px;flex:0 0 280px;margin-right:20px;display: flex;white-space: normal;gap: 10px;}.recads_item a {display:flex;white-space:normal;gap:10px;}.recads_image{position:relative;height:auto}.recads_image img{width:auto;height: 73px!important;max-width:165px!important;border-radius:8px}.article_datas_title{font-size:14px;font-weight:700;line-height:1.2;margin:0;overflow:hidden;display:-webkit-box;-webkit-line-clamp:4;-webkit-box-orient:vertical;}.arjW-img-overlay{position:absolute;z-index:3;bottom:8px;left:0;padding:0 0 0 10px}.arjW-img-overlay>img{width:auto;height: 16px!important;}.recads_image::after{z-index:2;position:absolute;top:50%;bottom:4px;left:0;right:0;content:'';background:linear-gradient(to top,#d6d6d6,transparent);width:100%;border-radius: 8px;}             BERITA REKOMENDASI           USD (US DOLLAR): Rp 15.610,67 AUD (AUSTRALIAN DOLLAR): Rp 10.535,64 BND (BRUNEI DOLLAR): Rp 11.741,76 CAD (CANADIAN DOLLAR): Rp 11.695,14 CHF (SWISS FRANC): Rp 18.109,83 CNH (CHINA YUAN): Rp 2.183,59 CNY (CHINA YUAN): Rp 2.184,99 DKK (DANISH KRONE): Rp 2.292,05 EUR (EURO): Rp 17.093,68 GBP (BRITISH POUND): Rp 19.739,69 HKD (HONGKONG DOLLAR): Rp 1.999,55 JPY (JAPANESE YEN): Rp 10.896,74 KRW (KOREAN WON): Rp 11,96 KWD (KUWAITI DINAR): Rp 50.766,41 LAK (LAOTIAN KIP): Rp 0,76 MYR (MALAYSIAN RINGGIT): Rp 3.356,41 NOK (NORWEGIAN KRONE): Rp 1.512,40 NZD (NEW ZEALAND DOLLAR): Rp 9.755,11 PGK (PAPUA N.G. KINA): Rp 4.321,03 PHP (PHILIPPINES PESO): Rp 280,87 SAR (SAUDI ARABIAN RIYAL): Rp 4.161,51 SEK (SWEDISH KRONA): Rp 1.536,50 SGD (SINGAPORE DOLLAR): Rp 11.741,76 THB (THAI BAHT): Rp 447,55 VND (VIETNAMESE DONG): Rp 0,64 Kurs Beli Mata Uang Asing per 20 Desember 2023: USD (US DOLLAR): Rp 15.455,33 AUD (AUSTRALIAN DOLLAR): Rp 10.429,26 BND (BRUNEI DOLLAR): Rp 11.617,93 CAD (CANADIAN DOLLAR): Rp 11.573,56 CHF (SWISS FRANC): Rp 17.919,22 CNH (CHINA YUAN): Rp 2.161,74 CNY (CHINA YUAN): Rp 2.163,07 DKK (DANISH KRONE): Rp 2.269,01 EUR (EURO): Rp 16.917,40 GBP (BRITISH POUND): Rp 19.537,08 HKD (HONGKONG DOLLAR): Rp 1.979,63 JPY (JAPANESE YEN): Rp 10.787,55 KRW (KOREAN WON): Rp 11,84 KWD (KUWAITI DINAR): Rp 50.244,90 LAK (LAOTIAN KIP): Rp 0,75 MYR (MALAYSIAN RINGGIT): Rp 3.319,44 NOK (NORWEGIAN KRONE): Rp 1.496,71 NZD (NEW ZEALAND DOLLAR): Rp 9.651,85 PGK (PAPUA N.G. KINA): Rp 4.015,29 PHP (PHILIPPINES PESO): Rp 277,92 SAR (SAUDI ARABIAN RIYAL): Rp 4.119,88 SEK (SWEDISH KRONA): Rp 1.520,91 SGD (SINGAPORE DOLLAR): Rp 11.617,93 THB (THAI BAHT): Rp 442,72 VND (VIETNAMESE DONG): Rp 0,64 (Tribunnews.com/Oktavia WW)";24-12-2023;https://www.tribunnews.com/bisnis/2023/12/24/update-kurs-dolar-as-hari-ini-24-desember-2023-meningkat-jadi-rp-15610;tribunnews.com - inilah update kurs terbaru dolar amerika serikat (usd) hari ini, 24 desember 2023. harga jual dolar as hari ini kembali meningkat tipis jadi rp15.610. menurut informasi dari bank indonesia, kurs beli dolar hari ini juga meningkat tipis, jadi rp 15.455. untuk kurs dolar di bca turut mengalami kenaikan tipis, jadi rp 15.335-rp15.635. sementara kurs dolar as di bank mandiri berada di level rp15.250-rp15.600. sejumlah mata uang asing lainnya juga mengalami perubahan harga jual dan beli pada minggu (24/12/2023). karyawan menunjukkan mata uang rupiah dan dolar as di tempat penukaran uang di jakarta, kamis (14/10/2021). (tribunnews/irwan rismawan) kurs jual mata uang asing per 24 desember 2023: berita rekomendasi usd (us dollar): rp 15.610,67 aud (australian dollar): rp 10.535,64 bnd (brunei dollar): rp 11.741,76 cad (canadian dollar): rp 11.695,14 chf (swiss franc): rp 18.109,83 cnh (china yuan): rp 2.183,59 cny (china yuan): rp 2.184,99 dkk (danish krone): rp 2.292,05 eur (euro): rp 17.093,68 gbp (british pound): rp 19.739,69 hkd (hongkong dollar): rp 1.999,55 jpy (japanese yen): rp 10.896,74 krw (korean won): rp 11,96 kwd (kuwaiti dinar): rp 50.766,41 lak (laotian kip): rp 0,76 myr (malaysian ringgit): rp 3.356,41 nok (norwegian krone): rp 1.512,40 nzd (new zealand dollar): rp 9.755,11 pgk (papua n.g. kina): rp 4.321,03 php (philippines peso): rp 280,87 sar (saudi arabian riyal): rp 4.161,51 sek (swedish krona): rp 1.536,50 sgd (singapore dollar): rp 11.741,76 thb (thai baht): rp 447,55 vnd (vietnamese dong): rp 0,64 kurs beli mata uang asing per 20 desember 2023: usd (us dollar): rp 15.455,33 aud (australian dollar): rp 10.429,26 bnd (brunei dollar): rp 11.617,93 cad (canadian dollar): rp 11.573,56 chf (swiss franc): rp 17.919,22 cnh (china yuan): rp 2.161,74 cny (china yuan): rp 2.163,07 dkk (danish krone): rp 2.269,01 eur (euro): rp 16.917,40 gbp (british pound): rp 19.537,08 hkd (hongkong dollar): rp 1.979,63 jpy (japanese yen): rp 10.787,55 krw (korean won): rp 11,84 kwd (kuwaiti dinar): rp 50.244,90 lak (laotian kip): rp 0,75 myr (malaysian ringgit): rp 3.319,44 nok (norwegian krone): rp 1.496,71 nzd (new zealand dollar): rp 9.651,85 pgk (papua n.g. kina): rp 4.015,29 php (philippines peso): rp 277,92 sar (saudi arabian riyal): rp 4.119,88 sek (swedish krona): rp 1.520,91 sgd (singapore dollar): rp 11.617,93 thb (thai baht): rp 442,72 vnd (vietnamese dong): rp 0,64 (tribunnews.com/oktavia ww)
Kurs Dolar AS Hari Ini, 29 Desember 2023: Turun Lagi, Jadi Rp15.493;"TRIBUNNEWS.COM - Berikut kurs terbaru dolar Amerika Serikat (USD) hari ini, Jumat 29 Desember 2023. Harga jual dolar AS pada hari ini kembali turun sebanyak Rp73 sehingga menjadi Rp15.493. Menurut informasi dari Bank Indonesia, menjelang akhir tahun, kurs beli dolar hari ini juga terpantau turun, yaitu Rp15.338. Kurs dolar AS di Bank Mandiri mengalami perubahan, yaitu di level Rp15.255-Rp15.575, sedangkan kurs dolar di BCA justru meningkat menjadi Rp15.295-Rp15.595. Sejumlah mata uang asing lainnya juga mengalami perubahan harga jual dan beli pada Jumat (29/12/2023). Kurs Jual Mata Uang Asing per 29 Desember 2023: 1 USD (US DOLLAR): Rp15.493,08  .recads_wrapper{height:134px;position:relative;margin:10px 0 30px;padding:10px 15px;overflow:hidden;box-shadow:0 0 10px rgb(0 0 0 / 20%);}.recads_title{margin-bottom:10px;font-size:16px;font-weight:700}.arjW-list{overflow-x:scroll;overflow-y:hidden;white-space:nowrap;width:auto;padding:10px 0;position:relative;display:flex;scroll-snap-type:x;flex-wrap:nowrap}.recads_item{scroll-snap-align:start;width:280px;flex:0 0 280px;margin-right:20px;display: flex;white-space: normal;gap: 10px;}.recads_item a {display:flex;white-space:normal;gap:10px;}.recads_image{position:relative;height:auto}.recads_image img{width:auto;height: 73px!important;max-width:165px!important;border-radius:8px}.article_datas_title{font-size:14px;font-weight:700;line-height:1.2;margin:0;overflow:hidden;display:-webkit-box;-webkit-line-clamp:4;-webkit-box-orient:vertical;}.arjW-img-overlay{position:absolute;z-index:3;bottom:8px;left:0;padding:0 0 0 10px}.arjW-img-overlay>img{width:auto;height: 16px!important;}.recads_image::after{z-index:2;position:absolute;top:50%;bottom:4px;left:0;right:0;content:'';background:linear-gradient(to top,#d6d6d6,transparent);width:100%;border-radius: 8px;}             BERITA REKOMENDASI           1 AUD (AUSTRALIAN DOLLAR): Rp10.622,06 1 BND (BRUNEI DOLLAR): Rp11.773,75 1 CAD (CANADIAN DOLLAR): Rp11.748,75 1 CHF (SWISS FRANC): Rp18.470,53 1 CNH (CHINA YUAN): Rp2.179,51 1 CNY (CHINA YUAN): Rp2.180,59 1 DKK (DANISH KRONE): Rp2.310,81 1 EUR (EURO): Rp17.228,30 1 GBP (BRITISH POUND): Rp19.862,13 1 HKD (HONGKONG DOLLAR): Rp1.982,61 100 JPY (JAPANESE YEN): Rp11.010,65 1 KRW (KOREAN WON): Rp12,03 1 KWD (KUWAITI DINAR): Rp50.479,21 1 LAK (LAOTIAN KIP): Rp0,76 1 MYR (MALAYSIAN RINGGIT): Rp3.360,75 1 NOK (NORWEGIAN KRONE): Rp1.538,31 1 NZD (NEW ZEALAND DOLLAR): Rp9.848,95 1 PGK (PAPUA N.G. KINA): Rp4.288,48 1 PHP (PHILIPPINES PESO): Rp279,20 1 SAR (SAUDI ARABIAN RIYAL): Rp4.131,49 1 SEK (SWEDISH KRONA): Rp1.561,80 1 SGD (SINGAPORE DOLLAR): Rp11.773,75 1 THB (THAI BAHT): Rp454,34 1 VND (VIETNAMESE DONG): Rp0,64 Kurs Beli Mata Uang Asing per 29 Desember 2023: 1 USD (US DOLLAR): Rp15.338,92 1 AUD (AUSTRALIAN DOLLAR): Rp10.508,69 1 BND (BRUNEI DOLLAR): Rp11.649,52 1 CAD (CANADIAN DOLLAR): Rp11.628,32 1 CHF (SWISS FRANC): Rp18.278,03 1 CNH (CHINA YUAN): Rp2.157,59 1 CNY (CHINA YUAN): Rp2.158,74 1 DKK (DANISH KRONE): Rp2.287,48 1 EUR (EURO): Rp17.050,74 1 GBP (BRITISH POUND): Rp19.658,36 1 HKD (HONGKONG DOLLAR): Rp1.962,80 100 JPY (JAPANESE YEN): Rp10.898,76 1 KRW (KOREAN WON): Rp11,91 1 KWD (KUWAITI DINAR): Rp49.960,65 1 LAK (LAOTIAN KIP): Rp0,74 1 MYR (MALAYSIAN RINGGIT): Rp3.323,71 1 NOK (NORWEGIAN KRONE): Rp1.522,26 1 NZD (NEW ZEALAND DOLLAR): Rp9.744,82 1 PGK (PAPUA N.G. KINA): Rp3.985,05 1 PHP (PHILIPPINES PESO): Rp276,33 1 SAR (SAUDI ARABIAN RIYAL): Rp4.089,72 1 SEK (SWEDISH KRONA): Rp1.546,04 1 SGD (SINGAPORE DOLLAR): Rp11.649,52 1 THB (THAI BAHT): Rp449,43 1 VND (VIETNAMESE DONG): Rp0,63 (Tribunnews.com/Oktavia WW)";29-12-2023;https://www.tribunnews.com/bisnis/2023/12/29/kurs-dolar-as-hari-ini-29-desember-2023-turun-lagi-jadi-rp15493;tribunnews.com - berikut kurs terbaru dolar amerika serikat (usd) hari ini, jumat 29 desember 2023. harga jual dolar as pada hari ini kembali turun sebanyak rp73 sehingga menjadi rp15.493. menurut informasi dari bank indonesia, menjelang akhir tahun, kurs beli dolar hari ini juga terpantau turun, yaitu rp15.338. kurs dolar as di bank mandiri mengalami perubahan, yaitu di level rp15.255-rp15.575, sedangkan kurs dolar di bca justru meningkat menjadi rp15.295-rp15.595. sejumlah mata uang asing lainnya juga mengalami perubahan harga jual dan beli pada jumat (29/12/2023). kurs jual mata uang asing per 29 desember 2023: 1 usd (us dollar): rp15.493,08 berita rekomendasi 1 aud (australian dollar): rp10.622,06 1 bnd (brunei dollar): rp11.773,75 1 cad (canadian dollar): rp11.748,75 1 chf (swiss franc): rp18.470,53 1 cnh (china yuan): rp2.179,51 1 cny (china yuan): rp2.180,59 1 dkk (danish krone): rp2.310,81 1 eur (euro): rp17.228,30 1 gbp (british pound): rp19.862,13 1 hkd (hongkong dollar): rp1.982,61 100 jpy (japanese yen): rp11.010,65 1 krw (korean won): rp12,03 1 kwd (kuwaiti dinar): rp50.479,21 1 lak (laotian kip): rp0,76 1 myr (malaysian ringgit): rp3.360,75 1 nok (norwegian krone): rp1.538,31 1 nzd (new zealand dollar): rp9.848,95 1 pgk (papua n.g. kina): rp4.288,48 1 php (philippines peso): rp279,20 1 sar (saudi arabian riyal): rp4.131,49 1 sek (swedish krona): rp1.561,80 1 sgd (singapore dollar): rp11.773,75 1 thb (thai baht): rp454,34 1 vnd (vietnamese dong): rp0,64 kurs beli mata uang asing per 29 desember 2023: 1 usd (us dollar): rp15.338,92 1 aud (australian dollar): rp10.508,69 1 bnd (brunei dollar): rp11.649,52 1 cad (canadian dollar): rp11.628,32 1 chf (swiss franc): rp18.278,03 1 cnh (china yuan): rp2.157,59 1 cny (china yuan): rp2.158,74 1 dkk (danish krone): rp2.287,48 1 eur (euro): rp17.050,74 1 gbp (british pound): rp19.658,36 1 hkd (hongkong dollar): rp1.962,80 100 jpy (japanese yen): rp10.898,76 1 krw (korean won): rp11,91 1 kwd (kuwaiti dinar): rp49.960,65 1 lak (laotian kip): rp0,74 1 myr (malaysian ringgit): rp3.323,71 1 nok (norwegian krone): rp1.522,26 1 nzd (new zealand dollar): rp9.744,82 1 pgk (papua n.g. kina): rp3.985,05 1 php (philippines peso): rp276,33 1 sar (saudi arabian riyal): rp4.089,72 1 sek (swedish krona): rp1.546,04 1 sgd (singapore dollar): rp11.649,52 1 thb (thai baht): rp449,43 1 vnd (vietnamese dong): rp0,63 (tribunnews.com/oktavia ww)
Inpex Cs Investasi Blok Masela, Nilainya Tembus Tiga Kali Lipat Proyek Kereta Cepat;"Laporan Wartawan Tribunnews.com, Dennis Destryawan TRIBUNNEWS.COM, JAKARTA - Inpex Masela, Ltd. (Inpex Masela), anak perusahaan Inpex Corporation menggelontorkan Rp 324 triliun untuk investasi proyek ladang gas bumi Blok Masela. Kepala SKK Migas, Dwi Soetjipto menyebutkan bahwa hari ini menjadi hari yang spesial, karena Kick Off Project Management Team Abadi Masela, yang menandai dimulainya Proyek Strategis Nasional yang sangat massif. ""Investasi proyek Abadi Masela sangat besar mencapai US$20.9 billion, dan jika dibandingkan akan setara Rp 324 triliun atau hampir tiga kali lipat nilai investasi kereta cepat Jakarta Bandung,"" ujar Dwi di Jakarta, Kamis (28/12/2023). Inpex Masela merupakan operator Proyek LNG Abadi. Hari ini mengadakan acara Kick-Off PMT Proyek LNG Abadi bersama SKK Migas, setelah pemerintah menyetujui revisi Plan of Development (POD) yang menyertakan komponen carbon capture storage (CCS) ke dalam revisi POD tersebut. Proyek ini adalah yang pertama di mana biaya terkait CCS telah memenuhi syarat untuk dimasukkan ke dalam cost recovery1, berdasarkan skema kontrak bagi hasil (PSC) yang mengatur operasi hulu minyak dan gas di Indonesia. Persetujuan POD revisi tersebut membuka jalan bagi INPEX dan mitranya untuk sepenuhnya mendorong proyek LNG Abadi sebagai proyek bersih dalam mendukung transisi energi. Kedepannya, INPEX dan mitranya akan melanjutkan operasi termasuk beberapa kegiatan di lokasi serta mempersiapkan pekerjaan FEED.  .recads_wrapper{height:134px;position:relative;margin:10px 0 30px;padding:10px 15px;overflow:hidden;box-shadow:0 0 10px rgb(0 0 0 / 20%);}.recads_title{margin-bottom:10px;font-size:16px;font-weight:700}.arjW-list{overflow-x:scroll;overflow-y:hidden;white-space:nowrap;width:auto;padding:10px 0;position:relative;display:flex;scroll-snap-type:x;flex-wrap:nowrap}.recads_item{scroll-snap-align:start;width:280px;flex:0 0 280px;margin-right:20px;display: flex;white-space: normal;gap: 10px;}.recads_item a {display:flex;white-space:normal;gap:10px;}.recads_image{position:relative;height:auto}.recads_image img{width:auto;height: 73px!important;max-width:165px!important;border-radius:8px}.article_datas_title{font-size:14px;font-weight:700;line-height:1.2;margin:0;overflow:hidden;display:-webkit-box;-webkit-line-clamp:4;-webkit-box-orient:vertical;}.arjW-img-overlay{position:absolute;z-index:3;bottom:8px;left:0;padding:0 0 0 10px}.arjW-img-overlay>img{width:auto;height: 16px!important;}.recads_image::after{z-index:2;position:absolute;top:50%;bottom:4px;left:0;right:0;content:'';background:linear-gradient(to top,#d6d6d6,transparent);width:100%;border-radius: 8px;}             BERITA REKOMENDASI           Setelah itu, perusahaan patungan (INPEX, Pertamina dan Petronas) akan melaksanakan proyek dengan tujuan mencapai keputusan investasi akhir / Final Investment Decision (FID) dan memulai produksi pada tahap awal setelah menyelesaikan persiapan yang diperlukan termasuk kegiatan pemasaran dan pembiayaan. Dwi Soetjipto mengatakan, langkah maju proyek ini dimulai dengan masuknya partner baru yaitu Pertamina dan Petronas serta bulan November 2023 yang lalu, pemerintah Indonesia dalam hal ini Menteri ESDM telah mengeluarkan Persetujuan Revisi kedua atas POD I Lapangan Abadi di Wilayah Kerja Masela. ""Proyek ini akan menghasilkan Pendapatan pemerintah sebesar US$37,8 Miliar atau setara Rp 586 Triliun,"" tuturnya.Proyek LNG Abadi ini juga menjadi bukti komitmen Indonesia dalam meningkatkan produksi sekaligus menurunkan emisi. Karena lapangan gas Abadi juga memiliki potensi untuk penyimpanan CO2 bahkan menjadi CCS Hub dengan kemampuan injeksi CO2 sebesar 71-80 Juta Ton dan Kapasitas Penyimpanan 1,2 Gigaton. ""CCS Hub pada Proyek Abadi Masela menambah daftar proyek CCS yang sedang dibangun di industri hulu migas, sekaligus menegaskan keberpihakan dan kontribusi industri ini dalam mengurangi emisi karbon dan mendukung Pemerintah dalam mencapai net zero emission di tahun 2060,"" ujar Dwi. Dwi menekankan pentingnya acara ini untuk mensinkronkan tekad bersama untuk mempercepat penyelesaian proyek dari target onstream di Q4 2029. Dia mengatakan jika proyek Abadi Masela bisa dipercepat maka berpotensi mempercepat penerimaan pendapatan dari proyek ini yang mencapai sekitar US$ 5 miliar, sebaliknya jika terjadi keterlambatan akan berpotensi tambahnya biaya proyek sekitar US$ 1 miliar setiap tahunnya diluar tambahan biaya tenaga kerja. ""Kick off hari ini adalah milestone penting, dan saya minta tim SKK Migas dan Inpex Masela untuk terus mencari potensi kegiatan untuk mempercepat proyek. Jika proyek Abadi Masela bisa lebih cepat selesai, maka dampaknya sangat besar berupa percepatan penerimaan negara dan tambahan pasokan gas untuk mendukung kebutuhan domestik,"" katanya. Menurut Dwi, kemajuan dari Proyek Abadi LNG ini sangat dinanti oleh oleh pemerintah dan masyarakat Indonesia, karena menjadi salah satu tulang punggung untuk mencapai target produksi di 2030 yaitu minyak 1 juta barel per hari (BOPD) dan gas 12 miliar kaki kubik per hari (BSCFD). Sementara Managing Executive Officer, Senior Vice President, Asia Projects, INPEX, Akihiro Watanabe, di dalam sambutannya memaparkan. Inpex sangat menghargai dukungan dari SKK Migas dan pemerintah Indonesia dalam merevisi POD untuk memasukkan CCS, yang merupakan momentum baik. ""Ke depannya, Inpex bersama JVP dengan sungguh-sungguh akan mengimplementasikan revisi POD melalui dukungan dan bimbingan dari SKK Migas dan pemerintah,"" tambahnya. Volume produksi LNG tahunan proyek LNG Abadi diperkirakan akan mencapai 9,5 juta ton dan diharapkan dapat berkontribusi untuk meningkatkan ketahanan energi di Indonesia, Jepang dan negara-negara Asia lainnya serta menghasilkan pasokan energi bersih yang stabil dalam jangka panjang, berdasarkan sifat ladang gas terkemuka di dunia dan cadangan berlimpah yang memungkinkan pengembangan yang efisien, serta komponen CCS Proyek. Selain itu, Proyek ini secara khusus diharapkan dapat berkontribusi secara signifikan terhadap pembangunan ekonomi dan sosial yang sangat dibutuhkan di bagian timur Indonesia, serta untuk mencapai tujuan Indonesia terkait target nol emisi CO2 pada tahun 2060.";28-12-2023;https://www.tribunnews.com/bisnis/2023/12/28/inpex-cs-investasi-blok-masela-nilainya-tembus-tiga-kali-lipat-proyek-kereta-cepat;"laporan wartawan tribunnews.com, dennis destryawan tribunnews.com, jakarta - inpex masela, ltd. (inpex masela), anak perusahaan inpex corporation menggelontorkan rp 324 triliun untuk investasi proyek ladang gas bumi blok masela. kepala skk migas, dwi soetjipto menyebutkan bahwa hari ini menjadi hari yang spesial, karena kick off project management team abadi masela, yang menandai dimulainya proyek strategis nasional yang sangat massif. ""investasi proyek abadi masela sangat besar mencapai us$20.9 billion, dan jika dibandingkan akan setara rp 324 triliun atau hampir tiga kali lipat nilai investasi kereta cepat jakarta bandung,"" ujar dwi di jakarta, kamis (28/12/2023). inpex masela merupakan operator proyek lng abadi. hari ini mengadakan acara kick-off pmt proyek lng abadi bersama skk migas, setelah pemerintah menyetujui revisi plan of development (pod) yang menyertakan komponen carbon capture storage (ccs) ke dalam revisi pod tersebut. proyek ini adalah yang pertama di mana biaya terkait ccs telah memenuhi syarat untuk dimasukkan ke dalam cost recovery1, berdasarkan skema kontrak bagi hasil (psc) yang mengatur operasi hulu minyak dan gas di indonesia. persetujuan pod revisi tersebut membuka jalan bagi inpex dan mitranya untuk sepenuhnya mendorong proyek lng abadi sebagai proyek bersih dalam mendukung transisi energi. kedepannya, inpex dan mitranya akan melanjutkan operasi termasuk beberapa kegiatan di lokasi serta mempersiapkan pekerjaan feed. berita rekomendasi setelah itu, perusahaan patungan (inpex, pertamina dan petronas) akan melaksanakan proyek dengan tujuan mencapai keputusan investasi akhir / final investment decision (fid) dan memulai produksi pada tahap awal setelah menyelesaikan persiapan yang diperlukan termasuk kegiatan pemasaran dan pembiayaan. dwi soetjipto mengatakan, langkah maju proyek ini dimulai dengan masuknya partner baru yaitu pertamina dan petronas serta bulan november 2023 yang lalu, pemerintah indonesia dalam hal ini menteri esdm telah mengeluarkan persetujuan revisi kedua atas pod i lapangan abadi di wilayah kerja masela. ""proyek ini akan menghasilkan pendapatan pemerintah sebesar us$37,8 miliar atau setara rp 586 triliun,"" tuturnya.proyek lng abadi ini juga menjadi bukti komitmen indonesia dalam meningkatkan produksi sekaligus menurunkan emisi. karena lapangan gas abadi juga memiliki potensi untuk penyimpanan co2 bahkan menjadi ccs hub dengan kemampuan injeksi co2 sebesar 71-80 juta ton dan kapasitas penyimpanan 1,2 gigaton. ""ccs hub pada proyek abadi masela menambah daftar proyek ccs yang sedang dibangun di industri hulu migas, sekaligus menegaskan keberpihakan dan kontribusi industri ini dalam mengurangi emisi karbon dan mendukung pemerintah dalam mencapai net zero emission di tahun 2060,"" ujar dwi. dwi menekankan pentingnya acara ini untuk mensinkronkan tekad bersama untuk mempercepat penyelesaian proyek dari target onstream di q4 2029. dia mengatakan jika proyek abadi masela bisa dipercepat maka berpotensi mempercepat penerimaan pendapatan dari proyek ini yang mencapai sekitar us$ 5 miliar, sebaliknya jika terjadi keterlambatan akan berpotensi tambahnya biaya proyek sekitar us$ 1 miliar setiap tahunnya diluar tambahan biaya tenaga kerja. ""kick off hari ini adalah milestone penting, dan saya minta tim skk migas dan inpex masela untuk terus mencari potensi kegiatan untuk mempercepat proyek. jika proyek abadi masela bisa lebih cepat selesai, maka dampaknya sangat besar berupa percepatan penerimaan negara dan tambahan pasokan gas untuk mendukung kebutuhan domestik,"" katanya. menurut dwi, kemajuan dari proyek abadi lng ini sangat dinanti oleh oleh pemerintah dan masyarakat indonesia, karena menjadi salah satu tulang punggung untuk mencapai target produksi di 2030 yaitu minyak 1 juta barel per hari (bopd) dan gas 12 miliar kaki kubik per hari (bscfd). sementara managing executive officer, senior vice president, asia projects, inpex, akihiro watanabe, di dalam sambutannya memaparkan. inpex sangat menghargai dukungan dari skk migas dan pemerintah indonesia dalam merevisi pod untuk memasukkan ccs, yang merupakan momentum baik. ""ke depannya, inpex bersama jvp dengan sungguh-sungguh akan mengimplementasikan revisi pod melalui dukungan dan bimbingan dari skk migas dan pemerintah,"" tambahnya. volume produksi lng tahunan proyek lng abadi diperkirakan akan mencapai 9,5 juta ton dan diharapkan dapat berkontribusi untuk meningkatkan ketahanan energi di indonesia, jepang dan negara-negara asia lainnya serta menghasilkan pasokan energi bersih yang stabil dalam jangka panjang, berdasarkan sifat ladang gas terkemuka di dunia dan cadangan berlimpah yang memungkinkan pengembangan yang efisien, serta komponen ccs proyek. selain itu, proyek ini secara khusus diharapkan dapat berkontribusi secara signifikan terhadap pembangunan ekonomi dan sosial yang sangat dibutuhkan di bagian timur indonesia, serta untuk mencapai tujuan indonesia terkait target nol emisi co2 pada tahun 2060."
