Title;Content;Date;URL;Cleaned Article
IHSG Awal Sesi Lanjutkan Kenaikan, Rupiah Menguat;"JAKARTA, KOMPAS.com - Indeks Harga Saham Gabungan (IHSG) menghijau pada awal perdagangan Bursa Efek Indonesia (BEI) Selasa (13/8/2024). Demikian juga dengan mata uang garuda yang menguat pada perdagangan pasar spot. Melansir data RTI, pukul 09.09 WIB, IHSG bergerak pada level 7.329,74 atau naik 32,11 poin (0,44 persen) dibanding penutupan sebelumnya pada level 7.297,62. Sebanyak 219 saham melaju di zona hijau dan 120 saham di zona merah. Sedangkan 216 saham lainnya stagnan. Adapun nilai transaksi hingga saat ini mencapai Rp 701,2 miliar dengan volume 1,15 miliar saham. Direktur Pilarmas Investindo Maximiliaus Nicodemus mengatakan, hari ini IHSG bisa mengalami penguatan. Namun, pergerakan pasar hari ini cenderung wait and see. Pelaku pasar dan investor kembali khawatir serangan antara Iran dengan Israel semakin besar untuk berpotensi terjadi. “Berdasarkan analisa teknikal, kami melihat IHSG berpotensi menguat terbatas dengan support dan resistance di level 7.150 – 7.300,” kata Maximiliaus dalam analisisnya. Bursa Asia hijau, dengan kenaikan Hang Seng Hong Kong 0,37 persen (63 poin) ke posisi 17.174,4, Shanghai Komposit bertambah 0,2 persen (5,6 poin) ke posisi 2.863,2, Strait Times naik 0,64 persen (20,8 poin) ke level 3.256,6, dan Nikkei menguat 2,3 persen (810,5 poin) ke level 35.835,5. Rupiah Adapun nilai tukar rupiah terhadap dollar AS di pasar spot pagi ini menguat. Melansir data Bloomberg, pukul 09.08 WIB rupiah berada pada level Rp 15.936 per dollar AS atau naik 20 poin (0,15 persen) dibanding penutupan sebelumnya Rp 15.956 per dollar AS. Pengamat pasar uang Ariston Tjendra mengatakan, pada perdagangan hari ini, pelaku pasar menunggu data penting inflasi AS yang akan dirilis Selasa dan Rabu ini. Data ini akan mengkonfirmasi ekspektasi pasar terhadap peluang kebijakan pemangkasan suku bunga acuan AS ke depan yang di bulan September ini yang menurut ekspektasi pasar, peluangnya 100 persen. ""Rupiah masih bergerak konsolidatif terhadap dollar AS hari ini dan masih berpeluang menguat dengan potensi penguatan ke arah Rp 15.900 per dollar AS, dan potensi resisten di kisaran Rp 16.000 per dollar AS,"" kata Ariston kepada Kompas.com. ";13-08-2024;https://money.kompas.com/read/2024/08/13/094203026/ihsg-awal-sesi-lanjutkan-kenaikan-rupiah-menguat;"jakarta,indeks harga saham gabungan (ihsg) menghijau pada awal perdagangan bursa efek indonesia (bei) selasa (13/8/2024). demikian juga dengan mata uang garuda yang menguat pada perdagangan pasar spot. melansir data rti, pukul 09.09 wib, ihsg bergerak pada level 7.329,74 atau naik 32,11 poin (0,44 persen) dibanding penutupan sebelumnya pada level 7.297,62. sebanyak 219 saham melaju di zona hijau dan 120 saham di zona merah. sedangkan 216 saham lainnya stagnan. adapun nilai transaksi hingga saat ini mencapai rp 701,2 miliar dengan volume 1,15 miliar saham. direktur pilarmas investindo maximiliaus nicodemus mengatakan, hari ini ihsg bisa mengalami penguatan. namun, pergerakan pasar hari ini cenderung wait and see. pelaku pasar dan investor kembali khawatir serangan antara iran dengan israel semakin besar untuk berpotensi terjadi. “berdasarkan analisa teknikal, kami melihat ihsg berpotensi menguat terbatas dengan support dan resistance di level7.300,” kata maximiliaus dalam analisisnya. bursa asia hijau, dengan kenaikan hang seng hong kong 0,37 persen (63 poin) ke posisi 17.174,4, shanghai komposit bertambah 0,2 persen (5,6 poin) ke posisi 2.863,2, strait times naik 0,64 persen (20,8 poin) ke level 3.256,6, dan nikkei menguat 2,3 persen (810,5 poin) ke level 35.835,5. rupiah adapun nilai tukar rupiah terhadap dollar as di pasar spot pagi ini menguat. melansir data bloomberg, pukul 09.08 wib rupiah berada pada level rp 15.936 per dollar as atau naik 20 poin (0,15 persen) dibanding penutupan sebelumnya rp 15.956 per dollar as. pengamat pasar uang ariston tjendra mengatakan, pada perdagangan hari ini, pelaku pasar menunggu data penting inflasi as yang akan dirilis selasa dan rabu ini. data ini akan mengkonfirmasi ekspektasi pasar terhadap peluang kebijakan pemangkasan suku bunga acuan as ke depan yang di bulan september ini yang menurut ekspektasi pasar, peluangnya 100 persen. ""rupiah masih bergerak konsolidatif terhadap dollar as hari ini dan masih berpeluang menguat dengan potensi penguatan ke arah rp 15.900 per dollar as, dan potensi resisten di kisaran rp 16.000 per dollar as,"" kata ariston kepada kompas.com. "
IHSG Diprediksi Melemah, Berikut Analisis dan Rekomendasi Sahamnya ;JAKARTA, KOMPAS.com – Indeks Harga Saham Gabungan (IHSG) diproyeksikan akan melemah pada Senin (19/8/2024). Sebelumnya, IHSG pada penutupan Jumat (16/8/2024) berakhir di zona hijau pada level 7.432,09. IHSG menguat 22,5 poin atau 0,3 persen.  Direktur of Research and Investment Pilarmas Investindo Sekuritas, Maximilianus Nico Demus mengatakan hari ini IHSG berpotensi melemah.   SHUTTERSTOCK/JIRAPONG MANUSTRONG Ilustrasi saham, pasar saham, transaksi saham.  Saat ini IHSG dan pasar obligasi tengah mendapatkan sentimen positif dari pasar. Namun apabila semua berjalan dengan rencana, bukan tidak mungkin IHSG akan kembali menguat, asalkan dijaga untuk tetap ditutup di level 7.350.  “Berdasarkan analisa teknikal, kami melihat IHSG berpotensi melemah terbatas dengan support dan resistance di level 7.275 sampai 7.450. Begitupun dengan imbal hasil obligasi yang terus mengalami penurunan, dan diharapkan imbal hasil SUN 10y akan bermain direntang 6.65 sampai 6.80. Derasnya Capital Inflow diharapkan dapat menjaga Rupiah hingga akhir tahun nanti,” ujar Maximilianus dalam analisisnya.  Analis MNC Sekuritas, Herditya Wicaksana mengatakan, ada kemungkinan IHSG sedang membentuk wave (b) dari wave 2 pada pola running flat. Apabila IHSG mampu break 7.460, maka IHSG akan menuju ke 7.513 hingga 7.654.  “Selanjutnya, IHSG akan terkoreksi ke rentang area 7,027 sampai 7218. Support IHSG pada level 7.207 - 7.126, resistance IHSG pada level 7.460 sampai 7.514,” kata Herditya. Adapun rekomendasi saham dari tiga perusahaan sekuritas, antara lain sebagai berikut.     Disclaimer: Artikel ini bukan untuk mengajak membeli atau menjual saham. Segala rekomendasi dan analisa saham berasal dari analis dari sekuritas yang bersangkutan, dan Kompas.com tidak bertanggung jawab atas keuntungan atau kerugian yang timbul. Keputusan investasi ada di tangan Investor. Pelajari dengan teliti sebelum membeli/menjual saham. ;19-08-2024;https://money.kompas.com/read/2024/08/19/072945026/ihsg-diprediksi-melemah-berikut-analisis-dan-rekomendasi-sahamnya;jakarta,indeks harga saham gabungan (ihsg) diproyeksikan akan melemah pada senin (19/8/2024). sebelumnya, ihsg pada penutupan jumat (16/8/2024) berakhir di zona hijau pada level 7.432,09. ihsg menguat 22,5 poin atau 0,3 persen. direktur of research and investment pilarmas investindo sekuritas, maximilianus nico demus mengatakan hari ini ihsg berpotensi melemah. shutterstock/jirapong manustrong ilustrasi saham, pasar saham, transaksi saham. saat ini ihsg dan pasar obligasi tengah mendapatkan sentimen positif dari pasar. namun apabila semua berjalan dengan rencana, bukan tidak mungkin ihsg akan kembali menguat, asalkan dijaga untuk tetap ditutup di level 7.350. “berdasarkan analisa teknikal, kami melihat ihsg berpotensi melemah terbatas dengan support dan resistance di level 7.275 sampai 7.450. begitupun dengan imbal hasil obligasi yang terus mengalami penurunan, dan diharapkan imbal hasil sun 10y akan bermain direntang 6.65 sampai 6.80. derasnya capital inflow diharapkan dapat menjaga rupiah hingga akhir tahun nanti,” ujar maximilianus dalam analisisnya. analis mnc sekuritas, herditya wicaksana mengatakan, ada kemungkinan ihsg sedang membentuk wave (b) dari wave 2 pada pola running flat. apabila ihsg mampu break 7.460, maka ihsg akan menuju ke 7.513 hingga 7.654. “selanjutnya, ihsg akan terkoreksi ke rentang area 7,027 sampai 7218. support ihsg pada level7.126, resistance ihsg pada level 7.460 sampai 7.514,” kata herditya. adapun rekomendasi saham dari tiga perusahaan sekuritas, antara lain sebagai berikut. disclaimer: artikel ini bukan untuk mengajak membeli atau menjual saham. segala rekomendasi dan analisa saham berasal dari analis dari sekuritas yang bersangkutan, dan kompas.com tidak bertanggung jawab atas keuntungan atau kerugian yang timbul. keputusan investasi ada di tangan investor. pelajari dengan teliti sebelum membeli/menjual saham. 
Mampukah IHSG Bangkit? Simak Analisis dan Rekomendasi Saham Hari Ini;JAKARTA, KOMPAS.com – Indeks Harga Saham Gabungan (IHSG) diproyeksikan akan menguat pada Jumat (16/8/2024). Sebelumnya, IHSG pada penutupan Kamis (15/8/2024) berakhir di zona merah pada level 7.409,5 atau turun 26,5 poin (0,36 persen). Analis BinaArtha Sekuritas Ivan Rosanova mengatakan, IHSG telah menembus ke atas level 7.454 pada hari Kamis, yang mengonfirmasi pembentukan wave (i) dari (iii) dalam skenario bullish. “Hari ini, IHSG masih berpeluang melanjutkan tren naiknya menuju 7.489 karena masih berada di atas 7.329 sebagai support minor,” kata Ivan dalam analisisnya. Level support IHSG berada di 7.329, 7.230 dan 7.103, sementara level resistennya di 7.489, 7.590 dan 7.654. Berdasarkan indikator MACD menandakan momentum bullish. Analis MNC Sekuritas, Herditya Wicaksana mengatakan, hari ini IHSG berpotensi mengalami pelemahan karena ada potensi IHSG sedang membentuk wave (b) dari wave 2 pada pola running flat. Support IHSG pada level 7.207 - 7.126, resistance pada level 7.454 - 7.514. “Selanjutnya, IHSG akan terkoreksi pada rentang area 7.027-7.218. Apabila IHSG mampu break 7.454 kembali, maka IHSG akan menuju ke 7.513-7.654,” kata Herditya. Lalu saham apa saja yang bisa dicermati pada perdagangan hari ini? Simak rekomendasi teknikal dari tiga perusahaan sekuritas ini: 1. MNC SekuritasERAA rekomendasi speculative buy 418-428, target price 450 - 464, stoploss below 406INCO rekomendasi buy on weakness 3.780-3.820, target price 3.930 - 4.090, stoploss below 3.710JPFA rekomendasi buy on weakness 1.540-1.595, target price 1.665 - 1.760, stoploss below 1.505 2. Pilarmas InvestindoERAA last price 428, support 406, resistance 440, target 438ASLC last price 104, support 95, resistance 110, target 108SMRA last price 640, support 605, resistance 660, target 655 3. BinaArtha SekuritasAKRA rekomendasi hold, support 1.465, resistance 1.565 - 1.730, target 1.565.BBNI rekomendasi accumulative buy, support 4.820, resistance 5.500 - 5.950, target 5.500.BMRI rekomendasi accumulative buy, support 6.300, resistance 7.250 - 7.900, target 7.250. Disclaimer: Artikel ini bukan untuk mengajak membeli atau menjual saham. Segala rekomendasi dan analisa saham berasal dari analis dari sekuritas yang bersangkutan, dan Kompas.com tidak bertanggung jawab atas keuntungan atau kerugian yang timbul. Keputusan investasi ada di tangan Investor. Pelajari dengan teliti sebelum membeli/menjual saham. ;16-08-2024;https://money.kompas.com/read/2024/08/16/073900526/mampukah-ihsg-bangkit-simak-analisis-dan-rekomendasi-saham-hari-ini;jakarta,indeks harga saham gabungan (ihsg) diproyeksikan akan menguat pada jumat (16/8/2024). sebelumnya, ihsg pada penutupan kamis (15/8/2024) berakhir di zona merah pada level 7.409,5 atau turun 26,5 poin (0,36 persen). analis binaartha sekuritas ivan rosanova mengatakan, ihsg telah menembus ke atas level 7.454 pada hari kamis, yang mengonfirmasi pembentukan wave (i) dari (iii) dalam skenario bullish. “hari ini, ihsg masih berpeluang melanjutkan tren naiknya menuju 7.489 karena masih berada di atas 7.329 sebagai support minor,” kata ivan dalam analisisnya. level support ihsg berada di 7.329, 7.230 dan 7.103, sementara level resistennya di 7.489, 7.590 dan 7.654. berdasarkan indikator macd menandakan momentum bullish. analis mnc sekuritas, herditya wicaksana mengatakan, hari ini ihsg berpotensi mengalami pelemahan karena ada potensi ihsg sedang membentuk wave (b) dari wave 2 pada pola running flat. support ihsg pada level7.126, resistance pada level7.514. “selanjutnya, ihsg akan terkoreksi pada rentang area 7.027-7.218. apabila ihsg mampu break 7.454 kembali, maka ihsg akan menuju ke 7.513-7.654,” kata herditya. lalu saham apa saja yang bisa dicermati pada perdagangan hari ini? simak rekomendasi teknikal dari tiga perusahaan sekuritas ini: 1. mnc sekuritaseraa rekomendasi speculative buy 418-428, target price464, stoploss below 406inco rekomendasi buy on weakness 3.780-3.820, target price4.090, stoploss below 3.710jpfa rekomendasi buy on weakness 1.540-1.595, target price1.760, stoploss below 1.505 2. pilarmas investindoeraa last price 428, support 406, resistance 440, target 438aslc last price 104, support 95, resistance 110, target 108smra last price 640, support 605, resistance 660, target 655 3. binaartha sekuritasakra rekomendasi hold, support 1.465, resistance1.730, target 1.565.bbni rekomendasi accumulative buy, support 4.820, resistance5.950, target 5.500.bmri rekomendasi accumulative buy, support 6.300, resistance7.900, target 7.250. disclaimer: artikel ini bukan untuk mengajak membeli atau menjual saham. segala rekomendasi dan analisa saham berasal dari analis dari sekuritas yang bersangkutan, dan kompas.com tidak bertanggung jawab atas keuntungan atau kerugian yang timbul. keputusan investasi ada di tangan investor. pelajari dengan teliti sebelum membeli/menjual saham. 
IHSG Ditutup Menguat Tembus Level 7.400, Rupiah Perkasa;JAKARTA, KOMPAS.com - Indeks Harga Saham Gabungan (IHSG) berakhir di zona hijau pada penutupan perdagangan di Bursa Efek Indonesia (BEI), Rabu (14/8/2024). Demikian juga dengan nilai tukar rupiah terhadap dollar AS yang menguat di pasar spot. IHSG ditutup pada level 7.436,03 atau naik 79,4 poin (1,08 persen) dibandingkan penutupan sebelumnya pada level 7.356,63. Mengutip RTI, sebanyak 333 saham melaju di zona hijau dan 241 saham di zona merah. Sedangkan 220 saham lainnya stagnan. Adapun jumlah transaksi sore ini mencapai Rp 10,9 triliun dengan volume 17,5 miliar saham. Top gainers yang mendorong laju IHSG yakni, Barito Pacific (BRPT) yang melonjak 7,14 persen ke level Rp 1.125 per saham. Kemudian, Indosat (ISAT) yang naik 5 persen ke level Rp 11.550 per saham. Dilanjutkan oleh Barito Renewables Energy (BREN) yang menguat 4,7 persne ke level Rp 8.800 per saham. Top losers yang menekan IHSG yaitu, Cisarua Mountain Dairy (CMRY) yang melemah 2,7 persen ke level Rp 5.250 per saham. Kemudian Indo Tambangraya Megah (ITMG) yang turun 2,2 persen ke level Rp 26.225 per saham. Dilanjutkan oleh Vale Indonesia (INCO) yang turun 1,5 persen ke level Rp 3.810 per saham. Bursa Asia mixed dengan kenaikan, Nikkei 0,58 persen atau 209,89 poin ke level 36.442,39, dan Strait Times menguat 0,85 persen (27,7 poin) ke level 3.286,28. Sementara itu, Shanghai Komposit melemah 0,6 persen (17,3 poin) ke posisi 2.850,6, dan Hang Seng Hong Kong terkoreksi 0,35 persen (60,7 poin) ke posisi 17.113,35. Rupiah Nilai tukar rupiah terhadap dollar AS sore ini juga menguat di pasar spot. Mengutip data Bloomberg, mata uang garuda ditutup pada level Rp 15.675 per dollar AS atau naik 158 poin (0,99 persen) dibandingkan dengan sebelumnya pada level Rp 15.833 per dollar AS. Sementara itu, mengacu kurs tengah Jisdor, nilai tukar rupiah pada Rabu (14/8/2024) pada level Rp 15.691 per dollar AS, atau menguat dibanding Selasa (13/8/2024) pada level Rp 15.885 per dollar AS. ;14-08-2024;https://money.kompas.com/read/2024/08/14/170300126/ihsg-ditutup-menguat-tembus-level-7.400-rupiah-perkasa;jakarta,indeks harga saham gabungan (ihsg) berakhir di zona hijau pada penutupan perdagangan di bursa efek indonesia (bei), rabu (14/8/2024). demikian juga dengan nilai tukar rupiah terhadap dollar as yang menguat di pasar spot. ihsg ditutup pada level 7.436,03 atau naik 79,4 poin (1,08 persen) dibandingkan penutupan sebelumnya pada level 7.356,63. mengutip rti, sebanyak 333 saham melaju di zona hijau dan 241 saham di zona merah. sedangkan 220 saham lainnya stagnan. adapun jumlah transaksi sore ini mencapai rp 10,9 triliun dengan volume 17,5 miliar saham. top gainers yang mendorong laju ihsg yakni, barito pacific (brpt) yang melonjak 7,14 persen ke level rp 1.125 per saham. kemudian, indosat (isat) yang naik 5 persen ke level rp 11.550 per saham. dilanjutkan oleh barito renewables energy (bren) yang menguat 4,7 persne ke level rp 8.800 per saham. top losers yang menekan ihsg yaitu, cisarua mountain dairy (cmry) yang melemah 2,7 persen ke level rp 5.250 per saham. kemudian indo tambangraya megah (itmg) yang turun 2,2 persen ke level rp 26.225 per saham. dilanjutkan oleh vale indonesia (inco) yang turun 1,5 persen ke level rp 3.810 per saham. bursa asia mixed dengan kenaikan, nikkei 0,58 persen atau 209,89 poin ke level 36.442,39, dan strait times menguat 0,85 persen (27,7 poin) ke level 3.286,28. sementara itu, shanghai komposit melemah 0,6 persen (17,3 poin) ke posisi 2.850,6, dan hang seng hong kong terkoreksi 0,35 persen (60,7 poin) ke posisi 17.113,35. rupiah nilai tukar rupiah terhadap dollar as sore ini juga menguat di pasar spot. mengutip data bloomberg, mata uang garuda ditutup pada level rp 15.675 per dollar as atau naik 158 poin (0,99 persen) dibandingkan dengan sebelumnya pada level rp 15.833 per dollar as. sementara itu, mengacu kurs tengah jisdor, nilai tukar rupiah pada rabu (14/8/2024) pada level rp 15.691 per dollar as, atau menguat dibanding selasa (13/8/2024) pada level rp 15.885 per dollar as. 
"Sebanyak 337 Saham ""Hijau"", IHSG Menguat di Akhir Sesi";JAKARTA, KOMPAS.com - Indeks Harga Saham Gabungan (IHSG) berakhir di zona hijau pada Senin (12/8/2024). Hal ini berbeda dengan rupiah yang melemah pada penutupan perdagangan pasar spot. IHSG ditutup pada level 7.297,62 atau naik 40,6 poin (0,56 persen) dibandingkan penutupan sebelumnya pada level 7.256,99. Mengutip RTI, sebanyak 337 saham melaju di zona hijau dan 206 saham di zona merah. Sedangkan 249 saham lainnya stagnan. Adapun jumlah transaksi sore ini mencapai Rp 6,9 triliun dengan volume 16,7 miliar saham. Top gainers yang mendorong laju IHSG yakni Harum Energy (HRUM) yang melonjak 13,7 persen ke level Rp 1.320 per saham. Kemudian, Timah (TINS) yang naik 5,7 persen ke posisi Rp 1.010 per saham. Dilanjutkan oleh Indosat (ISAT) yang naik 4,6 persen ke posisi Rp 10.675 per saham.  Top losers yang menekan IHSG yaitu, Amman Minerals International (AMMN) yang ambles 5,6 persen ke level Rp 10.475 per saham. Kemudian, Bank Jago (ARTO) yang melemah 2,4 persen ke level Rp 2.770 per saham. Selanjutnya, BFI Finance (BFIN) yang terkoreksi 2,2 persen ke level Rp 885 per saham. Bursa Asia mayoritas merah dengan penurunan, Shanghai Komposit 0,14 persen (3,9 poin) ke posisi 2.858,19, dan Strait Times melemah 0,81 persen (26,4 poin) ke level 3.235,37. Sementara itu, Hang Seng Hong Kong menguat 0,13 persen (21,4 poin) ke posisi 17.111,65. Mengutip data Bloomberg, rupiah sore ini ditutup melemah. Pukul 14.54 WIB mata uang garuda ditutup pada level Rp 15.955 per dollar AS atau turun 30 poin (0,19 persen) dibandingkan dengan sebelumnya pada level Rp 15.925 per saham. Sementara itu, mengacu kurs tengah Jisdor, nilai tukar rupiah pada Senin (12/8/2024) pada level Rp 15.963 per dollar AS, atau melemah dibanding Jumat (9/8/2024) pada level Rp 15.914 per dollar AS. Disclaimer: Artikel ini bukan untuk mengajak membeli atau menjual saham. Segala rekomendasi dan analisa saham berasal dari analis dari sekuritas yang bersangkutan, dan Kompas.com tidak bertanggung jawab atas keuntungan atau kerugian yang timbul. Keputusan investasi ada di tangan Investor. Pelajari dengan teliti sebelum membeli/menjual saham. ;12-08-2024;https://money.kompas.com/read/2024/08/12/171004926/sebanyak-337-saham-hijau-ihsg-menguat-di-akhir-sesi;jakarta, kompas.com - indeks harga saham gabungan (ihsg) berakhir di zona hijau pada senin (12/8/2024). hal ini berbeda dengan rupiah yang melemah pada penutupan perdagangan pasar spot. ihsg ditutup pada level 7.297,62 atau naik 40,6 poin (0,56 persen) dibandingkan penutupan sebelumnya pada level 7.256,99. mengutip rti, sebanyak 337 saham melaju di zona hijau dan 206 saham di zona merah. sedangkan 249 saham lainnya stagnan. adapun jumlah transaksi sore ini mencapai rp 6,9 triliun dengan volume 16,7 miliar saham. top gainers yang mendorong laju ihsg yakni harum energy (hrum) yang melonjak 13,7 persen ke level rp 1.320 per saham. kemudian, timah (tins) yang naik 5,7 persen ke posisi rp 1.010 per saham. dilanjutkan oleh indosat (isat) yang naik 4,6 persen ke posisi rp 10.675 per saham. top losers yang menekan ihsg yaitu, amman minerals international (ammn) yang ambles 5,6 persen ke level rp 10.475 per saham. kemudian, bank jago (arto) yang melemah 2,4 persen ke level rp 2.770 per saham. selanjutnya, bfi finance (bfin) yang terkoreksi 2,2 persen ke level rp 885 per saham. bursa asia mayoritas merah dengan penurunan, shanghai komposit 0,14 persen (3,9 poin) ke posisi 2.858,19, dan strait times melemah 0,81 persen (26,4 poin) ke level 3.235,37. sementara itu, hang seng hong kong menguat 0,13 persen (21,4 poin) ke posisi 17.111,65. mengutip data bloomberg, rupiah sore ini ditutup melemah. pukul 14.54 wib mata uang garuda ditutup pada level rp 15.955 per dollar as atau turun 30 poin (0,19 persen) dibandingkan dengan sebelumnya pada level rp 15.925 per saham. sementara itu, mengacu kurs tengah jisdor, nilai tukar rupiah pada senin (12/8/2024) pada level rp 15.963 per dollar as, atau melemah dibanding jumat (9/8/2024) pada level rp 15.914 per dollar as. disclaimer: artikel ini bukan untuk mengajak membeli atau menjual saham. segala rekomendasi dan analisa saham berasal dari analis dari sekuritas yang bersangkutan, dan kompas.com tidak bertanggung jawab atas keuntungan atau kerugian yang timbul. keputusan investasi ada di tangan investor. pelajari dengan teliti sebelum membeli/menjual saham. 
