Title;Content;Date;URL;Cleaned Article
CARA Dapat Diskon Listrik Desember 2021 dan Cek Tagihan Listrik Bulanan di PLN Mobile;"TRIBUNNEWS.COM - PLN memperpanjang diskon listrik dan subsidi abonemen listrik bagi pelanggannya hingga bulan Desember 2021. Besaran diskon yang diterima akan berbeda di setiap daya. Simak cara dapat dan besaran diskon yang diberikan PLN. Cara Mendapatkan Diskon Listrik dari PLN Bagi pelanggan pascabayar, diskon diberikan dengan langsung memotong tagihan rekening listrik pelanggan. Sementara itu, untuk pelanggan prabayar, diskon tarif listrik diberikan saat pembelian token listrik. Sehingga pelanggan tak perlu lagi mengakses WhatsApp, website stimulus.pln.co.id atau aplikasi PLN Mobile untuk mendapatkannya.  .recads_wrapper{height:134px;position:relative;margin:10px 0 30px;padding:10px 15px;overflow:hidden;box-shadow:0 0 10px rgb(0 0 0 / 20%);}.recads_title{margin-bottom:10px;font-size:16px;font-weight:700}.arjW-list{overflow-x:scroll;overflow-y:hidden;white-space:nowrap;width:auto;padding:10px 0;position:relative;display:flex;scroll-snap-type:x;flex-wrap:nowrap}.recads_item{scroll-snap-align:start;width:280px;flex:0 0 280px;margin-right:20px;display: flex;white-space: normal;gap: 10px;}.recads_item a {display:flex;white-space:normal;gap:10px;}.recads_image{position:relative;height:auto}.recads_image img{width:auto;height: 73px!important;max-width:165px!important;border-radius:8px}.article_datas_title{font-size:14px;font-weight:700;line-height:1.2;margin:0;overflow:hidden;display:-webkit-box;-webkit-line-clamp:4;-webkit-box-orient:vertical;}.arjW-img-overlay{position:absolute;z-index:3;bottom:8px;left:0;padding:0 0 0 10px}.arjW-img-overlay>img{width:auto;height: 16px!important;}.recads_image::after{z-index:2;position:absolute;top:50%;bottom:4px;left:0;right:0;content:'';background:linear-gradient(to top,#d6d6d6,transparent);width:100%;border-radius: 8px;}             BERITA REKOMENDASI           Selanjutnya, khusus untuk pembebasan biaya beban, abonemen, dan pembebasan ketentuan rekening minimum, pemberian stimulus akan diberikan secara otomatis dengan memotong tagihan rekening listrik konsumen sosial, bisnis, dan industri. Potongan sebesar 50 persen hanya diberikan untuk biaya beban atau abonemen dan biaya pemakaian rekening minimum. Rincian Besaran Diskon a. Diskon tarif listrik diperpanjang untuk pelanggan golongan rumah tangga dengan daya 450 VA (R1/TR 450 VA), bisnis kecil daya 450 VA (B1/TR 450 VA) dan industri kecil daya 450 VA (I1/TR 450 VA): - Reguler atau pascabayar: rekening listrik diberikan diskon sebesar 50 persen atau gratis (biaya pemakaian dan biaya beban); - Prabayar: diberikan diskon tarif listrik untuk pembelian token sebesar 50 persen. b. Perpanjangan diskon tarif listrik untuk pelanggan golongan rumah tangga daya 900 VA bersubsidi (R1/TR 900 VA): - Reguler atau pascabayar: rekening listrik diberikan diskon sebesar 25 persen (biaya pemakaian dan biaya beban); - Prabayar: diberikan diskon tarif listrik untuk pembelian token sebesar 25 persen. c. Pembebasan biaya beban atau abonemen, serta pembebasan ketentuan rekening minimum sebesar 50 persen bagi pelanggan industri, bisnis, dan sosial. Cara cek tagihan listrik melalui aplikasi PLN Mobile: 1. Buka aplikasi PLN Mobile; 2. Pilih menu Catat Meter; 3. Masukkan ID Pelanggan; 4. Kemudian, foto angka meter; 5. Masukkan angka stand meter kemudian kirim; 6. Secara otomatis, estimasi tagihan listrikmu bulan ini akan muncul. Cara cek sisa pemakaian: 1. Download dan buka aplikasi PLN Mobile; 2. Kemudian, pilih menu Kelistrikan; 3. Lalu, pilih ID Pelanggan; 4. Perkiraan sisa pemakaian secara otomatis akan tampil. Berita Terkait PLN Beri Keringanan Pelanggan (Tribunnews.com/Widya/Tio)";02-12-2021;https://m.tribunnews.com/bisnis/2021/12/02/cara-dapat-diskon-listrik-desember-2021-dan-cek-tagihan-listrik-bulanan-di-pln-mobile?page=all;"tribunnews.com - pln memperpanjang diskon listrik dan subsidi abonemen listrik bagi pelanggannya hingga bulan desember 2021. besaran diskon yang diterima akan berbeda di setiap daya. simak cara dapat dan besaran diskon yang diberikan pln. cara mendapatkan diskon listrik dari pln bagi pelanggan pascabayar, diskon diberikan dengan langsung memotong tagihan rekening listrik pelanggan. sementara itu, untuk pelanggan prabayar, diskon tarif listrik diberikan saat pembelian token listrik. sehingga pelanggan tak perlu lagi mengakses whatsapp, website stimulus.pln.co.id atau aplikasi pln mobile untuk mendapatkannya. berita rekomendasi selanjutnya, khusus untuk pembebasan biaya beban, abonemen, dan pembebasan ketentuan rekening minimum, pemberian stimulus akan diberikan secara otomatis dengan memotong tagihan rekening listrik konsumen sosial, bisnis, dan industri. potongan sebesar 50 persen hanya diberikan untuk biaya beban atau abonemen dan biaya pemakaian rekening minimum. rincian besaran diskon a. diskon tarif listrik diperpanjang untuk pelanggan golongan rumah tangga dengan daya 450 va (r1/tr 450 va), bisnis kecil daya 450 va (b1/tr 450 va) dan industri kecil daya 450 va (i1/tr 450 va): - reguler atau pascabayar: rekening listrik diberikan diskon sebesar 50 persen atau gratis (biaya pemakaian dan biaya beban); - prabayar: diberikan diskon tarif listrik untuk pembelian token sebesar 50 persen. b. perpanjangan diskon tarif listrik untuk pelanggan golongan rumah tangga daya 900 va bersubsidi (r1/tr 900 va): - reguler atau pascabayar: rekening listrik diberikan diskon sebesar 25 persen (biaya pemakaian dan biaya beban); - prabayar: diberikan diskon tarif listrik untuk pembelian token sebesar 25 persen. c. pembebasan biaya beban atau abonemen, serta pembebasan ketentuan rekening minimum sebesar 50 persen bagi pelanggan industri, bisnis, dan sosial. cara cek tagihan listrik melalui aplikasi pln mobile: 1. buka aplikasi pln mobile; 2. pilih menu catat meter; 3. masukkan id pelanggan; 4. kemudian, foto angka meter; 5. masukkan angka stand meter kemudian kirim; 6. secara otomatis, estimasi tagihan listrikmu bulan ini akan muncul. cara cek sisa pemakaian: 1. download dan buka aplikasi pln mobile; 2. kemudian, pilih menu kelistrikan; 3. lalu, pilih id pelanggan; 4. perkiraan sisa pemakaian secara otomatis akan tampil. berita terkait pln beri keringanan pelanggan (tribunnews.com/widya/tio)"
Ini Mekanisme Terbaru Pre-Opening dan Pre-Closing Perdagangan Saham di BEI;" JAKARTA, KOMPAS.com - PT Bursa Efek Indonesia (BEI) mulai hari ini meluncurkan fitur dan mekanisme baru pada sistem perdagangan di bursa. Fitur-fitur dan mekanisme baru tersebut mencakup penyesuaian mekanisme Pre-Opening dan Pre-Closing, penambahan fitur Market Order, perpanjangan waktu perdagangan di pasar negosiasi, dan penutupan informasi kode broker pada informasi post trade yang didistribusikan selama sesi perdagangan.  “Sebenarnya proses ini sudah berjalan cukup lama dan sudah direncanakan lebih dari setahun lalu. Hari ini adalah hari pertama melakukan implementasi kedua hal tersebut, dalam prosesnya sampai sekarang kondisi berjalan lancar,” Direktur Perdagangan dan Pengaturan Anggota Bursa Efek Indonesia (BEI) Laksono Widodo secara virtual, Senin (6/12/2021).  Penyesuaian mekanisme Pre-Opening dan Pre-Closing ini dilakukan dengan penambahan fitur informasi Indicative Equilibrium Price (IEP) serta Indicative Equilibrium Volume (IEV). Dengan adanya fitur ini investor dapat menggunakan indikator untuk mengetahui perkiraan harga pembukaan dan penutupan berdasarkan harga dengan volume terbanyak yang dapat dipertemukan.  Pada sesi Pre-Closing, terdapat fitur tambahan, yaitu Random Closing dengan waktu penutupan di hari perdagangan Bursa akan dilakukan secara acak. Tujuan dari adanya penambahan fitur IEP, IEV dan Random Closing ini, yakni untuk mengoptimalisasi pembentukan harga pembukaan dan harga penutupan yang lebih wajar pada sesi Pre-Opening dan sesi Pre-Closing sesuai dengan kondisi pasar.  Fitur tersebut juga berguna untuk meredam terjadinya manipulasi pergerakan harga saham yang tajam pada saat sesi pembukaan dan sesi penutupan. Lalu untuk menyempurnakan transparansi pembentukan harga, meningkatkan likuiditas transaksi, serta merupakan best practice di Bursa lain.  Selain itu, BEI juga melakukan penambahan fitur Market Order guna memudahkan investor dalam menyampaikan pesanan pada harga pasar. Market Order merupakan tipe pesanan agar investor cukup input volume tanpa input harga. Sistem Bursa akan mempertemukan Market Order dengan harga terbaik yang ada pada pasar.   Tipe pesanan ini bermanfaat ketika pergerakan harga bergerak cepat, sehingga dapat meningkatkan kesempatan investor untuk memperoleh efek yang diminati. Market Order juga dapat meningkatkan potensi terjadinya transaksi, sehingga mendorong terciptanya peningkatan likuiditas pasar.  Sedangkan perpanjangan waktu perdagangan di Pasar Negosiasi ditujukan untuk mengakomodasi masukan serta kebutuhan dari pelaku pasar, seperti perusahaan efek dan nasabah kelembagaan yang membutuhkan waktu tambahan dalam melakukan transaksi di akhir hari.  Selain meluncurkan fitur baru, sistem perdagangan Jakarta Automated Trading System (JATS) BEI juga akan melakukan penutupan kode broker saham pada informasi post trade yang didistribusikan selama sesi perdagangan (realtime running trade). Investor tidak lagi dapat melihat informasi kode Anggota Bursa (AB) yang melakukan transaksisaham tertentu pada saat perdagangan berlangsung (real time) atau pada saat terjadinya matched order.  Direktur Pengembangan BEI Hasan Fawzi mengungkapkan, penutupan kode broker ini juga merupakan best practice yang telah diterapkan Bursa lain di mancanegara, dan secara umum telah memberikan banyak manfaat.   Adapun tujuan penutupan kode broker antara lain untuk meningkatkan tata kelola pasar, yaitu membangun market governance dengan mengurangi praktik herding behaviour atau menggiring pasar ke saham-saham tertentu.  Kemudian, penutupan kode broker juga berfungsi untuk mencegah praktik herding behaviour dan front running, serta mengarahkan investor untuk melakukan riset sebelum melakukan keputusan investasi dengan menggunakan filosofi analisis fundamental dan teknikal.  “Ini menjadi bagian tidak terpisahkan dari upaya besar BEI melakukan transformasi keseluruhan siklus proses utama bursa. Tentu tujuan akhirnya adalah mendorong agar BEI dapat menyediakan layanan bursa efek secara teratur, wajar, efisien dan semakin dekat dengan international best practice yang juga secara umum berlaku di bursa lainnya , baik di regional maupun di global,” jelas Hasan.  Nantinya, meskipun AB tidak lagi mendapatkan akses informasi kode broker secara real time selama sesi perdagangan berlangsung, Bursa tetap memberikan informasi seluruh transaksi, termasuk kode broker setelah sesi perdagangan berakhir yang dapat diakses oleh semua AB.  Data tersebut dapat dimanfaatkan oleh AB untuk mengolah informasi kode broker yang selanjutnya dapat didistribusikan ke investor. Informasi kode broker atas setiap transaksi dan ringkasan transaksi AB dapat diperoleh setelah sesi perdagangan berakhir dalam bentuk file Data Transaksi Bursa, data olahan perusahaan sekuritas, atau melalui Website BEI www.idx.co.id &gt; Data Pasar &gt; Ringkasan Perdagangan &gt; Ringkasan Broker, Ringkasan Saham, Daily Trading Information, serta Laporan Statistik. ";06-12-2021;https://money.kompas.com/read/2021/12/06/151000626/ini-mekanisme-terbaru-pre-opening-dan-pre-closing-perdagangan-saham-di-bei;jakarta,pt bursa efek indonesia (bei) mulai hari ini meluncurkan fitur dan mekanisme baru pada sistem perdagangan di bursa. fitur-fitur dan mekanisme baru tersebut mencakup penyesuaian mekanisme pre-opening dan pre-closing, penambahan fitur market order, perpanjangan waktu perdagangan di pasar negosiasi, dan penutupan informasi kode broker pada informasi post trade yang didistribusikan selama sesi perdagangan. “sebenarnya proses ini sudah berjalan cukup lama dan sudah direncanakan lebih dari setahun lalu. hari ini adalah hari pertama melakukan implementasi kedua hal tersebut, dalam prosesnya sampai sekarang kondisi berjalan lancar,” direktur perdagangan dan pengaturan anggota bursa efek indonesia (bei) laksono widodo secara virtual, senin (6/12/2021). penyesuaian mekanisme pre-opening dan pre-closing ini dilakukan dengan penambahan fitur informasi indicative equilibrium price (iep) serta indicative equilibrium volume (iev). dengan adanya fitur ini investor dapat menggunakan indikator untuk mengetahui perkiraan harga pembukaan dan penutupan berdasarkan harga dengan volume terbanyak yang dapat dipertemukan. pada sesi pre-closing, terdapat fitur tambahan, yaitu random closing dengan waktu penutupan di hari perdagangan bursa akan dilakukan secara acak. tujuan dari adanya penambahan fitur iep, iev dan random closing ini, yakni untuk mengoptimalisasi pembentukan harga pembukaan dan harga penutupan yang lebih wajar pada sesi pre-opening dan sesi pre-closing sesuai dengan kondisi pasar. fitur tersebut juga berguna untuk meredam terjadinya manipulasi pergerakan harga saham yang tajam pada saat sesi pembukaan dan sesi penutupan. lalu untuk menyempurnakan transparansi pembentukan harga, meningkatkan likuiditas transaksi, serta merupakan best practice di bursa lain. selain itu, bei juga melakukan penambahan fitur market order guna memudahkan investor dalam menyampaikan pesanan pada harga pasar. market order merupakan tipe pesanan agar investor cukup input volume tanpa input harga. sistem bursa akan mempertemukan market order dengan harga terbaik yang ada pada pasar. tipe pesanan ini bermanfaat ketika pergerakan harga bergerak cepat, sehingga dapat meningkatkan kesempatan investor untuk memperoleh efek yang diminati. market order juga dapat meningkatkan potensi terjadinya transaksi, sehingga mendorong terciptanya peningkatan likuiditas pasar. sedangkan perpanjangan waktu perdagangan di pasar negosiasi ditujukan untuk mengakomodasi masukan serta kebutuhan dari pelaku pasar, seperti perusahaan efek dan nasabah kelembagaan yang membutuhkan waktu tambahan dalam melakukan transaksi di akhir hari. selain meluncurkan fitur baru, sistem perdagangan jakarta automated trading system (jats) bei juga akan melakukan penutupan kode broker saham pada informasi post trade yang didistribusikan selama sesi perdagangan (realtime running trade). investor tidak lagi dapat melihat informasi kode anggota bursa (ab) yang melakukan transaksisaham tertentu pada saat perdagangan berlangsung (real time) atau pada saat terjadinya matched order. direktur pengembangan bei hasan fawzi mengungkapkan, penutupan kode broker ini juga merupakan best practice yang telah diterapkan bursa lain di mancanegara, dan secara umum telah memberikan banyak manfaat. adapun tujuan penutupan kode broker antara lain untuk meningkatkan tata kelola pasar, yaitu membangun market governance dengan mengurangi praktik herding behaviour atau menggiring pasar ke saham-saham tertentu. kemudian, penutupan kode broker juga berfungsi untuk mencegah praktik herding behaviour dan front running, serta mengarahkan investor untuk melakukan riset sebelum melakukan keputusan investasi dengan menggunakan filosofi analisis fundamental dan teknikal. “ini menjadi bagian tidak terpisahkan dari upaya besar bei melakukan transformasi keseluruhan siklus proses utama bursa. tentu tujuan akhirnya adalah mendorong agar bei dapat menyediakan layanan bursa efek secara teratur, wajar, efisien dan semakin dekat dengan international best practice yang juga secara umum berlaku di bursa lainnya , baik di regional maupun di global,” jelas hasan. nantinya, meskipun ab tidak lagi mendapatkan akses informasi kode broker secara real time selama sesi perdagangan berlangsung, bursa tetap memberikan informasi seluruh transaksi, termasuk kode broker setelah sesi perdagangan berakhir yang dapat diakses oleh semua ab. data tersebut dapat dimanfaatkan oleh ab untuk mengolah informasi kode broker yang selanjutnya dapat didistribusikan ke investor. informasi kode broker atas setiap transaksi dan ringkasan transaksi ab dapat diperoleh setelah sesi perdagangan berakhir dalam bentuk file data transaksi bursa, data olahan perusahaan sekuritas, atau melalui website bei www.idx.co.id data pasar ringkasan perdagangan ringkasan broker, ringkasan saham, daily trading information, serta laporan statistik. 
Cara Beli Saham bagi Pemula, Gampang dan Bisa dari Rumah;JAKARTA, KOMPAS.com – Saham adalah salah satu instrumen investasi yang mulai populer di kalangan anak muda. Di masa pandemi Covid-19, jumlah investor saham di pasar modal naik signifikan. Sebenarnya apa itu saham dan bagaimana cara beli saham? Sederhananya, saham adalah bukti kepemilikan nilai sebuah perusahaan atau bukti penyertaan modal. Membeli saham perusahaan, artinya menjadi pemilik perusahaan tersebut. Cara membeli saham juga kini semakin mudah. Berkat kecanggihan teknologi, cara beli saham sudah bisa dilakukan secara online. Untung rugi investasi saham Keuntungan dari berinvestasi saham adalah mendapatkan capital gain. Yaitu keuntungan dari kenaikan harga saham yang dimiliki. Selain itu, keuntungan dari membeli saham adalah berhak mendapatkan dividen atau pembagian keuntungan perusahaan. Sementara kerugian dari berinvestasi saham adalah capital loss. Yakni kerugian atas penurunan harga saham yang dibeli. Kemudian kerugian kedua dari membeli saham adalah risiko likuidasi atau jika perusahaan yang sahamnya kita beli mengalami kebangkrutan. Meski saham adalah instrumen investasi yang berisiko tinggi, tapi berinvestasi saham bisa memberikan imbal atau keuntungan yang tinggi pula. Sesuai dengan prinsip high risk high gain. Dikutip dari laman yuknabungsaham.idx.co.id, Minggu (5/12/2021), Bursa Efek Indonesia (BEI) adalah tempat atau wadah bagi para pelaku saham untuk memperdagangkan atau memperjualbelikan setiap saham atau efek yang mereka miliki dan ingin beli. BEI ini ibarat mal yang menyediakan tempat kepada para pihak untuk bertransaksi. PIXABAY cara beli saham bagi pemula secara aman, mudah dan cepat Namun demikian, cara beli saham bukan berarti harus datang ke BEI. Melainkan bisa membeli saham secara online. Jual beli saham dapat dilakukan melalui perusahaan sekuritas yang menyediakan platformnya. Cara beli saham bagi pemula Bagaimana cara beli saham bagi pemula? Masyarakat yang ingin berinvestasi saham, jangan khawatir. Karena cara beli saham saat ini sangat mudah. Pada prinsipnya, siapa pun dapat membeli saham. Sejumlah perusahaan sekuritas saat ini sudah menyediakan platform jual beli saham. Termasuk tahapan cara beli saham bagi pemula atau cara membeli saham perusahaan bagi masyarakat awam. Perusahaan sekuritas adalah perusahaan yang telah mendapat izin dari OJK sebagai perantara pedagang efek (broker-dealer), penjamin emisi (underwriter), atau kegiatan lain sesuai dengan ketentuan pengawas pasar modal. Adapun untuk pembelian saham, investor harus menyiapkan dana sesuai harga saham dan membayar biaya transaksi untuk perusahaan sekuritas (fee broker). Sedangkan untuk penjualan saham, total dana yang didapat investor adalah nilai sesuai harga jual saham dikurangi biaya transaksi dan PPh. PIXABAY cara beli saham bagi pemula secara aman, mudah dan cepat Biaya transaksi tersebut berbeda-beda di setiap perusahaan sekuritas, namun umumnya 0,2—0,3% dari nilai transaksi pembelian saham (termasuk PPN) dan ditambah PPh 0.1% khusus untuk transaksi penjualan saham. Berikut adalah tahapan-tahapan dan cara membeli saham: ;06-12-2021;https://money.kompas.com/read/2021/12/06/073151426/cara-beli-saham-bagi-pemula-gampang-dan-bisa-dari-rumah?page=all;jakarta,saham adalah salah satu instrumen investasi yang mulai populer di kalangan anak muda. di masa pandemi covid-19, jumlah investor saham di pasar modal naik signifikan. sebenarnya apa itu saham dan bagaimana cara beli saham? sederhananya, saham adalah bukti kepemilikan nilai sebuah perusahaan atau bukti penyertaan modal. membeli saham perusahaan, artinya menjadi pemilik perusahaan tersebut. cara membeli saham juga kini semakin mudah. berkat kecanggihan teknologi, cara beli saham sudah bisa dilakukan secara online. untung rugi investasi saham keuntungan dari berinvestasi saham adalah mendapatkan capital gain. yaitu keuntungan dari kenaikan harga saham yang dimiliki. selain itu, keuntungan dari membeli saham adalah berhak mendapatkan dividen atau pembagian keuntungan perusahaan. sementara kerugian dari berinvestasi saham adalah capital loss. yakni kerugian atas penurunan harga saham yang dibeli. kemudian kerugian kedua dari membeli saham adalah risiko likuidasi atau jika perusahaan yang sahamnya kita beli mengalami kebangkrutan. meski saham adalah instrumen investasi yang berisiko tinggi, tapi berinvestasi saham bisa memberikan imbal atau keuntungan yang tinggi pula. sesuai dengan prinsip high risk high gain. dikutip dari laman yuknabungsaham.idx.co.id, minggu (5/12/2021), bursa efek indonesia (bei) adalah tempat atau wadah bagi para pelaku saham untuk memperdagangkan atau memperjualbelikan setiap saham atau efek yang mereka miliki dan ingin beli. bei ini ibarat mal yang menyediakan tempat kepada para pihak untuk bertransaksi. pixabay cara beli saham bagi pemula secara aman, mudah dan cepat namun demikian, cara beli saham bukan berarti harus datang ke bei. melainkan bisa membeli saham secara online. jual beli saham dapat dilakukan melalui perusahaan sekuritas yang menyediakan platformnya. cara beli saham bagi pemula bagaimana cara beli saham bagi pemula? masyarakat yang ingin berinvestasi saham, jangan khawatir. karena cara beli saham saat ini sangat mudah. pada prinsipnya, siapa pun dapat membeli saham. sejumlah perusahaan sekuritas saat ini sudah menyediakan platform jual beli saham. termasuk tahapan cara beli saham bagi pemula atau cara membeli saham perusahaan bagi masyarakat awam. perusahaan sekuritas adalah perusahaan yang telah mendapat izin dari ojk sebagai perantara pedagang efek (broker-dealer), penjamin emisi (underwriter), atau kegiatan lain sesuai dengan ketentuan pengawas pasar modal. adapun untuk pembelian saham, investor harus menyiapkan dana sesuai harga saham dan membayar biaya transaksi untuk perusahaan sekuritas (fee broker). sedangkan untuk penjualan saham, total dana yang didapat investor adalah nilai sesuai harga jual saham dikurangi biaya transaksi dan pph. pixabay cara beli saham bagi pemula secara aman, mudah dan cepat biaya transaksi tersebut berbeda-beda di setiap perusahaan sekuritas, namun umumnya 0,2—0,3% dari nilai transaksi pembelian saham (termasuk ppn) dan ditambah pph 0.1% khusus untuk transaksi penjualan saham. berikut adalah tahapan-tahapan dan cara membeli saham: 
