Title;Content;Date;URL;Cleaned Article
9 Contoh Investasi Jangka Panjang, Cocok bagi Pemula;KOMPAS.com - Investasi jangka panjang alias long term investment adalah investasi yang pengembalian keuntungannya di atas satu tahun. Ada banyak contoh investasi jangka panjang. Investasi jangka panjang adalah kebalikan dari investasi jangka pendek yang keuntungannya sudah bisa dinikmati dalam waktu kurang dari setahun. Paling klasik, investasi jangka panjang contohnya adalah membeli tanah. Di mana harga tanah terus mengalami kenaikan dari tahun ke tahun. Ciri dari investasi jangka panjang adalah potensi keuntungannya yang lebih besar, namun dengan jangka waktu yang lebih lama. Terkadang, risikonya juga lebih tinggi. Lazimnya, tujuan investasi dilakukan guna memenuhi sesuatu yang membutuhkan biaya besar di masa mendatang seperti kebutuhan dana pendidikan, haji atau umrah, dana pensiun, membangun rumah, dan sebagainya. Berikut ini sederet contoh investasi jangka panjang sebagaimana dirangkum dari berbagai sumber: Membeli properti, baik tanah atau bangunan, termasuk dalam investasi jangka panjang. Ini karena harga properti cenderung terus mengalami kenaikan dari tahun ke tahun. Ada kalanya, harga properti memang turun, namun kasus tersebut jarang terjadi. Terlebih apabila berada di lokasi strategis, maka harga properti tentu akan terus mengalami kenaikan dari tahun ke tahun. Apabila disewakan, properti juga akan memberikan passive income bagi pemiliknya. Misalnya ketika Anda membeli ruko, lalu menyewakannya. Contoh investasi jangka panjang selanjutnya adalah saham. Saham adalah penyertaan penyertaan modal dari investor, dalam hal ini seseorang atau badan usaha terhadap sebuah perusahaan. Ketika seseorang membeli saham, maka orang tersebut ikut memiliki perusahaan sesuai dengan persentase saham yang dibeli. Investor pun juga berhak ada sebagian keuntungan perusahaan. Dalam jangka panjang, seorang investor saham bisa mengharapkan keuntungan dari pembagian laba atau dividen, hingga capital gain yaitu selisih antara harga beli dan harga jual. Kendati demikian, investor saham tentunya akan ikut menanggung risiko apabila perusahaan mengalami kerugian. Yang mana kondisi tersebut berdampak langsung pada harga saham maupun dividen. Ketiga, investasi jangka panjang contohnya adalah logam mulia. Harga emas relatif cenderung mengalami kenaikan setiap tahunnya. Emas juga merupakan sarana lindung nilai, artinya seorang bisa mempertahankan nilai asetnya dari gerusan inflasi. Nyaris tidak ada risiko berinvestasi pada emas karena jarang sekali harganya yang turun. ;07-04-2023;https://money.kompas.com/read/2023/04/07/144930526/9-contoh-investasi-jangka-panjang-cocok-bagi-pemula?page=all;investasi jangka panjang alias long term investment adalah investasi yang pengembalian keuntungannya di atas satu tahun. ada banyak contoh investasi jangka panjang. investasi jangka panjang adalah kebalikan dari investasi jangka pendek yang keuntungannya sudah bisa dinikmati dalam waktu kurang dari setahun. paling klasik, investasi jangka panjang contohnya adalah membeli tanah. di mana harga tanah terus mengalami kenaikan dari tahun ke tahun. ciri dari investasi jangka panjang adalah potensi keuntungannya yang lebih besar, namun dengan jangka waktu yang lebih lama. terkadang, risikonya juga lebih tinggi. lazimnya, tujuan investasi dilakukan guna memenuhi sesuatu yang membutuhkan biaya besar di masa mendatang seperti kebutuhan dana pendidikan, haji atau umrah, dana pensiun, membangun rumah, dan sebagainya. berikut ini sederet contoh investasi jangka panjang sebagaimana dirangkum dari berbagai sumber: membeli properti, baik tanah atau bangunan, termasuk dalam investasi jangka panjang. ini karena harga properti cenderung terus mengalami kenaikan dari tahun ke tahun. ada kalanya, harga properti memang turun, namun kasus tersebut jarang terjadi. terlebih apabila berada di lokasi strategis, maka harga properti tentu akan terus mengalami kenaikan dari tahun ke tahun. apabila disewakan, properti juga akan memberikan passive income bagi pemiliknya. misalnya ketika anda membeli ruko, lalu menyewakannya. contoh investasi jangka panjang selanjutnya adalah saham. saham adalah penyertaan penyertaan modal dari investor, dalam hal ini seseorang atau badan usaha terhadap sebuah perusahaan. ketika seseorang membeli saham, maka orang tersebut ikut memiliki perusahaan sesuai dengan persentase saham yang dibeli. investor pun juga berhak ada sebagian keuntungan perusahaan. dalam jangka panjang, seorang investor saham bisa mengharapkan keuntungan dari pembagian laba atau dividen, hingga capital gain yaitu selisih antara harga beli dan harga jual. kendati demikian, investor saham tentunya akan ikut menanggung risiko apabila perusahaan mengalami kerugian. yang mana kondisi tersebut berdampak langsung pada harga saham maupun dividen. ketiga, investasi jangka panjang contohnya adalah logam mulia. harga emas relatif cenderung mengalami kenaikan setiap tahunnya. emas juga merupakan sarana lindung nilai, artinya seorang bisa mempertahankan nilai asetnya dari gerusan inflasi. nyaris tidak ada risiko berinvestasi pada emas karena jarang sekali harganya yang turun. 
IFG Holding Cetak Laba Bersih Rp 4 Triliun Tahun 2022;"JAKARTA, KOMPAS.com - Holding BUMN Asuransi, Penjaminan, dan Investasi Indonesia Financial Group (IFG) telah berdiri selama 3 tahun sejak resmi dimandatkan pemerintah pada tahun 2020. Sekretaris Perusahaan IFG Oktarina Dwidya Sistha melaporkan, laba bersih IFG pada tahun 2022 tercatat sebesar Rp 4 triliun (unaudited). Angka ini tumbuh dari total laba bersih pada tahun 2019 sebesar Rp 2,2 triliun. Di sisi lain, total aset konsolidasi sebesar Rp 137,6 triliun (unaudited) di tahun 2022. ""Dengan kolaborasi bersama pemerintah dan ekosistem BUMN, IFG mampu meningkatkan value creation secara konsolidasi,"" kata dia dalam keterangan resmi, dikutip Jumat (14/4/2023).  Selain itu, IFG juga mencatatkan beberapa peningkatan dan pencapaian pada anak usahanya. Misalnya, terdapat peningkatan kecepatan waktu proses pencairan santunan kecelakaan lalu lintas oleh PT Jasa Raharja yang kini dapat diselesaikan dalam waktu 1 hari 4 jam, dari target maksimal 3 hari. Lalu, PT Asuransi Kredit Indonesia (Askrindo) mencetak realisasi volume Penjaminan Kredit Usaha Rakyat (KUR) sebesar Rp 760,7 triliun dan pemulihan ekonomi nasional (PEN) sebesar Rp 25,4 triliun.  Baca juga: IFG Life Butuh PMN Rp 3 Triliun untuk Selesaikan Pengalihan Polis Jiwasraya  Lainnya, PT Jaminan Kredit Indonesia (Jamkrindo) mencetak realisasi volume penjaminan KUR sebesar Rp 773 triliun dan PEN sebesar Ro 33,4 triliun. Soal migrasi polis dari Jiwasraya, IFG Life telah memindahkan total 157.312 polis pada Januari 2023. Perusahaan juga telah membayarkan klaim senilai Rp 5,9 triliun kepada pemegang polis yang sudah beralih ke IFG Life sejak Desember 2021. Lebih lanjut, Jasindo telah memiliki risk based capital (RBC) positif mencapai 149,57 persen (audited) pada Desember 2022. Sebelumnya pada tahun 2021, RBC Jasindo sempat menyentuh angka negatig 84,85 persen.  Kemudian, Bahana TCW Investment Management mencatat Asset Under Management (AUM) mencapai Rp 39,21 triliun per Desember 2022.  ""Dengan beberapa capaian tersebut, IFG dan anak usaha akan terus menjaga pertumbuhan positif,"" tandas dia. ";14-04-2023;https://money.kompas.com/read/2023/04/14/091000926/ifg-holding-cetak-laba-bersih-rp-4-triliun-tahun-2022;"jakarta,holding bumn asuransi, penjaminan, dan investasi indonesia financial group (ifg) telah berdiri selama 3 tahun sejak resmi dimandatkan pemerintah pada tahun 2020. sekretaris perusahaan ifg oktarina dwidya sistha melaporkan, laba bersih ifg pada tahun 2022 tercatat sebesar rp 4 triliun (unaudited). angka ini tumbuh dari total laba bersih pada tahun 2019 sebesar rp 2,2 triliun. di sisi lain, total aset konsolidasi sebesar rp 137,6 triliun (unaudited) di tahun 2022. ""dengan kolaborasi bersama pemerintah dan ekosistem bumn, ifg mampu meningkatkan value creation secara konsolidasi,"" kata dia dalam keterangan resmi, dikutip jumat (14/4/2023). selain itu, ifg juga mencatatkan beberapa peningkatan dan pencapaian pada anak usahanya. misalnya, terdapat peningkatan kecepatan waktu proses pencairan santunan kecelakaan lalu lintas oleh pt jasa raharja yang kini dapat diselesaikan dalam waktu 1 hari 4 jam, dari target maksimal 3 hari. lalu, pt asuransi kredit indonesia (askrindo) mencetak realisasi volume penjaminan kredit usaha rakyat (kur) sebesar rp 760,7 triliun dan pemulihan ekonomi nasional (pen) sebesar rp 25,4 triliun. baca juga: ifg life butuh pmn rp 3 triliun untuk selesaikan pengalihan polis jiwasraya lainnya, pt jaminan kredit indonesia (jamkrindo) mencetak realisasi volume penjaminan kur sebesar rp 773 triliun dan pen sebesar ro 33,4 triliun. soal migrasi polis dari jiwasraya, ifg life telah memindahkan total 157.312 polis pada januari 2023. perusahaan juga telah membayarkan klaim senilai rp 5,9 triliun kepada pemegang polis yang sudah beralih ke ifg life sejak desember 2021. lebih lanjut, jasindo telah memiliki risk based capital (rbc) positif mencapai 149,57 persen (audited) pada desember 2022. sebelumnya pada tahun 2021, rbc jasindo sempat menyentuh angka negatig 84,85 persen. kemudian, bahana tcw investment management mencatat asset under management (aum) mencapai rp 39,21 triliun per desember 2022. ""dengan beberapa capaian tersebut, ifg dan anak usaha akan terus menjaga pertumbuhan positif,"" tandas dia. "
Maka Capital Gandeng Filantropis Rikrik Rizkiyana Luncurkan Impact Investment Fund;"KOMPAS.com – Perusahaan capital advisory sekaligus investasi Maka Capital meluncurkan program pendanaan bertajuk “Impact Investing and Venture Philanthropy” bersama HMBC Rikrik Rizkiyana. “Kami menyambut dengan baik kesediaan Rikrik Rizkiyana menjadi Investment Board sekaligus Fund Sponsor pertama di program ini,” ujar Managing Partner dan CEO Maka Capital, kailash Raghuwanshi, dalam rilis yang diterima Kompas.com, Jumat (7/4/2023). Sebagai informasi, HMBC Rikrik Rizkiyana adalah seorang pengacara senior yang kini aktif menjadi filantropis di Indonesia dan diakui secara global. Rikrik Rizkiyana masuk dalam daftar Asia’s 2017 Heroes of Philanthropy versi Forbes dan juga Finalist dari Ernst &amp; Young Social Entrepreneur of The Year Tahun 2015. Kini, Rikrik juga aktif mendirikan berbagai organisasi sosial dan kemanusiaan hingga institusi pendidikan. Sementara Kailash Raghuwanshi sendiri merupakan mantan board advisor dari Landcent—perusahaan yang didanai oleh Bill &amp; Melinda Gates Foundation—yang telah menekuni dunia investasi selama 15 tahun dan telah bekerja di berbagai perusahaan modal ventura di mancanegara. Posisi terakhirnya di Landcent dan Bill &amp; Melinda Gates Foundation membuatnya terinspirasi untuk meluncurkan konsep Impact Investing di Indonesia. ""Dana modal ini akan mendanai 5 hingga 10 perusahaan yang memiliki fokus dan komitmen untuk memberikan dampak kepada sosial dan lingkungan setiap tahunnya. Kami juga mengajak investor sosial, baik di skala internasional maupun nasional untuk mendukung kemajuan program ini di Indonesia,” jelas Kailash. Perlu diketahui, Impact Investing adalah pendekatan investasi dari kombinasi investasi tradisional dan filantropi tradisional. Jenis investasi ini tergolong baru dan tengah menjadi tren. Kombinasi keduanya dilakukan karena filantropi tradisional memberikan dampak secara langsung, tetapi tidak berkelanjutan. Sementara, investasi tradisional dianggap memegang prinsip berkelanjutan, tetapi hanya fokus pada aspek keuangan. “Bersama HMBC Rikrik Rizkiyana, kami ingin mengubah landscape investasi di Indonesia. Kami percaya bahwa Impact Investing adalah konsep (investasi) yang memiliki potensi di masa depan mengingat Indonesia adalah negara paling dermawan di dunia secara 5 tahun berturut-turut menurut The World Giving Index,” tukas Kailash. ";07-04-2023;https://money.kompas.com/read/2023/04/07/143852026/maka-capital-gandeng-filantropis-rikrik-rizkiyana-luncurkan-impact-investment;"perusahaan capital advisory sekaligus investasi maka capital meluncurkan program pendanaan bertajuk “impact investing and venture philanthropy” bersama hmbc rikrik rizkiyana. “kami menyambut dengan baik kesediaan rikrik rizkiyana menjadi investment board sekaligus fund sponsor pertama di program ini,” ujar managing partner dan ceo maka capital, kailash raghuwanshi, dalam rilis yang diterima kompas.com, jumat (7/4/2023). sebagai informasi, hmbc rikrik rizkiyana adalah seorang pengacara senior yang kini aktif menjadi filantropis di indonesia dan diakui secara global. rikrik rizkiyana masuk dalam daftar asia’s 2017 heroes of philanthropy versi forbes dan juga finalist dari ernst young social entrepreneur of the year tahun 2015. kini, rikrik juga aktif mendirikan berbagai organisasi sosial dan kemanusiaan hingga institusi pendidikan. sementara kailash raghuwanshi sendiri merupakan mantan board advisor dari landcent—perusahaan yang didanai oleh bill melinda gates foundation—yang telah menekuni dunia investasi selama 15 tahun dan telah bekerja di berbagai perusahaan modal ventura di mancanegara. posisi terakhirnya di landcent dan bill melinda gates foundation membuatnya terinspirasi untuk meluncurkan konsep impact investing di indonesia. ""dana modal ini akan mendanai 5 hingga 10 perusahaan yang memiliki fokus dan komitmen untuk memberikan dampak kepada sosial dan lingkungan setiap tahunnya. kami juga mengajak investor sosial, baik di skala internasional maupun nasional untuk mendukung kemajuan program ini di indonesia,” jelas kailash. perlu diketahui, impact investing adalah pendekatan investasi dari kombinasi investasi tradisional dan filantropi tradisional. jenis investasi ini tergolong baru dan tengah menjadi tren. kombinasi keduanya dilakukan karena filantropi tradisional memberikan dampak secara langsung, tetapi tidak berkelanjutan. sementara, investasi tradisional dianggap memegang prinsip berkelanjutan, tetapi hanya fokus pada aspek keuangan. “bersama hmbc rikrik rizkiyana, kami ingin mengubah landscape investasi di indonesia. kami percaya bahwa impact investing adalah konsep (investasi) yang memiliki potensi di masa depan mengingat indonesia adalah negara paling dermawan di dunia secara 5 tahun berturut-turut menurut the world giving index,” tukas kailash. "
             Banyak Data Penting! Waspada, Salah Sedikit IHSG Bisa Ambruk            ;Jakarta, CNBC Indonesia - Pasar keuangan Tanah Air pekan ini cenderung bergerak beragam. Indeks Harga Saham Gabungan (IHSG) menghentikan penguatan dua pekan beruntun, sementara rupiah melanjutkan kinerja impresifnya melawan dolar Amerika pekan ini. Lantas mampukah pasar keuangan melanjutkan kinerja positifnya pekan depan? Indeks acuan Tanah Air tersebut tercatat melemah tipis 0,18% ke 6.792,76. Dalam empat hari perdagangan, IHSG masing-masing menguat dan melemah dua kali. Meski melemah, investor asing tercatat melakukan aksi beli bersih (net buy) sebesar Rp 1,9 triliun, dan jika ditambah dengan pasar nego dan tunai nilainya bertambah menjadi Rp 2,5 triliun. Pergerakan IHSG cenderung searah dengan bursa saham AS (Wall Street) yang juga melemah. Pelaku pasar menanti rilis data tenaga kerja AS versi pemerintah yang dirilis Jumat kemarin. Data tersebut merupakan salah satu acuan bank sentral AS (The Fed) dalam menetapkan kebijakan moneternya. Data yang dirilis Jumat kemarin menunjukkan pasar tenaga kerja masih kuat. Sepanjang Maret perekonomian AS dilaporkan mampu menyerap 236.000 tenaga kerja di luar sektor pertanian (non-farm payrolls), sejalan dengan ekspektasi analis. Kemudian, tingkat pengangguran turun menjadi 3,5% dari sebelumnya 3,6%. Rata-rata upah per jam naik 4,2% year-on-year, tetapi menjadi yang terendah sejak Juni 2021. Sementara, Mata uang Garuda tercatat menguat 0,53% ke Rp 14.910/US$. Rupiah kini sudah menguat 4 pekan beruntun dengan total 3,5%. Tidak hanya itu, rupiah juga menjadi mata uang terbaik Asia sepanjang tahun ini dengan penguatan 4,4%, dan menjadi yang terbaik ke-enam di dunia. Rupiah mulai menguat setelah Silicon Valley Bank (SVB) kolaps di Amerika Serikat, hal ini membuat The Fed diprediksi tidak agresif lagi dalam menaikkan suku bunga. Mampukah kinerja pasar keuangan cemerlang pekan depan? setidaknya para pelaku pasar patut menyimak beberapa sentimen utama yang akan menggerakkan pasar pekan depan. Pertama, investor masih cenderung mencermati data-data penting dari ekonomi AS terutama data tenaga kerja yang baru rilis. Sikap investor cenderung wait and see setelah sebelumnya tanda-tanda perekonomian AS merosot semakin terlihat. Institute for Supply Management (ISM) melaporkan kontraksi sektor manufaktur semakin dalam pada Maret. Purchasing Managers' Index(PMI) dilaporkan sebesar 46,3, sudah mengalami kontraksi (di bawah 50) selama 5 bulan beruntun dan berada di level terendah sejak Mei 2020. Namun, dengan pasar tenaga kerja yang masih kuat dan inflasi berdasarkan personal consumption expenditure (PCE) yang sulit turun membuat pasar kembali memprediksi bank sentral AS (The Fed) akan kembali menaikkan suku bunga pada Mei. Tidak bisa dipungkiri, bahwa sentimen The Fed masih menjadi momok mengerikan bagi pasar finansial Tanah Air. Ketegangan antara suku bunga dan harga saham akan tetap terjadi pekan depan, karena investor terus mencerna indikasi sikap The Fed yang cenderung masihhawkishhingga beberapa bulan ke depan.Selain itu, ada ekonomi dua raksasa dunia yang juga merupakan partner dagang utama RI, China dan Amerika Serikat. Dari Amerika di awal pekan nanti Senin (10/4/2023) akan ada rilis data ekonomi penting terkait data ekspektasi inflasi konsumen. Pada hari berikutnya kita juga akan disuguhkan dengan pidato pejabat The Fed yang akan memberikan sinyal terkait suku bunga. Pekan ini fokus utama pelaku pasar adalah data inflasi AS yang bakal dirilis pada Rabu (12/4/2023). Ini tentunya menjadi indikator utama bagaimana The Fed akan mengambil langkah ke depannya.  Untuk diketahui, inflasi Amerika Serikat (AS) naik pada Februari 2023.Indeks harga konsumen (CPI) meningkat 0,4% pada Februari, menempatkan tingkat inflasi tahunan sebesar 6%. Laporan tersebut persis sejalan dengan perkiraan Dow Jones. Tidak termasuk harga makanan dan energi, CPI inti juga naik 0,5% pada Februari dan 5,5% dalam basis 12 bulan. Laporan bulanan tersebut sedikit di atas perkiraan 0,4%, tetapi tingkat tahunan sesuai dengan prediksi. Bagi The Fed, CPI bulanan yang mengukur harga sekeranjang barang dan jasa, telah menjadi titik data utama dalam keputusannya untuk menaikkan suku bunga selama setahun terakhir. Sejak Maret tahun lalu, suku bunga naik dari nol menjadi 4,5% menjadi 4,75%, level tertinggi sejak 2007. Sementara, dari Negeri Tirai Bambu pekan depan kita akan disuguhkan dengan data inflasi dan indeks harga produsen (PPI). Tak kalah penting, Pekan ini investor fokus mengamati rilis data neraca perdagangan terkait ekspor-impor China. Ini akan memberikan gambaran bagaimana ekonomi China bangkit pasca tertekan akibat Covid-19 beberapa waktu belakangan. Dari dalam negeri, tentunya ada sejumlah data ekonomi penting yang patut dinantikan pelaku pasar diantaranya akan ada rilis penjualan retail pada periode Februari 2023.  Untuk diketahui Penjualan ritel di Indonesia turun 0,6% secara yoy pada Januari 2023. Ini adalah penurunan penjualan ritel pertama sejak September 2021, di tengah lemahnya konsumsi akibat biaya pinjaman yang lebih tinggi.  CNBC INDONESIA RESEARCH [email protected];09-04-2023;https://www.cnbcindonesia.com/market/20230409114938-17-428312/banyak-data-penting-waspada-salah-sedikit-ihsg-bisa-ambruk;pasar keuangan tanah air pekan ini cenderung bergerak beragam. indeks harga saham gabungan (ihsg) menghentikan penguatan dua pekan beruntun, sementara rupiah melanjutkan kinerja impresifnya melawan dolar amerika pekan ini. lantas mampukah pasar keuangan melanjutkan kinerja positifnya pekan depan? indeks acuan tanah air tersebut tercatat melemah tipis 0,18% ke 6.792,76. dalam empat hari perdagangan, ihsg masing-masing menguat dan melemah dua kali. meski melemah, investor asing tercatat melakukan aksi beli bersih (net buy) sebesar rp 1,9 triliun, dan jika ditambah dengan pasar nego dan tunai nilainya bertambah menjadi rp 2,5 triliun. pergerakan ihsg cenderung searah dengan bursa saham as (wall street) yang juga melemah. pelaku pasar menanti rilis data tenaga kerja as versi pemerintah yang dirilis jumat kemarin. data tersebut merupakan salah satu acuan bank sentral as (the fed) dalam menetapkan kebijakan moneternya. data yang dirilis jumat kemarin menunjukkan pasar tenaga kerja masih kuat. sepanjang maret perekonomian as dilaporkan mampu menyerap 236.000 tenaga kerja di luar sektor pertanian (non-farm payrolls), sejalan dengan ekspektasi analis. kemudian, tingkat pengangguran turun menjadi 3,5% dari sebelumnya 3,6%. rata-rata upah per jam naik 4,2% year-on-year, tetapi menjadi yang terendah sejak juni 2021. sementara, mata uang garuda tercatat menguat 0,53% ke rp 14.910/us$. rupiah kini sudah menguat 4 pekan beruntun dengan total 3,5%. tidak hanya itu, rupiah juga menjadi mata uang terbaik asia sepanjang tahun ini dengan penguatan 4,4%, dan menjadi yang terbaik ke-enam di dunia. rupiah mulai menguat setelah silicon valley bank (svb) kolaps di amerika serikat, hal ini membuat the fed diprediksi tidak agresif lagi dalam menaikkan suku bunga. mampukah kinerja pasar keuangan cemerlang pekan depan? setidaknya para pelaku pasar patut menyimak beberapa sentimen utama yang akan menggerakkan pasar pekan depan. pertama, investor masih cenderung mencermati data-data penting dari ekonomi as terutama data tenaga kerja yang baru rilis. sikap investor cenderung wait and see setelah sebelumnya tanda-tanda perekonomian as merosot semakin terlihat. institute for supply management (ism) melaporkan kontraksi sektor manufaktur semakin dalam pada maret. purchasing managers' index(pmi) dilaporkan sebesar 46,3, sudah mengalami kontraksi (di bawah 50) selama 5 bulan beruntun dan berada di level terendah sejak mei 2020. namun, dengan pasar tenaga kerja yang masih kuat dan inflasi berdasarkan personal consumption expenditure (pce) yang sulit turun membuat pasar kembali memprediksi bank sentral as (the fed) akan kembali menaikkan suku bunga pada mei. tidak bisa dipungkiri, bahwa sentimen the fed masih menjadi momok mengerikan bagi pasar finansial tanah air. ketegangan antara suku bunga dan harga saham akan tetap terjadi pekan depan, karena investor terus mencerna indikasi sikap the fed yang cenderung masihhawkishhingga beberapa bulan ke depan.selain itu, ada ekonomi dua raksasa dunia yang juga merupakan partner dagang utama ri, china dan amerika serikat. dari amerika di awal pekan nanti senin (10/4/2023) akan ada rilis data ekonomi penting terkait data ekspektasi inflasi konsumen. pada hari berikutnya kita juga akan disuguhkan dengan pidato pejabat the fed yang akan memberikan sinyal terkait suku bunga. pekan ini fokus utama pelaku pasar adalah data inflasi as yang bakal dirilis pada rabu (12/4/2023). ini tentunya menjadi indikator utama bagaimana the fed akan mengambil langkah ke depannya. untuk diketahui, inflasi amerika serikat (as) naik pada februari 2023.indeks harga konsumen (cpi) meningkat 0,4% pada februari, menempatkan tingkat inflasi tahunan sebesar 6%. laporan tersebut persis sejalan dengan perkiraan dow jones. tidak termasuk harga makanan dan energi, cpi inti juga naik 0,5% pada februari dan 5,5% dalam basis 12 bulan. laporan bulanan tersebut sedikit di atas perkiraan 0,4%, tetapi tingkat tahunan sesuai dengan prediksi. bagi the fed, cpi bulanan yang mengukur harga sekeranjang barang dan jasa, telah menjadi titik data utama dalam keputusannya untuk menaikkan suku bunga selama setahun terakhir. sejak maret tahun lalu, suku bunga naik dari nol menjadi 4,5% menjadi 4,75%, level tertinggi sejak 2007. sementara, dari negeri tirai bambu pekan depan kita akan disuguhkan dengan data inflasi dan indeks harga produsen (ppi). tak kalah penting, pekan ini investor fokus mengamati rilis data neraca perdagangan terkait ekspor-impor china. ini akan memberikan gambaran bagaimana ekonomi china bangkit pasca tertekan akibat covid-19 beberapa waktu belakangan. dari dalam negeri, tentunya ada sejumlah data ekonomi penting yang patut dinantikan pelaku pasar diantaranya akan ada rilis penjualan retail pada periode februari 2023. untuk diketahui penjualan ritel di indonesia turun 0,6% secara yoy pada januari 2023. ini adalah penurunan penjualan ritel pertama sejak september 2021, di tengah lemahnya konsumsi akibat biaya pinjaman yang lebih tinggi. cnbc indonesia research [email protected]
