Title;Content;Date;URL;Cleaned Article
6 Tips Jitu Ajukan Keringanan Kartu Kredit di Masa Pandemi;JAKARTA, KOMPAS.com - Dampak pandemi Covid-19, mulai dari gaji ‘disunat,’ Pemutusan Hubungan Kerja (PHK), usaha sepi, dan merembet hingga ancaman resesi ekonomi. Buat makan saja susah, apalagi bayar cicilan kartu kredit. Pandemi bikin pusing tujuh keliling. Untung ada kebijakan Bank Indonesia (BI) dalam penyelenggaraan kartu kredit sebagai langkah mengurangi dampak virus corona. Antara lain, penurunan batas maksimum suku bunga kartu kredit menjadi 2 persen per bulan dan batas minimum pembayaran jadi 5 persen dari total tagihan. Juga kebijakan memangkas nilai denda keterlambatan pembayaran kartu kredit menjadi maksimum 1 persen dari total tagihan dan tidak melebihi Rp 100.000. Kebijakan tersebut berlaku sampai akhir Desember 2020. Keringanan pembayaran kartu kredit tentu saja jadi angin segar buat mereka yang terkena imbas Covid-19. Selain itu, bagi pengguna yang sebelumnya tercatat punya tunggakan kartu kredit, gagal bayar, bahkan menjadi kredit macet akibat kondisi keuangan memburuk. Bank penerbit kartu kredit bisa saja memberi keringanan pembayaran. Mengajukannya dapat melalui cara berikut ini, seperti dikutip Cermati.com, Minggu (23/8/2020). Penggunaan kartu kredit sejatinya adalah utang yang harus tetap dibayar. Jika tidak dapat melunasinya tepat waktu, minta keringanan. Caranya datang langsung ke bank penerbit kartu kredit, apakah itu kantor pusat ataupun kantor cabang. Anda dapat lebih leluasa berkomunikasi dan mengutarakan alasan sebenarnya mengenai permintaan keringanan dibanding hanya lewat telepon. Tinggal datang langsung, ambil nomor antrean, lalu bertemu dan berbicara dengan customer service bank, bahkan bisa saja dioper ke bagian collection hingga persoalan tersebut menemukan titik terang. Dalam permintaan keringanan, tentu saja Anda dan pihak bank harus melakukan negosiasi sampai ada kata sepakat. Setelah alasan kesulitan membayar tagihan kartu kredit diterima bank, langkah selanjutnya adalah bernegosiasi program keringanan yang bisa Anda dapatkan.   Apakah itu program perpanjang cicilan dengan bunga ringan, menghapus denda keterlambatan, diskon cicilan, diskon sekali bayar, atau jenis program keringanan lain yang ditawarkan bank. Anda membuat kesepakatan dengan bank yang harus disesuaikan dengan kemampuan dan kondisi keuangan Anda. Dikenal dengan istilah rescheduling, di mana prosesnya jatuh tempo pembayaran diatur ulang. Contohnya tenor pembayaran dari sebelumnya 12 bulan diperpanjang menjadi 17 bulan. Nominal pembayaran angsuran pun dapat disesuaikan dengan kondisi keuangan dan kemampuan Anda. Dengan begitu, Anda dapat melunasi utang kartu kredit tanpa terbebani lagi. Baca Juga: Waspada Penipuan Kartu Kredit! Oknum Minta Nomor Kartu dan CVV Adalah program keringanan bagi Anda yang kesulitan membayar utang pokok ataupun bunga kartu kredit. Jenis restrukturisasi yang ditawarkan antara lain sebagai berikut. Menata kembali perjanjian kartu kredit. Mengubah persyaratan kredit menjadi baru. Contohnya dengan upaya memangkas suku bunga, pembebasan bunga atau sebagian pokok utang, dapat menunda pembayaran bunga sampai jangka waktu tertentu, dan lainnya. Selain untuk transaksi pembayaran, kartu kredit juga memiliki fasilitas pinjaman tunai. Namun besaran yang dapat dicairkan sebesar 50 persen dari sisa limit kartu kredit. Contohnya Anda punya limit kartu kredit sebesar Rp 8 juta dan sudah terpakai Rp 3 juta, dengan demkian sisa Rp 5 juta. Berarti yang bisa menjadi pinjaman tunai hanya sebesar Rp 2,5 juta (50 persen dari Rp 5 juta).   Tenor pinjaman dana tunai berkisar 3 bulan sampai 36 bulan. Sedangkan besaran bunganya ada yang menawarkan di bawah 1 persen. Semakin panjang tenornya, bunga semakin rendah. Memiliki kartu kredit boleh-boleh saja. Tidak ada yang melarang. Prinsipnya cuma satu, kalau tidak mau terjebak utang, gunakan kartu kredit dengan bijak. Pakai sesuai kebutuhan. Jangan hedon, konsumtif, apalagi foya-foya bak anak sultan menggunakan kartu kredit. Gesek kartu kredit sama saja berutang. Utang adalah kewajiban yang harus dibayar sampai lunas. Jika tidak, konsekuensinya siap-siap ‘diteror’ debt collector. Parahnya, harta benda bisa disita untuk membayar utang.   Artikel ini merupakan kerja sama Kompas.com dan Cermati.com. Isi artikel sepenuhnya merupakan tanggung jawab Cermati.com. ;23-08-2020;https://money.kompas.com/read/2020/08/23/123900726/6-tips-jitu-ajukan-keringanan-kartu-kredit-di-masa-pandemi?page=all&jxrecoid=1bb9cc83-6217-480f-a023-50e64e140231~lfa_kompas&source=widgetML&engine=V;jakarta,dampak pandemi covid-19, mulai dari gaji ‘disunat,’ pemutusan hubungan kerja (phk), usaha sepi, dan merembet hingga ancaman resesi ekonomi. buat makan saja susah, apalagi bayar cicilan kartu kredit. pandemi bikin pusing tujuh keliling. untung ada kebijakan bank indonesia (bi) dalam penyelenggaraan kartu kredit sebagai langkah mengurangi dampak virus corona. antara lain, penurunan batas maksimum suku bunga kartu kredit menjadi 2 persen per bulan dan batas minimum pembayaran jadi 5 persen dari total tagihan. juga kebijakan memangkas nilai denda keterlambatan pembayaran kartu kredit menjadi maksimum 1 persen dari total tagihan dan tidak melebihi rp 100.000. kebijakan tersebut berlaku sampai akhir desember 2020. keringanan pembayaran kartu kredit tentu saja jadi angin segar buat mereka yang terkena imbas covid-19. selain itu, bagi pengguna yang sebelumnya tercatat punya tunggakan kartu kredit, gagal bayar, bahkan menjadi kredit macet akibat kondisi keuangan memburuk. bank penerbit kartu kredit bisa saja memberi keringanan pembayaran. mengajukannya dapat melalui cara berikut ini, seperti dikutip cermati.com, minggu (23/8/2020). penggunaan kartu kredit sejatinya adalah utang yang harus tetap dibayar. jika tidak dapat melunasinya tepat waktu, minta keringanan. caranya datang langsung ke bank penerbit kartu kredit, apakah itu kantor pusat ataupun kantor cabang. anda dapat lebih leluasa berkomunikasi dan mengutarakan alasan sebenarnya mengenai permintaan keringanan dibanding hanya lewat telepon. tinggal datang langsung, ambil nomor antrean, lalu bertemu dan berbicara dengan customer service bank, bahkan bisa saja dioper ke bagian collection hingga persoalan tersebut menemukan titik terang. dalam permintaan keringanan, tentu saja anda dan pihak bank harus melakukan negosiasi sampai ada kata sepakat. setelah alasan kesulitan membayar tagihan kartu kredit diterima bank, langkah selanjutnya adalah bernegosiasi program keringanan yang bisa anda dapatkan. apakah itu program perpanjang cicilan dengan bunga ringan, menghapus denda keterlambatan, diskon cicilan, diskon sekali bayar, atau jenis program keringanan lain yang ditawarkan bank. anda membuat kesepakatan dengan bank yang harus disesuaikan dengan kemampuan dan kondisi keuangan anda. dikenal dengan istilah rescheduling, di mana prosesnya jatuh tempo pembayaran diatur ulang. contohnya tenor pembayaran dari sebelumnya 12 bulan diperpanjang menjadi 17 bulan. nominal pembayaran angsuran pun dapat disesuaikan dengan kondisi keuangan dan kemampuan anda. dengan begitu, anda dapat melunasi utang kartu kredit tanpa terbebani lagi. baca juga: waspada penipuan kartu kredit! oknum minta nomor kartu dan cvv adalah program keringanan bagi anda yang kesulitan membayar utang pokok ataupun bunga kartu kredit. jenis restrukturisasi yang ditawarkan antara lain sebagai berikut. menata kembali perjanjian kartu kredit. mengubah persyaratan kredit menjadi baru. contohnya dengan upaya memangkas suku bunga, pembebasan bunga atau sebagian pokok utang, dapat menunda pembayaran bunga sampai jangka waktu tertentu, dan lainnya. selain untuk transaksi pembayaran, kartu kredit juga memiliki fasilitas pinjaman tunai. namun besaran yang dapat dicairkan sebesar 50 persen dari sisa limit kartu kredit. contohnya anda punya limit kartu kredit sebesar rp 8 juta dan sudah terpakai rp 3 juta, dengan demkian sisa rp 5 juta. berarti yang bisa menjadi pinjaman tunai hanya sebesar rp 2,5 juta (50 persen dari rp 5 juta). tenor pinjaman dana tunai berkisar 3 bulan sampai 36 bulan. sedangkan besaran bunganya ada yang menawarkan di bawah 1 persen. semakin panjang tenornya, bunga semakin rendah. memiliki kartu kredit boleh-boleh saja. tidak ada yang melarang. prinsipnya cuma satu, kalau tidak mau terjebak utang, gunakan kartu kredit dengan bijak. pakai sesuai kebutuhan. jangan hedon, konsumtif, apalagi foya-foya bak anak sultan menggunakan kartu kredit. gesek kartu kredit sama saja berutang. utang adalah kewajiban yang harus dibayar sampai lunas. jika tidak, konsekuensinya siap-siap ‘diteror’ debt collector. parahnya, harta benda bisa disita untuk membayar utang. artikel ini merupakan kerja sama kompas.com dan cermati.com. isi artikel sepenuhnya merupakan tanggung jawab cermati.com. 
Kim Jong Un Puji Kemajuan Ekonomi Indonesia;"KOMPAS.com - Presiden Korea Utara, Kim Jong Un, memuji pencapaian pembangunan ekonomi Indonesia dalam beberapa tahun terakhir. Menurut dia, arah pembangunan di Tanah Air mengalami banyak kemajuan. ""Setelah kemerdekaan, negara Anda telah membuat banyak kemajuan besar dalam pengembangan ekonomi,"" kata Kim Jong Un seperti dikutip dari laman resmi Kementerian Luar Negeri Republik Demokratik Rakyat Korea, Selasa (18/8/2020). Pemimpin Besar Korea Utara yang juga putra Kim Jong-il ini memuji pembangunan ekonomi Indonesia yang dianggap cukup berhasil dalam skala ekonomi kerakyatan. ""(Anda membangun kemajuan besar) dalam membangun masyarakat sejahtera di bawah panji kedaulatan, kemerdekaan, dan gerakan non-blok,"" kata Kim Jong Un seraya memberi ucapan selamat atas HUT Kemerdekaan ke-75 RI. ""Kesempatan ini saya gunakan untuk mengutarakan keyakinan saya bahwa tradisi persahabatan kedua negara yang terjalin dengan baik, dan akan terus melanjutkan konsolidasi dan ikatan di era baru saat ini,"" ucap Kim Jong Un. Sebagai informasi, kerja sama ekonomi Indonesia dengan Korea Utara terus terjalin dengan baik, bahkan terus ditingkatkan. Hubungan ekonomi kedua negara sudah terjalin erat sejak era Presiden Soekarno dan Presiden Kim Il Sung yang merupakan kakek dari Kim Jong Un. ""Kami telah merancang dan sedang menjalankan sejumlah program konkret untuk memperkuat hubungan kedua negara sejalan dengan visi misi Presiden Joko Widodo,"" kata Duta Besar RI untuk Korea Utara, Berlian Napitupulu dikutip dari Antara. ""Kami terus meningkatkan promosi ekonomi dan perdagangan antara lain berpartisipasi secara aktif dalam beberapa pameran dagang internasional di Pyongyang dan pertemuan bisnis,"" kata dia lagi. ";18-08-2020;https://money.kompas.com/read/2020/08/18/141554026/kim-jong-un-puji-kemajuan-ekonomi-indonesia;"presiden korea utara, kim jong un, memuji pencapaian pembangunan ekonomi indonesia dalam beberapa tahun terakhir. menurut dia, arah pembangunan di tanah air mengalami banyak kemajuan. ""setelah kemerdekaan, negara anda telah membuat banyak kemajuan besar dalam pengembangan ekonomi,"" kata kim jong un seperti dikutip dari laman resmi kementerian luar negeri republik demokratik rakyat korea, selasa (18/8/2020). pemimpin besar korea utara yang juga putra kim jong-il ini memuji pembangunan ekonomi indonesia yang dianggap cukup berhasil dalam skala ekonomi kerakyatan. ""(anda membangun kemajuan besar) dalam membangun masyarakat sejahtera di bawah panji kedaulatan, kemerdekaan, dan gerakan non-blok,"" kata kim jong un seraya memberi ucapan selamat atas hut kemerdekaan ke-75 ri. ""kesempatan ini saya gunakan untuk mengutarakan keyakinan saya bahwa tradisi persahabatan kedua negara yang terjalin dengan baik, dan akan terus melanjutkan konsolidasi dan ikatan di era baru saat ini,"" ucap kim jong un. sebagai informasi, kerja sama ekonomi indonesia dengan korea utara terus terjalin dengan baik, bahkan terus ditingkatkan. hubungan ekonomi kedua negara sudah terjalin erat sejak era presiden soekarno dan presiden kim il sung yang merupakan kakek dari kim jong un. ""kami telah merancang dan sedang menjalankan sejumlah program konkret untuk memperkuat hubungan kedua negara sejalan dengan visi misi presiden joko widodo,"" kata duta besar ri untuk korea utara, berlian napitupulu dikutip dari antara. ""kami terus meningkatkan promosi ekonomi dan perdagangan antara lain berpartisipasi secara aktif dalam beberapa pameran dagang internasional di pyongyang dan pertemuan bisnis,"" kata dia lagi. "
Pesawat N250, Proyek Triliunan Rupiah yang Kandas Karena Krismon 1998;JAKARTA, KOMPAS.com - Pesawat pertama buatan Indonesia N250 Gatotkaca resmi dimuseumkan di Museum Pusat Dirgantara Mandala di Yogyakarta. Pesawat ini telah dikandangkan selama puluhan tahun di hanggar milik PT Dirgantara Indonesia (Persero), Bandung. Seri N250 merupakan buah dari mimpi Menristek di era Orde Baru, BJ Habibie, agar Indonesia mampu membuat pesawat sendiri. Tujuannya tak lain agar Indonesia yang secara geografis berupa kepulauan, bisa terkoneksi lewat udara. Pesawat N250 mulai dirancang bangun pada tahun 1986. Pada tahun 1995 pesawat tersebut berhasil mengudara di langit Indonesia. Mulanya, N250 didesain untuk pasar 30 penumpang, namun belakangan diganti menjadi kapasitas 50 penumpang. Namun sayang, cerita manis pesawat N250 ini harus terhenti saat Indonesia diterpa krisis moneter atau krismon pada tahun 1998. Proyek pesawat N250 disetop oleh negara akibat krisis ekonomi tersebut. Penutupan proyek IPTN juga dilakukan pemerintah atas saran IMF saat itu.  Dikutip dari Harian Kompas, 10 Agustus 1995, program pembuatan pesawat N250 ke tahap pembuatan prototipe berikut kandas diterpa krisis moneter 1998. Padahal, untuk sampai ke produksi, butuh investasi 650 juta dollar AS atau kini senilai Rp 8,45 triliun. Seiring dengan itu, IPTN mengalami kemunduran, ditandai pemutusan hubungan kerja sekitar 15.700 pekerja pada 1997, kini tinggal 4.200 orang. Itu seiring penurunan produksi pesawat. Masa surut juga dialami industri strategis dan industri lain. BJ Habibie sendirilah yang memimpin langsung proyek tersebut hingga sukses terbang. Pesawat N250 adalah satu-satunya pesawat turboprop di dunia yang menggunakan fly-by-wire atau fwb dengan jam terbang kurang lebih 900 jam. Turboprop adalah jenis pesawat pembangkit yang menggunakan turbin gas untuk menggerakkan baling-baling. Teknologi fly-by-wire akan melindungi pilot dari manuver berbahaya. Teknologi ini bisa mengambil kendali kontrol pesawat saat pilot lengah. Karena semuanya serba elektronik, sifat pemeliharaan pesawat ini pun lebih efisien dibanding pesawat pendahulunya. Kecepatan terbang pesawat N250 Gatotkaca mampu mencapai 610 km per jam. Sementara untuk ketinggian operasinya setinggi 25.000 kaki dengan daya jelajah 1.480 km. Selain fbw yang rumit, adanya niat untuk menjadikan N-250 sebagai pesawat baling-baling dengan kecepatan jelajah tinggi 330 knot atau hampir 600 km/jam, membuat para insinyur IPTN dihadapkan pada tantangan teknik yang besar, yang belum pernah mereka alami sebelumnya. Semuanya itu tidak mudah. Satu kali generator auxiliary power unit yang harus menyediakan tenaga listrik tambahan mati, ada pula kemudi digerakkan untuk memutar pesawat ke kiri, pesawat membelok sebaliknya, juga ada as generator di mesin yang patah. Pesawat N250 mulai terbang perdana pada 10 Agustus 1995 di Bandara Husein Sastranegara, Bandung. Ribuan orang menyaksikan langsung penerbangan perdana pesawat pertama buatan anak bangsa tersebut. Lepas landasnya N250 juga disiarkan langsung oleh TVRI. Gemuruh takbir, sorak sorai kebanggan, dan tepuk tangan menggema ketika pesawat N250 yang dipiloti Erwin Danuwinata itu berhasil lepas landas. ;23-08-2020;https://money.kompas.com/read/2020/08/23/180312626/pesawat-n250-proyek-triliunan-rupiah-yang-kandas-karena-krismon-1998?page=all;jakarta,pesawat pertama buatan indonesia n250 gatotkaca resmi dimuseumkan di museum pusat dirgantara mandala di yogyakarta. pesawat ini telah dikandangkan selama puluhan tahun di hanggar milik pt dirgantara indonesia (persero), bandung. seri n250 merupakan buah dari mimpi menristek di era orde baru, bj habibie, agar indonesia mampu membuat pesawat sendiri. tujuannya tak lain agar indonesia yang secara geografis berupa kepulauan, bisa terkoneksi lewat udara. pesawat n250 mulai dirancang bangun pada tahun 1986. pada tahun 1995 pesawat tersebut berhasil mengudara di langit indonesia. mulanya, n250 didesain untuk pasar 30 penumpang, namun belakangan diganti menjadi kapasitas 50 penumpang. namun sayang, cerita manis pesawat n250 ini harus terhenti saat indonesia diterpa krisis moneter atau krismon pada tahun 1998. proyek pesawat n250 disetop oleh negara akibat krisis ekonomi tersebut. penutupan proyek iptn juga dilakukan pemerintah atas saran imf saat itu. dikutip dari harian kompas, 10 agustus 1995, program pembuatan pesawat n250 ke tahap pembuatan prototipe berikut kandas diterpa krisis moneter 1998. padahal, untuk sampai ke produksi, butuh investasi 650 juta dollar as atau kini senilai rp 8,45 triliun. seiring dengan itu, iptn mengalami kemunduran, ditandai pemutusan hubungan kerja sekitar 15.700 pekerja pada 1997, kini tinggal 4.200 orang. itu seiring penurunan produksi pesawat. masa surut juga dialami industri strategis dan industri lain. bj habibie sendirilah yang memimpin langsung proyek tersebut hingga sukses terbang. pesawat n250 adalah satu-satunya pesawat turboprop di dunia yang menggunakan fly-by-wire atau fwb dengan jam terbang kurang lebih 900 jam. turboprop adalah jenis pesawat pembangkit yang menggunakan turbin gas untuk menggerakkan baling-baling. teknologi fly-by-wire akan melindungi pilot dari manuver berbahaya. teknologi ini bisa mengambil kendali kontrol pesawat saat pilot lengah. karena semuanya serba elektronik, sifat pemeliharaan pesawat ini pun lebih efisien dibanding pesawat pendahulunya. kecepatan terbang pesawat n250 gatotkaca mampu mencapai 610 km per jam. sementara untuk ketinggian operasinya setinggi 25.000 kaki dengan daya jelajah 1.480 km. selain fbw yang rumit, adanya niat untuk menjadikan n-250 sebagai pesawat baling-baling dengan kecepatan jelajah tinggi 330 knot atau hampir 600 km/jam, membuat para insinyur iptn dihadapkan pada tantangan teknik yang besar, yang belum pernah mereka alami sebelumnya. semuanya itu tidak mudah. satu kali generator auxiliary power unit yang harus menyediakan tenaga listrik tambahan mati, ada pula kemudi digerakkan untuk memutar pesawat ke kiri, pesawat membelok sebaliknya, juga ada as generator di mesin yang patah. pesawat n250 mulai terbang perdana pada 10 agustus 1995 di bandara husein sastranegara, bandung. ribuan orang menyaksikan langsung penerbangan perdana pesawat pertama buatan anak bangsa tersebut. lepas landasnya n250 juga disiarkan langsung oleh tvri. gemuruh takbir, sorak sorai kebanggan, dan tepuk tangan menggema ketika pesawat n250 yang dipiloti erwin danuwinata itu berhasil lepas landas. 
             Market Cap BCA Menuju Rp 800 T, Kokoh Berada di Puncak            ;Jakarta, CNBC Indonesia - Indeks Harga Saham Gabungan (IHSG) pekan lalu mengalami penguatan tipis . Penguatan IHSG tersebut tidak mempengaruhi perubahan 10 saham berkapitalisasi terbesar seperti pekan lalu. Pada periode 18 Agustus-19 Agustus 2020, IHSG menguat 0,48% dan ditutup di level 5.272,81. Sebenarnya IHSG sempat mencatatkan penguatan, tetapi pada perdagangan terakhir hari Rabu (19/8/2020) IHSG melemah 0,42%. Pada pekan lalu yang hanya 2 hari perdagangan, investor asing melakukan aksi jual bersih di seluruh pasar mencapai Rp 325 miliar. Dari dalam negeri Bank Indonesia (BI) pekan lalu memutuskan untuk tetap mempertahankan suku bunga acuan BI 7-Day Reverse Repo Rate (BI7DRR) di posisi 4%. Gubernur Bank Indonesia, Perry Warjiyo menilai tersebut masih konsisten untuk mendorong pemulihan ekonomi di masa pandemi COVID-19.   BI menilai ekonomi Indonesia triwulan III-2020 akan membaik sejalan dengan relaksasi PSBB (Pembatasan Sosial Berskala Besar) dan stimulus fiskal serta berlanjutnya kebijakan moneter, restrukturisasi dunia usaha, dan sarana digital dalam transaksi ekonomi dalam mendukung UMKM. BI juga melihat perbaikan ekonomi mulai terlihat di China yang didorong dampak pandemi yang kian berkurang. Walaupun begitu, bank sentral masih mewaspadai adanya tensi geopolitik di global. Namun, kabar dari ketidakpastian seputar kapan pandemi berakhir masih membuat pasar keuangan diterpa kecemasan. Ke depan beberapa faktor yang menggerakkan harga saham global termasuk di dalam negeri adalah perkembangan pandemi Covid-19, perkembangan terbaru vaksin, stimulus lanjutan dari pemerintah dan bank sentral hingga tensi geopolitik AS-China. Mengacu data BEI, hingga akhir pekan lalu total kapitalisasi pasar saham-saham big cap mencapai Rp 2.883 triliun naik tipis dari posisi sebelumnya Rp 2.871 triliun seiring dengan IHSG yang menguat tipis pekan lalu.   Berdasarkan data di atas, rata-rata kapitalisasi pasar mengalami penurunan, hanya 2 emiten yang mengalami kenaikan signifikan. Penurunan kapitalisasi pasar ini disebabkan karena beberapa emiten mengalami penurunan harga saham dan volume transaksi yang diperdagangkan pekan lalu. Pada pekan lalu, seperti PT Bank Mandiri Tbk (BMRI) turun 1,23% secara mingguan. Sementara PT Astra International Tbk (ASII) turun 0,47% secara mingguan.   Sampai saat ini, belum terjadi perubahan posisi dari pekan ini dengan pekan sebelumnya, di mana PT Bank Central Asia Tbk (BBCA) masih kokoh di puncak klasemen dengan kapitalisasi pasar Rp 780 triliun jauh melebihi emiten-emiten yang kapitalisasi pasarnya naik Rp 7 triliun. Kapitalisasi pasar yang berhasil meningkat signifikan salah satunya adalah PT Bank BRI Tbk (BBRI) yang berhasil meningkat Rp 5 triliun walaupun laba BBRI mengalami penurunan sebesar 37% secara month to month (mtm). Market cap adalah nilai pasar dari sebuah emiten, perkalian antara harga saham dengan jumlah saham beredar di pasar, semakin besar nilai market cap emiten maka pengaruh pergerakannya juga besar terhadap pergerakan IHSG. TIM RISET CNBC INDONESIA  ;24-08-2020;https://www.cnbcindonesia.com/market/20200824112406-17-181462/market-cap-bca-menuju-rp-800-t-kokoh-berada-di-puncak;indeks harga saham gabungan (ihsg) pekan lalu mengalami penguatan tipis . penguatan ihsg tersebut tidak mempengaruhi perubahan 10 saham berkapitalisasi terbesar seperti pekan lalu. pada periode 18 agustus-19 agustus 2020, ihsg menguat 0,48% dan ditutup di level 5.272,81. sebenarnya ihsg sempat mencatatkan penguatan, tetapi pada perdagangan terakhir hari rabu (19/8/2020) ihsg melemah 0,42%. pada pekan lalu yang hanya 2 hari perdagangan, investor asing melakukan aksi jual bersih di seluruh pasar mencapai rp 325 miliar. dari dalam negeri bank indonesia (bi) pekan lalu memutuskan untuk tetap mempertahankan suku bunga acuan bi 7-day reverse repo rate (bi7drr) di posisi 4%. gubernur bank indonesia, perry warjiyo menilai tersebut masih konsisten untuk mendorong pemulihan ekonomi di masa pandemi covid-19. bi menilai ekonomi indonesia triwulan iii-2020 akan membaik sejalan dengan relaksasi psbb (pembatasan sosial berskala besar) dan stimulus fiskal serta berlanjutnya kebijakan moneter, restrukturisasi dunia usaha, dan sarana digital dalam transaksi ekonomi dalam mendukung umkm. bi juga melihat perbaikan ekonomi mulai terlihat di china yang didorong dampak pandemi yang kian berkurang. walaupun begitu, bank sentral masih mewaspadai adanya tensi geopolitik di global. namun, kabar dari ketidakpastian seputar kapan pandemi berakhir masih membuat pasar keuangan diterpa kecemasan. ke depan beberapa faktor yang menggerakkan harga saham global termasuk di dalam negeri adalah perkembangan pandemi covid-19, perkembangan terbaru vaksin, stimulus lanjutan dari pemerintah dan bank sentral hingga tensi geopolitik as-china. mengacu data bei, hingga akhir pekan lalu total kapitalisasi pasar saham-saham big cap mencapai rp 2.883 triliun naik tipis dari posisi sebelumnya rp 2.871 triliun seiring dengan ihsg yang menguat tipis pekan lalu. berdasarkan data di atas, rata-rata kapitalisasi pasar mengalami penurunan, hanya 2 emiten yang mengalami kenaikan signifikan. penurunan kapitalisasi pasar ini disebabkan karena beberapa emiten mengalami penurunan harga saham dan volume transaksi yang diperdagangkan pekan lalu. pada pekan lalu, seperti pt bank mandiri tbk (bmri) turun 1,23% secara mingguan. sementara pt astra international tbk (asii) turun 0,47% secara mingguan. sampai saat ini, belum terjadi perubahan posisi dari pekan ini dengan pekan sebelumnya, di mana pt bank central asia tbk (bbca) masih kokoh di puncak klasemen dengan kapitalisasi pasar rp 780 triliun jauh melebihi emiten-emiten yang kapitalisasi pasarnya naik rp 7 triliun. kapitalisasi pasar yang berhasil meningkat signifikan salah satunya adalah pt bank bri tbk (bbri) yang berhasil meningkat rp 5 triliun walaupun laba bbri mengalami penurunan sebesar 37% secara month to month (mtm). market cap adalah nilai pasar dari sebuah emiten, perkalian antara harga saham dengan jumlah saham beredar di pasar, semakin besar nilai market cap emiten maka pengaruh pergerakannya juga besar terhadap pergerakan ihsg. tim riset cnbc indonesia 
