Title;Content;Date;URL;Cleaned Article
             Jangan Kaget! Harga Penawaran Cash Saham BRIS Cuma Rp 781            ;Jakarta, CNBC Indonesia - Pemegang saham tiga bank syariah BUMN akhirnya mengumumkan kejelasan skema merger PT Bank BRISyariah Tbk(BRIS), PT Bank Syariah Mandiri (BSM), dan PT Bank BNISyariah (BNIS). Berdasarkan prospektus yang disampaikan pada Rabu ini (21/10/2020), pemegang saham publik BRIS nantinya akan terdilusi menjadi tinggal 4,4% dalam proses merger bank syariah BUMN. Adapun PT Bank Mandiri Tbk (BMRI) akan menjadi pemegang saham dominan BRIS dengan kepemilikan hingga 51% dalam skema penggabungan atau merger tiga bank syariah BUMN ini. BRIS akan menjadi bank yang menerima hasil penggabungan (surviving entity).  Berdasarkan keterangan resmi pemerintah, komposisi pemegang saham pada lainnya di BRIS adalah PT Bank Negara Indonesia Tbk. (BBNI) 25,0%, PT Bank Rakyat Indonesia Tbk (BBRI) 17,4%, DPLK BRI-Saham Syariah 2% dan investor publik 4,4%. Namun apabila ada pemegang saham minoritas yang tidak setuju akan merger ini, BRI atau pihak lain yang ditunjuk BRI siap membeli saham pemegang saham minoritas (cash offer) tersebut di harga Rp 781,29 per saham BRIS yang merupakan nilai pasar wajar BRIS.   Nilai wajar itu sebagaimana dinilai oleh KJPP Suwendho, Rinaldy dan Rekan, jauh di bawah harga pasar BRIS yang saat ini diperdagangkan di harga Rp 1.465/unit. Para pemegang saham minoritas BRIS yang berhak untuk meminta sahamnya dibeli adalah para pemegang saham yang tercatat dalam Daftar Pemegang Saham BRIS pada 19 November 2020, yaitu satu hari kerja sebelum pemanggilan RUPSLB. Periode permohonan penjualan saham dimulai dari tanggal 17 Desember 2020 hingga 5 Januari 2021. Merespons hal ini sendiri terpantau saham BRIS hari ini diperdagangkan di zona merah anjlok 2,33% ke level Rp 1.465/unit, jelang penutupan sesi I.  TIM RISET CNBC INDONESIA ;21-10-2020;https://www.cnbcindonesia.com/market/20201021101237-17-195933/jangan-kaget-harga-penawaran-cash-saham-bris-cuma-rp-781;jakarta, cnbc indonesia - pemegang saham tiga bank syariah bumn akhirnya mengumumkan kejelasan skema merger pt bank brisyariah tbk(bris), pt bank syariah mandiri (bsm), dan pt bank bnisyariah (bnis). berdasarkan prospektus yang disampaikan pada rabu ini (21/10/2020), pemegang saham publik bris nantinya akan terdilusi menjadi tinggal 4,4% dalam proses merger bank syariah bumn. adapun pt bank mandiri tbk (bmri) akan menjadi pemegang saham dominan bris dengan kepemilikan hingga 51% dalam skema penggabungan atau merger tiga bank syariah bumn ini. bris akan menjadi bank yang menerima hasil penggabungan (surviving entity). berdasarkan keterangan resmi pemerintah, komposisi pemegang saham pada lainnya di bris adalah pt bank negara indonesia tbk. (bbni) 25,0%, pt bank rakyat indonesia tbk (bbri) 17,4%, dplk bri-saham syariah 2% dan investor publik 4,4%. namun apabila ada pemegang saham minoritas yang tidak setuju akan merger ini, bri atau pihak lain yang ditunjuk bri siap membeli saham pemegang saham minoritas (cash offer) tersebut di harga rp 781,29 per saham bris yang merupakan nilai pasar wajar bris. nilai wajar itu sebagaimana dinilai oleh kjpp suwendho, rinaldy dan rekan, jauh di bawah harga pasar bris yang saat ini diperdagangkan di harga rp 1.465/unit. para pemegang saham minoritas bris yang berhak untuk meminta sahamnya dibeli adalah para pemegang saham yang tercatat dalam daftar pemegang saham bris pada 19 november 2020, yaitu satu hari kerja sebelum pemanggilan rupslb. periode permohonan penjualan saham dimulai dari tanggal 17 desember 2020 hingga 5 januari 2021. merespons hal ini sendiri terpantau saham bris hari ini diperdagangkan di zona merah anjlok 2,33% ke level rp 1.465/unit, jelang penutupan sesi i. tim riset cnbc indonesia 
             Saham BRIS Mentok ARB Terus, Aku Kudu Piye?            ;Jakarta, CNBC Indonesia- Harga saham PT Bank BRISyariah Tbk (BRIS) kembali terkoreksi lagi, bahkan koreksi terjadi sejak awal perdagangan Kamis (22/10/20) yakni minus 6,81% menyentuh level auto reject bawah (ARB) di level Rp 1.300/saham. Bahkan pada penutupan perdagangan kemarin, antrean saham BRIS yang menanti di level ARB di harga Rp 1.300/unit sebanyak 1,22 juta lot atau senilai Rp 159 miliar yang mengindikasikan koreksi akan kembali terjadi pada perdagangan Jumat ini (23/10). Data BEI mencatat, koreksi ini melanjutkan penurunan tajam saham BRIS pada perdagangan Rabu yang juga kena batas bawah maksimal penurunan sebesar 7%, di harga Rp 1.395/saham, dampak dari harga cash offer (penawaran pembelian saham oleh pengendali dalam rangka merger bank syariah BUMN) saham BRIS yang hanya berada di kisaran Rp 781/saham. Harga Rp 781/saham ini didapatkan dari valuasi harga wajar BRIS oleh Kantor Jasa Penilai Publik (KJPP) Suwendho, Rinaldy dan Rekan. Tim Riset CNBC Indonesia menilai, harga BRIS di saat ini sudah jauh di atas harga wajarnya sehingga terjadinya koreksi.   BRIS saat ini memang dalam proses merger menjadi survivor bank dengan menerima penggabungan dua bank syariah BUMN lainnya yakni PT Bank Syariah Mandiri (BSM) dan PT Bank BNI Syariah (BNIS) dengan target efektif rampung pada 1 Februari 2021. Dengan terkoreksinya harga sahan BRIS menyentuh level ARB dua hari berturut-turut tentunya membuat para investor bertanya-tanya apa yang sebaiknya dilakukan. Bagaimana prospek saham BRIS, dan kira-kira ke mana gerak saham BRIS selanjutnya di tengah proses merger ini? Koreksi saham BRIS memang tidak lain dan tidak bukan karena menurut KJPP harga wajarnya hanya berada di kisaran Rp 781/saham. Memang setelah melesat tinggi harga saham BRIS dengan valuasi harga pasar dibanding nilai buku (PBV, price to book value) sudah tergolong premium yakni 2,42 kali. Maka ketika KJPP merilis bahwa harga wajarnya hanyalah Rp 781/saham, sontak pasar merespons dan harga pasar BRIS bergerak ke arah harga wajarnya. Bahkan pascamerger, nilai buku BRIS akan kembali tergerus karena valuasi KJPP untuk harga wajar BSM dengan PBV sebesar angka 1,64 kali dan BNIS dengan harga wajar di PBV sebesar 1,48 kali lebih mahal daripada harga wajar BRIS dengan PBV sebesar 1,45 kali. Ini menunjukkan secara proporsional valuasi harga wajar BRIS lebih murah daripada valuasi harga BSM dan BNIS sehingga PBV BRIS saat ini akan tergerus. Menurut perhitungan Tim Riset CNBC Indonesia nilai buku BRIS yang telah dilebur berpotensi tergerus ke angka Rp 499/unit yang mencerminkan PBV sebesar 2,5 kali di harga saat ini tergolong lebih mahal apabila dibandingkan dengan rata-rata PBV industri perbankan di angka 1,5 kali.   Akan tetapi perlu diingat yang pertama, valuasi wajar KJPP untuk saham BRIS di harga Rp 781/saham adalah valuasi per Juni 2020 dengan asumsi kegiatan usaha BRIS secara berkesinambungan (going concern). Artinya valuasi wajar BRIS tersebut per kuartal kedua 2020 dan bukan valuasi saat ini di bulan Oktober. Tentu saja valuasi Oktober sudah berubah, dan valuasi tersebut merupakan valuasi BRIS going concern saja tanpa mengakomodasi prospek usaha BRIS yang nantinya akan dilebur menjadi perbankan syariah terbesar di Indonesia dan memiliki ekspektasi usaha dan pertumbuhan yang cerah. Selanjutnya perlu diingat, meskipun nantinya setelah dimerger nilai buku BRIS kemungkinan tergerus. Akan tetapi nantinya laba per saham BRIS juga berpotensi naik karena BSM dan BNIS yang dilebur lebih profitable dibanding BRIS. Di posisi saat ini, dengan laba bersih sebesar Rp 117 miliar maka laba per saham (earnings per share/EPS) pemegang saham BRIS jika disetahunkan adalah Rp 24/unit. Setelah dilebur, total laba bersih 'Bank Amanah' (nama baru bank hasil merger dari kabar pasar) akan sebesar Rp 1,1 triliun atau apabila disetahunkan akan berada di angka Rp 2,2 triliun, yang merepresentasikan EPS sebesar Rp 53,8/unit atau kenaikan sebesar 124,16%. EPS tersebut merepresentasikan valuasi harga pasar dibandingkan dengan laba bersih (PER) di angka 24,16 kali memang masih lebih mahal apabila dibandingkan dengan rata-rata industri perbankan di angka 10,4 kali. Meskipun demikian, walaupun valuasinya sudah berada di atas rata-rata industri baik menggunakan metode PBV dan PER, akan tetapi prospek pertumbuhan bank syariah hasil merger yang cemerlang inilah yang menyebabkan banyak investor mengkategorikan BRIS sebagai growth stock alias saham dengan prospek usaha ke depan yang sangat pesat. Hal ini mengingat bank syariah hasil merger ini nantinya akan menguasai pangsa pasar perbankan syariah baik dari segi aset, pembiayaan, maupun pengumpulan Dana Pihak Ketiga (DPK). Dengan demikian, apabila investor ingin menyimpan saham ini dalam jangka panjang, masih sangat menarik.  Akan tetapi apabila anda bukanlah seorang investor melainkan seorang trader dengan timeframe pendek hingga menengah maka ada baiknya untuk keluar terlebih dahulu. Pasalnya, saat ini BRIS sedang dalam tren penurunan setelah jatuh ke level ARB-nya selama 2 hari berturut-turut dan menunjukkan akan adanya tren koreksi lanjutan.  TIM RISET CNBC INDONESIA ;23-10-2020;https://www.cnbcindonesia.com/market/20201022163738-17-196400/saham-bris-mentok-arb-terus-aku-kudu-piye;jakarta, cnbc indonesia- harga saham pt bank brisyariah tbk (bris) kembali terkoreksi lagi, bahkan koreksi terjadi sejak awal perdagangan kamis (22/10/20) yakni minus 6,81% menyentuh level auto reject bawah (arb) di level rp 1.300/saham. bahkan pada penutupan perdagangan kemarin, antrean saham bris yang menanti di level arb di harga rp 1.300/unit sebanyak 1,22 juta lot atau senilai rp 159 miliar yang mengindikasikan koreksi akan kembali terjadi pada perdagangan jumat ini (23/10). data bei mencatat, koreksi ini melanjutkan penurunan tajam saham bris pada perdagangan rabu yang juga kena batas bawah maksimal penurunan sebesar 7%, di harga rp 1.395/saham, dampak dari harga cash offer (penawaran pembelian saham oleh pengendali dalam rangka merger bank syariah bumn) saham bris yang hanya berada di kisaran rp 781/saham. harga rp 781/saham ini didapatkan dari valuasi harga wajar bris oleh kantor jasa penilai publik (kjpp) suwendho, rinaldy dan rekan. tim riset cnbc indonesia menilai, harga bris di saat ini sudah jauh di atas harga wajarnya sehingga terjadinya koreksi. bris saat ini memang dalam proses merger menjadi survivor bank dengan menerima penggabungan dua bank syariah bumn lainnya yakni pt bank syariah mandiri (bsm) dan pt bank bni syariah (bnis) dengan target efektif rampung pada 1 februari 2021. dengan terkoreksinya harga sahan bris menyentuh level arb dua hari berturut-turut tentunya membuat para investor bertanya-tanya apa yang sebaiknya dilakukan. bagaimana prospek saham bris, dan kira-kira ke mana gerak saham bris selanjutnya di tengah proses merger ini? koreksi saham bris memang tidak lain dan tidak bukan karena menurut kjpp harga wajarnya hanya berada di kisaran rp 781/saham. memang setelah melesat tinggi harga saham bris dengan valuasi harga pasar dibanding nilai buku (pbv, price to book value) sudah tergolong premium yakni 2,42 kali. maka ketika kjpp merilis bahwa harga wajarnya hanyalah rp 781/saham, sontak pasar merespons dan harga pasar bris bergerak ke arah harga wajarnya. bahkan pascamerger, nilai buku bris akan kembali tergerus karena valuasi kjpp untuk harga wajar bsm dengan pbv sebesar angka 1,64 kali dan bnis dengan harga wajar di pbv sebesar 1,48 kali lebih mahal daripada harga wajar bris dengan pbv sebesar 1,45 kali. ini menunjukkan secara proporsional valuasi harga wajar bris lebih murah daripada valuasi harga bsm dan bnis sehingga pbv bris saat ini akan tergerus. menurut perhitungan tim riset cnbc indonesia nilai buku bris yang telah dilebur berpotensi tergerus ke angka rp 499/unit yang mencerminkan pbv sebesar 2,5 kali di harga saat ini tergolong lebih mahal apabila dibandingkan dengan rata-rata pbv industri perbankan di angka 1,5 kali. akan tetapi perlu diingat yang pertama, valuasi wajar kjpp untuk saham bris di harga rp 781/saham adalah valuasi per juni 2020 dengan asumsi kegiatan usaha bris secara berkesinambungan (going concern). artinya valuasi wajar bris tersebut per kuartal kedua 2020 dan bukan valuasi saat ini di bulan oktober. tentu saja valuasi oktober sudah berubah, dan valuasi tersebut merupakan valuasi bris going concern saja tanpa mengakomodasi prospek usaha bris yang nantinya akan dilebur menjadi perbankan syariah terbesar di indonesia dan memiliki ekspektasi usaha dan pertumbuhan yang cerah. selanjutnya perlu diingat, meskipun nantinya setelah dimerger nilai buku bris kemungkinan tergerus. akan tetapi nantinya laba per saham bris juga berpotensi naik karena bsm dan bnis yang dilebur lebih profitable dibanding bris. di posisi saat ini, dengan laba bersih sebesar rp 117 miliar maka laba per saham (earnings per share/eps) pemegang saham bris jika disetahunkan adalah rp 24/unit. setelah dilebur, total laba bersih 'bank amanah' (nama baru bank hasil merger dari kabar pasar) akan sebesar rp 1,1 triliun atau apabila disetahunkan akan berada di angka rp 2,2 triliun, yang merepresentasikan eps sebesar rp 53,8/unit atau kenaikan sebesar 124,16%. eps tersebut merepresentasikan valuasi harga pasar dibandingkan dengan laba bersih (per) di angka 24,16 kali memang masih lebih mahal apabila dibandingkan dengan rata-rata industri perbankan di angka 10,4 kali. meskipun demikian, walaupun valuasinya sudah berada di atas rata-rata industri baik menggunakan metode pbv dan per, akan tetapi prospek pertumbuhan bank syariah hasil merger yang cemerlang inilah yang menyebabkan banyak investor mengkategorikan bris sebagai growth stock alias saham dengan prospek usaha ke depan yang sangat pesat. hal ini mengingat bank syariah hasil merger ini nantinya akan menguasai pangsa pasar perbankan syariah baik dari segi aset, pembiayaan, maupun pengumpulan dana pihak ketiga (dpk). dengan demikian, apabila investor ingin menyimpan saham ini dalam jangka panjang, masih sangat menarik. akan tetapi apabila anda bukanlah seorang investor melainkan seorang trader dengan timeframe pendek hingga menengah maka ada baiknya untuk keluar terlebih dahulu. pasalnya, saat ini bris sedang dalam tren penurunan setelah jatuh ke level arb-nya selama 2 hari berturut-turut dan menunjukkan akan adanya tren koreksi lanjutan. tim riset cnbc indonesia 
             Jangan Kaget! Selama Pandemi Banyak yang Jadi Investor Saham            ;"Jakarta, CNBC Indonesia - Di tengah pandemi virus Corona, perusahaan sekuritas justru mencatatkan penambahan investor baru. Direktur Retail dan Treasury Mandiri Sekuritas, Theodora VN Manik mengatakan, di masa pandemi, hampir 95% nasabah ritel melakukan tarnsaksi secara daring. Perseroan juga mencatatkan peningkatan investor baru lebih dari 50% dibanding periode yang sama tahun lalu. ""Nilai transaksi harian nasabah retail juga meningkat sekitar 70% secara tahunan dibandingkan dengan periode yang sama tahun lalu,"" lanjut Theodora, dalam siaran pers, Jumat (23/10/2020). Sampai dengan enam bulan pertama tahun 2020, Mandiri Sekuritas mencatatkan peningkatan sebanyak lebih dari 26.000 nasabah baru untuk segmen ritel menjadi total 145 ribu nasabah.    Hingga penghujung tahun ini, Mansek menargetkan penambahan investor baru secara akumulasi menjadi 150 ribu nasabah. Sampai dengan sisa tahun ini, perseroan menargetkan sebanyak 150.000 nasabah. Kenaikan investor ritel ini juga dialami di negara-negara kawasan Asia Tenggara. Pasalnya, alokasi dana masyarakat yang tadinya konsumtif, di saat pandemi mulai diarahkan untuk berinvestasi di pasar modal. Menurut Direktur Perdagangan dan Anggota Bursa BEI, Laksono Widodo di masa pandemi, terjadi peningkatan transaksi dari investor ritel domestik. Hal ini menjadi katalis yang positif untuk meredam tekanan pasar saham yang terguncang arus modal keluar yang begitu besar sejak awal tahun ini. ""Investor ritel mendominasi rata-rata transaksi harian, 51% dari investor ritel dengan rata-rata nilai transaksi harian Rp 6,3 triliun,"" ujar Laksono, dalam diskusi ""The Role of Retail Investors in Maintaining Market Stability amid Pandemic Situation"" secara daring, Rabu (21/10/2020). Menariknya, dari sisi demografi, investor ritel tersebut sebanyak 47,57% didominasi dari kalangan generasi milenial atau berusia di bawah 30 tahun. Beberapa hal yang menjadi alasan transaksi ritel meningkat karena mereka memiliki uang tunai berlebih yang mulai diinvestasikan di pasar saham di tengah era suku bunga rendah. Peningkatan juga terjadi di Bursa Saham Thailand (SET). Menurut Senior Executive Vice President, Corporate Strategy The Stock Exchange of Thailand Saraphol Tulayasathien, nilai rerata transaksi harian di Bursa Thailand naik 19% dari 1,707 juta US$ 2.037 juta US$. ""Bursa Thailand juga mencatat adanya penambahan sebanyak 230 ribu investor baru sampai dengan Agustus 2020,"" imbuhnya lagi.   Janice Kan, Managing Director, Head of Markets, Equities at SGX menuturkan, Bursa Singapura juga mencatat kenaaikan partisipasi investor ritel menjadi 20% dari sebelumnya 15% selama pandemi. Hal ini juga turut memberikan andil terhadap naiknya rata-rata nilai transaksi harian di di Bursa Negeri Singa tersebut. ""Terjadi peningkatan nilai transaksi harian sebesar 40%. Sedangkan pembukaan rekening efek mengalami kenaikan sebanyak 25%,"" katanya. Kenaikan nilai transaksi sampai dua digit juga terjadi di Bursa Malaysia. Hal ini, menurut Mohd Zulkifli Mustafa, Director, Corporate Strategy, Bursa Malaysia Berhad tak lain disebabkan meningkatnya partisipasi dari investor ritel.";23-10-2020;https://www.cnbcindonesia.com/market/20201023134938-17-196606/jangan-kaget-selama-pandemi-banyak-yang-jadi-investor-saham;"di tengah pandemi virus corona, perusahaan sekuritas justru mencatatkan penambahan investor baru. direktur retail dan treasury mandiri sekuritas, theodora vn manik mengatakan, di masa pandemi, hampir 95% nasabah ritel melakukan tarnsaksi secara daring. perseroan juga mencatatkan peningkatan investor baru lebih dari 50% dibanding periode yang sama tahun lalu. ""nilai transaksi harian nasabah retail juga meningkat sekitar 70% secara tahunan dibandingkan dengan periode yang sama tahun lalu,"" lanjut theodora, dalam siaran pers, jumat (23/10/2020). sampai dengan enam bulan pertama tahun 2020, mandiri sekuritas mencatatkan peningkatan sebanyak lebih dari 26.000 nasabah baru untuk segmen ritel menjadi total 145 ribu nasabah. hingga penghujung tahun ini, mansek menargetkan penambahan investor baru secara akumulasi menjadi 150 ribu nasabah. sampai dengan sisa tahun ini, perseroan menargetkan sebanyak 150.000 nasabah. kenaikan investor ritel ini juga dialami di negara-negara kawasan asia tenggara. pasalnya, alokasi dana masyarakat yang tadinya konsumtif, di saat pandemi mulai diarahkan untuk berinvestasi di pasar modal. menurut direktur perdagangan dan anggota bursa bei, laksono widodo di masa pandemi, terjadi peningkatan transaksi dari investor ritel domestik. hal ini menjadi katalis yang positif untuk meredam tekanan pasar saham yang terguncang arus modal keluar yang begitu besar sejak awal tahun ini. ""investor ritel mendominasi rata-rata transaksi harian, 51% dari investor ritel dengan rata-rata nilai transaksi harian rp 6,3 triliun,"" ujar laksono, dalam diskusi ""the role of retail investors in maintaining market stability amid pandemic situation"" secara daring, rabu (21/10/2020). menariknya, dari sisi demografi, investor ritel tersebut sebanyak 47,57% didominasi dari kalangan generasi milenial atau berusia di bawah 30 tahun. beberapa hal yang menjadi alasan transaksi ritel meningkat karena mereka memiliki uang tunai berlebih yang mulai diinvestasikan di pasar saham di tengah era suku bunga rendah. peningkatan juga terjadi di bursa saham thailand (set). menurut senior executive vice president, corporate strategy the stock exchange of thailand saraphol tulayasathien, nilai rerata transaksi harian di bursa thailand naik 19% dari 1,707 juta us$ 2.037 juta us$. ""bursa thailand juga mencatat adanya penambahan sebanyak 230 ribu investor baru sampai dengan agustus 2020,"" imbuhnya lagi. janice kan, managing director, head of markets, equities at sgx menuturkan, bursa singapura juga mencatat kenaaikan partisipasi investor ritel menjadi 20% dari sebelumnya 15% selama pandemi. hal ini juga turut memberikan andil terhadap naiknya rata-rata nilai transaksi harian di di bursa negeri singa tersebut. ""terjadi peningkatan nilai transaksi harian sebesar 40%. sedangkan pembukaan rekening efek mengalami kenaikan sebanyak 25%,"" katanya. kenaikan nilai transaksi sampai dua digit juga terjadi di bursa malaysia. hal ini, menurut mohd zulkifli mustafa, director, corporate strategy, bursa malaysia berhad tak lain disebabkan meningkatnya partisipasi dari investor ritel."
