Title;Content;Date;URL;Cleaned Article
             Warren Buffett vs Lo Kheng Hong, Ini Portofolio Saham Mereka            ;Jakarta, CNBC Indonesia - Investor kawakan global, Warren Buffett, baru saja membuat geger jagat pasar modal di seantero dunia. Di masa pandemi ini investor saham tersukses ini mulai bergerak belanja saham setelah sebelumnya hanya aktif menjual saham maskapai penerbangan. Dalam keterbukaan yang diterbitkan oleh badan pengawas Securities and Exchange Commission (SEC) alias OJK-nya AS per 30 Juni 2020, disebutkan bahwa Berkshire Hathaway, perusahaan investasi yang dikendalikan oleh Buffett, melego saham bank JPMorgan Chase, Goldman Sachs, Wells Fargo, bahkan institusi keuangan lain seperti Visa, MasterCard, Bank of New York, dan PNC Financial. Hasil penjualan saham-saham institusi keuangan tersebut ternyata dibelanjakan menjadi saham pertambangan emas Barrick Gold oleh Warren Buffett selama periode April sampai Juni 2020. Banyak yang kaget terhadap keputusan Warren Buffet, sebab Barrick Gold merupakan saham di sektor pertambangan emas yang pertama kali di beli oleh pria dengan julukan Peramal dari Omaha tersebut. Buffett sendiri terkenal sejak dahulu sangat tidak tertarik untuk berinvestasi emas. Di Tanah Air, ada nama Lo Kheng Hong, investor kawakan dan sukses serta seringkali disejajarkan dengan Buffett. Bahkan pelaku pasar menjulukinya Warren Buffett-nya Indonesia. Lo Kheng Hong yang dikenal sebagai tipe investor value investing ini pun mulai belanja. Data pemegang saham yang dipublikasikan Kustodian Sentral Efek Indonesia (KSEI) di situs Bursa Efek Indonesia (BEI) menunjukkan, Lo Kheng Hong membeli sebanyak 942.184.700 saham PT Global Mediacom Tbk (BMTR) atau mewakili sebanyak 6,14% saham, tercatat per 14 Agustus 2020, dari sebelumnya nihil. Lo Kheng Hong dan Warren Buffett memang sama-sama bertipe value investing, tipe investor saham berbasis nilai. Para value investor suka mencari saham-saham yang salah harga, alias kondisi ketika nilai intrinsik saham lebih tinggi daripada nilai pasarnya.  Baik Buffett maupun Lo Kheng, keduanya tergolong sukses. Untuk Buffett, tentu saja tidak perlu lagi diragukan kesuksesanya karena menurut majalah Forbes, Buffett adalah orang terkaya ke 7 di dunia saat ini. Sedangkan untuk Lo Kheng Hong, kisah suksesnya di dunia saham sudah sangat terkenal, tercatat banyak saham-saham yang pernah dibeli Lo Kheng Hong naik ratusan hingga ribuan persen. Tentu saja kesuksesan kedua investor tersebut membuat orang-orang bertanya, sebenarnya berapa kekayaan Warren Buffett dan Lo Kheng Hong, dan portofolio saham apa saja yang mereka pegang? Berikut rangkuman dari Tim Riset CNBC Indonesia.  Tercatat per 30 Juni 2020, portofolio saham terbesar yang dimiliki oleh Berkshire Hathaway, perusahaan investasi yang dimiliki oleh Buffett, adalah saham di sektor teknologi yakni Apple Inc. (AAPL) yang dikoleksi oleh Buffett sebanyak 245 juta saham senilai US$ 89,5 miliar atau Rp 1.298 triliun (kurs Rp 14.500/US$). Saham AAPL sendiri memiliki porsi sebanyak 44,2% dari total portofolio Berkshire Hathaway. Selama tahun berjalan sendiri saham AAPL sudah reli sebesar 70,23% dan menjadi sumber pundi-pundi penghasilan Berkshire Hathaway yang terbesar. Selanjutnya, walaupun baru saja melego berbagai saham di sektor finansial ternyata proporsi saham terbesar kedua di portofolio Berkshire Hathaway masih datang dari sektor finansial sebesar 10,85% yakni saham Bank of America Corp. (BAC) dengan total sebanyak 925 juta saham senilai US$ 21,9 miliar atau Rp 318 triliun. Setelah melihat portofolio Berkshire Hathaway, bagaimana dengan kekayaan pribadi Warren Buffett? Dilansir dari Forbes kekayaan Warren Buffett adalah sebesar US$ 78,4 miliar atau Rp 1.138 triliun yang sebagian besar datang dari kepemilikan saham Berkshire Hathaway miliknya. Bagaimana dengan Lo Kheng Hong ? Ternyata, walaupun tidak se-tajir Warren Buffett, kekayaan Lo Kheng Hong tidak bisa dipandang sebelah mata apalagi untuk ukuran orang Indonesia.  Tercatat per 14 Agustus 2020, Lo memegang saham induk usaha MNC Group, BMTR sebanyak 942 juta saham senilai Rp 295 miliar.  Selanjutnya Lo juga memegang saham PT Petrosea Tbk (PTRO). Anak usaha PT Indika Energy Tbk (INDY) ini sahamnya dikoleksi Lo sebanyak 151 juta saham senilai Rp 289 miliar per 31 Juli 2020. Terakhir tercatat Lo juga memiliki saham PT Mitrabahtera Segara Sejati Tbk (MBSS), masih Grup Indika, sebanyak 101 juta saham senilai Rp 41 miliar per 31 Juli 2020. Apabila mempergunakan data di atas maka kekayaan Lo Kheng Hong ditaksir mencapai paling tidak Rp 625 miliar. Akan tetapi hal yang perlu menjadi catatan tentunya adalah saham-saham di atas hanyalah saham yang kepemilikan Lo Kheng Hong di atas 5% sehingga wajib dilaporkan kepada Kustodian Sentral Efek Indonesia (KSEI). Hal ini menyebabkan saham-saham Lo Kheng Hong yang kepemilikanya di bawah 5% tidak terpantau, seperti rumor yang beredar di kalangan para pelaku pasar bahwa Lo memegang saham INDY dengan nominal cukup besar meskipun tidak mencapai 5%. Selain itu angka tersebut juga tentunya tidak termasuk aset non-saham Lo Kheng Hong seperti rumah dan ruko yang dimiliki pria berumur 61 tahun ini.  TIM RISET CNBC INDONESIA ;24-08-2020;https://www.cnbcindonesia.com/market/20200824135921-17-181532/warren-buffett-vs-lo-kheng-hong-ini-portofolio-saham-mereka;jakarta, cnbc indonesia - investor kawakan global, warren buffett, baru saja membuat geger jagat pasar modal di seantero dunia. di masa pandemi ini investor saham tersukses ini mulai bergerak belanja saham setelah sebelumnya hanya aktif menjual saham maskapai penerbangan. dalam keterbukaan yang diterbitkan oleh badan pengawas securities and exchange commission (sec) alias ojk-nya as per 30 juni 2020, disebutkan bahwa berkshire hathaway, perusahaan investasi yang dikendalikan oleh buffett, melego saham bank jpmorgan chase, goldman sachs, wells fargo, bahkan institusi keuangan lain seperti visa, mastercard, bank of new york, dan pnc financial. hasil penjualan saham-saham institusi keuangan tersebut ternyata dibelanjakan menjadi saham pertambangan emas barrick gold oleh warren buffett selama periode april sampai juni 2020. banyak yang kaget terhadap keputusan warren buffet, sebab barrick gold merupakan saham di sektor pertambangan emas yang pertama kali di beli oleh pria dengan julukan peramal dari omaha tersebut. buffett sendiri terkenal sejak dahulu sangat tidak tertarik untuk berinvestasi emas. di tanah air, ada nama lo kheng hong, investor kawakan dan sukses serta seringkali disejajarkan dengan buffett. bahkan pelaku pasar menjulukinya warren buffett-nya indonesia. lo kheng hong yang dikenal sebagai tipe investor value investing ini pun mulai belanja. data pemegang saham yang dipublikasikan kustodian sentral efek indonesia (ksei) di situs bursa efek indonesia (bei) menunjukkan, lo kheng hong membeli sebanyak 942.184.700 saham pt global mediacom tbk (bmtr) atau mewakili sebanyak 6,14% saham, tercatat per 14 agustus 2020, dari sebelumnya nihil. lo kheng hong dan warren buffett memang sama-sama bertipe value investing, tipe investor saham berbasis nilai. para value investor suka mencari saham-saham yang salah harga, alias kondisi ketika nilai intrinsik saham lebih tinggi daripada nilai pasarnya. baik buffett maupun lo kheng, keduanya tergolong sukses. untuk buffett, tentu saja tidak perlu lagi diragukan kesuksesanya karena menurut majalah forbes, buffett adalah orang terkaya ke 7 di dunia saat ini. sedangkan untuk lo kheng hong, kisah suksesnya di dunia saham sudah sangat terkenal, tercatat banyak saham-saham yang pernah dibeli lo kheng hong naik ratusan hingga ribuan persen. tentu saja kesuksesan kedua investor tersebut membuat orang-orang bertanya, sebenarnya berapa kekayaan warren buffett dan lo kheng hong, dan portofolio saham apa saja yang mereka pegang? berikut rangkuman dari tim riset cnbc indonesia. tercatat per 30 juni 2020, portofolio saham terbesar yang dimiliki oleh berkshire hathaway, perusahaan investasi yang dimiliki oleh buffett, adalah saham di sektor teknologi yakni apple inc. (aapl) yang dikoleksi oleh buffett sebanyak 245 juta saham senilai us$ 89,5 miliar atau rp 1.298 triliun (kurs rp 14.500/us$). saham aapl sendiri memiliki porsi sebanyak 44,2% dari total portofolio berkshire hathaway. selama tahun berjalan sendiri saham aapl sudah reli sebesar 70,23% dan menjadi sumber pundi-pundi penghasilan berkshire hathaway yang terbesar. selanjutnya, walaupun baru saja melego berbagai saham di sektor finansial ternyata proporsi saham terbesar kedua di portofolio berkshire hathaway masih datang dari sektor finansial sebesar 10,85% yakni saham bank of america corp. (bac) dengan total sebanyak 925 juta saham senilai us$ 21,9 miliar atau rp 318 triliun. setelah melihat portofolio berkshire hathaway, bagaimana dengan kekayaan pribadi warren buffett? dilansir dari forbes kekayaan warren buffett adalah sebesar us$ 78,4 miliar atau rp 1.138 triliun yang sebagian besar datang dari kepemilikan saham berkshire hathaway miliknya. bagaimana dengan lo kheng hong ? ternyata, walaupun tidak se-tajir warren buffett, kekayaan lo kheng hong tidak bisa dipandang sebelah mata apalagi untuk ukuran orang indonesia. tercatat per 14 agustus 2020, lo memegang saham induk usaha mnc group, bmtr sebanyak 942 juta saham senilai rp 295 miliar. selanjutnya lo juga memegang saham pt petrosea tbk (ptro). anak usaha pt indika energy tbk (indy) ini sahamnya dikoleksi lo sebanyak 151 juta saham senilai rp 289 miliar per 31 juli 2020. terakhir tercatat lo juga memiliki saham pt mitrabahtera segara sejati tbk (mbss), masih grup indika, sebanyak 101 juta saham senilai rp 41 miliar per 31 juli 2020. apabila mempergunakan data di atas maka kekayaan lo kheng hong ditaksir mencapai paling tidak rp 625 miliar. akan tetapi hal yang perlu menjadi catatan tentunya adalah saham-saham di atas hanyalah saham yang kepemilikan lo kheng hong di atas 5% sehingga wajib dilaporkan kepada kustodian sentral efek indonesia (ksei). hal ini menyebabkan saham-saham lo kheng hong yang kepemilikanya di bawah 5% tidak terpantau, seperti rumor yang beredar di kalangan para pelaku pasar bahwa lo memegang saham indy dengan nominal cukup besar meskipun tidak mencapai 5%. selain itu angka tersebut juga tentunya tidak termasuk aset non-saham lo kheng hong seperti rumah dan ruko yang dimiliki pria berumur 61 tahun ini. tim riset cnbc indonesia 
             Terungkap! Ternyata Ini Dia Pembeli Misterius Saham Ultrajaya            ;Jakarta, CNBC Indonesia -  Setelah saham PT Ultrajaya Milk Industry & Trading Company Tbk (ULTJ) sempat membuat heboh para pelaku pasar karena pada saham ini terjadi transaksi di pasar nego secara besar-besaran ini pada pekan lalu, hari ini terungkap siapa pembeli saham tersebut. Adalah Sabana Prawira Widjaja yang melakukan transaksi pembelian 13 juta lot saham ULTJ atau 1,3 miliar saham ULTJ lewat pasar nego. Sabana merupakan cucu dari pendiri dan pemilik perusahaan Ultrajaya Ahmad Prawirawidjaja. Menariknya status transaksi ini diminta oleh sang klien untuk diblokir sehingga tidak dapat ditransaksikan di pasar reguler sehingga ada kemungkinan pembelian saham ULTJ ini dilakukan sang pemilik dengan timeframe untuk jangka panjang. Sedangkan untuk counterparty alias sang penjual saham tersebut masih menjadi misteri, akan tetapi kabar yang beredar di kalangan para pelaku pasar bahwa penjualan kemarin kembali dilakukan oleh perusahaan asuransi jiwa dan dana pensiun (dapen) Grup Salim yakni PT Indolife Pensiontama yang melepas kepemilikannya di saham yang bergerak di sektor barang-barang konsumsi tersebut.   Sebelumnya PT Indolife Pensiontama sudah melepas sebagian kepemilikan saham ULTJ yakni sebanyak 66 juta lembar saham emiten konsumer yang memproduksi susu Ultra Milk dan Teh Kotak ini. Berdasarkan data laporan pemegang yang dipublikasikan perseroan di Bursa Efek Indonesia (BEI), disebutkan porsi Indolife sebelumnya mencapai 15,06% di saham ULTJ atau setara dengan 1.740.284.200 saham. Namun pada akhir Maret, nilainya berkurang sehingga menjadi 14,49% atau porsinya menjadi 1.674.284.200 atau berkurang 66 juta saham alias minus 0,57%.  Sebelumnya, Tercatat PT Shinhan Sekurtas (AH) melakukan pembelian di saham ULTJ lewat pasar nego sebanyak 13 juta lot di harga Rp 1.600/unit dengan nilai transaksi sebesar Rp 2,1 triliun. Pembelian ini sendiri dilakukan dari broker PT Net Sekuritas (OK) Selama 6 bulan terakhir sendiri broker AH sangat getol melakukan pembelian saham ULTJ di pasar nego, tercatat sejak 1 Maret 2020, AH sudah melakukan pembelian di saham ULTJ lewat pasar nego sebanyak 23,4 juta lot dengan harga Rp 1.600/unit dengan total nilai transaksi sebesar Rp 3,7 triliun. Sementara broker yang paling banyak melepas saham ULTJ adalah broker OK yang menjual ULTJ sebanyak 18,9 juta lot dengan harga rata-rata Rp 1584/unit dengan total nilai jual sebesar Rp 3 triliun dan PT Nikko Sekuritas Indonesia (RB) yang melepas sebanyak 12,5 juta lembar di harga rata-rata Rp 1580/unit dengan total nilai sebesar Rp 2 triliun.   Sebagai informasi, pasar negosiasi di BEI adalah satu dari tiga jenis transaksi di bursa saham. Jenis transaksi lain yaitu transaksi di pasar reguler atau pasar biasa, dan pasar tunai.  Transaksi di pasar reguler merupakan transaksi yang dilakukan menggunakan mekanisme tawar menawar berkelanjutan dan menjadi fasilitas bertransaksi dengan harga normal dan jumlah transaksi minimal 1 lot (100 saham). Sebaliknya, transaksi besar yang dilakukan di pasar negosiasi biasanya melibatkan pemilik atau pemegang saham besar yang tidak ingin merusak harga di pasar reguler. Harga dan jumlah transaksi bisa ditentukan oleh kedua belah pihak tanpa perlu mengikuti harga pasar. Sementara itu, pasar tunai adalah pasar di mana perdagangan efek di bursa dilaksanakan berdasarkan proses tawar-menawar secara lelang yang berkesinambungan (continuous auction market) oleh perusahaan efek anggota bursa (AB) melalui sistem JATS dan penyelesaiannya dilakukan pada hari bursa yang sama alias hari itu juga (T+0).  TIM RISET CNBC INDONESIA;18-08-2020;https://www.cnbcindonesia.com/market/20200818120433-17-180468/terungkap-ternyata-ini-dia-pembeli-misterius-saham-ultrajaya;jakarta, cnbc indonesia - setelah saham pt ultrajaya milk industry & trading company tbk (ultj) sempat membuat heboh para pelaku pasar karena pada saham ini terjadi transaksi di pasar nego secara besar-besaran ini pada pekan lalu, hari ini terungkap siapa pembeli saham tersebut. adalah sabana prawira widjaja yang melakukan transaksi pembelian 13 juta lot saham ultj atau 1,3 miliar saham ultj lewat pasar nego. sabana merupakan cucu dari pendiri dan pemilik perusahaan ultrajaya ahmad prawirawidjaja. menariknya status transaksi ini diminta oleh sang klien untuk diblokir sehingga tidak dapat ditransaksikan di pasar reguler sehingga ada kemungkinan pembelian saham ultj ini dilakukan sang pemilik dengan timeframe untuk jangka panjang. sedangkan untuk counterparty alias sang penjual saham tersebut masih menjadi misteri, akan tetapi kabar yang beredar di kalangan para pelaku pasar bahwa penjualan kemarin kembali dilakukan oleh perusahaan asuransi jiwa dan dana pensiun (dapen) grup salim yakni pt indolife pensiontama yang melepas kepemilikannya di saham yang bergerak di sektor barang-barang konsumsi tersebut. sebelumnya pt indolife pensiontama sudah melepas sebagian kepemilikan saham ultj yakni sebanyak 66 juta lembar saham emiten konsumer yang memproduksi susu ultra milk dan teh kotak ini. berdasarkan data laporan pemegang yang dipublikasikan perseroan di bursa efek indonesia (bei), disebutkan porsi indolife sebelumnya mencapai 15,06% di saham ultj atau setara dengan 1.740.284.200 saham. namun pada akhir maret, nilainya berkurang sehingga menjadi 14,49% atau porsinya menjadi 1.674.284.200 atau berkurang 66 juta saham alias minus 0,57%. sebelumnya, tercatat pt shinhan sekurtas (ah) melakukan pembelian di saham ultj lewat pasar nego sebanyak 13 juta lot di harga rp 1.600/unit dengan nilai transaksi sebesar rp 2,1 triliun. pembelian ini sendiri dilakukan dari broker pt net sekuritas (ok) selama 6 bulan terakhir sendiri broker ah sangat getol melakukan pembelian saham ultj di pasar nego, tercatat sejak 1 maret 2020, ah sudah melakukan pembelian di saham ultj lewat pasar nego sebanyak 23,4 juta lot dengan harga rp 1.600/unit dengan total nilai transaksi sebesar rp 3,7 triliun. sementara broker yang paling banyak melepas saham ultj adalah broker ok yang menjual ultj sebanyak 18,9 juta lot dengan harga rata-rata rp 1584/unit dengan total nilai jual sebesar rp 3 triliun dan pt nikko sekuritas indonesia (rb) yang melepas sebanyak 12,5 juta lembar di harga rata-rata rp 1580/unit dengan total nilai sebesar rp 2 triliun. sebagai informasi, pasar negosiasi di bei adalah satu dari tiga jenis transaksi di bursa saham. jenis transaksi lain yaitu transaksi di pasar reguler atau pasar biasa, dan pasar tunai. transaksi di pasar reguler merupakan transaksi yang dilakukan menggunakan mekanisme tawar menawar berkelanjutan dan menjadi fasilitas bertransaksi dengan harga normal dan jumlah transaksi minimal 1 lot (100 saham). sebaliknya, transaksi besar yang dilakukan di pasar negosiasi biasanya melibatkan pemilik atau pemegang saham besar yang tidak ingin merusak harga di pasar reguler. harga dan jumlah transaksi bisa ditentukan oleh kedua belah pihak tanpa perlu mengikuti harga pasar. sementara itu, pasar tunai adalah pasar di mana perdagangan efek di bursa dilaksanakan berdasarkan proses tawar-menawar secara lelang yang berkesinambungan (continuous auction market) oleh perusahaan efek anggota bursa (ab) melalui sistem jats dan penyelesaiannya dilakukan pada hari bursa yang sama alias hari itu juga (t+0). tim riset cnbc indonesia
             Konstruksi Tol Cibitung Ambruk, Begini Nasib Saham WSKT-WSBP            ;"Jakarta, CNBC Indonesia - Konstruksi di proyek pembangunan Jalan Tol Cibitung-Cilincing Seksi IV, Jakarta Utara ambruk. PT Cibitung Tanjung Priok Port Tollways (CTP) sebagai pengelola menginformasikan kejadian tersebut berlangsung pada saat kegiatan pengecoran pada Minggu, 16 Agustus 2020. Setelah kabar tersebut keluar, belum ada dampak signifikan terhadap pergerakan harga saham emiten konstruksi BUMN khususnya PT Waskita Karya Tbk (WSKT) dan juga PT Waskita Beton Precast Tbk (WSBP). CTP adalah Badan Usaha Jalan Tol (BUJT) yang berada di bawah naungan sekaligus sebagai anak perusahaan dari PT Waskita Toll Road (WTR) sebagai pemegang saham mayoritas. Komposisi pemegang saham perusahaan hingga 31 Desember 2017 terdiri dari Waskita Toll Road sebesar 55% dan PT Akses Pelabuhan Indonesia sebesar 45%. Data BEI mencatat, harga saham WSBP malah terpantau naik. Saham WSBP pada 13:50 WIB, Selasa (18/8/2020), diperdagangkan di zona hijau dengan kenaikan 2,37% ke level Rp 173/saham. Bahkan jelang penutupan sesi pertama, harga saham WSBP sempat naik ke angka Rp 175/saham. Total transaksi di saham WSBP hari ini sebesar Rp 17 miliar, dengan frekuensi sebanyak 2.777 kali dan volume sebanyak 101 juta saham. Sebulan terakhir, saham WSBP ambles 15,87%. Adapun saham WSKT naik 2,34% di level Rp 655/saham, dengan nilai transaksi Rp 33,13 miliar dengan volume perdagangan 50,29 juta saham. Sebulan terakhir saham WSKT minus 8,97%. Direktur Utama CTP, Thorry Hendrarto, menjelaskan bahwa kejadian ambruknya proyek tersebut berada di Seksi IV Kelurahan Marunda, Cilincing, Jakarta Utara. ""Penyebab utama kejadian tersebut saat ini sedang di evaluasi oleh PT Waskita Beton Precast selaku kontraktor dan pimpinan proyek PT Cibitung Tanjung Priok Tollways,"" ujar Thorry Hendrarto dalam keterangannya, dikutip CNBC Indonesia, Selasa (18/8/20). Sebelumnya, Waskita Beton Precast mencatat sebanyak 8 pekerja yang luka akibat ambruknya proyek tersebut.  ""Delapan orang dengan luka ringan,"" kata pelaksana tugas Sekretaris Perusahaan Waskita Beton Precast, Ales Okta Pratama dikutip dari detikcom. ""Waskita Beton Precast memohon maaf kepada seluruh pihak, khususnya yang terganggu atas kejadian ini,"" kata Ales Okta.  TIM RISET CNBC INDONESIA ";18-08-2020;https://www.cnbcindonesia.com/market/20200818135306-17-180521/konstruksi-tol-cibitung-ambruk-begini-nasib-saham-wskt-wsbp;"jakarta, cnbc indonesia - konstruksi di proyek pembangunan jalan tol cibitung-cilincing seksi iv, jakarta utara ambruk. pt cibitung tanjung priok port tollways (ctp) sebagai pengelola menginformasikan kejadian tersebut berlangsung pada saat kegiatan pengecoran pada minggu, 16 agustus 2020. setelah kabar tersebut keluar, belum ada dampak signifikan terhadap pergerakan harga saham emiten konstruksi bumn khususnya pt waskita karya tbk (wskt) dan juga pt waskita beton precast tbk (wsbp). ctp adalah badan usaha jalan tol (bujt) yang berada di bawah naungan sekaligus sebagai anak perusahaan dari pt waskita toll road (wtr) sebagai pemegang saham mayoritas. komposisi pemegang saham perusahaan hingga 31 desember 2017 terdiri dari waskita toll road sebesar 55% dan pt akses pelabuhan indonesia sebesar 45%. data bei mencatat, harga saham wsbp malah terpantau naik. saham wsbp pada 13:50 wib, selasa (18/8/2020), diperdagangkan di zona hijau dengan kenaikan 2,37% ke level rp 173/saham. bahkan jelang penutupan sesi pertama, harga saham wsbp sempat naik ke angka rp 175/saham. total transaksi di saham wsbp hari ini sebesar rp 17 miliar, dengan frekuensi sebanyak 2.777 kali dan volume sebanyak 101 juta saham. sebulan terakhir, saham wsbp ambles 15,87%. adapun saham wskt naik 2,34% di level rp 655/saham, dengan nilai transaksi rp 33,13 miliar dengan volume perdagangan 50,29 juta saham. sebulan terakhir saham wskt minus 8,97%. direktur utama ctp, thorry hendrarto, menjelaskan bahwa kejadian ambruknya proyek tersebut berada di seksi iv kelurahan marunda, cilincing, jakarta utara. ""penyebab utama kejadian tersebut saat ini sedang di evaluasi oleh pt waskita beton precast selaku kontraktor dan pimpinan proyek pt cibitung tanjung priok tollways,"" ujar thorry hendrarto dalam keterangannya, dikutip cnbc indonesia, selasa (18/8/20). sebelumnya, waskita beton precast mencatat sebanyak 8 pekerja yang luka akibat ambruknya proyek tersebut. ""delapan orang dengan luka ringan,"" kata pelaksana tugas sekretaris perusahaan waskita beton precast, ales okta pratama dikutip dari detikcom. ""waskita beton precast memohon maaf kepada seluruh pihak, khususnya yang terganggu atas kejadian ini,"" kata ales okta. tim riset cnbc indonesia "
