Title;Content;Date;URL;Cleaned Article
 The Fed Kembali Tahan Suku Bunga 5,25 - 5,5 Persen ;"Bank Sentral Amerika Serikat The Federal Reserve (The Fed) kembali mempertahankan suku bunga acuan di level 5,25 persen - 5,50 persen pada Rabu (12/6) waktu AS. Suku bunga di kisaran tersebut berlaku sejak Juli 2023. Pilihan menahan suku bunga yang sudah diambil tujuh kali berturut-turut ini mempertimbangkan inflasi pada Mei 2024 yang turun menjadi 3,3 persen dibandingkan 3,4 persen pada bulan sebelumnya. Gubernur The Fed Jerome Powell mengatakan tingkat inflasi lebih baik dari perkiraan siapa pun, dan menjadi faktor dalam keputusan rapat Federal Open Market Committee (FOMC).  ADVERTISEMENT   SCROLL TO CONTINUE WITH CONTENT  ""Kami melihat laporan hari ini sebagai kemajuan dan, Anda tahu, membangun kepercayaan diri. Tetapi kami tidak melihat diri kami memiliki kepercayaan diri untuk mulai melonggarkan kebijakan saat ini,"" kata Powell seperti diberitakan CNBC, Rabu (12/6).  The Fed juga mengisyaratkan bahwa hanya ada satu pemangkasan suku bunga yang diperkirakan terjadi sebelum akhir tahun ini. Namun, pada 2025, diperkirakan akan terjadi pemangkasan yang lebih agresif yakni sebanyak empat kali. Jika proyeksi tersebut bertahan, maka suku bunga The Fed akan berada di 4,1 persen pada akhir tahun depan.   The Fed juga merilis Ringkasan Proyeksi Ekonomi FOMC, di mana inflasi pada tahun ini diperkirakan sebesar 2,6 persen hingga 2,8 persen, tidak termasuk inflasi makanan dan energi. Pengukur proyeksi inflasi The Fed adalah indeks harga pengeluaran konsumsi pribadi yang dikeluarkan Departemen Perdagangan. The Fed lebih fokus pada inflasi inti sebagai indikator jangka panjang yang lebih baik. Keputusan menahan suku bunga dan proyeksi The Fed ini muncul pada tahun yang bergejolak bagi pasar. Investor berharap The Fed akan mulai melakukan pelonggaran kebijakan setelah menaikkan suku bunga acuan ke level tertinggi dalam 23 tahun terakhir. [Gambas:Video CNN]  ";13-06-2024;https://www.cnnindonesia.com/ekonomi/20240613110827-78-1109346/the-fed-kembali-tahan-suku-bunga-525-55-persen;"bank sentral amerika serikat the federal reserve (the fed) kembali mempertahankan suku bunga acuan di level 5,25 persen - 5,50 persen pada rabu (12/6) waktu as. suku bunga di kisaran tersebut berlaku sejak juli 2023. pilihan menahan suku bunga yang sudah diambil tujuh kali berturut-turut ini mempertimbangkan inflasi pada mei 2024 yang turun menjadi 3,3 persen dibandingkan 3,4 persen pada bulan sebelumnya. gubernur the fed jerome powell mengatakan tingkat inflasi lebih baik dari perkiraan siapa pun, dan menjadi faktor dalam keputusan rapat federal open market committee (fomc). ""kami melihat laporan hari ini sebagai kemajuan dan, anda tahu, membangun kepercayaan diri. tetapi kami tidak melihat diri kami memiliki kepercayaan diri untuk mulai melonggarkan kebijakan saat ini,"" kata powell seperti diberitakan cnbc, rabu (12/6). the fed juga mengisyaratkan bahwa hanya ada satu pemangkasan suku bunga yang diperkirakan terjadi sebelum akhir tahun ini. namun, pada 2025, diperkirakan akan terjadi pemangkasan yang lebih agresif yakni sebanyak empat kali. jika proyeksi tersebut bertahan, maka suku bunga the fed akan berada di 4,1 persen pada akhir tahun depan. the fed juga merilis ringkasan proyeksi ekonomi fomc, di mana inflasi pada tahun ini diperkirakan sebesar 2,6 persen hingga 2,8 persen, tidak termasuk inflasi makanan dan energi. pengukur proyeksi inflasi the fed adalah indeks harga pengeluaran konsumsi pribadi yang dikeluarkan departemen perdagangan. the fed lebih fokus pada inflasi inti sebagai indikator jangka panjang yang lebih baik. keputusan menahan suku bunga dan proyeksi the fed ini muncul pada tahun yang bergejolak bagi pasar. investor berharap the fed akan mulai melakukan pelonggaran kebijakan setelah menaikkan suku bunga acuan ke level tertinggi dalam 23 tahun terakhir. "
 IHSG Diprediksi Muram Hari Ini ;"Indeks Harga Saham Gabungan (IHSG) diprediksi melemah pada perdagangan Rabu (12/6). CEO Yugen Bertumbuh Sekuritas William Surya Wijaya mengatakan minimnya sentimen membuat IHSG cenderung memiliki potensi tertekan lebih besar dibanding peluang kenaikan. ""Selain itu, masih terjadinya fluktuasi rupiah turut memberikan sentimen sendiri bagi pergerakan IHSG,"" katanya.  ADVERTISEMENT   SCROLL TO CONTINUE WITH CONTENT  Ia memperkirakan indeks saham akan bergerak dalam rentang support 6.789 dan resistance 7.034.  Untuk saham pilihan, William merekomendasikan GGRM, BBRII, ICBP, AALI, dan BSDE. Sementara itu, Pengamat Pasar Modal PT Dinamika Gelora Satya Oktavianus Audi mengatakan investor masih akan cenderung hold menanti rilis suku bunga the Fed. Ia memproyeksi indeks bergerak dalam level support 6.010 dan resistance 6.955. ""Selain itu, pelemahan rupiah juga berpotensi mendorong pelemahan IHSG,"" katanya. IHSG ditutup di level 6.855 pada Selasa (11/6). Indeks saham melemah 65,85 poin atau minus 0,95 persen dari perdagangan sebelumnya.   Mengutip RTI Infokom, investor melakukan transaksi sebesar Rp8,64 triliun dengan jumlah saham yang diperdagangkan sebanyak 16,79 miliar saham. Pada penutupan kali ini, 198 saham menguat, 366 terkoreksi, dan 215 lainnya stagnan. Terpantau delapan dari sebelas indeks sektoral melemah, dipimpin sektor cyclical yang turun 1,11 persen. [Gambas:Video CNN] ";12-06-2024;https://www.cnnindonesia.com/ekonomi/20240612061155-92-1108755/ihsg-diprediksi-muram-hari-ini;"indeks harga saham gabungan (ihsg) diprediksi melemah pada perdagangan rabu (12/6). ceo yugen bertumbuh sekuritas william surya wijaya mengatakan minimnya sentimen membuat ihsg cenderung memiliki potensi tertekan lebih besar dibanding peluang kenaikan. ""selain itu, masih terjadinya fluktuasi rupiah turut memberikan sentimen sendiri bagi pergerakan ihsg,"" katanya. ia memperkirakan indeks saham akan bergerak dalam rentang support 6.789 dan resistance 7.034. untuk saham pilihan, william merekomendasikan ggrm, bbrii, icbp, aali, dan bsde. sementara itu, pengamat pasar modal pt dinamika gelora satya oktavianus audi mengatakan investor masih akan cenderung hold menanti rilis suku bunga the fed. ia memproyeksi indeks bergerak dalam level support 6.010 dan resistance 6.955. ""selain itu, pelemahan rupiah juga berpotensi mendorong pelemahan ihsg,"" katanya. ihsg ditutup di level 6.855 pada selasa (11/6). indeks saham melemah 65,85 poin atau minus 0,95 persen dari perdagangan sebelumnya. mengutip rti infokom, investor melakukan transaksi sebesar rp8,64 triliun dengan jumlah saham yang diperdagangkan sebanyak 16,79 miliar saham. pada penutupan kali ini, 198 saham menguat, 366 terkoreksi, dan 215 lainnya stagnan. terpantau delapan dari sebelas indeks sektoral melemah, dipimpin sektor cyclical yang turun 1,11 persen. "
 IHSG Diprediksi Semringah Hari Ini ;"Indeks Harga Saham Gabungan (IHSG) diprediksi bergerak dengan kecenderungan menguat pada perdagangan Selasa (11/6). CEO Yugen Bertumbuh Sekuritas William Surya Wijaya mengatakan peluang kenaikan lanjutan masih terbuka mengingat kondisi perekonomian Indonesia yang stabil. ""Di sisi lain masih adanya potensi koreksi tetap perlu diwaspadai oleh para investor mengingat capital outflow yang tercatat secara year to date (ytd),"" kata William.  ADVERTISEMENT   SCROLL TO CONTINUE WITH CONTENT  Ia memperkirakan indeks saham akan bergerak dalam rentang support 6.789 dan resistance 7.034.  Untuk saham pilihan, William merekomendasikan BBCA, BBRI, SMRA, AKRA, SMGER, CTRA, dan UNVR. Senada, Pengamat Pasar Modal Riska Afriani memperkirakan IHSG bergerak menguat terbatas. Meskipun pada perdagangan kemarin asing tercatat melakukan net sell, namun aksi beli pelaku pasar domestik mendominasi perdagangan sehingga IHSG mampu ditutup di atas level 6.900. ""Pelaku pasar asing saat ini cenderung wait and see hingga ada peluang The Fed menurunkan suku bunga acuannya,"" katanya. Hari ini, ia memperkirakan IHSG bergerak di rentang 6.853- 6.989.   IHSG ditutup di level 6.921 pada Senin (10/6). Indeks saham menguat 23,59 poin atau plus 0,34 persen dari perdagangan sebelumnya. Mengutip RTI Infokom, investor melakukan transaksi sebesar Rp8,66 triliun dengan jumlah saham yang diperdagangkan sebanyak 28,22 miliar saham. Pada penutupan kali ini, 198 saham menguat, 381 terkoreksi, dan 205 lainnya stagnan. Terpantau sembilan dari sebelas indeks sektoral melemah, dipimpin sektor teknologi yang turun 2,31 persen. [Gambas:Video CNN]";11-06-2024;https://www.cnnindonesia.com/ekonomi/20240611054019-92-1108275/ihsg-diprediksi-semringah-hari-ini;"indeks harga saham gabungan (ihsg) diprediksi bergerak dengan kecenderungan menguat pada perdagangan selasa (11/6). ceo yugen bertumbuh sekuritas william surya wijaya mengatakan peluang kenaikan lanjutan masih terbuka mengingat kondisi perekonomian indonesia yang stabil. ""di sisi lain masih adanya potensi koreksi tetap perlu diwaspadai oleh para investor mengingat capital outflow yang tercatat secara year to date (ytd),"" kata william. ia memperkirakan indeks saham akan bergerak dalam rentang support 6.789 dan resistance 7.034. untuk saham pilihan, william merekomendasikan bbca, bbri, smra, akra, smger, ctra, dan unvr. senada, pengamat pasar modal riska afriani memperkirakan ihsg bergerak menguat terbatas. meskipun pada perdagangan kemarin asing tercatat melakukan net sell, namun aksi beli pelaku pasar domestik mendominasi perdagangan sehingga ihsg mampu ditutup di atas level 6.900. ""pelaku pasar asing saat ini cenderung wait and see hingga ada peluang the fed menurunkan suku bunga acuannya,"" katanya. hari ini, ia memperkirakan ihsg bergerak di rentang 6.853- 6.989. ihsg ditutup di level 6.921 pada senin (10/6). indeks saham menguat 23,59 poin atau plus 0,34 persen dari perdagangan sebelumnya. mengutip rti infokom, investor melakukan transaksi sebesar rp8,66 triliun dengan jumlah saham yang diperdagangkan sebanyak 28,22 miliar saham. pada penutupan kali ini, 198 saham menguat, 381 terkoreksi, dan 205 lainnya stagnan. terpantau sembilan dari sebelas indeks sektoral melemah, dipimpin sektor teknologi yang turun 2,31 persen. "
 IHSG Terperosok ke 6.855 Sore Ini ;Indeks harga Saham gabungan (IHSG) ditutup di level 6.855 pada Selasa (11/6). Indeks saham melemah 65,85 poin atau minus 0,95 persen dari perdagangan sebelumnya. Mengutip RTI Infokom, investor melakukan transaksi sebesar Rp8,64 triliun dengan jumlah saham yang diperdagangkan sebanyak 16,79 miliar saham. Pada penutupan kali ini, 198 saham menguat, 366 terkoreksi, dan 215 lainnya stagnan. Terpantau delapan dari sebelas indeks sektoral melemah, dipimpin sektor cyclical yang turun 1,11 persen.  ADVERTISEMENT   SCROLL TO CONTINUE WITH CONTENT  Beralih ke bursa asing, bursa saham Asia bervarisi. Tercatat, indeks Nikkei 225 di Jepang naik 0,25 persen, indeks Hang Seng Composite di Hong Kong minus 1,01persen, dan indeks Kospi di Korea Selatan menguat 0,15 persen.  Bursa saham Eropa kompak menguat. Terpantau, indeks FTSE 100 di Inggris plus 0,13 persen, indeks CAC 40 di Prancis naik 0,47 persen, dan indeks DAX di Jerman menguat 0,11 persen. Begitu pula dengan bursa Amerika yang serempak bergerak di zona hijau. Indeks S&P 500 naik 0,26 persen, indeks NYSE naik 0,29 persen, dan indeks NASDAQ Composite naik 0,35 persen. ;11-06-2024;https://www.cnnindonesia.com/ekonomi/20240611162330-92-1108572/ihsg-terperosok-ke-6855-sore-ini;indeks harga saham gabungan (ihsg) ditutup di level 6.855 pada selasa (11/6). indeks saham melemah 65,85 poin atau minus 0,95 persen dari perdagangan sebelumnya. mengutip rti infokom, investor melakukan transaksi sebesar rp8,64 triliun dengan jumlah saham yang diperdagangkan sebanyak 16,79 miliar saham. pada penutupan kali ini, 198 saham menguat, 366 terkoreksi, dan 215 lainnya stagnan. terpantau delapan dari sebelas indeks sektoral melemah, dipimpin sektor cyclical yang turun 1,11 persen. beralih ke bursa asing, bursa saham asia bervarisi. tercatat, indeks nikkei 225 di jepang naik 0,25 persen, indeks hang seng composite di hong kong minus 1,01persen, dan indeks kospi di korea selatan menguat 0,15 persen. bursa saham eropa kompak menguat. terpantau, indeks ftse 100 di inggris plus 0,13 persen, indeks cac 40 di prancis naik 0,47 persen, dan indeks dax di jerman menguat 0,11 persen. begitu pula dengan bursa amerika yang serempak bergerak di zona hijau. indeks s&p 500 naik 0,26 persen, indeks nyse naik 0,29 persen, dan indeks nasdaq composite naik 0,35 persen. 
 IHSG Diprediksi Menguat Terbatas Hari Ini ;"Indeks Harga Saham Gabungan (IHSG) diproyeksi menguat terbatas pada perdagangan Jumat (14/6). CEO Yugen Bertumbuh Sekuritas William Surya Wijaya mengatakan pola gerak IHSG di akhir pekan masih betah berada dalam rentang konsolidasi wajar. Gelombang tekanan terlihat mulai mereda sehingga terbuka peluang teknikal rebound. ""Di sisi lain saat ini IHSG masih ditopang oleh beberapa faktor di antaranya masih stabilnya kondisi perekonomian Indonesia yang terlihat dari beberapa data yang telah terlansir dan musim pembagian dividen oleh emiten,"" katanya.  ADVERTISEMENT   SCROLL TO CONTINUE WITH CONTENT  Ia memperkirakan indeks saham akan bergerak dalam rentang support 6.789 dan resistance 7.034. Untuk saham pilihan, William merekomendasikan ASII, BBNI, ICBP, SMGR, dan BSDE.  Sementara itu, Analis sekaligus Pendiri WH Project William Hartanto melihat IHSG akan melemah terbatas. Ia mengatakan tekanan pada indeks masih terus berlanjut. ""Apabila IHSG melemah lebih jauh di bawah 6.800 maka demand zone berikutnya perlu diperhatikan, karena ada potensi jenuh jual yang terlihat dari penurunan nilai transaksi belakangan ini, dan mulai besarnya transaksi investor asing namun dilakukan di pasar negosiasi,"" katanya. Ia memproyeksi IHSG bergerak di rentang 6.762 - 6.887. IHSG ditutup di level 6.831 pada Kamis (13/6). Indeks saham melemah 18,53 poin atau minus 0,27 persen dari perdagangan sebelumnya. Mengutip RTI Infokom, investor melakukan transaksi sebesar Rp13,48 triliun dengan jumlah saham yang diperdagangkan sebanyak 42,41 miliar saham. Pada penutupan kali ini, 251 saham menguat, 285 terkoreksi, dan 235 lainnya stagnan. Terpantau 6 dari 11 indeks sektoral menguat, dipimpin sektor teknologi yang naik 1,46 persen. [Gambas:Video CNN]  ";14-06-2024;https://www.cnnindonesia.com/ekonomi/20240614061326-92-1109704/ihsg-diprediksi-menguat-terbatas-hari-ini;"indeks harga saham gabungan (ihsg) diproyeksi menguat terbatas pada perdagangan jumat (14/6). ceo yugen bertumbuh sekuritas william surya wijaya mengatakan pola gerak ihsg di akhir pekan masih betah berada dalam rentang konsolidasi wajar. gelombang tekanan terlihat mulai mereda sehingga terbuka peluang teknikal rebound. ""di sisi lain saat ini ihsg masih ditopang oleh beberapa faktor di antaranya masih stabilnya kondisi perekonomian indonesia yang terlihat dari beberapa data yang telah terlansir dan musim pembagian dividen oleh emiten,"" katanya. ia memperkirakan indeks saham akan bergerak dalam rentang support 6.789 dan resistance 7.034. untuk saham pilihan, william merekomendasikan asii, bbni, icbp, smgr, dan bsde. sementara itu, analis sekaligus pendiri wh project william hartanto melihat ihsg akan melemah terbatas. ia mengatakan tekanan pada indeks masih terus berlanjut. ""apabila ihsg melemah lebih jauh di bawah 6.800 maka demand zone berikutnya perlu diperhatikan, karena ada potensi jenuh jual yang terlihat dari penurunan nilai transaksi belakangan ini, dan mulai besarnya transaksi investor asing namun dilakukan di pasar negosiasi,"" katanya. ia memproyeksi ihsg bergerak di rentang 6.762 - 6.887. ihsg ditutup di level 6.831 pada kamis (13/6). indeks saham melemah 18,53 poin atau minus 0,27 persen dari perdagangan sebelumnya. mengutip rti infokom, investor melakukan transaksi sebesar rp13,48 triliun dengan jumlah saham yang diperdagangkan sebanyak 42,41 miliar saham. pada penutupan kali ini, 251 saham menguat, 285 terkoreksi, dan 235 lainnya stagnan. terpantau 6 dari 11 indeks sektoral menguat, dipimpin sektor teknologi yang naik 1,46 persen. "
 IHSG Diprediksi Tertekan Awal Pekan Ini ;"Indeks Harga Saham Gabungan (IHSG) diprediksi bergerak dengan kecenderungan melemah pada perdagangan Senin (10/6). CEO Yugen Bertumbuh Sekuritas William Surya Wijaya mengatakan tekanan berasal dari fluktuasi nilai tukar rupiah dan terjadinya capital outflow yang tercatat secara year to date (ytd). ""Sehingga masih cukup besarnya peluang tekanan tetap perlu diwaspadai oleh para investor,"" kata William.  ADVERTISEMENT   SCROLL TO CONTINUE WITH CONTENT  Ia memperkirakan indeks saham akan bergerak dalam rentang support 6.789 dan resistance 7.034.  Untuk saham pilihan, William merekomendasikan ITMG, BMRI, LSIP, GGRM, AKRA, dan BSDE. Senada, Praktisi Pasar Modal sekaligus Founder WH-Project William Hartanto memperkirakan IHSG melemah di kisaran 6.800 - 7.000. ""IHSG masih memiliki gap pada 6.886 dan berpotensi mengalami pelemahan terbatas hingga penutupan gap tersebut,"" katanya.   IHSG ditutup di level 6.897 pada Jumat (7/6). Indeks saham melemah 76,94 poin atau minus 1,10 persen dari perdagangan sebelumnya. Mengutip RTI Infokom, investor melakukan transaksi sebesar Rp8,30 triliun dengan jumlah saham yang diperdagangkan sebanyak 12,74 miliar saham. Pada penutupan kali ini, 232 saham menguat, 309 terkoreksi, dan 240 lainnya stagnan. Terpantau tujuh dari sebelas indeks sektoral melemah, dipimpin sektor keuangan yang turun 1,35 persen. [Gambas:Video CNN]";10-06-2024;https://www.cnnindonesia.com/ekonomi/20240610060602-92-1107808/ihsg-diprediksi-tertekan-awal-pekan-ini;"indeks harga saham gabungan (ihsg) diprediksi bergerak dengan kecenderungan melemah pada perdagangan senin (10/6). ceo yugen bertumbuh sekuritas william surya wijaya mengatakan tekanan berasal dari fluktuasi nilai tukar rupiah dan terjadinya capital outflow yang tercatat secara year to date (ytd). ""sehingga masih cukup besarnya peluang tekanan tetap perlu diwaspadai oleh para investor,"" kata william. ia memperkirakan indeks saham akan bergerak dalam rentang support 6.789 dan resistance 7.034. untuk saham pilihan, william merekomendasikan itmg, bmri, lsip, ggrm, akra, dan bsde. senada, praktisi pasar modal sekaligus founder wh-project william hartanto memperkirakan ihsg melemah di kisaran 6.800 - 7.000. ""ihsg masih memiliki gap pada 6.886 dan berpotensi mengalami pelemahan terbatas hingga penutupan gap tersebut,"" katanya. ihsg ditutup di level 6.897 pada jumat (7/6). indeks saham melemah 76,94 poin atau minus 1,10 persen dari perdagangan sebelumnya. mengutip rti infokom, investor melakukan transaksi sebesar rp8,30 triliun dengan jumlah saham yang diperdagangkan sebanyak 12,74 miliar saham. pada penutupan kali ini, 232 saham menguat, 309 terkoreksi, dan 240 lainnya stagnan. terpantau tujuh dari sebelas indeks sektoral melemah, dipimpin sektor keuangan yang turun 1,35 persen. "
         IHSG Dibuka di Zona Hijau, Diramal Mantul Hari Ini    ;Indeks Harga Saham Gabungan (IHSG) pagi ini dibuka di zona hijau. IHSG kembali mendekati level 6.900-an. Mengutip data RTI, Kamis (13/6/2024), pagi ini IHSG dibuka menguat 41 poin (0,61%) ke 6.891. Indeks LQ45 juga dibuka naik 1,08% ke posisi 872. IHSG berada di level tertingginya pada level 6.894 dan terendahnya 6.880. Sebanyak 845 juta lembar saham diperdagangkan pagi ini dengan nilai Rp 367 miliar.      ADVERTISEMENT         SCROLL TO CONTINUE WITH CONTENT    Mengutip riset Mega Capital Sekuritas, sentimen dari global masih berasal dari keputusan The Fed yang menahan suku bunga membuat bursa saham global menguat. Mayoritas bursa saham global kompak menguat, in deks Nasdaq kembali cetak rekor tertinggi dengan penguatan 1.53% di level 17608. Sesuai perkiraan pasar, pada FOMC hari ini The Fed masih menahan suku bunga di level 5.5%. The Fed juga mengapresiasi data inflasi Mei yang hanya tumbuh sebesar 3.3%, lebih rendah dari bulan sebelumnya di 3.4% dan perkiraan pasar. Meski demikian, The Fed masih kurang optimis dengan proses disinflasi pada beberapa bulan mendatang. Sementara dari sisi domestik IHSG pada perdagangan Rabu, 12 Juni 2024 bergerak dalam ruang terbatas dengan diakhiri melemah tipis sebesar 0.08% ke level 6850. Investor asing mencatatkan aksi net sell sebesar Rp 747 miliar dengan 5 saham yang paling banyak dijual yaitu BMRI, BBNI, BBCA, BREN, dan BBRI. Menurut Mega Capita Sekuritas IHSG sedang membentuk hammer candle pada support lower bollinger band sehinggaberpotensi rebound menguat dengan dukungan stochastic yang berpeluang keluar dari oversold, antara range 6.821-6.878. Sementara itu bursa Asia pagi ini hampir seluruhnya melemah. Berikut pergerakannya. - Nikkei naik 26 poin (0,07%) ke 38.903- Hang Seng menguat 98 poin (0,55%) ke 18.036- Shanghai berkurang 1 poin (0,06%) ke 3.035- Straits Times naik 19 poin (0,59%) ke 3.326  ;13-06-2024;https://finance.detik.com/bursa-dan-valas/d-7388556/ihsg-dibuka-di-zona-hijau-diramal-mantul-hari-ini;indeks harga saham gabungan (ihsg) pagi ini dibuka di zona hijau. ihsg kembali mendekati level 6.900-an. mengutip data rti, kamis (13/6/2024), pagi ini ihsg dibuka menguat 41 poin (0,61%) ke 6.891. indeks lq45 juga dibuka naik 1,08% ke posisi 872. ihsg berada di level tertingginya pada level 6.894 dan terendahnya 6.880. sebanyak 845 juta lembar saham diperdagangkan pagi ini dengan nilai rp 367 miliar. mengutip riset mega capital sekuritas, sentimen dari global masih berasal dari keputusan the fed yang menahan suku bunga membuat bursa saham global menguat. mayoritas bursa saham global kompak menguat, in deks nasdaq kembali cetak rekor tertinggi dengan penguatan 1.53% di level 17608. sesuai perkiraan pasar, pada fomc hari ini the fed masih menahan suku bunga di level 5.5%. the fed juga mengapresiasi data inflasi mei yang hanya tumbuh sebesar 3.3%, lebih rendah dari bulan sebelumnya di 3.4% dan perkiraan pasar. meski demikian, the fed masih kurang optimis dengan proses disinflasi pada beberapa bulan mendatang. sementara dari sisi domestik ihsg pada perdagangan rabu, 12 juni 2024 bergerak dalam ruang terbatas dengan diakhiri melemah tipis sebesar 0.08% ke level 6850. investor asing mencatatkan aksi net sell sebesar rp 747 miliar dengan 5 saham yang paling banyak dijual yaitu bmri, bbni, bbca, bren, dan bbri. menurut mega capita sekuritas ihsg sedang membentuk hammer candle pada support lower bollinger band sehinggaberpotensi rebound menguat dengan dukungan stochastic yang berpeluang keluar dari oversold, antara range 6.821-6.878. sementara itu bursa asia pagi ini hampir seluruhnya melemah. berikut pergerakannya. - nikkei naik 26 poin (0,07%) ke 38.903- hang seng menguat 98 poin (0,55%) ke 18.036- shanghai berkurang 1 poin (0,06%) ke 3.035- straits times naik 19 poin (0,59%) ke 3.326 
         Awal Pekan IHSG Dibuka ke Level 6.897    ;Indeks Harga Saham Gabungan (IHSG) pada awal pembukaan perdagangan pekan ini dibuka ke level 6.897. Beberapa menit setelah perdagangan dibuka, indeks bergerak turun ke zona merah ke level 6.889, turun 0,12%. Mengutip data RTI, Senin (10/6/2024), IHSG bergerak pada level tertingginya di level 6.913,4 dan terendah di 6.885,7. Sebanyak 130 saham bergerak naik, 204 saham bergerak turun dan 200 saham belum bergerak. Market Cap tercatat Rp 11.519 triliun. Sementara pergerakan saham di bursa Asia lainnya pagi ini antara lain:      ADVERTISEMENT         SCROLL TO CONTINUE WITH CONTENT