Title;Content;Date;URL;Cleaned Article
Mitratel Borong 54 Tower XL Axiata Seharga Rp 36,62 miliar.;"TRIBUNNEWS.COM, JAKARTA -- PT Dayamitra Telekomunikasi Tbk (MTEL) atau Mitratel memborong sebanyak 54 menara milik PT XL Axiata Tbk (EXCL). Perusahaan plat merah tersebut membayar sebanyak 54 tower base transceiver station (BTS) dengan total harga Rp 36,62 miliar. Disebutkan, finalisasi transaksi dilakukan ada 25 September 2023. ""Mitratel telah menyelesaikan transaksi pembelian 54 menara telekomunikasi dengan 63 tenant dengan tenancy ratio 1.16 kali,"" jelas Direktur Investasi Mitratel Hendra Purnama, Rabu (27/9/2023). Tak hanya itu, MTEL juga menyepakati untuk menyewakan kembali atas 53 menara telekomunikasi kepada EXCL. Seluruh nilai transaksi mencapai Rp 36,62 miliar.  Hendra mengatakan menara yang akuisisi MTEL dari EXCL tersebar merata di seluruh Indonesia. Mulai dari Sumatera Bagian Tengah, Sumatra Bagian Selatan.  .recads_wrapper{height:134px;position:relative;margin:10px 0 30px;padding:10px 15px;overflow:hidden;box-shadow:0 0 10px rgb(0 0 0 / 20%);}.recads_title{margin-bottom:10px;font-size:16px;font-weight:700}.arjW-list{overflow-x:scroll;overflow-y:hidden;white-space:nowrap;width:auto;padding:10px 0;position:relative;display:flex;scroll-snap-type:x;flex-wrap:nowrap}.recads_item{scroll-snap-align:start;width:280px;flex:0 0 280px;margin-right:20px;display: flex;white-space: normal;gap: 10px;}.recads_item a {display:flex;white-space:normal;gap:10px;}.recads_image{position:relative;height:auto}.recads_image img{width:auto;height: 73px!important;max-width:165px!important;border-radius:8px}.article_datas_title{font-size:14px;font-weight:700;line-height:1.2;margin:0;overflow:hidden;display:-webkit-box;-webkit-line-clamp:4;-webkit-box-orient:vertical;}.arjW-img-overlay{position:absolute;z-index:3;bottom:8px;left:0;padding:0 0 0 10px}.arjW-img-overlay>img{width:auto;height: 16px!important;}.recads_image::after{z-index:2;position:absolute;top:50%;bottom:4px;left:0;right:0;content:'';background:linear-gradient(to top,#d6d6d6,transparent);width:100%;border-radius: 8px;}             BERITA REKOMENDASI           Selain itu mencari EXCL juga ada di Jawa Barat, Jakarta, Bogor, Bali dan Nusa Tenggara hingga Kalimantan dan Sulawesi. Sebaran menara yang besar di luar Jawa akan menjadi peluang baru bagi MTEL. Hendra menjelaskan Mitratel meyakini potensi pertumbuhan ekonomi di luar pulau Jawa dan kontribusinya yang menjanjikan terhadap perekonomian nasional. Untuk itu akusisi EXCL merupakan langkah yang baik. ""Akuisisi ini merupakan bentuk komitmen kami dalam membantu mitra strategis kami dari industri operator telekomunikasi untuk melakukan ekspansi dengan bisnis model yang lebih efisien,"" katanya. Selain EXCL, pada 22 September 2023, Mitratel juga telah mengakuisisi 51 menara miliki dua perusahaan lainnya. Namun Hendra belum menjelaskan secara rinci besaran transaksi tersebut. Yang jelas seluruh menara tersebut berada di Bali dan Jakarta Bogor. Dari pembelian 51 menara ini, MTEL mendapatkan 79 tenant baru. Artinya, tenancy ratio menara anyar ini sebesar 1,55 kali. Hendra menilai divestasi aset menara dan fiber optik milik operator telekomunikasi akan terus berlangsung karena menjadi langkah strategi bagi industri telekomunikasi. ""Ini merupakan langkah strategis industri telekomunikasi untuk mencapai pertumbuhan secara cepat, efisien dan efektif. Mitratel selalu siap menjadi mitra strategis mereka,"" pungkasnya. (Yuliana Hema) Sumber: Kontan";28-09-2023;https://www.tribunnews.com/bisnis/2023/09/28/mitratel-borong-54-tower-xl-axiata-seharga-rp-3662-miliar;"tribunnews.com, jakarta -- pt dayamitra telekomunikasi tbk (mtel) atau mitratel memborong sebanyak 54 menara milik pt xl axiata tbk (excl). perusahaan plat merah tersebut membayar sebanyak 54 tower base transceiver station (bts) dengan total harga rp 36,62 miliar. disebutkan, finalisasi transaksi dilakukan ada 25 september 2023. ""mitratel telah menyelesaikan transaksi pembelian 54 menara telekomunikasi dengan 63 tenant dengan tenancy ratio 1.16 kali,"" jelas direktur investasi mitratel hendra purnama, rabu (27/9/2023). tak hanya itu, mtel juga menyepakati untuk menyewakan kembali atas 53 menara telekomunikasi kepada excl. seluruh nilai transaksi mencapai rp 36,62 miliar. hendra mengatakan menara yang akuisisi mtel dari excl tersebar merata di seluruh indonesia. mulai dari sumatera bagian tengah, sumatra bagian selatan. berita rekomendasi selain itu mencari excl juga ada di jawa barat, jakarta, bogor, bali dan nusa tenggara hingga kalimantan dan sulawesi. sebaran menara yang besar di luar jawa akan menjadi peluang baru bagi mtel. hendra menjelaskan mitratel meyakini potensi pertumbuhan ekonomi di luar pulau jawa dan kontribusinya yang menjanjikan terhadap perekonomian nasional. untuk itu akusisi excl merupakan langkah yang baik. ""akuisisi ini merupakan bentuk komitmen kami dalam membantu mitra strategis kami dari industri operator telekomunikasi untuk melakukan ekspansi dengan bisnis model yang lebih efisien,"" katanya. selain excl, pada 22 september 2023, mitratel juga telah mengakuisisi 51 menara miliki dua perusahaan lainnya. namun hendra belum menjelaskan secara rinci besaran transaksi tersebut. yang jelas seluruh menara tersebut berada di bali dan jakarta bogor. dari pembelian 51 menara ini, mtel mendapatkan 79 tenant baru. artinya, tenancy ratio menara anyar ini sebesar 1,55 kali. hendra menilai divestasi aset menara dan fiber optik milik operator telekomunikasi akan terus berlangsung karena menjadi langkah strategi bagi industri telekomunikasi. ""ini merupakan langkah strategis industri telekomunikasi untuk mencapai pertumbuhan secara cepat, efisien dan efektif. mitratel selalu siap menjadi mitra strategis mereka,"" pungkasnya. (yuliana hema) sumber: kontan"
Puluhan Mahasiswa Indonesia Berkesempatan Belajar Teknologi Mobil Listrik di China;"TRIBUNNEWS.COM, JAKARTA - Sebanyak 24 Pemuda Indonesia mendapatkan beasiswa ke Sichuan Engineering Technology College (SCETC) di Deyang - China. Mereka akan belajar di Jurusan Teknologi Mobil Listrik dan E-Commerce. Acara pelepasan para pemuda Indonesia yang mendapatkan beasiswa itu digelar di Wisma Samadi, Klender, Jakarta Timur. Hadir dalam acara tersebut antara lain Plt. Asisten Deputi Industri Pendukung Infrastruktur Kemenko Kemaritiman dan Investasi Nayo Ramli, Direktur Chindo Business Center Sanny, Waketum DPP GAMKI Kevin Rouw, Panglima Brigsena GAMKI Andriyas Tuhenay, Ketua Umum DPP FOKSI Muhammad Natsir, dan Manager Divisi Pelatihan dan Penjualan Asia Pasifik BYD Mr Jacob Ma. Dalam pengarahannya, Nayo Ramli berpesan agar pemuda Indonesia yang mendapatkan beasiswa untuk menyelesaikan kuliah dengan baik. ""Raih kesuksesan dan pengalaman di China, dan pulang membangun Indonesia,"" kata Nayo Ramli dalam keterangannya, Kamis (28/9/2023). Di momen yang bersamaan, Manager Pelatihan dan Penjualan Asia Pasifik BYD menyebutkan Indonesia menuju industri kendaraan listrik dan prospek karir dari peserta beasiswa sangat cerah. ""Indonesia pasti membutuhkan engineer mobil listrik untuk industri EV,"" kata Jacob Ma.  .recads_wrapper{height:134px;position:relative;margin:10px 0 30px;padding:10px 15px;overflow:hidden;box-shadow:0 0 10px rgb(0 0 0 / 20%);}.recads_title{margin-bottom:10px;font-size:16px;font-weight:700}.arjW-list{overflow-x:scroll;overflow-y:hidden;white-space:nowrap;width:auto;padding:10px 0;position:relative;display:flex;scroll-snap-type:x;flex-wrap:nowrap}.recads_item{scroll-snap-align:start;width:280px;flex:0 0 280px;margin-right:20px;display: flex;white-space: normal;gap: 10px;}.recads_item a {display:flex;white-space:normal;gap:10px;}.recads_image{position:relative;height:auto}.recads_image img{width:auto;height: 73px!important;max-width:165px!important;border-radius:8px}.article_datas_title{font-size:14px;font-weight:700;line-height:1.2;margin:0;overflow:hidden;display:-webkit-box;-webkit-line-clamp:4;-webkit-box-orient:vertical;}.arjW-img-overlay{position:absolute;z-index:3;bottom:8px;left:0;padding:0 0 0 10px}.arjW-img-overlay>img{width:auto;height: 16px!important;}.recads_image::after{z-index:2;position:absolute;top:50%;bottom:4px;left:0;right:0;content:'';background:linear-gradient(to top,#d6d6d6,transparent);width:100%;border-radius: 8px;}             BERITA REKOMENDASI           Koordinator Beasiswa SCETC, Prima Surbakti, yang juga Ketua Bidang Kemaritiman dan Investasi DPP GAMKI menyebutkan beasiswa kuliah SCETC ini merupakan tindak lanjut MoU antara Chindo Business Center, DPP GAMKI dan DPP FOKSI untuk pengembangan SDM Pemuda Indonesia dalam bidang teknologi. Prima Surbakti menyampaikan, 24 penerima beasiswa berasal dari Provinsi Papua, Sulawesi Tengah, Sulawesi Selatan, Sumatera Utara, Riau, Nusa Tenggara Timur, dan Jawa Barat dan Jawa Tengah. Mereka mendapatkan beasiswa penuh untuk studi di China. ""Setiap mahasiswa mendapatkan fasilitas kuliah gratis seperti biaya kuliah, tempat tinggal, buku kuliah, izin tinggal, asuransi serta uang saku RMB800 atau kurang lebih Rp1,7 juta setiap bulan,"" katanya.  Prima Surbakti mengucapkan terima kasih kepada SCETC yang tetap memberi kepercayaan untuk studi dengan jurusan teknologi mobil listrik dan e-commerce kepada anak bangsa. ""Tahun lalu kita sudah mengirimkan 13 orang, dan tahun ini kita mengirimkan 24 orang. Mereka juga punya kesempatan belajar dan bekerja di BYD, perusahaan mobil listrik terbesar di dunia,"" tuturnya. Ke depan, kata Prima, pihaknya akan menambah kuota beasiswa dan membuka jurusan teknologi lainnya. ""Program ini menjadi investasi jangka panjang. Indonesia membutuhkan SDM yang berkualitas menuju Indonesia Emas 2045,"" terangnya. Prima berpesan kepada 24 mahasiswa ini untuk menjaga kesehatan, belajar, dan bergaul dengan baik serta kembali untuk mengabdi di Indonesia dengan membangun industri mobil listrik di Indonesia. ""Learning Today-Leading Tomorrow! Tuntut ilmu hari ini, membangun Indonesia besok,"" tuturnya.";28-09-2023;https://www.tribunnews.com/bisnis/2023/09/28/puluhan-mahasiswa-indonesia-berkesempatan-belajar-teknologi-mobil-listrik-di-china;"tribunnews.com, jakarta - sebanyak 24 pemuda indonesia mendapatkan beasiswa ke sichuan engineering technology college (scetc) di deyang - china. mereka akan belajar di jurusan teknologi mobil listrik dan e-commerce. acara pelepasan para pemuda indonesia yang mendapatkan beasiswa itu digelar di wisma samadi, klender, jakarta timur. hadir dalam acara tersebut antara lain plt. asisten deputi industri pendukung infrastruktur kemenko kemaritiman dan investasi nayo ramli, direktur chindo business center sanny, waketum dpp gamki kevin rouw, panglima brigsena gamki andriyas tuhenay, ketua umum dpp foksi muhammad natsir, dan manager divisi pelatihan dan penjualan asia pasifik byd mr jacob ma. dalam pengarahannya, nayo ramli berpesan agar pemuda indonesia yang mendapatkan beasiswa untuk menyelesaikan kuliah dengan baik. ""raih kesuksesan dan pengalaman di china, dan pulang membangun indonesia,"" kata nayo ramli dalam keterangannya, kamis (28/9/2023). di momen yang bersamaan, manager pelatihan dan penjualan asia pasifik byd menyebutkan indonesia menuju industri kendaraan listrik dan prospek karir dari peserta beasiswa sangat cerah. ""indonesia pasti membutuhkan engineer mobil listrik untuk industri ev,"" kata jacob ma. berita rekomendasi koordinator beasiswa scetc, prima surbakti, yang juga ketua bidang kemaritiman dan investasi dpp gamki menyebutkan beasiswa kuliah scetc ini merupakan tindak lanjut mou antara chindo business center, dpp gamki dan dpp foksi untuk pengembangan sdm pemuda indonesia dalam bidang teknologi. prima surbakti menyampaikan, 24 penerima beasiswa berasal dari provinsi papua, sulawesi tengah, sulawesi selatan, sumatera utara, riau, nusa tenggara timur, dan jawa barat dan jawa tengah. mereka mendapatkan beasiswa penuh untuk studi di china. ""setiap mahasiswa mendapatkan fasilitas kuliah gratis seperti biaya kuliah, tempat tinggal, buku kuliah, izin tinggal, asuransi serta uang saku rmb800 atau kurang lebih rp1,7 juta setiap bulan,"" katanya. prima surbakti mengucapkan terima kasih kepada scetc yang tetap memberi kepercayaan untuk studi dengan jurusan teknologi mobil listrik dan e-commerce kepada anak bangsa. ""tahun lalu kita sudah mengirimkan 13 orang, dan tahun ini kita mengirimkan 24 orang. mereka juga punya kesempatan belajar dan bekerja di byd, perusahaan mobil listrik terbesar di dunia,"" tuturnya. ke depan, kata prima, pihaknya akan menambah kuota beasiswa dan membuka jurusan teknologi lainnya. ""program ini menjadi investasi jangka panjang. indonesia membutuhkan sdm yang berkualitas menuju indonesia emas 2045,"" terangnya. prima berpesan kepada 24 mahasiswa ini untuk menjaga kesehatan, belajar, dan bergaul dengan baik serta kembali untuk mengabdi di indonesia dengan membangun industri mobil listrik di indonesia. ""learning today-leading tomorrow! tuntut ilmu hari ini, membangun indonesia besok,"" tuturnya."
PPA Raih Penghargaan Jasa Pertambangan Terbaik dari Kementerian ESDM;"Laporan Wartawan Tribunnews, Sanusi TRIBUNNEWS.COM, JAKARTA - Kementerian ESDM memberikan penghargaan kepada perusahaan jasa kontraktor pertambangan PT Putra Perkasa Abadi (PPA) sebagai pemegang Izin Usaha Jasa Pertambangan (IUJP) terbaik di ajang Good Mining Practice (GMP) Award 2023, Jumat (29/9/2023). GMP Award 2023 kali ini diikuti 13 perusahaan KK, 33 perusahaan PKP2B (Perjanjian Karya Pengusahaan Pertambangan Batubara), 30 perusahaan IUPMA (Izin Usaha Pertambangan Modal Asing), 24 perusahaan IUP PMDN, 9 perusahaan IUPK (Izin Usaha Pertambangan Khusus), dan 65 perusahaan IUJP. Acara yang merupakan bentuk apresiasi pemerintah kepada para perusahaan sektor pertambangan di Indonesia yang telah melakukan kaidah teknik pertambangan yang baik. PPA juga memperoleh Piagam Penghargaan Aditama dalam pengelolaan standardisasi usaha jasa pertambangan mineral dan batubara di antara 65 Badan Usaha Pemegang IUJP yang dinilai. Menteri ESDM Arifin Tasrif mengungkapkan pentingnya penerapan kaidah teknis pertambangan yang baik. “Dengan diterapkannya kaidah teknis pertambangan yang baik diharapkan pengelolaan kegiatan pertambangan mineral dan batubara dapat berlangsung secara efektif, efisien, aman, dan ramah lingkungan,” kata Arifin.   .recads_wrapper{height:134px;position:relative;margin:10px 0 30px;padding:10px 15px;overflow:hidden;box-shadow:0 0 10px rgb(0 0 0 / 20%);}.recads_title{margin-bottom:10px;font-size:16px;font-weight:700}.arjW-list{overflow-x:scroll;overflow-y:hidden;white-space:nowrap;width:auto;padding:10px 0;position:relative;display:flex;scroll-snap-type:x;flex-wrap:nowrap}.recads_item{scroll-snap-align:start;width:280px;flex:0 0 280px;margin-right:20px;display: flex;white-space: normal;gap: 10px;}.recads_item a {display:flex;white-space:normal;gap:10px;}.recads_image{position:relative;height:auto}.recads_image img{width:auto;height: 73px!important;max-width:165px!important;border-radius:8px}.article_datas_title{font-size:14px;font-weight:700;line-height:1.2;margin:0;overflow:hidden;display:-webkit-box;-webkit-line-clamp:4;-webkit-box-orient:vertical;}.arjW-img-overlay{position:absolute;z-index:3;bottom:8px;left:0;padding:0 0 0 10px}.arjW-img-overlay>img{width:auto;height: 16px!important;}.recads_image::after{z-index:2;position:absolute;top:50%;bottom:4px;left:0;right:0;content:'';background:linear-gradient(to top,#d6d6d6,transparent);width:100%;border-radius: 8px;}             BERITA REKOMENDASI           Presiden Direktur PPA Christianto Setyo, mengungkapkan apresiasi atas diraihnya penghargaan ini dan komitmen PPA untuk terus menerapkan kaidah pertambangan yang baik pada operasional penambangan di setiap sitenya. “Tahun ini PPA berhasil mempertahankan trofi IUJP Terbaik dan mendapatkan 6 piagam Aditama, prestasi ini tidak terlepas dari dukungan insan PPA di seluruh Indonesia hingga penghargaan ini dapat diraih. kami juga mengucapkan terima kasih kepada Kementerian ESDM dan Ditjen Minerba atas apresiasi yang telah diberikan,” ujar Christianto usai menerima penghargaan. PPA dinyatakan meraih Penghargaan Trofi IUJP Terbaik dalam Pengelolaan Standardisasi Usaha Jasa Pertambangan Mineral & Batubara kelompok Pemegang Izin Usaha Jasa Pertambangan setelah PPA Site BIB, PPA Site MLP, PPA Site PTBA diumumkan meraih Piagam Penghargaan Aditama Pengelolaan Standarisasi Usaha Jasa Pertambangan Mineral & Batubara Kelompok Pemegang Izin Usaha Jasa Pertambangan.";02-10-2023;https://www.tribunnews.com/bisnis/2023/10/02/ppa-raih-penghargaan-jasa-pertambangan-terbaik-dari-kementerian-esdm;laporan wartawan tribunnews, sanusi tribunnews.com, jakarta - kementerian esdm memberikan penghargaan kepada perusahaan jasa kontraktor pertambangan pt putra perkasa abadi (ppa) sebagai pemegang izin usaha jasa pertambangan (iujp) terbaik di ajang good mining practice (gmp) award 2023, jumat (29/9/2023). gmp award 2023 kali ini diikuti 13 perusahaan kk, 33 perusahaan pkp2b (perjanjian karya pengusahaan pertambangan batubara), 30 perusahaan iupma (izin usaha pertambangan modal asing), 24 perusahaan iup pmdn, 9 perusahaan iupk (izin usaha pertambangan khusus), dan 65 perusahaan iujp. acara yang merupakan bentuk apresiasi pemerintah kepada para perusahaan sektor pertambangan di indonesia yang telah melakukan kaidah teknik pertambangan yang baik. ppa juga memperoleh piagam penghargaan aditama dalam pengelolaan standardisasi usaha jasa pertambangan mineral dan batubara di antara 65 badan usaha pemegang iujp yang dinilai. menteri esdm arifin tasrif mengungkapkan pentingnya penerapan kaidah teknis pertambangan yang baik. “dengan diterapkannya kaidah teknis pertambangan yang baik diharapkan pengelolaan kegiatan pertambangan mineral dan batubara dapat berlangsung secara efektif, efisien, aman, dan ramah lingkungan,” kata arifin. berita rekomendasi presiden direktur ppa christianto setyo, mengungkapkan apresiasi atas diraihnya penghargaan ini dan komitmen ppa untuk terus menerapkan kaidah pertambangan yang baik pada operasional penambangan di setiap sitenya. “tahun ini ppa berhasil mempertahankan trofi iujp terbaik dan mendapatkan 6 piagam aditama, prestasi ini tidak terlepas dari dukungan insan ppa di seluruh indonesia hingga penghargaan ini dapat diraih. kami juga mengucapkan terima kasih kepada kementerian esdm dan ditjen minerba atas apresiasi yang telah diberikan,” ujar christianto usai menerima penghargaan. ppa dinyatakan meraih penghargaan trofi iujp terbaik dalam pengelolaan standardisasi usaha jasa pertambangan mineral & batubara kelompok pemegang izin usaha jasa pertambangan setelah ppa site bib, ppa site mlp, ppa site ptba diumumkan meraih piagam penghargaan aditama pengelolaan standarisasi usaha jasa pertambangan mineral & batubara kelompok pemegang izin usaha jasa pertambangan.
Apa Itu Bursa Efek: Pengertian, Fungsi, dan Cara Kerjanya;KOMPAS.com - Bursa efek adalah istilah yang tentu sudah tidak asing lagi di telinga kita, nama lainnya adalah pasar modal. Apa itu bursa efek? Mengutip laman Otoritas Jasa Keuangan (OJK), bursa efek adalah pihak yang menyelenggarakan dan menyediakan sistem dan sarana, untuk mempertemukan penawaran jual dan beli efek dari pihak-pihak yang ingin memperdagangkan efek tersebut. Efek atau dalam istilah bahasa Inggris disebut security adalah suatu surat berharga yang bernilai serta dapat diperdagangkan. Contoh dari efek adalah saham dan obligasi. fungsi bursa efek indonesia adalah untuk menyelenggarakan dan menyediakan sistem dan atau sarana perdagangan efek atau surat berharga. Dengan tersedianya sistem dan atau sarana yang baik, para investor, perusahaan sekuritas, maupun perusahaan yang membutuhkan dana dari pasar modal dapat melakukan penawaran jual dan beli efek secara teratur, wajar, dan efisien. Di samping itu, tersedianya sistem dan atau sarana dimaksud memungkinkan bursa efek melakukan pengawasan terhadap anggotanya dengan lebih efektif. Saat ini fungsi bursa efek di Indonesia dilakukan oleh PT Bursa Efek Indonesia atau BEI. BEI sendiri merupakan gabungan dari Bursa Efek Jakarta (BEJ) dan Bursa Efek Surabaya (BES). BEI adalah lembaga yang ditunjuk secara resmi resmi dari pemerintah Indonesia yang memfasilitasi segala kegiatan jual beli saham perusahaan go public, maupun surat-surat berharga lainnya. Salah satu manfaat bursa efek adalah mendorong perekonomian nasional, terutama agar perusahaan-perusahaan yang beroperasi di Indonesia bisa mendapatkan akses modal dari investor. Sebagaimana yang sudah disebutkan di atas, bursa efek didirikan untuk menyelenggarakan dan menyediakan sistem dan atau sarana perdagangan efek agar teratur dan efisien. Secara umum, fungsi bursa efek indonesia adalah sebagai berikut: Perusahaan yang akan memperdagangkan sahamnya di publik, atau surat berharga lain seperti oblihasi, akan mendaftarkan diri di bursa efek. Dengan mencatatkan saham mereka di bursa efek, maka saham mereka bisa diperjual belikan kepada publik. Untuk prosesnya bakal difasilitasi oleh BEI. Namun demikian, untuk mencapai hal tersebut, perusahaan tersebut harus memenuhi persyaratan atau listing dari Bursa Efek Indonesia. Biasanya, perusahaan yang mencatatkan sahamnya di bursa adalah perusahaan yang sudah berpotensi menjadi perusahaan besar dengan modal besar akan mudah terdaftar. Di Indonesia, bursa efek adalah pertama kali diresmikan oleh Presiden Soeharto pada 10 Agustus 1977, yakni dengan dibukanya Bursa Efek Jakarta (BEJ) yang dijalankan di bawah Bapepam (Badan Pelaksana Pasar Modal) dengan PT Semen Cibinong sebagai emiten pertama. Lalu pada tahun 1989, pemerintah kembali membuka pasar modal lainnya, yakni Bursa Efek Surabaya (BES). Namun sejak tahun 2007, BEJ dan BES kemudian digabung menjadi Bursa Efek Indonesia (BEI). Sebutan lain di Indonesia dari bursa efek adalah IDX. BEI saat ini memiliki kantor di Jalan Sudirman, Jakarta. Jadi sudah tahu kan apa itu bursa efek? KOMPAS.com/GARRY ANDREW LOTULUNG Bursa efek adalah salah satu lokomotif penting dalam menggerakan ekonomi nasional, di mana salah satu manfaat bursa efek adalah untuk mempertemukan investor atau pemodal dan perusahaan yang membutuhkan dana. ;30-09-2023;https://money.kompas.com/read/2023/09/30/113051626/apa-itu-bursa-efek-pengertian-fungsi-dan-cara-kerjanya;bursa efek adalah istilah yang tentu sudah tidak asing lagi di telinga kita, nama lainnya adalah pasar modal. apa itu bursa efek? mengutip laman otoritas jasa keuangan (ojk), bursa efek adalah pihak yang menyelenggarakan dan menyediakan sistem dan sarana, untuk mempertemukan penawaran jual dan beli efek dari pihak-pihak yang ingin memperdagangkan efek tersebut. efek atau dalam istilah bahasa inggris disebut security adalah suatu surat berharga yang bernilai serta dapat diperdagangkan. contoh dari efek adalah saham dan obligasi. fungsi bursa efek indonesia adalah untuk menyelenggarakan dan menyediakan sistem dan atau sarana perdagangan efek atau surat berharga. dengan tersedianya sistem dan atau sarana yang baik, para investor, perusahaan sekuritas, maupun perusahaan yang membutuhkan dana dari pasar modal dapat melakukan penawaran jual dan beli efek secara teratur, wajar, dan efisien. di samping itu, tersedianya sistem dan atau sarana dimaksud memungkinkan bursa efek melakukan pengawasan terhadap anggotanya dengan lebih efektif. saat ini fungsi bursa efek di indonesia dilakukan oleh pt bursa efek indonesia atau bei. bei sendiri merupakan gabungan dari bursa efek jakarta (bej) dan bursa efek surabaya (bes). bei adalah lembaga yang ditunjuk secara resmi resmi dari pemerintah indonesia yang memfasilitasi segala kegiatan jual beli saham perusahaan go public, maupun surat-surat berharga lainnya. salah satu manfaat bursa efek adalah mendorong perekonomian nasional, terutama agar perusahaan-perusahaan yang beroperasi di indonesia bisa mendapatkan akses modal dari investor. sebagaimana yang sudah disebutkan di atas, bursa efek didirikan untuk menyelenggarakan dan menyediakan sistem dan atau sarana perdagangan efek agar teratur dan efisien. secara umum, fungsi bursa efek indonesia adalah sebagai berikut: perusahaan yang akan memperdagangkan sahamnya di publik, atau surat berharga lain seperti oblihasi, akan mendaftarkan diri di bursa efek. dengan mencatatkan saham mereka di bursa efek, maka saham mereka bisa diperjual belikan kepada publik. untuk prosesnya bakal difasilitasi oleh bei. namun demikian, untuk mencapai hal tersebut, perusahaan tersebut harus memenuhi persyaratan atau listing dari bursa efek indonesia. biasanya, perusahaan yang mencatatkan sahamnya di bursa adalah perusahaan yang sudah berpotensi menjadi perusahaan besar dengan modal besar akan mudah terdaftar. di indonesia, bursa efek adalah pertama kali diresmikan oleh presiden soeharto pada 10 agustus 1977, yakni dengan dibukanya bursa efek jakarta (bej) yang dijalankan di bawah bapepam (badan pelaksana pasar modal) dengan pt semen cibinong sebagai emiten pertama. lalu pada tahun 1989, pemerintah kembali membuka pasar modal lainnya, yakni bursa efek surabaya (bes). namun sejak tahun 2007, bej dan bes kemudian digabung menjadi bursa efek indonesia (bei). sebutan lain di indonesia dari bursa efek adalah idx. bei saat ini memiliki kantor di jalan sudirman, jakarta. jadi sudah tahu kan apa itu bursa efek? kompas.com/garry andrew lotulung bursa efek adalah salah satu lokomotif penting dalam menggerakan ekonomi nasional, di mana salah satu manfaat bursa efek adalah untuk mempertemukan investor atau pemodal dan perusahaan yang membutuhkan dana. 
