Title;Content;Date;URL;Cleaned Article
 Profil Perusahaan 'Kawalan' AA Gym yang Harga Sahamnya Anjlok ;"Perusahaan fesyen yang mendapuk Ustaz Abdullah Gymnastiar atau Aa Gym sebagai komisaris, PT Bersama Zatta Jaya Tbk (ZATA) atau elcorps, mendadak mencuri perhatian. Pasalnya, harga saham perusahaan yang resmi melantai di Bursa Efek Indonesia (BEI) pada November 2022 lalu ini anjlok mendekati Rp50 per unit. Hari ini, Jumat (27/1) pukul 10.50 WIB, harga saham ZATA turun cukup dalam 4 poin atau 6,35 persen menjadi Rp59 per unit. Padahal, saat penawaran umum perdana, harga saham perseroan ditawarkan Rp100 per unit.  ADVERTISEMENT   SCROLL TO CONTINUE WITH CONTENT   Berdasarkan portal resmi elcorps.com, perusahaan merupakan perseroan yang bergerak dalam bidang perdagangan pakaian dan berfokus pada bidang fesyen muslim/modest fashion. Ia tercatat sebagai induk usaha fesyen muslim merek dagang Elzatta. Saat ini perseroan dan perusahaan anak tercatat memiliki 123 toko yang tersebar di seluruh Indonesia. Perusahaan yang didirikan pada 2012 ini memiliki karyawan sebanyak 79 orang (2022). AA Gym sebelumnya diangkat menjadi komisaris menjelang perusahaan melantai di BEI. ""Berdasarkan akta No.16 tanggal 4 Agustus 2022, anggota Direksi dan Dewan Komisaris Perseroan diangkat dengan masa jabatan selama lima tahun sampai dengan penutupan RUPS tahunan untuk tahun buku 2027,"" tulis manajemen dalam prospektus pada Selasa (25/10).   Sebagai komisaris, Aa Gym bertanggung jawab atas pengawasan kebijakan pengurusan, jalannya pengurusan pada umumnya, dan memberi nasihat kepada Direksi. Ia juga bertugas memberikan persetujuan atas rencana kerja tahunan perseroan, selambat-lambatnya sebelum dimulainya tahun buku yang akan datang. Dalam prospektus tersebut, gaji dan tunjangan yang diterima Dewan Komisaris untuk periode yang berakhir pada 31 Maret 2022, 31 Desember 2021 dan 2020 adalah senilai Rp214,2 juta, Rp998,8 juta dan Rp1 miliar. [Gambas:Video CNN] ";27-01-2023;https://www.cnnindonesia.com/ekonomi/20230127111314-92-905544/profil-perusahaan-kawalan-aa-gym-yang-harga-sahamnya-anjlok;"perusahaan fesyen yang mendapuk ustaz abdullah gymnastiar atau aa gym sebagai komisaris, pt bersama zatta jaya tbk (zata) atau elcorps, mendadak mencuri perhatian. pasalnya, harga saham perusahaan yang resmi melantai di bursa efek indonesia (bei) pada november 2022 lalu ini anjlok mendekati rp50 per unit. hari ini, jumat (27/1) pukul 10.50 wib, harga saham zata turun cukup dalam 4 poin atau 6,35 persen menjadi rp59 per unit. padahal, saat penawaran umum perdana, harga saham perseroan ditawarkan rp100 per unit. berdasarkan portal resmi elcorps.com, perusahaan merupakan perseroan yang bergerak dalam bidang perdagangan pakaian dan berfokus pada bidang fesyen muslim/modest fashion. ia tercatat sebagai induk usaha fesyen muslim merek dagang elzatta. saat ini perseroan dan perusahaan anak tercatat memiliki 123 toko yang tersebar di seluruh indonesia. perusahaan yang didirikan pada 2012 ini memiliki karyawan sebanyak 79 orang (2022). aa gym sebelumnya diangkat menjadi komisaris menjelang perusahaan melantai di bei. ""berdasarkan akta no.16 tanggal 4 agustus 2022, anggota direksi dan dewan komisaris perseroan diangkat dengan masa jabatan selama lima tahun sampai dengan penutupan rups tahunan untuk tahun buku 2027,"" tulis manajemen dalam prospektus pada selasa (25/10). sebagai komisaris, aa gym bertanggung jawab atas pengawasan kebijakan pengurusan, jalannya pengurusan pada umumnya, dan memberi nasihat kepada direksi. ia juga bertugas memberikan persetujuan atas rencana kerja tahunan perseroan, selambat-lambatnya sebelum dimulainya tahun buku yang akan datang. dalam prospektus tersebut, gaji dan tunjangan yang diterima dewan komisaris untuk periode yang berakhir pada 31 maret 2022, 31 desember 2021 dan 2020 adalah senilai rp214,2 juta, rp998,8 juta dan rp1 miliar. "
 RI Terapkan BBM Campur Sawit 35 Persen Mulai Besok ;"Pemerintah bakal menerapkan penggunaan bahan bakar minyak (BBM) solar campur minyak sawit sebesar 35 persen mulai besok(1/2) besok. Deputi Bidang Koordinasi Pangan dan Agribisnis Kementerian Koordinator Bidang Perekonomian Musdhalifah Machmud menyampaikan hal tersebut dalam acara Energy Corner Special B35 Implementation di Kementerian Koordinator Bidang Perekonomian. ""Insyaallah B35 akan dimulai besok hari pada 1 Februari 2023. B35 akan segera masuk di dalam seluruh transportasi nasional kita yang menggunakan bahan bakar biodiesel,"" katanya, Selasa (31/1).  ADVERTISEMENT   SCROLL TO CONTINUE WITH CONTENT   Musdhalifah mengatakan target penyaluran B35 pada 2023 adalah 13,15 juta kiloliter (KL). Target ini ia klaim bisa menghemat devisa sekitar US$10,75 miliar alias setara Rp161 triliun. B35 merupakan campuran bahan bakar nabati berbasis minyak kelapa sawit, yaitu Fatty Acid Methyl Esters (FAME). Adapun kadar minyak sawitnya adalah 35 persen, sementara 65 persen lainnya merupakan BBM jenis solar. Kementerian ESDM mengungkapkan program B35 merupakan langkah antisipasi lonjakan harga minyak dunia serta menekan impor solar. Selain itu, program tersebut juga diharapkan dapat meningkatkan pemanfaatan energi terbarukan.   ""Implementasi B35 bukan hanya energi, tetapi kami mendukung penciptaan lapangan kerja baru, menciptakan penurunan emisi gas rumah kaca, menghemat devisa negara dari pembelian energi fosil dari luar, dan menjalankan energi biru,"" tutur Musdhalifah. Ia juga mengklaim implementasi B35 ini  sudah mempertimbangkan kesiapan badan usaha (BU) bahan bakar nabati (BBN) dan BU BBM, baik dari aspek kesiapan pasokan, distribusi, termasuk infrastruktur penunjang. [Gambas:Video CNN] ";31-01-2023;https://www.cnnindonesia.com/ekonomi/20230131115611-85-906963/ri-terapkan-bbm-campur-sawit-35-persen-mulai-besok;"pemerintah bakal menerapkan penggunaan bahan bakar minyak (bbm) solar campur minyak sawit sebesar 35 persen mulai besok(1/2) besok. deputi bidang koordinasi pangan dan agribisnis kementerian koordinator bidang perekonomian musdhalifah machmud menyampaikan hal tersebut dalam acara energy corner special b35 implementation di kementerian koordinator bidang perekonomian. ""insyaallah b35 akan dimulai besok hari pada 1 februari 2023. b35 akan segera masuk di dalam seluruh transportasi nasional kita yang menggunakan bahan bakar biodiesel,"" katanya, selasa (31/1). musdhalifah mengatakan target penyaluran b35 pada 2023 adalah 13,15 juta kiloliter (kl). target ini ia klaim bisa menghemat devisa sekitar us$10,75 miliar alias setara rp161 triliun. b35 merupakan campuran bahan bakar nabati berbasis minyak kelapa sawit, yaitu fatty acid methyl esters (fame). adapun kadar minyak sawitnya adalah 35 persen, sementara 65 persen lainnya merupakan bbm jenis solar. kementerian esdm mengungkapkan program b35 merupakan langkah antisipasi lonjakan harga minyak dunia serta menekan impor solar. selain itu, program tersebut juga diharapkan dapat meningkatkan pemanfaatan energi terbarukan. ""implementasi b35 bukan hanya energi, tetapi kami mendukung penciptaan lapangan kerja baru, menciptakan penurunan emisi gas rumah kaca, menghemat devisa negara dari pembelian energi fosil dari luar, dan menjalankan energi biru,"" tutur musdhalifah. ia juga mengklaim implementasi b35 ini sudah mempertimbangkan kesiapan badan usaha (bu) bahan bakar nabati (bbn) dan bu bbm, baik dari aspek kesiapan pasokan, distribusi, termasuk infrastruktur penunjang. "
 Harga Emas Antam Turun Lagi ke Rp1.030 Juta per Gram ;"Harga jual emas PT Aneka Tambang (Persero) Tbk atau Antam berada di posisi Rp1,030 juta per gram pada Jumat (27/1). Harga emas Antam ini turun Rp5.000 ribu per gram dibandingkan harga pada perdagangan sebelumnya sebesar Rp1,035 juta per gram. Senada, harga pembelian kembali (buyback) juga turun Rp5.000 per gram, dari Rp941 ribu menjadi Rp936 ribu per gram. Berdasarkan data Antam, harga jual emas berukuran 0,5 gram senilai Rp565 ribu, 2 gram Rp2 juta, 3 gram Rp2,97 juta, 5 gram Rp4,92 juta, 10 gram Rp9,79 juta, 25 gram Rp24,36 juta, dan 50 gram Rp48,64 juta.  ADVERTISEMENT   SCROLL TO CONTINUE WITH CONTENT   Kemudian, harga emas berukuran 100 gram senilai Rp97,21 juta, 250 gram Rp242,76 juta, 500 gram Rp485,32 juta, dan 1 kilogram Rp970,6 juta. Harga jual emas tersebut sudah termasuk Pajak Penghasilan (PPh) 22 atas emas batangan sebesar 0,45 persen bagi pemegang Nomor Pokok Wajib Pajak (NPWP). Pembeli yang tidak menyertakan NPWP dikenakan potongan pajak lebih tinggi sebesar 0,9 persen. Kemudian, untuk harga emas di perdagangan internasional berdasarkan acuan pasar Commodity Exchange COMEX menguat 0,06 persen menjadi US$1.947,8 per troy ons. Senada, harga emas di perdagangan spot juga naik 0,15 persen menjadi US$1.932,09 per troy ons.   Senior Analis DCFX Lukman Leong memperkirakan harga emas bakal turun karena data pertumbuhan AS yang positif, tercatat 2,9 persen pada kuartal IV-2022. Lebih tinggi dari perkiraan pasar sebesar 2,6 persen. ""Ini memicu kekhawatiran apabila The Fed akan lebih lama mempertahankan suku bunga tinggi mereka. Investor sekarang mengalihkan perhatian pada data inflasi PCE AS malam ini,"" ujarnya kepada CNNIndonesia.com. Hari ini, Lukman memperkirakan harga emas internasional berada dalam rentang US$1.920-US$1.950 per troy ons. [Gambas:Video CNN] ";27-01-2023;https://www.cnnindonesia.com/ekonomi/20230127091238-92-905491/harga-emas-antam-turun-lagi-ke-rp1030-juta-per-gram;"harga jual emas pt aneka tambang (persero) tbk atau antam berada di posisi rp1,030 juta per gram pada jumat (27/1). harga emas antam ini turun rp5.000 ribu per gram dibandingkan harga pada perdagangan sebelumnya sebesar rp1,035 juta per gram. senada, harga pembelian kembali (buyback) juga turun rp5.000 per gram, dari rp941 ribu menjadi rp936 ribu per gram. berdasarkan data antam, harga jual emas berukuran 0,5 gram senilai rp565 ribu, 2 gram rp2 juta, 3 gram rp2,97 juta, 5 gram rp4,92 juta, 10 gram rp9,79 juta, 25 gram rp24,36 juta, dan 50 gram rp48,64 juta. kemudian, harga emas berukuran 100 gram senilai rp97,21 juta, 250 gram rp242,76 juta, 500 gram rp485,32 juta, dan 1 kilogram rp970,6 juta. harga jual emas tersebut sudah termasuk pajak penghasilan (pph) 22 atas emas batangan sebesar 0,45 persen bagi pemegang nomor pokok wajib pajak (npwp). pembeli yang tidak menyertakan npwp dikenakan potongan pajak lebih tinggi sebesar 0,9 persen. kemudian, untuk harga emas di perdagangan internasional berdasarkan acuan pasar commodity exchange comex menguat 0,06 persen menjadi us$1.947,8 per troy ons. senada, harga emas di perdagangan spot juga naik 0,15 persen menjadi us$1.932,09 per troy ons. senior analis dcfx lukman leong memperkirakan harga emas bakal turun karena data pertumbuhan as yang positif, tercatat 2,9 persen pada kuartal iv-2022. lebih tinggi dari perkiraan pasar sebesar 2,6 persen. ""ini memicu kekhawatiran apabila the fed akan lebih lama mempertahankan suku bunga tinggi mereka. investor sekarang mengalihkan perhatian pada data inflasi pce as malam ini,"" ujarnya kepada cnnindonesia.com. hari ini, lukman memperkirakan harga emas internasional berada dalam rentang us$1.920-us$1.950 per troy ons. "
 Minyakita Akan Setop Produksi, Harga Tembus Rp16 Ribu per Liter ;"Harga minyak goreng kemasan sederhana besutan pemerintah, Minyakita, melambung tinggi di atas harga eceran tertinggi (HET) yang ditetapkan Rp14 ribu per liter. Mengutip detikcom, Jumat (27/1), di beberapa pasar tradisional wilayah Tangerang Selatan, harga Minyakita bahkan tembus Rp16 ribu per liter. Ketua Ikatan Pedagang Pasar Indonesia (IKAPPI) Abdullah Mansuri mengatakan lonjakan harga tersebut dipicu karena stok Minyakita sudah tidak ada.  ADVERTISEMENT   SCROLL TO CONTINUE WITH CONTENT   ""Rata-rata agen dan distributor menyatakan bahwa Minyakita stoknya sudah habis. Bahkan ada yang bilang tidak produksi. Sampai Maret hanya mengeluarkan stok yang ada, menghabiskan stok yang ada,"" tuturnya kepada detikcom, Jumat (27/1). ""Artinya Minyakita sudah tidak bisa diandalkan. Iya penghabisan sampai Maret. Artinya tidak ada produksi lagi,"" ucapnya. Ia menambahkan lonjakan harga Minyakita di atas Rp15 ribu per liter sudah terjadi sejak sebulan lalu. Tidak hanya di Pulau Jawa, bahkan di luar Pulau Jawa kini juga kesulitan mendapatkan Minyakita. Menurutnya, harga Minyakita bisa melambung lebih tinggi lagi dari sekarang lantaran barangnya yang tidak ada. Selain itu, Abdullah juga mengaku tengah mengecek di RNI soal setok Minyakita. Ia mengatakan baik RNI maupun beberapa perusahaan tidak memiliki barang tersebut.  Ia mengaku banyak pihak-pihak yang memprotes langkanya pasokan Minyakita di pasar-pasar.  ""Karena memang agen atau distributor yang biasa mereka pakai memang sudah nggak sanggup lagi untuk mendistribusi sehingga mereka mendorong kami untuk melobi beberapa perusahaan, termasuk lobi Kemendag untuk mendapatkan Minyakita,"" ungkapnya. Ia pun turut mempertanyakan sistem pengawasan yang dilakukan pemerintah dalam mencegah kelangkaan Minyakita yang terjadi di pasaran. Menurutnya, pemerintah belum mampu mengontrol jumlah produksi Minyakita di dalam negeri dan hal itu terlihat dari pasang-surutnya komoditas tersebut di pasaran.  ""Kan yang mencetuskan Minyakita ini Menteri Perdagangan, kenapa Menteri Perdagangan tidak mampu mengontrol ini barangnya harganya tinggi, barangnya nggak ada? Bagaimana sistem kontrol yang dilakukan Kementerian Perdagangan terhadap distributor minyak?"" katanya.  ""Nah, yang kayak gini kan menyulitkan kami, pedagang. Pedagang sulit, masyarakat sulit,"" imbuhnya.  Mansuri mengungkapkan, apabila kondisi seperti ini terus berlangsung, maka salah satu solusinya adalah kembali menggunakan minyak curah. ""Karena nggak ada pilihan. Kalau Minyakita nggak ada sedangkan konsumen nguber kita terus kan pilihannya nggak ada lagi kecuali minyak curah,"" tutupnya.  [Gambas:Video CNN] ";27-01-2023;https://www.cnnindonesia.com/ekonomi/20230127181549-92-905802/minyakita-akan-setop-produksi-harga-tembus-rp16-ribu-per-liter;"harga minyak goreng kemasan sederhana besutan pemerintah, minyakita, melambung tinggi di atas harga eceran tertinggi (het) yang ditetapkan rp14 ribu per liter. mengutip detikcom, jumat (27/1), di beberapa pasar tradisional wilayah tangerang selatan, harga minyakita bahkan tembus rp16 ribu per liter. ketua ikatan pedagang pasar indonesia (ikappi) abdullah mansuri mengatakan lonjakan harga tersebut dipicu karena stok minyakita sudah tidak ada. ""rata-rata agen dan distributor menyatakan bahwa minyakita stoknya sudah habis. bahkan ada yang bilang tidak produksi. sampai maret hanya mengeluarkan stok yang ada, menghabiskan stok yang ada,"" tuturnya kepada detikcom, jumat (27/1). ""artinya minyakita sudah tidak bisa diandalkan. iya penghabisan sampai maret. artinya tidak ada produksi lagi,"" ucapnya. ia menambahkan lonjakan harga minyakita di atas rp15 ribu per liter sudah terjadi sejak sebulan lalu. tidak hanya di pulau jawa, bahkan di luar pulau jawa kini juga kesulitan mendapatkan minyakita. menurutnya, harga minyakita bisa melambung lebih tinggi lagi dari sekarang lantaran barangnya yang tidak ada. selain itu, abdullah juga mengaku tengah mengecek di rni soal setok minyakita. ia mengatakan baik rni maupun beberapa perusahaan tidak memiliki barang tersebut. ia mengaku banyak pihak-pihak yang memprotes langkanya pasokan minyakita di pasar-pasar. ""karena memang agen atau distributor yang biasa mereka pakai memang sudah nggak sanggup lagi untuk mendistribusi sehingga mereka mendorong kami untuk melobi beberapa perusahaan, termasuk lobi kemendag untuk mendapatkan minyakita,"" ungkapnya. ia pun turut mempertanyakan sistem pengawasan yang dilakukan pemerintah dalam mencegah kelangkaan minyakita yang terjadi di pasaran. menurutnya, pemerintah belum mampu mengontrol jumlah produksi minyakita di dalam negeri dan hal itu terlihat dari pasang-surutnya komoditas tersebut di pasaran. ""kan yang mencetuskan minyakita ini menteri perdagangan, kenapa menteri perdagangan tidak mampu mengontrol ini barangnya harganya tinggi, barangnya nggak ada? bagaimana sistem kontrol yang dilakukan kementerian perdagangan terhadap distributor minyak?"" katanya. ""nah, yang kayak gini kan menyulitkan kami, pedagang. pedagang sulit, masyarakat sulit,"" imbuhnya. mansuri mengungkapkan, apabila kondisi seperti ini terus berlangsung, maka salah satu solusinya adalah kembali menggunakan minyak curah. ""karena nggak ada pilihan. kalau minyakita nggak ada sedangkan konsumen nguber kita terus kan pilihannya nggak ada lagi kecuali minyak curah,"" tutupnya. "
         IHSG Diramal Dekati 7.000, Intip Saham-saham yang Bisa Cuan    ; Pada perdagangan akhir pekan lalu (27/1), IHSG ditutup menguat sebesar +0,50% atau +34,16 poin di level 6.898,98. Financial Expert Ajaib Sekuritas, Ratih Mustikoningsih meramalkan IHSG hari ini bergerak mixed mendekati level 7.000 dalam rentang level 6.847 - 6.952. Sejumlah informasi penting bakal jadi penggerak IHSG hari ini, salah satunya datang dari Kementerian Pekerjaan Umum dan Perumahan Rakyat (PUPR) yang menyiapkan dana APBN sebesar Rp481 miliar untuk meningkatkan kualitas infrastruktur di Labuan Bajo, Nusa Tenggara Timur.      ADVERTISEMENT         SCROLL TO CONTINUE WITH CONTENT    Sementara itu, inflasi pada Januari 2023 diprediksi di level 0,5% MoM, dalam periode tahunan di proyeksikan tumbuh 5,4% YoY pada Januari 2023. Hal tersebut dikarenakan adanya efek liburan natal dan tahun baru pada akhir tahun 2022 dan dilanjutkan momentum imlek pada awal tahun sehingga terjadi peningkatan permintaan ditengah masalah stok supply yang terbatas. Dari mancanegara, PCE Price Index Amerika Serikat pada periode Desember 2022 tercatat pada level 5% YoY atau 0,1% MoM. Core PCE Price Index Amerika Serikat pada Desember 2022 tercatat di level 4,4% YoY atau 0,3% MoM. Sementara itu, Jepang mencatat Consumer Price Index periode Januari 2023 tumbuh 4,4% YoY, lebih tinggi dibanding periode sebelumnya yang tercatat di level 4% YoY. Saham - saham pilihan Ajaib Sekuritas SLIS Buy : 210 TP :218 Stop loss : 204 Morning star candle dengan konfirmasi volume yang naik signifikan, stochastic bergerak goldencross pada area oversold dan MACD bearish terbatas indikasi bullish continuation. Kinerja SLIS cemerlang, berhasil mencatat pertumbuhan laba bersih 25% yoy mencapai Rp25,46 miliar. Rencana pemerintah terkait pemberian subsidi kendaraan listrik akan mendorong peningkatan kapasitas volume produksi SLIS sehingga memicu peningkatan profitabilitas ke depan. DRMA Buy : 585 TP : 605 Stop loss : 570 Tertahan di atas MA 5 hari, stochastic goldencross di area netral indikasi berpeluang bullish short term, MACD bar histogram dalam momentum positif. Kinerja DRMA sepanjang kuartal III 2022 mencatat pertumbuhan net profit mencapai 74% QoQ. Prospek DRMA ke depan cukup positif dengan fokus bisnis komponen kendaraan listrik, di mana tren permintaan kendaraan listrik ke depan diproyeksi dapat tumbuh. SIDO Buy : 760 TP : 785 Stop loss : 745 SIDO bergerak uptrend jangka pendek, indicator stochastic naik dengan MACD bar histogram dalam momentum positif. Berpotensi melanjutkan bullish trend. SIDO mengalokasikan capex sebesar Rp197 miliar di tahun ini untuk ekspansi. Net foreign buy secara YTD sebesar Rp2,74 miliar dan beberapa investor asing seperti Blackrock juga rutin mengakumulasi SIDO. Katalis positif lainnya adalah ditambahkannya SIDO dalam LQ45 periode Februari - Juli 2023. Investasi saham mengandung risiko dan seluruhnya menjadi tanggung jawab pribadi. Informasi ini disusun melalui riset internal, tidak dipengaruhi pihak manapun, dan bukan merupakan rekomendasi, ajakan, usulan ataupun paksaan untuk melakukan transaksi jual/beli Efek. Harga saham berfluktuasi secara real-time. Harap berinvestasi sesuai pertimbangan yang matang.;30-01-2023;https://finance.detik.com/market-research/d-6541163/ihsg-diramal-dekati-7-000-intip-saham-saham-yang-bisa-cuan;pada perdagangan akhir pekan lalu (27/1), ihsg ditutup menguat sebesar +0,50% atau +34,16 poin di level 6.898,98. financial expert ajaib sekuritas, ratih mustikoningsih meramalkan ihsg hari ini bergerak mixed mendekati level 7.000 dalam rentang level 6.847 - 6.952. sejumlah informasi penting bakal jadi penggerak ihsg hari ini, salah satunya datang dari kementerian pekerjaan umum dan perumahan rakyat (pupr) yang menyiapkan dana apbn sebesar rp481 miliar untuk meningkatkan kualitas infrastruktur di labuan bajo, nusa tenggara timur. sementara itu, inflasi pada januari 2023 diprediksi di level 0,5% mom, dalam periode tahunan di proyeksikan tumbuh 5,4% yoy pada januari 2023. hal tersebut dikarenakan adanya efek liburan natal dan tahun baru pada akhir tahun 2022 dan dilanjutkan momentum imlek pada awal tahun sehingga terjadi peningkatan permintaan ditengah masalah stok supply yang terbatas. dari mancanegara, pce price index amerika serikat pada periode desember 2022 tercatat pada level 5% yoy atau 0,1% mom. core pce price index amerika serikat pada desember 2022 tercatat di level 4,4% yoy atau 0,3% mom. sementara itu, jepang mencatat consumer price index periode januari 2023 tumbuh 4,4% yoy, lebih tinggi dibanding periode sebelumnya yang tercatat di level 4% yoy. saham - saham pilihan ajaib sekuritas slis buy : 210 tp :218 stop loss : 204 morning star candle dengan konfirmasi volume yang naik signifikan, stochastic bergerak goldencross pada area oversold dan macd bearish terbatas indikasi bullish continuation. kinerja slis cemerlang, berhasil mencatat pertumbuhan laba bersih 25% yoy mencapai rp25,46 miliar. rencana pemerintah terkait pemberian subsidi kendaraan listrik akan mendorong peningkatan kapasitas volume produksi slis sehingga memicu peningkatan profitabilitas ke depan. drma buy : 585 tp : 605 stop loss : 570 tertahan di atas ma 5 hari, stochastic goldencross di area netral indikasi berpeluang bullish short term, macd bar histogram dalam momentum positif. kinerja drma sepanjang kuartal iii 2022 mencatat pertumbuhan net profit mencapai 74% qoq. prospek drma ke depan cukup positif dengan fokus bisnis komponen kendaraan listrik, di mana tren permintaan kendaraan listrik ke depan diproyeksi dapat tumbuh. sido buy : 760 tp : 785 stop loss : 745 sido bergerak uptrend jangka pendek, indicator stochastic naik dengan macd bar histogram dalam momentum positif. berpotensi melanjutkan bullish trend. sido mengalokasikan capex sebesar rp197 miliar di tahun ini untuk ekspansi. net foreign buy secara ytd sebesar rp2,74 miliar dan beberapa investor asing seperti blackrock juga rutin mengakumulasi sido. katalis positif lainnya adalah ditambahkannya sido dalam lq45 periode februari - juli 2023. investasi saham mengandung risiko dan seluruhnya menjadi tanggung jawab pribadi. informasi ini disusun melalui riset internal, tidak dipengaruhi pihak manapun, dan bukan merupakan rekomendasi, ajakan, usulan ataupun paksaan untuk melakukan transaksi jual/beli efek. harga saham berfluktuasi secara real-time. harap berinvestasi sesuai pertimbangan yang matang.
