Title;Content;Date;URL;Cleaned Article
Investasi Obligasi: Definisi, Jenis, dan Untung Ruginya;KOMPAS.com - Investasi obligasi adalah salah satu alternatif investasi yang bisa dikatakan nyaris tanpa risiko. Keuntungan investasi obligasi lainnya adalah keuntungan dari selisih harga di pasar apabila investor kemudian menjualnya. Dikutip dari laman resmi Otoritas Jasa Keuangan (OJK), investasi obligasi adalah investasi dalam bentuk pembelian surat utang jangka panjang yang diterbitkan oleh perusahaan atau pemerintah dengan nilai nominal dan waktu jatuh tempo tertentu. Meski ada tanggal jatuh tempo, bukan berarti obligasi tersebut dipegang hingga jatuh tempo, karena sebenarnya dapat diperjualbelikan pada pasar sekunder. Berbeda dengan saham yang memberikan hak kepemilikan kepada pemegangnya, obligasi sebenarnya merupakan pinjaman yang Anda (investor) berikan kepada suatu perusahaan atau pemerintah. Penerbit obligasi bisa disebut debitur dan pembeli obligasi adalah kreditur atau investor. Pembayaran yang harus dilunasi tersebut yakni utang pokok ditambah dengan bunga atau yang biasa disebut kupon. Singkatnya, obligasi adalah surat utang yang bisa dibeli dan pembeli akan mendapat keuntungan berupa bunga. Obligasi adalah instrumen investasi yang bisa dipilih investor di pasar modal selain efek saham yang diperdagangkan. Jenis-jenis obligas cukup beragam yang dibedakan dari beberapa kriteria. Berikut beberapa di antaranya: 1. Obligasi pemerintah Obligasi pemerintah adalah jenis investasi obligasi dalam bentuk Surat Utang Negara yang diterbitkan oleh Pemerintah RI. Pemerintah menerbitkan obligasi dengan kupon tetap, obligasi dengan kupon variabel, dan obligasi dengan prinsip syariah atau sukuk. 2. Obligasi korporasi Yaitu obligasi berupa surat utang yang diterbitkan oleh perusahaan Indonesia, baik BUMN maupun korporasi swasta lainnya. Sama seperti obligasi pemerintah, obligasi korporasi terbagi atas obligasi dengan kupon tetap, obligasi dengan kupon variabel dan obligasi dengan prinsip syariah. Ada Obligasi Korporasi yang telah diperingkat atau pula yang tidak diperingkat. 3. Obligasi ritel Obligasi yang diterbitkan oleh pemerintah yang dijual kepada individu atau perseorangan melalui agen penjual yang ditunjuk oleh pemerintah. Biasanya, ada beberapa jenis yaitu ORI atau sukuk ritel. 1. Obligasi konvensional Obligasi konvensional dalam jenis obligasi berdasarkan imbal hasil diartikan sebagai surat utang yang diterbitkan pihak tertentu untuk mendapat pinjaman. Nantinya, pinjaman akan digunakan sebagai tambahan modal dengan perjanjian memberikan imbal hasil atau bunga kepada investor dalam jangka waktu tertentu. 2. Obligasi syariah Obligasi syariah atau dikenal dengan nama sukuk adalah surat utang yang memberikan imbal hasil berupa uang sewa. Perhitungannya dilakukan berdasarkan prinsip syariah Islam, tanpa mengandung unsur riba. Imbal hasil akan dibayarkan secara berkala dalam periode tertentu. Sementara, peminjam akan melunasi pokok utang pada tanggal jatuh tempo. ;10-05-2023;https://money.kompas.com/read/2023/05/10/125830226/investasi-obligasi-definisi-jenis-dan-untung-ruginya?page=all;investasi obligasi adalah salah satu alternatif investasi yang bisa dikatakan nyaris tanpa risiko. keuntungan investasi obligasi lainnya adalah keuntungan dari selisih harga di pasar apabila investor kemudian menjualnya. dikutip dari laman resmi otoritas jasa keuangan (ojk), investasi obligasi adalah investasi dalam bentuk pembelian surat utang jangka panjang yang diterbitkan oleh perusahaan atau pemerintah dengan nilai nominal dan waktu jatuh tempo tertentu. meski ada tanggal jatuh tempo, bukan berarti obligasi tersebut dipegang hingga jatuh tempo, karena sebenarnya dapat diperjualbelikan pada pasar sekunder. berbeda dengan saham yang memberikan hak kepemilikan kepada pemegangnya, obligasi sebenarnya merupakan pinjaman yang anda (investor) berikan kepada suatu perusahaan atau pemerintah. penerbit obligasi bisa disebut debitur dan pembeli obligasi adalah kreditur atau investor. pembayaran yang harus dilunasi tersebut yakni utang pokok ditambah dengan bunga atau yang biasa disebut kupon. singkatnya, obligasi adalah surat utang yang bisa dibeli dan pembeli akan mendapat keuntungan berupa bunga. obligasi adalah instrumen investasi yang bisa dipilih investor di pasar modal selain efek saham yang diperdagangkan. jenis-jenis obligas cukup beragam yang dibedakan dari beberapa kriteria. berikut beberapa di antaranya: 1. obligasi pemerintah obligasi pemerintah adalah jenis investasi obligasi dalam bentuk surat utang negara yang diterbitkan oleh pemerintah ri. pemerintah menerbitkan obligasi dengan kupon tetap, obligasi dengan kupon variabel, dan obligasi dengan prinsip syariah atau sukuk. 2. obligasi korporasi yaitu obligasi berupa surat utang yang diterbitkan oleh perusahaan indonesia, baik bumn maupun korporasi swasta lainnya. sama seperti obligasi pemerintah, obligasi korporasi terbagi atas obligasi dengan kupon tetap, obligasi dengan kupon variabel dan obligasi dengan prinsip syariah. ada obligasi korporasi yang telah diperingkat atau pula yang tidak diperingkat. 3. obligasi ritel obligasi yang diterbitkan oleh pemerintah yang dijual kepada individu atau perseorangan melalui agen penjual yang ditunjuk oleh pemerintah. biasanya, ada beberapa jenis yaitu ori atau sukuk ritel. 1. obligasi konvensional obligasi konvensional dalam jenis obligasi berdasarkan imbal hasil diartikan sebagai surat utang yang diterbitkan pihak tertentu untuk mendapat pinjaman. nantinya, pinjaman akan digunakan sebagai tambahan modal dengan perjanjian memberikan imbal hasil atau bunga kepada investor dalam jangka waktu tertentu. 2. obligasi syariah obligasi syariah atau dikenal dengan nama sukuk adalah surat utang yang memberikan imbal hasil berupa uang sewa. perhitungannya dilakukan berdasarkan prinsip syariah islam, tanpa mengandung unsur riba. imbal hasil akan dibayarkan secara berkala dalam periode tertentu. sementara, peminjam akan melunasi pokok utang pada tanggal jatuh tempo. 
Mengenal Apa Itu SBR, Imbal Hasil, dan Risikonya;KOMPAS.com - Savings Bond Ritel (SBR) menjadi salah satu produk investasi yang bisa dipilih oleh masyarakat. SBR adalah Surat Utang Negara (SUN) yang diterbitkan pemerintah untuk warga negara Indonesia (WNI). Salah satu bentuk obligasi pemerintah ini memiliki risiko moderat, yang lebih tinggi dibandingkan deposito tapi lebih rendah dibandingkan saham. Lantas, bagaimana sistem imbal hasil dari investasi Savings Bond Ritel (SBR)? Dilansir dari laman resmi Otoritas Jasa Keuangan (OJK), investor SBR akan memperoleh imbal hasil berupa kupon yang dibayarkan setiap bulannya. Kupon SBR bersifat mengambang dengan tingkat kupon minimal (floating with floor) dan mengacu pada BI-7 Days Reverse Repo Rate (BI-7DRR) yang disesuaikan setiap tiga bulan pada tanggal penyesuaian kupon. Investasi SBR relatif aman dari gagal bayar dikarenakan pembayaran pokok dan kuponnya dijamin negara. Pajak yang dikenakan atas kupon SBR yaitu Pajak Penghasilan (PPh) final sebesar 10 persen, lebih rendah dibandingkan pajak atas deposito sebesar 20 persen. Terdapat beberapa keuntungan bagi para investor yang memilih menempatkan dananya dengan berinvestasi SBR sebagai berikut: Dituliskan dalam laman Bank Indonesia (BI), jangka waktu atau tenor investasi di SBR selama dua tahun. Risiko dari investasi SBR yakni risiko likuiditas (liquidity risk), karena tidak dapat diperdagangkan atau dialihkan. SBR tidak bisa dijual seluruhnya sebelum jatuh tempo, tapi bisa dicairkan sebagian dana dengan memanfaatkan fasilitas early redemption. Early redemption memungkinkan investor untuk mencairkan sebagian pokok investasi pada SBR sebelum jatuh tempo. Fasilitas tersebut bisa dimanfaatkan oleh investor dengan kepemilikan SBR minimal Rp 2 juta di setiap mitra distribusi, dan jumlah maksimal yang bisa dicairkan sebesar 50 persen dari pemesanan SBR. Perlu digarisbawahi, pencairan SBR dengan fasilitas early redemption atau mencairkan sebagian dana investasi tidak dikenai biaya pencairan. Demikian ulasan mengenai apa itu pengertian investasi SBR, sistem imbal hasil, dan risikonya. Investasi SBR bisa dibeli oleh setiap WNI yang sudah mempunyai Kartu Tanda Penduduk (KTP) dengan minimum pembelian sebesar Rp 1 juta.  ;13-05-2023;https://money.kompas.com/read/2023/05/13/195047926/mengenal-apa-itu-sbr-imbal-hasil-dan-risikonya;savings bond ritel (sbr) menjadi salah satu produk investasi yang bisa dipilih oleh masyarakat. sbr adalah surat utang negara (sun) yang diterbitkan pemerintah untuk warga negara indonesia (wni). salah satu bentuk obligasi pemerintah ini memiliki risiko moderat, yang lebih tinggi dibandingkan deposito tapi lebih rendah dibandingkan saham. lantas, bagaimana sistem imbal hasil dari investasi savings bond ritel (sbr)? dilansir dari laman resmi otoritas jasa keuangan (ojk), investor sbr akan memperoleh imbal hasil berupa kupon yang dibayarkan setiap bulannya. kupon sbr bersifat mengambang dengan tingkat kupon minimal (floating with floor) dan mengacu pada bi-7 days reverse repo rate (bi-7drr) yang disesuaikan setiap tiga bulan pada tanggal penyesuaian kupon. investasi sbr relatif aman dari gagal bayar dikarenakan pembayaran pokok dan kuponnya dijamin negara. pajak yang dikenakan atas kupon sbr yaitu pajak penghasilan (pph) final sebesar 10 persen, lebih rendah dibandingkan pajak atas deposito sebesar 20 persen. terdapat beberapa keuntungan bagi para investor yang memilih menempatkan dananya dengan berinvestasi sbr sebagai berikut: dituliskan dalam laman bank indonesia (bi), jangka waktu atau tenor investasi di sbr selama dua tahun. risiko dari investasi sbr yakni risiko likuiditas (liquidity risk), karena tidak dapat diperdagangkan atau dialihkan. sbr tidak bisa dijual seluruhnya sebelum jatuh tempo, tapi bisa dicairkan sebagian dana dengan memanfaatkan fasilitas early redemption. early redemption memungkinkan investor untuk mencairkan sebagian pokok investasi pada sbr sebelum jatuh tempo. fasilitas tersebut bisa dimanfaatkan oleh investor dengan kepemilikan sbr minimal rp 2 juta di setiap mitra distribusi, dan jumlah maksimal yang bisa dicairkan sebesar 50 persen dari pemesanan sbr. perlu digarisbawahi, pencairan sbr dengan fasilitas early redemption atau mencairkan sebagian dana investasi tidak dikenai biaya pencairan. demikian ulasan mengenai apa itu pengertian investasi sbr, sistem imbal hasil, dan risikonya. investasi sbr bisa dibeli oleh setiap wni yang sudah mempunyai kartu tanda penduduk (ktp) dengan minimum pembelian sebesar rp 1 juta. 
Pahami, Ini Cara Berinvestasi SBR;KOMPAS.com - Para investor baru yang memilih menempatkan dananya pada investasi Savings Bond Ritel (SBR) mencari informasi terkait cara investasi jenis ini. SBR adalah surat utang negara yang diterbitkan pemerintah untuk warga negara Indonesia (WNI) yang sudah memiliki Kartu Tanda Penduduk (KTP). Agar bisa mulai berinvestasi di SBR, investor dapat melakukan pembelian sebesar minimal Rp 1 juta dan maksimal Rp 2 juta. SBR termasuk salah satu investasi yang aman dari risiko gagal bayar, karena pembayaran pokok dan kuponnya dijamin oleh negara. Lantas, bagaimana cara berinvestasi di Savings Bond Ritel (SBR)? Dilansir dari laman resmi Kementerian Keuangan (Kemenkeu), cara berinvestasi di SBR sebagai berikut: Lebih lanjut, dalam laman resmi Otoritas Jasa Keuangan (OJK), terdapat beberapa tips memilih mitra distribusi investasi SBR meliputi: Perlu diketahui bahwa tenor atau jangka waktu investasi SBR selama dua tahun. Sebelum jatuh tempo, SBR tidak bisa dicairkan secara menyeluruh. Kendati begitu, dana yang diinvestasikan di SBR dapat dicairkan sebagian dengan fasilitas early redemption. Fasilitas ini bisa dimanfaatkan oleh para investor yang memiliki SBR sebesar Rp 2 juta di setiap mitra distribusi. Jumlah maksimal yang bisa diajukan dalam early redemption ini sebesar 50 persen dari setiap pemesanan pembelian. Nah, itulah ulasan mengenai cara membeli atau berinvestasi di SBR. Penting untuk diingat, pilih investasi sesuai dengan profil masing-masing, dan pastikan telah mengetahui plus minus dari investasi tersebut. ;14-05-2023;https://money.kompas.com/read/2023/05/14/084044726/pahami-ini-cara-berinvestasi-sbr;para investor baru yang memilih menempatkan dananya pada investasi savings bond ritel (sbr) mencari informasi terkait cara investasi jenis ini. sbr adalah surat utang negara yang diterbitkan pemerintah untuk warga negara indonesia (wni) yang sudah memiliki kartu tanda penduduk (ktp). agar bisa mulai berinvestasi di sbr, investor dapat melakukan pembelian sebesar minimal rp 1 juta dan maksimal rp 2 juta. sbr termasuk salah satu investasi yang aman dari risiko gagal bayar, karena pembayaran pokok dan kuponnya dijamin oleh negara. lantas, bagaimana cara berinvestasi di savings bond ritel (sbr)? dilansir dari laman resmi kementerian keuangan (kemenkeu), cara berinvestasi di sbr sebagai berikut: lebih lanjut, dalam laman resmi otoritas jasa keuangan (ojk), terdapat beberapa tips memilih mitra distribusi investasi sbr meliputi: perlu diketahui bahwa tenor atau jangka waktu investasi sbr selama dua tahun. sebelum jatuh tempo, sbr tidak bisa dicairkan secara menyeluruh. kendati begitu, dana yang diinvestasikan di sbr dapat dicairkan sebagian dengan fasilitas early redemption. fasilitas ini bisa dimanfaatkan oleh para investor yang memiliki sbr sebesar rp 2 juta di setiap mitra distribusi. jumlah maksimal yang bisa diajukan dalam early redemption ini sebesar 50 persen dari setiap pemesanan pembelian. nah, itulah ulasan mengenai cara membeli atau berinvestasi di sbr. penting untuk diingat, pilih investasi sesuai dengan profil masing-masing, dan pastikan telah mengetahui plus minus dari investasi tersebut. 
Tantangan dan Peluang Indonesia Lakukan Dedolarisasi dan Gabung BRICS;BEBERAPA waktu belakangan, Indonesia gencar menunjukkan upaya mengurangi ketergantungan terhadap dolar Amerika Serikat (AS) melalui dedolarisasi. Pada Mei ini, Indonesia bekerja sama dengan Bank Sentral Korea Selatan dan beberapa negara Asia Tenggara dalam penggunaan mata uang lokal dalam transaksi perdagangan dan investasi, yang merupakan contoh nyata dari upaya ini. Tujuan utama dedolarisasi adalah menciptakan stabilitas nilai tukar bagi mata uang lokal (rupiah) dan meningkatkan kedaulatan moneter. Fenomena dedolarisasi secara struktural yang terjadi di berbagai negara, terutama di negara-negara BRICS (Brasil, Rusia, India, China, dan Afrika Selatan), memiliki potensi untuk memberikan manfaat yang signifikan bagi negara-negara berkembang, termasuk Indonesia. Penggunaan dolar AS dalam perdagangan internasional diperkirakan akan terus menurun dalam beberapa dekade mendatang. Sementara itu, pembicaraan mengenai mata uang gabungan negara-negara BRICS dan penggunaan mata uang lokal dalam sistem pembayaran global semakin ramai. Namun, penggantian dolar AS sebagai mata uang dominan dalam perdagangan internasional memerlukan waktu yang panjang dan melibatkan berbagai faktor yang saling berinteraksi. Indonesia sebagai negara dengan potensi ekonomi yang besar dapat memperkuat kerja sama dan koordinasi di antara emerging market melalui forum seperti BRICS. Hingga saat ini, Indonesia masih mempertimbangkan untuk menjadi anggota BRICS. China mengakui bahwa Indonesia merupakan kandidat potensial untuk BRICS sebagai emerging market dan negara Muslim terbesar. Terlebih lagi, Indonesia berkomitmen terhadap stabilitas global dan ekonomi dunia yang terbuka. Namun, BRICS belum memiliki aturan dan prosedur untuk perluasan keanggotaan. Adaptasi paradigma dan pandangan diperlukan jika Indonesia ingin bergabung dengan BRICS dan mengimbangi kemampuannya. Manfaat dan tantangan pasti akan membuntuti apabila Indonesia tergabung dalam keanggotaan BRICS. Beberapa tantangan apabila Indonesia bergabung dengan BRICS adalah perbedaan sistem politik dan nilai-nilai antara anggota BRICS, serta potensi persaingan ekonomi. Karena itu, Indonesia perlu mempertimbangkan dengan cermat langkah-langkah yang akan diambil. Salah satu cara yang dapat dilakukan adalah dengan membangun kerja sama yang lebih erat dan inklusif di antara anggota BRICS, serta meningkatkan koordinasi dengan negara-negara emerging market lainnya, seperti yang ada dalam kelompok MIKTA (Meksiko, Indonesia, Korea Selatan, Turki, dan Australia). Indonesia menghadapi tantangan dan ancaman geopolitik yang cukup kompleks jika terus melakukan dedolarisasi dan bergabung dalam penggunaan mata uang BRICS. Indonesia berpotensi konflik dengan AS, yang merasa terancam oleh penurunan dominasi dolar AS dalam perdagangan internasional. Hal itu bisa memengaruhi hubungan diplomatik dan perdagangan antara Indonesia dengan AS, serta negara-negara Barat lainnya, yang masih memiliki pengaruh signifikan dalam perekonomian global. Indonesia juga harus siap menghadapi ketidakpastian ekonomi dan politik yang muncul akibat perubahan struktural ini. Perubahan dalam sistem moneter global dan penggunaan mata uang BRICS memerlukan adaptasi dan koordinasi yang kuat antara pemerintah, sektor swasta, dan institusi keuangan. Terlebih lagi, proses ini akan melibatkan negara-negara dengan latar belakang politik, ekonomi, dan budaya yang beragam, sehingga meningkatkan risiko ketidakstabilan dan ketegangan geopolitik. Indonesia juga harus jeli terhadap ancaman stabilitas regional dan global yang muncul akibat rivalitas negara-negara adidaya, seperti AS, China, dan Rusia. Masing-masing negara tadi mempunyai kepentingan strategis di kawasan Asia Pasifik. Tergabungnya Indonesia ke dalam BRICS berpotensi memperburuk ketegangan dan posisi Indonesia menjadi lebih rentan terhadap tekanan eksternal. Untuk mengatasi tantangan dan ancaman geopolitik ini, Indonesia perlu membangun strategi yang seimbang dan fleksibel. ;09-05-2023;https://money.kompas.com/read/2023/05/09/111221726/tantangan-dan-peluang-indonesia-lakukan-dedolarisasi-dan-gabung-brics?page=all;beberapa waktu belakangan, indonesia gencar menunjukkan upaya mengurangi ketergantungan terhadap dolar amerika serikat (as) melalui dedolarisasi. pada mei ini, indonesia bekerja sama dengan bank sentral korea selatan dan beberapa negara asia tenggara dalam penggunaan mata uang lokal dalam transaksi perdagangan dan investasi, yang merupakan contoh nyata dari upaya ini. tujuan utama dedolarisasi adalah menciptakan stabilitas nilai tukar bagi mata uang lokal (rupiah) dan meningkatkan kedaulatan moneter. fenomena dedolarisasi secara struktural yang terjadi di berbagai negara, terutama di negara-negara brics (brasil, rusia, india, china, dan afrika selatan), memiliki potensi untuk memberikan manfaat yang signifikan bagi negara-negara berkembang, termasuk indonesia. penggunaan dolar as dalam perdagangan internasional diperkirakan akan terus menurun dalam beberapa dekade mendatang. sementara itu, pembicaraan mengenai mata uang gabungan negara-negara brics dan penggunaan mata uang lokal dalam sistem pembayaran global semakin ramai. namun, penggantian dolar as sebagai mata uang dominan dalam perdagangan internasional memerlukan waktu yang panjang dan melibatkan berbagai faktor yang saling berinteraksi. indonesia sebagai negara dengan potensi ekonomi yang besar dapat memperkuat kerja sama dan koordinasi di antara emerging market melalui forum seperti brics. hingga saat ini, indonesia masih mempertimbangkan untuk menjadi anggota brics. china mengakui bahwa indonesia merupakan kandidat potensial untuk brics sebagai emerging market dan negara muslim terbesar. terlebih lagi, indonesia berkomitmen terhadap stabilitas global dan ekonomi dunia yang terbuka. namun, brics belum memiliki aturan dan prosedur untuk perluasan keanggotaan. adaptasi paradigma dan pandangan diperlukan jika indonesia ingin bergabung dengan brics dan mengimbangi kemampuannya. manfaat dan tantangan pasti akan membuntuti apabila indonesia tergabung dalam keanggotaan brics. beberapa tantangan apabila indonesia bergabung dengan brics adalah perbedaan sistem politik dan nilai-nilai antara anggota brics, serta potensi persaingan ekonomi. karena itu, indonesia perlu mempertimbangkan dengan cermat langkah-langkah yang akan diambil. salah satu cara yang dapat dilakukan adalah dengan membangun kerja sama yang lebih erat dan inklusif di antara anggota brics, serta meningkatkan koordinasi dengan negara-negara emerging market lainnya, seperti yang ada dalam kelompok mikta (meksiko, indonesia, korea selatan, turki, dan australia). indonesia menghadapi tantangan dan ancaman geopolitik yang cukup kompleks jika terus melakukan dedolarisasi dan bergabung dalam penggunaan mata uang brics. indonesia berpotensi konflik dengan as, yang merasa terancam oleh penurunan dominasi dolar as dalam perdagangan internasional. hal itu bisa memengaruhi hubungan diplomatik dan perdagangan antara indonesia dengan as, serta negara-negara barat lainnya, yang masih memiliki pengaruh signifikan dalam perekonomian global. indonesia juga harus siap menghadapi ketidakpastian ekonomi dan politik yang muncul akibat perubahan struktural ini. perubahan dalam sistem moneter global dan penggunaan mata uang brics memerlukan adaptasi dan koordinasi yang kuat antara pemerintah, sektor swasta, dan institusi keuangan. terlebih lagi, proses ini akan melibatkan negara-negara dengan latar belakang politik, ekonomi, dan budaya yang beragam, sehingga meningkatkan risiko ketidakstabilan dan ketegangan geopolitik. indonesia juga harus jeli terhadap ancaman stabilitas regional dan global yang muncul akibat rivalitas negara-negara adidaya, seperti as, china, dan rusia. masing-masing negara tadi mempunyai kepentingan strategis di kawasan asia pasifik. tergabungnya indonesia ke dalam brics berpotensi memperburuk ketegangan dan posisi indonesia menjadi lebih rentan terhadap tekanan eksternal. untuk mengatasi tantangan dan ancaman geopolitik ini, indonesia perlu membangun strategi yang seimbang dan fleksibel. 
