Title;Content;Date;URL;Cleaned Article
 Mengenal Simposium Jackson Hole Hingga Bisa Pengaruhi Gerak Rupiah ;"Nilai tukar rupiah dibuka di posisi Rp15.287 per dolar AS di perdagangan pasar spot pada Jumat (25/8) pagi tadi. Mata uang Garuda melemah 41 poin atau minus 0,27 persen dibandingkan penutupan di hari sebelumnya. Pengamat Komoditas dan Mata Uang Lukman Leong memprediksi rupiah bakal tertekan dolar AS hari ini. Ia menyebut pelemahan ini terjadi imbas data klaim pengangguran AS yang lebih banyak dari perkiraan. ""Rupiah juga tertekan sentimen risk off di pasar menjelang Simposium Jackson Hole,"" katanya kepada CNNIndonesia.com.  ADVERTISEMENT   SCROLL TO CONTINUE WITH CONTENT   Lantas apa Simposium Ekonomi Jackson Hole sehingga bisa mempengaruhi pergerakan nilai tukar rupiah? Simposium Ekonomi Jackson Hole diselenggarakan oleh The Fed wilayah Kansas City sejak 1981. Peserta simposium meliputi para bankir sentral terkemuka, menteri keuangan, akademisi, dan pelaku pasar keuangan dari seluruh dunia. Para peserta berkumpul untuk membahas isu-isu ekonomi, implikasi, dan pilihan kebijakan terkait topik simposium. Nah, pada tahun ini, para pejabat The Fed akan berkumpul untuk Simposium Ekonomi Jackson Hole pada 24 hingga 26 Agustus 2023 di Jackson Hole, Wyoming. Simposium Ekonomi Jackson Hole ini mengusung tema ""Pergeseran Struktural dalam Perekonomian Global"". Melansir situs Federal Reserve Bank of Kansas City, Senin (21/8), tema tersebut akan mengeksplorasi beberapa perkembangan signifikan dan berpotensi bertahan lama yang mempengaruhi perekonomian global.    Salah satu momen yang ditunggu dalam Simposium Ekonomi Jackson Hole adalah pidato ketua The Fed. Pidato itu biasanya digunakan sebagai kesempatan bagi The Fed untuk memberikan sinyal mengenai kebijakan. Melansir New York Times, Ketua The Fed akan akan menyampaikan pidatonya ketika langkah The Fed selanjutnya masih belum pasti karena inflasi yang masih moderat. Sementara Wall Street sedang mencoba mencari tahu apakah para pejabat Fed berpikir bahwa mereka perlu menaikkan suku bunga lebih banyak lagi tahun ini. Kemudian apakah langkah tersebut kemungkinan besar akan dilakukan pada September mendatang. Salah satu pengaruh kenaikan suku bunga The Fed bisa dilihat pada nilai tukar rupiah. Ketika The Fed menaikkan suku bunganya, investor akan lebih tertarik pada dolar AS yang dapat menyebabkan apresiasi dolar dan penurunan nilai rupiah. [Gambas:Video CNN] ";25-08-2023;https://www.cnnindonesia.com/ekonomi/20230825103906-78-990340/mengenal-simposium-jackson-hole-hingga-bisa-pengaruhi-gerak-rupiah;"nilai tukar rupiah dibuka di posisi rp15.287 per dolar as di perdagangan pasar spot pada jumat (25/8) pagi tadi. mata uang garuda melemah 41 poin atau minus 0,27 persen dibandingkan penutupan di hari sebelumnya. pengamat komoditas dan mata uang lukman leong memprediksi rupiah bakal tertekan dolar as hari ini. ia menyebut pelemahan ini terjadi imbas data klaim pengangguran as yang lebih banyak dari perkiraan. ""rupiah juga tertekan sentimen risk off di pasar menjelang simposium jackson hole,"" katanya kepada cnnindonesia.com. lantas apa simposium ekonomi jackson hole sehingga bisa mempengaruhi pergerakan nilai tukar rupiah? simposium ekonomi jackson hole diselenggarakan oleh the fed wilayah kansas city sejak 1981. peserta simposium meliputi para bankir sentral terkemuka, menteri keuangan, akademisi, dan pelaku pasar keuangan dari seluruh dunia. para peserta berkumpul untuk membahas isu-isu ekonomi, implikasi, dan pilihan kebijakan terkait topik simposium. nah, pada tahun ini, para pejabat the fed akan berkumpul untuk simposium ekonomi jackson hole pada 24 hingga 26 agustus 2023 di jackson hole, wyoming. simposium ekonomi jackson hole ini mengusung tema ""pergeseran struktural dalam perekonomian global"". melansir situs federal reserve bank of kansas city, senin (21/8), tema tersebut akan mengeksplorasi beberapa perkembangan signifikan dan berpotensi bertahan lama yang mempengaruhi perekonomian global. salah satu momen yang ditunggu dalam simposium ekonomi jackson hole adalah pidato ketua the fed. pidato itu biasanya digunakan sebagai kesempatan bagi the fed untuk memberikan sinyal mengenai kebijakan. melansir new york times, ketua the fed akan akan menyampaikan pidatonya ketika langkah the fed selanjutnya masih belum pasti karena inflasi yang masih moderat. sementara wall street sedang mencoba mencari tahu apakah para pejabat fed berpikir bahwa mereka perlu menaikkan suku bunga lebih banyak lagi tahun ini. kemudian apakah langkah tersebut kemungkinan besar akan dilakukan pada september mendatang. salah satu pengaruh kenaikan suku bunga the fed bisa dilihat pada nilai tukar rupiah. ketika the fed menaikkan suku bunganya, investor akan lebih tertarik pada dolar as yang dapat menyebabkan apresiasi dolar dan penurunan nilai rupiah. "
 Bank Sentral Rusia Kerek Suku Bunga Imbas Nilai Tukar Rubel Anjlok ;"Bank sentral Rusia menaikkan suku bunga utamanya sebesar 3,5 poin menjadi 12 persen. Langkah itu diambil setelah nilai tukar rubel menyentuh level terendah dalam 17 bulan terakhir. Melansir CNN, Selasa (15/8), bank sentral Rusia mengatakan keputusannya dibuat pada pertemuan khusus dan bertujuan untuk membatasi risiko stabilitas harga. ""Penurunan depresiasi rubel ke harga mendapatkan momentum dan ekspektasi inflasi meningkat,"" bunyi pernyataan bank sentral Rusia.  ADVERTISEMENT   SCROLL TO CONTINUE WITH CONTENT   Sepanjang tahun ini, nilai tukar rubel turun 35 persen terhadap dolar AS lantaran perang Rusia dan Ukraina. Rubel sempat anjlok ke 102 per dolar AS pada Senin lalu. Namun rubel kemudian bangkit ke 98 per dolar AS setelah pengumuman kenaikan suku bunga. Sementara itu, Menteri Keuangan AS Janet Yellen mengatakan penurunan rubel mencerminkan bahwa sanksi terhadap Rusia dan perang telah menyebabkan ekonomi Rusia terkuras. Sedangkan Ekonom Capital Economics Liam Peach mengatakan depresiasi rubel adalah konsekuensi dari banyak faktor yang bergerak menyerang Rusia. Faktor tersebut antara lain anjloknya harga energi dan pendapatan ekspor, serta sulitnya menarik modal asing. ""Kenaikan suku bunga hari ini hanya akan memperlambat pendarahan untuk sementara,"" katanya.  [Gambas:Video CNN] ";18-08-2023;https://www.cnnindonesia.com/ekonomi/20230818070904-78-987419/bank-sentral-rusia-kerek-suku-bunga-imbas-nilai-tukar-rubel-anjlok;"bank sentral rusia menaikkan suku bunga utamanya sebesar 3,5 poin menjadi 12 persen. langkah itu diambil setelah nilai tukar rubel menyentuh level terendah dalam 17 bulan terakhir. melansir cnn, selasa (15/8), bank sentral rusia mengatakan keputusannya dibuat pada pertemuan khusus dan bertujuan untuk membatasi risiko stabilitas harga. ""penurunan depresiasi rubel ke harga mendapatkan momentum dan ekspektasi inflasi meningkat,"" bunyi pernyataan bank sentral rusia. sepanjang tahun ini, nilai tukar rubel turun 35 persen terhadap dolar as lantaran perang rusia dan ukraina. rubel sempat anjlok ke 102 per dolar as pada senin lalu. namun rubel kemudian bangkit ke 98 per dolar as setelah pengumuman kenaikan suku bunga. sementara itu, menteri keuangan as janet yellen mengatakan penurunan rubel mencerminkan bahwa sanksi terhadap rusia dan perang telah menyebabkan ekonomi rusia terkuras. sedangkan ekonom capital economics liam peach mengatakan depresiasi rubel adalah konsekuensi dari banyak faktor yang bergerak menyerang rusia. faktor tersebut antara lain anjloknya harga energi dan pendapatan ekspor, serta sulitnya menarik modal asing. ""kenaikan suku bunga hari ini hanya akan memperlambat pendarahan untuk sementara,"" katanya. "
 Bank Sentral China Pangkas Suku Bunga Lagi Gegara Ekonomi Makin 'Lesu' ;China memangkas suku bunga pinjaman acuan utamanya pada Senin (21/8). Pemotongan suku bunga ini yang kedua kali dilakukan China selama 2023, sebagai upaya menghidupkan kembali pertumbuhan ekonomi negara yang masih lesu saat ini.   ADVERTISEMENT   SCROLL TO CONTINUE WITH CONTENT  Bank Rakyat China (People's Bank of China/PBoC) memangkas suku bunga pinjaman satu tahun (LPR) sebesar 10 basis poin dari 3,55 persen menjadi 3,45 persen. Dikutip CNN, pemangkasan LPR 1 tahun ini masih lebih tinggi dari ekspektasi pasar yang memperkirakan LPR 1 tahun PBoC menjadi 3,4 persen. Meski begitu, China tidak mengubah suku bunga pinjaman untuk jangka lima tahun yang berada di 4,20 persen. Padahal, pasar memperkirakan LPR 5 tahun juga dipangkas menjadi 4,05 persen. Maka dari itu, pemotongan LPR China dianggap kejutan bagi para ekonom.  PBoC melakukan pemangkasan LPR dengan hati-hati untuk meredakan kekhawatiran di sekitar China yang saat ini melanda pasar keuangan. Sebab, mayoritas analis yang disurvei oleh Reuters telah memprediksi pemotongan LPR hingga 15 basis poin. Hampir semua analis itu pun memperkirakan bahwa suku bunga pinjaman lima tahun yang berfungsi sebagai suku bunga referensi hipotek, akan dipangkas setidaknya 15 basis poin.     [Gambas:Video CNN] ;21-08-2023;https://www.cnnindonesia.com/ekonomi/20230821125019-78-988470/bank-sentral-china-pangkas-suku-bunga-lagi-gegara-ekonomi-makin-lesu;china memangkas suku bunga pinjaman acuan utamanya pada senin (21/8). pemotongan suku bunga ini yang kedua kali dilakukan china selama 2023, sebagai upaya menghidupkan kembali pertumbuhan ekonomi negara yang masih lesu saat ini. bank rakyat china (people's bank of china/pboc) memangkas suku bunga pinjaman satu tahun (lpr) sebesar 10 basis poin dari 3,55 persen menjadi 3,45 persen. dikutip cnn, pemangkasan lpr 1 tahun ini masih lebih tinggi dari ekspektasi pasar yang memperkirakan lpr 1 tahun pboc menjadi 3,4 persen. meski begitu, china tidak mengubah suku bunga pinjaman untuk jangka lima tahun yang berada di 4,20 persen. padahal, pasar memperkirakan lpr 5 tahun juga dipangkas menjadi 4,05 persen. maka dari itu, pemotongan lpr china dianggap kejutan bagi para ekonom. pboc melakukan pemangkasan lpr dengan hati-hati untuk meredakan kekhawatiran di sekitar china yang saat ini melanda pasar keuangan. sebab, mayoritas analis yang disurvei oleh reuters telah memprediksi pemotongan lpr hingga 15 basis poin. hampir semua analis itu pun memperkirakan bahwa suku bunga pinjaman lima tahun yang berfungsi sebagai suku bunga referensi hipotek, akan dipangkas setidaknya 15 basis poin. 
 Bos BCA Hibahkan Saham Rp74 M ke Anak ;"Direktur Utama PT Bank Central Asia Tbk (BCA) Jahja Setiaatmadja menghibahkan 8 juta  saham senilai Rp74 miliar kepada kedua orang anaknya. Saham perusahaan dengan kode emiten BBCA itu diberikan kepada Enrica Ariestia PS dan Elizabeth Ariestia MS. Keduanya mendapat masing-masing 4 juta saham atau senilai Rp37 miliar. Kepala Sub Divisi BCA Linda Chandrawati mengatakan proses transaksi sudah dituntaskan pada Jumat (18/8) lalu.  ADVERTISEMENT   SCROLL TO CONTINUE WITH CONTENT   ""Tujuan transaksi hibah ke anak,"" katanya dalam keterbukaan informasi Bursa Efek Indonesia (BEI). Pada perdagangan Jumat, saham BBCA ditutup melemah 50 poin atau minus 0,54 persen ke posisi Rp9.250 per lembar. Adapun kapitalisasi saham BCA mencapai Rp1.134,13 triliun.   Per Juli 2023, pemegang saham BCA antara lain PT Dwimuria Investama sebanyak 67,72 miliar saham atau 54,94 persen. Lalu, Robert Budi Hartono sebanyak 28,13 juta saham atau 0,023 persen. Kemudian, Bambang Hartono sebanyak 27,02 juta saham atau 0,022 persen, pihak afiliasi pengendali 3,02 miliar saham atau 2,455 persen, dan masyarakat non warkat sebanyak 52,26 miliar saham atau 42,399 persen. [Gambas:Video CNN] ";21-08-2023;https://www.cnnindonesia.com/ekonomi/20230821123614-92-988458/bos-bca-hibahkan-saham-rp74-m-ke-anak;"direktur utama pt bank central asia tbk (bca) jahja setiaatmadja menghibahkan 8 juta saham senilai rp74 miliar kepada kedua orang anaknya. saham perusahaan dengan kode emiten bbca itu diberikan kepada enrica ariestia ps dan elizabeth ariestia ms. keduanya mendapat masing-masing 4 juta saham atau senilai rp37 miliar. kepala sub divisi bca linda chandrawati mengatakan proses transaksi sudah dituntaskan pada jumat (18/8) lalu. ""tujuan transaksi hibah ke anak,"" katanya dalam keterbukaan informasi bursa efek indonesia (bei). pada perdagangan jumat, saham bbca ditutup melemah 50 poin atau minus 0,54 persen ke posisi rp9.250 per lembar. adapun kapitalisasi saham bca mencapai rp1.134,13 triliun. per juli 2023, pemegang saham bca antara lain pt dwimuria investama sebanyak 67,72 miliar saham atau 54,94 persen. lalu, robert budi hartono sebanyak 28,13 juta saham atau 0,023 persen. kemudian, bambang hartono sebanyak 27,02 juta saham atau 0,022 persen, pihak afiliasi pengendali 3,02 miliar saham atau 2,455 persen, dan masyarakat non warkat sebanyak 52,26 miliar saham atau 42,399 persen. "
 Melihat Sisa Saham Bos BCA Usai Hibahkan Rp74 M ke Anak ;"Saham Presiden Direktur PT Bank Central Asia Tbk (BCA) Jahja Setiaatmadja masih sangat banyak meski baru saja menghibahkan 8 juta saham senilai Rp74 miliar kepada kedua anaknya. Berdasarkan data keterbukaan informasi Bursa Efek Indonesia (BEI), Jahja awalnya memegang 40.818.853 lembar saham emiten berkode BBCA tersebut.   ADVERTISEMENT   SCROLL TO CONTINUE WITH CONTENT  Lalu, ia menghibahkan 4 juta saham dengan nilai Rp9.250 per lembar kepada anaknya bernama Elizabeth Ariestia MS. Dengan begitu, Elizabeth mendapatkan saham senilai Rp37 miliar. ""Tujuan transaksi: hibah ke anak Elizabeth Ariestia MS,"" kata Kepala Sub Divisi BCA Linda Chandrawati dalam keterangan resmi, Jumat (18/8). Setelah hibah tersebut, saham Jahja tersisa 36.818.853. Kemudian, saham bos BCA itu susut kembali 4 juta dengan nilai Rp37 miliar untuk hadiah anaknya yang lain bernama Enrica Ariestia PS.  ""Tujuan transaksi: hibah ke anak Enrica Ariestia PS,"" tulis Linda di hari yang sama. Usai hibah 8 juta saham tersebut, saham Jahja Setiaatmadja di BCA tersisa 32.818.853 lembar. Sementara itu, pemegang saham BCA per Juli 2023, antara lain PT Dwimuria Investama sebesar 67,72 persen miliar saham atau 54,94 persen. Kemudian, Robert Budi Hartono mengantongi 28,13 juta saham alias 0,023 persen. Lalu, Bambang Hartono memegang 27,02 juta saham atau 0,022 persen. Ada juga pihak afiliasi pengendali sebesar 3,02 miliar saham atau 2,455 persen dan masyarakat nonwarkat sebanyak 52,26 miliar saham alias 42,399 persen.";21-08-2023;https://www.cnnindonesia.com/ekonomi/20230821145132-78-988568/melihat-sisa-saham-bos-bca-usai-hibahkan-rp74-m-ke-anak;"saham presiden direktur pt bank central asia tbk (bca) jahja setiaatmadja masih sangat banyak meski baru saja menghibahkan 8 juta saham senilai rp74 miliar kepada kedua anaknya. berdasarkan data keterbukaan informasi bursa efek indonesia (bei), jahja awalnya memegang 40.818.853 lembar saham emiten berkode bbca tersebut. lalu, ia menghibahkan 4 juta saham dengan nilai rp9.250 per lembar kepada anaknya bernama elizabeth ariestia ms. dengan begitu, elizabeth mendapatkan saham senilai rp37 miliar. ""tujuan transaksi: hibah ke anak elizabeth ariestia ms,"" kata kepala sub divisi bca linda chandrawati dalam keterangan resmi, jumat (18/8). setelah hibah tersebut, saham jahja tersisa 36.818.853. kemudian, saham bos bca itu susut kembali 4 juta dengan nilai rp37 miliar untuk hadiah anaknya yang lain bernama enrica ariestia ps. ""tujuan transaksi: hibah ke anak enrica ariestia ps,"" tulis linda di hari yang sama. usai hibah 8 juta saham tersebut, saham jahja setiaatmadja di bca tersisa 32.818.853 lembar. sementara itu, pemegang saham bca per juli 2023, antara lain pt dwimuria investama sebesar 67,72 persen miliar saham atau 54,94 persen. kemudian, robert budi hartono mengantongi 28,13 juta saham alias 0,023 persen. lalu, bambang hartono memegang 27,02 juta saham atau 0,022 persen. ada juga pihak afiliasi pengendali sebesar 3,02 miliar saham atau 2,455 persen dan masyarakat nonwarkat sebanyak 52,26 miliar saham alias 42,399 persen."
         Gelar RUPSLB, Emiten Rokok Sampoerna Rombak Susunan Direksi    ;"PT Hanjaya Mandala Sampoerna Tbk (HMSP) mengumumkan perombakan susunan Direksi Perseroan. Berdasarkan hasil Rapat Umum Pemegang Saham Luar Biasa (RUPSLB) pada Senin (21/8/2023) di Jakarta. Johan Bink ditunjuk sebagai Direktur Operasional menggantikan Dina Lombardi, dan Gunnar Beckers sebagai Direktur Pemasaran menggantikan Francisca Rahardja. Sebelumnya, Johan menjabat sebagai Direktur Manufaktur di Papastratos S.A., afiliasi dari Philip Morris International (PMI) di Athena, Yunani, dengan pengalaman lebih dari 33 tahun dalam bidang manajemen rantai pasokan dan perencanaan produksi.      ADVERTISEMENT         SCROLL TO CONTINUE WITH CONTENT    Sementara itu, Gunnar sebelumnya menjabat sebagai Kepala Global Pengalaman Konsumen PMI di Lausanne, Swiss, dengan pengalaman selama lebih dari 20 tahun dalam bidang pemasaran. Presiden Direktur Sampoerna, Vassilis Gkatzelis, menyampaikan bahwa Johan dan Gunnar akan menjadi bagian penting dalam tim manajemen dan Direksi Sampoerna. ""Pengalaman luas Johan dalam Operations, mulai dari manajemen rantai pasokan dan perencanaan produksi, serta keterampilan komunikasi dan kepemimpinannya yang kuat, akan sangat membantu dalam posisi barunya,"" kata Vassilis. ""Sementara itu, Gunnar adalah seorang eksekutif yang berpengetahuan luas, yang secara konsisten menciptakan nilai di berbagai penugasan di tingkat global, regional, dan pasar. Perspektif strategis, pengalaman internasional yang luas, semangat kolaboratif yang kuat, fokus pada konsumen, dan kemampuan membangun merek akan menjadi aset besar dalam peran barunya,"" tambah Vassilis. Vassilis juga mengucapkan terima kasih kepada Dina dan Francisca atas kontribusi dan kepemimpinan mereka di Sampoerna. Keduanya akan mengemban tanggung jawab baru di dalam organisasi PMI. ""Ibu Dina selalu mengutamakan keselamatan dan pengembangan karyawan, sehingga menjadi teladan nilai- nilai Sampoerna dan PMI selama periode pandemi yang sangat menantang. Beliau senantiasa memandu tim Operations dalam berbagai pencapaian penting, termasuk terkait dengan investasi Sampoerna dalam membangun fasilitas produksi untuk produk tembakau inovatif bebas asap,"" kata Vassilis. ""Sementara itu, Ibu Francisca telah memimpin timnya melalui masa-masa yang sangat menantang dengan pandangan ke depan. Beliau juga membangun fondasi yang kuat untuk organisasi yang berpusat pada konsumen. Pada saat yang sama, beliau juga turut mengantarkan perjalanan awal produk tembakau inovatif bebas asap yang diperkenalkan Sampoerna kepada konsumen dewasa di Indonesia,"" kata Vassilis.";21-08-2023;https://finance.detik.com/bursa-dan-valas/d-6887999/gelar-rupslb-emiten-rokok-sampoerna-rombak-susunan-direksi;"pt hanjaya mandala sampoerna tbk (hmsp) mengumumkan perombakan susunan direksi perseroan. berdasarkan hasil rapat umum pemegang saham luar biasa (rupslb) pada senin (21/8/2023) di jakarta. johan bink ditunjuk sebagai direktur operasional menggantikan dina lombardi, dan gunnar beckers sebagai direktur pemasaran menggantikan francisca rahardja. sebelumnya, johan menjabat sebagai direktur manufaktur di papastratos s.a., afiliasi dari philip morris international (pmi) di athena, yunani, dengan pengalaman lebih dari 33 tahun dalam bidang manajemen rantai pasokan dan perencanaan produksi. sementara itu, gunnar sebelumnya menjabat sebagai kepala global pengalaman konsumen pmi di lausanne, swiss, dengan pengalaman selama lebih dari 20 tahun dalam bidang pemasaran. presiden direktur sampoerna, vassilis gkatzelis, menyampaikan bahwa johan dan gunnar akan menjadi bagian penting dalam tim manajemen dan direksi sampoerna. ""pengalaman luas johan dalam operations, mulai dari manajemen rantai pasokan dan perencanaan produksi, serta keterampilan komunikasi dan kepemimpinannya yang kuat, akan sangat membantu dalam posisi barunya,"" kata vassilis. ""sementara itu, gunnar adalah seorang eksekutif yang berpengetahuan luas, yang secara konsisten menciptakan nilai di berbagai penugasan di tingkat global, regional, dan pasar. perspektif strategis, pengalaman internasional yang luas, semangat kolaboratif yang kuat, fokus pada konsumen, dan kemampuan membangun merek akan menjadi aset besar dalam peran barunya,"" tambah vassilis. vassilis juga mengucapkan terima kasih kepada dina dan francisca atas kontribusi dan kepemimpinan mereka di sampoerna. keduanya akan mengemban tanggung jawab baru di dalam organisasi pmi. ""ibu dina selalu mengutamakan keselamatan dan pengembangan karyawan, sehingga menjadi teladan nilai- nilai sampoerna dan pmi selama periode pandemi yang sangat menantang. beliau senantiasa memandu tim operations dalam berbagai pencapaian penting, termasuk terkait dengan investasi sampoerna dalam membangun fasilitas produksi untuk produk tembakau inovatif bebas asap,"" kata vassilis. ""sementara itu, ibu francisca telah memimpin timnya melalui masa-masa yang sangat menantang dengan pandangan ke depan. beliau juga membangun fondasi yang kuat untuk organisasi yang berpusat pada konsumen. pada saat yang sama, beliau juga turut mengantarkan perjalanan awal produk tembakau inovatif bebas asap yang diperkenalkan sampoerna kepada konsumen dewasa di indonesia,"" kata vassilis."
