Title;Content;Date;URL;Cleaned Article
Hadapi Tantangan Industri Otomotif di 2023, Kemenperin Dorong Perusahaan Jangkau Pasar Baru;"Laporan Wartawan Tribunnews.com, Lita Febriani TRIBUNNEWS.COM, JAKARTA - Menunjukkan performa maksimal di tahun 2022, industri otomotif nyatanya masih dihantui banyak tantangan pada 2023. Beberapa tantangan diantaranya terkait ketersediaan bahan baku, kekurangan semi-konduktor, kendala logistik dan transportasi, serta biaya energi yang tinggi. Direktur Industri Maritim, Alat Transportasi dan Alat Pertahanan Kementerian Perindustrian R. Hendro Martono, menyampaikan untuk mengatasi tantangan tersebut, Kemenperin mendorong perusahaan untuk mengembangkan sayap untuk menjangkau pasar-pasar baru, menguatkan inovasi, serta meningkatkan anggaran research and development (RnD). ""Hal-hal tersebut akan menjadi basis bagi Kemenperin dalam memperjuangkan insentif untuk industri otomotif. Inovasi serta ketersediaan bahan baku merupakan kunci bagi masa depan industri otomotif,"" tutur Hendro, Senin (30/1/2023). Di samping itu, Kemenperin dan para stakeholder terus berupaya memastikan bahwa proses produksi industri otomotif dapat berjalan dengan baik, termasuk dalam hal ketersediaan bahan baku.  ""Bapak Menteri Perindustrian juga meminta komitmen para pelaku industri otomotif untuk meningkatkan kandungan produk lokal, baik suku cadang maupun komponen, dalam proses manufaktur,"" terangnya.  .recads_wrapper{height:134px;position:relative;margin:10px 0 30px;padding:10px 15px;overflow:hidden;box-shadow:0 0 10px rgb(0 0 0 / 20%);}.recads_title{margin-bottom:10px;font-size:16px;font-weight:700}.arjW-list{overflow-x:scroll;overflow-y:hidden;white-space:nowrap;width:auto;padding:10px 0;position:relative;display:flex;scroll-snap-type:x;flex-wrap:nowrap}.recads_item{scroll-snap-align:start;width:280px;flex:0 0 280px;margin-right:20px;display: flex;white-space: normal;gap: 10px;}.recads_item a {display:flex;white-space:normal;gap:10px;}.recads_image{position:relative;height:auto}.recads_image img{width:auto;height: 73px!important;max-width:165px!important;border-radius:8px}.article_datas_title{font-size:14px;font-weight:700;line-height:1.2;margin:0;overflow:hidden;display:-webkit-box;-webkit-line-clamp:4;-webkit-box-orient:vertical;}.arjW-img-overlay{position:absolute;z-index:3;bottom:8px;left:0;padding:0 0 0 10px}.arjW-img-overlay>img{width:auto;height: 16px!important;}.recads_image::after{z-index:2;position:absolute;top:50%;bottom:4px;left:0;right:0;content:'';background:linear-gradient(to top,#d6d6d6,transparent);width:100%;border-radius: 8px;}             BERITA REKOMENDASI           Hendro menekankan perlunya integrasi industri kecil dan menengah (IKM) dalam pasokan dan produksi bagi industri yang lebih besar. ""Kemenperin berkomitmen untuk terus pertumbuhan dan pengintegrasian IKM ke dalam produksi global dan rantai pasokan industri otomotif. Kemitraan antara industri besar dan industri kecil ini diharapkan dapat menghasilkan sesuatu yang hebat,"" imbuhnya.";30-01-2023;https://www.tribunnews.com/bisnis/2023/01/30/hadapi-tantangan-industri-otomotif-di-2023-kemenperin-dorong-perusahaan-jangkau-pasar-baru;"laporan wartawan tribunnews.com, lita febriani tribunnews.com, jakarta - menunjukkan performa maksimal di tahun 2022, industri otomotif nyatanya masih dihantui banyak tantangan pada 2023. beberapa tantangan diantaranya terkait ketersediaan bahan baku, kekurangan semi-konduktor, kendala logistik dan transportasi, serta biaya energi yang tinggi. direktur industri maritim, alat transportasi dan alat pertahanan kementerian perindustrian r. hendro martono, menyampaikan untuk mengatasi tantangan tersebut, kemenperin mendorong perusahaan untuk mengembangkan sayap untuk menjangkau pasar-pasar baru, menguatkan inovasi, serta meningkatkan anggaran research and development (rnd). ""hal-hal tersebut akan menjadi basis bagi kemenperin dalam memperjuangkan insentif untuk industri otomotif. inovasi serta ketersediaan bahan baku merupakan kunci bagi masa depan industri otomotif,"" tutur hendro, senin (30/1/2023). di samping itu, kemenperin dan para stakeholder terus berupaya memastikan bahwa proses produksi industri otomotif dapat berjalan dengan baik, termasuk dalam hal ketersediaan bahan baku. ""bapak menteri perindustrian juga meminta komitmen para pelaku industri otomotif untuk meningkatkan kandungan produk lokal, baik suku cadang maupun komponen, dalam proses manufaktur,"" terangnya. berita rekomendasi hendro menekankan perlunya integrasi industri kecil dan menengah (ikm) dalam pasokan dan produksi bagi industri yang lebih besar. ""kemenperin berkomitmen untuk terus pertumbuhan dan pengintegrasian ikm ke dalam produksi global dan rantai pasokan industri otomotif. kemitraan antara industri besar dan industri kecil ini diharapkan dapat menghasilkan sesuatu yang hebat,"" imbuhnya."
4 Hal Ini Harus Dijaga agar Rekening Tabungan Tidak Dikuras Orang Lain;"JAKARTA, KOMPAS.com - Otoritas Jasa Keuangan (OJK) mengimbau agar masyarakat menjaga 4 hal agar dapat terhindar dari modus kejahatan perbankan.  Pasalnya, di era digital ini banyak pelaku kejahatan perbankan yang memanfaatkan kelalaian konsumen dalam menjaga data pribadi.  Salah satunya seperti kasus tukang becak bernama Setu yang berhasil menguras rekening tabungan nasabah BCA sebesar Rp 320 juta di kantor cabang BCA Indrapura, Surabaya berbekal kartu ATM, buku tabungan, KTP, dan pin ATM korban.  Adapun dalang dibalik kasus ini justru kenalan korban, yakni Thoha yang merupakan penghuni rumah kos milik korban. Pelaku mengaku belum ada sepekan tinggal di tempat indekos korban.   Lantas, bagaimana dia bisa mendapat identitas pribadi korban?  Thoha, dalam sidang lanjutan yang digelar secara daring di Pengadilan Negeri Surabaya, Selasa (24/1/2023) menjelaskan, peristiwa tersebut bermula saat dirinya mengetahui bahwa Muin memiliki uang ratusan juta rupiah di rekeningnya.  Hal itu diketahui ketika keduanya terlibat obrolan dan berencana membangun bisnis bersama. ""Dari situ saya tahu Muin (korban) punya uang lebih dari Rp 300 juta,"" kata dia, dikutip dari pemberitaan Kompas.com.  Melansir Sistem Informasi Penelusuran Perkara Pengadilan Negeri Surabaya, pada Rabu (3/8/2022) Thoha mengetahui nomor PIN e-banking milik Muin. Hal itu juga dibenarkan Thoha dalam sidang lanjutan.  Ketika itu, dia mengaku meminta tolong pada Muin untuk mentransfer sejumlah uang ke rekening lain. ""Saya mengintip nomor PIN-nya saat saya minta transfer uang,"" kata Thoha.  Thoha kemudian mempelajari teknik menarik uang dalam jumlah besar di bank selama dua hari. Dalam kurun waktu itu pula, dia menemukan Setu, seorang tukang becak yang memiliki penampilan mirip dengan Muin.  Pada Jumat (5/8/2023) Thoha memasuki kamar Muin secara sembunyi-sembunyi dan mencuri sejumlah barang berharga seperti kartu ATM dan buku tabungan. Dia kemudian bersama Setu melakukan penarikan uang secara besar-besaran dari rekening Muin.  Kepada Setu, Thoha berpura-pura meminta tolong untuk mengambil uang mewakilkan bapaknya yang sedang sakit. Setu pun setuju hingga dia mendapatkan upah Rp 5 juta dari uang Rp 320 juta yang dicairkan. Berkaca dari kasus itu, ada baiknya masyarakat terus berhati-hati dalam menjaga dokumen pribadi dan saat bertransaksi perbankan di manapun.  OJK dalam Instagram resminya membagikan empat hal yang perlu disimpan baik-baik terhindar dari modus kejahatan perbankan, yaitu sebagai berikut: Keempat data pribadi itu diperlukan sebagai syarat untuk menarik tabungan di kantor cabang bank sehingga nasabah bank wajib menjaga kerahasiaan 4 hal itu dari orang lain termasuk kerabat dan orang terdekat.  ""Simpan baik-baik 4 hal ini. Jangan berikan ke siapapun ya,"" tulis OJK dalam akun Instagramnya, Rabu (25/1/2023).  Terlebih jika nasabah lalai seperti kasus tukang becak itu, bank tidak akan mengganti uang korban yang sudah digasak pelaku karena kesalahan bukan dilakukan oleh pihak bank. ";26-01-2023;https://money.kompas.com/read/2023/01/26/102000926/4-hal-ini-harus-dijaga-agar-rekening-tabungan-tidak-dikuras-orang-lain;"jakarta,otoritas jasa keuangan (ojk) mengimbau agar masyarakat menjaga 4 hal agar dapat terhindar dari modus kejahatan perbankan. pasalnya, di era digital ini banyak pelaku kejahatan perbankan yang memanfaatkan kelalaian konsumen dalam menjaga data pribadi. salah satunya seperti kasus tukang becak bernama setu yang berhasil menguras rekening tabungan nasabah bca sebesar rp 320 juta di kantor cabang bca indrapura, surabaya berbekal kartu atm, buku tabungan, ktp, dan pin atm korban. adapun dalang dibalik kasus ini justru kenalan korban, yakni thoha yang merupakan penghuni rumah kos milik korban. pelaku mengaku belum ada sepekan tinggal di tempat indekos korban. lantas, bagaimana dia bisa mendapat identitas pribadi korban? thoha, dalam sidang lanjutan yang digelar secara daring di pengadilan negeri surabaya, selasa (24/1/2023) menjelaskan, peristiwa tersebut bermula saat dirinya mengetahui bahwa muin memiliki uang ratusan juta rupiah di rekeningnya. hal itu diketahui ketika keduanya terlibat obrolan dan berencana membangun bisnis bersama. ""dari situ saya tahu muin (korban) punya uang lebih dari rp 300 juta,"" kata dia, dikutip dari pemberitaan kompas.com. melansir sistem informasi penelusuran perkara pengadilan negeri surabaya, pada rabu (3/8/2022) thoha mengetahui nomor pin e-banking milik muin. hal itu juga dibenarkan thoha dalam sidang lanjutan. ketika itu, dia mengaku meminta tolong pada muin untuk mentransfer sejumlah uang ke rekening lain. ""saya mengintip nomor pin-nya saat saya minta transfer uang,"" kata thoha. thoha kemudian mempelajari teknik menarik uang dalam jumlah besar di bank selama dua hari. dalam kurun waktu itu pula, dia menemukan setu, seorang tukang becak yang memiliki penampilan mirip dengan muin. pada jumat (5/8/2023) thoha memasuki kamar muin secara sembunyi-sembunyi dan mencuri sejumlah barang berharga seperti kartu atm dan buku tabungan. dia kemudian bersama setu melakukan penarikan uang secara besar-besaran dari rekening muin. kepada setu, thoha berpura-pura meminta tolong untuk mengambil uang mewakilkan bapaknya yang sedang sakit. setu pun setuju hingga dia mendapatkan upah rp 5 juta dari uang rp 320 juta yang dicairkan. berkaca dari kasus itu, ada baiknya masyarakat terus berhati-hati dalam menjaga dokumen pribadi dan saat bertransaksi perbankan di manapun. ojk dalam instagram resminya membagikan empat hal yang perlu disimpan baik-baik terhindar dari modus kejahatan perbankan, yaitu sebagai berikut: keempat data pribadi itu diperlukan sebagai syarat untuk menarik tabungan di kantor cabang bank sehingga nasabah bank wajib menjaga kerahasiaan 4 hal itu dari orang lain termasuk kerabat dan orang terdekat. ""simpan baik-baik 4 hal ini. jangan berikan ke siapapun ya,"" tulis ojk dalam akun instagramnya, rabu (25/1/2023). terlebih jika nasabah lalai seperti kasus tukang becak itu, bank tidak akan mengganti uang korban yang sudah digasak pelaku karena kesalahan bukan dilakukan oleh pihak bank. "
Cek, Ini Tarif Listrik per-kWh yang Berlaku pada Februari 2023;KOMPAS.com - Pelanggan listrik non-subsidi membayar tarif penggunaan listriknya berdasarkan tariff adjustment yang ditentukan oleh pemerintah. Tariff adjusment adalah mekanisme mengubah dan menetapkan turun naiknya besaran tarif listrik mengikuti perubahan besarnya faktor ekonomi mikro, agar tarif yang dikenakan kepada konsumen mendekati Biaya Pokok Penyediaan Listrik (BPP). Adapun tarif listrik bagi pelanggan non-subsidi pada bulan Februari 2023, masih mengacu pada tarif yang berlaku saat ini. Pemerintah melalui Kementerian Energi dan Sumber Daya Mineral (ESDM) memastikan tidak ada kenaikan tarif listrik (tariff adjustment) bagi pelanggan non-subsidi sampai 31 Maret mendatang. Tarif listrik per kWh saat ini masih sama dengan tarif listrik pada triwulan IV-2022 atau periode Oktober-Desember tahun lalu. Disadur dari laman resmi Kementerian ESDM, penyesuaian tarif tenaga listrik (tariff adjustment) akan dilakukan jika terjadi perubahan terhadap realisasi indikator makro ekonomi yang dihitung secara tiga bulan. Lantas, berapa tarif listrik per-kWh bagi pelanggan PLN non-subsidi pada Februari 2023? Berdasarkan informasi resmi yang dirilis oleh PLN, tarif tenaga listrik (tariff adjustment) per kWh yang berlaku Februari 2023 sebagai berikut: Sebagai informasi, tarif tenaga listrik reguler adalah tarif tenaga listrik yang dibayarkan setelah pemakaian tenaga listrik oleh pelanggan. Adapun tarif tenaga listrik prabayar merupakan tarif tenaga listrik yang dibayarkan sebelum pemakaian tenaga listrik oleh konsumen. ;31-01-2023;https://money.kompas.com/read/2023/01/31/182300226/cek-ini-tarif-listrik-per-kwh-yang-berlaku-pada-februari-2023;pelanggan listrik non-subsidi membayar tarif penggunaan listriknya berdasarkan tariff adjustment yang ditentukan oleh pemerintah. tariff adjusment adalah mekanisme mengubah dan menetapkan turun naiknya besaran tarif listrik mengikuti perubahan besarnya faktor ekonomi mikro, agar tarif yang dikenakan kepada konsumen mendekati biaya pokok penyediaan listrik (bpp). adapun tarif listrik bagi pelanggan non-subsidi pada bulan februari 2023, masih mengacu pada tarif yang berlaku saat ini. pemerintah melalui kementerian energi dan sumber daya mineral (esdm) memastikan tidak ada kenaikan tarif listrik (tariff adjustment) bagi pelanggan non-subsidi sampai 31 maret mendatang. tarif listrik per kwh saat ini masih sama dengan tarif listrik pada triwulan iv-2022 atau periode oktober-desember tahun lalu. disadur dari laman resmi kementerian esdm, penyesuaian tarif tenaga listrik (tariff adjustment) akan dilakukan jika terjadi perubahan terhadap realisasi indikator makro ekonomi yang dihitung secara tiga bulan. lantas, berapa tarif listrik per-kwh bagi pelanggan pln non-subsidi pada februari 2023? berdasarkan informasi resmi yang dirilis oleh pln, tarif tenaga listrik (tariff adjustment) per kwh yang berlaku februari 2023 sebagai berikut: sebagai informasi, tarif tenaga listrik reguler adalah tarif tenaga listrik yang dibayarkan setelah pemakaian tenaga listrik oleh pelanggan. adapun tarif tenaga listrik prabayar merupakan tarif tenaga listrik yang dibayarkan sebelum pemakaian tenaga listrik oleh konsumen. 
Cegah Kerugian Negara, BPK Mulai Audit Keuangan BUMN ;"JAKARTA, KOMPAS.com – Setelah Kementerian ESDM dan Kementerian LHK, kali ini Badan Pemeriksa Keuangan (BPK) akan melakukan pemeriksaan kinerja keuangan Badan Usaha Milik Negara (BUMN).  Anggota VII Badan Pemeriksa Keuangan (BPK)/Pimpinan Pemeriksaan Keuangan Negara VII, Hendra Susanto mengatakan, berdasarkan data tahun anggaran 2021, BUMN memiliki aset sebesar Rp 8.978 triliun atau lebih dari 60 persen dari Produk Domestik Bruto (PDB) Indonesia. Aset ini tentunya harus dikelola dengan baik oleh BUMN.  Hal tersebut dia sampaikan saat memberikan pengarahan kepada para pemeriksa dalam rapat persiapan pemeriksaan tahun 2023. Sementara strategi yang komprehensif dapat dilakukan melalui kolaborasi dengan satuan pengawas internal (SPI) di BUMN terkait pemeriksaan subsidi.   ""Dengan langkah ini diharapkan dapat mengurangi beban pemeriksaan yang bersifat verifikasi, dan pemeriksaan dapat fokus pada pendapatan biaya investasi (PBI) yang merupakan proses bisnis yang signifikan pada BUMN yang diperiksa. Hal ini dapat memberikan solusi atas permasalahan BUMN yang sistemik,"" kata dia dikutip dari laman resmi BPK, Selasa (31/1/2023).  Untuk dapat meningkatkan pelayanan BUMN kepada publik, Auditorat Utama Keuangan Negara (AKN) VII akan melakukan pemeriksaan terkait Penanaman Modal Negara (PMN).   Pemeriksaan atas PMN ini dilaksanakan untuk memastikan PMN tersebut telah dikelola dengan tepat guna, sehingga BUMN dapat mendukung Proyek Strategis Nasional (PSN) dalam rangka pencapaian target dalam Rencana Pembangunan Jangka Menengah Nasional (RPJMN).  Baca juga: Temuan BPK: Biaya Transfer BI Fast Tidak Transparan dan Akuntabel  ""Sedangkan untuk menjaga kesinambungan BUMN, maka BPK akan melaksanakan pemeriksaan untuk memastikan implementasi good corporate governance, me-review pelaksanaan manajemen risiko dan menguji implementasi business judgement rules untuk mencegah terjadinya kerugian negara,"" ujar Hendra.  BPK mengharapkan agar pemeriksaan ini dapat mendorong peningkatan kinerja BUMN melalui pemberian rekomendasi-rekomendasi pemeriksaan yang difokuskan dalam rangka peningkatan kinerja operasional dan mengatasi hambatan yang dihadapi oleh BUMN. ";31-01-2023;https://money.kompas.com/read/2023/01/31/154000926/cegah-kerugian-negara-bpk-mulai-audit-keuangan-bumn-;"jakarta,setelah kementerian esdm dan kementerian lhk, kali ini badan pemeriksa keuangan (bpk) akan melakukan pemeriksaan kinerja keuangan badan usaha milik negara (bumn). anggota vii badan pemeriksa keuangan (bpk)/pimpinan pemeriksaan keuangan negara vii, hendra susanto mengatakan, berdasarkan data tahun anggaran 2021, bumn memiliki aset sebesar rp 8.978 triliun atau lebih dari 60 persen dari produk domestik bruto (pdb) indonesia. aset ini tentunya harus dikelola dengan baik oleh bumn. hal tersebut dia sampaikan saat memberikan pengarahan kepada para pemeriksa dalam rapat persiapan pemeriksaan tahun 2023. sementara strategi yang komprehensif dapat dilakukan melalui kolaborasi dengan satuan pengawas internal (spi) di bumn terkait pemeriksaan subsidi. ""dengan langkah ini diharapkan dapat mengurangi beban pemeriksaan yang bersifat verifikasi, dan pemeriksaan dapat fokus pada pendapatan biaya investasi (pbi) yang merupakan proses bisnis yang signifikan pada bumn yang diperiksa. hal ini dapat memberikan solusi atas permasalahan bumn yang sistemik,"" kata dia dikutip dari laman resmi bpk, selasa (31/1/2023). untuk dapat meningkatkan pelayanan bumn kepada publik, auditorat utama keuangan negara (akn) vii akan melakukan pemeriksaan terkait penanaman modal negara (pmn). pemeriksaan atas pmn ini dilaksanakan untuk memastikan pmn tersebut telah dikelola dengan tepat guna, sehingga bumn dapat mendukung proyek strategis nasional (psn) dalam rangka pencapaian target dalam rencana pembangunan jangka menengah nasional (rpjmn). baca juga: temuan bpk: biaya transfer bi fast tidak transparan dan akuntabel ""sedangkan untuk menjaga kesinambungan bumn, maka bpk akan melaksanakan pemeriksaan untuk memastikan implementasi good corporate governance, me-review pelaksanaan manajemen risiko dan menguji implementasi business judgement rules untuk mencegah terjadinya kerugian negara,"" ujar hendra. bpk mengharapkan agar pemeriksaan ini dapat mendorong peningkatan kinerja bumn melalui pemberian rekomendasi-rekomendasi pemeriksaan yang difokuskan dalam rangka peningkatan kinerja operasional dan mengatasi hambatan yang dihadapi oleh bumn. "
Naik Rp 3.000 Per Gram, Simak Rincian Harga Emas Antam Hari Ini;JAKARTA, KOMPAS.com - Harga emas batangan PT Aneka Tambang (Persero) Tbk naik pada hari ini, Rabu (25/1/2023).   Mengutip laman Logam Mulia, harga emas Antam dibanderol Rp 1.040.000 per gram atau menguat Rp 3.000 per gram dibandingkan dengan harga sebelumnya,Rp 1.037.000 per gram pada Selasa (24/1/2023).  Harga buyback emas Antam juga naik Rp 3.000 per gram pada level Rp 946.000 per gram.  Buyback adalah harga yang di dapat jika pemegang emas Antam ingin menjual emas batangan tersebut.   Namun, perlu diketahui bahwa harga emas Antam itu adalah yang berlaku di Butik Emas LM, Graha Dipta, Pulo Gadung, Jakarta Timur. Maka bisa saja harganya berbeda pada gerai penjualan emas Antam lainnya.  Adapun berdasarkan Peraturan Menteri Keuangan (PMK) Nomor 34/PMK.10/2017 diatur bahwa pembelian emas batangan akan dikenakan PPh 22 sebesar 0,9 persen.   Baca juga: Simak 4 Tips Investasi Emas untuk Investor Pemula   Jika ingin dapat potongan pajak lebih rendah sebesar 0,45 persen, maka sertakan Nomor Pokok Wajib Pajak (NPWP) setiap kali transaksi. Setiap pembelian emas batangan akan disertai dengan bukti potong PPh 22.   Sedangkan untuk buyback, berdasarkan PMK Nomor 34/PMK.10/2017, penjualan kembali emas batangan ke Antam dengan nilai lebih dari Rp 10 juta, akan dikenakan PPh 22 sebesar 1,5 persenuntuk pemegang NPWP dan 3 persenuntuk non NPWP.   Untuk diketahui pula, bahwa harga buyback yang ditetapkan Antam tersebut belum termasuk pengenaan pajak bila penjualannya melebihi Rp 10 juta. PPh 22 atas transaksi buyback akan dipotong langsung dari total nilai buyback.  Berikut rincian harga emas Antam hari ini:   Emas 0,5 gram: Rp 570.000   Emas 1 gram: Rp 1.040.000   Emas 2 gram: Rp 2.020.000  Emas 3 gram: Rp 3.005.000   Emas 5 gram: Rp 4.975.000  ;25-01-2023;https://money.kompas.com/read/2023/01/25/092000626/naik-rp-3.000-per-gram-simak-rincian-harga-emas-antam-hari-ini?page=all;jakarta,harga emas batangan pt aneka tambang (persero) tbk naik pada hari ini, rabu (25/1/2023). mengutip laman logam mulia, harga emas antam dibanderol rp 1.040.000 per gram atau menguat rp 3.000 per gram dibandingkan dengan harga sebelumnya,rp 1.037.000 per gram pada selasa (24/1/2023). harga buyback emas antam juga naik rp 3.000 per gram pada level rp 946.000 per gram. buyback adalah harga yang di dapat jika pemegang emas antam ingin menjual emas batangan tersebut. namun, perlu diketahui bahwa harga emas antam itu adalah yang berlaku di butik emas lm, graha dipta, pulo gadung, jakarta timur. maka bisa saja harganya berbeda pada gerai penjualan emas antam lainnya. adapun berdasarkan peraturan menteri keuangan (pmk) nomor 34/pmk.10/2017 diatur bahwa pembelian emas batangan akan dikenakan pph 22 sebesar 0,9 persen. baca juga: simak 4 tips investasi emas untuk investor pemula jika ingin dapat potongan pajak lebih rendah sebesar 0,45 persen, maka sertakan nomor pokok wajib pajak (npwp) setiap kali transaksi. setiap pembelian emas batangan akan disertai dengan bukti potong pph 22. sedangkan untuk buyback, berdasarkan pmk nomor 34/pmk.10/2017, penjualan kembali emas batangan ke antam dengan nilai lebih dari rp 10 juta, akan dikenakan pph 22 sebesar 1,5 persenuntuk pemegang npwp dan 3 persenuntuk non npwp. untuk diketahui pula, bahwa harga buyback yang ditetapkan antam tersebut belum termasuk pengenaan pajak bila penjualannya melebihi rp 10 juta. pph 22 atas transaksi buyback akan dipotong langsung dari total nilai buyback. berikut rincian harga emas antam hari ini: emas 0,5 gram: rp 570.000 emas 1 gram: rp 1.040.000 emas 2 gram: rp 2.020.000 emas 3 gram: rp 3.005.000 emas 5 gram: rp 4.975.000 
