Title;Content;Date;URL;Cleaned Article
IHSG Diprediksi Tertekan, Berikut Rekomendasi Saham Hari Ini;"Laporan Wartawan Tribunnews.com, Reynas Abdia TRIBUNNEWS.COM, JAKARTA - Indeks Harga Saham Gabungan hari ini diperkirakan akan cenderung tertekan dan akan bergerak di kisaran 6.789 - 7.034 pada perdagangan Rabu (12/6/2024). “Perkembangan pola gerak IHSG terlihat masih dibayangi oleh gelombang tekanan yang terlihat belum mereda, masih minimnya sentimen membuat IHSG cenderung memiliki potensi tekanan yang lebih besar dibanding peluang kenaikannya,” kata CEO Yugen Bertumbuh Sekuritas William Surya Wijaya. Di samping itu, masih terjadinya fluktuasi nilai tukar rupiah turut memberikan sentimen tersendiri bagi pergerakan IHSG. Selama support level terdekat dapat dipertahankan ditengah tekanan yang berlangsung maka peluang IHSG untuk kembali pada jalur uptrend jangka pendeknya masih terbuka “IHSG berpotensi terkonsolidasi,” tukasnya.  Tim riset Samuel Sekuritas Indonesia mencatat indeks kemarin gagal tembus level 6.940, bahkan cenderung melemah ke arah support down channel pola di sekitar 6.810, berikutnya 6750.  .recads_wrapper{height:134px;position:relative;margin:10px 0 30px;padding:10px 15px;overflow:hidden;box-shadow:0 0 10px rgb(0 0 0 / 20%);}.recads_title{margin-bottom:10px;font-size:16px;font-weight:700}.arjW-list{overflow-x:scroll;overflow-y:hidden;white-space:nowrap;width:auto;padding:10px 0;position:relative;display:flex;scroll-snap-type:x;flex-wrap:nowrap}.recads_item{scroll-snap-align:start;width:280px;flex:0 0 280px;margin-right:20px;display: flex;white-space: normal;gap: 10px;}.recads_item a {display:flex;white-space:normal;gap:10px;}.recads_image{position:relative;height:auto}.recads_image img{width:auto;height: 73px!important;max-width:165px!important;border-radius:8px}.article_datas_title{font-size:14px;font-weight:700;line-height:1.2;margin:0;overflow:hidden;display:-webkit-box;-webkit-line-clamp:4;-webkit-box-orient:vertical;}.arjW-img-overlay{position:absolute;z-index:3;bottom:8px;left:0;padding:0 0 0 10px}.arjW-img-overlay>img{width:auto;height: 16px!important;}.recads_image::after{z-index:2;position:absolute;top:50%;bottom:4px;left:0;right:0;content:'';background:linear-gradient(to top,#d6d6d6,transparent);width:100%;border-radius: 8px;}             BERITA REKOMENDASI           Jika terjadi rebound kemungkinan akan tertahan di sekitar 6.880-6.940. Berikut rekomendasi teknikal saham pada perdagangan Rabu (12/6/2024). AMMN (11875)Sp.BUY-TP @Rp12.200-Rp12.625Cutloss  BRIS (2170)BUY-TP @Rp2.240-Rp2.290Cutloss  ACES (862)BUY-TP @Rp880-Rp900Cutloss  GGRM (18800)BUY-TP @Rp19.200-19.450Cutloss  MBMA (605)BUY-TP @Rp620-Rp640Cutloss  NCKL (960)BUY-TP @Rp980-Rp990Cutloss";12-06-2024;https://www.tribunnews.com/bisnis/2024/06/12/ihsg-diprediksi-tertekan-berikut-rekomendasi-saham-hari-ini;laporan wartawan tribunnews.com, reynas abdia tribunnews.com, jakarta - indeks harga saham gabungan hari ini diperkirakan akan cenderung tertekan dan akan bergerak di kisaran 6.789 - 7.034 pada perdagangan rabu (12/6/2024). “perkembangan pola gerak ihsg terlihat masih dibayangi oleh gelombang tekanan yang terlihat belum mereda, masih minimnya sentimen membuat ihsg cenderung memiliki potensi tekanan yang lebih besar dibanding peluang kenaikannya,” kata ceo yugen bertumbuh sekuritas william surya wijaya. di samping itu, masih terjadinya fluktuasi nilai tukar rupiah turut memberikan sentimen tersendiri bagi pergerakan ihsg. selama support level terdekat dapat dipertahankan ditengah tekanan yang berlangsung maka peluang ihsg untuk kembali pada jalur uptrend jangka pendeknya masih terbuka “ihsg berpotensi terkonsolidasi,” tukasnya. tim riset samuel sekuritas indonesia mencatat indeks kemarin gagal tembus level 6.940, bahkan cenderung melemah ke arah support down channel pola di sekitar 6.810, berikutnya 6750. berita rekomendasi jika terjadi rebound kemungkinan akan tertahan di sekitar 6.880-6.940. berikut rekomendasi teknikal saham pada perdagangan rabu (12/6/2024). ammn (11875)sp.buy-tp @rp12.200-rp12.625cutloss bris (2170)buy-tp @rp2.240-rp2.290cutloss aces (862)buy-tp @rp880-rp900cutloss ggrm (18800)buy-tp @rp19.200-19.450cutloss mbma (605)buy-tp @rp620-rp640cutloss nckl (960)buy-tp @rp980-rp990cutloss
Dua Pekerja Terluka Akibat Semburan Uap Panas Smelter PT ITSS di Morowali Diklaim Mulai Membaik;"Laporan Wartawan Tribunnews.com, Lita Febriani TRIBUNNEWS.COM - Kecelakaan kerja kembali terjadi di PT Indonesia Tsingshan Stainless Steel (ITSS) pada Kamis (13/6/2024). Peristiwa ini menyebabkan dua orang pekerja mengalami luka cukup serius. Menurut akun media sosial X @LIPSedane menyebutkan kejadian tersebut diakibatkan oleh ledakan tabung oksigen. ""Morowali, 13 Juni 2024 - Terjadi Kecelakaan Kerja di PT ITSS-IMIP Morowali, yang disebabkan oleh Ledakan tabung oxy, akibat ledakan tersebut dua orang buruh menjadi korban dan mengalami luka bakar yg cukup parah,"" tulis akun @LIPSedane, dikutip Tribunnews.com, Jumat (14/6/2024). PT ITSS yang merupakan Tenant di Kawasan Industri Indonesia Morowali Industrial Park (IMIP) mengonfirmasi bahwa kedua karyawan yang mengalami luka segera dilarikan ke Klinik IMIP usai terkena uap panas ferronickel pada Kamis (13/6/2024) sekitar pukul 22.00 WITA. Kini, kondisi kedua korban dikabarkan membaik usai mendapatkan perawatan medis ketika di rujuk ke RSUD Bungku, Morowali, Sulawesi Tengah.  .recads_wrapper{height:134px;position:relative;margin:10px 0 30px;padding:10px 15px;overflow:hidden;box-shadow:0 0 10px rgb(0 0 0 / 20%);}.recads_title{margin-bottom:10px;font-size:16px;font-weight:700}.arjW-list{overflow-x:scroll;overflow-y:hidden;white-space:nowrap;width:auto;padding:10px 0;position:relative;display:flex;scroll-snap-type:x;flex-wrap:nowrap}.recads_item{scroll-snap-align:start;width:280px;flex:0 0 280px;margin-right:20px;display: flex;white-space: normal;gap: 10px;}.recads_item a {display:flex;white-space:normal;gap:10px;}.recads_image{position:relative;height:auto}.recads_image img{width:auto;height: 73px!important;max-width:165px!important;border-radius:8px}.article_datas_title{font-size:14px;font-weight:700;line-height:1.2;margin:0;overflow:hidden;display:-webkit-box;-webkit-line-clamp:4;-webkit-box-orient:vertical;}.arjW-img-overlay{position:absolute;z-index:3;bottom:8px;left:0;padding:0 0 0 10px}.arjW-img-overlay>img{width:auto;height: 16px!important;}.recads_image::after{z-index:2;position:absolute;top:50%;bottom:4px;left:0;right:0;content:'';background:linear-gradient(to top,#d6d6d6,transparent);width:100%;border-radius: 8px;}             BERITA REKOMENDASI           Manager Media Relations PT IMIP Dedy Kurniawan, membenarkan atas kejadian kecelakaan kerja tersebut. Namun, dirinya membantah bahwa kecelakaan diakibatkan karena ledakan di tungku smelter PT ITSS. ""Itu benar. Namun sekali lagi kami tegaskan bahwa itu terjadi bukan karena ledakan, melainkan semburan uap panas ketika karyawan melakukan pembersihan terak baja yang terdapat di lantai pabrik,"" tutur Dedy dalam keterangan resmi, Jumat (14/6/2024). Menurut Dedy, kejadian itu berawal ketika sejumlah karyawan sedang melakukan pembersihan lantai pabrik dari ceceran terak baja.  Untuk mempermudah proses pembersihan, dilakukan pemotongan terak baja tersebut. Usai dipotong, tiba-tiba seorang karyawan menyiram air pada terak baja yang baru saja dipotong dengan maksud untuk mempercepat proses pendinginan. Akibatnya, terjadi semburan uap panas dan mengenai dua orang karyawan. Kedua karyawan yang terluka saat ini sudah mendapat perawatan di RSUD Bungku dan kondisi kedua korban dalam keadaan sadar. Saat ini, penanganan yang dilakukan oleh pihak tim Safety IMIP adalah melakukan investigasi kecelakaan kerja di tempat tersebut.";14-06-2024;https://www.tribunnews.com/bisnis/2024/06/14/dua-pekerja-terluka-akibat-semburan-uap-panas-smelter-pt-itss-di-morowali-diklaim-mulai-membaik;"laporan wartawan tribunnews.com, lita febriani tribunnews.com - kecelakaan kerja kembali terjadi di pt indonesia tsingshan stainless steel (itss) pada kamis (13/6/2024). peristiwa ini menyebabkan dua orang pekerja mengalami luka cukup serius. menurut akun media sosial x @lipsedane menyebutkan kejadian tersebut diakibatkan oleh ledakan tabung oksigen. ""morowali, 13 juni 2024 - terjadi kecelakaan kerja di pt itss-imip morowali, yang disebabkan oleh ledakan tabung oxy, akibat ledakan tersebut dua orang buruh menjadi korban dan mengalami luka bakar yg cukup parah,"" tulis akun @lipsedane, dikutip tribunnews.com, jumat (14/6/2024). pt itss yang merupakan tenant di kawasan industri indonesia morowali industrial park (imip) mengonfirmasi bahwa kedua karyawan yang mengalami luka segera dilarikan ke klinik imip usai terkena uap panas ferronickel pada kamis (13/6/2024) sekitar pukul 22.00 wita. kini, kondisi kedua korban dikabarkan membaik usai mendapatkan perawatan medis ketika di rujuk ke rsud bungku, morowali, sulawesi tengah. berita rekomendasi manager media relations pt imip dedy kurniawan, membenarkan atas kejadian kecelakaan kerja tersebut. namun, dirinya membantah bahwa kecelakaan diakibatkan karena ledakan di tungku smelter pt itss. ""itu benar. namun sekali lagi kami tegaskan bahwa itu terjadi bukan karena ledakan, melainkan semburan uap panas ketika karyawan melakukan pembersihan terak baja yang terdapat di lantai pabrik,"" tutur dedy dalam keterangan resmi, jumat (14/6/2024). menurut dedy, kejadian itu berawal ketika sejumlah karyawan sedang melakukan pembersihan lantai pabrik dari ceceran terak baja. untuk mempermudah proses pembersihan, dilakukan pemotongan terak baja tersebut. usai dipotong, tiba-tiba seorang karyawan menyiram air pada terak baja yang baru saja dipotong dengan maksud untuk mempercepat proses pendinginan. akibatnya, terjadi semburan uap panas dan mengenai dua orang karyawan. kedua karyawan yang terluka saat ini sudah mendapat perawatan di rsud bungku dan kondisi kedua korban dalam keadaan sadar. saat ini, penanganan yang dilakukan oleh pihak tim safety imip adalah melakukan investigasi kecelakaan kerja di tempat tersebut."
Bitcoin Dinilai Bisa Jadi Alternatif Mata Uang Saat Kondisi Ekonomi Tak Stabil;"TRIBUNNEWS.COM, JAKARTA - Aset kripto, Bitcoin dinilai bisa menjadi alternatif opsi mata uang ketika kondisi ekonomi global tidak stabil. Hal ini berkaca dari kejadian pada Mei 2024, di mana Bank Sentral China mengalami perlambatan signifikan dalam pembelian emasnya, yang menunjukkan potensi perubahan strategi. Kondisi tersebut terjadi di tengah meningkatnya ketegangan geopolitik global dan upaya negara-negara mencari alternatif mata uang cadangan. Sejak awal abad ke-21, China secara konsisten membeli emas untuk mengamankan keuntungan dari surplus perdagangan dan sebagai alternatif terhadap dolar. Penurunan pembelian emas ini menandakan adanya pergeseran dalam kebijakan cadangan devisa negara tersebut, yang bisa berdampak signifikan. CEO Indodax, Oscar Darmawan menyampaikan, dalam konteks pergeseran geopolitik global, diversifikasi menjadi penting sebab dapat melindungi dari dampak negatif ketidakstabilan politik atau ekonomi di satu wilayah, serta fluktuasi nilai tukar dan inflasi. ""Peningkatan ketegangan ini mendorong beberapa negara untuk mencari alternatif dalam mata uang cadangan mereka,"" ujar Oscar dikutip dari Kontan, Sabtu (15/6/2024).  .recads_wrapper{height:134px;position:relative;margin:10px 0 30px;padding:10px 15px;overflow:hidden;box-shadow:0 0 10px rgb(0 0 0 / 20%);}.recads_title{margin-bottom:10px;font-size:16px;font-weight:700}.arjW-list{overflow-x:scroll;overflow-y:hidden;white-space:nowrap;width:auto;padding:10px 0;position:relative;display:flex;scroll-snap-type:x;flex-wrap:nowrap}.recads_item{scroll-snap-align:start;width:280px;flex:0 0 280px;margin-right:20px;display: flex;white-space: normal;gap: 10px;}.recads_item a {display:flex;white-space:normal;gap:10px;}.recads_image{position:relative;height:auto}.recads_image img{width:auto;height: 73px!important;max-width:165px!important;border-radius:8px}.article_datas_title{font-size:14px;font-weight:700;line-height:1.2;margin:0;overflow:hidden;display:-webkit-box;-webkit-line-clamp:4;-webkit-box-orient:vertical;}.arjW-img-overlay{position:absolute;z-index:3;bottom:8px;left:0;padding:0 0 0 10px}.arjW-img-overlay>img{width:auto;height: 16px!important;}.recads_image::after{z-index:2;position:absolute;top:50%;bottom:4px;left:0;right:0;content:'';background:linear-gradient(to top,#d6d6d6,transparent);width:100%;border-radius: 8px;}             BERITA REKOMENDASI           Oscar menambahkan Bitcoin muncul sebagai pilihan menarik dalam mencari alternatif, karena menawarkan keunggulan sebagai aset yang tidak terkait dengan kebijakan moneter suatu negara, dan memiliki sifat desentralisasi yang membuatnya lebih tahan terhadap tekanan politik dan sanksi eksternal. Ia menyebut, Bitcoin telah terbukti menjadi alat investasi yang efektif bagi investor yang mencari peluang pertumbuhan dan perlindungan terhadap fluktuasi mata uang konvensional.  El Salvador menjadi negara pertama yang mengadopsi Bitcoin sebagai devisa resmi pada September 2021, di bawah kepemimpinan Presiden Nayib Bukele. Tujuan utama langkah ini adalah meningkatkan inklusi keuangan, menarik investasi asing, dan mengurangi biaya pengiriman uang bagi warga yang bekerja di luar negeri. El Salvador mengintegrasikan Bitcoin dalam sistem keuangan nasionalnya untuk meraih manfaat ekonomi jangka panjang. (Noverius Laoli/Kontan) Artikel ini sudah tayang di Kontan dengan judul Bitcon Bisa Jadi Alternatif Investasi di Tengah Ketidakpastian Ekonomi";15-06-2024;https://www.tribunnews.com/new-economy/2024/06/15/bitcoin-dinilai-bisa-jadi-alternatif-mata-uang-saat-kondisi-ekonomi-tak-stabil;"tribunnews.com, jakarta - aset kripto, bitcoin dinilai bisa menjadi alternatif opsi mata uang ketika kondisi ekonomi global tidak stabil. hal ini berkaca dari kejadian pada mei 2024, di mana bank sentral china mengalami perlambatan signifikan dalam pembelian emasnya, yang menunjukkan potensi perubahan strategi. kondisi tersebut terjadi di tengah meningkatnya ketegangan geopolitik global dan upaya negara-negara mencari alternatif mata uang cadangan. sejak awal abad ke-21, china secara konsisten membeli emas untuk mengamankan keuntungan dari surplus perdagangan dan sebagai alternatif terhadap dolar. penurunan pembelian emas ini menandakan adanya pergeseran dalam kebijakan cadangan devisa negara tersebut, yang bisa berdampak signifikan. ceo indodax, oscar darmawan menyampaikan, dalam konteks pergeseran geopolitik global, diversifikasi menjadi penting sebab dapat melindungi dari dampak negatif ketidakstabilan politik atau ekonomi di satu wilayah, serta fluktuasi nilai tukar dan inflasi. ""peningkatan ketegangan ini mendorong beberapa negara untuk mencari alternatif dalam mata uang cadangan mereka,"" ujar oscar dikutip dari kontan, sabtu (15/6/2024). berita rekomendasi oscar menambahkan bitcoin muncul sebagai pilihan menarik dalam mencari alternatif, karena menawarkan keunggulan sebagai aset yang tidak terkait dengan kebijakan moneter suatu negara, dan memiliki sifat desentralisasi yang membuatnya lebih tahan terhadap tekanan politik dan sanksi eksternal. ia menyebut, bitcoin telah terbukti menjadi alat investasi yang efektif bagi investor yang mencari peluang pertumbuhan dan perlindungan terhadap fluktuasi mata uang konvensional. el salvador menjadi negara pertama yang mengadopsi bitcoin sebagai devisa resmi pada september 2021, di bawah kepemimpinan presiden nayib bukele. tujuan utama langkah ini adalah meningkatkan inklusi keuangan, menarik investasi asing, dan mengurangi biaya pengiriman uang bagi warga yang bekerja di luar negeri. el salvador mengintegrasikan bitcoin dalam sistem keuangan nasionalnya untuk meraih manfaat ekonomi jangka panjang. (noverius laoli/kontan) artikel ini sudah tayang di kontan dengan judul bitcon bisa jadi alternatif investasi di tengah ketidakpastian ekonomi"
Rangkaian KRL Jakarta-Bogor Hanya 8 Gerbong, KCI Ungkap Alasannya;"Laporan Wartawan Tribunnews.com, Nitis Hawaroh TRIBUNNEWS.COM, JAKARTA - PT KAI Commuter (KCI) mengungkapkan, jumlah rangkaian KRL rute Jakarta-Bogor yang hanya didominasi 8 gerbong ditujukan untuk menjaga frekuensi perjalanan kereta lantaran kurangnya jumlah armada yang siap beroperasi. ""Saat ini kami merekomposisi trainset kereta untuk mempertahankan headway perjalanan kereta,"" kata Manajer Humas Kereta Commuter Indonesia Leza Arlan saat dihubungi Tribunnews, Selasa (11/6/2024). Saat ini KAI Commuter mengoperasikan 1.048 perjalanan dengan menjalankan 89 rangkaian tiap hari kerja. Sedangkan pada hari libur dan akhir minggu 959 perjalanan dengan 87 rangkaian. Tercatat rata-rata volume pengguna pada hari kerja selama Juni 2024 ini sebanyak 989.353 orang. Volume tertinggi pada Senin 3 Juni lalu di angka 1.002.169 orang. Corporate Secretary KAI Commuter Anne Purba mengatakan, KAI Commuter mengoperasikan perjalanan lintas Bogor sebanyak 379 perjalanan, lintas Cikarang sebanyak 260 perjalanan, Lintas Rangkasbitung 199 perjalanan, Lintas Tangerang sebanyak 124 perjalanan dan Lintas Tanjungpriuk sebanyak 86 perjalanan. Menurutnya, pola operasi pesebaran rangkaian sarana Commuter Line ini mempertimbangkan dan menyesuaikan kebutuhan perawatan rutin yang dilakukan KAI Commuter. ""Perawatan rutin dan berkala ini untuk menjaga keselamatan dan keandalan sarana saat beroperasi tetap optimal serta peningkatan layanan kepada penggunanya,"" kata Anne dalam keterangannya.  .recads_wrapper{height:134px;position:relative;margin:10px 0 30px;padding:10px 15px;overflow:hidden;box-shadow:0 0 10px rgb(0 0 0 / 20%);}.recads_title{margin-bottom:10px;font-size:16px;font-weight:700}.arjW-list{overflow-x:scroll;overflow-y:hidden;white-space:nowrap;width:auto;padding:10px 0;position:relative;display:flex;scroll-snap-type:x;flex-wrap:nowrap}.recads_item{scroll-snap-align:start;width:280px;flex:0 0 280px;margin-right:20px;display: flex;white-space: normal;gap: 10px;}.recads_item a {display:flex;white-space:normal;gap:10px;}.recads_image{position:relative;height:auto}.recads_image img{width:auto;height: 73px!important;max-width:165px!important;border-radius:8px}.article_datas_title{font-size:14px;font-weight:700;line-height:1.2;margin:0;overflow:hidden;display:-webkit-box;-webkit-line-clamp:4;-webkit-box-orient:vertical;}.arjW-img-overlay{position:absolute;z-index:3;bottom:8px;left:0;padding:0 0 0 10px}.arjW-img-overlay>img{width:auto;height: 16px!important;}.recads_image::after{z-index:2;position:absolute;top:50%;bottom:4px;left:0;right:0;content:'';background:linear-gradient(to top,#d6d6d6,transparent);width:100%;border-radius: 8px;}             BERITA REKOMENDASI           Sementara itu, KCI nantinya akan menyeragamkan jumlah unit gerbong yang terdapat dalam satu rangkaian kereta atau stamformasi (SF) menjadi 12 gerbong dalam satu rangkaian (SF12) pada 2025 mendatang. Mengutip Kompas, KCI saat ini mengoperasikan sebanyak 1.115 gerbong dengan stamformasi 8 dan 10 dalam satu rangkaian KRL dari yang seharusnya 12. Berkurangnya jumlah gerbong dalam satu rangkaian KRL membuat kapasitas angkut satu rangkaian KRL turut berkurang. Hal ini menyebabkan banyak penumpang yang mengeluh karena terlalu berdempetan di dalam KRL. Anne Purba mengatakan, penambahan stamformasi dari SF8 dan SF10 menjadi SF12 dilakukan setelah proses peremajaan atau retrofit 19 rangkaian KRL dan pengadaan 16 rangkaian KRL baru selesai dilakukan pada 2025. Pasalnya 19 rangkaian yang diretrofit dan 16 rangkaian KRL baru dari PT INKA (Persero) sudah distandarisasi atau diseragamkan agar stamformasinya 12 gerbong.  ""Nanti untuk SF-nya itu setelah retrofit dan pengadaan baru ini semuanya 12 mulai 2025. Tapi selama retrofit itu kita lakukan, pasti akan tetap ada yang namanya SF8 dan SF10,"" ujarnya saat konferensi pers di Kantor Pusat KCI, Jakarta, Senin (6/11/2023). Meskipun stamformasi KRL belum dapat dimaksimalkan hingga SF12, namun KAI Commuter berkomitmen untuk tidak mengurangi frekuensi perjalanan agar penumpang tidak perlu menunggu kereta lebih lama. Anne menjelaskan, retrofit sebanyak 19 rangkaian akan dilakukan secara bertahap selama 2023-2026. Hal ini ditandai dengan penandatanganan Kontrak Kerjasama Pekerjaan Retrofit Sarana KRL sebanyak 19 rangkaian pada 3 November 2023 di Madiun. ""Dalam masa pengadaan KRL dan retrofit ini, kebijakan dari KCI itu tidak akan mengurangi frekuensi perjalanan,"" ucapnya.";11-06-2024;https://www.tribunnews.com/bisnis/2024/06/11/rangkaian-krl-jakarta-bogor-hanya-8-gerbong-kci-ungkap-alasannya;"laporan wartawan tribunnews.com, nitis hawaroh tribunnews.com, jakarta - pt kai commuter (kci) mengungkapkan, jumlah rangkaian krl rute jakarta-bogor yang hanya didominasi 8 gerbong ditujukan untuk menjaga frekuensi perjalanan kereta lantaran kurangnya jumlah armada yang siap beroperasi. ""saat ini kami merekomposisi trainset kereta untuk mempertahankan headway perjalanan kereta,"" kata manajer humas kereta commuter indonesia leza arlan saat dihubungi tribunnews, selasa (11/6/2024). saat ini kai commuter mengoperasikan 1.048 perjalanan dengan menjalankan 89 rangkaian tiap hari kerja. sedangkan pada hari libur dan akhir minggu 959 perjalanan dengan 87 rangkaian. tercatat rata-rata volume pengguna pada hari kerja selama juni 2024 ini sebanyak 989.353 orang. volume tertinggi pada senin 3 juni lalu di angka 1.002.169 orang. corporate secretary kai commuter anne purba mengatakan, kai commuter mengoperasikan perjalanan lintas bogor sebanyak 379 perjalanan, lintas cikarang sebanyak 260 perjalanan, lintas rangkasbitung 199 perjalanan, lintas tangerang sebanyak 124 perjalanan dan lintas tanjungpriuk sebanyak 86 perjalanan. menurutnya, pola operasi pesebaran rangkaian sarana commuter line ini mempertimbangkan dan menyesuaikan kebutuhan perawatan rutin yang dilakukan kai commuter. ""perawatan rutin dan berkala ini untuk menjaga keselamatan dan keandalan sarana saat beroperasi tetap optimal serta peningkatan layanan kepada penggunanya,"" kata anne dalam keterangannya. berita rekomendasi sementara itu, kci nantinya akan menyeragamkan jumlah unit gerbong yang terdapat dalam satu rangkaian kereta atau stamformasi (sf) menjadi 12 gerbong dalam satu rangkaian (sf12) pada 2025 mendatang. mengutip kompas, kci saat ini mengoperasikan sebanyak 1.115 gerbong dengan stamformasi 8 dan 10 dalam satu rangkaian krl dari yang seharusnya 12. berkurangnya jumlah gerbong dalam satu rangkaian krl membuat kapasitas angkut satu rangkaian krl turut berkurang. hal ini menyebabkan banyak penumpang yang mengeluh karena terlalu berdempetan di dalam krl. anne purba mengatakan, penambahan stamformasi dari sf8 dan sf10 menjadi sf12 dilakukan setelah proses peremajaan atau retrofit 19 rangkaian krl dan pengadaan 16 rangkaian krl baru selesai dilakukan pada 2025. pasalnya 19 rangkaian yang diretrofit dan 16 rangkaian krl baru dari pt inka (persero) sudah distandarisasi atau diseragamkan agar stamformasinya 12 gerbong. ""nanti untuk sf-nya itu setelah retrofit dan pengadaan baru ini semuanya 12 mulai 2025. tapi selama retrofit itu kita lakukan, pasti akan tetap ada yang namanya sf8 dan sf10,"" ujarnya saat konferensi pers di kantor pusat kci, jakarta, senin (6/11/2023). meskipun stamformasi krl belum dapat dimaksimalkan hingga sf12, namun kai commuter berkomitmen untuk tidak mengurangi frekuensi perjalanan agar penumpang tidak perlu menunggu kereta lebih lama. anne menjelaskan, retrofit sebanyak 19 rangkaian akan dilakukan secara bertahap selama 2023-2026. hal ini ditandai dengan penandatanganan kontrak kerjasama pekerjaan retrofit sarana krl sebanyak 19 rangkaian pada 3 november 2023 di madiun. ""dalam masa pengadaan krl dan retrofit ini, kebijakan dari kci itu tidak akan mengurangi frekuensi perjalanan,"" ucapnya."
