Title;Content;Date;URL;Cleaned Article
Kreasikan Teh Olahan Kulit Buah Kopi, Usaha Rintisan Mahasiswa Tembus E-Commerce;"Laporan wartawan Tribunnews.com, Fahdi Fahlevi TRIBUNNEWS.COM, JAKARTA - Mahasiswa Sekolah STEM Terapan Universitas Prasetiya Mulya mengembangkan kreasi minuman dari olahan kulit buah kopi atau cascara dengan produk berupa teh. Produk bernama Robustea ini didirikan oleh tim mahasiswa S1 Food Business Technology angkatan 2022, yaitu Alexander Bryan, Karyn Joy, Portia Bellezza, Raelen Angelina Halim, dan Valerie Chou. Usaha ini dikembangkan dalam mata kuliah Food Business Creation dan Food Business Development. Alexander Bryan menjelaskan, awal terbentuknya bisnis ini merupakan tuntutan dari mata kuliah di tahun ketiga mereka.  ""Bagaimana kita bisa mengimplementasikan beberapa bagian bisnis ke dalam produk yang kita kembangkan ini,"" kata Alexander, dalam keterangannya, Jumat (7/4/2023). Alexander mengungkapkan bahan baku teh ini dikreasikan melalui limbah kopi yaitu pada bagian kulit buahnya.  .recads_wrapper{height:134px;position:relative;margin:10px 0 30px;padding:10px 15px;overflow:hidden;box-shadow:0 0 10px rgb(0 0 0 / 20%);}.recads_title{margin-bottom:10px;font-size:16px;font-weight:700}.arjW-list{overflow-x:scroll;overflow-y:hidden;white-space:nowrap;width:auto;padding:10px 0;position:relative;display:flex;scroll-snap-type:x;flex-wrap:nowrap}.recads_item{scroll-snap-align:start;width:280px;flex:0 0 280px;margin-right:20px;display: flex;white-space: normal;gap: 10px;}.recads_item a {display:flex;white-space:normal;gap:10px;}.recads_image{position:relative;height:auto}.recads_image img{width:auto;height: 73px!important;max-width:165px!important;border-radius:8px}.article_datas_title{font-size:14px;font-weight:700;line-height:1.2;margin:0;overflow:hidden;display:-webkit-box;-webkit-line-clamp:4;-webkit-box-orient:vertical;}.arjW-img-overlay{position:absolute;z-index:3;bottom:8px;left:0;padding:0 0 0 10px}.arjW-img-overlay>img{width:auto;height: 16px!important;}.recads_image::after{z-index:2;position:absolute;top:50%;bottom:4px;left:0;right:0;content:'';background:linear-gradient(to top,#d6d6d6,transparent);width:100%;border-radius: 8px;}             BERITA REKOMENDASI           Saat ini, Indonesia merupakan salah satu produsen kopi terbesar di dunia, sebanyak 700 ribu ton per tahun dihasilkan atau 9 persen dari produksi kopi dunia. ""Tapi pengolahan biji kopi menghasilkan sekitar 40% limbah pangan karena bagian kulit dan daging yang tak terpakai,"" ungkap Alexander. Menurut Alexander, atau kulit buah kopi itu memiliki manfaat kesehatan yang banyak dan potensi ekonomi yang besar apabila diolah dengan baik untuk konsumsi manusia. Inovasi minuman ini, kata Alexander, aman dikonsumsi untuk penderita diabetes dan gangguan lambung. Saat ini inovasi teh para mahasiswa ini sudah dijual di e-commerce. ""Untuk tahap awal kita ke E-Commerce. Profil pembeli lebih banyak pria dan lebih banyak di wilayah Jakarta, Bandung, Surabaya, Tangerang, dan Cirebon,"" ucap Alexander. Sementara itu, Dekan Sekolah STEM Terapan Universitas Prasetiya Mulya Stevanus Wisnu Wijaya menambahkan, Robustea yang memanfaatkan kulit buah kopi untuk diolah menjadi teh merupakan inovasi mahasiswa yang juga mendukung isu ketahanan pangan. Stevanus mengungkapkan, sistem pembelajaran di kampusnya mewajibkan mahasiswanya mempraktikkan ilmu yang didapat menjadi sebuah produk bisnis. ""Kami berharap produk-produk inovasi dari mahasiswa ini bisa diterima di market dan juga memberikan dampak signifikan secara sosial dan juga ekonomi,"" ucap Stevanus. Saat ini terdapat 4 varian rasa dari teh cascara Robustea, yakni Puntang Bandung, Bali Kintamani, Blume, dan Lux. Varian Puntang Bandung dan Bali Kintamani masuk ke dalam lini produk Single Origin.";07-04-2023;https://www.tribunnews.com/bisnis/2023/04/07/kreasikan-teh-olahan-kulit-buah-kopi-usaha-rintisan-mahasiswa-tembus-e-commerce;"laporan wartawan tribunnews.com, fahdi fahlevi tribunnews.com, jakarta - mahasiswa sekolah stem terapan universitas prasetiya mulya mengembangkan kreasi minuman dari olahan kulit buah kopi atau cascara dengan produk berupa teh. produk bernama robustea ini didirikan oleh tim mahasiswa s1 food business technology angkatan 2022, yaitu alexander bryan, karyn joy, portia bellezza, raelen angelina halim, dan valerie chou. usaha ini dikembangkan dalam mata kuliah food business creation dan food business development. alexander bryan menjelaskan, awal terbentuknya bisnis ini merupakan tuntutan dari mata kuliah di tahun ketiga mereka. ""bagaimana kita bisa mengimplementasikan beberapa bagian bisnis ke dalam produk yang kita kembangkan ini,"" kata alexander, dalam keterangannya, jumat (7/4/2023). alexander mengungkapkan bahan baku teh ini dikreasikan melalui limbah kopi yaitu pada bagian kulit buahnya. berita rekomendasi saat ini, indonesia merupakan salah satu produsen kopi terbesar di dunia, sebanyak 700 ribu ton per tahun dihasilkan atau 9 persen dari produksi kopi dunia. ""tapi pengolahan biji kopi menghasilkan sekitar 40% limbah pangan karena bagian kulit dan daging yang tak terpakai,"" ungkap alexander. menurut alexander, atau kulit buah kopi itu memiliki manfaat kesehatan yang banyak dan potensi ekonomi yang besar apabila diolah dengan baik untuk konsumsi manusia. inovasi minuman ini, kata alexander, aman dikonsumsi untuk penderita diabetes dan gangguan lambung. saat ini inovasi teh para mahasiswa ini sudah dijual di e-commerce. ""untuk tahap awal kita ke e-commerce. profil pembeli lebih banyak pria dan lebih banyak di wilayah jakarta, bandung, surabaya, tangerang, dan cirebon,"" ucap alexander. sementara itu, dekan sekolah stem terapan universitas prasetiya mulya stevanus wisnu wijaya menambahkan, robustea yang memanfaatkan kulit buah kopi untuk diolah menjadi teh merupakan inovasi mahasiswa yang juga mendukung isu ketahanan pangan. stevanus mengungkapkan, sistem pembelajaran di kampusnya mewajibkan mahasiswanya mempraktikkan ilmu yang didapat menjadi sebuah produk bisnis. ""kami berharap produk-produk inovasi dari mahasiswa ini bisa diterima di market dan juga memberikan dampak signifikan secara sosial dan juga ekonomi,"" ucap stevanus. saat ini terdapat 4 varian rasa dari teh cascara robustea, yakni puntang bandung, bali kintamani, blume, dan lux. varian puntang bandung dan bali kintamani masuk ke dalam lini produk single origin."
Program PPM Harita Nickel Hasilkan Transaksi Rp 8 Miliar Per Bulan;"JAKARTA, KOMPAS.com - Kesadaran para pelaku bisnis dalam menjalankan praktik dan kegiatan operasional untuk lebih mendukung kelestarian lingkungan, dan dampak positif pada kegiatan sosial, serta ekonomi masyarakat dalam dua dekade, mengalami peningkatan. Kegiatan bisnis tidak hanya berorientasi kepada keuntungan ekonomi yang besar semata, namun lebih memerhatikan aspek sosial lingkungan. Hal ini sesuai dengan Agenda 2030 untuk Tujuan Pembangunan Berkelanjutan (TPB) atau The 2030 Agenda for Sustainable Development (SDGs). SDGs merupakan kesepakatan pembangunan baru yang mendorong perubahan-perubahan yang bergeser ke arah pembangunan berkelanjutan. Praktik SDGs juga haruslah berdasarkan hak asasi manusia dan kesetaraan untuk mendorong pembangunan sosial, ekonomi, dan lingkungan hidup.  SDGs diterapkan dengan prinsip-prinsip universal, integrasi, dan inklusif untuk meyakinkan bahwa tidak akan ada seorang pun yang terlewatkan atau “No-one Left Behind”. Terdiri dari 17 Tujuan, SDGs dilakukan dalam rangka melanjutkan upaya dan pencapaian Millennium Development Goals (MDGs) yang berakhir akhir pada tahun 2015 lalu. Salah satu perusahaan yang mendorong perubahan-perubahan ini adalah Harita Nickel, entitas Harita Group, yang membuka pertambangan dan hilirisasi terintegrasi, di Pulau Obi, Kabupaten Halmahera Selatan, Provinsi Maluku Utara. Harita  Harita Group berkomitmen untuk terus mendukung pembangunan berkelanjutan melalui pemenuhan Tujuan Pembangunan Berkelanjutan (TPB) atau Sustainable Development Goals (SDGs) Nomor 2 Tanpa Kelaparan, Nomor 5 Kesetaraan Gender, dan Nomor 8 Pekerjaan Layak dan Pertumbuhan Ekonomi. Salah satu upaya adalah dengan melakukan pembinaan di bidang pertanian. Melalui pengembangan ekonomi, perusahaan yang dimiliki Lim Hariyanto Wijaya ini berkomitmen untuk merealisasikan tiga tujuan yakni TPB Nomor 2 tanpa kelaparan, TPB Nomor 5 kesetaraan gender, dan TPB Nomor 8 pekerjaan yang layak dan pertumbuhan ekonomi. Untuk tiga tujuan tersebut, Department Head of Community Affairs and Land Management Latif Supriyadi menuturkan, Harita melakukan pembinaan di bidang pertanian, perikanan, dan kelompok UMKM Wanita. Secara rinci, pembinaan di bidang pertanian secara terus menerus diberikan terhadap 15 kelompok tani, 285 petani penyediaan input, pelatihan, dan akses pasar. ""Kami melaksanakan sejumlah program pengembangan dan pemberdayaan masyarakat (PPM) yang berdampak multiganda pada kehidupan ekonomi masyarakat di Pulau Obi dan sekitarnya. Sehingga tercipta rantai pasok yang berkesinambungan,"" tutur Latif.  Terdapat kelompok Sentra Ketahanan Pangan Obi (Sentani) yang telah memproduksi 5,3 ton padi per hektar dari total lahan 12 hektar yang digarap. Kemudian kelompok Akelamo Jaya Group yang memproduksi pertanian hortikultura melalui budidaya kacang panjang, cabai, dan tomat. Selanjutnya Obi Sehati yang merupakan sentra holtikultura dan agribisnis tanggap iklim dengan budidaya semangka dan melon. ";09-04-2023;https://lestari.kompas.com/read/2023/04/09/070000186/program-ppm-harita-nickel-hasilkan-transaksi-rp-8-miliar-per-bulan?page=all;"jakarta, kompas.com - kesadaran para pelaku bisnis dalam menjalankan praktik dan kegiatan operasional untuk lebih mendukung kelestarian lingkungan, dan dampak positif pada kegiatan sosial, serta ekonomi masyarakat dalam dua dekade, mengalami peningkatan. kegiatan bisnis tidak hanya berorientasi kepada keuntungan ekonomi yang besar semata, namun lebih memerhatikan aspek sosial lingkungan. hal ini sesuai dengan agenda 2030 untuk tujuan pembangunan berkelanjutan (tpb) atau the 2030 agenda for sustainable development (sdgs). sdgs merupakan kesepakatan pembangunan baru yang mendorong perubahan-perubahan yang bergeser ke arah pembangunan berkelanjutan. praktik sdgs juga haruslah berdasarkan hak asasi manusia dan kesetaraan untuk mendorong pembangunan sosial, ekonomi, dan lingkungan hidup. sdgs diterapkan dengan prinsip-prinsip universal, integrasi, dan inklusif untuk meyakinkan bahwa tidak akan ada seorang pun yang terlewatkan atau “no-one left behind”. terdiri dari 17 tujuan, sdgs dilakukan dalam rangka melanjutkan upaya dan pencapaian millennium development goals (mdgs) yang berakhir akhir pada tahun 2015 lalu. salah satu perusahaan yang mendorong perubahan-perubahan ini adalah harita nickel, entitas harita group, yang membuka pertambangan dan hilirisasi terintegrasi, di pulau obi, kabupaten halmahera selatan, provinsi maluku utara. harita harita group berkomitmen untuk terus mendukung pembangunan berkelanjutan melalui pemenuhan tujuan pembangunan berkelanjutan (tpb) atau sustainable development goals (sdgs) nomor 2 tanpa kelaparan, nomor 5 kesetaraan gender, dan nomor 8 pekerjaan layak dan pertumbuhan ekonomi. salah satu upaya adalah dengan melakukan pembinaan di bidang pertanian. melalui pengembangan ekonomi, perusahaan yang dimiliki lim hariyanto wijaya ini berkomitmen untuk merealisasikan tiga tujuan yakni tpb nomor 2 tanpa kelaparan, tpb nomor 5 kesetaraan gender, dan tpb nomor 8 pekerjaan yang layak dan pertumbuhan ekonomi. untuk tiga tujuan tersebut, department head of community affairs and land management latif supriyadi menuturkan, harita melakukan pembinaan di bidang pertanian, perikanan, dan kelompok umkm wanita. secara rinci, pembinaan di bidang pertanian secara terus menerus diberikan terhadap 15 kelompok tani, 285 petani penyediaan input, pelatihan, dan akses pasar. ""kami melaksanakan sejumlah program pengembangan dan pemberdayaan masyarakat (ppm) yang berdampak multiganda pada kehidupan ekonomi masyarakat di pulau obi dan sekitarnya. sehingga tercipta rantai pasok yang berkesinambungan,"" tutur latif. terdapat kelompok sentra ketahanan pangan obi (sentani) yang telah memproduksi 5,3 ton padi per hektar dari total lahan 12 hektar yang digarap. kemudian kelompok akelamo jaya group yang memproduksi pertanian hortikultura melalui budidaya kacang panjang, cabai, dan tomat. selanjutnya obi sehati yang merupakan sentra holtikultura dan agribisnis tanggap iklim dengan budidaya semangka dan melon. "
4 Cara Cek Rekening Penipu secara Online;JAKARTA, KOMPAS.com – Informasi seputar cara cek rekening penipu penting untuk diketahui. Hal ini bertujuan agar dapat mencegah terjadinya tindakan penipuan online yang semakin marak. Saat ini, cara cek rekening penipu dapat dilakukan secara online dengan mudah. Masyarakat tidak perlu datang ke kantor Otoritas Jasa Keuangan (OJK) terdekat untuk melakukan pengaduan.     Ada beberapa situs web yang bisa menjadi sarana untuk cek nomor rekening penipu secara online dengan akurat. Misalnya laman CekRekening.id dari Kementerian Komunikasi dan Informatika Republik Indonesia. Portal ini bertujuan untuk membantu masyarakat mendapatkan informasi rekening bank yang diduga terindikasi tindak pidana. Melalui CekRekening.id, masyarakat dapat melakukan cek rekening penipu apabila menerima SMS permintaan transfer atau pembayaran uang dari pihak lain yang tidak berkaitan dan tidak bertanggungjawab. Ada juga situs web Kredibel.go.id yang bisa cek nomor rekening penipu secara online beserta nomor handphone. Pilihan lain dari cara cek nomor rekening penipu adalah laman Lapor.go.id yang dikembangkan oleh Kementerian PAN RB bersama Kemendagri, Kantor Staf Presiden, dan Ombudsman Republik Indonesia. Nah, berikut ini beberapa cara cek rekening penipu secara online yang bisa dilakukan dengan mudah.  Rekening yang dilaporkan adalah rekening terkait tindak pidana penipuan, investasi palsu, narkotika dan obat terlarang, terorisme, dan kejahatan lainnya.    Berikut cara cek rekening penipu secara online melalui CekRekening.id: Untuk mendapatkan informasi lebih lanjut bisa melalui menghubungi call center: (021) 384 5786 dan WhatsApp: 08118331316. Freepik/rawpixel.com Cara cek rekening penipu secara online dengan mudah melalui website resmi Pilihan kedua dari cara cek nomor rekening penipu adalah melalui Lapor.go.id. Berikut langkah-langkahnya: Ketiga, laman Kredibel.go.id juga menjadi salah satu laman resmi yang memfasilitasi pengecekan nomor rekening penipu secara online. Berikut langkah-langkahnya: Pilihan terakhir dari cara cek nomor rekening penipu secara online yakni bisa melalui akun Instagram @indonesiablacklist. Caranya: Pengaduan dan pelaporan terkait nomor rekening penipu juga dapat dilakukan dengan menghubungi Otoritas Jasa Keuangan (OJK) di nomor 1-500-655. OJK juga menerima laporan dalam bentuk surat elektronik atau email di konsumen@ojk.go.id. Dalam laporan lewat email tersebut, Anda bisa mengirim tangkapan layar SMS nomor rekening penipu yang masuk ke pesan. Nantinya, nomor rekening penipu tersebut akan dikumpulkan OJK sebagai bukti buat membekukan rekening si penipu. Nah, itulah beberapa cara cek rekening penipu secara online yang bisa dilakukan dengan mudah tanpa harus keluar rumah.  Dok. Kredivo Cara cek rekening penipu secara online dengan mudah melalui website resmi ;09-04-2023;https://money.kompas.com/read/2023/04/09/225646826/4-cara-cek-rekening-penipu-secara-online;jakarta,informasi seputar cara cek rekening penipu penting untuk diketahui. hal ini bertujuan agar dapat mencegah terjadinya tindakan penipuan online yang semakin marak. saat ini, cara cek rekening penipu dapat dilakukan secara online dengan mudah. masyarakat tidak perlu datang ke kantor otoritas jasa keuangan (ojk) terdekat untuk melakukan pengaduan. ada beberapa situs web yang bisa menjadi sarana untuk cek nomor rekening penipu secara online dengan akurat. misalnya laman cekrekening.id dari kementerian komunikasi dan informatika republik indonesia. portal ini bertujuan untuk membantu masyarakat mendapatkan informasi rekening bank yang diduga terindikasi tindak pidana. melalui cekrekening.id, masyarakat dapat melakukan cek rekening penipu apabila menerima sms permintaan transfer atau pembayaran uang dari pihak lain yang tidak berkaitan dan tidak bertanggungjawab. ada juga situs web kredibel.go.id yang bisa cek nomor rekening penipu secara online beserta nomor handphone. pilihan lain dari cara cek nomor rekening penipu adalah laman lapor.go.id yang dikembangkan oleh kementerian pan rb bersama kemendagri, kantor staf presiden, dan ombudsman republik indonesia. nah, berikut ini beberapa cara cek rekening penipu secara online yang bisa dilakukan dengan mudah. rekening yang dilaporkan adalah rekening terkait tindak pidana penipuan, investasi palsu, narkotika dan obat terlarang, terorisme, dan kejahatan lainnya. berikut cara cek rekening penipu secara online melalui cekrekening.id: untuk mendapatkan informasi lebih lanjut bisa melalui menghubungi call center: (021) 384 5786 dan whatsapp: 08118331316. freepik/rawpixel.com cara cek rekening penipu secara online dengan mudah melalui website resmi pilihan kedua dari cara cek nomor rekening penipu adalah melalui lapor.go.id. berikut langkah-langkahnya: ketiga, laman kredibel.go.id juga menjadi salah satu laman resmi yang memfasilitasi pengecekan nomor rekening penipu secara online. berikut langkah-langkahnya: pilihan terakhir dari cara cek nomor rekening penipu secara online yakni bisa melalui akun instagram @indonesiablacklist. caranya: pengaduan dan pelaporan terkait nomor rekening penipu juga dapat dilakukan dengan menghubungi otoritas jasa keuangan (ojk) di nomor 1-500-655. ojk juga menerima laporan dalam bentuk surat elektronik atau email di konsumen@ojk.go.id. dalam laporan lewat email tersebut, anda bisa mengirim tangkapan layar sms nomor rekening penipu yang masuk ke pesan. nantinya, nomor rekening penipu tersebut akan dikumpulkan ojk sebagai bukti buat membekukan rekening si penipu. nah, itulah beberapa cara cek rekening penipu secara online yang bisa dilakukan dengan mudah tanpa harus keluar rumah. dok. kredivo cara cek rekening penipu secara online dengan mudah melalui website resmi 
Kemarin Melemah, Harga Emas Antam Hari Ini Naik Rp 2.000 Per Gram;JAKARTA, KOMPAS.com - Harga emas batangan PT Aneka Tambang (Persero) Tbk naik Rp 2.000 per gram pada hari ini, Rabu (12/4/2023), berbalik dari hari sebelumnya yang melemah Rp 3.000 per gram.   Mengutip laman Logam Mulia, harga emas Antam hari ini sebesar Rp 1.071.000 per gram dari hari sebelumnya yang seharga Rp 1.069.000 per gram.   Harga buyback juga naik Rp 2.000 per gram menjadi Rp 964.000 per gram dari sebelumnya Rp 962.000 per gram. Buyback adalah harga yang di dapat jika pemegang emas Antam ingin menjual emas batangan tersebut.  Meski begitu, harga emas Antam tersebut adalah yang berlaku di Butik Emas LM, Graha Dipta, Pulo Gadung, Jakarta Timur, sehingga bisa saja harganya berbeda pada gerai penjualan emas Antam lainnya.  Adapun berdasarkan Peraturan Menteri Keuangan (PMK) Nomor 34/PMK.10/2017 diatur bahwa pembelian emas batangan akan dikenakan PPh 22 sebesar 0,9 persen.   Jika ingin dapat potongan pajak lebih rendah sebesar 0,45 persen, maka sertakan Nomor Pokok Wajib Pajak (NPWP) setiap kali transaksi. Setiap pembelian emas batangan akan disertai dengan bukti potong PPh 22.   Sedangkan untuk buyback, berdasarkan PMK Nomor 34/PMK.10/2017, penjualan kembali emas batangan ke Antam dengan nilai lebih dari Rp 10 juta, akan dikenakan PPh 22 sebesar 1,5 persen untuk pemegang NPWP dan 3 persen untuk non NPWP.  Untuk diketahui pula, bahwa harga buyback yang ditetapkan Antam tersebut belum termasuk pengenaan pajak bila penjualannya melebihi Rp 10 juta. PPh 22 atas transaksi buyback akan dipotong langsung dari total nilai buyback.   Berikut rincian harga emas Antam hari ini: ;12-04-2023;https://money.kompas.com/read/2023/04/12/101000326/kemarin-melemah-harga-emas-antam-hari-ini-naik-rp-2.000-per-gram;jakarta,harga emas batangan pt aneka tambang (persero) tbk naik rp 2.000 per gram pada hari ini, rabu (12/4/2023), berbalik dari hari sebelumnya yang melemah rp 3.000 per gram. mengutip laman logam mulia, harga emas antam hari ini sebesar rp 1.071.000 per gram dari hari sebelumnya yang seharga rp 1.069.000 per gram. harga buyback juga naik rp 2.000 per gram menjadi rp 964.000 per gram dari sebelumnya rp 962.000 per gram. buyback adalah harga yang di dapat jika pemegang emas antam ingin menjual emas batangan tersebut. meski begitu, harga emas antam tersebut adalah yang berlaku di butik emas lm, graha dipta, pulo gadung, jakarta timur, sehingga bisa saja harganya berbeda pada gerai penjualan emas antam lainnya. adapun berdasarkan peraturan menteri keuangan (pmk) nomor 34/pmk.10/2017 diatur bahwa pembelian emas batangan akan dikenakan pph 22 sebesar 0,9 persen. jika ingin dapat potongan pajak lebih rendah sebesar 0,45 persen, maka sertakan nomor pokok wajib pajak (npwp) setiap kali transaksi. setiap pembelian emas batangan akan disertai dengan bukti potong pph 22. sedangkan untuk buyback, berdasarkan pmk nomor 34/pmk.10/2017, penjualan kembali emas batangan ke antam dengan nilai lebih dari rp 10 juta, akan dikenakan pph 22 sebesar 1,5 persen untuk pemegang npwp dan 3 persen untuk non npwp. untuk diketahui pula, bahwa harga buyback yang ditetapkan antam tersebut belum termasuk pengenaan pajak bila penjualannya melebihi rp 10 juta. pph 22 atas transaksi buyback akan dipotong langsung dari total nilai buyback. berikut rincian harga emas antam hari ini: 
