Title;Content;Date;URL;Cleaned Article
Great Eastern General Insurance Tawarkan Asuransi untuk UMKM;"Laporan Wartawan Tribunnews.com, Eko Sutriyanto TRIBUNNEWS.COM, JAKARTA - Meski kondisi sudah mulai membaik, jelas terlihat bahwa Usaha Mikro Kecil Menengah (UMKM) masih butuh banyak dukungan dan dorongan dari berbagai pihak selain dari pemerintah. Salah satu yang membutuhkan perhatian adalah mengurangi risiko yang menimpa UMKM, baik yang bergerak di sektor perdagangan, ritel ataupun industri. Marketing Director Great Eastern General Insurance Indonesia (GEGI), Linggawati Tok mengatakan, segala sesuatu yang ada di UMKM mulai dari stok barang, mesin, gedung hingga furnitur, perabotan, interior, dan peralatan elektronik rentan terhadap kerugian dan kerusakan.  ""Kerusakan atau gangguan dalam operasinal bisnis UMKM dapat mengakibatkan kerugian yang besar. Pemilik UMKM juga harus menyadari luasnya risiko dari adanya tanggung jawab yang mungkin timbul baik dari kelalaian para pemilik ataupun kelalaian para karyawannya,” kata Linggawati kepada wartawan, Senin (15/5/2023). Untuk membantu mengurangi risiko, GEGI menginisiasi sebuah produk khusus untuk UMKM, yaitu Shop Package Insurance yang memberikan perlindungan yang komprehensif untuk bisnis UMKM, termasuk untuk aset UMKM, tanggung jawab hukum terhadap pengunjung dan masyarakat umum. Shop Package Insurance juga menjamin pencurian, kerusuhan, pemogokan, banjir, badai, tanah longsor, gempa bumi dan kerusakan akibat kecelakaan lainnya. .recads_wrapper{height:134px;position:relative;margin:10px 0 30px;padding:10px 15px;overflow:hidden;box-shadow:0 0 10px rgb(0 0 0 / 20%);}.recads_title{margin-bottom:10px;font-size:16px;font-weight:700}.arjW-list{overflow-x:scroll;overflow-y:hidden;white-space:nowrap;width:auto;padding:10px 0;position:relative;display:flex;scroll-snap-type:x;flex-wrap:nowrap}.recads_item{scroll-snap-align:start;width:280px;flex:0 0 280px;margin-right:20px;display: flex;white-space: normal;gap: 10px;}.recads_item a {display:flex;white-space:normal;gap:10px;}.recads_image{position:relative;height:auto}.recads_image img{width:auto;height: 73px!important;max-width:165px!important;border-radius:8px}.article_datas_title{font-size:14px;font-weight:700;line-height:1.2;margin:0;overflow:hidden;display:-webkit-box;-webkit-line-clamp:4;-webkit-box-orient:vertical;}.arjW-img-overlay{position:absolute;z-index:3;bottom:8px;left:0;padding:0 0 0 10px}.arjW-img-overlay>img{width:auto;height: 16px!important;}.recads_image::after{z-index:2;position:absolute;top:50%;bottom:4px;left:0;right:0;content:'';background:linear-gradient(to top,#d6d6d6,transparent);width:100%;border-radius: 8px;}             BERITA REKOMENDASI";15-05-2023;https://www.tribunnews.com/bisnis/2023/05/15/great-eastern-general-insurance-tawarkan-asuransi-untuk-umkm;"laporan wartawan tribunnews.com, eko sutriyanto tribunnews.com, jakarta - meski kondisi sudah mulai membaik, jelas terlihat bahwa usaha mikro kecil menengah (umkm) masih butuh banyak dukungan dan dorongan dari berbagai pihak selain dari pemerintah. salah satu yang membutuhkan perhatian adalah mengurangi risiko yang menimpa umkm, baik yang bergerak di sektor perdagangan, ritel ataupun industri. marketing director great eastern general insurance indonesia (gegi), linggawati tok mengatakan, segala sesuatu yang ada di umkm mulai dari stok barang, mesin, gedung hingga furnitur, perabotan, interior, dan peralatan elektronik rentan terhadap kerugian dan kerusakan. ""kerusakan atau gangguan dalam operasinal bisnis umkm dapat mengakibatkan kerugian yang besar. pemilik umkm juga harus menyadari luasnya risiko dari adanya tanggung jawab yang mungkin timbul baik dari kelalaian para pemilik ataupun kelalaian para karyawannya,” kata linggawati kepada wartawan, senin (15/5/2023). untuk membantu mengurangi risiko, gegi menginisiasi sebuah produk khusus untuk umkm, yaitu shop package insurance yang memberikan perlindungan yang komprehensif untuk bisnis umkm, termasuk untuk aset umkm, tanggung jawab hukum terhadap pengunjung dan masyarakat umum. shop package insurance juga menjamin pencurian, kerusuhan, pemogokan, banjir, badai, tanah longsor, gempa bumi dan kerusakan akibat kecelakaan lainnya. berita rekomendasi"
Cara Cerdik Nasi Liwet Mbak Laksmi Solo Hadapi Gempuran Covid-19 dan Batalnya Piala Dunia U-20;"Laporan Wartawan Tribunnews.com, Wahyu Gilang Putranto TRIBUNNEWS.COM, SOLO - Nasi liwet 'Mbak Laksmi' mungkin tidak asing lagi bagi masyarakat Kota Solo, Jawa Tengah. Usaha kuliner khas Kota Solo itu sudah ada sejak 1997. Merek usaha diambil dari nama sang pendiri, Laksmi (50). Nasi liwet Mbak Laksmi merupakan UMKM binaan BRI, berlokasi di selter barat Stadion Manahan Solo. Setelah bertahan di masa pandemi Covid-19, usaha Laksmi kembali teruji dengan batalnya Piala Dunia U-20 di Indonesia yang digadang-gadang bisa meningkatkan perekonomian para pedagang. Laksmi mengalami masa saat konsumen tidak boleh makan di tempat karena aturan pembatasan Covid-19.  .recads_wrapper{height:134px;position:relative;margin:10px 0 30px;padding:10px 15px;overflow:hidden;box-shadow:0 0 10px rgb(0 0 0 / 20%);}.recads_title{margin-bottom:10px;font-size:16px;font-weight:700}.arjW-list{overflow-x:scroll;overflow-y:hidden;white-space:nowrap;width:auto;padding:10px 0;position:relative;display:flex;scroll-snap-type:x;flex-wrap:nowrap}.recads_item{scroll-snap-align:start;width:280px;flex:0 0 280px;margin-right:20px;display: flex;white-space: normal;gap: 10px;}.recads_item a {display:flex;white-space:normal;gap:10px;}.recads_image{position:relative;height:auto}.recads_image img{width:auto;height: 73px!important;max-width:165px!important;border-radius:8px}.article_datas_title{font-size:14px;font-weight:700;line-height:1.2;margin:0;overflow:hidden;display:-webkit-box;-webkit-line-clamp:4;-webkit-box-orient:vertical;}.arjW-img-overlay{position:absolute;z-index:3;bottom:8px;left:0;padding:0 0 0 10px}.arjW-img-overlay>img{width:auto;height: 16px!important;}.recads_image::after{z-index:2;position:absolute;top:50%;bottom:4px;left:0;right:0;content:'';background:linear-gradient(to top,#d6d6d6,transparent);width:100%;border-radius: 8px;}             BERITA REKOMENDASI           Meski begitu, Nasi Liwet Mbak Laksmi masih bisa bertahan karena telah didaftarkan di aplikasi penjualan online. ""Saat pandemi usaha masih bisa berjalan, karena saya juga jualan lewat Shopee Food dan Go Food,"" ungkap Laksmi saat dijumpai di selter Stadion Manahan Solo, Sabtu (6/5/2023).  Nasi Liwet Mbak Laksmi Solo (TribunSolo.com)  Walaupun konsumen yang datang berkurang drastis, Laksmi masih mendapat pesanan melalui aplikasi. Laksmi bersyukur tidak melewatkan tawaran dari pihak aplikasi agar usahanya didaftarkan beberapa tahun lalu. ""Dulu daftar aplikasi ditawari sebelum pandemi,"" ujarnya. Perbanyak Pilihan Menu Strategi lain yang dipakai Laksmi untuk bisa bertahan di tengah pandemi adalah dengan menambah pilihan menu. Menu utama warung Mbak Laksmi adalah nasi liwet dan gudeg ceker khas Solo. Kemudian, ibu dua anak itu melengkapinya dengan ayam geprek, ayam kremes, ayam bakar, lele, kakap, hingga bubur ayam. ""Jadi yang ingin menu selain nasi liwet ada pilihan. Selain itu menyesuaikan menu dengan kantong anak muda,"" ujarnya. Harga menu warung Mbak Laksmi mulai dari Rp 10.000. Selain menambah menu rupanya Laksmi rupanya membuat dua akun di masing-masing aplikasi. Satu akun digunakan untuk 'Nasi Liwet dan Gudeg Ceker Mbak Laksmi', satu lainnya untuk 'Ayam Geprek Mbak Laksmi'. Itu dilakukan Laksmi untuk memudahkan warungnya tampil pada pilihan pencarian saat konsumen aplikasi mencari menu makanan yang diinginkan. ""Jadi diketik nasi liwet muncul, dicari ayam geprek ya muncul,"" ungkapnya. Buka 24 Jam Strategi berikutnya, Laksmi membuka warungnya 24 jam. Selain di selter barat Stadion Manahan, Laksmi kini membuka warung di dua tempat berbeda, yaitu di Jalan Ir Soepomo dan di dekat Kampus IV Univesitas Muhammadiyah Surakarta (UMS). ""Tiga-tiganya 24 jam,"" ungkapnya.  INFO GRAFIS - Nasi Liwet Mbak Laksmi Solo (Tribunnews.com)  Setiap warung memiliki tiga karyawan yang terbagi dalam tiga shift. ""Masing-masing orang 10 jam, jadi ada waktu dua jam untuk pergantian shift dan saling bertemu,"" ujarnya. Alasan Laksmi membuka usahanya 24 jam karena menu nasi liwet dicari orang luar kota yang menginap di Solo. ""Jadi kapan pun mereka pengin nasi liwet selalu ada,"" ujarnya. Bahkan, saat momen lebaran pun Laksmi tetap membuka warungnya dengan menambah karyawan. ""Gajinya juga saya dobelin pas lebaran kemarin, kalau sekarang sudah kembali normal,"" ungkapnya.  Laksmi saat menyiapkan pesanan pelanggan di shelter pedagang barat Stadion Manahan Solo. (Tribunnews.com/Wahyu Gilang Putranto)  Polemik Piala Dunia U-20 Diketahui, Stadion Manahan Solo direncanakan menjadi salah satu venue diselenggarakannya Piala Dunia U-20 Indonesia. Sebagai persiapan, Pemerintah Kota Solo melakukan penataan para pedagang di sekitar Stadion Manahan. Para pedagang yang awalnya berada di sisi barat, utara, dan timur stadion, kini ditempatkan menjadi satu di bagian barat. Para pedagang menempati 120 selter yang disediakan Pemkot Solo. Saat proses pembenahan, para pedagang terpaksa untuk tidak berjualan. Setelah renovasi, lokasi pedagang pun tak lagi sama dengan sebelumnya. Warung Laksmi dulu berada tepat di tengah, dekat pintu barat stadion. Kini, Laksmi menempati sisi selatan, selter nomor lima. Hal itu diakui Laksmi mengurangi pendapatannya. ""Pas pindah di sini ya mengurangi omzet, langganan juga lepas, soalnya dulu lokasinya strategis pas di tengah, sekarang di sini,"" ujarnya. Namun Laksmi menerima apa yang telah diputuskan pemerintah. ""Pokoknya kami ikut Pemkot, wong kita juga binaan, kita kan juga dapat hak pakai,"" ujarnya.  Kondisi shelter pedagang di barat Stadion Manahan Solo, Jawa Tengah, setelah direnovasi. (Tribunnews/Wahyu Gilang Putranto)  Permodalan Cukup dan Digitalisasi Laksmi mengaku saat ini usahanya mendapat program permodalan dari Bank BRI. ""Saya ada permodalan dari BRI, kalau sudah selesai ya ditawarin lagi, ya saya ambil lagi,"" ujarnya. Setoran bulanan yang dibayarkan Laksmi langsung terpotong otomatis dari rekening yang ia gunakan untuk aplikasi pesan makanan online. ""Jadi bayar setorannya pakai nasi, enggak kerasa,"" candanya. Selain itu, dengan renovasi selter Stadion Manahan Solo yang bekerja sama dengan BRI, pelanggan di warung Laksmi sudah dapat membayar dengan QRIS. ""Banyak anak muda sekarang yang bayar lewat scan QRIS itu, lebih mudah katanya,"" pungkas Laksmi. (*)";10-05-2023;https://www.tribunnews.com/bisnis/2023/05/10/cara-cerdik-nasi-liwet-mbak-laksmi-solo-hadapi-gempuran-covid-19-dan-batalnya-piala-dunia-u-20;"laporan wartawan tribunnews.com, wahyu gilang putranto tribunnews.com, solo - nasi liwet 'mbak laksmi' mungkin tidak asing lagi bagi masyarakat kota solo, jawa tengah. usaha kuliner khas kota solo itu sudah ada sejak 1997. merek usaha diambil dari nama sang pendiri, laksmi (50). nasi liwet mbak laksmi merupakan umkm binaan bri, berlokasi di selter barat stadion manahan solo. setelah bertahan di masa pandemi covid-19, usaha laksmi kembali teruji dengan batalnya piala dunia u-20 di indonesia yang digadang-gadang bisa meningkatkan perekonomian para pedagang. laksmi mengalami masa saat konsumen tidak boleh makan di tempat karena aturan pembatasan covid-19. berita rekomendasi meski begitu, nasi liwet mbak laksmi masih bisa bertahan karena telah didaftarkan di aplikasi penjualan online. ""saat pandemi usaha masih bisa berjalan, karena saya juga jualan lewat shopee food dan go food,"" ungkap laksmi saat dijumpai di selter stadion manahan solo, sabtu (6/5/2023). nasi liwet mbak laksmi solo (tribunsolo.com) walaupun konsumen yang datang berkurang drastis, laksmi masih mendapat pesanan melalui aplikasi. laksmi bersyukur tidak melewatkan tawaran dari pihak aplikasi agar usahanya didaftarkan beberapa tahun lalu. ""dulu daftar aplikasi ditawari sebelum pandemi,"" ujarnya. perbanyak pilihan menu strategi lain yang dipakai laksmi untuk bisa bertahan di tengah pandemi adalah dengan menambah pilihan menu. menu utama warung mbak laksmi adalah nasi liwet dan gudeg ceker khas solo. kemudian, ibu dua anak itu melengkapinya dengan ayam geprek, ayam kremes, ayam bakar, lele, kakap, hingga bubur ayam. ""jadi yang ingin menu selain nasi liwet ada pilihan. selain itu menyesuaikan menu dengan kantong anak muda,"" ujarnya. harga menu warung mbak laksmi mulai dari rp 10.000. selain menambah menu rupanya laksmi rupanya membuat dua akun di masing-masing aplikasi. satu akun digunakan untuk 'nasi liwet dan gudeg ceker mbak laksmi', satu lainnya untuk 'ayam geprek mbak laksmi'. itu dilakukan laksmi untuk memudahkan warungnya tampil pada pilihan pencarian saat konsumen aplikasi mencari menu makanan yang diinginkan. ""jadi diketik nasi liwet muncul, dicari ayam geprek ya muncul,"" ungkapnya. buka 24 jam strategi berikutnya, laksmi membuka warungnya 24 jam. selain di selter barat stadion manahan, laksmi kini membuka warung di dua tempat berbeda, yaitu di jalan ir soepomo dan di dekat kampus iv univesitas muhammadiyah surakarta (ums). ""tiga-tiganya 24 jam,"" ungkapnya. info grafis - nasi liwet mbak laksmi solo (tribunnews.com) setiap warung memiliki tiga karyawan yang terbagi dalam tiga shift. ""masing-masing orang 10 jam, jadi ada waktu dua jam untuk pergantian shift dan saling bertemu,"" ujarnya. alasan laksmi membuka usahanya 24 jam karena menu nasi liwet dicari orang luar kota yang menginap di solo. ""jadi kapan pun mereka pengin nasi liwet selalu ada,"" ujarnya. bahkan, saat momen lebaran pun laksmi tetap membuka warungnya dengan menambah karyawan. ""gajinya juga saya dobelin pas lebaran kemarin, kalau sekarang sudah kembali normal,"" ungkapnya. laksmi saat menyiapkan pesanan pelanggan di shelter pedagang barat stadion manahan solo. (tribunnews.com/wahyu gilang putranto) polemik piala dunia u-20 diketahui, stadion manahan solo direncanakan menjadi salah satu venue diselenggarakannya piala dunia u-20 indonesia. sebagai persiapan, pemerintah kota solo melakukan penataan para pedagang di sekitar stadion manahan. para pedagang yang awalnya berada di sisi barat, utara, dan timur stadion, kini ditempatkan menjadi satu di bagian barat. para pedagang menempati 120 selter yang disediakan pemkot solo. saat proses pembenahan, para pedagang terpaksa untuk tidak berjualan. setelah renovasi, lokasi pedagang pun tak lagi sama dengan sebelumnya. warung laksmi dulu berada tepat di tengah, dekat pintu barat stadion. kini, laksmi menempati sisi selatan, selter nomor lima. hal itu diakui laksmi mengurangi pendapatannya. ""pas pindah di sini ya mengurangi omzet, langganan juga lepas, soalnya dulu lokasinya strategis pas di tengah, sekarang di sini,"" ujarnya. namun laksmi menerima apa yang telah diputuskan pemerintah. ""pokoknya kami ikut pemkot, wong kita juga binaan, kita kan juga dapat hak pakai,"" ujarnya. kondisi shelter pedagang di barat stadion manahan solo, jawa tengah, setelah direnovasi. (tribunnews/wahyu gilang putranto) permodalan cukup dan digitalisasi laksmi mengaku saat ini usahanya mendapat program permodalan dari bank bri. ""saya ada permodalan dari bri, kalau sudah selesai ya ditawarin lagi, ya saya ambil lagi,"" ujarnya. setoran bulanan yang dibayarkan laksmi langsung terpotong otomatis dari rekening yang ia gunakan untuk aplikasi pesan makanan online. ""jadi bayar setorannya pakai nasi, enggak kerasa,"" candanya. selain itu, dengan renovasi selter stadion manahan solo yang bekerja sama dengan bri, pelanggan di warung laksmi sudah dapat membayar dengan qris. ""banyak anak muda sekarang yang bayar lewat scan qris itu, lebih mudah katanya,"" pungkas laksmi. (*)"
Rekrutmen Bersama BUMN 2023 Dibuka, Ini Daftar Lowongan Pekerjaan dari PT Pertamina Patra Niaga;"TRIBUNNEWS.COM – Inilah daftar lowongan pekerjaan yang dibuka oleh PT Pertamina Patra Niaga. Kementerian Badan Usaha Milik Negara atau Kementerian BUMN secara resmi membuka rekrutmen bersama pada Kamis (11/5/2023). Rekrutmen bersama ini bertujuan untuk mencari talenta terbaik dari putra dan putri bangsa untuk dapat bergabung di berbagai perusahaan BUMN. Mengutip dari laman Forum Human Capital Indonesia, salah satu perusahaan BUMN yang membuka lowongan kerja dalam seleksi bersama ini adalah PT Pertamina Patra Niaga. Untuk lebih lengkapnya, simak daftar lowongan pekerjaan yang dibuka oleh PT Pertamina Patra Niaga di bawah ini:  1.      PT Pertamina (Persero) - PT PERTAMINA PATRA NIAGA Posisi : Junior Engineer I Construction  .recads_wrapper{height:134px;position:relative;margin:10px 0 30px;padding:10px 15px;overflow:hidden;box-shadow:0 0 10px rgb(0 0 0 / 20%);}.recads_title{margin-bottom:10px;font-size:16px;font-weight:700}.arjW-list{overflow-x:scroll;overflow-y:hidden;white-space:nowrap;width:auto;padding:10px 0;position:relative;display:flex;scroll-snap-type:x;flex-wrap:nowrap}.recads_item{scroll-snap-align:start;width:280px;flex:0 0 280px;margin-right:20px;display: flex;white-space: normal;gap: 10px;}.recads_item a {display:flex;white-space:normal;gap:10px;}.recads_image{position:relative;height:auto}.recads_image img{width:auto;height: 73px!important;max-width:165px!important;border-radius:8px}.article_datas_title{font-size:14px;font-weight:700;line-height:1.2;margin:0;overflow:hidden;display:-webkit-box;-webkit-line-clamp:4;-webkit-box-orient:vertical;}.arjW-img-overlay{position:absolute;z-index:3;bottom:8px;left:0;padding:0 0 0 10px}.arjW-img-overlay>img{width:auto;height: 16px!important;}.recads_image::after{z-index:2;position:absolute;top:50%;bottom:4px;left:0;right:0;content:'';background:linear-gradient(to top,#d6d6d6,transparent);width:100%;border-radius: 8px;}             BERITA REKOMENDASI           Jurusan : Teknik Elektro,  Teknik Fisika, Teknik Industri, Teknik Kelautan, Teknik Kimia, Teknik Mekanik, Teknik Mesin, Teknik Metalurgi dan Mining, Teknik Perkapalan, Teknik Sipil Jenjang : Sarjana S1 / Diploma IV 2.      PT Pertamina (Persero) - PT PERTAMINA PATRA NIAGA Posisi : Junior Engineer I Facilities Jurusan : Teknik Elektro,  Teknik Fisika, Teknik Industri, Teknik Kelautan, Teknik Kimia, Teknik Mekanik, Teknik Mesin, Teknik Metalurgi dan Mining, Teknik Perkapalan, Teknik Sipil Jenjang : Sarjana S1 / Diploma IV 3.      PT Pertamina (Persero) - PT Pertamina Patra Niaga - PT Pertamina Lubricants Posisi : Junior Spv. Depot Supply Point Jurusan : Manajemen Logistik,  Manajemen Operasional, Teknik Industri Jenjang : Diploma III 4.      PT Pertamina (Persero) - PT Pertamina Patra Niaga - PT Pertamina Lubricants Posisi : Sales Support Key Account Jurusan : Ekonomi Manajemen,  Teknik Industri, Teknik Kimia Jenjang : Sarjana S1 / Diploma IV 5.      PT Pertamina (Persero) - PT Pertamina Patra Niaga - PT Pertamina Lubricants Posisi : Junior Analyst QC Lab Production Jurusan : Kimia,  Teknik Kimia Jenjang : Sarjana S1 / Diploma IV 6.      PT Pertamina (Persero) - PT Pertamina Patra Niaga - PT Pertamina Lubricants Posisi : Junior Analyst Bench Test dan Engine Test Jurusan : Teknik Fisika,  Teknik Kimia, Teknik Mesin Jenjang : Sarjana S1 / Diploma IV 7.      PT Pertamina (Persero) - PT Pertamina Patra Niaga - PT Pertamina Lubricants Posisi : Area Sales Supervisor Industry Jurusan : Teknik Industri,  Teknik Kimia, Teknik Mesin Jenjang : Sarjana S1 / Diploma IV 8.      PT Pertamina (Persero) - PT Pertamina Patra Niaga - PT Pertamina Retail Posisi : Business Unit Head Sales Area I (Sumatera Area) Jurusan : Hukum Bisnis,  Ilmu Manajemen, Teknik Mesin/Otomotif Jenjang : Diploma III 9.      PT Pertamina (Persero) - PT Pertamina Patra Niaga - PT Pertamina Retail Posisi : Business Unit Head Sales Area III (Jawa Barat Area) Jurusan : Hukum Bisnis,  Ilmu Manajemen, Teknik Mesin/Otomotif Jenjang : Diploma III 10.  PT Pertamina (Persero) - PT Pertamina Patra Niaga - PT Pertamina Retail Posisi : Business Unit Head Sales Area IV (Jateng dan Jatimbalinus Area) Jurusan : Hukum Bisnis,  Ilmu Manajemen, Teknik Mesin/Otomotif Jenjang : Diploma III 11.  PT Pertamina (Persero) - PT Pertamina Patra Niaga - PT Pertamina Retail Posisi : Business Unit Head Sales Area V (Kalimantan, Sulawesi, Papua Area) Jurusan : Hukum Bisnis,  Ilmu Manajemen, Teknik Mesin/Otomotif Jenjang : Diploma III 12.  PT Pertamina (Persero) - PT Pertamina Patra Niaga - PT Pertamina Retail Posisi : Junior Auditor Operation Function Jurusan : Akuntansi,  Manajemen Keuangan Jenjang : Sarjana S1 / Diploma IV 13.  PT Pertamina (Persero) - PT Pertamina Patra Niaga - PT Pertamina Retail Posisi : Staff Fuel Retail Account Receivable Jurusan : Akuntansi Jenjang : Sarjana S1 / Diploma IV (Tribunnews.com/Mikael Dafit Adi Prasetyo)";12-05-2023;https://www.tribunnews.com/bisnis/2023/05/12/rekrutmen-bersama-bumn-2023-dibuka-ini-daftar-lowongan-pekerjaan-dari-pt-pertamina-patra-niaga;tribunnews.com – inilah daftar lowongan pekerjaan yang dibuka oleh pt pertamina patra niaga. kementerian badan usaha milik negara atau kementerian bumn secara resmi membuka rekrutmen bersama pada kamis (11/5/2023). rekrutmen bersama ini bertujuan untuk mencari talenta terbaik dari putra dan putri bangsa untuk dapat bergabung di berbagai perusahaan bumn. mengutip dari laman forum human capital indonesia, salah satu perusahaan bumn yang membuka lowongan kerja dalam seleksi bersama ini adalah pt pertamina patra niaga. untuk lebih lengkapnya, simak daftar lowongan pekerjaan yang dibuka oleh pt pertamina patra niaga di bawah ini: 1. pt pertamina (persero) - pt pertamina patra niaga posisi : junior engineer i construction berita rekomendasi jurusan : teknik elektro, teknik fisika, teknik industri, teknik kelautan, teknik kimia, teknik mekanik, teknik mesin, teknik metalurgi dan mining, teknik perkapalan, teknik sipil jenjang : sarjana s1 / diploma iv 2. pt pertamina (persero) - pt pertamina patra niaga posisi : junior engineer i facilities jurusan : teknik elektro, teknik fisika, teknik industri, teknik kelautan, teknik kimia, teknik mekanik, teknik mesin, teknik metalurgi dan mining, teknik perkapalan, teknik sipil jenjang : sarjana s1 / diploma iv 3. pt pertamina (persero) - pt pertamina patra niaga - pt pertamina lubricants posisi : junior spv. depot supply point jurusan : manajemen logistik, manajemen operasional, teknik industri jenjang : diploma iii 4. pt pertamina (persero) - pt pertamina patra niaga - pt pertamina lubricants posisi : sales support key account jurusan : ekonomi manajemen, teknik industri, teknik kimia jenjang : sarjana s1 / diploma iv 5. pt pertamina (persero) - pt pertamina patra niaga - pt pertamina lubricants posisi : junior analyst qc lab production jurusan : kimia, teknik kimia jenjang : sarjana s1 / diploma iv 6. pt pertamina (persero) - pt pertamina patra niaga - pt pertamina lubricants posisi : junior analyst bench test dan engine test jurusan : teknik fisika, teknik kimia, teknik mesin jenjang : sarjana s1 / diploma iv 7. pt pertamina (persero) - pt pertamina patra niaga - pt pertamina lubricants posisi : area sales supervisor industry jurusan : teknik industri, teknik kimia, teknik mesin jenjang : sarjana s1 / diploma iv 8. pt pertamina (persero) - pt pertamina patra niaga - pt pertamina retail posisi : business unit head sales area i (sumatera area) jurusan : hukum bisnis, ilmu manajemen, teknik mesin/otomotif jenjang : diploma iii 9. pt pertamina (persero) - pt pertamina patra niaga - pt pertamina retail posisi : business unit head sales area iii (jawa barat area) jurusan : hukum bisnis, ilmu manajemen, teknik mesin/otomotif jenjang : diploma iii 10. pt pertamina (persero) - pt pertamina patra niaga - pt pertamina retail posisi : business unit head sales area iv (jateng dan jatimbalinus area) jurusan : hukum bisnis, ilmu manajemen, teknik mesin/otomotif jenjang : diploma iii 11. pt pertamina (persero) - pt pertamina patra niaga - pt pertamina retail posisi : business unit head sales area v (kalimantan, sulawesi, papua area) jurusan : hukum bisnis, ilmu manajemen, teknik mesin/otomotif jenjang : diploma iii 12. pt pertamina (persero) - pt pertamina patra niaga - pt pertamina retail posisi : junior auditor operation function jurusan : akuntansi, manajemen keuangan jenjang : sarjana s1 / diploma iv 13. pt pertamina (persero) - pt pertamina patra niaga - pt pertamina retail posisi : staff fuel retail account receivable jurusan : akuntansi jenjang : sarjana s1 / diploma iv (tribunnews.com/mikael dafit adi prasetyo)
