Title;Content;Date;URL;Cleaned Article
Apa Itu IHSG: Pengertian, Fungsi, dan Cara Menghitungnya;JAKARTA, KOMPAS.com - IHSG adalah salah satu acuan bagi para investor saham di pasar modal. Bagi Anda yang ingin terjun di dunia investasi saham atau reksadana, penting untuk memahami apa itu IHSG.  IHSG adalah singkatan dari Indeks Harga Saham Gabungan. Dalam arti lebih luas, IHSG adalah indeks yang mengukur kinerja harga semua saham yang tercatat di Bursa Efek Indonesia (BEI). Nama lain dari IHSG adalah Indonesia Composite Index (ICI), dan kini lebih sering disebut dengan IDX Composite. IHSG adalah indikator pergerakan saham yang tercatat di bursa dengan menggunakan semua emiten yang tercatat sebagai komponen perhitungan indeks. Dikutip dari laman idx.co.id, IHSG adalah indeks yang mengukur kinerja harga semua saham yang tercatat di Papan Utama dan Papan Pengembangan Bursa Efek Indonesia (BEI).   IHSG dihitung dengan menggunakan rata-rata berimbang berdasarkan jumlah saham di bursa atau Market Value Weighted Average Index. Data ini dihitung setiap hari bursa yaitu Senin sampai dengan Jumat pukul 09.00-16.00 WIB, sehingga menghasilkan data secara update. Dengan kata lain, IHSG adalah grafik pergerakan rata-rata saham di BEI. IHSG biasanya digunakan sebagai gambaran untuk melihat kenaikan atau penurunan pasar investasi secara global, dalam hal ini pasar saham di Indonesia. Dikutip dari laman sikapiuangmu.ojk.go.id, salah satu fungsi IHSG adalah digunakan untuk mengukur kinerja portofolio. Portofolio saham merupakan kumpulan aset investasi saham yang dimiliki perorangan atau perusahaan. Misalnya, seseorang investor memiliki saham dari perusahaan A, B, dan C. Nah, kumpulan saham ini disebut sebagai portofolio. Dengan melihat kinerja IHSG, investor dapat membuat estimasi keuntungan dari portofolio saham yang dimilikinya. Selain itu, fungsi lain dari IHSG adalah sebagai indikator pergerakan pasar modal. Apabila tren IHSG sedang meningkat, maka bisa dipastikan harga saham dalam pasar modal juga turut meningkat. Sebaliknya, jika indeks harga sedang lemah, maka harga saham juga ikut menurun. Namun, perlu diingat bahwa nilai ini adalah nilai rata-rata. Bisa saja ada saham yang harganya berbeda jauh dari IHSG. Selanjutnya, fungsi IHSG adalah untuk melihat perkembangan kondisi ekonomi suatu negara seperti aliran modal, pertumbuhan ekonomi, dan penerimaan pajak negara. IHSG berperan besar karena semakin tinggi investasi yang ada dalam negara, maka aliran modal juga akan semakin besar. Fungsi berikutnya dari IHSG adalah sebagai acuan bagi investor dalam melakukan pembelian saham. Harga saham gabungan mempresentasikan bagaimana kondisi pasar modal sendiri. Dengan IHSG, investor dapat membuat keputusan untuk membeli atau menjual sahamnya. Freepik IHSG adalah indeks yang mengukur kinerja harga semua saham yang tercatat di Bursa Efek Indonesia. Dikutip dari pemberitaan Kompas.com sebelumnya, IHSG adalah mencakup pergerakan harga seluruh saham biasa dan saham preferen yang tercatat di BEI. Hari Dasar untuk perhitungan IHSG adalah tanggal 10 Agustus 1982. ;09-10-2022;https://money.kompas.com/read/2022/10/09/212457226/apa-itu-ihsg-pengertian-fungsi-dan-cara-menghitungnya?page=all;jakarta,ihsg adalah salah satu acuan bagi para investor saham di pasar modal. bagi anda yang ingin terjun di dunia investasi saham atau reksadana, penting untuk memahami apa itu ihsg. ihsg adalah singkatan dari indeks harga saham gabungan. dalam arti lebih luas, ihsg adalah indeks yang mengukur kinerja harga semua saham yang tercatat di bursa efek indonesia (bei). nama lain dari ihsg adalah indonesia composite index (ici), dan kini lebih sering disebut dengan idx composite. ihsg adalah indikator pergerakan saham yang tercatat di bursa dengan menggunakan semua emiten yang tercatat sebagai komponen perhitungan indeks. dikutip dari laman idx.co.id, ihsg adalah indeks yang mengukur kinerja harga semua saham yang tercatat di papan utama dan papan pengembangan bursa efek indonesia (bei). ihsg dihitung dengan menggunakan rata-rata berimbang berdasarkan jumlah saham di bursa atau market value weighted average index. data ini dihitung setiap hari bursa yaitu senin sampai dengan jumat pukul 09.00-16.00 wib, sehingga menghasilkan data secara update. dengan kata lain, ihsg adalah grafik pergerakan rata-rata saham di bei. ihsg biasanya digunakan sebagai gambaran untuk melihat kenaikan atau penurunan pasar investasi secara global, dalam hal ini pasar saham di indonesia. dikutip dari laman sikapiuangmu.ojk.go.id, salah satu fungsi ihsg adalah digunakan untuk mengukur kinerja portofolio. portofolio saham merupakan kumpulan aset investasi saham yang dimiliki perorangan atau perusahaan. misalnya, seseorang investor memiliki saham dari perusahaan a, b, dan c. nah, kumpulan saham ini disebut sebagai portofolio. dengan melihat kinerja ihsg, investor dapat membuat estimasi keuntungan dari portofolio saham yang dimilikinya. selain itu, fungsi lain dari ihsg adalah sebagai indikator pergerakan pasar modal. apabila tren ihsg sedang meningkat, maka bisa dipastikan harga saham dalam pasar modal juga turut meningkat. sebaliknya, jika indeks harga sedang lemah, maka harga saham juga ikut menurun. namun, perlu diingat bahwa nilai ini adalah nilai rata-rata. bisa saja ada saham yang harganya berbeda jauh dari ihsg. selanjutnya, fungsi ihsg adalah untuk melihat perkembangan kondisi ekonomi suatu negara seperti aliran modal, pertumbuhan ekonomi, dan penerimaan pajak negara. ihsg berperan besar karena semakin tinggi investasi yang ada dalam negara, maka aliran modal juga akan semakin besar. fungsi berikutnya dari ihsg adalah sebagai acuan bagi investor dalam melakukan pembelian saham. harga saham gabungan mempresentasikan bagaimana kondisi pasar modal sendiri. dengan ihsg, investor dapat membuat keputusan untuk membeli atau menjual sahamnya. freepik ihsg adalah indeks yang mengukur kinerja harga semua saham yang tercatat di bursa efek indonesia. dikutip dari pemberitaan kompas.com sebelumnya, ihsg adalah mencakup pergerakan harga seluruh saham biasa dan saham preferen yang tercatat di bei. hari dasar untuk perhitungan ihsg adalah tanggal 10 agustus 1982. 
Jokowi Pimpin Upacara HUT ke-77 TNI di Istana Merdeka Pagi ini;"JAKARTA, KOMPAS.com - Presiden Joko Widodo akan menjadi inspektur upacara pada peringatan HUT ke-77 Tentara Nasional Indonesia (TNI) yang digelar di halaman Istana Merdeka, Rabu (5/10/2022) pagi ini. Upacara akan digelar sekitar pukul 07.30 WIB.  Dalam keterangannya pada 30 September lalu, Kepala Staf Umum (Kasum) Tentara Nasional Indonesia (TNI) Letjen Eko Margiyono mengatakan, peringatan HUT ke-77 TNI akan digelar dengan sejumlah acara.  ""Rangkaian kegiatannya adalah upacara sperti biasa, di mana inspektur upacaranya direncanakan Bapak Presiden RI,"" kata Eko. Eko melanjutkan, seusai upacara Presiden Joko Widodo akan menyaksikan demo sejumlah atraksi pesawat tempur TNI Angkatan Udara (AU).  Nantinya akan ada flypass pesawat tempur F16 yang melintasi Istana.  Kemudian, ada pula aksi helikopter yang membawa giant flag dan dilanjutkan atraksi akrobatik dari Jupiter. Jupiter merupakan pasukan akrobatik TNI AU.  Setelah rangkaian atraksi di udara tersebut, lanjut Eko, Presiden Jokowi akan melakukan video conference untuk menyapa para prajurit TNI yang bertugas di perbatasan.  ""Presiden akan melakukan video conference dengan prajurit yang bertugas di empat tempat. Yang pertama di perbatasan RI Kalimantan di Pos Lintas Batas Negara (PLBN) Entikong, kemudian di Pam (pengamanan) terluar di Sangihe-Talaud,"" jelas Eko.  ""Kemudian, yang ketiga di perbatasan RI-Papua Nugini di sektor selatan. Khususnya di Merauke. Yakni di PLBN Sota. Dan yang terakhir di luar perbatasan antara RI dengan Timor Leste yang ada di PLBN Mota Ain,"" lanjutnya.  Setelah selesai melakukan video conference, Presiden Jokowi akan keluar menuju ke depan Istana, yakni ke tepi Jalan Merdeka Utara.  Di sana presiden akan melihat beberapa kendaraan tempur (ranpur) yang terbaru yang dimiliki kesatuan TNI yang akan ditampilkan secara statis.   ""Setelah beliau melihat display dari alutsista (alat utama sistem senjata) tersebut, kemudian Presiden menuju ke panggung. Beliau akan menerima defile pasukan dan alutsista. Di mana nanti di pasukan ada drum band, kemudian setelah itu pasukan yang ikut upacara dan defile ranpur. Sebanyak 63 ranpur,"" papar Eko.  Eko menuturkan, defile ranpur akan bergerak dari depan Istana menuju Bundaran Hotel Indonesia (HI).   Nantinya defile akan berhenti di Bundaran HI untuk memberikan kesempatan kepada masyarakat menyaksikan alutsista terbaru yang dimiliki TNI.  ""Ini adalah salah satu bentuk pertanggungjawaban kami kepada rakyat Indonesia. Karena alutsista ini semua dibeli juga dari rakyat Indonesia melalui pajak,"" tegasnya.   Eko menuturkan, rangkaian kegiatan upacara di Istana Merdeka ini merupakan peringatan yang dilakukan secara terpusat.   Untuk peringatan di daerah, akan dilakukan upacara secara mandiri. ";05-10-2022;https://nasional.kompas.com/read/2022/10/05/05153781/jokowi-pimpin-upacara-hut-ke-77-tni-di-istana-merdeka-pagi-ini;"jakarta,presiden joko widodo akan menjadi inspektur upacara pada peringatan hut ke-77 tentara nasional indonesia (tni) yang digelar di halaman istana merdeka, rabu (5/10/2022) pagi ini. upacara akan digelar sekitar pukul 07.30 wib. dalam keterangannya pada 30 september lalu, kepala staf umum (kasum) tentara nasional indonesia (tni) letjen eko margiyono mengatakan, peringatan hut ke-77 tni akan digelar dengan sejumlah acara. ""rangkaian kegiatannya adalah upacara sperti biasa, di mana inspektur upacaranya direncanakan bapak presiden ri,"" kata eko. eko melanjutkan, seusai upacara presiden joko widodo akan menyaksikan demo sejumlah atraksi pesawat tempur tni angkatan udara (au). nantinya akan ada flypass pesawat tempur f16 yang melintasi istana. kemudian, ada pula aksi helikopter yang membawa giant flag dan dilanjutkan atraksi akrobatik dari jupiter. jupiter merupakan pasukan akrobatik tni au. setelah rangkaian atraksi di udara tersebut, lanjut eko, presiden jokowi akan melakukan video conference untuk menyapa para prajurit tni yang bertugas di perbatasan. ""presiden akan melakukan video conference dengan prajurit yang bertugas di empat tempat. yang pertama di perbatasan ri kalimantan di pos lintas batas negara (plbn) entikong, kemudian di pam (pengamanan) terluar di sangihe-talaud,"" jelas eko. ""kemudian, yang ketiga di perbatasan ri-papua nugini di sektor selatan. khususnya di merauke. yakni di plbn sota. dan yang terakhir di luar perbatasan antara ri dengan timor leste yang ada di plbn mota ain,"" lanjutnya. setelah selesai melakukan video conference, presiden jokowi akan keluar menuju ke depan istana, yakni ke tepi jalan merdeka utara. di sana presiden akan melihat beberapa kendaraan tempur (ranpur) yang terbaru yang dimiliki kesatuan tni yang akan ditampilkan secara statis. ""setelah beliau melihat display dari alutsista (alat utama sistem senjata) tersebut, kemudian presiden menuju ke panggung. beliau akan menerima defile pasukan dan alutsista. di mana nanti di pasukan ada drum band, kemudian setelah itu pasukan yang ikut upacara dan defile ranpur. sebanyak 63 ranpur,"" papar eko. eko menuturkan, defile ranpur akan bergerak dari depan istana menuju bundaran hotel indonesia (hi). nantinya defile akan berhenti di bundaran hi untuk memberikan kesempatan kepada masyarakat menyaksikan alutsista terbaru yang dimiliki tni. ""ini adalah salah satu bentuk pertanggungjawaban kami kepada rakyat indonesia. karena alutsista ini semua dibeli juga dari rakyat indonesia melalui pajak,"" tegasnya. eko menuturkan, rangkaian kegiatan upacara di istana merdeka ini merupakan peringatan yang dilakukan secara terpusat. untuk peringatan di daerah, akan dilakukan upacara secara mandiri. "
Disorot New York Times, Berapa Anggaran Jumbo Polri dari APBN?;KOMPAS.com - Tragedi di Stadion Kanjuruhan, Malang, yang menewaskan setidaknya 131 orang pada Sabtu (1/10/2022) lalu menjadi sorotan dunia. Ini adalah salah satu peristiwa paling berdarah dalam sejarah sepakbola dunia. Tak sedikit pula yang menganggap Tragedi Kanjuruhan adalah Tragedi Kemanusiaan. Salah satu media bergengsi dunia, The New York Times, sampai membuat laporan khusus yang menyorot peran polisi yang menembakkan gas air mata sehingga menimbulkan kepanikan massa.  Dalam laporan berjudul Deadly Soccer Clash in Indonesia Puts Police Tactics, and Impunity, in Spotlight itu disebutkan pula bagaimana polisi Indonesia kerap melampaui batas dalam menghadapi kerusuhan dan selalu saja kebal hukum. Ironisnya, menurut New York Times, semua itu terjadi ketika anggaran Polri terus naik. Sejak satu dekade terakhir, uang pajak rakyat untuk membiayai operasional Polri memang cenderung mengalami peningkatan pesat. “Selama bertahun-tahun, puluhan ribu orang Indonesia telah menghadapi kekuatan polisi yang korup menurut banyak orang, menggunakan kekuatan brutal untuk menghalau massa, dan tidak akuntabel kepada siapa pun,” demikian tulis New York Times. Dikutip dari RUU APBN dan Nota Keuangan APBN, Polri sejauh ini masuk dalam 3 institusi kementerian/lembaga (K/L) dengan alokasi dana APBN terbesar yang diusulkan di tahun 2023. Tiga kementerian ini tercatat mendapatkan alokasi di atas Rp 100 triliun. Anggaran untuk institusi Polri tahun depan adalah sebesar Rp 107,7 triliun. Besaran anggaran untuk kepolisian ini berada di urutan ketiga, di bawah Kementerian Pertahanan yang mendapat alokasi sebesar Rp 131,9 triliun dan Kementerian PUPR sebesar Rp 125 triliun. Dibandingkan anggaran Kementerian Pertahanan, alokasi uang pajak rakyat untuk Polri memang lebih kecil. Namun, anggaran Kemenhan tersebut terbagi untuk 3 matra yakni TNI AD, TNI AU, dan TNI AL. Selain untuk 3 angkatan, anggaran itu juga termasuk untuk membiayai belanja dan operasional Kementerian Pertahanan dan Mabes TNI. Meski memiliki anggaran terbesar ketiga dalam APBN tahun depan, anggaran Polri turun tipis dibandingkan di APBN 2022, di mana anggaran Korps Bhayangkara ini tercatat sebesar Rp 108,4 triliun. Selain tragedi di Kanjuruhan Malang, profesionalisme institusi Polri memang tengah jadi sorotan publik. Ini setelah munculnya kasus kematian Brigadir J yang dianggap janggal di rumah Irjen Ferdi Sambo. Awalnya, kematian Brigadir dilaporkan akibat terjadi baku tembak dengan Brigadir E, tetapi belakangan mulai terkuak kemungkinan kematian Brigadir J karena pembunuhan berencana. Banyak pejabat kepolisian yang terseret pusaran kasus kematian Brigadir J. Irjen Ferdi Sambo pun dinonaktifkan dan menjadi tersangka. Berikut ini anggaran APBN untuk Polri dalam 5 tahun terakhir: Menurut pemerintah, anggaran sebesar itu akan dialokasikan untuk memperkuat stabilitas Polhukam dalam mendorong pemulihan ekonomi, memodernisasi alat material khusus Polri dan untuk profesionalisme SDM. ;06-10-2022;https://money.kompas.com/read/2022/10/06/094303126/disorot-new-york-times-berapa-anggaran-jumbo-polri-dari-apbn?page=all;tragedi di stadion kanjuruhan, malang, yang menewaskan setidaknya 131 orang pada sabtu (1/10/2022) lalu menjadi sorotan dunia. ini adalah salah satu peristiwa paling berdarah dalam sejarah sepakbola dunia. tak sedikit pula yang menganggap tragedi kanjuruhan adalah tragedi kemanusiaan. salah satu media bergengsi dunia, the new york times, sampai membuat laporan khusus yang menyorot peran polisi yang menembakkan gas air mata sehingga menimbulkan kepanikan massa. dalam laporan berjudul deadly soccer clash in indonesia puts police tactics, and impunity, in spotlight itu disebutkan pula bagaimana polisi indonesia kerap melampaui batas dalam menghadapi kerusuhan dan selalu saja kebal hukum. ironisnya, menurut new york times, semua itu terjadi ketika anggaran polri terus naik. sejak satu dekade terakhir, uang pajak rakyat untuk membiayai operasional polri memang cenderung mengalami peningkatan pesat. “selama bertahun-tahun, puluhan ribu orang indonesia telah menghadapi kekuatan polisi yang korup menurut banyak orang, menggunakan kekuatan brutal untuk menghalau massa, dan tidak akuntabel kepada siapa pun,” demikian tulis new york times. dikutip dari ruu apbn dan nota keuangan apbn, polri sejauh ini masuk dalam 3 institusi kementerian/lembaga (k/l) dengan alokasi dana apbn terbesar yang diusulkan di tahun 2023. tiga kementerian ini tercatat mendapatkan alokasi di atas rp 100 triliun. anggaran untuk institusi polri tahun depan adalah sebesar rp 107,7 triliun. besaran anggaran untuk kepolisian ini berada di urutan ketiga, di bawah kementerian pertahanan yang mendapat alokasi sebesar rp 131,9 triliun dan kementerian pupr sebesar rp 125 triliun. dibandingkan anggaran kementerian pertahanan, alokasi uang pajak rakyat untuk polri memang lebih kecil. namun, anggaran kemenhan tersebut terbagi untuk 3 matra yakni tni ad, tni au, dan tni al. selain untuk 3 angkatan, anggaran itu juga termasuk untuk membiayai belanja dan operasional kementerian pertahanan dan mabes tni. meski memiliki anggaran terbesar ketiga dalam apbn tahun depan, anggaran polri turun tipis dibandingkan di apbn 2022, di mana anggaran korps bhayangkara ini tercatat sebesar rp 108,4 triliun. selain tragedi di kanjuruhan malang, profesionalisme institusi polri memang tengah jadi sorotan publik. ini setelah munculnya kasus kematian brigadir j yang dianggap janggal di rumah irjen ferdi sambo. awalnya, kematian brigadir dilaporkan akibat terjadi baku tembak dengan brigadir e, tetapi belakangan mulai terkuak kemungkinan kematian brigadir j karena pembunuhan berencana. banyak pejabat kepolisian yang terseret pusaran kasus kematian brigadir j. irjen ferdi sambo pun dinonaktifkan dan menjadi tersangka. berikut ini anggaran apbn untuk polri dalam 5 tahun terakhir: menurut pemerintah, anggaran sebesar itu akan dialokasikan untuk memperkuat stabilitas polhukam dalam mendorong pemulihan ekonomi, memodernisasi alat material khusus polri dan untuk profesionalisme sdm. 
Ekosistem Pertanian Centrigo Dukung Kebutuhan Petani dari Hulu hingga Hilir;"JAKARTA, KOMPAS.com - Perusahaan pertanian Syngenta merilis ekosistem pertanien Centrigo, yang memenuhi kebutuhan petani dari hulu hingga hilir, sehingga mampu meningkatkan produktivitas dan profitabilitas petani di Indonesia dalam rangka memperkuat ketahanan pangan nasional. Ekosistem Centrigo dihadirkan untuk mengatasi aneka hambatan petani, terutama karena petani sering kurang terlayani dan tidak memiliki akses terhadap teknologi yang dapat membuka potensi pertanian dan meningkatkan nilai produk pertanian. Hal ini berdasarkan Statistik Pendapatan dari BPS per Februari 2022. Pilot project ekosistem Centrigo yakni di Lembang, sebagai daerah penghasil sayuran besar di Jawa Barat, pada tanggal 4 Oktober. Serta di Kediri, Jawa Timur, pada tanggal 6 Oktober 2022, yang berfokus pada tanaman jagung. Dalam ekosistem ini, selain petani diajak untuk melek teknologi, juga dihadirkan solusi perlindungan tanaman, solusi benih terbaik, serta solusi kebutuhan harian petani lainnya. ""Inilah yang ditawarkan oleh CENTRIGO™, melalui pusat kegiatannya yaitu berupa pendekatan digital, layanan, dan solusi yang terintegrasi,” kata Kazim Hasnain, Presiden Direktur PT Syngenta Indonesia melalui keterangannya, Jumat (7/10/2022). ""Untuk memberikan solusi hulu hingga hilir terbaik ke petani, ekosistem Centrigo ini didukung sejumlah partner terbaik di bidangnya,"" imbuh Andre Oliveira, Head New Farming Ecosystem, Asia Pacific. Petani pertama-tama akan menerima saran perencanaan dari tim CENTRIGO™, diikuti oleh kredit mikro dan layanan perbankan dari Bank Rakyat Indonesia (BRI). Selanjutnya, petani akan diberikan akses ke bibit sayuran dan benih jagung NK yang berkualitas tinggi, dan teknologi perlindungan tanaman terkemuka dari Syngenta. Kemudian, Yara akan memberikan pengujian tanah untuk memberikan saran nutrisi dan solusi pupuk yang akan disesuaikan dengan kebutuhan petani. Terakhir, Sayurbox dan JIVA akan bertindak sebagai offtake masing-masing untuk sayuran dan jagung. ""Ini baru permulaan, dan kami akan memperluas kerjasama dengan mitra lain untuk memberikan penawaran lebih untuk mendukung kebutuhan petani,"" lanjutAndre. ""Dilengkapi dengan jaringan pengetahuan dan layanan, kami yakin bahwa petani CENTRIGO™ akan menjadi wirausahawan yang terdepan dalam memodernisasi pertanian,"" pungkas Kazim. ";07-10-2022;https://money.kompas.com/read/2022/10/07/213745426/ekosistem-pertanian-centrigo-dukung-kebutuhan-petani-dari-hulu-hingga-hilir;"jakarta,perusahaan pertanian syngenta merilis ekosistem pertanien centrigo, yang memenuhi kebutuhan petani dari hulu hingga hilir, sehingga mampu meningkatkan produktivitas dan profitabilitas petani di indonesia dalam rangka memperkuat ketahanan pangan nasional. ekosistem centrigo dihadirkan untuk mengatasi aneka hambatan petani, terutama karena petani sering kurang terlayani dan tidak memiliki akses terhadap teknologi yang dapat membuka potensi pertanian dan meningkatkan nilai produk pertanian. hal ini berdasarkan statistik pendapatan dari bps per februari 2022. pilot project ekosistem centrigo yakni di lembang, sebagai daerah penghasil sayuran besar di jawa barat, pada tanggal 4 oktober. serta di kediri, jawa timur, pada tanggal 6 oktober 2022, yang berfokus pada tanaman jagung. dalam ekosistem ini, selain petani diajak untuk melek teknologi, juga dihadirkan solusi perlindungan tanaman, solusi benih terbaik, serta solusi kebutuhan harian petani lainnya. ""inilah yang ditawarkan oleh centrigo™, melalui pusat kegiatannya yaitu berupa pendekatan digital, layanan, dan solusi yang terintegrasi,” kata kazim hasnain, presiden direktur pt syngenta indonesia melalui keterangannya, jumat (7/10/2022). ""untuk memberikan solusi hulu hingga hilir terbaik ke petani, ekosistem centrigo ini didukung sejumlah partner terbaik di bidangnya,"" imbuh andre oliveira, head new farming ecosystem, asia pacific. petani pertama-tama akan menerima saran perencanaan dari tim centrigo™, diikuti oleh kredit mikro dan layanan perbankan dari bank rakyat indonesia (bri). selanjutnya, petani akan diberikan akses ke bibit sayuran dan benih jagung nk yang berkualitas tinggi, dan teknologi perlindungan tanaman terkemuka dari syngenta. kemudian, yara akan memberikan pengujian tanah untuk memberikan saran nutrisi dan solusi pupuk yang akan disesuaikan dengan kebutuhan petani. terakhir, sayurbox dan jiva akan bertindak sebagai offtake masing-masing untuk sayuran dan jagung. ""ini baru permulaan, dan kami akan memperluas kerjasama dengan mitra lain untuk memberikan penawaran lebih untuk mendukung kebutuhan petani,"" lanjutandre. ""dilengkapi dengan jaringan pengetahuan dan layanan, kami yakin bahwa petani centrigo™ akan menjadi wirausahawan yang terdepan dalam memodernisasi pertanian,"" pungkas kazim. "
