Title;Content;Date;URL;Cleaned Article
             Volatilitas Masih Tinggi, Saham Teknologi Berjatuhan Lagi            ;Jakarta, CNBC Indonesia - Saham emiten teknologi terpantau berjatuhan pada perdagangan sesi II Rabu (12/4/2023), di mana volatilitas saham teknologi masih cukup tinggi hingga hari ini. Per pukul 14:39 WIB, kesembilan saham teknologi kompak terkoreksi pada sesi II hari ini.   Berikut pergerakan saham emiten tambang emas pada perdagangan sesi I hari ini. Sumber: RTI Saham teknologi e-commerce dan ojek online (ojol) yakni PT GoTo Gojek Tokopedia Tbk (GOTO) memimpin koreksi saham teknologi pada sesi II hari ini, yakni ambruk 6,06% ke posisi harga Rp 93/saham. Berikutnya ada saham PT Digital Mediatama Maxima Tbk (DMMX) yang ambles 3,5% ke Rp 690/saham. Dari sektoral, yakni sektor teknologi, pada sesi II hari ini menjadi yang paling parah koreksinya yakni mencapai 1,8% dan beberapa saham turut membebani Indeks Harga Saham Gabungan (IHSG). Sektor teknologi yang masih cenderung lesu karena sentimen global yang belum menentu, di tambah prospek suku bunga bank sentral utama yang juga masih belum pasti membuat kinerja saham teknologi pun tertahan. Meski begitu, sejatinya sepanjang tahun ini sudah lebih baik, ketimbang pada tahun lalu yang merana karena agresifnya bank sentral utama, terutama bank sentral Amerika Serikat (AS), Federal Reserve (The Fed). Namun, prediksi sikap The Fed yang bakal melunak tentunya menjadi sentimen positif bagi saham-saham teknologi, karena dengan melunaknya The Fed dan bahkan bank sentral utama lainnya, maka perusahaan dapat memulihkan kinerjanya dan tentunya dapat berekspansi dengan leluasa. Meski begitu, prediksi sikap The Fed hingga hari ini masih berubah-ubah. Terakhir, Ekspektasi pasar kini menunjukkan 72% pelaku pasar memperkirakan The Fed akan menaikkan suku bunga acuan sebesar 25 bps pada Mei mendatang. Bandingkan dengan pekan lalu di mana angkanya hanya 43%. Ekspektasi pasar akan berubah jika data inflasi AS tidak sesuai keinginan pasar.   AS akan mengumumkan data inflasi Maret pada Rabu pukul 19:00 WIB. Inflasi AS melandai ke 6% (year-on-year/yoy) pada Februari 2023, dari 6,4% (yoy) pada Januari lalu. Pasar berekspektasi inflasi AS akan melandai ke 5,2-5,4% pada Maret. Inflasi adalah salah satu pertimbangan utama The Fed dalam menentukan suku bunga pada Mei mendatang. Jika inflasi masih membandel, bukan tidak mungkin The Fed akan tetap hawkish dan jika demikian, maka sektor teknologi belum akan pulih dalam waktu dekat. CNBC INDONESIA RESEARCH [email protected] Sanggahan: Artikel ini adalah produk jurnalistik berupa pandangan CNBC Indonesia Research. Analisis ini tidak bertujuan mengajak pembaca untuk membeli, menahan, atau menjual produk atau sektor investasi terkait. Keputusan sepenuhnya ada pada diri pembaca, sehingga kami tidak bertanggung jawab terhadap segala kerugian maupun keuntungan yang timbul dari keputusan tersebut.;12-04-2023;https://www.cnbcindonesia.com/market/20230412144951-17-429328/volatilitas-masih-tinggi-saham-teknologi-berjatuhan-lagi;saham emiten teknologi terpantau berjatuhan pada perdagangan sesi ii rabu (12/4/2023), di mana volatilitas saham teknologi masih cukup tinggi hingga hari ini. per pukul 14:39 wib, kesembilan saham teknologi kompak terkoreksi pada sesi ii hari ini. berikut pergerakan saham emiten tambang emas pada perdagangan sesi i hari ini. sumber: rti saham teknologi e-commerce dan ojek online (ojol) yakni pt goto gojek tokopedia tbk (goto) memimpin koreksi saham teknologi pada sesi ii hari ini, yakni ambruk 6,06% ke posisi harga rp 93/saham. berikutnya ada saham pt digital mediatama maxima tbk (dmmx) yang ambles 3,5% ke rp 690/saham. dari sektoral, yakni sektor teknologi, pada sesi ii hari ini menjadi yang paling parah koreksinya yakni mencapai 1,8% dan beberapa saham turut membebani indeks harga saham gabungan (ihsg). sektor teknologi yang masih cenderung lesu karena sentimen global yang belum menentu, di tambah prospek suku bunga bank sentral utama yang juga masih belum pasti membuat kinerja saham teknologi pun tertahan. meski begitu, sejatinya sepanjang tahun ini sudah lebih baik, ketimbang pada tahun lalu yang merana karena agresifnya bank sentral utama, terutama bank sentral amerika serikat (as), federal reserve (the fed). namun, prediksi sikap the fed yang bakal melunak tentunya menjadi sentimen positif bagi saham-saham teknologi, karena dengan melunaknya the fed dan bahkan bank sentral utama lainnya, maka perusahaan dapat memulihkan kinerjanya dan tentunya dapat berekspansi dengan leluasa. meski begitu, prediksi sikap the fed hingga hari ini masih berubah-ubah. terakhir, ekspektasi pasar kini menunjukkan 72% pelaku pasar memperkirakan the fed akan menaikkan suku bunga acuan sebesar 25 bps pada mei mendatang. bandingkan dengan pekan lalu di mana angkanya hanya 43%. ekspektasi pasar akan berubah jika data inflasi as tidak sesuai keinginan pasar. as akan mengumumkan data inflasi maret pada rabu pukul 19:00 wib. inflasi as melandai ke 6% (year-on-year/yoy) pada februari 2023, dari 6,4% (yoy) pada januari lalu. pasar berekspektasi inflasi as akan melandai ke 5,2-5,4% pada maret. inflasi adalah salah satu pertimbangan utama the fed dalam menentukan suku bunga pada mei mendatang. jika inflasi masih membandel, bukan tidak mungkin the fed akan tetap hawkish dan jika demikian, maka sektor teknologi belum akan pulih dalam waktu dekat. cnbc indonesia research [email protected] sanggahan: artikel ini adalah produk jurnalistik berupa pandangan 
             Tak Perlu Pesugihan! 10 Saham Ini Bikin Kaya 4 Kali Lipat            ;Jakarta, CNBC Indonesia - Indeks Harga Saham Gabungan (IHSG) melemah tipis 0,18% ke 6.792,76 sepanjang pekan ini. Pergerakan IHSG cenderung searah dengan bursa saham AS (Wall Street) yang juga melemah. Pelaku pasar menanti rilis data tenaga kerja AS versi pemerintah yang dirilis Jumat kemarin. Meski IHSG melemah, beberapa saham mencatat kenaikan yang cukup tajam. Berdasarkan data IDX, PT MD Picture Tbk. (FILM) menjadi emiten yang penguatannya paling tajam pekan ini. FILM menutup perdagangan Kamis sebelum libur Jumat kemarin di Rp 1.635/saham, melesat lebih dari 60%. FILM yang membukukan kinerja apik pada 2022 memicu kenaikan harga saham tersebut. Mengutip laporan keuangan MD Pictures, penujualan pada 2022 tercatat sebesar Rp 436,85 miliar, melesat lebih dari 71% dari periode sama tahun sebelumnya. Laba bersih melesat hingga 375% menjadi nyaris Rp 160 miliar. Kinerja impresif tersebut membuat saham FILM menduduki peringkat pertama top gainers pekan ini. Di urutan kedua ada PT Krida Jaringan Nusantara (KJEN) yang sahamnya melesat lebih dari 52%. KJEN mengakhiri perdagangan pekan ini di Rp 183/saham, dari pekan sebelumnya Rp 120/saham. PT Pudjiadi Prestige Tbk. (PUPD) mencatat kenaikan sebesar 48%. Berikut top gainers di pekan ini.    Total kenaikan ke-10 saham tersebut lebih dari 400%, sehingga jika membelinya pada akhir pekan lalu, dan menjualnya di harga penutupan pekan ini, nilai investasi tentunya akan melesat empat kali lipat.   Di sisi lain, ada 10 saham yang mencatat kinerja buruk. PT Lavender Bina Cendika Tbk. (BMBL) menjadi yang terburuk setelah merosot lebih dari 26%. Melengkapi 3 besar top losers ada PT Telefast Indonesia Tbk. (TFAS) dan PT Distribusi Voucer Nusantara Tbk ( (DIVA).   ;08-04-2023;https://www.cnbcindonesia.com/market/20230408141208-17-428207/tak-perlu-pesugihan-10-saham-ini-bikin-kaya-4-kali-lipat;jakarta, cnbc indonesia - indeks harga saham gabungan (ihsg) melemah tipis 0,18% ke 6.792,76 sepanjang pekan ini. pergerakan ihsg cenderung searah dengan bursa saham as (wall street) yang juga melemah. pelaku pasar menanti rilis data tenaga kerja as versi pemerintah yang dirilis jumat kemarin. meski ihsg melemah, beberapa saham mencatat kenaikan yang cukup tajam. berdasarkan data idx, pt md picture tbk. (film) menjadi emiten yang penguatannya paling tajam pekan ini. film menutup perdagangan kamis sebelum libur jumat kemarin di rp 1.635/saham, melesat lebih dari 60%. film yang membukukan kinerja apik pada 2022 memicu kenaikan harga saham tersebut. mengutip laporan keuangan md pictures, penujualan pada 2022 tercatat sebesar rp 436,85 miliar, melesat lebih dari 71% dari periode sama tahun sebelumnya. laba bersih melesat hingga 375% menjadi nyaris rp 160 miliar. kinerja impresif tersebut membuat saham film menduduki peringkat pertama top gainers pekan ini. di urutan kedua ada pt krida jaringan nusantara (kjen) yang sahamnya melesat lebih dari 52%. kjen mengakhiri perdagangan pekan ini di rp 183/saham, dari pekan sebelumnya rp 120/saham. pt pudjiadi prestige tbk. (pupd) mencatat kenaikan sebesar 48%. berikut top gainers di pekan ini. total kenaikan ke-10 saham tersebut lebih dari 400%, sehingga jika membelinya pada akhir pekan lalu, dan menjualnya di harga penutupan pekan ini, nilai investasi tentunya akan melesat empat kali lipat. di sisi lain, ada 10 saham yang mencatat kinerja buruk. pt lavender bina cendika tbk. (bmbl) menjadi yang terburuk setelah merosot lebih dari 26%. melengkapi 3 besar top losers ada pt telefast indonesia tbk. (tfas) dan pt distribusi voucer nusantara tbk ( (diva). 
             Saham Teknologi Masih Lesu, Tapi 2 Saham Ini Malah Bergairah            ;Jakarta, CNBC Indonesia - Sektor teknologi di Indonesia masih belum bergairah sepanjang tahun ini. Namun, kinerjanya sudah lebih membaik dibandingkan dengan tahun lalu. Di Indonesia, setidaknya ada tiga emiten teknologi yang banyak digunakan oleh masyarakat. Ketiga emiten tersebut merupakan bekas dari startup teknologi RI yang berhasil melantai di bursa.  Adapun ketiga emiten tersebut yakni PT Bukalapak.com Tbk (BUKA), PT GoTo Gojek Tokopedia Tbk (GOTO), dan PT Global Digital Niaga Tbk (BELI). Selain tiga saham tersebut, ada dua saham lainnya namun belum terdaftar di Bursa Efek Indonesia (BEI), yakni Grab Holdings Ltd. (induk Grab) dan Sea Ltd. (induk Shopee). Berikut kinerja saham raksasa teknologi di Indonesia sepanjang tahun ini.  Dari di atas, kelima saham teknologi tersebut secara mayoritas lesu sepanjang tahun ini. Namun yang hebat, saham GOTO dan Sea Ltd. terpantau bergairah sepanjang tahun ini. GOTO terpantau masih melesat 3,3% sepanjang tahun ini, meski pergerakannya cenderung terlihat volatil dan tidak jarang membebani Indeks Harga Saham Gabungan (IHSG). Sedangkan saham Sea Ltd juga masih mampu melejit hingga lebih dari 57% sepanjang tahun ini, menghiraukan sentimen negatif yang turut mempengaruhi kinerjanya. Saham-saham teknologi, terutama yang tergabung di indeks IDXTechno pun masih belum bergairah sepanjang tahun ini. Adapun sektor IDXTechno sendiri masih terkoreksi hingga 5,29% sepanjang tahun ini, berdasarkan data terakhir per Selasa kemarin. Sektor teknologi yang masih cenderung lesu karena sentimen global yang belum menentu, di tambah prospek suku bunga bank sentral utama yang juga masih belum pasti membuat kinerja saham teknologi pun tertahan. Meski begitu, sejatinya sepanjang tahun ini sudah lebih baik, ketimbang pada tahun lalu yang merana karena agresifnya bank sentral utama, terutama bank sentral Amerika Serikat (AS), Federal Reserve (The Fed). Namun, prediksi sikap The Fed yang bakal melunak tentunya menjadi sentimen positif bagi saham-saham teknologi, karena dengan melunaknya The Fed dan bahkan bank sentral utama lainnya, maka perusahaan dapat memulihkan kinerjanya dan tentunya dapat berekspansi dengan leluasa. Meski begitu, prediksi sikap The Fed hingga hari ini masih berubah-ubah. Terakhir, Ekspektasi pasar kini menunjukkan 72% pelaku pasar memperkirakan The Fed akan menaikkan suku bunga acuan sebesar 25 bps pada Mei mendatang. Bandingkan dengan pekan lalu di mana angkanya hanya 43%. Ekspektasi pasar akan berubah jika data inflasi AS tidak sesuai keinginan pasar. AS akan mengumumkan data inflasi Maret pada Rabu pukul 19:00 WIB. Inflasi AS melandai ke 6% (year-on-year/yoy) pada Februari 2023, dari 6,4% (yoy) pada Januari lalu. Pasar berekspektasi inflasi AS akan melandai ke 5,2-5,4% pada Maret. Inflasi adalah salah satu pertimbangan utama The Fed dalam menentukan suku bunga pada Mei mendatang. Jika inflasi masih membandel, bukan tidak mungkin The Fed akan tetap hawkish dan jika demikian, maka sektor teknologi belum akan pulih dalam waktu dekat. CNBC INDONESIA RESEARCH;12-04-2023;https://www.cnbcindonesia.com/market/20230412142526-17-429317/saham-teknologi-masih-lesu-tapi-2-saham-ini-malah-bergairah;sektor teknologi di indonesia masih belum bergairah sepanjang tahun ini. namun, kinerjanya sudah lebih membaik dibandingkan dengan tahun lalu. di indonesia, setidaknya ada tiga emiten teknologi yang banyak digunakan oleh masyarakat. ketiga emiten tersebut merupakan bekas dari startup teknologi ri yang berhasil melantai di bursa. adapun ketiga emiten tersebut yakni pt bukalapak.com tbk (buka), pt goto gojek tokopedia tbk (goto), dan pt global digital niaga tbk (beli). selain tiga saham tersebut, ada dua saham lainnya namun belum terdaftar di bursa efek indonesia (bei), yakni grab holdings ltd. (induk grab) dan sea ltd. (induk shopee). berikut kinerja saham raksasa teknologi di indonesia sepanjang tahun ini. dari di atas, kelima saham teknologi tersebut secara mayoritas lesu sepanjang tahun ini. namun yang hebat, saham goto dan sea ltd. terpantau bergairah sepanjang tahun ini. goto terpantau masih melesat 3,3% sepanjang tahun ini, meski pergerakannya cenderung terlihat volatil dan tidak jarang membebani indeks harga saham gabungan (ihsg). sedangkan saham sea ltd juga masih mampu melejit hingga lebih dari 57% sepanjang tahun ini, menghiraukan sentimen negatif yang turut mempengaruhi kinerjanya. saham-saham teknologi, terutama yang tergabung di indeks idxtechno pun masih belum bergairah sepanjang tahun ini. adapun sektor idxtechno sendiri masih terkoreksi hingga 5,29% sepanjang tahun ini, berdasarkan data terakhir per selasa kemarin. sektor teknologi yang masih cenderung lesu karena sentimen global yang belum menentu, di tambah prospek suku bunga bank sentral utama yang juga masih belum pasti membuat kinerja saham teknologi pun tertahan. meski begitu, sejatinya sepanjang tahun ini sudah lebih baik, ketimbang pada tahun lalu yang merana karena agresifnya bank sentral utama, terutama bank sentral amerika serikat (as), federal reserve (the fed). namun, prediksi sikap the fed yang bakal melunak tentunya menjadi sentimen positif bagi saham-saham teknologi, karena dengan melunaknya the fed dan bahkan bank sentral utama lainnya, maka perusahaan dapat memulihkan kinerjanya dan tentunya dapat berekspansi dengan leluasa. meski begitu, prediksi sikap the fed hingga hari ini masih berubah-ubah. terakhir, ekspektasi pasar kini menunjukkan 72% pelaku pasar memperkirakan the fed akan menaikkan suku bunga acuan sebesar 25 bps pada mei mendatang. bandingkan dengan pekan lalu di mana angkanya hanya 43%. ekspektasi pasar akan berubah jika data inflasi as tidak sesuai keinginan pasar. as akan mengumumkan data inflasi maret pada rabu pukul 19:00 wib. inflasi as melandai ke 6% (year-on-year/yoy) pada februari 2023, dari 6,4% (yoy) pada januari lalu. pasar berekspektasi inflasi as akan melandai ke 5,2-5,4% pada maret. inflasi adalah salah satu pertimbangan utama the fed dalam menentukan suku bunga pada mei mendatang. jika inflasi masih membandel, bukan tidak mungkin the fed akan tetap hawkish dan jika demikian, maka sektor teknologi belum akan pulih dalam waktu dekat. cnbc indonesia research
             10 Saham Favorit Asing, Nomor 1 Punya Orang Terkaya RI            ;Jakarta, CNBC Indonesia - Pada penutupan perdagangan sesi II Senin (10/4/2023), Indeks Harga Saham Gabungan (IHSG) kembali ditutup melemah. IHSG terkoreksi 0,32% menjadi 6.771,23 secara harian. Ada sebanyak 369 saham yang melemah, 182 saham stagnan dan hanya 179 saham saja yang menguat. Nilai transaksi mencapai sekitar Rp 7,5 triliun, melibatkan 18,22 miliar saham yang berpindah tangan sebanyak 1,3 juta kali. Kemarin IHSG konsisten bergerak di wilayah negatif dan sempat menyentuh level terendah di 6.735,2. Dalam lima hari perdagangan IHSG terkoreksi 0,50%. Sementara itu, secara year to date (ytd) indeks masih membukukan pelemahan sebesar 1,16%. Mengutip RTI Business, investor asing melakukan penjualan bersih di seluruh pasar sebesar Rp195,24 miliar, di pasar reguler sebesar Rp255,46 miliar. Sementara pembelian bersih saham oleh investor asing sebesar Rp60,22 miliar. Lantas, apa saja saham yang dibeli asing yang menadahi IHSG? Mengutip RTI Business pada Selasa (11/4/2023), berikut net foreign buy pada Senin (10/4/2023). 1. PT Bank Central Asia Tbk. (BBCA) - Rp66,6 miliar 2. PT Bank Rakyat Indonesia Tbk. (BBRI) - Rp53,6 miliar 3. PT Bank Negara Indonesai Tbk. (BBNI) - Rp16,7 miliar 4. PT Bank Tabungan Negara Tbk. (BBTN) - Rp13,2 miliar 5. PT Charoen Pokphand Indonesia Tbk. (CPIN) - Rp11,2 miliar 6. PT Bank Amar Indonesia Tbk. (AMAR) - Rp10,4 miliar 7. PT Bukalapak.com Tbk. (BUKA) - Rp9,4 miliar 8. PT Merdeka Copper Gold Tbk. (MDKA) - Rp8,6 miliar 9. PT Sumber Alfaria Trijaya Tbk. (AMRT) - Rp8,3 miliar 10. PT Nusantara Sawit Sejahtera Tbk. (NSSS) - Rp8,1 miliar;11-04-2023;https://www.cnbcindonesia.com/market/20230411084122-17-428812/10-saham-favorit-asing-nomor-1-punya-orang-terkaya-ri;pada penutupan perdagangan sesi ii senin (10/4/2023), indeks harga saham gabungan (ihsg) kembali ditutup melemah. ihsg terkoreksi 0,32% menjadi 6.771,23 secara harian. ada sebanyak 369 saham yang melemah, 182 saham stagnan dan hanya 179 saham saja yang menguat. nilai transaksi mencapai sekitar rp 7,5 triliun, melibatkan 18,22 miliar saham yang berpindah tangan sebanyak 1,3 juta kali. kemarin ihsg konsisten bergerak di wilayah negatif dan sempat menyentuh level terendah di 6.735,2. dalam lima hari perdagangan ihsg terkoreksi 0,50%. sementara itu, secara year to date (ytd) indeks masih membukukan pelemahan sebesar 1,16%. mengutip rti business, investor asing melakukan penjualan bersih di seluruh pasar sebesar rp195,24 miliar, di pasar reguler sebesar rp255,46 miliar. sementara pembelian bersih saham oleh investor asing sebesar rp60,22 miliar. lantas, apa saja saham yang dibeli asing yang menadahi ihsg? mengutip rti business pada selasa (11/4/2023), berikut net foreign buy pada senin (10/4/2023). 1. pt bank central asia tbk. (bbca) - rp66,6 miliar 2. pt bank rakyat indonesia tbk. (bbri) - rp53,6 miliar 3. pt bank negara indonesai tbk. (bbni) - rp16,7 miliar 4. pt bank tabungan negara tbk. (bbtn) - rp13,2 miliar 5. pt charoen pokphand indonesia tbk. (cpin) - rp11,2 miliar 6. pt bank amar indonesia tbk. (amar) - rp10,4 miliar 7. pt bukalapak.com tbk. (buka) - rp9,4 miliar 8. pt merdeka copper gold tbk. (mdka) - rp8,6 miliar 9. pt sumber alfaria trijaya tbk. (amrt) - rp8,3 miliar 10. pt nusantara sawit sejahtera tbk. (nsss) - rp8,1 miliar
             Waspada Shallow Recession, Investor Perlu Lakukan Ini!            ;"Jakarta, CNBC Indonesia - Para investor di pasar saham saat ini sangat perlu mempertimbangkan potensi kerugian dari dampak stabilitas ekonomi dunia yang sedang terancam resesi. Sebab, selama periode resesi, umumnya likuiditas pasar saham turun sebesar 10% secara rata-rata. Selain itu, estimasi laba juga mengalami revisi sebesar 5-10% secara gradual. Sementara rata-rata penurunan indeks harga saham gabungan (IHSG) berkisar 6 sd 38%. Saat ini per posisi terakhir, likuiditas IHSG menurun 57%, dan kinerja laba menurun 4% yang diikuti penurunan IHSG sebesar 7% dari level tertinggi. Syailendra Research dalam market insight memandang bahwa penurunan likuiditas dan kinerja laba ini mencerminkan adanya penurunan sentimen investor terhadap IHSG. ""Hal ini menandakan setidaknya shallow recession telah tercermin di harga pasar saat ini,"" tulis Syailendra Research dalam market insight, dikutip Kamis (2/2/2023). Menjelang periode resesi, terdapat juga downside risk yang perlu diantisipasi oleh investor terutama di pasar saham. Sebab, secara historis, tercatat bahwa downside risk beberapa kali berpengaruh negatif terhadap reaksi pasar saham IHSG.   Di antaranya seperti krisis akibat devaluasi Yuan (2014), devaluasi Yuan dan berakhirnya quantitative easing (QE) (2015), perang dagang AS dan berakhirnya QE (2018), Resesi akibat Covid-19 (2020), pemberlakuan kembali lockdown (2020). ""Hal tersebut memperlihatkan bahwa pelaku pasar merefleksikan ekspektasinya mengenai kondisi ekonomi di masa depan di pasar saham sehingga pasar saham dapat digunakan sebagai alat untuk bernavigasi pada periode resesi,"" jelas Syailendra. Dengan begitu, Syailendra mengungkapkan bahwa sulit untuk mengetahui titik terendah dari suatu resesi akibat tingginya ketidakpastian ekonomi. ""Untuk itu, dalam menunggu perkembangan pasar, Syailendra membeberkan instrumen investasi yang dapat memberikan imbal hasil yang menarik dan relatif lebih stabil, yakni Reksa Dana Pendapatan Tetap (RDPT) dan Reksa Dana Pasar Uang (RDPU),"" tulis Syailendra dikutip dari akun Instagram resmi @reksadana.syailendra.   Untuk RDPT, Syailendra Capital memiliki produk menarik bernama Syailendra Pendapatan Tetap Premium (SPTP) yang bertujuan untuk memberikan hasil investasi yang optimal melalui eksposur pada obligasi korporasi. Sedangkan di RDPU, ada Syailendra Dana Kas (SDK) yang bertujuan untuk memperoleh tingkat likuiditas yang tinggi sekaligus memberikan tingkat imbal hasil yang menarik.";13-04-2023;https://www.cnbcindonesia.com/market/20230413051506-17-429439/waspada-shallow-recession-investor-perlu-lakukan-ini;"para investor di pasar saham saat ini sangat perlu mempertimbangkan potensi kerugian dari dampak stabilitas ekonomi dunia yang sedang terancam resesi. sebab, selama periode resesi, umumnya likuiditas pasar saham turun sebesar 10% secara rata-rata. selain itu, estimasi laba juga mengalami revisi sebesar 5-10% secara gradual. sementara rata-rata penurunan indeks harga saham gabungan (ihsg) berkisar 6 sd 38%. saat ini per posisi terakhir, likuiditas ihsg menurun 57%, dan kinerja laba menurun 4% yang diikuti penurunan ihsg sebesar 7% dari level tertinggi. syailendra research dalam market insight memandang bahwa penurunan likuiditas dan kinerja laba ini mencerminkan adanya penurunan sentimen investor terhadap ihsg. ""hal ini menandakan setidaknya shallow recession telah tercermin di harga pasar saat ini,"" tulis syailendra research dalam market insight, dikutip kamis (2/2/2023). menjelang periode resesi, terdapat juga downside risk yang perlu diantisipasi oleh investor terutama di pasar saham. sebab, secara historis, tercatat bahwa downside risk beberapa kali berpengaruh negatif terhadap reaksi pasar saham ihsg. di antaranya seperti krisis akibat devaluasi yuan (2014), devaluasi yuan dan berakhirnya quantitative easing (qe) (2015), perang dagang as dan berakhirnya qe (2018), resesi akibat covid-19 (2020), pemberlakuan kembali lockdown (2020). ""hal tersebut memperlihatkan bahwa pelaku pasar merefleksikan ekspektasinya mengenai kondisi ekonomi di masa depan di pasar saham sehingga pasar saham dapat digunakan sebagai alat untuk bernavigasi pada periode resesi,"" jelas syailendra. dengan begitu, syailendra mengungkapkan bahwa sulit untuk mengetahui titik terendah dari suatu resesi akibat tingginya ketidakpastian ekonomi. ""untuk itu, dalam menunggu perkembangan pasar, syailendra membeberkan instrumen investasi yang dapat memberikan imbal hasil yang menarik dan relatif lebih stabil, yakni reksa dana pendapatan tetap (rdpt) dan reksa dana pasar uang (rdpu),"" tulis syailendra dikutip dari akun instagram resmi @reksadana.syailendra. untuk rdpt, syailendra capital memiliki produk menarik bernama syailendra pendapatan tetap premium (sptp) yang bertujuan untuk memberikan hasil investasi yang optimal melalui eksposur pada obligasi korporasi. sedangkan di rdpu, ada syailendra dana kas (sdk) yang bertujuan untuk memperoleh tingkat likuiditas yang tinggi sekaligus memberikan tingkat imbal hasil yang menarik."
