Title;Content;Date;URL;Cleaned Article
"Mengenal Proyek ""Jurassic Park"" di TN Komodo yang Jadi Polemik";"JAKARTA, KOMPAS.com - Pemandangan tak biasa terjadi di salah satu pulau di Taman Nasional Komodo, Pulau Rinca, saat seekor komodo tampak berhadap-hadapan dengan truk proyek yang akan melintas. Dalam sebuah unggahan foto yang ramai di media sosial, tampak kadal terbesar di dunia itu berada hanya jarak dalam beberapa meter dari bagian moncong truk yang membawa material proyek. Truk pengangkut material tersebut merupakan bagian dari proyek pembangunan geopark yang digadang-gadang pemerintah bakal menjadikan TN Komodo serupa dengan ""Jurassic Park"". Jurassic Park merupakan film Hollywood yang diadaptasi dari kisah fiksi yang bercerita tentang taman nasional khusus yang didedikasikan untuk penelitian dan wisata edukasi dinosaurus. Hewan purba itu dihidupkan kembali berkat kemajuan teknologi. Pulau Komodo dan Pulau Rinca sendiri sudah ditetapkan sebagai taman nasional sejak 1980 untuk melindungi satwa komodo atau Varanus komodoensis, hewan endemik purba yang hanya bisa ditemukan di NTT. Mengutip keterangan resmi Kementerian PUPR, Senin (26/10/2020), proyek di TN Komodo tersebut merupakan bagian dari Kawasan Strategis Pariwisata Nasional (KSPN) Super Prioritas Labuan Bajo, Nusa Tenggara Timur ( NTT). Salah satu kawasan yang akan mengalami perubahan desain secara signifikan adalah Pulau Rinca di Kabupaten Manggarai Barat. Pulau habitat komodo ini akan disulap besar-besaran oleh pemerintah dan investor swasta sebagai destinasi wisata premium. Pemerintah mengeklaim, proyek-proyek yang dikerjakan di TN Komodo tersebut tetap memprioritaskan aspek ekologi berkelanjutan bagi spesies komodo dan sosial bagi penduduk sekitar. ""Tujuan utama konsep ini adalah mempromosikan kesejahteraan ekonomi masyarakat yang tinggal di sekitar kawasan dengan mengembangkan potensi yang ada dengan cara yang berkelanjutan,"" kata Menteri PUPR Basuki Hadimuljono dalam keterangan resminya. Pemerintah pusat menganggarkan dana sebesar Rp 69,96 miliar untuk menata kawasan Pulau Rinca yang meliputi bangunan pusat informasi, sentra suvenir, kafe, dan toilet publik. Kementerian PUPR yang ditugaskan Presiden Jokowi juga akan membangun kantor pengelola kawasan, selfie spot, klinik, gudang, ruang terbuka publik, dan penginapan untuk peneliti. Lalu pembangunan pemandu wisata (ranger), area trekking untuk pejalan kaki dan selter pengunjung didesain melayang atau elevated agar tidak mengganggu lalu lintas komodo. Basuki mengeklaim, pembangunan infrastruktur pada setiap KSPN direncanakan secara terpadu, baik penataan kawasan, jalan, penyediaan air baku dan air bersih, pengelolaan sampah, sanitasi, serta perbaikan hunian penduduk melalui sebuah rencana induk pengembangan infrastruktur. Secara keseluruhan untuk tahun 2020, Kementerian PUPR mengalokasikan anggaran sebesar Rp 902,47 miliar untuk mengerjakan 43 paket kegiatan infrastruktur di KSPN Labuan Bajo yang meliputi peningkatan kualitas layanan jalan dan jembatan, penyediaan sumber daya air, permukiman, dan perumahan. Basuki mengatakan, upaya meningkatkan kunjungan wisatawan ke Labuan Bajo dilakukan secara bertahap, dengan pembenahan infrastruktur yang akan menjadi prioritas. ";26-10-2020;https://money.kompas.com/read/2020/10/26/082650426/mengenal-proyek-jurassic-park-di-tn-komodo-yang-jadi-polemik?page=all;"jakarta,pemandangan tak biasa terjadi di salah satu pulau di taman nasional komodo, pulau rinca, saat seekor komodo tampak berhadap-hadapan dengan truk proyek yang akan melintas. dalam sebuah unggahan foto yang ramai di media sosial, tampak kadal terbesar di dunia itu berada hanya jarak dalam beberapa meter dari bagian moncong truk yang membawa material proyek. truk pengangkut material tersebut merupakan bagian dari proyek pembangunan geopark yang digadang-gadang pemerintah bakal menjadikan tn komodo serupa dengan ""jurassic park"". jurassic park merupakan film hollywood yang diadaptasi dari kisah fiksi yang bercerita tentang taman nasional khusus yang didedikasikan untuk penelitian dan wisata edukasi dinosaurus. hewan purba itu dihidupkan kembali berkat kemajuan teknologi. pulau komodo dan pulau rinca sendiri sudah ditetapkan sebagai taman nasional sejak 1980 untuk melindungi satwa komodo atau varanus komodoensis, hewan endemik purba yang hanya bisa ditemukan di ntt. mengutip keterangan resmi kementerian pupr, senin (26/10/2020), proyek di tn komodo tersebut merupakan bagian dari kawasan strategis pariwisata nasional (kspn) super prioritas labuan bajo, nusa tenggara timur ( ntt). salah satu kawasan yang akan mengalami perubahan desain secara signifikan adalah pulau rinca di kabupaten manggarai barat. pulau habitat komodo ini akan disulap besar-besaran oleh pemerintah dan investor swasta sebagai destinasi wisata premium. pemerintah mengeklaim, proyek-proyek yang dikerjakan di tn komodo tersebut tetap memprioritaskan aspek ekologi berkelanjutan bagi spesies komodo dan sosial bagi penduduk sekitar. ""tujuan utama konsep ini adalah mempromosikan kesejahteraan ekonomi masyarakat yang tinggal di sekitar kawasan dengan mengembangkan potensi yang ada dengan cara yang berkelanjutan,"" kata menteri pupr basuki hadimuljono dalam keterangan resminya. pemerintah pusat menganggarkan dana sebesar rp 69,96 miliar untuk menata kawasan pulau rinca yang meliputi bangunan pusat informasi, sentra suvenir, kafe, dan toilet publik. kementerian pupr yang ditugaskan presiden jokowi juga akan membangun kantor pengelola kawasan, selfie spot, klinik, gudang, ruang terbuka publik, dan penginapan untuk peneliti. lalu pembangunan pemandu wisata (ranger), area trekking untuk pejalan kaki dan selter pengunjung didesain melayang atau elevated agar tidak mengganggu lalu lintas komodo. basuki mengeklaim, pembangunan infrastruktur pada setiap kspn direncanakan secara terpadu, baik penataan kawasan, jalan, penyediaan air baku dan air bersih, pengelolaan sampah, sanitasi, serta perbaikan hunian penduduk melalui sebuah rencana induk pengembangan infrastruktur. secara keseluruhan untuk tahun 2020, kementerian pupr mengalokasikan anggaran sebesar rp 902,47 miliar untuk mengerjakan 43 paket kegiatan infrastruktur di kspn labuan bajo yang meliputi peningkatan kualitas layanan jalan dan jembatan, penyediaan sumber daya air, permukiman, dan perumahan. basuki mengatakan, upaya meningkatkan kunjungan wisatawan ke labuan bajo dilakukan secara bertahap, dengan pembenahan infrastruktur yang akan menjadi prioritas. "
Cara Mengecek Penerima BLT UMKM Rp 2,4 Juta di e-Form BRI;"JAKARTA, KOMPAS.com - Pemerintah menggulirkan program Bantuan Presiden (Banpres) Produktif atau Bantuan Langsung Tunai (BLT) UMKM sebesar Rp 2,4 juta (BLT UMKM Rp 2,4 juta) lewat Kementerian Koperasi dan UKM serta Bank BRI. Hingga 28 September 2020, program ini sudah terealisasi 72,46 persen, dengan nilai total anggaran yang sudah digelontorkan mencapai Rp 15,93 triliun. Targetnya ada 9,1 juta penerima di tahun 2020. Pelaku usaha UMKM yang sudah ditetapkan sebagai penerima bantuan UMKM Rp 2,4 juta akan mendapatkan notifikasi SMS dari Bank BRI. Kabar baiknya, Banpres produktif ini masih diperpanjang hingga akhir November 2020. BLT UMKM tahap II ini bakal diperpanjang dan menyasar 3 juta UMKM. Untuk bisa mendapatkan bantuan BLT ini, pelaku usaha harus mendaftarkan secara langsung. Jika lolos, uang akan ditransfer. Untuk mengecek penerima BPUM, bisa dilakukan melalui e-form yang disediakan PT Bank Rakyat Indonesia Tbk (Persero) atau BRI. Berikut cara mengecek siapa saja penerima BLT Rp 2,4 juta di e-form BRI. Sebagai informasi, bantuan UMKM Rp 2,4 juta diluncurkan oleh Presiden Jokowi pada 24 Agustus 2020 yang lalu, BRI telah menyalurkan BPUM sebesar Rp. 10,3 triliun kepada 4,3 juta penerima. Pemerintah berencana menambah jumlah penerima bantuan ini hingga 12 juta pelaku UMKM. Untuk cara mendapatkan bantuan UMKM Rp 2,4 juta, pelaku usaha kecil ini bisa mendaftarkan dirinya ke dinas koperasi yang berada di domisilinya (bantuan 2,4 juta). Berikut syarat UMKM mendapatkan bantuan Rp 2,4 juta dari pemerintah: Syarat lainnya, seperti dikutip laman Kemenkop, bagi pelaku usaha mikro yang alamat usahanya berbeda dengan alamat domisili sebagaimana tercantum di KTP, maka dapat melampirkan Surat Keterangan Usaha (SKU). Sebelumnya, Menteri Koperasi dan UKM (Menkop UKM) Teten Masduki menyatakan untuk cara mendapatkan bantuan UMKM Rp 2,4 juta, pelaku usaha kecil ini bisa mendaftarkan dirinya ke dinas koperasi yang berada di domisilinya. ""Pemerintah terus mengevaluasi program Pemulihan Ekonomi Nasional dan Koperasi dan UMKM. Sekarang Presiden Joko Widodo mengeluarkan program baru, yakni Bantuan Sosial Presiden (Banpres) produktif untuk usaha mikro yang belum bankable, yang belum punya pinjaman dari perbankan,"" ujar Teten dikutip dari Harian Kompas. Mantan aktivis ICW ini menuturkan, skema dana bantuan pemerintah untuk pelaku usaha wong cilik ini akan lansung ditransfer ke rekening masing-masing pemilik usaha. ""Kami mengalokasikan kepada 12 juta pelaku usaha mikro. Saat ini DIPA (daftar isian penggunaan anggaran)-nya sudah disediakan, pada tahap awal untuk 9,1 juta unit usaha mikro,"" kata Teten. ""Per unit usaha mikro memperoleh Rp 2,4 juta sekali bayar, ditransfer langsung ke rekening bersangkutan yang sudah terdata by name by address. Direncanakan diluncurkan pada 17 Agustus 2020,"" kata dia lagi. Bantuan itu bukan pinjaman atau kredit, melainkan hibah. Sehingga penerima tidak akan dikenai biaya apa pun dalam proses penyalurannya. ";21-10-2020;https://money.kompas.com/read/2020/10/21/100114126/cara-mengecek-penerima-blt-umkm-rp-24-juta-di-e-form-bri;"jakarta,pemerintah menggulirkan program bantuan presiden (banpres) produktif atau bantuan langsung tunai (blt) umkm sebesar rp 2,4 juta (blt umkm rp 2,4 juta) lewat kementerian koperasi dan ukm serta bank bri. hingga 28 september 2020, program ini sudah terealisasi 72,46 persen, dengan nilai total anggaran yang sudah digelontorkan mencapai rp 15,93 triliun. targetnya ada 9,1 juta penerima di tahun 2020. pelaku usaha umkm yang sudah ditetapkan sebagai penerima bantuan umkm rp 2,4 juta akan mendapatkan notifikasi sms dari bank bri. kabar baiknya, banpres produktif ini masih diperpanjang hingga akhir november 2020. blt umkm tahap ii ini bakal diperpanjang dan menyasar 3 juta umkm. untuk bisa mendapatkan bantuan blt ini, pelaku usaha harus mendaftarkan secara langsung. jika lolos, uang akan ditransfer. untuk mengecek penerima bpum, bisa dilakukan melalui e-form yang disediakan pt bank rakyat indonesia tbk (persero) atau bri. berikut cara mengecek siapa saja penerima blt rp 2,4 juta di e-form bri. sebagai informasi, bantuan umkm rp 2,4 juta diluncurkan oleh presiden jokowi pada 24 agustus 2020 yang lalu, bri telah menyalurkan bpum sebesar rp. 10,3 triliun kepada 4,3 juta penerima. pemerintah berencana menambah jumlah penerima bantuan ini hingga 12 juta pelaku umkm. untuk cara mendapatkan bantuan umkm rp 2,4 juta, pelaku usaha kecil ini bisa mendaftarkan dirinya ke dinas koperasi yang berada di domisilinya (bantuan 2,4 juta). berikut syarat umkm mendapatkan bantuan rp 2,4 juta dari pemerintah: syarat lainnya, seperti dikutip laman kemenkop, bagi pelaku usaha mikro yang alamat usahanya berbeda dengan alamat domisili sebagaimana tercantum di ktp, maka dapat melampirkan surat keterangan usaha (sku). sebelumnya, menteri koperasi dan ukm (menkop ukm) teten masduki menyatakan untuk cara mendapatkan bantuan umkm rp 2,4 juta, pelaku usaha kecil ini bisa mendaftarkan dirinya ke dinas koperasi yang berada di domisilinya. ""pemerintah terus mengevaluasi program pemulihan ekonomi nasional dan koperasi dan umkm. sekarang presiden joko widodo mengeluarkan program baru, yakni bantuan sosial presiden (banpres) produktif untuk usaha mikro yang belum bankable, yang belum punya pinjaman dari perbankan,"" ujar teten dikutip dari harian kompas. mantan aktivis icw ini menuturkan, skema dana bantuan pemerintah untuk pelaku usaha wong cilik ini akan lansung ditransfer ke rekening masing-masing pemilik usaha. ""kami mengalokasikan kepada 12 juta pelaku usaha mikro. saat ini dipa (daftar isian penggunaan anggaran)-nya sudah disediakan, pada tahap awal untuk 9,1 juta unit usaha mikro,"" kata teten. ""per unit usaha mikro memperoleh rp 2,4 juta sekali bayar, ditransfer langsung ke rekening bersangkutan yang sudah terdata by name by address. direncanakan diluncurkan pada 17 agustus 2020,"" kata dia lagi. bantuan itu bukan pinjaman atau kredit, melainkan hibah. sehingga penerima tidak akan dikenai biaya apa pun dalam proses penyalurannya. "
Hidup dengan Ibu ODGJ, 4 Bocah Kurang Gizi dan Ditemukan Popok Berulat di Rumah;"KOMPAS.com - Empat anak di Kabupaten Nunukan, Kalimantan Utara alami gizi buruk. Mereka adalah R (7), S (5), I (3), dan Sup (1)  Selama ini mereka tinggal dengan sang ibu, Rosnaeni (26) yang mengalami gangguan psikologi atau orang dengan gangguan jiwa (ODGJ) serta sang ayah, Herman (52). Satu keluarga tersebut tinggal di tengah kebun sawit yang jauh dari pemukiman. Jarak rumah mereka sekitar tiga kilometer dari jalan raya sehingga jarang berinteraksi dengan orang. Herman bekerja menombak buah kelapa sawit. Dia mendaparkan upah Rp 150.000 per ton. Padahal satu bulan, Herman hanya menombak buah kelapa sawit sebanyak dua kali. Untungnya, pemilik kebun berbaik hati dengan menanggung kebutuhan beras untuk keluarga Herman. Saat ini Dinas Pemberdayaan Perempuan dan Perlindungan Anak, Pengendalian Penduduk dan Keluarga Berencana (DPPPAPPKB) Kabupaten Nunukan, Kalimantan Utara mengurusi keluarga tersebut. Shutterstock.com Ilustrasi depresi pasca melahirkanRosnaeni terpaut usia yang cukup jauh dengan suaminya, Herman. Mereka menikah saat sama-sama menjadi TKI ilegal di Sabah, Malaysia. Mereka kemudian tinggal di Pulau Sebatik selama tujuh tahun terakhir. Keluarga tersebut tinggal berpindah-pindah dari satu kebun ke kebun lainnya. Menurut Kepala Dinas DPPPAPPKB Nunukan Faridah Aryani, kepada petugas, Rosnaeni bercerita jika ia kerap mengalami siksaan fisik dan kekerasan dari suaminya. Selain itu Rosnaeni bercerita jika ia adalah istri ketujuh Herman. ""Dari hasil obrolan psikolog, ibunya anak-anak ini istri ketujuh, kita juga belum tahu apakah Herman ini maniak atau bagaimana. Info yang kita dapat ini perkawinannya yang ketujuh, istrinya mengaku sering kena pukul, bisa jadi itu salah satu sebab dia depresi,"" tuturnya, Jumat (23/10/2020). Selain tertekan karena kerap disiksa sang suami, Rosnaeni diduga pernah mengalami guncangan hebat saat anak ketiganya meninggal dunia saat usianya belum genap setahun. Perempuan 26 tahun itu juga tak pernah beinteraksi dengan orang lain. Petugas puskesmas juga menjelaskan jika Rosnaeni pernah mengalami masalah medis saat melahirkan. Disebukan jika darah putih Rosnaeni sempat naik. ""Selain itu, pernah ada masalah saat melahirkan. Dari penjelasan petugas puskesmas, ada riwayat medis kalau darah putihnya sempat naik. Jadi kalau darah putih naik ke kepala saat perempuan melahirkan itu bisa mengakibatkan buta atau meninggal dunia, kemungkinan itu juga masih kami dalami,"" katanya. ";24-10-2020;https://regional.kompas.com/read/2020/10/24/14140071/hidup-dengan-ibu-odgj-4-bocah-kurang-gizi-dan-ditemukan-popok-berulat-di?page=all;"empat anak di kabupaten nunukan, kalimantan utara alami gizi buruk. mereka adalah r (7), s (5), i (3), dan sup (1) selama ini mereka tinggal dengan sang ibu, rosnaeni (26) yang mengalami gangguan psikologi atau orang dengan gangguan jiwa (odgj) serta sang ayah, herman (52). satu keluarga tersebut tinggal di tengah kebun sawit yang jauh dari pemukiman. jarak rumah mereka sekitar tiga kilometer dari jalan raya sehingga jarang berinteraksi dengan orang. herman bekerja menombak buah kelapa sawit. dia mendaparkan upah rp 150.000 per ton. padahal satu bulan, herman hanya menombak buah kelapa sawit sebanyak dua kali. untungnya, pemilik kebun berbaik hati dengan menanggung kebutuhan beras untuk keluarga herman. saat ini dinas pemberdayaan perempuan dan perlindungan anak, pengendalian penduduk dan keluarga berencana (dpppappkb) kabupaten nunukan, kalimantan utara mengurusi keluarga tersebut. shutterstock.com ilustrasi depresi pasca melahirkanrosnaeni terpaut usia yang cukup jauh dengan suaminya, herman. mereka menikah saat sama-sama menjadi tki ilegal di sabah, malaysia. mereka kemudian tinggal di pulau sebatik selama tujuh tahun terakhir. keluarga tersebut tinggal berpindah-pindah dari satu kebun ke kebun lainnya. menurut kepala dinas dpppappkb nunukan faridah aryani, kepada petugas, rosnaeni bercerita jika ia kerap mengalami siksaan fisik dan kekerasan dari suaminya. selain itu rosnaeni bercerita jika ia adalah istri ketujuh herman. ""dari hasil obrolan psikolog, ibunya anak-anak ini istri ketujuh, kita juga belum tahu apakah herman ini maniak atau bagaimana. info yang kita dapat ini perkawinannya yang ketujuh, istrinya mengaku sering kena pukul, bisa jadi itu salah satu sebab dia depresi,"" tuturnya, jumat (23/10/2020). selain tertekan karena kerap disiksa sang suami, rosnaeni diduga pernah mengalami guncangan hebat saat anak ketiganya meninggal dunia saat usianya belum genap setahun. perempuan 26 tahun itu juga tak pernah beinteraksi dengan orang lain. petugas puskesmas juga menjelaskan jika rosnaeni pernah mengalami masalah medis saat melahirkan. disebukan jika darah putih rosnaeni sempat naik. ""selain itu, pernah ada masalah saat melahirkan. dari penjelasan petugas puskesmas, ada riwayat medis kalau darah putihnya sempat naik. jadi kalau darah putih naik ke kepala saat perempuan melahirkan itu bisa mengakibatkan buta atau meninggal dunia, kemungkinan itu juga masih kami dalami,"" katanya. "
             'Adu Mulut' Trump vs Biden, Awas Koreksi IHSG!            ;"Jakarta, CNBC Indonesia - Indeks Harga Saham Gabungan (IHSG) kembali melemah tipis 0,09% ke 5.901,816 pada perdagangan Kamis kemarin. Data perdagangan mencatat, investor asing melakukan aksi jual bersih sebanyak Rp 251 miliar di pasar reguler dengan nilai transaksi menyentuh Rp 9,3 triliun. Pelaku pasar saat ini menanti kepastian stimulus fiskal di AS yang kabarnya bisa cair di pekan ini. Perundingan antara Nancy Pelosi, Ketua DPR (House of Representatif) Amerika Serikat (AS) dengan Menteri Keuangan Steven Mnuchin yang membahas stimulus tersebut masih berlangsung, dan dikatakan masih ada perbedaan pendapat. ""Memang masih ada sejumlah pendapat yang berbeda. Namun, kami sudah memasuki tahapan negosiasi yang baru, di mana tinggal mengurus masalah teknis bahasa penyampaian,"" ungkap Mark Meadows, Kepala Staf Gedung Putih, seperti dikutip dari Reuters.   Perkembangan stimulus tersebut masih akan mempengaruhi pergerakan pasar saham pada hari ini Jumat (23/10/2020), termasuk IHSG. Pelosi memberikan sinyal adanya kemajuan perundingan stimulus fiskal kemarin. ""Jika tidak ada kemajuan, saya tidak akan menghabiskan detik sekalipun di dalam perundingan ini. Ini adalah usaha yang serius. Saya percaya kami semua ingin mencapai kesepakatan,"" kata Pelosi sebagaimana dilansir CNBC International, Kamis (22/10/2020). Meski demikian Pelosi juga memberikan indikasi stimulus kemungkinan belum akan cair sebelum pemilihan presiden 3 November mendatang. Ia mengatakan butuh waktu untuk menyelesaikan dan menandatangani undang-undang stimulus fiskal, artinya harapan akan cairnya stimulus di pekan ini. Selain itu pelaku pasar juga akan mencermati debat calon presiden AS yang mempertemukan petahana dari Partai Republik Donald Trump dengan penantangnya Joseph 'Joe' Biden dari Partai Demokrat pagi ini. Alhasil, pelaku pasar kemungkinan melakukan aksi wait and see sehingga IHSG berisiko terkoreksi lagi.    Secara teknikal, IHSG kemarin nyaris menyentuh support di 5.060, yang juga merupakan rerata pergerakan 100 hari (moving average/MA100) yang ditunjukkan garis warna oranye muda. Setelah mendekati level tersebut, IHSG langsung rebound yang menjadi indikasi support kuat.   Indikator Stochastic pada grafik harian dan 1 jam tidak berada di wilayah jenuh beli (overbought) maupun jenuh jual (oversold), sehingga tidak bisa memberikan sinyal kemana IHSG akan bergerak. Stochastic merupakan leading indicator, atau indikator yang mengawali pergerakan harga. Ketika Stochastic mencapai wilayah overbought (di atas 80) atau oversold (di bawah 20), maka suatu harga suatu instrumen berpeluang berbalik arah. IHSG kini bergerak di dekat rerata pergerakan 50 hari (moving average/MA50) yang ditunjukkan dengan garis hijau.   MA 50 berada di kisaran 5.115 hingga 5.120, jika berhasil dilewati IHSG berpeluang menguat kembali menuju kisaran 5.163 yang menjadi resisten kuat sebab merupakan Fibonnaci Retracement 50%. Fibonnaci tersebut ditarik dari level tertinggi September 2019 di 6.414 ke level terlemah tahun ini 3.911 pada grafik harian. Sebaliknya, selama tertahan di bawah MA 50 IHSG berisiko melemah ke support 5.060. Jika support dilewati, ada risiko bursa kebanggaan Tanah Air ini turun ke kisaran 5.020.  TIM RISET CNBC INDONESIA  ";23-10-2020;https://www.cnbcindonesia.com/market/20201023075150-17-196483/adu-mulut-trump-vs-biden-awas-koreksi-ihsg;"jakarta, cnbc indonesia - indeks harga saham gabungan (ihsg) kembali melemah tipis 0,09% ke 5.901,816 pada perdagangan kamis kemarin. data perdagangan mencatat, investor asing melakukan aksi jual bersih sebanyak rp 251 miliar di pasar reguler dengan nilai transaksi menyentuh rp 9,3 triliun. pelaku pasar saat ini menanti kepastian stimulus fiskal di as yang kabarnya bisa cair di pekan ini. perundingan antara nancy pelosi, ketua dpr (house of representatif) amerika serikat (as) dengan menteri keuangan steven mnuchin yang membahas stimulus tersebut masih berlangsung, dan dikatakan masih ada perbedaan pendapat. ""memang masih ada sejumlah pendapat yang berbeda. namun, kami sudah memasuki tahapan negosiasi yang baru, di mana tinggal mengurus masalah teknis bahasa penyampaian,"" ungkap mark meadows, kepala staf gedung putih, seperti dikutip dari reuters. perkembangan stimulus tersebut masih akan mempengaruhi pergerakan pasar saham pada hari ini jumat (23/10/2020), termasuk ihsg. pelosi memberikan sinyal adanya kemajuan perundingan stimulus fiskal kemarin. ""jika tidak ada kemajuan, saya tidak akan menghabiskan detik sekalipun di dalam perundingan ini. ini adalah usaha yang serius. saya percaya kami semua ingin mencapai kesepakatan,"" kata pelosi sebagaimana dilansir cnbc international, kamis (22/10/2020). meski demikian pelosi juga memberikan indikasi stimulus kemungkinan belum akan cair sebelum pemilihan presiden 3 november mendatang. ia mengatakan butuh waktu untuk menyelesaikan dan menandatangani undang-undang stimulus fiskal, artinya harapan akan cairnya stimulus di pekan ini. selain itu pelaku pasar juga akan mencermati debat calon presiden as yang mempertemukan petahana dari partai republik donald trump dengan penantangnya joseph 'joe' biden dari partai demokrat pagi ini. alhasil, pelaku pasar kemungkinan melakukan aksi wait and see sehingga ihsg berisiko terkoreksi lagi. secara teknikal, ihsg kemarin nyaris menyentuh support di 5.060, yang juga merupakan rerata pergerakan 100 hari (moving average/ma100) yang ditunjukkan garis warna oranye muda. setelah mendekati level tersebut, ihsg langsung rebound yang menjadi indikasi support kuat. indikator stochastic pada grafik harian dan 1 jam tidak berada di wilayah jenuh beli (overbought) maupun jenuh jual (oversold), sehingga tidak bisa memberikan sinyal kemana ihsg akan bergerak. stochastic merupakan leading indicator, atau indikator yang mengawali pergerakan harga. ketika stochastic mencapai wilayah overbought (di atas 80) atau oversold (di bawah 20), maka suatu harga suatu instrumen berpeluang berbalik arah. ihsg kini bergerak di dekat rerata pergerakan 50 hari (moving average/ma50) yang ditunjukkan dengan garis hijau. ma 50 berada di kisaran 5.115 hingga 5.120, jika berhasil dilewati ihsg berpeluang menguat kembali menuju kisaran 5.163 yang menjadi resisten kuat sebab merupakan fibonnaci retracement 50%. fibonnaci tersebut ditarik dari level tertinggi september 2019 di 6.414 ke level terlemah tahun ini 3.911 pada grafik harian. sebaliknya, selama tertahan di bawah ma 50 ihsg berisiko melemah ke support 5.060. jika support dilewati, ada risiko bursa kebanggaan tanah air ini turun ke kisaran 5.020. tim riset cnbc indonesia "
