Title;Content;Date;URL;Cleaned Article
IHSG Sesi I Menguat ke Level 7.436, Total Transaksi Capai Rp 4,9 Triliun;"Laporan Wartawan Tribunnews.com, Reynas Abdila TRIBUNNEWS.COM, JAKARTA - Indeks Harga Saham Gabungan (IHSG) ditutup menguat 0,05 persen atau naik 4,025 basis point ke level 7.436,115 pada sesi I perdagangan bursa, Senin (19/8/2024). Mengutip RTI Business, IHSG bergerak variatif dengan level support 7.422 hingga resistance 7.451 setelah dibuka pada level 7.432 pagi tadi. Sebanyak 277 saham harganya naik, 268 saham harganya turun, dan sisanya 251 saham stagnan. Total nilai transaksi jeda perdagangan mencapai Rp 4,9 triliun dari adanya volume penjualan 8,6 miliar saham. Saham raksasa BBRI, BBCA, dan BREN menjadi tiga saham dengan jumlah nilai transaksi terbesar. BBRI membukukan transaksi Rp578 miliar, BBCA sebesar Rp254 miliar, dan BREN senilai Rp247 miliar.  .recads_wrapper{height:134px;position:relative;margin:10px 0 30px;padding:10px 15px;overflow:hidden;box-shadow:0 0 10px rgb(0 0 0 / 20%);}.recads_title{margin-bottom:10px;font-size:16px;font-weight:700}.arjW-list{overflow-x:scroll;overflow-y:hidden;white-space:nowrap;width:auto;padding:10px 0;position:relative;display:flex;scroll-snap-type:x;flex-wrap:nowrap}.recads_item{scroll-snap-align:start;width:280px;flex:0 0 280px;margin-right:20px;display: flex;white-space: normal;gap: 10px;}.recads_item a {display:flex;white-space:normal;gap:10px;}.recads_image{position:relative;height:auto}.recads_image img{width:auto;height: 73px!important;max-width:165px!important;border-radius:8px}.article_datas_title{font-size:14px;font-weight:700;line-height:1.2;margin:0;overflow:hidden;display:-webkit-box;-webkit-line-clamp:4;-webkit-box-orient:vertical;}.arjW-img-overlay{position:absolute;z-index:3;bottom:8px;left:0;padding:0 0 0 10px}.arjW-img-overlay>img{width:auto;height: 16px!important;}.recads_image::after{z-index:2;position:absolute;top:50%;bottom:4px;left:0;right:0;content:'';background:linear-gradient(to top,#d6d6d6,transparent);width:100%;border-radius: 8px;}             BERITA REKOMENDASI           Sejumlah sektor saham berdasarkan indeks bervariatif di mana energi turun 0,05 persen, barang baku naik 0,63 persen, industri naik 0,36 persen, konsumer siklikal naik 2,28 persen, non konsumer turun 0,66 persen, kesehatan minus 0,64 persen.  Kemudian sektor saham keuangan naik 0,32 persen, real estate naik 0,13 persen, teknologi turun 0,49 persen, infrastruktur turun 0,39 persen, dan logistik naik 0,39 persen. Indeks acuan siang ini terkoreksi antara lain LQ45 tercatat turun 0,08 persen menjadi 924,533, indeks Jakarta Islamic Index (JII) melemah 0,10 persen ke 507,070, dan IDX30 melemah 0,28 persen ke 468,657.";19-08-2024;https://www.tribunnews.com/bisnis/2024/08/19/ihsg-sesi-i-menguat-ke-level-7436-total-transaksi-capai-rp-49-triliun;laporan wartawan tribunnews.com, reynas abdila tribunnews.com, jakarta - indeks harga saham gabungan (ihsg) ditutup menguat 0,05 persen atau naik 4,025 basis point ke level 7.436,115 pada sesi i perdagangan bursa, senin (19/8/2024). mengutip rti business, ihsg bergerak variatif dengan level support 7.422 hingga resistance 7.451 setelah dibuka pada level 7.432 pagi tadi. sebanyak 277 saham harganya naik, 268 saham harganya turun, dan sisanya 251 saham stagnan. total nilai transaksi jeda perdagangan mencapai rp 4,9 triliun dari adanya volume penjualan 8,6 miliar saham. saham raksasa bbri, bbca, dan bren menjadi tiga saham dengan jumlah nilai transaksi terbesar. bbri membukukan transaksi rp578 miliar, bbca sebesar rp254 miliar, dan bren senilai rp247 miliar. berita rekomendasi sejumlah sektor saham berdasarkan indeks bervariatif di mana energi turun 0,05 persen, barang baku naik 0,63 persen, industri naik 0,36 persen, konsumer siklikal naik 2,28 persen, non konsumer turun 0,66 persen, kesehatan minus 0,64 persen. kemudian sektor saham keuangan naik 0,32 persen, real estate naik 0,13 persen, teknologi turun 0,49 persen, infrastruktur turun 0,39 persen, dan logistik naik 0,39 persen. indeks acuan siang ini terkoreksi antara lain lq45 tercatat turun 0,08 persen menjadi 924,533, indeks jakarta islamic index (jii) melemah 0,10 persen ke 507,070, dan idx30 melemah 0,28 persen ke 468,657.
IHSG Lanjutkan Pola Penguatan, Cek Rekomendasi Saham Perdagangan Hari Ini;"Laporan Wartawan Tribunnews.com, Reynas Abdila TRIBUNNEWS.COM, JAKARTA - Indeks Harga Saham Gabungan (IHSG) berpotensi menguat pada perdagangan Rabu (14/8/2024). CEO Yugen Bertumbuh Sekuritas William Surya Wijaya memperkirakan IHSG akan bergerak di kisaran 7.202 - 7.373. “Perkembangan pergerakan IHSG dalam jangka pendek masih menunjukkan pola uptrend,” katanya. Hal ini terkonfirmasi dengan upaya IHSG berhasil menembus resisten level terdekat dan upayanya untuk mencetak rekor All Time High (ATH) yang baru. Menurutnya, masih kuat fundamental perekonomian Indonesia turut menjadi penopang pergerakan IHSG hingga saat ini. Sedangkan dalam jangka pendek peluang koreksi minor masih terbuka.  .recads_wrapper{height:134px;position:relative;margin:10px 0 30px;padding:10px 15px;overflow:hidden;box-shadow:0 0 10px rgb(0 0 0 / 20%);}.recads_title{margin-bottom:10px;font-size:16px;font-weight:700}.arjW-list{overflow-x:scroll;overflow-y:hidden;white-space:nowrap;width:auto;padding:10px 0;position:relative;display:flex;scroll-snap-type:x;flex-wrap:nowrap}.recads_item{scroll-snap-align:start;width:280px;flex:0 0 280px;margin-right:20px;display: flex;white-space: normal;gap: 10px;}.recads_item a {display:flex;white-space:normal;gap:10px;}.recads_image{position:relative;height:auto}.recads_image img{width:auto;height: 73px!important;max-width:165px!important;border-radius:8px}.article_datas_title{font-size:14px;font-weight:700;line-height:1.2;margin:0;overflow:hidden;display:-webkit-box;-webkit-line-clamp:4;-webkit-box-orient:vertical;}.arjW-img-overlay{position:absolute;z-index:3;bottom:8px;left:0;padding:0 0 0 10px}.arjW-img-overlay>img{width:auto;height: 16px!important;}.recads_image::after{z-index:2;position:absolute;top:50%;bottom:4px;left:0;right:0;content:'';background:linear-gradient(to top,#d6d6d6,transparent);width:100%;border-radius: 8px;}             BERITA REKOMENDASI           “Ini tentunya dapat dijadikan momen oleh investor untuk melakukan akumulasi pembelian dengan target investasi jangka panjang,” paparnya. Menurut tim riset MNC Sekuritas, IHSG masih cenderung menguat untuk menguji 7.408-7.438 sebagai area penguatannya.  Selanjutnya, IHSG akan terkoreksi ke rentang area 7.027-7.218. ACES - Buy on WeaknessACES menguat 2,78 persen ke 740 disertai dengan munculnya volume pembelian.Buy on Weakness: 725-740Target Price: 775, 855Stoploss: below 710 ICBP - Buy on WeaknessICBP menguat 1,59 persen ke 11,175 namun disertai dengan adanya peningkatan volume penjualan.Buy on Weakness: 10,600-11,025Target Price: 11,350, 11,850Stoploss: below 10,425 MAPI - Spec BuyMAPI menguat 3,21 persen ke 1,445 disertai dengan munculnya volume pembelian.Spec Buy: 1,410-1,445Target Price: 1,505, 1,625Stoploss: below 1,395 SMGA - Buy on WeaknessSMGA menguat 3,53 persen ke 88 disertai dengan peningkatan volume pembelian, namun penguatannya tertahan oleh cluster MA20 dan MA60.Buy on Weakness: 84-87Target Price: 91, 97Stoploss: below 81 Disclaimer: Bukan ajakan beli/jual saham apapun. Saham bisa naik turun secara tajam. Investasi saham mengandung risiko dan sepenuhnya tanggung jawab pribadi.";14-08-2024;https://www.tribunnews.com/bisnis/2024/08/14/ihsg-lanjutkan-pola-penguatan-cek-rekomendasi-saham-perdagangan-hari-ini;laporan wartawan tribunnews.com, reynas abdila tribunnews.com, jakarta - indeks harga saham gabungan (ihsg) berpotensi menguat pada perdagangan rabu (14/8/2024). ceo yugen bertumbuh sekuritas william surya wijaya memperkirakan ihsg akan bergerak di kisaran 7.202 - 7.373. “perkembangan pergerakan ihsg dalam jangka pendek masih menunjukkan pola uptrend,” katanya. hal ini terkonfirmasi dengan upaya ihsg berhasil menembus resisten level terdekat dan upayanya untuk mencetak rekor all time high (ath) yang baru. menurutnya, masih kuat fundamental perekonomian indonesia turut menjadi penopang pergerakan ihsg hingga saat ini. sedangkan dalam jangka pendek peluang koreksi minor masih terbuka. berita rekomendasi “ini tentunya dapat dijadikan momen oleh investor untuk melakukan akumulasi pembelian dengan target investasi jangka panjang,” paparnya. menurut tim riset mnc sekuritas, ihsg masih cenderung menguat untuk menguji 7.408-7.438 sebagai area penguatannya. selanjutnya, ihsg akan terkoreksi ke rentang area 7.027-7.218. aces - buy on weaknessaces menguat 2,78 persen ke 740 disertai dengan munculnya volume pembelian.buy on weakness: 725-740target price: 775, 855stoploss: below 710 icbp - buy on weaknessicbp menguat 1,59 persen ke 11,175 namun disertai dengan adanya peningkatan volume penjualan.buy on weakness: 10,600-11,025target price: 11,350, 11,850stoploss: below 10,425 mapi - spec buymapi menguat 3,21 persen ke 1,445 disertai dengan munculnya volume pembelian.spec buy: 1,410-1,445target price: 1,505, 1,625stoploss: below 1,395 smga - buy on weaknesssmga menguat 3,53 persen ke 88 disertai dengan peningkatan volume pembelian, namun penguatannya tertahan oleh cluster ma20 dan ma60.buy on weakness: 84-87target price: 91, 97stoploss: below 81 disclaimer: bukan ajakan beli/jual saham apapun. saham bisa naik turun secara tajam. investasi saham mengandung risiko dan sepenuhnya tanggung jawab pribadi.
IHSG Berpeluang Menguat, Cek Menu Saham Perdagangan Hari Ini;"Laporan Wartawan Tribunnews.com, Reynas Abdila TRIBUNNEWS.COM, JAKARTA - Indeks Harga Saham Gabungan (IHSG) berpeluang menguarlt pada pebukaan perdagangan bursa hari ini, Senin (19/8/2024). CEO Yugen Bertumbuh Sekuritas William Surya Wijaya memperkirakan IHSG bergerak di rentang 7.256 - 7.489 “Pasca peningkatan performa IHSG yang kembali dapat mencetak rekor tertinggi baru, menunjukkan bahwa potensi IHSG untuk kembali menapak pola uptrend jangka pendek semakin terlihat,” ucap William dalam risetnya. Hal ini sekaligus ditopang oleh kondisi kinerja emiten yang terlihat juga turut membaik serta data perekonomian yang menunjukkan kestabilan perekonomian. “Hari ini IHSG berpotensi menguat,” imbuhnya. Menurut MNC Sekuritas, IHSG menguat 0,30 persen ke 7,432 disertai dengan munculnya volume pembelian, namun penguatannya masih tertahan resistance terdekatnya di 7,460.  .recads_wrapper{height:134px;position:relative;margin:10px 0 30px;padding:10px 15px;overflow:hidden;box-shadow:0 0 10px rgb(0 0 0 / 20%);}.recads_title{margin-bottom:10px;font-size:16px;font-weight:700}.arjW-list{overflow-x:scroll;overflow-y:hidden;white-space:nowrap;width:auto;padding:10px 0;position:relative;display:flex;scroll-snap-type:x;flex-wrap:nowrap}.recads_item{scroll-snap-align:start;width:280px;flex:0 0 280px;margin-right:20px;display: flex;white-space: normal;gap: 10px;}.recads_item a {display:flex;white-space:normal;gap:10px;}.recads_image{position:relative;height:auto}.recads_image img{width:auto;height: 73px!important;max-width:165px!important;border-radius:8px}.article_datas_title{font-size:14px;font-weight:700;line-height:1.2;margin:0;overflow:hidden;display:-webkit-box;-webkit-line-clamp:4;-webkit-box-orient:vertical;}.arjW-img-overlay{position:absolute;z-index:3;bottom:8px;left:0;padding:0 0 0 10px}.arjW-img-overlay>img{width:auto;height: 16px!important;}.recads_image::after{z-index:2;position:absolute;top:50%;bottom:4px;left:0;right:0;content:'';background:linear-gradient(to top,#d6d6d6,transparent);width:100%;border-radius: 8px;}             BERITA REKOMENDASI           IHSG masih akan terkoreksi ke rentang area 7.027-7.218 apabila IHSG mampu break 7.460, maka IHSG akan menuju ke 7.513-7.654.  AUTO - Buy on Weakness AUTO menguat 0,46 persen ke 2,190 dan disertai dengan munculnya volume pembelian. Saat ini, posisi AUTO diperkirakan sedang berada di awal wave v dari wave i dari wave (iii), sehingga AUTO masih berpeluang menguat. Buy on Weakness: 2,170-2,190 Target Price: 2,270, 2,410 Stoploss: below 2,100 BREN - Buy on Weakness BREN menguat 0,86% ke 8,750 disertai dengan munculnya volume pembelian, namun penguatan BREN masih tertahan oleh MA60. Saat ini, posisi BREN diperkirakan sedang berada pada bagian dari wave (iii) dari wave [c], sehingga BREN berpeluang melanjutkan penguatannya. Buy on Weakness: 8,425-8,625 Target Price: 9,175, 9,600 Stoploss: below 8,125 INKP - Spec Buy INKP menguat 0,91% ke 8,350 disertai dengan munculnya volume pembelian. Kami perkirakan, posisi INKP saat ini sedang berada di awal wave v dari wave (i) dari wave [c], sehingga INKP masih berpeluang melanjutkan penguatannya. Spec Buy: 8,275-8,350 Target Price: 8,450, 8,600 Stoploss: below 8,250 SMGR - Buy on Weakness SMGR menguat 1% ke 4,050 disertai dengan munculnya volume pembelian. Kami perkirakan, posisi SMGR saat ini sedang berada pada bagian dari wave i dari wave (c), sehingga SMGR akan terkoreksi terlebih dahulu. Buy on Weakness: 3,930-4,030 Target Price: 4,170, 4,320 Stoploss: below 3,740";19-08-2024;https://www.tribunnews.com/bisnis/2024/08/19/ihsg-berpeluang-menguat-cek-menu-saham-perdagangan-hari-ini;laporan wartawan tribunnews.com, reynas abdila tribunnews.com, jakarta - indeks harga saham gabungan (ihsg) berpeluang menguarlt pada pebukaan perdagangan bursa hari ini, senin (19/8/2024). ceo yugen bertumbuh sekuritas william surya wijaya memperkirakan ihsg bergerak di rentang 7.256 - 7.489 “pasca peningkatan performa ihsg yang kembali dapat mencetak rekor tertinggi baru, menunjukkan bahwa potensi ihsg untuk kembali menapak pola uptrend jangka pendek semakin terlihat,” ucap william dalam risetnya. hal ini sekaligus ditopang oleh kondisi kinerja emiten yang terlihat juga turut membaik serta data perekonomian yang menunjukkan kestabilan perekonomian. “hari ini ihsg berpotensi menguat,” imbuhnya. menurut mnc sekuritas, ihsg menguat 0,30 persen ke 7,432 disertai dengan munculnya volume pembelian, namun penguatannya masih tertahan resistance terdekatnya di 7,460. berita rekomendasi ihsg masih akan terkoreksi ke rentang area 7.027-7.218 apabila ihsg mampu break 7.460, maka ihsg akan menuju ke 7.513-7.654. auto - buy on weakness auto menguat 0,46 persen ke 2,190 dan disertai dengan munculnya volume pembelian. saat ini, posisi auto diperkirakan sedang berada di awal wave v dari wave i dari wave (iii), sehingga auto masih berpeluang menguat. buy on weakness: 2,170-2,190 target price: 2,270, 2,410 stoploss: below 2,100 bren - buy on weakness bren menguat 0,86% ke 8,750 disertai dengan munculnya volume pembelian, namun penguatan bren masih tertahan oleh ma60. saat ini, posisi bren diperkirakan sedang berada pada bagian dari wave (iii) dari wave [c], sehingga bren berpeluang melanjutkan penguatannya. buy on weakness: 8,425-8,625 target price: 9,175, 9,600 stoploss: below 8,125 inkp - spec buy inkp menguat 0,91% ke 8,350 disertai dengan munculnya volume pembelian. kami perkirakan, posisi inkp saat ini sedang berada di awal wave v dari wave (i) dari wave [c], sehingga inkp masih berpeluang melanjutkan penguatannya. spec buy: 8,275-8,350 target price: 8,450, 8,600 stoploss: below 8,250 smgr - buy on weakness smgr menguat 1% ke 4,050 disertai dengan munculnya volume pembelian. kami perkirakan, posisi smgr saat ini sedang berada pada bagian dari wave i dari wave (c), sehingga smgr akan terkoreksi terlebih dahulu. buy on weakness: 3,930-4,030 target price: 4,170, 4,320 stoploss: below 3,740
IHSG Masih Konsolidasi Wajar, Simak Rekomendasi Saham Hari Ini;"Laporan Wartawan Tribunnews.com, Reynas Abdila TRIBUNNEWS.COM, JAKARTA - Indeks Harga Saham Gabungan (IHSG) masih berpotensi konsolidasi wajar pada perdagangan Jumat (16/8/2024). CEO Yugen Bertumbuh Sekuritas William Surya Wijaya mengatakan IHSG akan menguji area 7.256 - 7.489. “Pola gerak IHSG terlihat melalui rentang konsolidasi wajar pasca mencatatkan rekor ATH secara intraday, namun IHSG terlihat masih belum mampu menutup perdagangan dengan rekor terbarunya,” katanya. Sedangkan potensi risiko terhadap terjadinya koreksi jangka pendek tetap perlu diwaspadai. “Masih terjadinya fluktuasi nilai tukar rupiah dan juga harga komoditas turut memberikan sentimen tersendiri bagi pergerakan IHSG,” tambahnya. Namun capital inflow yang tercatat masuk ke dalam pasar modal Indonesia masih menjadi salah satu faktor penunjang kenaikan IHSG hingga beberapa waktu mendatang.  .recads_wrapper{height:134px;position:relative;margin:10px 0 30px;padding:10px 15px;overflow:hidden;box-shadow:0 0 10px rgb(0 0 0 / 20%);}.recads_title{margin-bottom:10px;font-size:16px;font-weight:700}.arjW-list{overflow-x:scroll;overflow-y:hidden;white-space:nowrap;width:auto;padding:10px 0;position:relative;display:flex;scroll-snap-type:x;flex-wrap:nowrap}.recads_item{scroll-snap-align:start;width:280px;flex:0 0 280px;margin-right:20px;display: flex;white-space: normal;gap: 10px;}.recads_item a {display:flex;white-space:normal;gap:10px;}.recads_image{position:relative;height:auto}.recads_image img{width:auto;height: 73px!important;max-width:165px!important;border-radius:8px}.article_datas_title{font-size:14px;font-weight:700;line-height:1.2;margin:0;overflow:hidden;display:-webkit-box;-webkit-line-clamp:4;-webkit-box-orient:vertical;}.arjW-img-overlay{position:absolute;z-index:3;bottom:8px;left:0;padding:0 0 0 10px}.arjW-img-overlay>img{width:auto;height: 16px!important;}.recads_image::after{z-index:2;position:absolute;top:50%;bottom:4px;left:0;right:0;content:'';background:linear-gradient(to top,#d6d6d6,transparent);width:100%;border-radius: 8px;}             BERITA REKOMENDASI           Menurut Samuel Sekuritas, indeks kemarin terkoreksi sebagai reaksi normal throwback setelah breaks resistance dan di area tertinggi sepanjang masa.  Koreksi ini masih normal, selama tertahan di 7350-7300, dan menjadi buying area. Berikut rekomendasi teknikal saham perdagangan hari ini: BBRI (4830); BUY-TP @4920-5050; Cutloss <4750 ASII (4890); BUY-TP @5025-5150; Cutloss <4830 BRPT (1105); BUY-TP @1135-1180; Cutloss <1090 HRUM (1380); BUY-TP @1425-1450; Cutloss <1345 ARKO (1170); BUY-TP @1255-1320; Cutloss <1115 FILM (4750); BUY-TP @5100-6075; Cutloss <4560 Disclaimer: Bukan ajakan beli/jual saham apapun. Saham bisa naik turun secara tajam. Investasi saham mengandung risiko dan sepenuhnya tanggung jawab pribadi.";16-08-2024;https://www.tribunnews.com/bisnis/2024/08/16/ihsg-masih-konsolidasi-wajar-simak-rekomendasi-saham-hari-ini;"laporan wartawan tribunnews.com, reynas abdila tribunnews.com, jakarta - indeks harga saham gabungan (ihsg) masih berpotensi konsolidasi wajar pada perdagangan jumat (16/8/2024). ceo yugen bertumbuh sekuritas william surya wijaya mengatakan ihsg akan menguji area 7.256 - 7.489. “pola gerak ihsg terlihat melalui rentang konsolidasi wajar pasca mencatatkan rekor ath secara intraday, namun ihsg terlihat masih belum mampu menutup perdagangan dengan rekor terbarunya,” katanya. sedangkan potensi risiko terhadap terjadinya koreksi jangka pendek tetap perlu diwaspadai. “masih terjadinya fluktuasi nilai tukar rupiah dan juga harga komoditas turut memberikan sentimen tersendiri bagi pergerakan ihsg,” tambahnya. namun capital inflow yang tercatat masuk ke dalam pasar modal indonesia masih menjadi salah satu faktor penunjang kenaikan ihsg hingga beberapa waktu mendatang. berita rekomendasi menurut samuel sekuritas, indeks kemarin terkoreksi sebagai reaksi normal throwback setelah breaks resistance dan di area tertinggi sepanjang masa. koreksi ini masih normal, selama tertahan di 7350-7300, dan menjadi buying area. berikut rekomendasi teknikal saham perdagangan hari ini: bbri (4830); buy-tp @4920-5050; cutloss <4750 asii (4890); buy-tp @5025-5150; cutloss <4830 brpt (1105); buy-tp @1135-1180; cutloss <1090 hrum (1380); buy-tp @1425-1450; cutloss <1345 arko (1170); buy-tp @1255-1320; cutloss <1115 film (4750); buy-tp @5100-6075; cutloss <4560 disclaimer: bukan ajakan beli/jual saham apapun. saham bisa naik turun secara tajam. investasi saham mengandung risiko dan sepenuhnya tanggung jawab pribadi."
IHSG dan Rupiah Kompak Menguat di Akhir Sesi;JAKARTA, KOMPAS.com - Pada penutupan perdagangan di Bursa Efek Indonesia (BEI), Indeks Harga Saham Gabungan (IHSG) berakhir di zona hijau pada Senin (19/8/2024). Demikian juga dengan rupiah yang menguat pada penutupan perdagangan pasar spot.  IHSG ditutup pada level 7.466,83 atau naik 34,7 poin (0,47 persen) dibandingkan penutupan sebelumnya pada level 7.432,09.  Mengutip RTI, sebanyak 318 saham melaju di zona hijau dan 216 saham di zona merah. Sedangkan 207 saham lainnya stagnan. Adapun jumlah transaksi sore ini mencapai Rp 9,2 triliun dengan volume 15,6 miliar saham.  Top gainers yang mendorong laju IHSG yakni, HM Sampoerna (HMSP) yang melonjak 15,7 persen ke level Rp 770 per saham. Kemudian, Barito Renewables Energy (BREN) yang bertambah 5,4 persen ke level Rp 9.200 per saham. Dilanjutkan oleh BFI Finance (BFIN) yang naik 4,2 perse ke level Rp 990 per saham.   Top losers yang menekan IHSG yaitu, Saratoga Investama Sedaya (SRTG) yang ambles 3,2 persen ke posisi Rp 1.805 per saham. Lalu, Charoen Pokphand Indonesia (CPIN) yang melemah 2,9 persen ke posisi Rp 5.000 per saham. Dilanjutkan oleh Chandra Asri Pacific (TPIA) yang turun 2,4 persen ke posisi Rp 9.850 per saham.  Baca juga: IHSG Diprediksi Melemah, Berikut Analisis dan Rekomendasi Sahamnya   Bursa Asia menghijau dengan kenaikan, Strait Times 0,08 persen (2,6 poin) ke level 3.355,26, Hang Seng Hong Kong bertambah 0,8 persen (139,4 poin) ke posisi 17.569,5, dan Shanghai Komposit menguat 0,49 persen (14,2 poin) ke posisi 2.893,66. Sementara itu, Nikkei melemah 1,7 persen (674,09 poin) ke posisi 37.388,6. Rupiah Mengutip data Bloomberg, rupiah sore ini ditutup menguat. Pukul 14.59 WIB mata uang garuda ditutup pada level Rp 15.550 per dollar AS atau naik 143 poin (0,91 persen) dibandingkan dengan sebelumnya pada level Rp 15.693 per saham.  Sementara itu, mengacu kurs tengah Jisdor, nilai tukar rupiah pada Jumat (16/8/2024) pada level Rp 15.591 per dollar AS, atau menguat dibanding Senin (19/8/2024) pada level Rp 15.716 per dollar AS. Disclaimer: Artikel ini bukan untuk mengajak membeli atau menjual saham. Segala rekomendasi dan analisa saham berasal dari analis dari sekuritas yang bersangkutan, dan Kompas.com tidak bertanggung jawab atas keuntungan atau kerugian yang timbul. Keputusan investasi ada di tangan Investor. Pelajari dengan teliti sebelum membeli/menjual saham. ;19-08-2024;https://money.kompas.com/read/2024/08/19/171611826/ihsg-dan-rupiah-kompak-menguat-di-akhir-sesi;jakarta,pada penutupan perdagangan di bursa efek indonesia (bei), indeks harga saham gabungan (ihsg) berakhir di zona hijau pada senin (19/8/2024). demikian juga dengan rupiah yang menguat pada penutupan perdagangan pasar spot. ihsg ditutup pada level 7.466,83 atau naik 34,7 poin (0,47 persen) dibandingkan penutupan sebelumnya pada level 7.432,09. mengutip rti, sebanyak 318 saham melaju di zona hijau dan 216 saham di zona merah. sedangkan 207 saham lainnya stagnan. adapun jumlah transaksi sore ini mencapai rp 9,2 triliun dengan volume 15,6 miliar saham. top gainers yang mendorong laju ihsg yakni, hm sampoerna (hmsp) yang melonjak 15,7 persen ke level rp 770 per saham. kemudian, barito renewables energy (bren) yang bertambah 5,4 persen ke level rp 9.200 per saham. dilanjutkan oleh bfi finance (bfin) yang naik 4,2 perse ke level rp 990 per saham. top losers yang menekan ihsg yaitu, saratoga investama sedaya (srtg) yang ambles 3,2 persen ke posisi rp 1.805 per saham. lalu, charoen pokphand indonesia (cpin) yang melemah 2,9 persen ke posisi rp 5.000 per saham. dilanjutkan oleh chandra asri pacific (tpia) yang turun 2,4 persen ke posisi rp 9.850 per saham. baca juga: ihsg diprediksi melemah, berikut analisis dan rekomendasi sahamnya bursa asia menghijau dengan kenaikan, strait times 0,08 persen (2,6 poin) ke level 3.355,26, hang seng hong kong bertambah 0,8 persen (139,4 poin) ke posisi 17.569,5, dan shanghai komposit menguat 0,49 persen (14,2 poin) ke posisi 2.893,66. sementara itu, nikkei melemah 1,7 persen (674,09 poin) ke posisi 37.388,6. rupiah mengutip data bloomberg, rupiah sore ini ditutup menguat. pukul 14.59 wib mata uang garuda ditutup pada level rp 15.550 per dollar as atau naik 143 poin (0,91 persen) dibandingkan dengan sebelumnya pada level rp 15.693 per saham. sementara itu, mengacu kurs tengah jisdor, nilai tukar rupiah pada jumat (16/8/2024) pada level rp 15.591 per dollar as, atau menguat dibanding senin (19/8/2024) pada level rp 15.716 per dollar as. disclaimer: artikel ini bukan untuk mengajak membeli atau menjual saham. segala rekomendasi dan analisa saham berasal dari analis dari sekuritas yang bersangkutan, dan kompas.com tidak bertanggung jawab atas keuntungan atau kerugian yang timbul. keputusan investasi ada di tangan investor. pelajari dengan teliti sebelum membeli/menjual saham. 
