Title;Content;Date;URL;Cleaned Article
 Rupiah Menguat ke Rp15.480 Pagi Ini ;"Nilai tukar rupiah bertengger di Rp15.480 per dolar AS pada Jumat (29/9) pagi. Posisi itu menguat 0,26 persen dibandingkan perdagangan sebelumnya. Mata uang di kawasan Asia bervariasi. Baht Thailand misalnya melemah 0,01 persen, ringgit Malaysia menguat 0,22 persen. Kemudian won Korea menguat 0,47 persen dan yuan China menguat 0,19 persen. Lalu, peso Filipina melemah 0,08 persen dan yen Jepang melemah 0,26 persen terhadap dolar AS.  ADVERTISEMENT   SCROLL TO CONTINUE WITH CONTENT   Mata uang di kawasan Eropa juga bervariasi. Misalnya euro menguat 0,06 persen dan poundsterling menguat 0,03 persen. Sedangkan, franc Swiss melemah 0,03 persen, dolar Australia melemah 0,06 persen, dan dan dolar Kanada melemah 0,10 persen. Analis pasar Lukman Leong mengatakan rupiah menguat setelah data ekonomi Amerika Serikat (AS) seperti penjualan rumah dan indeks manufaktur yang sangat lemah. ""Namun penguatan mungkin akan terbatas mengingat investor masih akan mengantisipasi data inflasi AS malam ini,"" katanya. Hari ini, Lukman memperkirakan rupiah bergerak di rentang Rp15.450 per dolar AS - Rp15.550 per dolar AS.   [Gambas:Video CNN] ";29-09-2023;https://www.cnnindonesia.com/ekonomi/20230929091529-78-1004991/rupiah-menguat-ke-rp15480-pagi-ini;"nilai tukar rupiah bertengger di rp15.480 per dolar as pada jumat (29/9) pagi. posisi itu menguat 0,26 persen dibandingkan perdagangan sebelumnya. mata uang di kawasan asia bervariasi. baht thailand misalnya melemah 0,01 persen, ringgit malaysia menguat 0,22 persen. kemudian won korea menguat 0,47 persen dan yuan china menguat 0,19 persen. lalu, peso filipina melemah 0,08 persen dan yen jepang melemah 0,26 persen terhadap dolar as. mata uang di kawasan eropa juga bervariasi. misalnya euro menguat 0,06 persen dan poundsterling menguat 0,03 persen. sedangkan, franc swiss melemah 0,03 persen, dolar australia melemah 0,06 persen, dan dan dolar kanada melemah 0,10 persen. analis pasar lukman leong mengatakan rupiah menguat setelah data ekonomi amerika serikat (as) seperti penjualan rumah dan indeks manufaktur yang sangat lemah. ""namun penguatan mungkin akan terbatas mengingat investor masih akan mengantisipasi data inflasi as malam ini,"" katanya. hari ini, lukman memperkirakan rupiah bergerak di rentang rp15.450 per dolar as - rp15.550 per dolar as. "
 Erick Minta Komisaris-Direksi BUMN Berangus Virus Judi Online ;"Menteri Badan Usaha Milik Negara (BUMN) Erick Thohir memerintahkan jajaran direksi hingga komisaris memberangus 'virus' judi online di tubuh perusahaan pelat merah. ""Ya tentu saya prihatin, apalagi kalau sudah penipuan (penggelapan uang negara), ya ditangkap lah ya (pejabat BUMN yang merugikan negara karena judi online), apalagi penipuan-penipuan. Sekecil apapun itu penipuan,"" ujarnya kepada CNNIndonesia.com di Kantor Transmedia, Jakarta Selatan, Rabu (4/10). ""Tapi gini, percuma dong kalau saya punya komisaris dan direksi perusahaan-perusahaan BUMN kalau hal-hal kecil harus kembali ke menteri lagi,"" imbuhnya.  ADVERTISEMENT   SCROLL TO CONTINUE WITH CONTENT   Ia mengatakan perannya sebagai seorang menteri BUMN lebih fokus kepada cakupan besar dan lebih luas. Erick mencontohkan salah satu fokusnya sekarang adalah bersih-bersih perusahaan pelat merah yang menyelewengkan dana pensiun (dapen). ""Jadi, saya lebih (ke) konteks besar. Tentu saya berharap isu-isu ini (judi online), direksi dan komisaris jadi bagian penting (memberantas),"" tutupnya. Pada awal September 2023 lalu, seorang pegawai BUMN di Jayapura berinisial RSSM ditetapkan sebagai tersangka kasus penggelapan dana nasabah Rp1,4 miliar. Pelaku diduga menggunakan uang tersebut untuk judi online. Tersangka diduga memakai modus mengirim uang dari nasabah yang baru ke rekening pribadinya. Lalu, uang tersebut disetor tersangka ke situs judi online.  ""Berdasarkan hasil pemeriksaan yang dilakukan oleh tim audit internal dari bank tersebut diperoleh hasil kerugian negara sebesar Rp1,1 miliar,"" kata Kasi Pidsus Kejaksaan Negeri (Kejari) Jayapura Marvie de Queljoe, dikutip dari detikcom. Polisi mengatakan total uang yang ditransfer ke rekening pelaku berjumlah Rp1,4 miliar. Namun, tersangka mengembalikan uang tersebut senilai Rp300 juta. Dalam kesempatan sama, Erick juga menanggapi soal peluang perusahaan pelat merah menguasai Hotel Sultan. Namun, ia tak berbicara banyak. Pasalnya, ia belum tahu lebih dalam soal desakan pengosongan Hotel Sultan yang sekarang masih dikuasai PT Indobuildco milik Pontjo Sutowo.   ""Saya enggak bisa komentar mengenai pengosongan (Hotel) Sultan karena saya belum tahu dan belum ada pembicaraan ke sana (peluang BUMN kuasai Hotel Sultan),"" katanya. ""Saya belum ada pembicaraan (peluang BUMN ambil alih Hotel Sultan). Jadi, saya tidak mau komentar yang saya belum tahu,"" sambung Erick. Terlepas dari pernyataan Erick, Pusat Pengelolaan Kompleks Gelora Bung Karno (PPKGBK) memasang spanduk khusus sore ini di Hotel Sultan. Pemasangan spanduk berwarna merah itu dilakukan petugas keamanan GBK dengan kawalan sejumlah aparat kepolisian. Spanduk itu bertuliskan 'Tanah Ini Aset Negara Milik Pemerintah Negara Republik Indonesia Berdasarkan HPL No.1/Gelora atas nama Sekretariat Negara RI c.q. PPKGBK dan telah dinyatakan sah oleh Putusan Peninjauan Kembali Mahkamah Agung No. 276/PK/Pdt/2011'. Pontjo memang masih kekeh mengelola tanah tempat berdirinya Hotel Sultan. Namun, pemerintah menyebut hak guna bangunan (HGB) PT Indobuildco sudah habis dan lahan tersebut kudu dikembalikan ke negara. [Gambas:Video CNN] ";04-10-2023;https://www.cnnindonesia.com/ekonomi/20231004202643-92-1007248/erick-minta-komisaris-direksi-bumn-berangus-virus-judi-online;"menteri badan usaha milik negara (bumn) erick thohir memerintahkan jajaran direksi hingga komisaris memberangus 'virus' judi online di tubuh perusahaan pelat merah. ""ya tentu saya prihatin, apalagi kalau sudah penipuan (penggelapan uang negara), ya ditangkap lah ya (pejabat bumn yang merugikan negara karena judi online), apalagi penipuan-penipuan. sekecil apapun itu penipuan,"" ujarnya kepada cnnindonesia.com di kantor transmedia, jakarta selatan, rabu (4/10). ""tapi gini, percuma dong kalau saya punya komisaris dan direksi perusahaan-perusahaan bumn kalau hal-hal kecil harus kembali ke menteri lagi,"" imbuhnya. ia mengatakan perannya sebagai seorang menteri bumn lebih fokus kepada cakupan besar dan lebih luas. erick mencontohkan salah satu fokusnya sekarang adalah bersih-bersih perusahaan pelat merah yang menyelewengkan dana pensiun (dapen). ""jadi, saya lebih (ke) konteks besar. tentu saya berharap isu-isu ini (judi online), direksi dan komisaris jadi bagian penting (memberantas),"" tutupnya. pada awal september 2023 lalu, seorang pegawai bumn di jayapura berinisial rssm ditetapkan sebagai tersangka kasus penggelapan dana nasabah rp1,4 miliar. pelaku diduga menggunakan uang tersebut untuk judi online. tersangka diduga memakai modus mengirim uang dari nasabah yang baru ke rekening pribadinya. lalu, uang tersebut disetor tersangka ke situs judi online. ""berdasarkan hasil pemeriksaan yang dilakukan oleh tim audit internal dari bank tersebut diperoleh hasil kerugian negara sebesar rp1,1 miliar,"" kata kasi pidsus kejaksaan negeri (kejari) jayapura marvie de queljoe, dikutip dari detikcom. polisi mengatakan total uang yang ditransfer ke rekening pelaku berjumlah rp1,4 miliar. namun, tersangka mengembalikan uang tersebut senilai rp300 juta. dalam kesempatan sama, erick juga menanggapi soal peluang perusahaan pelat merah menguasai hotel sultan. namun, ia tak berbicara banyak. pasalnya, ia belum tahu lebih dalam soal desakan pengosongan hotel sultan yang sekarang masih dikuasai pt indobuildco milik pontjo sutowo. ""saya enggak bisa komentar mengenai pengosongan (hotel) sultan karena saya belum tahu dan belum ada pembicaraan ke sana (peluang bumn kuasai hotel sultan),"" katanya. ""saya belum ada pembicaraan (peluang bumn ambil alih hotel sultan). jadi, saya tidak mau komentar yang saya belum tahu,"" sambung erick. terlepas dari pernyataan erick, pusat pengelolaan kompleks gelora bung karno (ppkgbk) memasang spanduk khusus sore ini di hotel sultan. pemasangan spanduk berwarna merah itu dilakukan petugas keamanan gbk dengan kawalan sejumlah aparat kepolisian. spanduk itu bertuliskan 'tanah ini aset negara milik pemerintah negara republik indonesia berdasarkan hpl no.1/gelora atas nama sekretariat negara ri c.q. ppkgbk dan telah dinyatakan sah oleh putusan peninjauan kembali mahkamah agung no. 276/pk/pdt/2011'. pontjo memang masih kekeh mengelola tanah tempat berdirinya hotel sultan. namun, pemerintah menyebut hak guna bangunan (hgb) pt indobuildco sudah habis dan lahan tersebut kudu dikembalikan ke negara. "
         Biang Kerok Rupiah Keok Lawan Dolar AS    ;"Nilai tukar rupiah terus melemah terhadap dolar Amerika Serikat (AS). Pada Rabu (27/9/2023) kemarin, nilai tukar mata uang Paman Sam tersebut menyentuh angka Rp 15.500. Menurut Kepala Departemen Pengelolaan Moneter Bank Indonesia (BI) Edi Susianto hampir semua mata uang di dunia melemah terhadap dolar AS. Pemicunya antara lain, pernyataan hawkish dari Federal Reverse System (Fed).      ADVERTISEMENT         SCROLL TO CONTINUE WITH CONTENT    ""Persepsi pelaku pasar bahwa The Fed masih akan menaikkan FFR (Federal Fund Right) minimal satu kali lagi. Selanjutnya akan higher for longer, di mana hal tersebut didorong juga adanya statement pejabat The Fed yang hawkish,"" ujar Edi kepada detikcom, Rabu (27/9/2023) kemarin. Kemudian, kondisi ekonomi Eropa dan China yang masih melemah, khususnya Eropa yang berpotensi terjadi stagflasi. Selain faktor global, melemahnya rupiah terhadap dolar AS juga dipicu kenaikan repatriasi dividen. Meski begitu, penawaran dan permintaan masih dalam kondisi seimbang. ""BI tentu selalu berada di pasar untuk memastikan keseimbangan supply-demand valas di pasar, dan kami melihat keseimbangan supply-demand di pasar masih terkendali,"" jelasnya. Sementara itu, Direktur PT Laba Forexindo Berjangka Ibrahim Assuaibi menilai penguatan dolar AS dipicu penghentian ekspor BBM dari Rusia ke Inggris dan Eropa. Hal tersebut membuat harga minyak mentah dunia semakin tinggi. ""Ada kemungkinan besar harga minyak mentah ini menyentuh US$ 100 per barel. Apalagi di bulan Desember memasuki musim dingin yang ekstrem,"" imbuhnya. Saat masuk musim dingin, kata dia kemungkinan besar kebutuhan untuk gas alam akan mengalami peningkatan, termasuk dari minyak mentah. Akibatnya, harga-harga minyak akan terus naik dan menyebabkan inflasi.";28-09-2023;https://finance.detik.com/moneter/d-6954320/biang-kerok-rupiah-keok-lawan-dolar-as;"nilai tukar rupiah terus melemah terhadap dolar amerika serikat (as). pada rabu (27/9/2023) kemarin, nilai tukar mata uang paman sam tersebut menyentuh angka rp 15.500. menurut kepala departemen pengelolaan moneter bank indonesia (bi) edi susianto hampir semua mata uang di dunia melemah terhadap dolar as. pemicunya antara lain, pernyataan hawkish dari federal reverse system (fed). ""persepsi pelaku pasar bahwa the fed masih akan menaikkan ffr (federal fund right) minimal satu kali lagi. selanjutnya akan higher for longer, di mana hal tersebut didorong juga adanya statement pejabat the fed yang hawkish,"" ujar edi kepada detikcom, rabu (27/9/2023) kemarin. kemudian, kondisi ekonomi eropa dan china yang masih melemah, khususnya eropa yang berpotensi terjadi stagflasi. selain faktor global, melemahnya rupiah terhadap dolar as juga dipicu kenaikan repatriasi dividen. meski begitu, penawaran dan permintaan masih dalam kondisi seimbang. ""bi tentu selalu berada di pasar untuk memastikan keseimbangan supply-demand valas di pasar, dan kami melihat keseimbangan supply-demand di pasar masih terkendali,"" jelasnya. sementara itu, direktur pt laba forexindo berjangka ibrahim assuaibi menilai penguatan dolar as dipicu penghentian ekspor bbm dari rusia ke inggris dan eropa. hal tersebut membuat harga minyak mentah dunia semakin tinggi. ""ada kemungkinan besar harga minyak mentah ini menyentuh us$ 100 per barel. apalagi di bulan desember memasuki musim dingin yang ekstrem,"" imbuhnya. saat masuk musim dingin, kata dia kemungkinan besar kebutuhan untuk gas alam akan mengalami peningkatan, termasuk dari minyak mentah. akibatnya, harga-harga minyak akan terus naik dan menyebabkan inflasi."
         Beredar Kabar Smartfren PHK Karyawan, Manajemen Buka Suara    ;"Beredar kabar bahwa PT Smartfren Telecom Tbk melakukan pemutusan hubungan kerja (PHK) kepada sejumlah karyawannya. Terkait kabar tersebut, Smartfren buka suara. Perusahaan telekomunikasi itu mengatakan saat ini pihaknya tengah melakukan beberapa inisiatif penajaman strategi bisnis, benchmarking dan perbaikan kinerja, seperti redefinisi tugas dan fungsi kerja. Hal-hal itu dilakukan guna meningkatkan daya saing. ""Hal ini sejalan dengan perkembangan industri yang menuntut perusahaan untuk senantiasa melakukan transformasi demi menunjang kelangsungan usaha,"" kata Director Investor Relations & Media Smartfren, Gisela Yenny Lesmana, dalam keterangannya kepada detikcom, Rabu (27/9/2023).      ADVERTISEMENT         SCROLL TO CONTINUE WITH CONTENT    Terkait kebijakan PHK, manajemen mengatakan telah melakukan dialog dengan para pekerja yang terdampak. Saat ini proses PHK tersebut disebut telah sesuai aturan yang berlaku. Namun, pihak Smartfren belum mengonfirmasi jumlah karyawan yang terdampak PHK. ""Kami sudah melakukan dialog dengan pekerja yang terdampak dengan selalu mengedepankan komunikasi dan musyawarah. Proses yang berjalan pun sudah sesuai dengan peraturan yang berlaku. Apabila ada ketidaksesuaian pendapat, maka perusahaan akan melakukan mediasi sesuai dengan mekanisme dan peraturan yang berlaku,"" jelasnya. Dewan Pimpinan Pusat Asosiasi Serikat Pekerja Indonesia (DPP ASPEK Indonesia), sebagai induk organisasi dari Serikat Karyawan Smartfren, mengungkap ada sebanyak 100 karyawan Smartfren terdampak PHK pada Agustus 2023. Menurut Presiden ASPEK Indonesia, Mirah Sumirat, berdasarkan laporan yang diterima PHK tersebut telah dilakukan sepihak dan massal diketahui masih akan berlanjut di tahun 2023, dan diperkirakan akan menelan korban mencapai sedikitnya 300 karyawan. Untuk itu, pihaknya meminta perhatian Menteri Ketenagakerjaan Republik Indonesia terkait laporan kasus pemutusan hubungan kerja (PHK) sepihak dan massal yang terjadi di PT Smartfren Telecom Tbk terhadap Pengurus, Anggota Serikat Karyawan Smartfren serta Karyawan PT Smartfren Telecom Tbk. Mirah mengungkapkan, PHK sepihak dan massal yang dilakukan manajemen PT Smartfren Telecom Tbk tidak memenuhi ketentuan peraturan perundang-undangan yang berlaku. Baik secara proses maupun terkait dengan hak-hak normatif yang wajib dibayarkan oleh perusahaan. ""Ironisnya para karyawan yang di-PHK, tidak mendapatkan hak-hak sesuai ketentuan perundangan yang berlaku, karena hanya diberikan kompensasi yang hanya diperhitungkan dari gaji pokok saja dan tidak memperhitungkan tunjangan lain yang bersifat tetap,"" tuturnya dalam keterangn tertulis. Menurutnya lagi, beberapa anggota Serikat Karyawan Smartfren yang di-PHK sepihak, telah menolak untuk di-PHK dan telah memberikan kuasa kepada DPP ASPEK Indonesia untuk diadvokasi kasusnya, baik terkait PHK maupun hak-hak normatif lainnya. Terkait kasus ini, DPP ASPEK Indonesia mengaku telah mengirim surat permohonan pertemuan kepada Direktur Utama dan Chief Executive Officer (CEO) PT Smartfren Telecom Tbk. ""Namun sampai saat ini, tidak ada tanggapan dari pihak manajemen PT Smartfren Telecom Tbk,"" tambah keterangan tersebut. Mirah mendesak Menteri Ketenagakerjaan untuk turun tangan memanggil Direksi PT Smartfren Telecom Tbk, agar manajemen PT Smartfren Telecom Tbk tidak melakukan PHK sepihak dan massal yang sewenang-wenang.  Lihat juga Video: Dana Rp 1,8 M untuk Karyawan Terdampak PHK Dikorupsi Dinsos Purwakarta  [Gambas:Video 20detik] ";27-09-2023;https://finance.detik.com/bursa-dan-valas/d-6952785/beredar-kabar-smartfren-phk-karyawan-manajemen-buka-suara;"beredar kabar bahwa pt smartfren telecom tbk melakukan pemutusan hubungan kerja (phk) kepada sejumlah karyawannya. terkait kabar tersebut, smartfren buka suara. perusahaan telekomunikasi itu mengatakan saat ini pihaknya tengah melakukan beberapa inisiatif penajaman strategi bisnis, benchmarking dan perbaikan kinerja, seperti redefinisi tugas dan fungsi kerja. hal-hal itu dilakukan guna meningkatkan daya saing. ""hal ini sejalan dengan perkembangan industri yang menuntut perusahaan untuk senantiasa melakukan transformasi demi menunjang kelangsungan usaha,"" kata director investor relations & media smartfren, gisela yenny lesmana, dalam keterangannya kepada detikcom, rabu (27/9/2023). terkait kebijakan phk, manajemen mengatakan telah melakukan dialog dengan para pekerja yang terdampak. saat ini proses phk tersebut disebut telah sesuai aturan yang berlaku. namun, pihak smartfren belum mengonfirmasi jumlah karyawan yang terdampak phk. ""kami sudah melakukan dialog dengan pekerja yang terdampak dengan selalu mengedepankan komunikasi dan musyawarah. proses yang berjalan pun sudah sesuai dengan peraturan yang berlaku. apabila ada ketidaksesuaian pendapat, maka perusahaan akan melakukan mediasi sesuai dengan mekanisme dan peraturan yang berlaku,"" jelasnya. dewan pimpinan pusat asosiasi serikat pekerja indonesia (dpp aspek indonesia), sebagai induk organisasi dari serikat karyawan smartfren, mengungkap ada sebanyak 100 karyawan smartfren terdampak phk pada agustus 2023. menurut presiden aspek indonesia, mirah sumirat, berdasarkan laporan yang diterima phk tersebut telah dilakukan sepihak dan massal diketahui masih akan berlanjut di tahun 2023, dan diperkirakan akan menelan korban mencapai sedikitnya 300 karyawan. untuk itu, pihaknya meminta perhatian menteri ketenagakerjaan republik indonesia terkait laporan kasus pemutusan hubungan kerja (phk) sepihak dan massal yang terjadi di pt smartfren telecom tbk terhadap pengurus, anggota serikat karyawan smartfren serta karyawan pt smartfren telecom tbk. mirah mengungkapkan, phk sepihak dan massal yang dilakukan manajemen pt smartfren telecom tbk tidak memenuhi ketentuan peraturan perundang-undangan yang berlaku. baik secara proses maupun terkait dengan hak-hak normatif yang wajib dibayarkan oleh perusahaan. ""ironisnya para karyawan yang di-phk, tidak mendapatkan hak-hak sesuai ketentuan perundangan yang berlaku, karena hanya diberikan kompensasi yang hanya diperhitungkan dari gaji pokok saja dan tidak memperhitungkan tunjangan lain yang bersifat tetap,"" tuturnya dalam keterangn tertulis. menurutnya lagi, beberapa anggota serikat karyawan smartfren yang di-phk sepihak, telah menolak untuk di-phk dan telah memberikan kuasa kepada dpp aspek indonesia untuk diadvokasi kasusnya, baik terkait phk maupun hak-hak normatif lainnya. terkait kasus ini, dpp aspek indonesia mengaku telah mengirim surat permohonan pertemuan kepada direktur utama dan chief executive officer (ceo) pt smartfren telecom tbk. ""namun sampai saat ini, tidak ada tanggapan dari pihak manajemen pt smartfren telecom tbk,"" tambah keterangan tersebut. mirah mendesak menteri ketenagakerjaan untuk turun tangan memanggil direksi pt smartfren telecom tbk, agar manajemen pt smartfren telecom tbk tidak melakukan phk sepihak dan massal yang sewenang-wenang. lihat juga video: dana rp 1,8 m untuk karyawan terdampak phk dikorupsi dinsos purwakarta "
