Title;Content;Date;URL;Cleaned Article
Kolaborasi Strategis Batumbu dan 3 Plaform untuk Meningkatkan Inklusi Keuangan;"Laporan Wartawan Tribunnews.com, Eko Sutriyanto TRIBUNNEWS.COM, JAKARTA - Batumbu menjalin sebuah kolaborasi strategis dengan platform LUNA, GrosirOne dan Siabos sebagai upaya inovasi dan berkolaborasi sehingga memberikan dampak positif bagi ekosistem Wira UMKM Batumbu. Komitmen tersebut terangkum dalam Tumbuseries yang bermanfaat sarana edukasi kepada Wira UMKM, TumbuSama merupakan kolaborasi bisnis sesama Wira UMKM Batumbu, TumbuTalk merupakan edukasi dalam bentuk berbagi antara Wira UMKM. Kemudian TumbuBijak merupakan kutipan pesan positif dari pelaku bisnis dan TumbuSehat merupakan aktivitas CSR Batumbu. Batumbu merupakan perusahaan Peer-To-Peer (P2P) Lending yang telah terdaftar dan diawasi oleh Otoritas Jasa Keuangan (OJK) sejak April 2019. Batumbu memediasi kemudahan akses layanan keuangan melalui pertemuan Penyedia Dana dan Wira UMKM yang membutuhkan pembiayaan dalam sebuah platform digital. ""Kolaborasi strategis ini berawal dari realita bahwa pada umumnya para Wira UMKM hanya berfokus pada peningkatan penjualan dan menomorduakan disiplin pencatatan transaksi bisnis yang lebih tertata dengan baik,"" kata Jenny Wiriyanto selaku CEO Batumbu dalam keterangan pers, Selasa (27/10/2020).  .recads_wrapper{height:134px;position:relative;margin:10px 0 30px;padding:10px 15px;overflow:hidden;box-shadow:0 0 10px rgb(0 0 0 / 20%);}.recads_title{margin-bottom:10px;font-size:16px;font-weight:700}.arjW-list{overflow-x:scroll;overflow-y:hidden;white-space:nowrap;width:auto;padding:10px 0;position:relative;display:flex;scroll-snap-type:x;flex-wrap:nowrap}.recads_item{scroll-snap-align:start;width:280px;flex:0 0 280px;margin-right:20px;display: flex;white-space: normal;gap: 10px;}.recads_item a {display:flex;white-space:normal;gap:10px;}.recads_image{position:relative;height:auto}.recads_image img{width:auto;height: 73px!important;max-width:165px!important;border-radius:8px}.article_datas_title{font-size:14px;font-weight:700;line-height:1.2;margin:0;overflow:hidden;display:-webkit-box;-webkit-line-clamp:4;-webkit-box-orient:vertical;}.arjW-img-overlay{position:absolute;z-index:3;bottom:8px;left:0;padding:0 0 0 10px}.arjW-img-overlay>img{width:auto;height: 16px!important;}.recads_image::after{z-index:2;position:absolute;top:50%;bottom:4px;left:0;right:0;content:'';background:linear-gradient(to top,#d6d6d6,transparent);width:100%;border-radius: 8px;}             BERITA REKOMENDASI           Dampak dari pencatatan bisnis yang tidak lengkap ini bisa mengakibatkan Wira UMKM sulit untuk mendapatkan pembiayaan yang disebabkan karena tidak adanya akses informasi yang mencerminkan perilaku, karakter dan pencatatan transaksi keuangan yang baik. Atas dasar itulah Batumbu menjalin kolaborasi strategis dengan beberapa penyedia platform di Indonesia yang memiliki kesamaan tujuan, untuk memberikan kemudahan dan menjadikan Wira UMKM Indonesia memiliki keunggulan kompetitif serta mendukung digitalisasi keuangan bagi Wira UMKM. Kolaborasi antara Batumbu dengan LUNA menawarkan solusi untuk mengoptimalkan operasional dan pelayanan dengan POS (Point Of Sale), system order dan pembayaran yang sudah terdigitalisasi dan telah di simplifikasi dengan berbasis teknologi. Kolaborasi ini makin lengkap karena didukung juga oleh GrosirOne yang memiliki visi untuk membuat efisiensi di bidang rantai pasok dengan teknologi dan layanan keuangan. Dalam prosesnya, GrosirOne mendigitalisasi supply chain untuk memastikan proses yang lebih lancar, aman, dan efisien untuk semua pihak. Satu lagi yang tidak kalah penting adalah kehadiran SiaBos dalam kolaborasi strategis ini, yang menjadi penyedia aplikasi pintar dalam mendigitalisasi pasar tradisional Indonesia untuk meningkatkan penjualan Wira UMKM dalam satu platform digital. Jenny berharap kolaborasi strategis yang dijalin dengan LUNA, GrosirOne, dan SiaBos, kami berharap untuk dapat menciptakan competitive advantage bagi Wira UMKM Indonesia. Dimulai dengan memberikan edukasi kepada para Wira UMKM agar terbiasa untuk disiplin dalam pencatatan bisnis dan pengolahan data menjadi informasi strategis. ""Kami ingin membawa mereka (Wira UMKM) ke dalam suatu kondisi yang tanpa mereka sadari bahwa mereka layak untuk mendapatkan pembiayaan karena pencatatan transaksi yang rapih mencerminkan perilaku dari bisnis itu sendiri,"" katanya. Batumbu sendiri berkomitmen tidak sekedar menyalurkan pinjaman, namun juga berkepentingan untuk membawa para Wira UMKM memiiliki kemampuan bekerja secara lebih efisien dan efektif, sehingga tercipta kemampuan untuk bersaing di kemudian hari.";27-10-2020;https://www.tribunnews.com/bisnis/2020/10/27/kolaborasi-strategis-batumbu-dan-3-plaform-untuk-meningkatkan-inklusi-keuangan;"laporan wartawan tribunnews.com, eko sutriyanto tribunnews.com, jakarta - batumbu menjalin sebuah kolaborasi strategis dengan platform luna, grosirone dan siabos sebagai upaya inovasi dan berkolaborasi sehingga memberikan dampak positif bagi ekosistem wira umkm batumbu. komitmen tersebut terangkum dalam tumbuseries yang bermanfaat sarana edukasi kepada wira umkm, tumbusama merupakan kolaborasi bisnis sesama wira umkm batumbu, tumbutalk merupakan edukasi dalam bentuk berbagi antara wira umkm. kemudian tumbubijak merupakan kutipan pesan positif dari pelaku bisnis dan tumbusehat merupakan aktivitas csr batumbu. batumbu merupakan perusahaan peer-to-peer (p2p) lending yang telah terdaftar dan diawasi oleh otoritas jasa keuangan (ojk) sejak april 2019. batumbu memediasi kemudahan akses layanan keuangan melalui pertemuan penyedia dana dan wira umkm yang membutuhkan pembiayaan dalam sebuah platform digital. ""kolaborasi strategis ini berawal dari realita bahwa pada umumnya para wira umkm hanya berfokus pada peningkatan penjualan dan menomorduakan disiplin pencatatan transaksi bisnis yang lebih tertata dengan baik,"" kata jenny wiriyanto selaku ceo batumbu dalam keterangan pers, selasa (27/10/2020). berita rekomendasi dampak dari pencatatan bisnis yang tidak lengkap ini bisa mengakibatkan wira umkm sulit untuk mendapatkan pembiayaan yang disebabkan karena tidak adanya akses informasi yang mencerminkan perilaku, karakter dan pencatatan transaksi keuangan yang baik. atas dasar itulah batumbu menjalin kolaborasi strategis dengan beberapa penyedia platform di indonesia yang memiliki kesamaan tujuan, untuk memberikan kemudahan dan menjadikan wira umkm indonesia memiliki keunggulan kompetitif serta mendukung digitalisasi keuangan bagi wira umkm. kolaborasi antara batumbu dengan luna menawarkan solusi untuk mengoptimalkan operasional dan pelayanan dengan pos (point of sale), system order dan pembayaran yang sudah terdigitalisasi dan telah di simplifikasi dengan berbasis teknologi. kolaborasi ini makin lengkap karena didukung juga oleh grosirone yang memiliki visi untuk membuat efisiensi di bidang rantai pasok dengan teknologi dan layanan keuangan. dalam prosesnya, grosirone mendigitalisasi supply chain untuk memastikan proses yang lebih lancar, aman, dan efisien untuk semua pihak. satu lagi yang tidak kalah penting adalah kehadiran siabos dalam kolaborasi strategis ini, yang menjadi penyedia aplikasi pintar dalam mendigitalisasi pasar tradisional indonesia untuk meningkatkan penjualan wira umkm dalam satu platform digital. jenny berharap kolaborasi strategis yang dijalin dengan luna, grosirone, dan siabos, kami berharap untuk dapat menciptakan competitive advantage bagi wira umkm indonesia. dimulai dengan memberikan edukasi kepada para wira umkm agar terbiasa untuk disiplin dalam pencatatan bisnis dan pengolahan data menjadi informasi strategis. ""kami ingin membawa mereka (wira umkm) ke dalam suatu kondisi yang tanpa mereka sadari bahwa mereka layak untuk mendapatkan pembiayaan karena pencatatan transaksi yang rapih mencerminkan perilaku dari bisnis itu sendiri,"" katanya. batumbu sendiri berkomitmen tidak sekedar menyalurkan pinjaman, namun juga berkepentingan untuk membawa para wira umkm memiiliki kemampuan bekerja secara lebih efisien dan efektif, sehingga tercipta kemampuan untuk bersaing di kemudian hari."
Indonesia’s Realization of Oil and Gas Production, Lifting in Q3 Decline Due to Coronavirus;JAKARTA, KOMPAS.com – Indonesia recorded a decline in the realization of oil and gas production and lifting in the third quarter of 2020 due to the Covid-19 pandemic. Upstream Oil and Gas Special Regulatory Taskforce (SKK Migas) head Dwi Soetjipto announced on Friday that from July to August 2020, the realization of oil production reached 710,000 barrels per day (bpd). Even though it was equivalent to 100.4 percent of the work program and budget target, the realization was down 4.71 percent from 745,100 bpd in the same period last year. Meanwhile, Dwi said, the realization of oil lifting until the third quarter reached 706,200 bpd, or down 5.37 percent from 746,300 bpd last year. Dwi said the difference between the production and lifting was because contractors (K3S) have stored the oil amid the low price of crude oil. “As the price remains low, many [contractors] are still holding back the oil production,” Dwi said in a virtual press conference on October 23. He went on to say that gas production and lifting have also declined. In the third quarter, the realization of gas production was 6.7 million standard cubic feet per day (mmscfd), or down 6.9 percent from 7.2 mmscfd in 2019. The gas lifting from July to September this year has decreased by 5.5 mmscfd from 5.9 mmscfd in the previous period. “We can see that the demand has decreased due to the Covid-19 pandemic,” Dwi said.He said that the realization of oil and gas production as per the third quarter reached 1.9 million barrels of oil equivalent per day (boepd) and the lifting reached 1.6 million boepd, respectively. (Writer: Rully R. Ramli | Editor: Erlangga Djumena) ;24-10-2020;https://go.kompas.com/read/2020/10/24/002405874/indonesias-realization-of-oil-and-gas-production-lifting-in-q3-decline-due-to;jakarta,indonesia recorded a decline in the realization of oil and gas production and lifting in the third quarter of 2020 due to the covid-19 pandemic. upstream oil and gas special regulatory taskforce (skk migas) head dwi soetjipto announced on friday that from july to august 2020, the realization of oil production reached 710,000 barrels per day (bpd). even though it was equivalent to 100.4 percent of the work program and budget target, the realization was down 4.71 percent from 745,100 bpd in the same period last year. meanwhile, dwi said, the realization of oil lifting until the third quarter reached 706,200 bpd, or down 5.37 percent from 746,300 bpd last year. dwi said the difference between the production and lifting was because contractors (k3s) have stored the oil amid the low price of crude oil. “as the price remains low, many [contractors] are still holding back the oil production,” dwi said in a virtual press conference on october 23. he went on to say that gas production and lifting have also declined. in the third quarter, the realization of gas production was 6.7 million standard cubic feet per day (mmscfd), or down 6.9 percent from 7.2 mmscfd in 2019. the gas lifting from july to september this year has decreased by 5.5 mmscfd from 5.9 mmscfd in the previous period. “we can see that the demand has decreased due to the covid-19 pandemic,” dwi said.he said that the realization of oil and gas production as per the third quarter reached 1.9 million barrels of oil equivalent per day (boepd) and the lifting reached 1.6 million boepd, respectively. (writer: rully r. ramli | editor: erlangga djumena) 
Jumlah Investor Pasar Modal Indonesia Masih Tertinggal dari Singapura dan Malaysia;"JAKARTA, KOMPAS.com - Pertumbuhan jumlah investor ritel pasar modal di tengah pandemi melesat mencapai 4,16 juta dari posisi tahun 2019 yang sebanyak 2,48 juta. Kendati demikian, jumlah investor Indonesia masih sangat rendah dibandingkan negara lainnya.  Direktur Eksekutif Departemen Pengembangan Pasar Keuangan Bank Indonesia, Donny Hutabarat mengatakan, dengan jumlah penduduk Indonesia usia produktif sebanyak 189 juta dan jumlah investor ritel di pasar modal 4,16 juta, maka rasionya hanya sekitar 2,2 persen. Rasio keterlibatan penduduk Indonesia yang berinvestasi di pasar modal kurang dari 5 persen, tertinggal jauh dari Amerika Serikat (AS) dengan rasio mencapai 55 persen, Singapura mencapai 26 persen, bahkan Malaysia mencapai 9 persen.  ""Dibandingkan negara lain itu kita masih sangat rendah. Angka 5 persen itu tidak cukup, dibandingkan dengan jumlah penduduk usia produktif, itu masih dibawah 5 persen, bahkan masih sekitar 2 persen-an,"" ungkapnya dalam acara Bareksa-Kontan-Ovo Fund Awards 2020, Rabu (21/10/2020) malam. Oleh sebab itu, Donny melihat masih ada ruang yang besar untuk mengembangkan investor ritel di Indonesia. Sehingga diharapkan kedepannya jumlah investor domestik terus bertambah, dan tak lagi bergantung pada investor asing.  Saat ini kepemilikan instrumen investasi di pasar modal oleh investor domestik sudah mencapai 58 persen, lebih tinggi dari kepemilikan investor asing.  ""Jadi potensi investor ritel di Indonesia itu masih sangat tinggi. Ini memang jadi sasaran untuk penyeimbang struktur investor pasar keuangan kita, jadi tidak terlalu mengandalkan investor asing,"" jelasnya.  Ia mengatakan, tingginya keterlibatan penduduk dalam investasi di pasar modal sangat penting untuk menekan gejolak akibat keluarnya investor asing di tengah pelemahan ekonomi. Seperti pada kondisi pandemi Covid-19 tahun ini, banyak investor asing yang keluar dari pasar modal Indonesia karena perekonomian nasional yang terus melemah. Tapi tekanan pada tahun ini tak sebesar pada krisis keuangan pada tahun 2008-2009.  Donny menjelaskan, pada tahun 2008-2009 jumlah investor domestik masih kecil dan tak mendominasi pasar modal, alhasil ketika terjadi gejolak ekonomi global Indeks Harga Saham Gabungan (IHSG) anjlok 60-70 persen karena perginya investor asing.  ""Tapi pada tahun ini, itu kemarin (IHSG) turun sekitar 20 persen. Ini menunjukkan resiliensi dari investor domestik itu nyata, jadi bisa menekan gejolak yang ditimbulkan investor asing,"" kata dia.  Oleh sebab itu, Donny menekankan, pentingnya untuk meningkatkan jumlah penduduk yang berinvetasi di pasar modal. Ia meminta, untuk semakin banyak masyarakat yang masuk ke pasar modal sehingga berdampak pada ketahanan ekonomi.  ""Jadi kampanyenya yaitu mulai dari investor di negeri sendiri dan mulai dari diri sendiri,"" tutupnya.  ";22-10-2020;https://money.kompas.com/read/2020/10/22/103000226/jumlah-investor-pasar-modal-indonesia-masih-tertinggal-dari-singapura-dan?page=all;"jakarta,pertumbuhan jumlah investor ritel pasar modal di tengah pandemi melesat mencapai 4,16 juta dari posisi tahun 2019 yang sebanyak 2,48 juta. kendati demikian, jumlah investor indonesia masih sangat rendah dibandingkan negara lainnya. direktur eksekutif departemen pengembangan pasar keuangan bank indonesia, donny hutabarat mengatakan, dengan jumlah penduduk indonesia usia produktif sebanyak 189 juta dan jumlah investor ritel di pasar modal 4,16 juta, maka rasionya hanya sekitar 2,2 persen. rasio keterlibatan penduduk indonesia yang berinvestasi di pasar modal kurang dari 5 persen, tertinggal jauh dari amerika serikat (as) dengan rasio mencapai 55 persen, singapura mencapai 26 persen, bahkan malaysia mencapai 9 persen. ""dibandingkan negara lain itu kita masih sangat rendah. angka 5 persen itu tidak cukup, dibandingkan dengan jumlah penduduk usia produktif, itu masih dibawah 5 persen, bahkan masih sekitar 2 persen-an,"" ungkapnya dalam acara bareksa-kontan-ovo fund awards 2020, rabu (21/10/2020) malam. oleh sebab itu, donny melihat masih ada ruang yang besar untuk mengembangkan investor ritel di indonesia. sehingga diharapkan kedepannya jumlah investor domestik terus bertambah, dan tak lagi bergantung pada investor asing. saat ini kepemilikan instrumen investasi di pasar modal oleh investor domestik sudah mencapai 58 persen, lebih tinggi dari kepemilikan investor asing. ""jadi potensi investor ritel di indonesia itu masih sangat tinggi. ini memang jadi sasaran untuk penyeimbang struktur investor pasar keuangan kita, jadi tidak terlalu mengandalkan investor asing,"" jelasnya. ia mengatakan, tingginya keterlibatan penduduk dalam investasi di pasar modal sangat penting untuk menekan gejolak akibat keluarnya investor asing di tengah pelemahan ekonomi. seperti pada kondisi pandemi covid-19 tahun ini, banyak investor asing yang keluar dari pasar modal indonesia karena perekonomian nasional yang terus melemah. tapi tekanan pada tahun ini tak sebesar pada krisis keuangan pada tahun 2008-2009. donny menjelaskan, pada tahun 2008-2009 jumlah investor domestik masih kecil dan tak mendominasi pasar modal, alhasil ketika terjadi gejolak ekonomi global indeks harga saham gabungan (ihsg) anjlok 60-70 persen karena perginya investor asing. ""tapi pada tahun ini, itu kemarin (ihsg) turun sekitar 20 persen. ini menunjukkan resiliensi dari investor domestik itu nyata, jadi bisa menekan gejolak yang ditimbulkan investor asing,"" kata dia. oleh sebab itu, donny menekankan, pentingnya untuk meningkatkan jumlah penduduk yang berinvetasi di pasar modal. ia meminta, untuk semakin banyak masyarakat yang masuk ke pasar modal sehingga berdampak pada ketahanan ekonomi. ""jadi kampanyenya yaitu mulai dari investor di negeri sendiri dan mulai dari diri sendiri,"" tutupnya. "
Curhat Lo Kheng Hong Soal Istri yang Dominan dalam Keuangan Keluarga ;" JAKARTA, KOMPAS.com – Salah seorang investor pasar modal sukses, Lo Kheng Hong menceritakan bagaimana peran istrinya dalam mengelola keuangan keluarga sehingga ia bisa sukses disejajarkan dengan Warren Buffett saat ini.  Lo mengatakan, sikap istrinya yang memberikan kebebasan kepadanya untuk mengelola keuangan adalah kunci kesuksesannya di pasar modal. Dia bersyukur, istrinya tidak dominan mengenai keuangan, sehingga ia bisa berusaha menggali potensi keuntungan di pasar modal.  “Mengenai pasangan, saya bersukur sekali istri saya sangat percaya. Andai istri saya tidak mempercayakan saya, mungkin saya akan menjadi suami yang bodoh,” kata Lo dalam virtual konferensi Capital Market Summit &amp; Expo, Sabtu (24/10/2020).  Dia bilang, istri yang dominan dalam keuangan bisa membuat dirinya bodoh karena usaha apapun yang ingin dilakukan tentunya akan sulit.  “Ibu-ibu yang memegang uang keluarga, akan membuat si bapak ini menjadi bodoh, karena apapun mau usaha tidak diberikan, coba kalau istri saya dominan, mungkin saya tidak seperti ini,” tegas dia.  Lo menjelaskan, proses memahami pasar modal bukan waktu yang singkat. Sebagai seorang yang berpendidikan sastra, awal menjadi investor ia sangat tidak memahami investasi dan ekonomi. Ia pun kerap mengalami kegagalan ketika mulai berinvestasi.  Dari kegagalan membuat ia belajar mengenal dan memahami pasar modal, hingga ia sukses saat ini. Di sisi lain, sebagai seorang investor sukses, Lo sangat mengidolakan sektor komoditas. Menurut dia, sektor komoditas merupakan sektor yang paling cepat bullish ketika harganya terdorong turun.  ";26-10-2020;https://money.kompas.com/read/2020/10/26/161200426/curhat-lo-kheng-hong-soal-istri-yang-dominan-dalam-keuangan-keluarga-?page=all;jakarta,salah seorang investor pasar modal sukses, lo kheng hong menceritakan bagaimana peran istrinya dalam mengelola keuangan keluarga sehingga ia bisa sukses disejajarkan dengan warren buffett saat ini. lo mengatakan, sikap istrinya yang memberikan kebebasan kepadanya untuk mengelola keuangan adalah kunci kesuksesannya di pasar modal. dia bersyukur, istrinya tidak dominan mengenai keuangan, sehingga ia bisa berusaha menggali potensi keuntungan di pasar modal. “mengenai pasangan, saya bersukur sekali istri saya sangat percaya. andai istri saya tidak mempercayakan saya, mungkin saya akan menjadi suami yang bodoh,” kata lo dalam virtual konferensi capital market summit expo, sabtu (24/10/2020). dia bilang, istri yang dominan dalam keuangan bisa membuat dirinya bodoh karena usaha apapun yang ingin dilakukan tentunya akan sulit. “ibu-ibu yang memegang uang keluarga, akan membuat si bapak ini menjadi bodoh, karena apapun mau usaha tidak diberikan, coba kalau istri saya dominan, mungkin saya tidak seperti ini,” tegas dia. lo menjelaskan, proses memahami pasar modal bukan waktu yang singkat. sebagai seorang yang berpendidikan sastra, awal menjadi investor ia sangat tidak memahami investasi dan ekonomi. ia pun kerap mengalami kegagalan ketika mulai berinvestasi. dari kegagalan membuat ia belajar mengenal dan memahami pasar modal, hingga ia sukses saat ini. di sisi lain, sebagai seorang investor sukses, lo sangat mengidolakan sektor komoditas. menurut dia, sektor komoditas merupakan sektor yang paling cepat bullish ketika harganya terdorong turun. 
