Title;Content;Date;URL;Cleaned Article
             Lo Kheng Hong Borong Saham BMTR, Masih Menarik Gak Sahamnya?            ;Jakarta, CNBC Indonesia - Investor kenamaan Lo Kheng Hong, yang dijuluki Warren Buffet-nya Indonesia, resmi membeli saham emiten Grup MNC, yakni PT Global Mediacom Tbk (BMTR). BMTR adalah induk usaha dari PT Media Nusantara Citra Tbk (MNCN) dan PT MNC Vision Networks Tbk. (IPTV). Data pemegang saham yang dipublikasikan Kustodian Sentral Efek Indonesia (KSEI) di situs Bursa Efek Indonesia (BEI) menunjukkan, Lo Kheng Hong membeli sebanyak 942.184.700 saham BMTR atau mewakili sebanyak 6,14% saham, tercatat per 14 Agustus 2020, dari sebelumnya nihil. Pembelian itu terbagi atas enam kali tahapan yakni 4.591.700 saham, 6.900.000 saham, 100 saham, 52.845.600 sahan, 177.747.400 saham, dan 700.000.000 saham. Hanya saja tidak disebutkan pada harga berapa. Saat dihubungi pada Senin (17/8/2020), Lo enggan membeberkan alasan membeli saham BMTR, ia hanya memberikan ucapan HUT ke-75 RI. Jika diasumsikan harga rata-rata saham BMTR sepekan di level Rp 214/saham, maka diperkirakan dana yang dikucurkan Lo Kheng bisa mencapai Rp 227 miliar. Dalam pengumuman KSEI tersebut, disebutkan pula kepemilikan saham Lo Kheng Hong di PT Petrosea Tbk (PTRO) sebanyak 14,97% atau 150.964.100 saham. Pembelian saham BMTR ini menjadi kenyataan setelah pekan lalu rumor Lo Kheng 'merapat' MNC ramai di pelaku pasar. Rumor tersebut bahkan sempat mengerek saham-saham Grup MNC terbang. Rumor itu berawal dari sebuah foto Lo Kheng Hong yang sedang berpose santai di belakang sebuah latar gambar kutipan dari Chairman MNC Group Hary Tanoesoedibjo, salah satu crazy rich Indonesia. Harga saham Hanya saja, ada perdagangan Jumat lalu, saham BMTR justru ambles 6,45% di level Rp 232/saham, meskipun secara sepekan saham BMTR meroket hingga 14,85% akibat rumor pasar tersebut. Saham BMTR ditransaksikan pekan lalu sebanyak Rp 43,95 miliar dengan volume perdagangan 182,29 juta saham dan kapitalisasi pasar Rp 3,56 triliun. Dalam sebulan terakhir saham BMTR naik 12,62% tapi secara year to date saham BMTR minus 33,33%. Investor asing pada Jumat lalu keluar dari saham BMTR Rp 1 miliar, dan sebulan terakhir investor asing net sell Rp 208,10 miliar. Lo Kheng Hong dikenal sebagai salah satu investor bertipe value investing (berbasis nilai) di BEI dan sukses. Bahkan dia dijuluki Warren Buffet-nya Indonesia karena sudah meraup untung dengan memilih saham-saham dengan fundamental baik dan valuasi yang murah. Dia memiliki beberapa saham saat ini, terutama di Grup Indika Energy. Di PT Mitrabahtera Segara Sejati Tbk. (MBSS), anak usaha PT Indika Energy Tbk (INDY), Lo Kheng Hong memiliki sebanyak 97.102.000 saham atau sebesar 5,55%, sementara di anak usaha Indika Energy lainnya yakni Petrosea, dia punya sebesar 13,67% saham per Juni 2019 sebelum akhirnya bertambah per 14 Agustus 2020. Sementara itu, pada Juni 2020, pemegang saham BMTR adalah PT MNC Investama Tbk (BHIT) sebesar 49,94%, dan investor publik 50,06%. Secara kinerja, BMTR mencetak pendapatan pada semester I-2020 sebesar Rp 5,86 triliun, turun 7,84% dibandingkan pendapatan periode yang sama tahun lalu Rp 6,36 triliun. Penurunan ini terjadi seiring dengan pendapatan iklan non digital atau iklan konvensional yang turun, padahal lini bisnis ini menjadi kontributor utama perseroan. Pendapatan yang berasal dari MNCN ini terkoreksi hingga 13,51% secara year on year menjadi Rp 3,20 triliun. Laba bersih BMTR pada semester I-2020 tercatat turun 7,71% menjadi Rp 551,66 miliar dari yang sebelumnya Rp 597,35 miliar. Sebelumnya BMTR sudah menetapkan harga pelaksanaan private placement atau Penambahan Modal Tanpa Melalui Hak Memesan Efek Terlebih Dahulu (PMTHMETD) sebesar Rp 200/saham.;18-08-2020;https://www.cnbcindonesia.com/market/20200818073746-17-180389/lo-kheng-hong-borong-saham-bmtr-masih-menarik-gak-sahamnya;investor kenamaan lo kheng hong, yang dijuluki warren buffet-nya indonesia, resmi membeli saham emiten grup mnc, yakni pt global mediacom tbk (bmtr). bmtr adalah induk usaha dari pt media nusantara citra tbk (mncn) dan pt mnc vision networks tbk. (iptv). data pemegang saham yang dipublikasikan kustodian sentral efek indonesia (ksei) di situs bursa efek indonesia (bei) menunjukkan, lo kheng hong membeli sebanyak 942.184.700 saham bmtr atau mewakili sebanyak 6,14% saham, tercatat per 14 agustus 2020, dari sebelumnya nihil. pembelian itu terbagi atas enam kali tahapan yakni 4.591.700 saham, 6.900.000 saham, 100 saham, 52.845.600 sahan, 177.747.400 saham, dan 700.000.000 saham. hanya saja tidak disebutkan pada harga berapa. saat dihubungi pada senin (17/8/2020), lo enggan membeberkan alasan membeli saham bmtr, ia hanya memberikan ucapan hut ke-75 ri. jika diasumsikan harga rata-rata saham bmtr sepekan di level rp 214/saham, maka diperkirakan dana yang dikucurkan lo kheng bisa mencapai rp 227 miliar. dalam pengumuman ksei tersebut, disebutkan pula kepemilikan saham lo kheng hong di pt petrosea tbk (ptro) sebanyak 14,97% atau 150.964.100 saham. pembelian saham bmtr ini menjadi kenyataan setelah pekan lalu rumor lo kheng 'merapat' mnc ramai di pelaku pasar. rumor tersebut bahkan sempat mengerek saham-saham grup mnc terbang. rumor itu berawal dari sebuah foto lo kheng hong yang sedang berpose santai di belakang sebuah latar gambar kutipan dari chairman mnc group hary tanoesoedibjo, salah satu crazy rich indonesia. harga saham hanya saja, ada perdagangan jumat lalu, saham bmtr justru ambles 6,45% di level rp 232/saham, meskipun secara sepekan saham bmtr meroket hingga 14,85% akibat rumor pasar tersebut. saham bmtr ditransaksikan pekan lalu sebanyak rp 43,95 miliar dengan volume perdagangan 182,29 juta saham dan kapitalisasi pasar rp 3,56 triliun. dalam sebulan terakhir saham bmtr naik 12,62% tapi secara year to date saham bmtr minus 33,33%. investor asing pada jumat lalu keluar dari saham bmtr rp 1 miliar, dan sebulan terakhir investor asing net sell rp 208,10 miliar. lo kheng hong dikenal sebagai salah satu investor bertipe value investing (berbasis nilai) di bei dan sukses. bahkan dia dijuluki warren buffet-nya indonesia karena sudah meraup untung dengan memilih saham-saham dengan fundamental baik dan valuasi yang murah. dia memiliki beberapa saham saat ini, terutama di grup indika energy. di pt mitrabahtera segara sejati tbk. (mbss), anak usaha pt indika energy tbk (indy), lo kheng hong memiliki sebanyak 97.102.000 saham atau sebesar 5,55%, sementara di anak usaha indika energy lainnya yakni petrosea, dia punya sebesar 13,67% saham per juni 2019 sebelum akhirnya bertambah per 14 agustus 2020. sementara itu, pada juni 2020, pemegang saham bmtr adalah pt mnc investama tbk (bhit) sebesar 49,94%, dan investor publik 50,06%. secara kinerja, bmtr mencetak pendapatan pada semester i-2020 sebesar rp 5,86 triliun, turun 7,84% dibandingkan pendapatan periode yang sama tahun lalu rp 6,36 triliun. penurunan ini terjadi seiring dengan pendapatan iklan non digital atau iklan konvensional yang turun, padahal lini bisnis ini menjadi kontributor utama perseroan. pendapatan yang berasal dari mncn ini terkoreksi hingga 13,51% secara year on year menjadi rp 3,20 triliun. laba bersih bmtr pada semester i-2020 tercatat turun 7,71% menjadi rp 551,66 miliar dari yang sebelumnya rp 597,35 miliar. sebelumnya bmtr sudah menetapkan harga pelaksanaan private placement atau penambahan modal tanpa melalui hak memesan efek terlebih dahulu (pmthmetd) sebesar rp 200/saham.
             Rogoh Rp 24 M, Bukit Asam Bangun 3 GOR Megah di Sumsel            ;PT Bukit Asam siapkan investasi senilai Rp 24 miliar untuk membangun 3 Gedung Olahraga (GOR) sekaligus di Sumatera Selatan. Hari Jumat  (21/8/2020) lalu menjadi momen penting peletakan batu pertama dari 3 GOR megah yang masing-masing berada di Kota Baru Selatan dan Tebat Sari Ogan Komering Ulu masing-masing senilai Rp 10 miliar, serta di Lubuk Raja senilai Rp 4 miliar. GOR Kota Baru Selatan dengan investasi senilai Rp 10 M ini berdiri di atas lahan 22.500 m2 dan mulai dibangun Agustus ini, rencananya GOR mulai bisa difungsikan pada April 2021. GOR yang berada di OKU Induk dengan nilai investasi Rp 4 miliar dibangun sejak Juni lalu dan diperkirakan mulai bisa digunakan masyarakat pada Februari 2021. Sekretaris Perusahaan PT Bukit Asam Tbk (PTBA) Apollonius Andwie mengatakan pembangunan 3 GOR ini merupakan wujud komitmen PTBA untuk membangun hubungan harmonis di tengah lingkungan yang lestari dan memberi manfaat seluas-luasnya untuk masyarakat. (Dok.PTBA);23-08-2020;https://www.cnbcindonesia.com/market/20200823164004-18-181346/rogoh-rp-24-m-bukit-asam-bangun-3-gor-megah-di-sumsel;pt bukit asam siapkan investasi senilai rp 24 miliar untuk membangun 3 gedung olahraga (gor) sekaligus di sumatera selatan. hari jumat (21/8/2020) lalu menjadi momen penting peletakan batu pertama dari 3 gor megah yang masing-masing berada di kota baru selatan dan tebat sari ogan komering ulu masing-masing senilai rp 10 miliar, serta di lubuk raja senilai rp 4 miliar. gor kota baru selatan dengan investasi senilai rp 10 m ini berdiri di atas lahan 22.500 m2 dan mulai dibangun agustus ini, rencananya gor mulai bisa difungsikan pada april 2021. gor yang berada di oku induk dengan nilai investasi rp 4 miliar dibangun sejak juni lalu dan diperkirakan mulai bisa digunakan masyarakat pada februari 2021. sekretaris perusahaan pt bukit asam tbk (ptba) apollonius andwie mengatakan pembangunan 3 gor ini merupakan wujud komitmen ptba untuk membangun hubungan harmonis di tengah lingkungan yang lestari dan memberi manfaat seluas-luasnya untuk masyarakat. (dok.ptba)
             Terkuak! Ini Alasan Lo Kheng Hong Borong 942 Juta Saham BMTR            ;"Jakarta, CNBC Indonesia - Investor kenamaan Lo Kheng Hong, yang dijuluki Warren Buffet-nya Indonesia, akhirnya benar-benar membeli saham salah satu emiten Grup MNC, yakni PT Global Mediacom Tbk (BMTR), sebagaimana rumor yang ramai diperbincangkan pelaku pasar sejak pekan lalu. Kabar ini langsung membuat saham BMTR pada perdagangan sesi I, Selasa (18/8/2020) melesat memimpin top gainers di Bursa Efek Indonesia (BEI). Data perdagangan mencatat, penutupan sesi I, saham BMTR melesat 25% di level Rp 290/saham dengan nilai transaksi Rp 92,60 miliar dan volume perdagangan 330,86 juta saham. Saham BMTR juga menyentuh batas atas maksimal kenaikan alias auto reject atas (ARA) yakni 25%. BMTR adalah induk usaha dari PT Media Nusantara Citra Tbk (MNCN) dan PT MNC Vision Networks Tbk. (IPTV). Selain saham BMTR yang melesat, saham IPTV juga menguat 3,90% di level Rp 320/saham pada perdagangan sesi I, sementara saham MNCN naik 3,98% di posisi Rp 915/saham. Data pemegang saham yang dipublikasikan Kustodian Sentral Efek Indonesia (KSEI) di situs Bursa Efek Indonesia (BEI) menunjukkan, Lo Kheng Hong memang membeli sebanyak 942.184.700 saham BMTR atau mewakili sebanyak 6,14% saham, tercatat per 14 Agustus 2020, dari sebelumnya nihil. Pembelian itu terbagi atas enam kali tahapan yakni 4.591.700 saham, 6.900.000 saham, 100 saham, 52.845.600 sahan, 177.747.400 saham, dan 700.000.000 saham. Jika diasumsikan harga rata-rata saham BMTR sepekan lalu di level Rp 214/saham, maka diperkirakan dana yang dikucurkan Lo Kheng bisa mencapai Rp 227 miliar. Lantas apa alasan Lo Kheng Hong memburu saham BMTR? ""BMTR perusahaan yang bagus, di tengah Pandemi masih bisa membukukan laba Rp 551 miliar,"" kata Lo Kheng Hong yang juga memegang saham PT Petrosea Tbk (PTRO) ini, kepada CNBC Indonesia, Selasa (18/8/2020). ""Valuasi [BMTR] juga murah,"" jelasnya. Lo Kheng Hong menjelaskan nilai buku per saham BMTR Rp 744/saham, sementara price earning ratio (PER) BMTR sebanyak 4 kali. ""Saya mempelajari laporan keuangan BMTR, sebelum membeli,"" katanya sembari memberikan softcopy laporan keuangan BMTR per Juni 2020. Nilai buku per saham atau Book Value Per Share (BVPS) adalah jumlah rupiah yang menjadi milik tiap-tiap saham dalam modal perusahaan. Book value per share dan pendapatan per saham (Earnings Per Share/EPS) digunakan sebagai salah satu alat pengukuran terhadap kemampuan perusahaan. Sementara PER adalah rasio harga saham perusahaan terhadap pendapatan per saham perusahaan. PER dihasilkan dari harga saham dibagi laba per saham. Semakin tinggi nilai PER, berarti harga saham perusahaan tersebut semakin mahal, dan sebaliknya. Mengacu laporan keuangan Juni 2020, BMTR mencetak pendapatan pada semester I-2020 sebesar Rp 5,86 triliun, turun 7,84% dibandingkan pendapatan periode yang sama tahun lalu Rp 6,36 triliun. Penurunan ini terjadi seiring dengan pendapatan iklan non digital atau iklan konvensional yang turun, padahal lini bisnis ini menjadi kontributor utama perseroan. Pendapatan yang berasal dari MNCN ini terkoreksi hingga 13,51% secara year on year menjadi Rp 3,20 triliun. Laba bersih BMTR pada semester I-2020 tercatat turun 7,71% menjadi Rp 551,66 miliar dari yang sebelumnya Rp 597,35 miliar. Lo Kheng Hong dikenal sebagai salah satu investor bertipe value investing (berbasis nilai) di BEI dan sukses. Bahkan dia dijuluki Warren Buffet-nya Indonesia karena sudah meraup untung dengan memilih saham-saham dengan fundamental baik dan valuasi yang murah. Dia memiliki beberapa saham saat ini, terutama di Grup Indika Energy. Di PT Mitrabahtera Segara Sejati Tbk. (MBSS), anak usaha PT Indika Energy Tbk (INDY), Lo Kheng Hong memiliki sebanyak 97.102.000 saham atau sebesar 5,55%, sementara di anak usaha Indika Energy lainnya yakni Petrosea, dia punya sebesar 13,67% saham per Juni 2019 sebelum akhirnya bertambah per 14 Agustus 2020. ";18-08-2020;https://www.cnbcindonesia.com/market/20200818112837-17-180457/terkuak-ini-alasan-lo-kheng-hong-borong-942-juta-saham-bmtr;"investor kenamaan lo kheng hong, yang dijuluki warren buffet-nya indonesia, akhirnya benar-benar membeli saham salah satu emiten grup mnc, yakni pt global mediacom tbk (bmtr), sebagaimana rumor yang ramai diperbincangkan pelaku pasar sejak pekan lalu. kabar ini langsung membuat saham bmtr pada perdagangan sesi i, selasa (18/8/2020) melesat memimpin top gainers di bursa efek indonesia (bei). data perdagangan mencatat, penutupan sesi i, saham bmtr melesat 25% di level rp 290/saham dengan nilai transaksi rp 92,60 miliar dan volume perdagangan 330,86 juta saham. saham bmtr juga menyentuh batas atas maksimal kenaikan alias auto reject atas (ara) yakni 25%. bmtr adalah induk usaha dari pt media nusantara citra tbk (mncn) dan pt mnc vision networks tbk. (iptv). selain saham bmtr yang melesat, saham iptv juga menguat 3,90% di level rp 320/saham pada perdagangan sesi i, sementara saham mncn naik 3,98% di posisi rp 915/saham. data pemegang saham yang dipublikasikan kustodian sentral efek indonesia (ksei) di situs bursa efek indonesia (bei) menunjukkan, lo kheng hong memang membeli sebanyak 942.184.700 saham bmtr atau mewakili sebanyak 6,14% saham, tercatat per 14 agustus 2020, dari sebelumnya nihil. pembelian itu terbagi atas enam kali tahapan yakni 4.591.700 saham, 6.900.000 saham, 100 saham, 52.845.600 sahan, 177.747.400 saham, dan 700.000.000 saham. jika diasumsikan harga rata-rata saham bmtr sepekan lalu di level rp 214/saham, maka diperkirakan dana yang dikucurkan lo kheng bisa mencapai rp 227 miliar. lantas apa alasan lo kheng hong memburu saham bmtr? ""bmtr perusahaan yang bagus, di tengah pandemi masih bisa membukukan laba rp 551 miliar,"" kata lo kheng hong yang juga memegang saham pt petrosea tbk (ptro) ini, kepada cnbc indonesia, selasa (18/8/2020). ""valuasi [bmtr] juga murah,"" jelasnya. lo kheng hong menjelaskan nilai buku per saham bmtr rp 744/saham, sementara price earning ratio (per) bmtr sebanyak 4 kali. ""saya mempelajari laporan keuangan bmtr, sebelum membeli,"" katanya sembari memberikan softcopy laporan keuangan bmtr per juni 2020. nilai buku per saham atau book value per share (bvps) adalah jumlah rupiah yang menjadi milik tiap-tiap saham dalam modal perusahaan. book value per share dan pendapatan per saham (earnings per share/eps) digunakan sebagai salah satu alat pengukuran terhadap kemampuan perusahaan. sementara per adalah rasio harga saham perusahaan terhadap pendapatan per saham perusahaan. per dihasilkan dari harga saham dibagi laba per saham. semakin tinggi nilai per, berarti harga saham perusahaan tersebut semakin mahal, dan sebaliknya. mengacu laporan keuangan juni 2020, bmtr mencetak pendapatan pada semester i-2020 sebesar rp 5,86 triliun, turun 7,84% dibandingkan pendapatan periode yang sama tahun lalu rp 6,36 triliun. penurunan ini terjadi seiring dengan pendapatan iklan non digital atau iklan konvensional yang turun, padahal lini bisnis ini menjadi kontributor utama perseroan. pendapatan yang berasal dari mncn ini terkoreksi hingga 13,51% secara year on year menjadi rp 3,20 triliun. laba bersih bmtr pada semester i-2020 tercatat turun 7,71% menjadi rp 551,66 miliar dari yang sebelumnya rp 597,35 miliar. lo kheng hong dikenal sebagai salah satu investor bertipe value investing (berbasis nilai) di bei dan sukses. bahkan dia dijuluki warren buffet-nya indonesia karena sudah meraup untung dengan memilih saham-saham dengan fundamental baik dan valuasi yang murah. dia memiliki beberapa saham saat ini, terutama di grup indika energy. di pt mitrabahtera segara sejati tbk. (mbss), anak usaha pt indika energy tbk (indy), lo kheng hong memiliki sebanyak 97.102.000 saham atau sebesar 5,55%, sementara di anak usaha indika energy lainnya yakni petrosea, dia punya sebesar 13,67% saham per juni 2019 sebelum akhirnya bertambah per 14 agustus 2020. "
             Inggris Turun Tangan, Tengahi Konflik Israel-Palestina            ;"Jakarta, CNBC Indonesia - Menteri Luar Negeri Inggris Dominic Raab bertemu dengan mitra nya dari Israel Gabi Ashkenazi di Yerusalem pada hari Selasa. Sebelumnya Raab telah tiba di Israel pada hari Senin untuk pertemuan dengan para pejabat Israel dan Palestina. Pertemuan itu dalam upaya ""mendesak dialog baru"" dan merundingkan solusi Israel dan Palestina yang terlibat konflik. Simak informasi selengkapnya di program Evening Up CNBC Indonesia (Selasa, 25/08/2020) berikut ini.";25-08-2020;https://www.cnbcindonesia.com/news/20200825191037-8-181954/inggris-turun-tangan-tengahi-konflik-israel-palestina;"jakarta, cnbc indonesia - menteri luar negeri inggris dominic raab bertemu dengan mitra nya dari israel gabi ashkenazi di yerusalem pada hari selasa. sebelumnya raab telah tiba di israel pada hari senin untuk pertemuan dengan para pejabat israel dan palestina. pertemuan itu dalam upaya ""mendesak dialog baru"" dan merundingkan solusi israel dan palestina yang terlibat konflik. simak informasi selengkapnya di program evening up cnbc indonesia (selasa, 25/08/2020) berikut ini."
             Habis Diborong Lo Kheng Hong, Saham Grup MNC Ngamuk Parah!            ;Jakarta, CNBC Indonesia - Investor kenamaan Lo Kheng Hong, yang dijuluki Warren Buffett-nya Indonesia, resmi membeli saham emiten Grup MNC, yakni PT Global Mediacom Tbk (BMTR). Sontak kabar ini langsung membuat saham BMTR pada perdagangan sesi I, Selasa (18/8/2020) melesat memimpin top gainers di Bursa Efek Indonesia (BEI). Data perdagangan mencatat, saham BMTR memimpin top gainers dengan kenaikan hingga 23,28% di level Rp 288/saham dengan nilai transaksi Rp 53 miliar dan volume perdagangan 193 juta saham. Padahal pekan lalu, perdagangan Jumat, saham BMTR justru ambles 6,45% di level Rp 232/saham, meskipun secara sepekan terakhir saham BMTR meroket 38,83% hingga pagi ini. Namun asing tercatat net sell atas saham BMTR sebesar Rp 2,58 miliar, sehingga pembelian saham lebih banyak dilakukan investor lokal. Sepekan terakhir asing bahkan melepas saham BMTR Rp 155 miliar. BMTR adalah induk usaha dari PT Media Nusantara Citra Tbk (MNCN) dan PT MNC Vision Networks Tbk. (IPTV). Selain saham BMTR yang melesat, saham IPTV juga menguat 5,84% di level Rp 326/saham pada perdagangan sesi I pagi ini, sementara saham MNCN naik 3,41% di posisi Rp 910/saham. Data pemegang saham yang dipublikasikan Kustodian Sentral Efek Indonesia (KSEI) di situs Bursa Efek Indonesia (BEI) menunjukkan, Lo Kheng Hong memang membeli sebanyak 942.184.700 saham BMTR atau mewakili sebanyak 6,14% saham, tercatat per 14 Agustus 2020, dari sebelumnya nihil. Pembelian itu terbagi atas enam kali tahapan yakni 4.591.700 saham, 6.900.000 saham, 100 saham, 52.845.600 sahan, 177.747.400 saham, dan 700.000.000 saham. Hanya saja tidak disebutkan pada harga berapa. Saat dihubungi pada Senin (17/8/2020), Lo enggan membeberkan alasan membeli saham BMTR, ia hanya memberikan ucapan HUT ke-75 RI. Jika diasumsikan harga rata-rata saham BMTR sepekan di level Rp 214/saham, maka diperkirakan dana yang dikucurkan Lo Kheng bisa mencapai Rp 227 miliar. Dalam pengumuman KSEI tersebut, disebutkan pula kepemilikan saham Lo Kheng Hong di PT Petrosea Tbk (PTRO) sebanyak 14,97% atau 150.964.100 saham. Lo Kheng Hong dikenal sebagai salah satu investor bertipe value investing (berbasis nilai) di BEI dan sukses. Bahkan dia dijuluki Warren Buffett-nya Indonesia karena sudah meraup untung dengan memilih saham-saham dengan fundamental baik dan valuasi yang murah. Dia memiliki beberapa saham saat ini, terutama di Grup Indika Energy. Di PT Mitrabahtera Segara Sejati Tbk. (MBSS), anak usaha PT Indika Energy Tbk (INDY), Lo Kheng Hong memiliki sebanyak 97.102.000 saham atau sebesar 5,55%, sementara di anak usaha Indika Energy lainnya yakni Petrosea, dia punya sebesar 13,67% saham per Juni 2019 sebelum akhirnya bertambah per 14 Agustus 2020. Secara kinerja, BMTR mencetak pendapatan pada semester I-2020 sebesar Rp 5,86 triliun, turun 7,84% dibandingkan pendapatan periode yang sama tahun lalu Rp 6,36 triliun. Penurunan ini terjadi seiring dengan pendapatan iklan non digital atau iklan konvensional yang turun, padahal lini bisnis ini menjadi kontributor utama perseroan. Pendapatan yang berasal dari MNCN ini terkoreksi hingga 13,51% secara year on year menjadi Rp 3,20 triliun. Laba bersih BMTR pada semester I-2020 tercatat turun 7,71% menjadi Rp 551,66 miliar dari yang sebelumnya Rp 597,35 miliar. ;18-08-2020;https://www.cnbcindonesia.com/market/20200818093715-17-180414/habis-diborong-lo-kheng-hong-saham-grup-mnc-ngamuk-parah;jakarta, cnbc indonesia - investor kenamaan lo kheng hong, yang dijuluki warren buffett-nya indonesia, resmi membeli saham emiten grup mnc, yakni pt global mediacom tbk (bmtr). sontak kabar ini langsung membuat saham bmtr pada perdagangan sesi i, selasa (18/8/2020) melesat memimpin top gainers di bursa efek indonesia (bei). data perdagangan mencatat, saham bmtr memimpin top gainers dengan kenaikan hingga 23,28% di level rp 288/saham dengan nilai transaksi rp 53 miliar dan volume perdagangan 193 juta saham. padahal pekan lalu, perdagangan jumat, saham bmtr justru ambles 6,45% di level rp 232/saham, meskipun secara sepekan terakhir saham bmtr meroket 38,83% hingga pagi ini. namun asing tercatat net sell atas saham bmtr sebesar rp 2,58 miliar, sehingga pembelian saham lebih banyak dilakukan investor lokal. sepekan terakhir asing bahkan melepas saham bmtr rp 155 miliar. bmtr adalah induk usaha dari pt media nusantara citra tbk (mncn) dan pt mnc vision networks tbk. (iptv). selain saham bmtr yang melesat, saham iptv juga menguat 5,84% di level rp 326/saham pada perdagangan sesi i pagi ini, sementara saham mncn naik 3,41% di posisi rp 910/saham. data pemegang saham yang dipublikasikan kustodian sentral efek indonesia (ksei) di situs bursa efek indonesia (bei) menunjukkan, lo kheng hong memang membeli sebanyak 942.184.700 saham bmtr atau mewakili sebanyak 6,14% saham, tercatat per 14 agustus 2020, dari sebelumnya nihil. pembelian itu terbagi atas enam kali tahapan yakni 4.591.700 saham, 6.900.000 saham, 100 saham, 52.845.600 sahan, 177.747.400 saham, dan 700.000.000 saham. hanya saja tidak disebutkan pada harga berapa. saat dihubungi pada senin (17/8/2020), lo enggan membeberkan alasan membeli saham bmtr, ia hanya memberikan ucapan hut ke-75 ri. jika diasumsikan harga rata-rata saham bmtr sepekan di level rp 214/saham, maka diperkirakan dana yang dikucurkan lo kheng bisa mencapai rp 227 miliar. dalam pengumuman ksei tersebut, disebutkan pula kepemilikan saham lo kheng hong di pt petrosea tbk (ptro) sebanyak 14,97% atau 150.964.100 saham. lo kheng hong dikenal sebagai salah satu investor bertipe value investing (berbasis nilai) di bei dan sukses. bahkan dia dijuluki warren buffett-nya indonesia karena sudah meraup untung dengan memilih saham-saham dengan fundamental baik dan valuasi yang murah. dia memiliki beberapa saham saat ini, terutama di grup indika energy. di pt mitrabahtera segara sejati tbk. (mbss), anak usaha pt indika energy tbk (indy), lo kheng hong memiliki sebanyak 97.102.000 saham atau sebesar 5,55%, sementara di anak usaha indika energy lainnya yakni petrosea, dia punya sebesar 13,67% saham per juni 2019 sebelum akhirnya bertambah per 14 agustus 2020. secara kinerja, bmtr mencetak pendapatan pada semester i-2020 sebesar rp 5,86 triliun, turun 7,84% dibandingkan pendapatan periode yang sama tahun lalu rp 6,36 triliun. penurunan ini terjadi seiring dengan pendapatan iklan non digital atau iklan konvensional yang turun, padahal lini bisnis ini menjadi kontributor utama perseroan. pendapatan yang berasal dari mncn ini terkoreksi hingga 13,51% secara year on year menjadi rp 3,20 triliun. laba bersih bmtr pada semester i-2020 tercatat turun 7,71% menjadi rp 551,66 miliar dari yang sebelumnya rp 597,35 miliar. 
