Title;Content;Date;URL;Cleaned Article
 Emiten Ramal Kapitalisasi Pasar Tembus Rp10 Ribu T pada 2025 ;"Ketua Asosiasi Emiten Indonesia (AEI) Iwan Setiawan Lukminto optimistis kapitalisasi pasar modal Indonesia akan terus tumbuh. Bahkan, ia memperkirakan dapat mencapai Rp10.000 triliun pada 2025. Keyakinan itu didorong oleh perbaikan kondisi pasar modal yang berangsur cepat usai terjerembab di awal pandemi covid-19. Iwan menyebut, misalnya, Indeks harga saham gabungan (IHSG) yang sempat terjun ke 3.937 pada Maret 2020 kini sudah kembali ke level 5.000.  ADVERTISEMENT   SCROLL TO CONTINUE WITH CONTENT  Belum lagi, investor pasar modal juga terus tumbuh dan diramal akan mencapai 3,5 juta pada akhir 2020. Per akhir September 2020 saja, jumlah investor pasar modal naik 31,9 persen secara year to date (ytd) menjadi 3,23 juta investor. ""Perbaikan ini tak lepas dari berbagai kebijakan yang dibuat oleh pemerintah untuk terus menstimulus ekonomi dalam negeri dan upaya Presiden yang disampaikan saat membuka bursa saham perdana tahun 2020 tanggal 2 Januari lalu untuk selalu mengutamakan good corporate governance,"" ujarnya saat membuka webinar ""Outlook 2021: The Year of Opportunity"", Rabu (21/10). Lebih Ianjut, Iwan menuturkan pemberlakuan pembatasan sosial berskala besar (PSBB) cukup memberi dampak dan tekanan terhadap beberapa sektor usaha. Kendati demikian, langkah itu menurutnya harus diambil agar dapat memutus rantai penyebaran covid-19. [Gambas:Video CNN] Ia juga mengapresiasi langkah pemerintah mempercepat pembahasan Undang-Undang Cipta Kerja yang dinilai dapat membangkitkan ekonomi nasional dan membuat Indonesia lebih siap menghadapi bonus demografi yang diperkirakan akan berlangsung hingga 2030. ""Kami percaya bahwa akan semakin banyak ruang pertumbuhan yang bisa di nikmati oleh segala sektor termasuk pasar modal tanah air yang saat ini mempunyai market capital sekitar 6000 triliun dan tidak mustahil market Capital kita akan menjadi Rp10.000 triliun sebelum 2025,"" tuturnya.";21-10-2020;https://www.cnnindonesia.com/ekonomi/20201021165621-92-561141/emiten-ramal-kapitalisasi-pasar-tembus-rp10-ribu-t-pada-2025;"ketua asosiasi emiten indonesia (aei) iwan setiawan lukminto optimistis kapitalisasi pasar modal indonesia akan terus tumbuh. bahkan, ia memperkirakan dapat mencapai rp10.000 triliun pada 2025. keyakinan itu didorong oleh perbaikan kondisi pasar modal yang berangsur cepat usai terjerembab di awal pandemi covid-19. iwan menyebut, misalnya, indeks harga saham gabungan (ihsg) yang sempat terjun ke 3.937 pada maret 2020 kini sudah kembali ke level 5.000. belum lagi, investor pasar modal juga terus tumbuh dan diramal akan mencapai 3,5 juta pada akhir 2020. per akhir september 2020 saja, jumlah investor pasar modal naik 31,9 persen secara year to date (ytd) menjadi 3,23 juta investor. ""perbaikan ini tak lepas dari berbagai kebijakan yang dibuat oleh pemerintah untuk terus menstimulus ekonomi dalam negeri dan upaya presiden yang disampaikan saat membuka bursa saham perdana tahun 2020 tanggal 2 januari lalu untuk selalu mengutamakan good corporate governance,"" ujarnya saat membuka webinar ""outlook 2021: the year of opportunity"", rabu (21/10). lebih ianjut, iwan menuturkan pemberlakuan pembatasan sosial berskala besar (psbb) cukup memberi dampak dan tekanan terhadap beberapa sektor usaha. kendati demikian, langkah itu menurutnya harus diambil agar dapat memutus rantai penyebaran covid-19. ia juga mengapresiasi langkah pemerintah mempercepat pembahasan undang-undang cipta kerja yang dinilai dapat membangkitkan ekonomi nasional dan membuat indonesia lebih siap menghadapi bonus demografi yang diperkirakan akan berlangsung hingga 2030. ""kami percaya bahwa akan semakin banyak ruang pertumbuhan yang bisa di nikmati oleh segala sektor termasuk pasar modal tanah air yang saat ini mempunyai market capital sekitar 6000 triliun dan tidak mustahil market capital kita akan menjadi rp10.000 triliun sebelum 2025,"" tuturnya."
 Dunkin Disebut Bakal Dijual ke Inspire Brands Rp129,36 T ;"Dunkin' Brands, perusahaan induk dari Dunkin' dan Baskin-Robbins, dikabarkan bakal dijual. Mengutip CNN, Selasa (27/10), pembeli merek makanan siap saji itu adalah Inspire Brands, sebuah perusahaan restoran yang mengelola sejumlah merek seperti Arby's, Buffalo Wild Wings, Sonic Drive-In, Jimmy John's, dan Rusty Taco. Keduanya, dikabarkan sedang dalam diskusi awal untuk proses akuisisi. Kesepakatan potensial ini pertama kali dilaporkan oleh New York Times pada Minggu (25/10).  ADVERTISEMENT   SCROLL TO CONTINUE WITH CONTENT  Dikabarkan oleh New York Times, Inspire akan membeli Dunkin' Brands dengan harga US$106,50 per saham. Transaksi akuisisi itu ditaksir mencapai sekitar US$8,8 miliar atau Rp129,36 triliun (asumsi kurs Rp14.700 per dolar AS). Informasi tersebut dikonfirmasi oleh manajemen Dunkin' Brands. Namun, pihak Dunkin' Brands tidak bisa memastikan apakah kesepakatan tersebut bisa tercapai. ""Dunkin' Brands mengonfirmasi telah mengadakan diskusi awal untuk diakuisisi oleh Inspire Brands. Tidak ada kepastian bahwa kesepakatan akan dicapai. Tidak ada pihak yang akan berkomentar lebih lanjut kecuali sampai transaksi disetujui,"" kata Kepala Komunikasi Dunkin' Brands Karen Raskopf. Sementara itu, pihak Inspire Brands menolak berkomentar. Perusahaan, yang berbasis di Georgia, AS itu mendapatkan dukungan dari grup ekuitas swasta Roark Capital Group. [Gambas:Video CNN] Untuk diketahui, Dunkin' Donuts dan Baskin-Robbins dijual oleh Pernod Ricard SA kepada tiga firma ekuitas swasta yakni Bain Capital, Carlyle Group, dan Thomas H pada 2005 seharga US$2,4 miliar. Selanjutnya, perusahaan go public pada 2011 dengan kode saham DNKN dan tercatat di indeks composite Nasdaq. Pada 2018, Dunkin' menghapus nama Donuts untuk memperluas pilihan makanan dan minumannya. Awal tahun ini, Dunkin' mengumumkan penutupan sekitar 800 restoran secara permanen.";27-10-2020;https://www.cnnindonesia.com/ekonomi/20201027082840-92-563091/dunkin-disebut-bakal-dijual-ke-inspire-brands-rp12936-t;"dunkin' brands, perusahaan induk dari dunkin' dan baskin-robbins, dikabarkan bakal dijual. mengutip cnn, selasa (27/10), pembeli merek makanan siap saji itu adalah inspire brands, sebuah perusahaan restoran yang mengelola sejumlah merek seperti arby's, buffalo wild wings, sonic drive-in, jimmy john's, dan rusty taco. keduanya, dikabarkan sedang dalam diskusi awal untuk proses akuisisi. kesepakatan potensial ini pertama kali dilaporkan oleh new york times pada minggu (25/10). dikabarkan oleh new york times, inspire akan membeli dunkin' brands dengan harga us$106,50 per saham. transaksi akuisisi itu ditaksir mencapai sekitar us$8,8 miliar atau rp129,36 triliun (asumsi kurs rp14.700 per dolar as). informasi tersebut dikonfirmasi oleh manajemen dunkin' brands. namun, pihak dunkin' brands tidak bisa memastikan apakah kesepakatan tersebut bisa tercapai. ""dunkin' brands mengonfirmasi telah mengadakan diskusi awal untuk diakuisisi oleh inspire brands. tidak ada kepastian bahwa kesepakatan akan dicapai. tidak ada pihak yang akan berkomentar lebih lanjut kecuali sampai transaksi disetujui,"" kata kepala komunikasi dunkin' brands karen raskopf. sementara itu, pihak inspire brands menolak berkomentar. perusahaan, yang berbasis di georgia, as itu mendapatkan dukungan dari grup ekuitas swasta roark capital group. untuk diketahui, dunkin' donuts dan baskin-robbins dijual oleh pernod ricard sa kepada tiga firma ekuitas swasta yakni bain capital, carlyle group, dan thomas h pada 2005 seharga us$2,4 miliar. selanjutnya, perusahaan go public pada 2011 dengan kode saham dnkn dan tercatat di indeks composite nasdaq. pada 2018, dunkin' menghapus nama donuts untuk memperluas pilihan makanan dan minumannya. awal tahun ini, dunkin' mengumumkan penutupan sekitar 800 restoran secara permanen."
         Pegawai Matahari Kena Potong Gaji    ;"PT Matahari Department Store Tbk mulai membayar kembali gaji karyawannya atau menaikkan sedikit demi sedikit nominal gaji yang sempat dipotong selama pandemi COVID-19. Emiten berkode saham LPPF ini pun bertekad memulihkan gaji seluruh karyawannya paling lambat kuartal VI-2020 mendatang. ""Pemulihan pemotongan gaji telah dimulai sejalan dengan pemulihan kami, dan direncanakan untuk pulih sepenuhnya pada Kuartal 4 2020,"" tulis CEO dan Wakil Presiden Direktur Matahari Terry O'Connor dalam siaran pers resminya dikutup dari Keterbukaan Informasi BEI, Jumat (23/10/2020). Sejak terimbas pandemi COVID-19 Matahari terus mencatatkan kerugian. Untuk bisa terus bertahan, memotong gaji karyawan jadi salah satu kebijakan yang diambil perseroan tersebut.      ADVERTISEMENT         SCROLL TO CONTINUE WITH CONTENT    Selama masa pandemi, emiten ini juga merumahkan atau memberlakukan kebijakan Work From Home (WFH) kepada 5.623 karyawannya. Ada juga pengurangan jumlah karyawan. Awalnya total karyawan tetap dan tidak tetap Matahari hingga per Desember 2019 mencapai 14.044 orang. Namun, pada awal Juni 2020 lalu jumlahnya menjadi 12.080 atau berkurang 1.964 orang. Namun, karyawan yang dikurangi itu bukan pekerja tetap melainkan karyawan yang habis masa kontraknya dan tidak diperpanjang terutama yang bekerja di toko-toko yang ditutup. Tak hanya berimbas ke karyawan, pandemi ini juga memaksa emiten ritel tersebut menutup 7 gerainya sekaligus. ""Pandemi COVID-19 mempercepat penutupan gerai-gerai yang berkinerja kurang baik, sejalan dengan upaya Matahari dalam merestrukturisasi bisnis. Sepanjang tahun ini, tujuh gerai format besar dan seluruh gerai khusus ditutup,"" sambungnya. Sehingga saat ini, Matahari Department Store hanya mengoperasikan 153 gerai di 76 kota di seluruh Indonesia. Rencananya, emiten berkode saham LPPF ini bakal menutup 3 gerai lainnya hingga akhir tahun.    Perusahaan juga menanggung kerugian bersih Rp 617 miliar dari Januari- September 2020. Dari segi pendapatan, emiten ini hanya mampu melaporkan penjualan kotor sebesar Rp 5,9 triliun alias anjlok sebanyak 57,6% dibanding periode yang sama tahun lalu. Pendapatan bersihnya pun demikian, merosot 57,5% menjadi Rp 3,3 triliun dibanding periode yang sama tahun lalu. Matahari mengaku sudah mulai pulih secara stabil pada Juli, Agustus, dan hingga pertengahan September lalu. Namun, ketika pada tanggal 14 September, PSBB diimplementasikan kembali di Jakarta dan adanya pembatasan operasional di lokasi lainnya, menyebabkan perseroan menutup beberapa gerainya untuk sementara, sehingga memperlambat kinerja emiten pada kuartal tersebut. Untuk mengurangi dampak pandemi, perseroan mengklaim telah mengupayakan berbagai pengetatan biaya, termasuk negosiasi untuk memperoleh keringanan sewa yang menghasilkan penurunan beban operasional sebesar 26,2% pada kuartal ketiga dan 29,3% pada periode Januari-September 2020. ""Kami telah melunasi fasilitas kredit tambahan yang diperoleh di bulan Mei tahun ini. Kami melakukan kontrol yang ketat atas pengeluaran kami dan pembekuan belanja modal kami masih berlaku selain terkait dua toko yang dibuka pada kuartal ini,"" imbuhnya.";23-10-2020;https://finance.detik.com/bursa-dan-valas/d-5225973/pegawai-matahari-kena-potong-gaji;"pt matahari department store tbk mulai membayar kembali gaji karyawannya atau menaikkan sedikit demi sedikit nominal gaji yang sempat dipotong selama pandemi covid-19. emiten berkode saham lppf ini pun bertekad memulihkan gaji seluruh karyawannya paling lambat kuartal vi-2020 mendatang. ""pemulihan pemotongan gaji telah dimulai sejalan dengan pemulihan kami, dan direncanakan untuk pulih sepenuhnya pada kuartal 4 2020,"" tulis ceo dan wakil presiden direktur matahari terry o'connor dalam siaran pers resminya dikutup dari keterbukaan informasi bei, jumat (23/10/2020). sejak terimbas pandemi covid-19 matahari terus mencatatkan kerugian. untuk bisa terus bertahan, memotong gaji karyawan jadi salah satu kebijakan yang diambil perseroan tersebut. selama masa pandemi, emiten ini juga merumahkan atau memberlakukan kebijakan work from home (wfh) kepada 5.623 karyawannya. ada juga pengurangan jumlah karyawan. awalnya total karyawan tetap dan tidak tetap matahari hingga per desember 2019 mencapai 14.044 orang. namun, pada awal juni 2020 lalu jumlahnya menjadi 12.080 atau berkurang 1.964 orang. namun, karyawan yang dikurangi itu bukan pekerja tetap melainkan karyawan yang habis masa kontraknya dan tidak diperpanjang terutama yang bekerja di toko-toko yang ditutup. tak hanya berimbas ke karyawan, pandemi ini juga memaksa emiten ritel tersebut menutup 7 gerainya sekaligus. ""pandemi covid-19 mempercepat penutupan gerai-gerai yang berkinerja kurang baik, sejalan dengan upaya matahari dalam merestrukturisasi bisnis. sepanjang tahun ini, tujuh gerai format besar dan seluruh gerai khusus ditutup,"" sambungnya. sehingga saat ini, matahari department store hanya mengoperasikan 153 gerai di 76 kota di seluruh indonesia. rencananya, emiten berkode saham lppf ini bakal menutup 3 gerai lainnya hingga akhir tahun. perusahaan juga menanggung kerugian bersih rp 617 miliar dari januari- september 2020. dari segi pendapatan, emiten ini hanya mampu melaporkan penjualan kotor sebesar rp 5,9 triliun alias anjlok sebanyak 57,6% dibanding periode yang sama tahun lalu. pendapatan bersihnya pun demikian, merosot 57,5% menjadi rp 3,3 triliun dibanding periode yang sama tahun lalu. matahari mengaku sudah mulai pulih secara stabil pada juli, agustus, dan hingga pertengahan september lalu. namun, ketika pada tanggal 14 september, psbb diimplementasikan kembali di jakarta dan adanya pembatasan operasional di lokasi lainnya, menyebabkan perseroan menutup beberapa gerainya untuk sementara, sehingga memperlambat kinerja emiten pada kuartal tersebut. untuk mengurangi dampak pandemi, perseroan mengklaim telah mengupayakan berbagai pengetatan biaya, termasuk negosiasi untuk memperoleh keringanan sewa yang menghasilkan penurunan beban operasional sebesar 26,2% pada kuartal ketiga dan 29,3% pada periode januari-september 2020. ""kami telah melunasi fasilitas kredit tambahan yang diperoleh di bulan mei tahun ini. kami melakukan kontrol yang ketat atas pengeluaran kami dan pembekuan belanja modal kami masih berlaku selain terkait dua toko yang dibuka pada kuartal ini,"" imbuhnya."
         Matahari Tutup 7 Toko Gara-gara Corona, Ini Dia Lokasinya    ;"PT Matahari Department Store Tbk telah menutup 7 gerainya lantaran tak kuat menanggung kerugian hingga Rp 617 miliar imbas pandemi COVID-19. Kerugian ratusan miliar tadi adalah kerugian bersih perusahaan Januari-September 2020. ""Pandemi COVID-19 mempercepat penutupan gerai-gerai yang berkinerja kurang baik, sejalan dengan upaya Matahari dalam merestrukturisasi bisnis. Sepanjang tahun ini, tujuh gerai format besar dan seluruh gerai khusus ditutup,"" ujar CEO dan Wakil Presiden Direktur Matahari Terry O'Connor dalam rilis resminya dikutip dari Keterbukaan Informasi BEI, Jumat (23/10/2020). Ketujuh gerai itu bakal ditutup permanen. Ke-7 gerai tadi berada di Palembang, Bogor, Jakarta, Balikpapan, Bali, Padang dan Cirebon.      ADVERTISEMENT         SCROLL TO CONTINUE WITH CONTENT    ""Gerai large format berlokasi di Palembang, Bogor, Jakarta, Balikpapan, Bali, Padang & Cirebon,"" kata Sekretaris Perusahaan Matahari Department Store Miranti Hadisusilo kepada detikcom. Selain, menutup gerai format besar, seluruh gerai khusus juga ditutup. Gerai khusus yang dimaksud berada di Jakarta, Surabaya dan Medan. Namun, gerai khusus ini hanya ditutup sementara waktu saja. Sehingga saat ini, Matahari hanya mengoperasikan 153 gerai di 76 kota di seluruh Indonesia. Rencananya, emiten berkode saham LPPF ini bakal menutup 3 gerai lainnya hingga akhir tahun. Langsung klik halaman selanjutnya.    Pendapatan emiten ritel itu sepanjang tahun ini terus melaporkan rapot merah. Tahun ini, perseroan hanya mampu memperoleh penjualan kotor sebesar Rp 5,9 triliun alias anjlok sebanyak 57,6% dibanding periode yang sama tahun lalu. Pendapatan bersihnya pun merosot 57,5% menjadi Rp 3,3 triliun dibanding periode yang sama tahun lalu. Matahari mengaku sudah mulai pulih secara stabil pada Juli, Agustus, dan hingga pertengahan September lalu. Namun, ketika pada tanggal 14 September, PSBB diimplementasikan kembali di Jakarta dan adanya pembatasan operasional di lokasi lainnya, menyebabkan perseroan menutup beberapa gerainya untuk sementara, sehingga memperlambat kinerja emiten pada kuartal tersebut. Untuk mengurangi dampak pandemi, perseroan mengklaim telah mengupayakan berbagai pengetatan biaya, termasuk negosiasi untuk memperoleh keringanan sewa yang menghasilkan penurunan beban operasional sebesar 26,2% pada kuartal ketiga dan 29,3% pada periode Januari-September 2020. Perseroan juga sempat melakukan pengurangan karyawan hingga pemotongan gaji. Awalnya total karyawan tetap dan tidak tetap Matahari per Desember 2019 mencapai 14.044 orang. Namun, pada awal Juni 2020 lalu jumlahnya menjadi 12.080 atau berkurang 1.964 orang. Soal gaji karyawan, emiten berkode saham LPPF ini bertekad bakal memulihkan gaji seluruh karyawannya paling lambat kuartal VI-2020 mendatang.";23-10-2020;https://finance.detik.com/bursa-dan-valas/d-5226535/matahari-tutup-7-toko-gara-gara-corona-ini-dia-lokasinya;"pt matahari department store tbk telah menutup 7 gerainya lantaran tak kuat menanggung kerugian hingga rp 617 miliar imbas pandemi covid-19. kerugian ratusan miliar tadi adalah kerugian bersih perusahaan januari-september 2020. ""pandemi covid-19 mempercepat penutupan gerai-gerai yang berkinerja kurang baik, sejalan dengan upaya matahari dalam merestrukturisasi bisnis. sepanjang tahun ini, tujuh gerai format besar dan seluruh gerai khusus ditutup,"" ujar ceo dan wakil presiden direktur matahari terry o'connor dalam rilis resminya dikutip dari keterbukaan informasi bei, jumat (23/10/2020). ketujuh gerai itu bakal ditutup permanen. ke-7 gerai tadi berada di palembang, bogor, jakarta, balikpapan, bali, padang dan cirebon. ""gerai large format berlokasi di palembang, bogor, jakarta, balikpapan, bali, padang & cirebon,"" kata sekretaris perusahaan matahari department store miranti hadisusilo kepada detikcom. selain, menutup gerai format besar, seluruh gerai khusus juga ditutup. gerai khusus yang dimaksud berada di jakarta, surabaya dan medan. namun, gerai khusus ini hanya ditutup sementara waktu saja. sehingga saat ini, matahari hanya mengoperasikan 153 gerai di 76 kota di seluruh indonesia. rencananya, emiten berkode saham lppf ini bakal menutup 3 gerai lainnya hingga akhir tahun. langsung klik halaman selanjutnya. pendapatan emiten ritel itu sepanjang tahun ini terus melaporkan rapot merah. tahun ini, perseroan hanya mampu memperoleh penjualan kotor sebesar rp 5,9 triliun alias anjlok sebanyak 57,6% dibanding periode yang sama tahun lalu. pendapatan bersihnya pun merosot 57,5% menjadi rp 3,3 triliun dibanding periode yang sama tahun lalu. matahari mengaku sudah mulai pulih secara stabil pada juli, agustus, dan hingga pertengahan september lalu. namun, ketika pada tanggal 14 september, psbb diimplementasikan kembali di jakarta dan adanya pembatasan operasional di lokasi lainnya, menyebabkan perseroan menutup beberapa gerainya untuk sementara, sehingga memperlambat kinerja emiten pada kuartal tersebut. untuk mengurangi dampak pandemi, perseroan mengklaim telah mengupayakan berbagai pengetatan biaya, termasuk negosiasi untuk memperoleh keringanan sewa yang menghasilkan penurunan beban operasional sebesar 26,2% pada kuartal ketiga dan 29,3% pada periode januari-september 2020. perseroan juga sempat melakukan pengurangan karyawan hingga pemotongan gaji. awalnya total karyawan tetap dan tidak tetap matahari per desember 2019 mencapai 14.044 orang. namun, pada awal juni 2020 lalu jumlahnya menjadi 12.080 atau berkurang 1.964 orang. soal gaji karyawan, emiten berkode saham lppf ini bertekad bakal memulihkan gaji seluruh karyawannya paling lambat kuartal vi-2020 mendatang."
