Title;Content;Date;URL;Cleaned Article
 Grup Salim Bakal Caplok Saham BUMI Milik Bakrie Rp24 T ;"Grup Salim bakal mencaplok saham emiten Grup Bakrie PT Bumi Resources Tbk (BUMI). Hal tersebut dilakukan melalui penambahan modal tanpa hak memesan efek terlebih dahulu (PMTHMETD) alias private placement. Dilansir dari keterbukaan informasi Bursa Efek Indonesia (BEI), Senin (10/10), grup bisnis milik Anthony Salim itu akan mengikuti PMTHMETD lewat dua perusahaan cangkang luar negeri, yakni Mach Energy Limited (MEL) dan Treasure Global Investment (TGIL). BUMI akan menerbitkan 200 miliar saham biasa seri C dengan harga pelaksanaan Rp 120 per saham. Rencana private placement akan dimintai persetujuan para pemegang saham dalam rapat umum pemegang saham luar biasa (RUPSLB) yang digelar pada Selasa, 11 Oktober 2022.  ADVERTISEMENT   SCROLL TO CONTINUE WITH CONTENT   MEL akan melakukan penyetoran atas 85 persen dari saham baru seri C yang diterbitkan dalam PMTHMETD itu atau sebanyak-banyaknya 170 miliar saham yang akan mewakili 49,44 persen dari saham setelah PMTHMETD. Sementara, sisa atau 15 persen akan diambil TGIL. ""MEL akan mengambil bagian atas sebesar 85 persen dari seluruh saham yang akan diterbitkan dalam PMTHMETD, dan TGIL akan mengambil bagian atas sebesar 15 persen dari seluruh saham yang akan diterbitkan dalam PMTHMETD,"" tulis BUMI. Susunan pemegang saham MEL sendiri terdiri dari PT Bakrie Capital Indonesia (BCI) dengan kepemilikan saham sebesar 42,50 persen, merupakan pihak dalam pengendalian oleh Kelompok Usaha Bakrie. Lalu, Clover Wide Limited dengan kepemilikan saham sebesar 15 persen, merupakan pihak yang dikendalikan oleh Agoes Projosasmito.  Kemudian, Mach Energy (Singapore) Pte. Ltd. (MEPL) dengan kepemilikan saham sebesar 42,50 persen, merupakan pihak yang dikendalikan oleh Anthony Salim. Sedangkan komposisi kepemilikan TGIL adalah PT Aswana Pinasthika memegang 16,15 persen saham dan dikendalikan oleh Agoes Projosasmito. Sisanya, 83,85 persen saham TGIL dimiliki oleh Mach Energy Pte. Ltd, yang dikendalikan oleh Anthoni Salim. Lewati aksi korporasi ini, BUMI berpotensi mendapatkan dana sebanyak-banyaknya Rp24 triliun atau setara dengan US$1,6 miliar. Perusahaan mencatat dana hasil private placement ini akan digunakan untuk penyelesaian kewajiban berupa pembayaran utang PKPU dan tambahan modal kerja serta pembayaran biaya-biaya terkait. [Gambas:Video CNN] ";10-10-2022;https://www.cnnindonesia.com/ekonomi/20221010131411-92-858530/grup-salim-bakal-caplok-saham-bumi-milik-bakrie-rp24-t;"grup salim bakal mencaplok saham emiten grup bakrie pt bumi resources tbk (bumi). hal tersebut dilakukan melalui penambahan modal tanpa hak memesan efek terlebih dahulu (pmthmetd) alias private placement. dilansir dari keterbukaan informasi bursa efek indonesia (bei), senin (10/10), grup bisnis milik anthony salim itu akan mengikuti pmthmetd lewat dua perusahaan cangkang luar negeri, yakni mach energy limited (mel) dan treasure global investment (tgil). bumi akan menerbitkan 200 miliar saham biasa seri c dengan harga pelaksanaan rp 120 per saham. rencana private placement akan dimintai persetujuan para pemegang saham dalam rapat umum pemegang saham luar biasa (rupslb) yang digelar pada selasa, 11 oktober 2022. mel akan melakukan penyetoran atas 85 persen dari saham baru seri c yang diterbitkan dalam pmthmetd itu atau sebanyak-banyaknya 170 miliar saham yang akan mewakili 49,44 persen dari saham setelah pmthmetd. sementara, sisa atau 15 persen akan diambil tgil. ""mel akan mengambil bagian atas sebesar 85 persen dari seluruh saham yang akan diterbitkan dalam pmthmetd, dan tgil akan mengambil bagian atas sebesar 15 persen dari seluruh saham yang akan diterbitkan dalam pmthmetd,"" tulis bumi. susunan pemegang saham mel sendiri terdiri dari pt bakrie capital indonesia (bci) dengan kepemilikan saham sebesar 42,50 persen, merupakan pihak dalam pengendalian oleh kelompok usaha bakrie. lalu, clover wide limited dengan kepemilikan saham sebesar 15 persen, merupakan pihak yang dikendalikan oleh agoes projosasmito. kemudian, mach energy (singapore) pte. ltd. (mepl) dengan kepemilikan saham sebesar 42,50 persen, merupakan pihak yang dikendalikan oleh anthony salim. sedangkan komposisi kepemilikan tgil adalah pt aswana pinasthika memegang 16,15 persen saham dan dikendalikan oleh agoes projosasmito. sisanya, 83,85 persen saham tgil dimiliki oleh mach energy pte. ltd, yang dikendalikan oleh anthoni salim. lewati aksi korporasi ini, bumi berpotensi mendapatkan dana sebanyak-banyaknya rp24 triliun atau setara dengan us$1,6 miliar. perusahaan mencatat dana hasil private placement ini akan digunakan untuk penyelesaian kewajiban berupa pembayaran utang pkpu dan tambahan modal kerja serta pembayaran biaya-biaya terkait. "
 Krisis Ekonomi 1997 Kembali Bayangi Asia ;"Seperempat abad yang lalu, krisis keuangan besar melanda Asia dan mengguncang ekonominya. Kini, krisis yang terjadi pada 1997 tersebut disebut kembali menghantui kawasan tersebut. Mata uang dan pasar saham di ekonomi terbesar Asia telah jatuh ke posisi terendah dalam beberapa dekade terakhir. Kondisi ini akibat kenaikan suku bunga yang agresif oleh bank sentral AS The Federal Reserves (The Fed). Dalam sebuah laporan baru, sebuah badan PBB memperingatkan bahwa tindakan The Fed bersama bank sentral lainnya yang menaikkan suku bunga berisiko mendorong ekonomi global ke dalam resesi.  ADVERTISEMENT   SCROLL TO CONTINUE WITH CONTENT   China yang merupakan ekonomi terbesar kedua di dunia harus melihat mata uangnya, yuan, jatuh 11 persen terhadap dolar AS. Ini menjadi kondisi terburuk sejak 1994. Jepang, ekonomi terbesar ketiga di dunia, bernasib lebih buruk. Yen Jepang telah jatuh 26 persen tahun ini dan menjadi penurunan terbesar di antara semua mata uang Asia. Ketika tekanan kuat pada mata uang utama Asia berlanjut, beberapa analis keuangan khawatir bahwa jika situasinya tidak terkendali, maka dapat menyebabkan krisis keuangan di kawasan itu. ""Lingkungan dolar yang kuat telah menimbulkan pertanyaan tentang bagaimana Asia akan terpengaruh dan apakah ini akan memicu krisis keuangan lain,"" tulis Kepala Ekonom Asia Morgan Stanley Chetan Ahya, dikutip dari CNN Business, Kamis (6/10).  Pada musim panas 1997 lalu, krisis besar-besaran di Asia dipicu oleh devaluasi mata uang Thailand, baht. Ini mengirimkan gelombang kejut ke seluruh Asia, yang menyebabkan pelarian modal besar-besaran dan turbulensi pasar saham. Kekacauan itu menyebabkan resesi mendalam di kawasan itu, membuat perusahaan bangkrut dan menggulingkan pemerintah. Kini, pemerintah negara Asia turun tangan untuk mencegah terulangnya krisis 1997-1998. Kementerian Keuangan Jepang mengungkapkan bahwa mereka menghabiskan hampir US$20 miliar pada September ini untuk memperlambat penurunan yen dalam intervensi pertama untuk menopang mata uang sejak 1998.  Bank sentral India juga menggunakan hampir US$75 miliar untuk meredakan gejolak dolar-rupee. Sedangkan China belum mengungkapkan angka apa pun. Namun, People's Bank of China memperingatkan pedagang yuan pekan lalu bahwa mereka akan kehilangan uang dalam jangka panjang jika mereka bertaruh melawan mata uang. Salah satu penyebab utama krisis 25 tahun yang lalu adalah gelembung harga aset yang diciptakan oleh arus masuk investasi yang besar ke beberapa negara Asia Tenggara pada awal 1990-an untuk mencari pengembalian cepat, atau dikenal sebagai ""uang panas"". Selain itu, negara-negara ini memiliki utang luar negeri yang besar, tata kelola perusahaan yang lemah, dan nilai tukar tetap.  Ketika The Fed mulai menaikkan suku bunga pada pertengahan 1990-an untuk melawan inflasi di Amerika Serikat, dolar mulai naik, mengganggu ekspor negara-negara Asia yang telah mematok mata uang mereka ke greenback. Saat ini, ketika dunia menuju resesi global, beberapa faktor yang sama muncul lagi, termasuk pengetatan Fed yang agresif untuk menahan inflasi. ""Lingkungan eksternal (untuk Asia) telah menjadi lebih menantang dalam konteks tantangan inflasi yang meluas dan laju pengetatan moneter yang hampir sinkron dan tajam,"" kata analis Morgan Stanley. Namun, analis menilai Asia saat ini memiliki fundamental makro yang lebih baik dibandingkan dengan pertengahan 1990-an.  ""Yang penting, tidak ada penumpukan utang luar negeri yang sama dalam beberapa tahun terakhir, yang merupakan salah satu pemicu krisis keuangan Asia,"" kata Kepala Penelitian Asia ANZ Research Khoon Goh. Sementara Kepala Ekonom Asia S&P Global Ratings Louis Kuijs memperkirakan cadangan devisa tidak turun ke level yang sangat rendah dalam waktu dekat di pasar negara berkembang utama Asia. China dan Jepang memiliki dua cadangan devisa terbesar di dunia, masing-masing memegang US$3 triliun dan US$1,3 triliun. Jika digabung maka itu adalah sepertiga dari seluruh cadangan devisa dunia. Selain itu, utang luar negeri dan utang sektor swasta di Asia saat ini tetap stabil, tidak seperti pertengahan 1990-an.  Kendati demikian, Asia diperkirakan masih akan dibayangi kesuraman ekonomi karena suku bunga AS diperkirakan naik lebih lanjut. Dolar AS kemungkinan juga akan naik lebih tinggi dan memperlambat pertumbuhan ekonomi global. Bank Dunia baru-baru ini memangkas perkiraan PDB untuk Asia menjadi 3,2 persen dari 5 persen tahun ini. Secara khusus China telah melihat prospek PDB-nya turun menjadi 2,8 persen dari 5 persen. Namun, analis memperkirakan kondisi akan membaik pada 2023. ""Ketahanan Asia dalam menghadapi badai global saat ini sebagian merupakan hasil reformasi yang didorong oleh krisis keuangan Asia,"" kata Neumann dari HSBC. [Gambas:Video CNN] ";06-10-2022;https://www.cnnindonesia.com/ekonomi/20221006093048-532-856984/krisis-ekonomi-1997-kembali-bayangi-asia;"seperempat abad yang lalu, krisis keuangan besar melanda asia dan mengguncang ekonominya. kini, krisis yang terjadi pada 1997 tersebut disebut kembali menghantui kawasan tersebut. mata uang dan pasar saham di ekonomi terbesar asia telah jatuh ke posisi terendah dalam beberapa dekade terakhir. kondisi ini akibat kenaikan suku bunga yang agresif oleh bank sentral as the federal reserves (the fed). dalam sebuah laporan baru, sebuah badan pbb memperingatkan bahwa tindakan the fed bersama bank sentral lainnya yang menaikkan suku bunga berisiko mendorong ekonomi global ke dalam resesi. china yang merupakan ekonomi terbesar kedua di dunia harus melihat mata uangnya, yuan, jatuh 11 persen terhadap dolar as. ini menjadi kondisi terburuk sejak 1994. jepang, ekonomi terbesar ketiga di dunia, bernasib lebih buruk. yen jepang telah jatuh 26 persen tahun ini dan menjadi penurunan terbesar di antara semua mata uang asia. ketika tekanan kuat pada mata uang utama asia berlanjut, beberapa analis keuangan khawatir bahwa jika situasinya tidak terkendali, maka dapat menyebabkan krisis keuangan di kawasan itu. ""lingkungan dolar yang kuat telah menimbulkan pertanyaan tentang bagaimana asia akan terpengaruh dan apakah ini akan memicu krisis keuangan lain,"" tulis kepala ekonom asia morgan stanley chetan ahya, dikutip dari cnn business, kamis (6/10). pada musim panas 1997 lalu, krisis besar-besaran di asia dipicu oleh devaluasi mata uang thailand, baht. ini mengirimkan gelombang kejut ke seluruh asia, yang menyebabkan pelarian modal besar-besaran dan turbulensi pasar saham. kekacauan itu menyebabkan resesi mendalam di kawasan itu, membuat perusahaan bangkrut dan menggulingkan pemerintah. kini, pemerintah negara asia turun tangan untuk mencegah terulangnya krisis 1997-1998. kementerian keuangan jepang mengungkapkan bahwa mereka menghabiskan hampir us$20 miliar pada september ini untuk memperlambat penurunan yen dalam intervensi pertama untuk menopang mata uang sejak 1998. bank sentral india juga menggunakan hampir us$75 miliar untuk meredakan gejolak dolar-rupee. sedangkan china belum mengungkapkan angka apa pun. namun, people's bank of china memperingatkan pedagang yuan pekan lalu bahwa mereka akan kehilangan uang dalam jangka panjang jika mereka bertaruh melawan mata uang. salah satu penyebab utama krisis 25 tahun yang lalu adalah gelembung harga aset yang diciptakan oleh arus masuk investasi yang besar ke beberapa negara asia tenggara pada awal 1990-an untuk mencari pengembalian cepat, atau dikenal sebagai ""uang panas"". selain itu, negara-negara ini memiliki utang luar negeri yang besar, tata kelola perusahaan yang lemah, dan nilai tukar tetap. ketika the fed mulai menaikkan suku bunga pada pertengahan 1990-an untuk melawan inflasi di amerika serikat, dolar mulai naik, mengganggu ekspor negara-negara asia yang telah mematok mata uang mereka ke greenback. saat ini, ketika dunia menuju resesi global, beberapa faktor yang sama muncul lagi, termasuk pengetatan fed yang agresif untuk menahan inflasi. ""lingkungan eksternal (untuk asia) telah menjadi lebih menantang dalam konteks tantangan inflasi yang meluas dan laju pengetatan moneter yang hampir sinkron dan tajam,"" kata analis morgan stanley. namun, analis menilai asia saat ini memiliki fundamental makro yang lebih baik dibandingkan dengan pertengahan 1990-an. ""yang penting, tidak ada penumpukan utang luar negeri yang sama dalam beberapa tahun terakhir, yang merupakan salah satu pemicu krisis keuangan asia,"" kata kepala penelitian asia anz research khoon goh. sementara kepala ekonom asia s&p global ratings louis kuijs memperkirakan cadangan devisa tidak turun ke level yang sangat rendah dalam waktu dekat di pasar negara berkembang utama asia. china dan jepang memiliki dua cadangan devisa terbesar di dunia, masing-masing memegang us$3 triliun dan us$1,3 triliun. jika digabung maka itu adalah sepertiga dari seluruh cadangan devisa dunia. selain itu, utang luar negeri dan utang sektor swasta di asia saat ini tetap stabil, tidak seperti pertengahan 1990-an. kendati demikian, asia diperkirakan masih akan dibayangi kesuraman ekonomi karena suku bunga as diperkirakan naik lebih lanjut. dolar as kemungkinan juga akan naik lebih tinggi dan memperlambat pertumbuhan ekonomi global. bank dunia baru-baru ini memangkas perkiraan pdb untuk asia menjadi 3,2 persen dari 5 persen tahun ini. secara khusus china telah melihat prospek pdb-nya turun menjadi 2,8 persen dari 5 persen. namun, analis memperkirakan kondisi akan membaik pada 2023. ""ketahanan asia dalam menghadapi badai global saat ini sebagian merupakan hasil reformasi yang didorong oleh krisis keuangan asia,"" kata neumann dari hsbc. "
 Daftar Negara yang Terancam Resesi pada 2023 ;"Kondisi ekonomi dunia semakin tidak pasti dan dihadapkan pada tantangan ancaman resesi pada 2023. Hal ini terlihat manakala bank-bank sentral terus mengerek suku bunga acuannya. Menteri Keuangan Sri Mulyani mengatakan akibat kebijakan moneter yang agresif itu, laju pertumbuhan ekonomi akan terhambat sehingga ancaman resesi semakin sulit dihindari. Menurut Sri Mulyani, kondisi ini dapat menciptakan stagflasi. Stagflasi adalah situasi di mana pertumbuhan ekonomi melambat, disertai dengan kenaikan harga (inflasi).  ADVERTISEMENT   SCROLL TO CONTINUE WITH CONTENT   Ia menyebut negara seperti Amerika Serikat (AS) dan Uni Eropa (UE) bahkan berpotensi mengalami resesi pada 2023 mendatang. Padahal, negara maju tersebut merupakan penggerak perekonomian dunia. Berikut daftar negara yang berpotensi mengalami resesi pada tahun depan. Pertumbuhan ekonomi AS terkontraksi 0,6 persen pada kuartal II 2022, setelah minus 1,6 persen pada kuartal I 2022. Kendati sudah dua kuartal berturut-turut terkontraksi, namun ekonomi AS belum dibilang resesi. Pengumuman resesi ekonomi dibuat oleh Bussiness Cycle Dating Committee, badan yang terdiri dari delapan ahli ekonomi yang dipilih oleh Biro Nasional Riset Ekonomi, organisasi non-profit.   Hingga kini, mereka masih ogah menggunakan kata resesi tersebut. Sedang di lain sisi, The Fed menepis kekhawatiran soal resesi. Bank sentral AS bersikeras menjelaskan bahwa pasar kerja AS masih kuat dengan bukti 315 ribu pekerja baru pada Agustus 2022. ""Pasar tenaga kerja AS yang kuat memberi kami fleksibilitas untuk menjadi agresif dalam perjuangan kami melawan inflasi,"" tulis The Fed. Mata uang euro yang merosot ke level terlemahnya terhadap dolar sejak akhir 2002 membuat kekhawatiran negara-negara Eropa terhadap resesi. Kenaikan harga gas alam turut menjadi pemicu ketakutan resesi. Data menunjukkan perlambatan tajam dalam pertumbuhan bisnis pada Juni. Tak hanya itu, rilis memperlihatkan defisit perdagangan pada Mei 2022 yang disesuaikan secara musiman sebesar 1 miliar euro di Jerman, berlawanan dengan ekspektasi surplus.   Perekonomian Inggris juga menunjukkan tanda-tanda perlambatan karena inflasi tinggi. Suku bunga acuan bank sentral Inggris bahkan sudah naik 200 basis poin selama 2022. Eropa terancam resesi 2023. ""Ekonomi mulai terlihat seperti lama-kelamaan akan habis terhenti,"" ujar Kepala Ekonom Bisnis di S&P Global Market Intelligence Chris Williamson. Menurut laporan Bank Dunia pada Selasa (27/9), China yang merupakan 86 persen dari output ekonomi kawasan 23 negara, diproyeksikan tumbuh 2,8 persen tahun ini. Angka ini merupakan penurunan signifikan dari perkiraan sebelumnya yang berada di angka 5,0 persen. Ekonomi China memang melemah dalam beberapa bulan terakhir menyusul kebijakan lockdown yang diberlakukan di Negara Tirai Bambu itu. Hal tersebut turut mengganggu sektor industri, penjualan domestik, hingga aktivitas ekspor.   ""Kami memproyeksikan pertumbuhan PDB riil melambat tajam menjadi 4,3 persen pada 2022 sampai dengan 0,8 poin, persentase lebih rendah dari yang diproyeksikan dalam Pembaruan Ekonomi China Desember,"" tulis IMF dalam laporan perekonomian China Juni 2022. Lembaga pemeringkat internasional, Fitch Ratings, memperkirakan kondisi keuangan global yang lebih ketat dan dampak geopolitik bakal memperburuk profil keuangan eksternal Mongolia yang lemah. ""Kami memproyeksikan defisit neraca berjalan Mongolia pada 2022 akan melebar menjadi 16,3 persen dari PDB dan beban utang luar negeri bersihnya menjadi besar pada 167 persen dari PDB,"" tulis analis Fitch. Ketergantungan Pemerintah Mongolia pada utang luar negeri turut meningkatkan kerentanan terhadap pergeseran sentimen investor internasional yang dapat menghasilkan perlambatan ekonomi.   Saham Korea Selatan jatuh pada awal Juli 2022 karena investor khawatir kenaikan suku bunga acuan untuk memerangi inflasi bakal memicu perlambatan ekonomi. Analis di Samsung Securities Seo Jung-hun menyebut saham Korea Selatan, seperti pasar saham Taiwan, sensitif terhadap momentum siklus ekonomi dan bereaksi terhadap ketakutan resesi. Menurut Sri Mulyani, perekonomian Indonesia masih cukup sehat dan aman dari ancaman resesi. Namun, masih ada risiko resesi ekonomi yang dialami Indonesia, yakni sebesar 3 persen. ""Kita (Indonesia) relatif dalam situasi yang tadi disebutkan risiko (potensi resesi) 3 persen,"" tutur Sri Mulyani dalam konferensi pers di Nusa Dua, Rabu (13/7), mengamini survei yang dilakukan Bloomberg soal potensi resesi negara-negara dunia.  [Gambas:Video CNN] ";05-10-2022;https://www.cnnindonesia.com/ekonomi/20221005180752-532-856801/daftar-negara-yang-terancam-resesi-pada-2023;"kondisi ekonomi dunia semakin tidak pasti dan dihadapkan pada tantangan ancaman resesi pada 2023. hal ini terlihat manakala bank-bank sentral terus mengerek suku bunga acuannya. menteri keuangan sri mulyani mengatakan akibat kebijakan moneter yang agresif itu, laju pertumbuhan ekonomi akan terhambat sehingga ancaman resesi semakin sulit dihindari. menurut sri mulyani, kondisi ini dapat menciptakan stagflasi. stagflasi adalah situasi di mana pertumbuhan ekonomi melambat, disertai dengan kenaikan harga (inflasi). ia menyebut negara seperti amerika serikat (as) dan uni eropa (ue) bahkan berpotensi mengalami resesi pada 2023 mendatang. padahal, negara maju tersebut merupakan penggerak perekonomian dunia. berikut daftar negara yang berpotensi mengalami resesi pada tahun depan. pertumbuhan ekonomi as terkontraksi 0,6 persen pada kuartal ii 2022, setelah minus 1,6 persen pada kuartal i 2022. kendati sudah dua kuartal berturut-turut terkontraksi, namun ekonomi as belum dibilang resesi. pengumuman resesi ekonomi dibuat oleh bussiness cycle dating committee, badan yang terdiri dari delapan ahli ekonomi yang dipilih oleh biro nasional riset ekonomi, organisasi non-profit. hingga kini, mereka masih ogah menggunakan kata resesi tersebut. sedang di lain sisi, the fed menepis kekhawatiran soal resesi. bank sentral as bersikeras menjelaskan bahwa pasar kerja as masih kuat dengan bukti 315 ribu pekerja baru pada agustus 2022. ""pasar tenaga kerja as yang kuat memberi kami fleksibilitas untuk menjadi agresif dalam perjuangan kami melawan inflasi,"" tulis the fed. mata uang euro yang merosot ke level terlemahnya terhadap dolar sejak akhir 2002 membuat kekhawatiran negara-negara eropa terhadap resesi. kenaikan harga gas alam turut menjadi pemicu ketakutan resesi. data menunjukkan perlambatan tajam dalam pertumbuhan bisnis pada juni. tak hanya itu, rilis memperlihatkan defisit perdagangan pada mei 2022 yang disesuaikan secara musiman sebesar 1 miliar euro di jerman, berlawanan dengan ekspektasi surplus. perekonomian inggris juga menunjukkan tanda-tanda perlambatan karena inflasi tinggi. suku bunga acuan bank sentral inggris bahkan sudah naik 200 basis poin selama 2022. eropa terancam resesi 2023. ""ekonomi mulai terlihat seperti lama-kelamaan akan habis terhenti,"" ujar kepala ekonom bisnis di s&p global market intelligence chris williamson. menurut laporan bank dunia pada selasa (27/9), china yang merupakan 86 persen dari output ekonomi kawasan 23 negara, diproyeksikan tumbuh 2,8 persen tahun ini. angka ini merupakan penurunan signifikan dari perkiraan sebelumnya yang berada di angka 5,0 persen. ekonomi china memang melemah dalam beberapa bulan terakhir menyusul kebijakan lockdown yang diberlakukan di negara tirai bambu itu. hal tersebut turut mengganggu sektor industri, penjualan domestik, hingga aktivitas ekspor. ""kami memproyeksikan pertumbuhan pdb riil melambat tajam menjadi 4,3 persen pada 2022 sampai dengan 0,8 poin, persentase lebih rendah dari yang diproyeksikan dalam pembaruan ekonomi china desember,"" tulis imf dalam laporan perekonomian china juni 2022. lembaga pemeringkat internasional, fitch ratings, memperkirakan kondisi keuangan global yang lebih ketat dan dampak geopolitik bakal memperburuk profil keuangan eksternal mongolia yang lemah. ""kami memproyeksikan defisit neraca berjalan mongolia pada 2022 akan melebar menjadi 16,3 persen dari pdb dan beban utang luar negeri bersihnya menjadi besar pada 167 persen dari pdb,"" tulis analis fitch. ketergantungan pemerintah mongolia pada utang luar negeri turut meningkatkan kerentanan terhadap pergeseran sentimen investor internasional yang dapat menghasilkan perlambatan ekonomi. saham korea selatan jatuh pada awal juli 2022 karena investor khawatir kenaikan suku bunga acuan untuk memerangi inflasi bakal memicu perlambatan ekonomi. analis di samsung securities seo jung-hun menyebut saham korea selatan, seperti pasar saham taiwan, sensitif terhadap momentum siklus ekonomi dan bereaksi terhadap ketakutan resesi. menurut sri mulyani, perekonomian indonesia masih cukup sehat dan aman dari ancaman resesi. namun, masih ada risiko resesi ekonomi yang dialami indonesia, yakni sebesar 3 persen. ""kita (indonesia) relatif dalam situasi yang tadi disebutkan risiko (potensi resesi) 3 persen,"" tutur sri mulyani dalam konferensi pers di nusa dua, rabu (13/7), mengamini survei yang dilakukan bloomberg soal potensi resesi negara-negara dunia. "
