Title;Content;Date;URL;Cleaned Article
         Yen Sedang Melemah, Tiket Pesawat ke Jepang Bisa Lebih Murah?    ;"Mata uang Yen Jepang melemah dalam beberapa waktu terakhir terhadap sejumlah mata uang termasuk rupiah. Apakah pelemahan ini membuat harga tiket pesawat ke Jepang menjadi lebih murah? Direktur Eksekutif Institute for Development of Economics and Finance (INDEF), Tauhid Ahmad mengatakan pelemahan nilai tukar Yen memungkinkan membuat harga tiket pesawat ke Jepang turun jika harga avtur tidak naik. ""Kalau harga minyak (avtur) tetap (tidak naik), maka akan lebih murah. Apalagi kalau harga avtur turun, maka akan murah lagi,"" kata Tauhid kepada detikcom, Jumat (25/8/2023).      ADVERTISEMENT         SCROLL TO CONTINUE WITH CONTENT    Melansir Bloomberg, pukul 14.24 WIB nilai tukar Yen terhadap rupiah melemah 0,16% menjadi Rp 104. Sedangkan terhadap Dolar Amerika Serikat (AS) melemah hingga 0,15%. Tauhid mengatakan melemahnya mata uang Yen Jepang dipengaruhi oleh berbagai faktor. Salah satunya karena kenaikan suku bunga Bank Sentral AS The Fed yang menyebabkan aliran modal keluar (capital outflow). ""Terjadi capital outflow besar-besaran karena Amerika naikkan suku bunga progresif,"" ucapnya. Selain faktor eksternal, proses pemulihan ekonomi Jepang dinilai tidak setinggi dari yang diproyeksikan sebelumnya dan kebijakan dari moneter dalam negeri Jepang dianggap tidak terlalu diminati investor. Ekonom Center of Reform on Economics (CORE), Yusuf Rendy Manilet mengatakan kondisi ini memang menguntungkan bagi Indonesia karena bisa mendapatkan satu nilai Yen dengan nilai lebih murah. Sebagai ilustrasi, untuk mendapatkan 1 Yen Jepang mungkin sebelumnya harus menyediakan uang sebesar Rp 108. Tetapi saat ini bisa mendapatkan 1 Yen Jepang hanya dengan menukarkan uang Rp 104. ""Secara konsep tentu penguatan nilai tukar Rupiah terhadap Yen itu bisa mempengaruhi nilai mata uang yang dikonversi dari Rupiah ke Yen itu sendiri. Artinya ketika nilai tukar Rupiah terapresiasi terhadap Yen, maka akan menjadi lebih murah untuk mendapatkan satu nilai Yen ketika ditukarkan,"" bebernya. Terhadap tiket pesawat ke Jepang, Tauhid mengingatkan bahwa komponen harga tiket pesawat tidak hanya semata-mata dipengaruhi oleh selisih perubahan dari nilai tukar, melainkan juga harga avtur dan waktu keberangkatan. ""Kalau kita bicara musim peak season, seperti misalnya ketika libur Lebaran ataupun ketika libur akhir tahun nanti maka saya kira potensi peningkatan harga tiket pesawat termasuk di dalamnya tiket pesawat ke Jepang itu juga berpotensi akan mengalami peningkatan,"" ucapnya.";25-08-2023;https://finance.detik.com/berita-ekonomi-bisnis/d-6895416/yen-sedang-melemah-tiket-pesawat-ke-jepang-bisa-lebih-murah;"mata uang yen jepang melemah dalam beberapa waktu terakhir terhadap sejumlah mata uang termasuk rupiah. apakah pelemahan ini membuat harga tiket pesawat ke jepang menjadi lebih murah? direktur eksekutif institute for development of economics and finance (indef), tauhid ahmad mengatakan pelemahan nilai tukar yen memungkinkan membuat harga tiket pesawat ke jepang turun jika harga avtur tidak naik. ""kalau harga minyak (avtur) tetap (tidak naik), maka akan lebih murah. apalagi kalau harga avtur turun, maka akan murah lagi,"" kata tauhid kepada detikcom, jumat (25/8/2023). melansir bloomberg, pukul 14.24 wib nilai tukar yen terhadap rupiah melemah 0,16% menjadi rp 104. sedangkan terhadap dolar amerika serikat (as) melemah hingga 0,15%. tauhid mengatakan melemahnya mata uang yen jepang dipengaruhi oleh berbagai faktor. salah satunya karena kenaikan suku bunga bank sentral as the fed yang menyebabkan aliran modal keluar (capital outflow). ""terjadi capital outflow besar-besaran karena amerika naikkan suku bunga progresif,"" ucapnya. selain faktor eksternal, proses pemulihan ekonomi jepang dinilai tidak setinggi dari yang diproyeksikan sebelumnya dan kebijakan dari moneter dalam negeri jepang dianggap tidak terlalu diminati investor. ekonom center of reform on economics (core), yusuf rendy manilet mengatakan kondisi ini memang menguntungkan bagi indonesia karena bisa mendapatkan satu nilai yen dengan nilai lebih murah. sebagai ilustrasi, untuk mendapatkan 1 yen jepang mungkin sebelumnya harus menyediakan uang sebesar rp 108. tetapi saat ini bisa mendapatkan 1 yen jepang hanya dengan menukarkan uang rp 104. ""secara konsep tentu penguatan nilai tukar rupiah terhadap yen itu bisa mempengaruhi nilai mata uang yang dikonversi dari rupiah ke yen itu sendiri. artinya ketika nilai tukar rupiah terapresiasi terhadap yen, maka akan menjadi lebih murah untuk mendapatkan satu nilai yen ketika ditukarkan,"" bebernya. terhadap tiket pesawat ke jepang, tauhid mengingatkan bahwa komponen harga tiket pesawat tidak hanya semata-mata dipengaruhi oleh selisih perubahan dari nilai tukar, melainkan juga harga avtur dan waktu keberangkatan. ""kalau kita bicara musim peak season, seperti misalnya ketika libur lebaran ataupun ketika libur akhir tahun nanti maka saya kira potensi peningkatan harga tiket pesawat termasuk di dalamnya tiket pesawat ke jepang itu juga berpotensi akan mengalami peningkatan,"" ucapnya."
Garap Reksadana yang Berdampak Positif ke Lingkungan, Insight IM Sabet BISRA 2023;"Laporan Wartawan Tribunnews, Choirul Arifin TRIBUNNEWS.COM, JAKARTA – PT Insight Investments Management (Insight IM) meraih penghargaan Silver Champion in Corporate Social Responsibility Program – Elemen Ekonomi di acara Anugerah Bisnis Indonesia Social Responsibility Awards (BISRA) 2023 yang diselenggarakan di Jakarta, Selasa (15/8/2023). Direktur PT Insight Investments Management (Insight IM) Thomas Harmanto menyatakan, penghargaan BISRA 2023 kembali menjadi cerminan atas upaya berkelanjutan Insight IM dalam menjalankan berbagai aktivitas CSR yang berdampak positif bagi lingkungan. Dia mengatakan, Insight IM secara konsisten menerapkan prinsip Socially Responsible Investing dalam pengelolaan seluruh produk reksa dana. ""Kami menegaskan komitmen ini dengan meluncurkan produk investasi yang tidak hanya memberikan keuntungan finansial bagi Nasabah itu sendiri, tetapi juga memberikan dampak positif dalam berbagai aspek tanggung jawab sosial perusahaan, seperti kemanusiaan, agama, pendidikan, budaya, kesehatan, dan pemberdayaan masyarakat,"" ujarnya dalam keterangan tertulis, dikutip Kamis 24 Agustus 2023. Di bidang lingkungan, Insight IM memiliki Produk Reksa Dana Indeks Insight SRI-KEHATI Likuid (ISL) yang turut bekerja sama dengan Yayasan Kehati untuk menunjang berbagai program pelestarian keanekaragaman hayati Indonesia. Dia menyebutkan, Reksa Dana Indeks Insight SRI-KEHATI Likuid (ISL) telah mendukung berbagai program CSR, di antaranya pengembangan sorgum di Pulau Flores, Nusa Tenggara Timur dan pengembangan Taman Kehati di 8 provinsi meliputi Sumatera Barat, Lampung, Jawa Barat, Jawa Tengah, Yogyakarta, Jawa Timur, Kalimantan Selatan, dan Sulawesi Utara.   .recads_wrapper{height:134px;position:relative;margin:10px 0 30px;padding:10px 15px;overflow:hidden;box-shadow:0 0 10px rgb(0 0 0 / 20%);}.recads_title{margin-bottom:10px;font-size:16px;font-weight:700}.arjW-list{overflow-x:scroll;overflow-y:hidden;white-space:nowrap;width:auto;padding:10px 0;position:relative;display:flex;scroll-snap-type:x;flex-wrap:nowrap}.recads_item{scroll-snap-align:start;width:280px;flex:0 0 280px;margin-right:20px;display: flex;white-space: normal;gap: 10px;}.recads_item a {display:flex;white-space:normal;gap:10px;}.recads_image{position:relative;height:auto}.recads_image img{width:auto;height: 73px!important;max-width:165px!important;border-radius:8px}.article_datas_title{font-size:14px;font-weight:700;line-height:1.2;margin:0;overflow:hidden;display:-webkit-box;-webkit-line-clamp:4;-webkit-box-orient:vertical;}.arjW-img-overlay{position:absolute;z-index:3;bottom:8px;left:0;padding:0 0 0 10px}.arjW-img-overlay>img{width:auto;height: 16px!important;}.recads_image::after{z-index:2;position:absolute;top:50%;bottom:4px;left:0;right:0;content:'';background:linear-gradient(to top,#d6d6d6,transparent);width:100%;border-radius: 8px;}             BERITA REKOMENDASI           Dia menambahkan, di tengah isu lingkungan yang kian menjadi tren, Insight IM hingga saat ini terus fokus mengoptimalkan kinerja produk reksa dana yang peduli dengan lingkungan. Salah satunya adalah Reksa Dana Indeks SRI- KEHATI Likuid (ISL) yang sifatnya ESG friendly investment. “Kinerja produk reksa dana ini sangat baik dengan historikal performanya tumbuh mencapai 22,61 persen sejak peluncuran per 31 Juli 2023. Kinerja ini bahkan mengungguli Indeks SRI-KEHATI itu sendiri. ""Dengan berinvestasi pada Reksa Dana Indeks Insight SRI- KEHATI Likuid (ISL) para Investor secara tidak langsung berkesempatan untuk turut berkontribusi berbagai program pelestarian keanekaragaman hayati Indonesia,” ujar Thomas. Sebagai informasi, Reksa Dana Indeks SRI-KEHATI Likuid dapat menjadi pilihan reksa dana indeks yang berkualitas tinggi berkat keunggulan kinerja total return historis indeks acuannya yang lebih baik daripada indeks-indeks saham lainnya. Mayoritas alokasi Indeks SRI-KEHATI berada pada saham perbankan, dan tidak mengandung saham-saham pertambangan yang performanya menurun di IHSG pada tahun ini. Investor mulai dapat mempertimbangkan untuk mengalokasikan sebagian dari portofolionya ke dalam Reksa Dana Saham Berbasis Indeks yang menerapkan strategi passive investing strategy guna meminimalisir risiko kesalahan pemilihan saham. Selain itu untuk melindungi diri dari risiko kesalahan timing pembelian, Investor bisa menerapkan teknik Rupiah Cost Averaging dalam pembelian reksa dana berbasis saham. “Performa unggul dari berbagai produk reksa dana yang dikelola oleh Insight IM telah meningkatkan optimisme dan motivasi kami untuk terus melaksanakan berbagai program positif yang memiliki dampak nyata dalam membantu masyarakat luas serta melestarikan lingkungan hidup,” ujar Thomas.";24-08-2023;https://www.tribunnews.com/bisnis/2023/08/24/garap-reksadana-yang-berdampak-positif-ke-lingkungan-insight-im-sabet-bisra-2023;"laporan wartawan tribunnews, choirul arifin tribunnews.com, jakarta – pt insight investments management (insight im) meraih penghargaan silver champion in corporate social responsibility program – elemen ekonomi di acara anugerah bisnis indonesia social responsibility awards (bisra) 2023 yang diselenggarakan di jakarta, selasa (15/8/2023). direktur pt insight investments management (insight im) thomas harmanto menyatakan, penghargaan bisra 2023 kembali menjadi cerminan atas upaya berkelanjutan insight im dalam menjalankan berbagai aktivitas csr yang berdampak positif bagi lingkungan. dia mengatakan, insight im secara konsisten menerapkan prinsip socially responsible investing dalam pengelolaan seluruh produk reksa dana. ""kami menegaskan komitmen ini dengan meluncurkan produk investasi yang tidak hanya memberikan keuntungan finansial bagi nasabah itu sendiri, tetapi juga memberikan dampak positif dalam berbagai aspek tanggung jawab sosial perusahaan, seperti kemanusiaan, agama, pendidikan, budaya, kesehatan, dan pemberdayaan masyarakat,"" ujarnya dalam keterangan tertulis, dikutip kamis 24 agustus 2023. di bidang lingkungan, insight im memiliki produk reksa dana indeks insight sri-kehati likuid (isl) yang turut bekerja sama dengan yayasan kehati untuk menunjang berbagai program pelestarian keanekaragaman hayati indonesia. dia menyebutkan, reksa dana indeks insight sri-kehati likuid (isl) telah mendukung berbagai program csr, di antaranya pengembangan sorgum di pulau flores, nusa tenggara timur dan pengembangan taman kehati di 8 provinsi meliputi sumatera barat, lampung, jawa barat, jawa tengah, yogyakarta, jawa timur, kalimantan selatan, dan sulawesi utara. berita rekomendasi dia menambahkan, di tengah isu lingkungan yang kian menjadi tren, insight im hingga saat ini terus fokus mengoptimalkan kinerja produk reksa dana yang peduli dengan lingkungan. salah satunya adalah reksa dana indeks sri- kehati likuid (isl) yang sifatnya esg friendly investment. “kinerja produk reksa dana ini sangat baik dengan historikal performanya tumbuh mencapai 22,61 persen sejak peluncuran per 31 juli 2023. kinerja ini bahkan mengungguli indeks sri-kehati itu sendiri. ""dengan berinvestasi pada reksa dana indeks insight sri- kehati likuid (isl) para investor secara tidak langsung berkesempatan untuk turut berkontribusi berbagai program pelestarian keanekaragaman hayati indonesia,” ujar thomas. sebagai informasi, reksa dana indeks sri-kehati likuid dapat menjadi pilihan reksa dana indeks yang berkualitas tinggi berkat keunggulan kinerja total return historis indeks acuannya yang lebih baik daripada indeks-indeks saham lainnya. mayoritas alokasi indeks sri-kehati berada pada saham perbankan, dan tidak mengandung saham-saham pertambangan yang performanya menurun di ihsg pada tahun ini. investor mulai dapat mempertimbangkan untuk mengalokasikan sebagian dari portofolionya ke dalam reksa dana saham berbasis indeks yang menerapkan strategi passive investing strategy guna meminimalisir risiko kesalahan pemilihan saham. selain itu untuk melindungi diri dari risiko kesalahan timing pembelian, investor bisa menerapkan teknik rupiah cost averaging dalam pembelian reksa dana berbasis saham. “performa unggul dari berbagai produk reksa dana yang dikelola oleh insight im telah meningkatkan optimisme dan motivasi kami untuk terus melaksanakan berbagai program positif yang memiliki dampak nyata dalam membantu masyarakat luas serta melestarikan lingkungan hidup,” ujar thomas."
Besaran Gaji PNS dan PPPK Berdasarkan Golongan dan Lamanya Masa Kerja;"TRIBUNNEWS.COM – Berikut perbedaan gaji Pegawai Negeri Sipil (PNS) dan Pegawai Pemerintah dengan Perjanjian Kerja (PPPK). Meski sama-sama berstatus sebagai Aparatur Sipil Negara (ASN), Pegawai Negeri Sipil (PNS) dan Pegawai Pemerintah dengan Perjanjian Kerja (PPPK) memiliki sejumlah perbedaan, seperti status kepegawaian hingga gaji yang didapatkan. Untuk lebih jelasnya, berikut Tribunnews.com akan mengulas perbedaan gaji PNS dan PPPK. Besaran Gaji PNS Gaji PNS diatur dalam Peraturan Pemerintah (PP) Nomor 15 Tahun 2019, besaran gaji pokok PNS berjenjang sesuai golongan dan lama masa kerja golongan (MKG).  Berikut gaji PNS untuk golongan I hingga IV. Hitungan gaji dari yang paling terendah hingga tertinggi disesuaikan berdasarkan MKG mulai dari kurang dari 1 tahun hingga 27 tahun. Golongan I (lulusan SD dan SMP):  .recads_wrapper{height:134px;position:relative;margin:10px 0 30px;padding:10px 15px;overflow:hidden;box-shadow:0 0 10px rgb(0 0 0 / 20%);}.recads_title{margin-bottom:10px;font-size:16px;font-weight:700}.arjW-list{overflow-x:scroll;overflow-y:hidden;white-space:nowrap;width:auto;padding:10px 0;position:relative;display:flex;scroll-snap-type:x;flex-wrap:nowrap}.recads_item{scroll-snap-align:start;width:280px;flex:0 0 280px;margin-right:20px;display: flex;white-space: normal;gap: 10px;}.recads_item a {display:flex;white-space:normal;gap:10px;}.recads_image{position:relative;height:auto}.recads_image img{width:auto;height: 73px!important;max-width:165px!important;border-radius:8px}.article_datas_title{font-size:14px;font-weight:700;line-height:1.2;margin:0;overflow:hidden;display:-webkit-box;-webkit-line-clamp:4;-webkit-box-orient:vertical;}.arjW-img-overlay{position:absolute;z-index:3;bottom:8px;left:0;padding:0 0 0 10px}.arjW-img-overlay>img{width:auto;height: 16px!important;}.recads_image::after{z-index:2;position:absolute;top:50%;bottom:4px;left:0;right:0;content:'';background:linear-gradient(to top,#d6d6d6,transparent);width:100%;border-radius: 8px;}             BERITA REKOMENDASI           - Golongan Ia: Rp 1.560.800 - Rp 2.335.800 - Golongan Ib: Rp 1.704.500 - Rp 2.472.900 - Golongan Ic: Rp 1.776.600 - Rp 2.577.500 - Golongan Id: Rp 1.851.800 - Rp 2.686.500 Golongan II (lulusan SMA dan D-III): - Golongan IIa: Rp 2.022.200 - Rp 3.373.600 - Golongan IIb: Rp 2.208.400 - Rp 3.516.300 - Golongan IIc: Rp 2.301.800 - Rp 3.665.000 - Golongan IId: Rp 2.399.200 - Rp 3.820.000 Golongan III (lulusan S1 atau S3): - Golongan IIIa: Rp 2.579.400 - Rp 4.236.400 - Golongan IIIb: Rp 2.688.500 - Rp 4.415.600 - Golongan IIIc: Rp 2.802.300 - Rp 4.602.400 - Golongan IIId: Rp 2.920.800 - Rp 4.797.000 Golongan IV: - Golongan IVa: Rp 3.044.300 - Rp 5.000.000 - Golongan IVb: Rp 3.173.100 - Rp 5.211.500 - Golongan IVc: Rp 3.307.300 - Rp 5.431.900 - Golongan IVd: Rp 3.447.200 - Rp 5.661.700 - Golongan IVe: Rp 3.593.100 - Rp 5.901.200 Besaran Gaji PPPK Adapun gaji untuk Pegawai Pemerintah dengan Perjanjian Kerja diatur berdasarkan Peraturan Presiden (Perpres) Nomor 98 Tahun 2020. Ketetapan gaji PPPK juga diatur dalam Peraturan Pemerintah Nomor 49 Tahun 2018 tentang Manajemen Pegawai Pemerintah dengan Perjanjian Kerja (PPPK). Berikut daftar gaji PPPK per bulan yang dianggarkan pemerintah dari APBN dan APBD: - Golongan I: Rp 1.794.900 - Rp 2.686.200 - Golongan II: Rp 1.960.200 - Rp 2.843.900 - Golongan III: Rp 2.043.200 - Rp 2.964.200 - Golongan IV: Rp 2.129.500 - Rp 3.089.600 - Golongan V: Rp 2.325.600 - Rp 3.879.700 - Golongan VI: Rp 2.539.700 - Rp 4.043.800 - Golongan VII: Rp 2.647.200 - Rp 4.214.900 - Golongan VIII: Rp 2.759.100 - Rp 4.393.100 - Golongan IX: Rp 2.966.500 - Rp 4.872.000 - Golongan X: Rp 3.091.900 - Rp 5.078.000 - Golongan XI: Rp 3.222.700 - Rp 5.292.800 - Golongan XII: Rp 3.359.000 - Rp 5.516.800 - Golongan XIII: Rp 3.501.100 - Rp 5.750.100 - Golongan XIV: Rp 3.649.200 - Rp 5.993.300 - Golongan XV: Rp 3.803.500 - Rp 6.246.900 - Golongan XVI: Rp 3.964.500 - Rp 6.511.100 - Golongan XVII: Rp 4.132.200 - Rp 6.786.500 Jadwal Seleksi CPNS 2023 Pemerintah melalui Kementerian Pendayagunaan Aparatur Negara dan Reformasi Birokrasi (Kemenparb) dan Badan Kepegawaian Negara (BKN) akan membuka seleksi Calon Pegawai Negeri Sipil (CPNS) pada September mendatang, Berdasarkan usulan dari BKN kepada Menteri Pendayagunaan Aparatur Negara dan Reformasi Birokrasi (Menpan RB), pendaftaran seleksi CPNS 2023 akan dibuka 17 September 2023. Pendaftaran CPNS 2023 akan berlangsung hingga 3 Oktober 2023 yang dilanjutkan dengan seleksi administrasi. Namun perlu digarisbawahi, jadwal pelaksanaan seleksi CPNS 2023 yang sudah beredar ini masih sebatas usulan. Artinya, jadwal CPNS 2023 bisa saja masih berubah-ubah sesuai dengan keputusan Menpan RB, Azwar Anas. (Tribunnews.com/Mikael Dafit)";23-08-2023;https://www.tribunnews.com/bisnis/2023/08/23/besaran-gaji-pns-dan-pppk-berdasarkan-golongan-dan-lamanya-masa-kerja;tribunnews.com – berikut perbedaan gaji pegawai negeri sipil (pns) dan pegawai pemerintah dengan perjanjian kerja (pppk). meski sama-sama berstatus sebagai aparatur sipil negara (asn), pegawai negeri sipil (pns) dan pegawai pemerintah dengan perjanjian kerja (pppk) memiliki sejumlah perbedaan, seperti status kepegawaian hingga gaji yang didapatkan. untuk lebih jelasnya, berikut tribunnews.com akan mengulas perbedaan gaji pns dan pppk. besaran gaji pns gaji pns diatur dalam peraturan pemerintah (pp) nomor 15 tahun 2019, besaran gaji pokok pns berjenjang sesuai golongan dan lama masa kerja golongan (mkg). berikut gaji pns untuk golongan i hingga iv. hitungan gaji dari yang paling terendah hingga tertinggi disesuaikan berdasarkan mkg mulai dari kurang dari 1 tahun hingga 27 tahun. golongan i (lulusan sd dan smp): berita rekomendasi - golongan ia: rp 1.560.800 - rp 2.335.800 - golongan ib: rp 1.704.500 - rp 2.472.900 - golongan ic: rp 1.776.600 - rp 2.577.500 - golongan id: rp 1.851.800 - rp 2.686.500 golongan ii (lulusan sma dan d-iii): - golongan iia: rp 2.022.200 - rp 3.373.600 - golongan iib: rp 2.208.400 - rp 3.516.300 - golongan iic: rp 2.301.800 - rp 3.665.000 - golongan iid: rp 2.399.200 - rp 3.820.000 golongan iii (lulusan s1 atau s3): - golongan iiia: rp 2.579.400 - rp 4.236.400 - golongan iiib: rp 2.688.500 - rp 4.415.600 - golongan iiic: rp 2.802.300 - rp 4.602.400 - golongan iiid: rp 2.920.800 - rp 4.797.000 golongan iv: - golongan iva: rp 3.044.300 - rp 5.000.000 - golongan ivb: rp 3.173.100 - rp 5.211.500 - golongan ivc: rp 3.307.300 - rp 5.431.900 - golongan ivd: rp 3.447.200 - rp 5.661.700 - golongan ive: rp 3.593.100 - rp 5.901.200 besaran gaji pppk adapun gaji untuk pegawai pemerintah dengan perjanjian kerja diatur berdasarkan peraturan presiden (perpres) nomor 98 tahun 2020. ketetapan gaji pppk juga diatur dalam peraturan pemerintah nomor 49 tahun 2018 tentang manajemen pegawai pemerintah dengan perjanjian kerja (pppk). berikut daftar gaji pppk per bulan yang dianggarkan pemerintah dari apbn dan apbd: - golongan i: rp 1.794.900 - rp 2.686.200 - golongan ii: rp 1.960.200 - rp 2.843.900 - golongan iii: rp 2.043.200 - rp 2.964.200 - golongan iv: rp 2.129.500 - rp 3.089.600 - golongan v: rp 2.325.600 - rp 3.879.700 - golongan vi: rp 2.539.700 - rp 4.043.800 - golongan vii: rp 2.647.200 - rp 4.214.900 - golongan viii: rp 2.759.100 - rp 4.393.100 - golongan ix: rp 2.966.500 - rp 4.872.000 - golongan x: rp 3.091.900 - rp 5.078.000 - golongan xi: rp 3.222.700 - rp 5.292.800 - golongan xii: rp 3.359.000 - rp 5.516.800 - golongan xiii: rp 3.501.100 - rp 5.750.100 - golongan xiv: rp 3.649.200 - rp 5.993.300 - golongan xv: rp 3.803.500 - rp 6.246.900 - golongan xvi: rp 3.964.500 - rp 6.511.100 - golongan xvii: rp 4.132.200 - rp 6.786.500 jadwal seleksi cpns 2023 pemerintah melalui kementerian pendayagunaan aparatur negara dan reformasi birokrasi (kemenparb) dan badan kepegawaian negara (bkn) akan membuka seleksi calon pegawai negeri sipil (cpns) pada september mendatang, berdasarkan usulan dari bkn kepada menteri pendayagunaan aparatur negara dan reformasi birokrasi (menpan rb), pendaftaran seleksi cpns 2023 akan dibuka 17 september 2023. pendaftaran cpns 2023 akan berlangsung hingga 3 oktober 2023 yang dilanjutkan dengan seleksi administrasi. namun perlu digarisbawahi, jadwal pelaksanaan seleksi cpns 2023 yang sudah beredar ini masih sebatas usulan. artinya, jadwal cpns 2023 bisa saja masih berubah-ubah sesuai dengan keputusan menpan rb, azwar anas. (tribunnews.com/mikael dafit)
