Title;Content;Date;URL;Cleaned Article
             Analisa Penyebab IHSG Jatuh 1%, Apa yang Terjadi?            ;Jakarta, CNBC Indonesia - Indeks Harga Saham Gabungan (IHSG) melemah lebih dari 1% pada perdagangan sesi pertama Rabu (4/10/2023). Indeks tercatat secara eksklusif bergerak di zona merah dan sempat ambles dalam hingga 1,45% ke 6.839,86 sebelum akhirnya memangkas pelemahan pada akhir penutupan sesi pertama ke 6.867,69 atau turun 1,05%. Meski diperdagangkan merah, pasar modal tercatat relatif ramai. Nilai transaksi IHSG sesi I hari ini mencapai Rp 6,75 triliun dengan melibatkan 14,12 miliar saham yang berpindah tangan sebanyak 871 ribu kali. Sebanyak 109 saham menguat, 433 saham melemah dan 190 saham stagnan. Seluruh sektor perdagangan bursa berakhir merah hari ini, dengan pelemahan terbesar terjadi di sektor barang baku yang ambles 2,84%. Lalu diikuti oleh sektor transportasi yang melemah 2,73% dan sektor energi tertekan 2,23%.  Adapun sektor keuangan yang memiliki bobot terbesar di IHSG tercatat tergelincir 0,65% Sementara pelemahan paling kecil dicatatkan oleh sektor teknologi yang turun 0,50%. Saham-saham blue chip kapitalisasi raksasa masih menjadi mesin pendorong ambruknya IHSG hari ini. Secara berurutan 5 emiten dengan sumbangsih penurunan indeks poin terbesar yang menyeret IHSG ambruk masing-masing adalah Barito Pacific (BRPT), Bank Rakyat Indonesia (BBRI), Bank Mandiri (BMRI), Astra Internasional (ASII) dan Bayan Resources (BYAN). Secara spesifik emiten tambang juga menjadi salah satu penyebab utama tumbangnya IHSG hari ini, dengan setengah dari 20 emiten yang menyeret IHSG turun (laggard) merupakan emiten tambang. Hal ini terkonfirmasi dengan 2 dari 3 sektoral dengan penurunan terbesar adalah barang baru dan energi. Pelemahan yang terjadi di pasar keuangan Indonesia tidak spesifik, melainkan juga dirasakan oleh banyak negara lain akibat kabar buruk dari Amerika Serikat. Sentimen tersebut adalah terkait kenaikan imbal hasil (yield) obligasi pemerintah AS (US Treasury) yang kembali menjadi kekhawatiran pasar dan membuat pasar saham global kembali terpuruk. Yield Treasury acuan tenor 10 tahun naik 19 basis poin (bp) ke posisi 4,821%, nyaris menyentuh 5% dan menjadi yang tertinggi sejak 2007 silam. Masih melonjaknya yield Treasury terjadi karena prospek era suku bunga tinggi sepertinya belum akan berakhir dalam waktu dekat, membuat pasar semakin khawatir. Inventor kini memprediksi suku bunga dapat lebih tinggi untuk jangka waktu yang lebih lama. Biaya pinjaman yang lebih tinggi berdampak negatif bagi dunia usaha dan konsumen. Menurut Presiden The Fed Atlanta, Raphael Bostic mengatakan tidak ada urgensi bagi bank sentral untuk menaikkan suku bunga kebijakannya lagi, namun kemungkinan akan memakan waktu yang lama sebelum penurunan suku bunga dianggap tepat. Sedangkan menurut Presiden The Fed Cleveland, Loretta Mester mengatakan dia terbuka untuk menaikkan suku bunga lagi, kemungkinan pada pertemuan bank berikutnya. Sementara itu, ekspektasi pasar mengenai kebijakan ketat The Fed semakin kencang. Perangkat FedWatch Tool menunjukkan sekitar 30,9% pelaku pasar memperkirakan adanya kenaikan suku bunga acuan sebesar 25 bp pada November mendatang. Angka ini lebih besar dibandingkan pekan lalu yang hanya 14%. Di lain sisi, data menunjukkan lowongan pekerjaan di AS secara tak terduga meningkat pada bulan Agustus, memicu kekhawatiran tentang ketatnya pasar tenaga kerja menjelang laporan utama pekerjaan bulanan AS pada Jumat pekan ini. Jika data tenaga kerja Negeri Paman Sam masih cukup kuat, maka The Fed berpotensi belum akan merubah sikapnya menjadi dovish. Apalagi, jika inflasi AS di bulan-bulan berikutnya masih jauh dari target yang ditetapkan The Fed di 2%, maka The Fed juga akan 'kekeuh' mempertahankan sikap hawkish-nya. Pelemahan IHSG terjadi berbarengan dengan pelemahan rupiah dan pasar obligasi pemerintah Indonesia juga ikut terpantau merana. Berdasarkan data dari Refinitiv per pukul 10:21 WIB, imbal hasil (yield) Surat Berharga Negara (SBN) tenor 10 tahun yang merupakan acuan obligasi pemerintah RI naik 2,7 basis poin (bp) ke posisi 7,052%, dari sebelumnya pada penutupan perdagangan kemarin di 7,025%. Diketahui, yield SBN tenor 10 tahun sudah bertahan di kisaran 6,9% sejak Selasa pekan lalu, di mana kenaikannya sudah mencapai 13,3 bp. Bahkan sejak 4 September lalu, kenaikan yield SBN tenor 10 tahun sudah mencapai 68 bp, di mana saat itu yield SBN tenor 10 tahun masih di 6,42%. Naiknya yield SBN menandakan bahwa harganya sedang mengalami penurunan dan investor sedang melepasnya. Sementara itu, rupiah menembus level psikologis Rp15.600/US$ dan bahkan menyentuh angka Rp15.630/US$ atau melemah 0,39%. Pelemahan ini terjadi karena indeks dolar (DXY) terpantau terus mengalami kenaikan karena pasar masih mengharapkan The Fed untuk tetap hawkish. Dalam empat hari terakhir DYX menguat secara konsisten dan signifikan. Pada 29 September tercatat DXY berada di angka 106,22 dan pada hari ini DXY berada di posisi 107,11 atau naik 0,83% dalam empat hari. Apresiasi DXY telah terjadi sejak pertengahan Juli 2023 yang berada di kisaran 99,9 hingga terjadi penguatan sebesar lebih dari 7% dalam waktu kurang dari tiga bulan saja. Tidak sampai di situ, imbal hasil US Treasury tenor 10 tahun juga ikut mengalami apresiasi bahkan per hari ini menyentuh angka 4,84% atau telah naik 5,9% dari 29 September yang berada di posisi 4,57%. Kenaikan imbal hasil AS ini semakin menarik investor untuk masuk dan memberikan capital inflow kepada AS atau dengan kata lain, negara-negara emerging market seperti Indonesia semakin ditinggalkan (terjadi capital outflow). ;04-10-2023;https://www.cnbcindonesia.com/market/20231004123712-17-477775/analisa-penyebab-ihsg-jatuh-1-apa-yang-terjadi;indeks harga saham gabungan (ihsg) melemah lebih dari 1% pada perdagangan sesi pertama rabu (4/10/2023). indeks tercatat secara eksklusif bergerak di zona merah dan sempat ambles dalam hingga 1,45% ke 6.839,86 sebelum akhirnya memangkas pelemahan pada akhir penutupan sesi pertama ke 6.867,69 atau turun 1,05%. meski diperdagangkan merah, pasar modal tercatat relatif ramai. nilai transaksi ihsg sesi i hari ini mencapai rp 6,75 triliun dengan melibatkan 14,12 miliar saham yang berpindah tangan sebanyak 871 ribu kali. sebanyak 109 saham menguat, 433 saham melemah dan 190 saham stagnan. seluruh sektor perdagangan bursa berakhir merah hari ini, dengan pelemahan terbesar terjadi di sektor barang baku yang ambles 2,84%. lalu diikuti oleh sektor transportasi yang melemah 2,73% dan sektor energi tertekan 2,23%. adapun sektor keuangan yang memiliki bobot terbesar di ihsg tercatat tergelincir 0,65% sementara pelemahan paling kecil dicatatkan oleh sektor teknologi yang turun 0,50%. saham-saham blue chip kapitalisasi raksasa masih menjadi mesin pendorong ambruknya ihsg hari ini. secara berurutan 5 emiten dengan sumbangsih penurunan indeks poin terbesar yang menyeret ihsg ambruk masing-masing adalah barito pacific (brpt), bank rakyat indonesia (bbri), bank mandiri (bmri), astra internasional (asii) dan bayan resources (byan). secara spesifik emiten tambang juga menjadi salah satu penyebab utama tumbangnya ihsg hari ini, dengan setengah dari 20 emiten yang menyeret ihsg turun (laggard) merupakan emiten tambang. hal ini terkonfirmasi dengan 2 dari 3 sektoral dengan penurunan terbesar adalah barang baru dan energi. pelemahan yang terjadi di pasar keuangan indonesia tidak spesifik, melainkan juga dirasakan oleh banyak negara lain akibat kabar buruk dari amerika serikat. sentimen tersebut adalah terkait kenaikan imbal hasil (yield) obligasi pemerintah as (us treasury) yang kembali menjadi kekhawatiran pasar dan membuat pasar saham global kembali terpuruk. yield treasury acuan tenor 10 tahun naik 19 basis poin (bp) ke posisi 4,821%, nyaris menyentuh 5% dan menjadi yang tertinggi sejak 2007 silam. masih melonjaknya yield treasury terjadi karena prospek era suku bunga tinggi sepertinya belum akan berakhir dalam waktu dekat, membuat pasar semakin khawatir. inventor kini memprediksi suku bunga dapat lebih tinggi untuk jangka waktu yang lebih lama. biaya pinjaman yang lebih tinggi berdampak negatif bagi dunia usaha dan konsumen. menurut presiden the fed atlanta, raphael bostic mengatakan tidak ada urgensi bagi bank sentral untuk menaikkan suku bunga kebijakannya lagi, namun kemungkinan akan memakan waktu yang lama sebelum penurunan suku bunga dianggap tepat. sedangkan menurut presiden the fed cleveland, loretta mester mengatakan dia terbuka untuk menaikkan suku bunga lagi, kemungkinan pada pertemuan bank berikutnya. sementara itu, ekspektasi pasar mengenai kebijakan ketat the fed semakin kencang. perangkat fedwatch tool menunjukkan sekitar 30,9% pelaku pasar memperkirakan adanya kenaikan suku bunga acuan sebesar 25 bp pada november mendatang. angka ini lebih besar dibandingkan pekan lalu yang hanya 14%. di lain sisi, data menunjukkan lowongan pekerjaan di as secara tak terduga meningkat pada bulan agustus, memicu kekhawatiran tentang ketatnya pasar tenaga kerja menjelang laporan utama pekerjaan bulanan as pada jumat pekan ini. jika data tenaga kerja negeri paman sam masih cukup kuat, maka the fed berpotensi belum akan merubah sikapnya menjadi dovish. apalagi, jika inflasi as di bulan-bulan berikutnya masih jauh dari target yang ditetapkan the fed di 2%, maka the fed juga akan 'kekeuh' mempertahankan sikap hawkish-nya. pelemahan ihsg terjadi berbarengan dengan pelemahan rupiah dan pasar obligasi pemerintah indonesia juga ikut terpantau merana. berdasarkan data dari refinitiv per pukul 10:21 wib, imbal hasil (yield) surat berharga negara (sbn) tenor 10 tahun yang merupakan acuan obligasi pemerintah ri naik 2,7 basis poin (bp) ke posisi 7,052%, dari sebelumnya pada penutupan perdagangan kemarin di 7,025%. diketahui, yield sbn tenor 10 tahun sudah bertahan di kisaran 6,9% sejak selasa pekan lalu, di mana kenaikannya sudah mencapai 13,3 bp. bahkan sejak 4 september lalu, kenaikan yield sbn tenor 10 tahun sudah mencapai 68 bp, di mana saat itu yield sbn tenor 10 tahun masih di 6,42%. naiknya yield sbn menandakan bahwa harganya sedang mengalami penurunan dan investor sedang melepasnya. sementara itu, rupiah menembus level psikologis rp15.600/us$ dan bahkan menyentuh angka rp15.630/us$ atau melemah 0,39%. pelemahan ini terjadi karena indeks dolar (dxy) terpantau terus mengalami kenaikan karena pasar masih mengharapkan the fed untuk tetap hawkish. dalam empat hari terakhir dyx menguat secara konsisten dan signifikan. pada 29 september tercatat dxy berada di angka 106,22 dan pada hari ini dxy berada di posisi 107,11 atau naik 0,83% dalam empat hari. apresiasi dxy telah terjadi sejak pertengahan juli 2023 yang berada di kisaran 99,9 hingga terjadi penguatan sebesar lebih dari 7% dalam waktu kurang dari tiga bulan saja. tidak sampai di situ, imbal hasil us treasury tenor 10 tahun juga ikut mengalami apresiasi bahkan per hari ini menyentuh angka 4,84% atau telah naik 5,9% dari 29 september yang berada di posisi 4,57%. kenaikan imbal hasil as ini semakin menarik investor untuk masuk dan memberikan capital inflow kepada as atau dengan kata lain, negara-negara emerging market seperti indonesia semakin ditinggalkan (terjadi capital outflow). 
             The Fed Masih Hawkish, Aset Investasi Ini Masih Menarik!            ;"Jakarta, CNBC Indonesia - Sikap hawkish bank sentral Amerika Serikat (AS) Federal Reserve (The Fed) membuat investor seluruh dunia semakin berhati-hati memarkirkan uang mereka, baik itu instrumen pilihan atau di mana instrumen tersebut dibeli. Meski demikian, nyatanya ada satu kelas aset yang menjadi atraktif kala bank sentral mempertahankan suku bunga tinggi. Chief Digital Officer PT Mega Capital Sekuritas InvestasiKu Firman Marihot menjelaskan Suku bunga tinggi menyebabkan efek-efek yang sifatnya pendapatan tetap akan lebih menarik karna memberikan imbal hasil (yield) lebih tinggi. Hal terlihat dari penerbitan obligasi baru yang ramai diserbu investor. Hal ini dikarenakan keterkaitan langsung antara suku bunga dan besaran kupon obligasi yang ditawarkan. Secara umum kupon obligasi akan selalu berada di atas suku bunga acuan. Hal ini menyebabkan pada era suku bunga tinggi kupon obligasi yang ditawarkan juga tinggi, begitu juga sebaliknya. Meski era suku bunga tinggi membuat likuiditas terbatas, Firman menegaskan Investor yang baik adalah yang bisa membaca kondisi ekonomi dan memanfaatkan untuk memperoleh keuntungan. ""Investor yang jeli mereka memastikan cuan dari setiap instrumen,"" terang Firman dalam Road to CNBC Indonesia Awards 2023, Best Securities dan Fund Manager, Rabu (27/9). Dirinya juga menambahkan meski instrumen investasi pendapatan tetap cukup atraktif di era suku bunga tinggi, investor yang bijak tentu akan melakukan diversifikasi portofolio. Hal ini karena sejumlah instrumen lain juga menawarkan mitigasi risiko apabila dilakukan pilihan yang baik, baik itu di saham maupun reksa dana.  Apalagi dengan luasnya pilihan yang ada di pasar ekuitas domestik dengan 11 sektor saham dan puluhan sub sektor.";27-09-2023;https://www.cnbcindonesia.com/market/20230927144604-17-476020/the-fed-masih-hawkish-aset-investasi-ini-masih-menarik;"sikap hawkish bank sentral amerika serikat (as) federal reserve (the fed) membuat investor seluruh dunia semakin berhati-hati memarkirkan uang mereka, baik itu instrumen pilihan atau di mana instrumen tersebut dibeli. meski demikian, nyatanya ada satu kelas aset yang menjadi atraktif kala bank sentral mempertahankan suku bunga tinggi. chief digital officer pt mega capital sekuritas investasiku firman marihot menjelaskan suku bunga tinggi menyebabkan efek-efek yang sifatnya pendapatan tetap akan lebih menarik karna memberikan imbal hasil (yield) lebih tinggi. hal terlihat dari penerbitan obligasi baru yang ramai diserbu investor. hal ini dikarenakan keterkaitan langsung antara suku bunga dan besaran kupon obligasi yang ditawarkan. secara umum kupon obligasi akan selalu berada di atas suku bunga acuan. hal ini menyebabkan pada era suku bunga tinggi kupon obligasi yang ditawarkan juga tinggi, begitu juga sebaliknya. meski era suku bunga tinggi membuat likuiditas terbatas, firman menegaskan investor yang baik adalah yang bisa membaca kondisi ekonomi dan memanfaatkan untuk memperoleh keuntungan. ""investor yang jeli mereka memastikan cuan dari setiap instrumen,"" terang firman dalam road to cnbc indonesia awards 2023, best securities dan fund manager, rabu (27/9). dirinya juga menambahkan meski instrumen investasi pendapatan tetap cukup atraktif di era suku bunga tinggi, investor yang bijak tentu akan melakukan diversifikasi portofolio. hal ini karena sejumlah instrumen lain juga menawarkan mitigasi risiko apabila dilakukan pilihan yang baik, baik itu di saham maupun reksa dana. apalagi dengan luasnya pilihan yang ada di pasar ekuitas domestik dengan 11 sektor saham dan puluhan sub sektor."
             Saham Tambang Bikin IHSG Tumbang 1% Lebih            ;Jakarta, CNBC Indonesia - Indeks Harga Saham Gabungan (IHSG) terpantau ambles pada perdagangan sesi I Rabu (4/10/2023), di mana emiten pertambangan menjadi pemberat terbesar IHSG pada sesi I hari ini. Hingga pukul 12:00 WIB, IHSG ambles 1,05% ke posisi 6.867,69. IHSG terkoreksi ke level psikologis 6.800 pada sesi I hari ini. Emiten pertambangan mendominasi laggard atau pemberat IHSG pada sesi I hari ini, di mana saham PT Bayan Resources Tbk (BYAN) menjadi pemberat terbesar IHSG pada sesi I hari ini, yakni mencapai 3,8 indeks poin. Saham BYAN sendiri ambles 1,23% ke posisi Rp 18.000/unit. Berikut emiten pertambangan raksasa yang membebani IHSG pada sesi I hari ini. Sumber: Refinitiv Emiten pertambangan RI berjatuhan dan membebani IHSG karena pergerakan komoditas global yang juga cenderung lesu akibat potensi pengetatan kebijakan moneter bank sentral Amerika Serikat (AS), Federal Reserve (The Fed) yang masih akan terjadi setidaknya hingga akhir tahun ini. Inventor kini memprediksi suku bunga dapat lebih tinggi untuk jangka waktu yang lebih lama. Biaya pinjaman yang lebih tinggi berdampak negatif bagi dunia usaha dan konsumen. Menurut Presiden The Fed Atlanta, Raphael Bostic mengatakan tidak ada urgensi bagi bank sentral untuk menaikkan suku bunga kebijakannya lagi, namun kemungkinan akan memakan waktu yang lama sebelum penurunan suku bunga dianggap tepat.  Sedangkan menurut Presiden The Fed Cleveland, Loretta Mester mengatakan dia terbuka untuk menaikkan suku bunga lagi, kemungkinan pada pertemuan bank berikutnya. Sementara itu, ekspektasi pasar mengenai kebijakan ketat The Fed semakin kencang. Perangkat FedWatch Tool menunjukkan sekitar 30,9% pelaku pasar memperkirakan adanya kenaikan suku bunga acuan sebesar 25 bp pada November mendatang. Angka ini lebih besar dibandingkan pekan lalu yang hanya 14%. The Fed yang masih akan hawkish setidaknya hingga akhir tahun ini, bahkan hingga awal tahun depan membuat imbal hasil (yield) obligasi pemerintah AS (US Treasury) kembali mencetak rekor tertingginya sejak 2007. Yield Treasury acuan tenor 10 tahun naik 19 basis poin (bp) ke posisi 4,821%, nyaris menyentuh 5% dan menjadi yang tertinggi sejak 2007 silam. Ketika yield Treasury kembali melonjak, maka investor cenderung menahan investasinya dan juga cenderung menghindari aset berisiko seperti saham dan juga berinvestasi di komoditas. Alhasil, koreksi pun tak terhindarkan karena investor cenderung mengamankan portofolionya dengan melakukan aksi profit taking dan menanti hingga kondisi pasar sudah lebih kondusif. CNBC INDONESIA RESEARCH [email protected] Sanggahan: Artikel ini adalah produk jurnalistik berupa pandangan CNBC Indonesia Research. Analisis ini tidak bertujuan mengajak pembaca untuk membeli, menahan, atau menjual produk atau sektor investasi terkait. Keputusan sepenuhnya ada pada diri pembaca, sehingga kami tidak bertanggung jawab terhadap segala kerugian maupun keuntungan yang timbul dari keputusan tersebut.;04-10-2023;https://www.cnbcindonesia.com/market/20231004122108-17-477770/saham-tambang-bikin-ihsg-tumbang-1-lebih;indeks harga saham gabungan (ihsg) terpantau ambles pada perdagangan sesi i rabu (4/10/2023), di mana emiten pertambangan menjadi pemberat terbesar ihsg pada sesi i hari ini. hingga pukul 12:00 wib, ihsg ambles 1,05% ke posisi 6.867,69. ihsg terkoreksi ke level psikologis 6.800 pada sesi i hari ini. emiten pertambangan mendominasi laggard atau pemberat ihsg pada sesi i hari ini, di mana saham pt bayan resources tbk (byan) menjadi pemberat terbesar ihsg pada sesi i hari ini, yakni mencapai 3,8 indeks poin. saham byan sendiri ambles 1,23% ke posisi rp 18.000/unit. berikut emiten pertambangan raksasa yang membebani ihsg pada sesi i hari ini. sumber: refinitiv emiten pertambangan ri berjatuhan dan membebani ihsg karena pergerakan komoditas global yang juga cenderung lesu akibat potensi pengetatan kebijakan moneter bank sentral amerika serikat (as), federal reserve (the fed) yang masih akan terjadi setidaknya hingga akhir tahun ini. inventor kini memprediksi suku bunga dapat lebih tinggi untuk jangka waktu yang lebih lama. biaya pinjaman yang lebih tinggi berdampak negatif bagi dunia usaha dan konsumen. menurut presiden the fed atlanta, raphael bostic mengatakan tidak ada urgensi bagi bank sentral untuk menaikkan suku bunga kebijakannya lagi, namun kemungkinan akan memakan waktu yang lama sebelum penurunan suku bunga dianggap tepat. sedangkan menurut presiden the fed cleveland, loretta mester mengatakan dia terbuka untuk menaikkan suku bunga lagi, kemungkinan pada pertemuan bank berikutnya. sementara itu, ekspektasi pasar mengenai kebijakan ketat the fed semakin kencang. perangkat fedwatch tool menunjukkan sekitar 30,9% pelaku pasar memperkirakan adanya kenaikan suku bunga acuan sebesar 25 bp pada november mendatang. angka ini lebih besar dibandingkan pekan lalu yang hanya 14%. the fed yang masih akan hawkish setidaknya hingga akhir tahun ini, bahkan hingga awal tahun depan membuat imbal hasil (yield) obligasi pemerintah as (us treasury) kembali mencetak rekor tertingginya sejak 2007. yield treasury acuan tenor 10 tahun naik 19 basis poin (bp) ke posisi 4,821%, nyaris menyentuh 5% dan menjadi yang tertinggi sejak 2007 silam. ketika yield treasury kembali melonjak, maka investor cenderung menahan investasinya dan juga cenderung menghindari aset berisiko seperti saham dan juga berinvestasi di komoditas. alhasil, koreksi pun tak terhindarkan karena investor cenderung mengamankan portofolionya dengan melakukan aksi profit taking dan menanti hingga kondisi pasar sudah lebih kondusif. cnbc indonesia research [email protected] sanggahan: artikel ini adalah produk jurnalistik berupa pandangan 
             Cek! Pergerakan IHSG Sepekan 30 September 2023            ;Jakarta,CNBC Indonesia - Indeks Harga Saham Gabungan (IHSG) ditutup menguat 0,03% atau ke 6.939,89 pada akhir perdagangan pekan ini, Jumat (29/09/2023). Secara kesleuruhan, IHSG ambruk 1,1% pekan ini. Pelemahan ini mengakhiri tren positif bursa saham Indonesia yang menguat pada dua pekan sebelumnya. IHSG ditutup menguat dua kali dan melemah dua kali sepanjang pekan ini. IHSG juga tak kuasa mengakhiri perdagangan di level 7.000. Ambruknya IHSG tak bisa dilepaskan dari gonjang-ganjing di ekonomi global terutama Amerika Serikat (AS). Pelaku pasar berekspektasi The Fed masih akan hawkish sehingga membuat bursa saham global jeblok. Menjelang akhir pekan, bursa saham juga digoyang ketidakpastian dari AS berupa ancaman shutdown akibat kongres dan pemerintah belum juga menemui kesepakatan soal pendanaan pemerintah.;30-09-2023;https://www.cnbcindonesia.com/market/20230930104859-20-476656/cek-pergerakan-ihsg-sepekan-30-september-2023;jakarta,cnbc indonesia - indeks harga saham gabungan (ihsg) ditutup menguat 0,03% atau ke 6.939,89 pada akhir perdagangan pekan ini, jumat (29/09/2023). secara kesleuruhan, ihsg ambruk 1,1% pekan ini. pelemahan ini mengakhiri tren positif bursa saham indonesia yang menguat pada dua pekan sebelumnya. ihsg ditutup menguat dua kali dan melemah dua kali sepanjang pekan ini. ihsg juga tak kuasa mengakhiri perdagangan di level 7.000. ambruknya ihsg tak bisa dilepaskan dari gonjang-ganjing di ekonomi global terutama amerika serikat (as). pelaku pasar berekspektasi the fed masih akan hawkish sehingga membuat bursa saham global jeblok. menjelang akhir pekan, bursa saham juga digoyang ketidakpastian dari as berupa ancaman shutdown akibat kongres dan pemerintah belum juga menemui kesepakatan soal pendanaan pemerintah.
