Title;Content;Date;URL;Cleaned Article
Menakar Dampak Belanja Caleg Pemilu 2024 ke Pertumbuhan Ekonomi Indonesia;"BOGOR, KOMPAS.com - Rangkaian Pemilihan Umum (Pemilu) pada 2024 diproyeksi mendongkrak pertumbuhan ekonomi nasional. Salah satu aktivitas yang akan berkontribusi cukup besar terhadap produk domestik bruto (PDB) RI ialah belanja calon legislatif atau caleg.  Kepala Pusat Kebijakan Ekonomi Makro Badan Kebijakan Fiskal Kementerian Keuangan Abdurohman mengatakan, belanja caleg akan terefleksikan dalam komponen konsumsi lembaga non profit (LNPRT). Kontribusi belanja caleg ke LNPRT akan mulai terefleksikan pada tahun ini dan tahun 2024.  ""Efek Pemilu lainnya adalah juga mendorong belanja yang dilakukan caleg,"" kata dia, dalam gelaran Media Gathering Kementerian Keuangan, di Bogor, Senin (25/9/2023).  Menurutnya, belanja caleg di Pemilu 2024 akan membantu mendongkrak konsumsi LNPRT sebesar 4,72 persen pada 2023. Kemudian angka tersebut akan meningkat menjadi 6,57 persen pada 2024.  Angka tersebut didapat dengan menghitung jumlah potensi caleg dan pengeluarannya. Abdurohman bilang, pada 2019 lalu, terdapat 8.037 caleg yang memperebutkan kursi Dewan Perwakilan Rakyat (DPR) dan terdapat 258.631 caleg yang memperebutkan kursi Dewan Perwakilan Rakyat Daerah (DPRD) tingkat 1 dan tingkat 2.  ""Ini kalau kita asumsikan bahwa jumlah caleg tetap,"" ujarnya.  Untuk yang memperebutkan kursi legislatif tingkat provinsi, Abdurohman menyebutkan, rata-rata pengeluaran caleg adalah sebesar Rp 1 miliar. Sementara itu, rata-rata pengeluaran caleg yang memperebutkan kursi legislatif tingkat kota dan kabupaten rata-rata mengeluarkan Rp 200 juta.  ""Ini dirata-ratakan saja, asumsi moderat, jadi dari situ total dampak ke LNPRT 2023 sekitar 4,72 persen, kemudian 2024 6,57 persen,"" tuturnya.  Selain ke LNPRT, belanja caleg di Pemilu 2024 juga akan berdampak ke komponen konsumsi rumah tangga. Hal ini seiring dengan uang yang digelontorkan para caleg ke pelaku usaha nasional.  Abdurohman menyebutkan, belanja caleg akan membantu pertumbuhan konsumsi rumah tangga sebesar 0,2 persen pada 2023. Sementara pada tahun depan, belanja caleg diprediksi mendongkrak pertumbuhan konsumsi rumah tangga sebesar 0,27 persen.  ""Itu akan sedikit mengkompensasi pelemahan global,"" ucap dia. ";25-09-2023;https://money.kompas.com/read/2023/09/25/174000426/menakar-dampak-belanja-caleg-pemilu-2024-ke-pertumbuhan-ekonomi-indonesia?page=all;"bogor,rangkaian pemilihan umum (pemilu) pada 2024 diproyeksi mendongkrak pertumbuhan ekonomi nasional. salah satu aktivitas yang akan berkontribusi cukup besar terhadap produk domestik bruto (pdb) ri ialah belanja calon legislatif atau caleg. kepala pusat kebijakan ekonomi makro badan kebijakan fiskal kementerian keuangan abdurohman mengatakan, belanja caleg akan terefleksikan dalam komponen konsumsi lembaga non profit (lnprt). kontribusi belanja caleg ke lnprt akan mulai terefleksikan pada tahun ini dan tahun 2024. ""efek pemilu lainnya adalah juga mendorong belanja yang dilakukan caleg,"" kata dia, dalam gelaran media gathering kementerian keuangan, di bogor, senin (25/9/2023). menurutnya, belanja caleg di pemilu 2024 akan membantu mendongkrak konsumsi lnprt sebesar 4,72 persen pada 2023. kemudian angka tersebut akan meningkat menjadi 6,57 persen pada 2024. angka tersebut didapat dengan menghitung jumlah potensi caleg dan pengeluarannya. abdurohman bilang, pada 2019 lalu, terdapat 8.037 caleg yang memperebutkan kursi dewan perwakilan rakyat (dpr) dan terdapat 258.631 caleg yang memperebutkan kursi dewan perwakilan rakyat daerah (dprd) tingkat 1 dan tingkat 2. ""ini kalau kita asumsikan bahwa jumlah caleg tetap,"" ujarnya. untuk yang memperebutkan kursi legislatif tingkat provinsi, abdurohman menyebutkan, rata-rata pengeluaran caleg adalah sebesar rp 1 miliar. sementara itu, rata-rata pengeluaran caleg yang memperebutkan kursi legislatif tingkat kota dan kabupaten rata-rata mengeluarkan rp 200 juta. ""ini dirata-ratakan saja, asumsi moderat, jadi dari situ total dampak ke lnprt 2023 sekitar 4,72 persen, kemudian 2024 6,57 persen,"" tuturnya. selain ke lnprt, belanja caleg di pemilu 2024 juga akan berdampak ke komponen konsumsi rumah tangga. hal ini seiring dengan uang yang digelontorkan para caleg ke pelaku usaha nasional. abdurohman menyebutkan, belanja caleg akan membantu pertumbuhan konsumsi rumah tangga sebesar 0,2 persen pada 2023. sementara pada tahun depan, belanja caleg diprediksi mendongkrak pertumbuhan konsumsi rumah tangga sebesar 0,27 persen. ""itu akan sedikit mengkompensasi pelemahan global,"" ucap dia. "
             Tok! The Fed Tahan Suku Bunga, Isyaratkan Kenaikan Lagi            ;"Jakarta, CNBC Indonesia - Bank sentral Amerika Serikat (AS) The Federal Reserve (The Fed) memutuskan untuk menahan suku bunga acuan di level 5,25-5,50% sesuai ekspektasi pasar. Namun, The Fed mengisyaratkan mereka akan tetap hawkish dan membuka kemungkinan kenaikan suku bunga ke depan. Hasil rapat Federal Open Market Committee (FOMC) juga mengindikasikan jika kebijakan moneter yang ketat akan tetap berlanjut hingga 2024 dan akan memangkas suku bunga lebih sedikit dari indikasi sebelumnya. Dokumen dot plot The Fed menunjukkan suku bunga akan ada di kisaran 5,5-5,75% pada tahun ini. Artinya, ada indikasi jika The Fed akan menaikkan suku bunga sebesar 25 bps lagi hingga akhir tahun. ""Indikator terkini menunjukkan jika aktivitas ekonomi masih solid. Penambahan tenaga kerja melandai dalam beberapa bulan terakhir tetapi tetap kuat. Tingkat pengangguran tetap rendah tetapi inflasi masih naik,"" tutur The Fed dalam keterangan resminya, dikutip dari situs resmi The Fed. The Fed menjelaskan jika mereka akan memutuskan kebijakan ke depan secara hati-hati berdasarkan data yang berkembang serta mempertimbangkan outlook serta risikonya.  ""Kami bersiap untuk menaikkan suku bunga lebih lanjut jika diperlukan dan kami tetap menahan kebijakan pada level terbatas sampai kami percaya diri kalau inflasi memang terus bergerak melandai menuju sasaran kami,"" ujar Chairman The Fed Jerome Powell usai rapat FOMC, dikutip dari CNBC International. Pernyataan Powell ini sedikit mengecewakan pasar yang sudah berekspektasi jika The Fed akan memangkas suku bunga secara signifikan pada tahun depan. Ekspektasi pasar sepertinya sulit tercapai melihat banyaknya pejabat The Fed yang ingin mempertahankan kebijakan ketat. Sebanyak 10 dari 19 pejabat The Fed memperkirakan kebijakan suku bunga masih di atas 5% hingga tahun depan.       The Fed Revisi Pertumbuhan AS Selain memutuskan kebijakan suku bunga, rapat FOMC September juga merevisi proyeksi sejumlah indikator ekonomi, termasuk pertumbuhan ekonomi AS. The Fed merevisi ke atas pertumbuhan ekonomi AS menjadi 2,1% pada tahun ini, naik dua kali lipat lebih dari 1% pada proyeksi Juni.Ekonomi AS diperkirakan tumbuh 1,5% pada 2024, dari 1,1% pada proyeksi sebelumnya. Tingkat pengangguran akan berada di kisaran 3,8% pada tahun ini, lebih rendah dibandingkan 4,1% pada proyeksi Juni. Pengangguran akan berada di angka 4,1% pada 2024, dari 4,5% pada proyeksi sebelumnya. Personal Consumption Expenditures(PCE).akan berada di 3,3% pada tahun ini, lebih tinggi dibandingkan 3,2% pada proyeksi sebelumnya. Inflasi inti diperkirakan akan bergerak di 3,7% pada 2023, lebih rendah dibandingkan proyeksi sebelumnya yakni 3,9%. Proyeksi ekonomi yang lebih baik tersebut menandai jika The Fed melihat ekonomi masih kencang dan pasar tenaga keras masih panas. The Fed juga percaya diri jika mereka bisa menekan inflasi tanpa harus membuat ekonomi AS limbung.  Proyeksi ini membuat perusahaan dan rumah tangga harus bersiap untuk menghadapi kemungkinan kenaikan suku bunga ke depan yang berimbas pada meningkatnya ongkos pinjaman. ""Saya selalu berpikir jika soft landing adalah outlook (pertumbuhan) yang paling memungkinkan dan sejauh ini masih benar,"" tutur Powell. Pemangkasan Suku Bunga 2024 Lebih Sedikit Proyeksi The Fed menunjukkan suku bunga (The Fed Fund rate/FFR) akan akan mencapai puncaknya di angka 5,6% pada tahun ini. Suku bunga akan turun hingga 5,1% hingga 2024 dan 3,9% hingga 2025. Suku bunga sekitar 5,1% pada 2024 lebih tinggi dibandingkan pada proyeksi Juni yakni 4,6%. Dokumen dot plot The Fed menunjukkan jika The Fed cenderung untuk menaikkan suku bunga sekali lagi pada tahun ini sebelum memangkas dua kali pada 2024 atau sekitar 50 bps. Proyeksi ini lebih rendah dibandingkan yang mereka indikasikan pada Juni lalu yakni sekitar 100 bps. ""Kami ingin melihat bukti yang meyakinkan jika kami sudah mencapai level yang tepat dan kami memang melihat kemajuan itu dan menyambut baik. Namun, seperti yang kalian tahu, kami ingin kemajuan yang lebih berarti sebelum kami sampai pada keputusan akhir,"" tutur Powell.  Sebanyak 12 pejabat The Fed memperkirakan adanya tambahan kenaikan pada tahun ini sementara tujuh anggota lainnya lebih kepada menahan suku bunga. Tak ada satupun yang berekspektasi adanya pemangkasan suku bunga. ""Pesannya sangat terlihat jelas jika revisi ke atas pertumbuhan ekonomi dan merevisi ke bawah tingkat pengangguran pada 2024 adalah indikasi jelas jika The Fed berekspektasi ekonomi akan soft landing meskipun suku bunga tinggi akan bertahan lama,"" tutur Olu Sonola, analis dari Fitch Ratings, dikutip dari CNBC International. CNBC INDONESIA RESEARCH [email protected] ";21-09-2023;https://www.cnbcindonesia.com/research/20230921045337-128-474254/tok-the-fed-tahan-suku-bunga-isyaratkan-kenaikan-lagi;"bank sentral amerika serikat (as) the federal reserve (the fed) memutuskan untuk menahan suku bunga acuan di level 5,25-5,50% sesuai ekspektasi pasar. namun, the fed mengisyaratkan mereka akan tetap hawkish dan membuka kemungkinan kenaikan suku bunga ke depan. hasil rapat federal open market committee (fomc) juga mengindikasikan jika kebijakan moneter yang ketat akan tetap berlanjut hingga 2024 dan akan memangkas suku bunga lebih sedikit dari indikasi sebelumnya. dokumen dot plot the fed menunjukkan suku bunga akan ada di kisaran 5,5-5,75% pada tahun ini. artinya, ada indikasi jika the fed akan menaikkan suku bunga sebesar 25 bps lagi hingga akhir tahun. ""indikator terkini menunjukkan jika aktivitas ekonomi masih solid. penambahan tenaga kerja melandai dalam beberapa bulan terakhir tetapi tetap kuat. tingkat pengangguran tetap rendah tetapi inflasi masih naik,"" tutur the fed dalam keterangan resminya, dikutip dari situs resmi the fed. the fed menjelaskan jika mereka akan memutuskan kebijakan ke depan secara hati-hati berdasarkan data yang berkembang serta mempertimbangkan outlook serta risikonya. ""kami bersiap untuk menaikkan suku bunga lebih lanjut jika diperlukan dan kami tetap menahan kebijakan pada level terbatas sampai kami percaya diri kalau inflasi memang terus bergerak melandai menuju sasaran kami,"" ujar chairman the fed jerome powell usai rapat fomc, dikutip dari cnbc international. pernyataan powell ini sedikit mengecewakan pasar yang sudah berekspektasi jika the fed akan memangkas suku bunga secara signifikan pada tahun depan. ekspektasi pasar sepertinya sulit tercapai melihat banyaknya pejabat the fed yang ingin mempertahankan kebijakan ketat. sebanyak 10 dari 19 pejabat the fed memperkirakan kebijakan suku bunga masih di atas 5% hingga tahun depan. the fed revisi pertumbuhan as selain memutuskan kebijakan suku bunga, rapat fomc september juga merevisi proyeksi sejumlah indikator ekonomi, termasuk pertumbuhan ekonomi as. the fed merevisi ke atas pertumbuhan ekonomi as menjadi 2,1% pada tahun ini, naik dua kali lipat lebih dari 1% pada proyeksi juni.ekonomi as diperkirakan tumbuh 1,5% pada 2024, dari 1,1% pada proyeksi sebelumnya. tingkat pengangguran akan berada di kisaran 3,8% pada tahun ini, lebih rendah dibandingkan 4,1% pada proyeksi juni. pengangguran akan berada di angka 4,1% pada 2024, dari 4,5% pada proyeksi sebelumnya. personal consumption expenditures(pce).akan berada di 3,3% pada tahun ini, lebih tinggi dibandingkan 3,2% pada proyeksi sebelumnya. inflasi inti diperkirakan akan bergerak di 3,7% pada 2023, lebih rendah dibandingkan proyeksi sebelumnya yakni 3,9%. proyeksi ekonomi yang lebih baik tersebut menandai jika the fed melihat ekonomi masih kencang dan pasar tenaga keras masih panas. the fed juga percaya diri jika mereka bisa menekan inflasi tanpa harus membuat ekonomi as limbung. proyeksi ini membuat perusahaan dan rumah tangga harus bersiap untuk menghadapi kemungkinan kenaikan suku bunga ke depan yang berimbas pada meningkatnya ongkos pinjaman. ""saya selalu berpikir jika soft landing adalah outlook (pertumbuhan) yang paling memungkinkan dan sejauh ini masih benar,"" tutur powell. pemangkasan suku bunga 2024 lebih sedikit proyeksi the fed menunjukkan suku bunga (the fed fund rate/ffr) akan akan mencapai puncaknya di angka 5,6% pada tahun ini. suku bunga akan turun hingga 5,1% hingga 2024 dan 3,9% hingga 2025. suku bunga sekitar 5,1% pada 2024 lebih tinggi dibandingkan pada proyeksi juni yakni 4,6%. dokumen dot plot the fed menunjukkan jika the fed cenderung untuk menaikkan suku bunga sekali lagi pada tahun ini sebelum memangkas dua kali pada 2024 atau sekitar 50 bps. proyeksi ini lebih rendah dibandingkan yang mereka indikasikan pada juni lalu yakni sekitar 100 bps. ""kami ingin melihat bukti yang meyakinkan jika kami sudah mencapai level yang tepat dan kami memang melihat kemajuan itu dan menyambut baik. namun, seperti yang kalian tahu, kami ingin kemajuan yang lebih berarti sebelum kami sampai pada keputusan akhir,"" tutur powell. sebanyak 12 pejabat the fed memperkirakan adanya tambahan kenaikan pada tahun ini sementara tujuh anggota lainnya lebih kepada menahan suku bunga. tak ada satupun yang berekspektasi adanya pemangkasan suku bunga. ""pesannya sangat terlihat jelas jika revisi ke atas pertumbuhan ekonomi dan merevisi ke bawah tingkat pengangguran pada 2024 adalah indikasi jelas jika the fed berekspektasi ekonomi akan soft landing meskipun suku bunga tinggi akan bertahan lama,"" tutur olu sonola, analis dari fitch ratings, dikutip dari cnbc international. cnbc indonesia research [email protected] "
             IHSG Tinggalkan 7.000, 4 Saham Ini Biang Keroknya            ;"Jakarta, CNBC Indonesia - Indeks Harga Saham Gabungan (IHSG) ditutup melemah pada perdagangan Senin (25/9/2023) awal pekan ini, setelah bergerak volatil sepanjang perdagangan hari ini. IHSG ditutup melemah 0,26% ke posisi 6.998,381. IHSG pun terkoreksi hingga menyentuh level psikologis 6.900, setelah bertahan di level psikologis 7.000. Secara sektoral, sektor teknologi dan industri menjadi pemberat IHSG pada hari ini. Sektor teknologi memberatkan indeks hingga 1,61%, sedangkan sektor industri memberatkan sebesar 0,82%. Selain itu, beberapa saham juga menjadi pemberat IHSG. Berikut saham-saham yang menjadi pemberat IHSG pada perdagangan hari ini. Sumber: Refinitiv Saham telekomunikasi BUMN PT Telkom Indonesia Tbk (TLKM) menjadi pemberat terbesar IHSG pada hari ini, yakni mencapai 11,21 indeks poin. Tak hanya itu, dua saham bank raksasa yakni PT Bank Rakyat Indonesia Tbk (BBRI) dan PT Bank Central Asia Tbk (BBCA) juga memberatkan indeks masing-masing 5,48 indeks poin dan 5,09 indeks poin. IHSG berakhir di zona merah pada perdagangan awal pekan ini, setelah bergerak volatil sepanjang hari ini. Investor cenderung masih wait and see di tengah upaya bank sentral Amerika Serikat (AS), Federal Reserve (The Fed) yang masih berjuang dalam menekan inflasinya. Sebagai informasi, Amerika Serikat (AS) mencatatkan inflasi sebesar 3,7% secara tahunan (year-on-year/yoy) pada Agustus 2023, naik dari inflasi pada bulan sebelumnya sebesar 3,2% YoY. Alhasil, The Fed mengisyaratkan mereka akan tetap hawkish dan membuka kemungkinan kenaikan suku bunga ke depan.   Hasil rapat Federal Open Market Committee (FOMC) pada pekan lalu juga mengindikasikan jika kebijakan moneter yang ketat akan tetap berlanjut hingga 2024 dan akan memangkas suku bunga lebih sedikit dari indikasi sebelumnya. Berdasarkan perangkat FedWatch, survei menunjukkan 20,3% The Fed akan menaikkan suku bunganya sebesar 25 basis poin (bp) pada FOMC November. Sementara pada FOMC Desember, persentasenya mengalami peningkatan menjadi 35,5% untuk The Fed mengalami peningkatan menjadi 5,50-5,75%. Di lain sisi, IHSG berakhir merana menjelang diresmikannya bursa karbon pada Selasa besok. Sebelumnya, bursa karbon akan diluncurkan secara resmi pada tanggal 26 September 2023. Bursa Efek Indonesia (BEI) pun telah resmi ditunjuk Otoritas Jasa Keuangan (OJK) menjadi penyelenggara bursa karbon. Direktur Pengembangan BEI Jeffrey Hendrik mengatakan, saat ini BEI sedang melakukan proses finalisasi aturan bursa karbon tersebut. Sesuai Peraturan OJK (POJK) Nomor 14 tahun 2023, maka bursa karbon akan memperdagangkan unit karbon yang tercatat di SRN PPI. ""Saat ini BEI sedang finalisasi Peraturan Bursa Karbon,"" ujarnya kepada wartawan, dikutip Rabu (20/9). Jeffrey mengungkapkan, pada tahap awal ini yang ditargetkan adalah membangun infrastruktur dan ekosistem bursa karbon yang baik. Melalui Bursa Karbon tersebut, Indonesia mampu mengambil peran lebih besar dalam upaya pengendalian dampak perubahan iklim secara global. Platform perdagangan karbon yang sudah mulai dipersiapkan sejak tahun 2022 ini akan memainkan peran penting mengingat Indonesia merupakan negara yang hampir 70% pemenuhan pengurangan emisi karbonnya berbasis pada sektor alam. CNBC INDONESIA RESEARCH [email protected] Sanggahan: Artikel ini adalah produk jurnalistik berupa pandangan CNBC Indonesia Research. Analisis ini tidak bertujuan mengajak pembaca untuk membeli, menahan, atau menjual produk atau sektor investasi terkait. Keputusan sepenuhnya ada pada diri pembaca, sehingga kami tidak bertanggung jawab terhadap segala kerugian maupun keuntungan yang timbul dari keputusan tersebut.";25-09-2023;https://www.cnbcindonesia.com/market/20230925162439-17-475379/ihsg-tinggalkan-7000-4-saham-ini-biang-keroknya;"indeks harga saham gabungan (ihsg) ditutup melemah pada perdagangan senin (25/9/2023) awal pekan ini, setelah bergerak volatil sepanjang perdagangan hari ini. ihsg ditutup melemah 0,26% ke posisi 6.998,381. ihsg pun terkoreksi hingga menyentuh level psikologis 6.900, setelah bertahan di level psikologis 7.000. secara sektoral, sektor teknologi dan industri menjadi pemberat ihsg pada hari ini. sektor teknologi memberatkan indeks hingga 1,61%, sedangkan sektor industri memberatkan sebesar 0,82%. selain itu, beberapa saham juga menjadi pemberat ihsg. berikut saham-saham yang menjadi pemberat ihsg pada perdagangan hari ini. sumber: refinitiv saham telekomunikasi bumn pt telkom indonesia tbk (tlkm) menjadi pemberat terbesar ihsg pada hari ini, yakni mencapai 11,21 indeks poin. tak hanya itu, dua saham bank raksasa yakni pt bank rakyat indonesia tbk (bbri) dan pt bank central asia tbk (bbca) juga memberatkan indeks masing-masing 5,48 indeks poin dan 5,09 indeks poin. ihsg berakhir di zona merah pada perdagangan awal pekan ini, setelah bergerak volatil sepanjang hari ini. investor cenderung masih wait and see di tengah upaya bank sentral amerika serikat (as), federal reserve (the fed) yang masih berjuang dalam menekan inflasinya. sebagai informasi, amerika serikat (as) mencatatkan inflasi sebesar 3,7% secara tahunan (year-on-year/yoy) pada agustus 2023, naik dari inflasi pada bulan sebelumnya sebesar 3,2% yoy. alhasil, the fed mengisyaratkan mereka akan tetap hawkish dan membuka kemungkinan kenaikan suku bunga ke depan. hasil rapat federal open market committee (fomc) pada pekan lalu juga mengindikasikan jika kebijakan moneter yang ketat akan tetap berlanjut hingga 2024 dan akan memangkas suku bunga lebih sedikit dari indikasi sebelumnya. berdasarkan perangkat fedwatch, survei menunjukkan 20,3% the fed akan menaikkan suku bunganya sebesar 25 basis poin (bp) pada fomc november. sementara pada fomc desember, persentasenya mengalami peningkatan menjadi 35,5% untuk the fed mengalami peningkatan menjadi 5,50-5,75%. di lain sisi, ihsg berakhir merana menjelang diresmikannya bursa karbon pada selasa besok. sebelumnya, bursa karbon akan diluncurkan secara resmi pada tanggal 26 september 2023. bursa efek indonesia (bei) pun telah resmi ditunjuk otoritas jasa keuangan (ojk) menjadi penyelenggara bursa karbon. direktur pengembangan bei jeffrey hendrik mengatakan, saat ini bei sedang melakukan proses finalisasi aturan bursa karbon tersebut. sesuai peraturan ojk (pojk) nomor 14 tahun 2023, maka bursa karbon akan memperdagangkan unit karbon yang tercatat di srn ppi. ""saat ini bei sedang finalisasi peraturan bursa karbon,"" ujarnya kepada wartawan, dikutip rabu (20/9). jeffrey mengungkapkan, pada tahap awal ini yang ditargetkan adalah membangun infrastruktur dan ekosistem bursa karbon yang baik. melalui bursa karbon tersebut, indonesia mampu mengambil peran lebih besar dalam upaya pengendalian dampak perubahan iklim secara global. platform perdagangan karbon yang sudah mulai dipersiapkan sejak tahun 2022 ini akan memainkan peran penting mengingat indonesia merupakan negara yang hampir 70% pemenuhan pengurangan emisi karbonnya berbasis pada sektor alam. cnbc indonesia research [email protected] sanggahan: artikel ini adalah produk jurnalistik berupa pandangan "
