Title;Content;Date;URL;Cleaned Article
 Daftar Saham Terancam Delisting 2023, WSKT hingga SRIL Bakal Didepak ;"Daftar saham terancam delisting sepanjang 2023 ada 38 emiten. Di daftar itu, ada PT Waskita Karya (Persero) Tbk alias WSKT dan PT Sri Rejeki Isman Tbk atau SRIL. Peringatan ini diumumkan Bursa Efek Indonesia (BEI) sejak awal Januari 2023 hingga pengujung tahun ini. Potensi delisting dari setiap emiten diumumkan dalam keterbukaan informasi. Khusus dalam kasus Waskita, saham perseroan disuspensi sejak Mei 2023 lalu. Ini terjadi karena penundaan pembayaran bunga dan pokok atas beberapa obligasi yang diterbitkan perusahaan.  ADVERTISEMENT   SCROLL TO CONTINUE WITH CONTENT  Suspensi saham yang berlangsung sekurang-kurangnya 24 bulan dari waktu pengumuman suspensi akan melahirkan potensi delisting saham.  ""Maka dari itu, dilakukannya delisting terhadap saham perseroan baru akan terjadi paling cepat pada bulan Mei 2025,"" komentar Waskita dalam keterangan resminya soal potensi didepak dari bursa, Kamis (23/11), dikutip dari detik. Akan tetapi, BUMN Konstruksi itu optimistis sanggup menyelesaikan review Master Restructuring Agreement (MRA) dan mendapatkan persetujuan kreditur perbankan maupun pemegang obligasi. Dengan begitu, suspensi saham dapat segera dibuka kembali di kuartal pertama 2024. Selain Waskita, ada 37 emiten lain yang juga mendapatkan peringatan potensi delisting dari BEI sepanjang tahun ini.   1. PT Armidian Karyatama Tbk (ARMY)2. PT Bukit Uluwatu Villa Tbk (BUVA)3. PT Cowell Development Tbk (COWL)4. PT Danasupra Erapacific Tbk (DEFI)5. PT Dua Putra Utama Makmur Tbk (DPUM)6. PT Jaya Bersama Indo Tbk (DUCK)7. PT Envy Technologies Indonesia Tbk (ENVY).8. PT Inti Agri Resources Tbk (IIKP)9. PT Sky Energy Indonesia Tbk (JSKY)10. PT Grand Kartech Tbk (KRAH)11. PT Steadfast Marine Tbk (KPAL)12. PT Forza Land Indonesia Tbk (FORZ)13. PT Panasia Indo Resources Tbk (HDTX)14. PT Capitalinc Investment Tbk (MTFN)15. PT Mas Murni Indonesia Tbk (MAMI)16. PT Magna Investama Mandiri Tbk (MGNA)17. PT Leyand International Tbk (LAPD)18. PT Hanson International Tbk (MYRX)19. PT Jakarta Kyoei Steel Works Tbk (JKSW)20. PT Eureka Prima Jakarta Tbk (LCGP)21. PT Falmaco Nonwoven Industri Tbk (FLMC)22. PT Hotel Mandarine Regency Tbk (HOME)23. PT Saraswati Griya Lestari Tbk (HOTL)24. PT Sinergi Megah Internusa Tbk (NUSA)25. PT Onix Capital Tbk (OCAP)26. PT Bliss Properti Indonesia Tbk (POSA)27. PT Trinitan Metals and Minerals Tbk (PURE)28. PT Nusantara Inti Corpora Tbk (UNIT)29. PT Sri Rejeki Isman Tbk (SRIL)30. PT Siwani Makmur Tbk (SIMA)31. PT Northcliff Citranusa Indonesia Tbk (SKYB)32. PT Rimo International Lestari Tbk (RIMO)33. PT Waskita Karya (Persero) Tbk (WSKT)34. PT Triwira Insanlestari Tbk (TRIL)35. PT Sugih Energy Tbk (SUGI)36. PT SMR Utama Tbk. (SMRU)37. PT Trada Alam Minera Tbk (TRAM)38. PT Trikomsel Oke Tbk (TRIO) [Gambas:Video CNN]";28-12-2023;https://www.cnnindonesia.com/ekonomi/20231228065901-92-1042483/daftar-saham-terancam-delisting-2023-wskt-hingga-sril-bakal-didepak;"daftar saham terancam delisting sepanjang 2023 ada 38 emiten. di daftar itu, ada pt waskita karya (persero) tbk alias wskt dan pt sri rejeki isman tbk atau sril. peringatan ini diumumkan bursa efek indonesia (bei) sejak awal januari 2023 hingga pengujung tahun ini. potensi delisting dari setiap emiten diumumkan dalam keterbukaan informasi. khusus dalam kasus waskita, saham perseroan disuspensi sejak mei 2023 lalu. ini terjadi karena penundaan pembayaran bunga dan pokok atas beberapa obligasi yang diterbitkan perusahaan. suspensi saham yang berlangsung sekurang-kurangnya 24 bulan dari waktu pengumuman suspensi akan melahirkan potensi delisting saham. ""maka dari itu, dilakukannya delisting terhadap saham perseroan baru akan terjadi paling cepat pada bulan mei 2025,"" komentar waskita dalam keterangan resminya soal potensi didepak dari bursa, kamis (23/11), dikutip dari detik. akan tetapi, bumn konstruksi itu optimistis sanggup menyelesaikan review master restructuring agreement (mra) dan mendapatkan persetujuan kreditur perbankan maupun pemegang obligasi. dengan begitu, suspensi saham dapat segera dibuka kembali di kuartal pertama 2024. selain waskita, ada 37 emiten lain yang juga mendapatkan peringatan potensi delisting dari bei sepanjang tahun ini. 1. pt armidian karyatama tbk (army)2. pt bukit uluwatu villa tbk (buva)3. pt cowell development tbk (cowl)4. pt danasupra erapacific tbk (defi)5. pt dua putra utama makmur tbk (dpum)6. pt jaya bersama indo tbk (duck)7. pt envy technologies indonesia tbk (envy).8. pt inti agri resources tbk (iikp)9. pt sky energy indonesia tbk (jsky)10. pt grand kartech tbk (krah)11. pt steadfast marine tbk (kpal)12. pt forza land indonesia tbk (forz)13. pt panasia indo resources tbk (hdtx)14. pt capitalinc investment tbk (mtfn)15. pt mas murni indonesia tbk (mami)16. pt magna investama mandiri tbk (mgna)17. pt leyand international tbk (lapd)18. pt hanson international tbk (myrx)19. pt jakarta kyoei steel works tbk (jksw)20. pt eureka prima jakarta tbk (lcgp)21. pt falmaco nonwoven industri tbk (flmc)22. pt hotel mandarine regency tbk (home)23. pt saraswati griya lestari tbk (hotl)24. pt sinergi megah internusa tbk (nusa)25. pt onix capital tbk (ocap)26. pt bliss properti indonesia tbk (posa)27. pt trinitan metals and minerals tbk (pure)28. pt nusantara inti corpora tbk (unit)29. pt sri rejeki isman tbk (sril)30. pt siwani makmur tbk (sima)31. pt northcliff citranusa indonesia tbk (skyb)32. pt rimo international lestari tbk (rimo)33. pt waskita karya (persero) tbk (wskt)34. pt triwira insanlestari tbk (tril)35. pt sugih energy tbk (sugi)36. pt smr utama tbk. (smru)37. pt trada alam minera tbk (tram)38. pt trikomsel oke tbk (trio) "
 Biang Kerok Saham Garuda Masih di Zona Merah ;"Saham Garuda Indonesia (GIAA) berada di zona merah dalam beberapa waktu terakhir. Pada penutupan pasar hari ini, Rabu (27/12), saham maskapai penerbangan tersebut anjlok 1,41 persen. Penurunan tertinggi terjadi pada Senin (18/12) yang minus sampai 9,88 persen. Head of Customer Literation and Education Kiwoom Sekuritas Indonesia Oktavianus Audi mengatakan volatilitas saham Garuda Indonesia terjadi karena aksi korporasi yang melunasi sebagian utangnya. Hal ini sesuai dengan yang telah diumumkan perseroan.  ADVERTISEMENT   SCROLL TO CONTINUE WITH CONTENT  Garuda Indonesia memang melakukan pelunasan sebagian obligasi dan sukuk senilai US$50 juta kepada kreditur GIAA.  ""Dalam laporannya, GIAA akan melakukan skema tender offer, sehingga berdampak pada sikap pemegang saham yang membuat volatilitas meningkat,"" ujarnya kepada CNNIndonesia.com, Rabu (27/12). Sedangkan, Associate Director PT Universal Broker Indonesia Sekuritas Hadrian Maynard Taslim mengatakan ada beberapa penyebab kinerja GIAA dalam keadaan tidak baik. Pertama, disebabkan oleh 3 catatan di sahan yakni gugatan pailit, ekuitas negatif dan masuk papan pemantauan khusus. Kedua, penyebab saham bergejolak adalah laporan keuangan GIAA per 30 September 2023 yang masih merugi Rp1,12 triliun. ""Tentunya ini angka yang jauh sekali penurunannya dibanding tahun lalu dimana per 31 Des 2022 secara akuntansi membukukan profit Rp58,8 triliun, jadi penurunannya lebih dari Rp50 triliun,"" jelas Hadrian.  Sementara, Direktur Utama Garuda Indonesia Irfan Setiaputra melalui keterangan tertulisnya yang disampaikan kepada Bursa Efek Indonesia (BEI) menyebutkan volatilitas saham terjadi karena terkait dengan fakta material atau kejadian penting yang disampaikan perseroan tentang pelunasan sebagian surat utang dan sukuk (Bond Retirement). Di mana, kreditur yang memiliki surat utang baru ini juga merupakan pihak yang mendapat distribusi saham dalam proses konversi utang saat Penambahan Modal Tanpa Hak Memesan Efek Terlebih Dahulu (PMTHMETD), yang merupakan bagian dari hasil homologasi PKPU yang telah disahkan oleh Pengadilan Negeri Jakarta Pusat. ""Dengan demikian dimungkinkan informasi mengenai Bond Retirement tersebut mempengaruhi keputusan pemegang saham untuk melakukan transaksi terhadap Efek Perseroan,"" kata Ivan.   Menurut Irfan, fakta material yang telah diinformasikan sesuai dengan Peraturan Otoritas Jasa Keuangan (POJK) Nomor 31/POJK.04/2017 dan Peraturan Nomor I-E tentang Kewajiban Penyampaian Informasi. Selain informasi yang disampaikan perseroan tersebut, Irfan menyebutkan sampai dengan saat ini tidak terdapat informasi material lainnya yang dapat mempengaruhi kelangsungan hidup perseroan atau mempengaruhi harga saham perseroan. ""Perseroan akan senantiasa memperhatikan ketentuan peraturan perundang-undangan yang berlaku, khususnya di bidang pasar modal,"" pungkas Irfan. [Gambas:Video CNN] ";27-12-2023;https://www.cnnindonesia.com/ekonomi/20231227205344-92-1042422/biang-kerok-saham-garuda-masih-di-zona-merah;"saham garuda indonesia (giaa) berada di zona merah dalam beberapa waktu terakhir. pada penutupan pasar hari ini, rabu (27/12), saham maskapai penerbangan tersebut anjlok 1,41 persen. penurunan tertinggi terjadi pada senin (18/12) yang minus sampai 9,88 persen. head of customer literation and education kiwoom sekuritas indonesia oktavianus audi mengatakan volatilitas saham garuda indonesia terjadi karena aksi korporasi yang melunasi sebagian utangnya. hal ini sesuai dengan yang telah diumumkan perseroan. garuda indonesia memang melakukan pelunasan sebagian obligasi dan sukuk senilai us$50 juta kepada kreditur giaa. ""dalam laporannya, giaa akan melakukan skema tender offer, sehingga berdampak pada sikap pemegang saham yang membuat volatilitas meningkat,"" ujarnya kepada cnnindonesia.com, rabu (27/12). sedangkan, associate director pt universal broker indonesia sekuritas hadrian maynard taslim mengatakan ada beberapa penyebab kinerja giaa dalam keadaan tidak baik. pertama, disebabkan oleh 3 catatan di sahan yakni gugatan pailit, ekuitas negatif dan masuk papan pemantauan khusus. kedua, penyebab saham bergejolak adalah laporan keuangan giaa per 30 september 2023 yang masih merugi rp1,12 triliun. ""tentunya ini angka yang jauh sekali penurunannya dibanding tahun lalu dimana per 31 des 2022 secara akuntansi membukukan profit rp58,8 triliun, jadi penurunannya lebih dari rp50 triliun,"" jelas hadrian. sementara, direktur utama garuda indonesia irfan setiaputra melalui keterangan tertulisnya yang disampaikan kepada bursa efek indonesia (bei) menyebutkan volatilitas saham terjadi karena terkait dengan fakta material atau kejadian penting yang disampaikan perseroan tentang pelunasan sebagian surat utang dan sukuk (bond retirement). di mana, kreditur yang memiliki surat utang baru ini juga merupakan pihak yang mendapat distribusi saham dalam proses konversi utang saat penambahan modal tanpa hak memesan efek terlebih dahulu (pmthmetd), yang merupakan bagian dari hasil homologasi pkpu yang telah disahkan oleh pengadilan negeri jakarta pusat. ""dengan demikian dimungkinkan informasi mengenai bond retirement tersebut mempengaruhi keputusan pemegang saham untuk melakukan transaksi terhadap efek perseroan,"" kata ivan. menurut irfan, fakta material yang telah diinformasikan sesuai dengan peraturan otoritas jasa keuangan (pojk) nomor 31/pojk.04/2017 dan peraturan nomor i-e tentang kewajiban penyampaian informasi. selain informasi yang disampaikan perseroan tersebut, irfan menyebutkan sampai dengan saat ini tidak terdapat informasi material lainnya yang dapat mempengaruhi kelangsungan hidup perseroan atau mempengaruhi harga saham perseroan. ""perseroan akan senantiasa memperhatikan ketentuan peraturan perundang-undangan yang berlaku, khususnya di bidang pasar modal,"" pungkas irfan. "
 Alasan Eks Bos GoTo Jual Saham ;"Komisaris PT GoTo Gojek Tokopedia Tbk (GOTO) Andre Soelistyo menjual kepemilikan saham di perusahaan teknologi tersebut. Berdasarkan keterbukaan informasi Bursa Efek Indonesia (BEI), eks CEO GoTo itu mengungkapkan alasan menjual saham untuk membayar fasilitas kredit pada 22 Desember 2023. Adapun jumlah saham yang dijual sebanyak 100 juta lembar. Jenis saham yang dilepaskan adalah Seri A. Di mana harga jual per lembar saham itu adalah Rp86. Artinya, total saham yang Andre jual mencapai Rp8,6 miliar.  ADVERTISEMENT   SCROLL TO CONTINUE WITH CONTENT  Saham Seri A itu dimiliki Andre secara langsung dan tidak langsung atau setara dengan 0,01 persen dari modal ditempatkan dan disetor GOTO.  ""Tujuan dari transaksi: Pembayaran Fasilitas Kredit,"" tulis Andre. Sebelum transaksi, total jumlah kepemilikan saham eks CEO GOTO itu mencapai 9.981.555.284 lembar atau setara 0,83 persen dari modal ditempatkan dan disetor perseroan. Jumlah itu terdiri dari 3.247.530.184 lembar saham Seri A dan 6.734.025.100 lembar saham seri B.   Setelah transaksi, jumlah saham GOTO milik Andre tersisa 9.881.555.284 lembar atau setara 0,82 persen dari modal ditempatkan dan disetor perseroan. Jumlah saham tersebut terdiri dari 3.147.530.184 lembar saham Seri A dan 6.734.025.100 lembar saham Seri B. [Gambas:Video CNN] ";28-12-2023;https://www.cnnindonesia.com/ekonomi/20231228194029-92-1042859/alasan-eks-bos-goto-jual-saham;"komisaris pt goto gojek tokopedia tbk (goto) andre soelistyo menjual kepemilikan saham di perusahaan teknologi tersebut. berdasarkan keterbukaan informasi bursa efek indonesia (bei), eks ceo goto itu mengungkapkan alasan menjual saham untuk membayar fasilitas kredit pada 22 desember 2023. adapun jumlah saham yang dijual sebanyak 100 juta lembar. jenis saham yang dilepaskan adalah seri a. di mana harga jual per lembar saham itu adalah rp86. artinya, total saham yang andre jual mencapai rp8,6 miliar. saham seri a itu dimiliki andre secara langsung dan tidak langsung atau setara dengan 0,01 persen dari modal ditempatkan dan disetor goto. ""tujuan dari transaksi: pembayaran fasilitas kredit,"" tulis andre. sebelum transaksi, total jumlah kepemilikan saham eks ceo goto itu mencapai 9.981.555.284 lembar atau setara 0,83 persen dari modal ditempatkan dan disetor perseroan. jumlah itu terdiri dari 3.247.530.184 lembar saham seri a dan 6.734.025.100 lembar saham seri b. setelah transaksi, jumlah saham goto milik andre tersisa 9.881.555.284 lembar atau setara 0,82 persen dari modal ditempatkan dan disetor perseroan. jumlah saham tersebut terdiri dari 3.147.530.184 lembar saham seri a dan 6.734.025.100 lembar saham seri b. "
 Ongkang-ongkang Kaki, Eks Bos Microsoft Bakal Dapat Dividen Rp15,4 T ;Konglomerat sekaligus mantan CEO Microsoft Corporation Steve Ballmer bakal mendapat Rp1 miliar atau setara Rp15,4 triliun (asumsi kurs Rp15.417 per dolar AS) pada 2024. Dilansir dari CNN Business, Kamis (28/12), dana itu berasal dari dividen yang diberikan oleh Microsoft. Maklum, Ballmer merupakan salah satu pemegang saham perusahaan teknologi raksasa itu.  ADVERTISEMENT   SCROLL TO CONTINUE WITH CONTENT  Hal ini terjadi setelah Microsoft meningkatkan pembayaran dividen menjadi US$3 per saham per tahun.  Ballmer sendiri memiliki 333,2 juta saham Microsoft atau setara 4 persen. Dengan begitu, Ballmer diperkirakan bakal menerima US$1 miliar dividen pada tahun depan. Hal ini tentu saja dengan asumsi dewan direksi Microsoft tidak memutuskan untuk memangkas dividen.   Meski demikian, orang terkaya keenam di dunia itu akan dikenakan pajak 20 persen atas dividen tersebut. Pasalnya, di AS orang yang berpenghasilan lebih dari US$500 ribu per tahun bakal dikenakan pajak sebesar itu. Artinya, dari total dividen US$1 miliar, Ballmer harus membayar pajak sebesar US$200 juta atau sekitar Rp3,08 miliar. [Gambas:Video CNN]  ;28-12-2023;https://www.cnnindonesia.com/ekonomi/20231228191747-92-1042852/ongkang-ongkang-kaki-eks-bos-microsoft-bakal-dapat-dividen-rp154-t;konglomerat sekaligus mantan ceo microsoft corporation steve ballmer bakal mendapat rp1 miliar atau setara rp15,4 triliun (asumsi kurs rp15.417 per dolar as) pada 2024. dilansir dari cnn business, kamis (28/12), dana itu berasal dari dividen yang diberikan oleh microsoft. maklum, ballmer merupakan salah satu pemegang saham perusahaan teknologi raksasa itu. hal ini terjadi setelah microsoft meningkatkan pembayaran dividen menjadi us$3 per saham per tahun. ballmer sendiri memiliki 333,2 juta saham microsoft atau setara 4 persen. dengan begitu, ballmer diperkirakan bakal menerima us$1 miliar dividen pada tahun depan. hal ini tentu saja dengan asumsi dewan direksi microsoft tidak memutuskan untuk memangkas dividen. meski demikian, orang terkaya keenam di dunia itu akan dikenakan pajak 20 persen atas dividen tersebut. pasalnya, di as orang yang berpenghasilan lebih dari us$500 ribu per tahun bakal dikenakan pajak sebesar itu. artinya, dari total dividen us$1 miliar, ballmer harus membayar pajak sebesar us$200 juta atau sekitar rp3,08 miliar. 
 Harga Minyak Melonjak 2 Persen Seiring 'Memanasnya' Laut Merah ;"Harga minyak melonjak lebih dari 2 persen pada perdagangan Rabu (27/12), di tengah serangan terhadap kapal-kapal yang melintasi Laut Merah, serta harapan penurunan suku bunga acuan Amerika Serikat (AS). Mengutip Reuters, minyak mentah berjangka Brent melesat 2,5 persen menjadi US$81,07 per barel. Sementara itu, minyak mentah West Texas Intermediate (WTI) AS naik 2,7 persen menjadi US$75,57 per barel. Lonjakan harga ini dipicu serangan lanjutan terhadap kapal di Laut Merah. Hal ini memicu kekhawatiran akan gangguan pengiriman pasokan minyak.  ADVERTISEMENT   SCROLL TO CONTINUE WITH CONTENT  ""Ada banyak ketegangan geopolitik saat ini di Timur Tengah. Hal ini menimbulkan kekhawatiran di sini terhadap keamanan transit minyak dan barang lainnya,"" kata analis Again Capital LLC John Kilduff.  Milisi Houthi Yaman yang didukung Iran mengaku bertanggung jawab atas serangan rudal pada Selasa lalu, terhadap sebuah kapal kontainer di Laut Merah. Serangan ini merupakan bentuk dukungan milisi terhadap Hamas, Palestina yang tengah berperang melawan Israel. Pihak Israel menyatakan telah melakukan pembalasan di Irak, Yaman dan Iran atas serangan yang dilakukan terhadap negaranya. Negara Zionis ini juga memastikan perang terhadap Hamas di Gaza kemungkinan akan berlangsung berbulan-bulan. Meskipun ada kekhawatiran mengenai Timur Tengah dan perubahan rute kapal, pasokan sebenarnya belum terpengaruh. Selain itu, ada harapan penurunan suku bunga oleh Bank Sentral AS (The Fed) yang dapat meningkatkan pertumbuhan ekonomi dan permintaan bahan bakar, turut mengerek harga minyak. The Fed diproyeksi akan memangkas suku bunga tahun depan. Suku bunga yang lebih rendah mengurangi biaya pinjaman konsumen, sehingga dapat meningkatkan pertumbuhan ekonomi dan permintaan minyak. [Gambas:Video CNN]  ";27-12-2023;https://www.cnnindonesia.com/ekonomi/20231227081707-85-1042064/harga-minyak-melonjak-2-persen-seiring-memanasnya-laut-merah;"harga minyak melonjak lebih dari 2 persen pada perdagangan rabu (27/12), di tengah serangan terhadap kapal-kapal yang melintasi laut merah, serta harapan penurunan suku bunga acuan amerika serikat (as). mengutip reuters, minyak mentah berjangka brent melesat 2,5 persen menjadi us$81,07 per barel. sementara itu, minyak mentah west texas intermediate (wti) as naik 2,7 persen menjadi us$75,57 per barel. lonjakan harga ini dipicu serangan lanjutan terhadap kapal di laut merah. hal ini memicu kekhawatiran akan gangguan pengiriman pasokan minyak. ""ada banyak ketegangan geopolitik saat ini di timur tengah. hal ini menimbulkan kekhawatiran di sini terhadap keamanan transit minyak dan barang lainnya,"" kata analis again capital llc john kilduff. milisi houthi yaman yang didukung iran mengaku bertanggung jawab atas serangan rudal pada selasa lalu, terhadap sebuah kapal kontainer di laut merah. serangan ini merupakan bentuk dukungan milisi terhadap hamas, palestina yang tengah berperang melawan israel. pihak israel menyatakan telah melakukan pembalasan di irak, yaman dan iran atas serangan yang dilakukan terhadap negaranya. negara zionis ini juga memastikan perang terhadap hamas di gaza kemungkinan akan berlangsung berbulan-bulan. meskipun ada kekhawatiran mengenai timur tengah dan perubahan rute kapal, pasokan sebenarnya belum terpengaruh. selain itu, ada harapan penurunan suku bunga oleh bank sentral as (the fed) yang dapat meningkatkan pertumbuhan ekonomi dan permintaan bahan bakar, turut mengerek harga minyak. the fed diproyeksi akan memangkas suku bunga tahun depan. suku bunga yang lebih rendah mengurangi biaya pinjaman konsumen, sehingga dapat meningkatkan pertumbuhan ekonomi dan permintaan minyak. "
 Cara Cairkan BPJS Ketenagakerjaan Secara Offline dan Online ;BPJS Ketenagakerjaan memiliki layanan online maupun offline untuk peserta yang ingin mengajukan klaim pencairan manfaat Jaminan Hari Tua (JHT). Kini pencairan JHT tidak harus dilakukan saat pensiun. Pencairan dapat juga dilakukan peserta yang mengundurkan diri (resign) dari pekerjaan atau mengalami pemutusan hubungan kerja (PHK). Proses pencairan manfaat JHT tidak hanya bisa dilakukan di kantor cabang dan bank yang bekerja sama atau Service Point Office (SPO), tetapi bisa juga dilakukan secara online.  ADVERTISEMENT   SCROLL TO CONTINUE WITH CONTENT  Melansir situs resmi BPJS Ketenagakerjaan, berikut cara mencairkan BPJS Ketenagakerjaan offline maupun online. 1. Scan QR Code yang tersedia di kantor cabang 2. Mengisi data awal yaitu NIK, nama lengkap, dan nomor kepesertaan. 3. Sistem akan verifikasi data otomatis terkait kelayakan klaim. 4. Setelah Verifikasi, peserta akan diarahkan untuk melengkapi data sesuai instruksi yang tampil pada portal. 5. Mengunggah dokumen persyaratan. 6. Peserta menunjukkan notifikasi kepada petugas kantor cabang untuk mendapatkan nomor antrian. 7. Proses lanjutan akan dilakukan di kantor cabang tersebut sampai dengan proses wawancara selesai. 8. Manfaat akan dicairkan melalui rekening yang dilampirkan. 1. Peserta dapat datang langsung sesuai jam operasional kantor layanan dari pukul 08.00 - 15.30 hari kerja atau jam operasional Bank (kecuali hari libur atau kondisi lain). 2. Menyiapkan berkas dokumen fotokopi persyaratan klaim dengan menunjukkan berkas asli. 3. Petugas akan melakukan proses verifikasi berkas dan wawancara. 4. Proses pengajuan selesai dan manfaat akan dicairkan melalui rekening yang dilampirkan. Pengajuan klaim melalui metode online dapat dilakukan dengan mengakses portal Lapakasik.bpjsketenagakerjaan.go.id. Berikut caranya: 1. Kunjungi Portal Layanan Lapakasik.bpjsketenagakerjaan.go.id 2. Mengisi Data Awal yaitu NIK, Nama Lengkap, & Nomor Kepesertaan 3. Sistem akan verifikasi data otomatis terkait kelayakan klaim. 4. Setelah Verifikasi, peserta akan diarahkan untuk melengkapi data sesuai instruksi yang tampil pada portal. 5. Mengunggah dokumen persyaratan. 6. Peserta yang berhasil menyelesaikan proses akan menerima notifikasi yang berisi informasi jadwal dan kantor cabang. 7. Peserta akan dihubungi melalui video call untuk proses wawancara sesuai jadwal pada notifikasi (siapkan berkas asli). 8. Proses selesai dan manfaat akan dicairkan melalui rekening yang dilampirkan.;13-12-2023;https://www.cnnindonesia.com/ekonomi/20231213182831-78-1036938/cara-cairkan-bpjs-ketenagakerjaan-secara-offline-dan-online;bpjs ketenagakerjaan memiliki layanan online maupun offline untuk peserta yang ingin mengajukan klaim pencairan manfaat jaminan hari tua (jht). kini pencairan jht tidak harus dilakukan saat pensiun. pencairan dapat juga dilakukan peserta yang mengundurkan diri (resign) dari pekerjaan atau mengalami pemutusan hubungan kerja (phk). proses pencairan manfaat jht tidak hanya bisa dilakukan di kantor cabang dan bank yang bekerja sama atau service point office (spo), tetapi bisa juga dilakukan secara online. melansir situs resmi bpjs ketenagakerjaan, berikut cara mencairkan bpjs ketenagakerjaan offline maupun online. 1. scan qr code yang tersedia di kantor cabang 2. mengisi data awal yaitu nik, nama lengkap, dan nomor kepesertaan. 3. sistem akan verifikasi data otomatis terkait kelayakan klaim. 4. setelah verifikasi, peserta akan diarahkan untuk melengkapi data sesuai instruksi yang tampil pada portal. 5. mengunggah dokumen persyaratan. 6. peserta menunjukkan notifikasi kepada petugas kantor cabang untuk mendapatkan nomor antrian. 7. proses lanjutan akan dilakukan di kantor cabang tersebut sampai dengan proses wawancara selesai. 8. manfaat akan dicairkan melalui rekening yang dilampirkan. 1. peserta dapat datang langsung sesuai jam operasional kantor layanan dari pukul 08.00 - 15.30 hari kerja atau jam operasional bank (kecuali hari libur atau kondisi lain). 2. menyiapkan berkas dokumen fotokopi persyaratan klaim dengan menunjukkan berkas asli. 3. petugas akan melakukan proses verifikasi berkas dan wawancara. 4. proses pengajuan selesai dan manfaat akan dicairkan melalui rekening yang dilampirkan. pengajuan klaim melalui metode online dapat dilakukan dengan mengakses portal lapakasik.bpjsketenagakerjaan.go.id. berikut caranya: 1. kunjungi portal layanan lapakasik.bpjsketenagakerjaan.go.id 2. mengisi data awal yaitu nik, nama lengkap, & nomor kepesertaan 3. sistem akan verifikasi data otomatis terkait kelayakan klaim. 4. setelah verifikasi, peserta akan diarahkan untuk melengkapi data sesuai instruksi yang tampil pada portal. 5. mengunggah dokumen persyaratan. 6. peserta yang berhasil menyelesaikan proses akan menerima notifikasi yang berisi informasi jadwal dan kantor cabang. 7. peserta akan dihubungi melalui video call untuk proses wawancara sesuai jadwal pada notifikasi (siapkan berkas asli). 8. proses selesai dan manfaat akan dicairkan melalui rekening yang dilampirkan.
