Title;Content;Date;URL;Cleaned Article
 Gegara Saham Bank Jago Lesu, Jerry Ng Terdepak dari Jajaran Orang Kaya ;"Nama Jerry Ng terdepak dari daftar orang terkaya Indonesia versi Forbes. Padahal, pada 2022 kemarin ia menjadi orang terkaya ke-35 dengan kekayaan mencapai US$1,2 miliar atau Rp17,8 triliun (asumsi kurs Rp14.857 per dolar AS). Hengkangnya nama Jerry Ng dari jajaran taipan RI terjadi di tengah lesunya harga saham PT Bank Jago Tbk, di mana ia memiliki saham di bank berkode ARTO itu.  ADVERTISEMENT   SCROLL TO CONTINUE WITH CONTENT   Mengutip detikcom, harga saham ARTO pada April 2022 masih di level Rp14.800 per lembar saham. Sementara itu, harga saham ARTO anjlok ke angka Rp2.240. Saat harta Jerry menurun pada 2021, Forbes juga mengungkapkan bahwa penyebabnya adalah anjloknya harga saham Bank Jago. ""Saham Bank Jago miliknya (Jerry Ng) jatuh dari puncaknya karena investor menganggap pemberi pinjaman dinilai terlalu tinggi,"" jelas Forbes.     Mengutip CNBC Indonesia, pelemahan saham Bank Jago ini terjadi karena banyak investor yang mulai mengukur langkah akan potensi bank itu untuk melakukan ekspansi cepat sembari secara cermat memperbaiki kinerja bottom line. Selain itu, kerekan suku bunga The Fed yang diikuti bank sentral global lain yang pada akhirnya turut membebani pasar modal RI. Jerry merupakan bankir veteran dengan pengalaman lebih dari tiga dekade. Dia mendapatkan kekayaannya dari saham di Bank Jago dengan mengakuisisi saham bank itu pada 2019. Sebelumnya, ia menduduki posisi teratas di Bank Danamon Indonesia dan Bank Central Asia. Ia juga pernah menjabat sebagai direktur utama Bank BTPN hingga Februari 2019.  [Gambas:Video CNN] ";13-04-2023;https://www.cnnindonesia.com/ekonomi/20230413141357-92-937287/gegara-saham-bank-jago-lesu-jerry-ng-terdepak-dari-jajaran-orang-kaya;"nama jerry ng terdepak dari daftar orang terkaya indonesia versi forbes. padahal, pada 2022 kemarin ia menjadi orang terkaya ke-35 dengan kekayaan mencapai us$1,2 miliar atau rp17,8 triliun (asumsi kurs rp14.857 per dolar as). hengkangnya nama jerry ng dari jajaran taipan ri terjadi di tengah lesunya harga saham pt bank jago tbk, di mana ia memiliki saham di bank berkode arto itu. mengutip detikcom, harga saham arto pada april 2022 masih di level rp14.800 per lembar saham. sementara itu, harga saham arto anjlok ke angka rp2.240. saat harta jerry menurun pada 2021, forbes juga mengungkapkan bahwa penyebabnya adalah anjloknya harga saham bank jago. ""saham bank jago miliknya (jerry ng) jatuh dari puncaknya karena investor menganggap pemberi pinjaman dinilai terlalu tinggi,"" jelas forbes. mengutip cnbc indonesia, pelemahan saham bank jago ini terjadi karena banyak investor yang mulai mengukur langkah akan potensi bank itu untuk melakukan ekspansi cepat sembari secara cermat memperbaiki kinerja bottom line. selain itu, kerekan suku bunga the fed yang diikuti bank sentral global lain yang pada akhirnya turut membebani pasar modal ri. jerry merupakan bankir veteran dengan pengalaman lebih dari tiga dekade. dia mendapatkan kekayaannya dari saham di bank jago dengan mengakuisisi saham bank itu pada 2019. sebelumnya, ia menduduki posisi teratas di bank danamon indonesia dan bank central asia. ia juga pernah menjabat sebagai direktur utama bank btpn hingga februari 2019. "
 Daftar Negara dengan Orang Kaya Terbanyak di Dunia ;Sejumlah negara tercatat memiliki penduduk terkaya di dunia. Setidaknya, ada 2.640 miliarder di dunia yang berasal dari dari 77 negara atau wilayah di seluruh dunia. Mengutip laporan Forbes, Senin(10/4), jumlah wilayah asal miliarder di dunia pada 2023 bertambah dua dari 75 negara pada tahun lalu. Dua tambahan wilayah baru itu adalah Panama dan Armenia. Posisi pertama negara dengan orang kaya terbanyak adalah Amerika Serikat dengan 735 orang miliarder. Jumlah itu sama dengan tahun lalu.  ADVERTISEMENT   SCROLL TO CONTINUE WITH CONTENT   Secara keseluruhan, kekayaan miliarder AS pada tahun ini turun dari US$4,7 triliun menjadi US$4,5 triliun imbas kondisi perusahaan rintisan 'unicorn'. Di posisi kedua, ada China dengan jumlah orang kaya sebanyak 495 orang miliarder. Jumlah kekayaan gabungan miliarder China sebanyak US$1,67 triliun. Posisi selanjutnya ditempati India dengan 169 orang miliarder, naik dibandingkan tahun lalu sebanyak 166 orang. Adapun total kekayaan gabungan para miliarder saat ini sebanyak US$675 miliar. Kemudian ada Jerman yang memiliki 126 miliarder, turun dari 134 miliarder pada tahun lalu. Total kekayaan gabungan para taipan Jerman saat ini sebanyak US$585 miliar.  Rusia menjadi negara dengan orang kaya terbanyak di dunia dengan 105 miliarder tahun ini dengan kekayaan bersih gabungan U$474 miliar, naik dari US$320 miliar tahun lalu. Orang terkaya di negara itu sebagian besar memulihkan kerugian yang mereka derita setelah invasi Ukraina. Berikut beberapa daftar negara dengan orang kaya terbanyak di dunia: 1. Amerika Serikat (735 miliarder) 2. China (495 miliarder) 3. India (169 miliarder) 4. Jerman (126 miliarder) 5. Rusia (105 miliarder) 6. Hong Kong (66 miliarder) 7. Italia (64 miliarder) 8. Kanada (63 miliarder) 9. Taiwan (52 miliarder) 10. Britania Raya (52 miliarder) 11. Brazil (51 miliarder) 12. Australia (47 miliarder) 13. Prancis (43 miliarder) 14. Swiss (41 miliarder) 15. Jepang (40 miliarder) 16. Swedia (39 miliarder) 17. Singapura (35 miliarder) 18. Korea Selatan (30 miliarder) 19. Israel (30 miliarder) 20. Indonesia (29 miliarder)  [Gambas:Video CNN] ;10-04-2023;https://www.cnnindonesia.com/ekonomi/20230410072033-92-935488/daftar-negara-dengan-orang-kaya-terbanyak-di-dunia;sejumlah negara tercatat memiliki penduduk terkaya di dunia. setidaknya, ada 2.640 miliarder di dunia yang berasal dari dari 77 negara atau wilayah di seluruh dunia. mengutip laporan forbes, senin(10/4), jumlah wilayah asal miliarder di dunia pada 2023 bertambah dua dari 75 negara pada tahun lalu. dua tambahan wilayah baru itu adalah panama dan armenia. posisi pertama negara dengan orang kaya terbanyak adalah amerika serikat dengan 735 orang miliarder. jumlah itu sama dengan tahun lalu. secara keseluruhan, kekayaan miliarder as pada tahun ini turun dari us$4,7 triliun menjadi us$4,5 triliun imbas kondisi perusahaan rintisan 'unicorn'. di posisi kedua, ada china dengan jumlah orang kaya sebanyak 495 orang miliarder. jumlah kekayaan gabungan miliarder china sebanyak us$1,67 triliun. posisi selanjutnya ditempati india dengan 169 orang miliarder, naik dibandingkan tahun lalu sebanyak 166 orang. adapun total kekayaan gabungan para miliarder saat ini sebanyak us$675 miliar. kemudian ada jerman yang memiliki 126 miliarder, turun dari 134 miliarder pada tahun lalu. total kekayaan gabungan para taipan jerman saat ini sebanyak us$585 miliar. rusia menjadi negara dengan orang kaya terbanyak di dunia dengan 105 miliarder tahun ini dengan kekayaan bersih gabungan u$474 miliar, naik dari us$320 miliar tahun lalu. orang terkaya di negara itu sebagian besar memulihkan kerugian yang mereka derita setelah invasi ukraina. berikut beberapa daftar negara dengan orang kaya terbanyak di dunia: 1. amerika serikat (735 miliarder) 2. china (495 miliarder) 3. india (169 miliarder) 4. jerman (126 miliarder) 5. rusia (105 miliarder) 6. hong kong (66 miliarder) 7. italia (64 miliarder) 8. kanada (63 miliarder) 9. taiwan (52 miliarder) 10. britania raya (52 miliarder) 11. brazil (51 miliarder) 12. australia (47 miliarder) 13. prancis (43 miliarder) 14. swiss (41 miliarder) 15. jepang (40 miliarder) 16. swedia (39 miliarder) 17. singapura (35 miliarder) 18. korea selatan (30 miliarder) 19. israel (30 miliarder) 20. indonesia (29 miliarder) 
 Ajaib Kripto Gratiskan Biaya Jual Beli Bitcoin, Harga Capai US$30 Ribu ;"Harga Bitcoin saat ini telah menembus level psikologis sebesar US$30,000 atau mengalami kenaikan lebih dari 80 persen sejak awal 2023. Capaian ini merupakan pertama kali sejak 10 Juni 2022. Kenaikan harga Bictoin tertinggi di tahun 2023 ini disebabkan oleh beberapa sentimen positif seperti tindakan beberapa negara yang mempertimbangkan alternatif penggunaan mata uang US Dollar serta menjelang data Indeks Harga Konsumen (IHK) Amerika Serikat Maret yang akan dirilis pada Rabu pekan ini (12/4). Financial Expert Ajaib Kripto Panji Yudha juga sepakat bahwa pergerakan bullish pasar aset kripto dalam beberapa hari terakhir bertepatan dengan sentimen yang beragam. Di antaranya laporan inflasi AS yang melandai hingga kebijakan AS untuk menstabilkan sistem perbankan.  ADVERTISEMENT   SCROLL TO CONTINUE WITH CONTENT  ""Penurunan nilai USD akan berdampak pada harga aset kripto, terutama Bitcoin yang memiliki korelasi cukup kuat. Ketika USD menguat, harga Bitcoin relatif turun dan ketika nilai mata uang USD menurun, harga Bitcoin cenderung menguat,"" kata Panji dalam keterangan tertulisnya, Selasa (11/4). Adapun pasar aset kripto mulai bergerak naik pada awal 2023 setelah melihat data tingkat inflasi AS yang mulai turun sejak akhir 2022. Melandainya inflasi ini memberikan harapan adanya pelonggaran kebijakan moneter oleh The Federal Reserve. Bitcoin kembali mendapatkan momentum pada akhir Maret menyusul krisis kesulitan likuiditas yang dialami Silicon Valley Bank dan Signature Bank di Amerika Serikat. Di mana hal ini membuat investor mengalihkan aset mereka ke jenis aset lain seperti Bitcoin. Panji menganalisis, setelah tembus US$30,000, maka harga terdekat resistance Bitcoin di target bakal mencapai US$30,700 hingga Kamis (12/4). Sementara dalam satu minggu ke depan atau Minggu (16/4), Bitcoin diprediksi akan menguji harga di kisaran US$32,500 melanjutkan momentum bullish. Untuk itu, kata Panji, penting bagi investor untuk memilih platform jual beli aset kripto yang legal dan berizin dari Bappebti. Salah satu pilihan platform investasi kripto yang bisa digunakan yakni Ajaib Kripto. Ajaib Kripto merupakan platform jual beli aset kripto dengan transaksi yang mudah, aman, dan telah memperoleh izin dari Bappebti. ""Sesuaikan gaya investasi dengan profil risiko masing-masing dengan menerapkan strategi take profit dan memanfaatkan fitur stop loss yang telah tersedia di Ajaib Kripto untuk meminimalisir kerugian saat berinvestasi,"" ujar Panji. Berkenan menguatnya harga Bitcoin, Ajaib Kripto pun membebaskan biaya untuk setiap transaksi jual dan beli aset kripto Bitcoin. Langkah ini membuat Ajaib Kripto menjadi platform investasi aset kripto pertama di tanah air yang menggratiskan transaksi Bitcoin. Strategic Communication Lead Ajaib Group Iwan Kurniawan menyatakan program biaya transaksi 0 persen untuk transaksi jual dan beli Bitcoin di Ajaib Kripto berlaku untuk seluruh pelanggan baru dan lama Ajaib Kripto. ""Seluruh pelanggan Ajaib Kripto dapat melakukan pembelian dan penjualan Aset Kripto Bitcoin BTC/IDR dan BTC/USDT tanpa dikenakan biaya transaksi dari Ajaib Kripto,"" ujar Iwan. Tidak ada ketentuan batasan dan kuota per pelanggan, sehingga pelanggan dapat melakukan transaksi jual dan beli Bitcoin gratis biaya transaksi selama program berlaku,"" tambahnya.";11-04-2023;https://www.cnnindonesia.com/ekonomi/20230411135008-83-936228/ajaib-kripto-gratiskan-biaya-jual-beli-bitcoin-harga-capai-us-30-ribu;"harga bitcoin saat ini telah menembus level psikologis sebesar us$30,000 atau mengalami kenaikan lebih dari 80 persen sejak awal 2023. capaian ini merupakan pertama kali sejak 10 juni 2022. kenaikan harga bictoin tertinggi di tahun 2023 ini disebabkan oleh beberapa sentimen positif seperti tindakan beberapa negara yang mempertimbangkan alternatif penggunaan mata uang us dollar serta menjelang data indeks harga konsumen (ihk) amerika serikat maret yang akan dirilis pada rabu pekan ini (12/4). financial expert ajaib kripto panji yudha juga sepakat bahwa pergerakan bullish pasar aset kripto dalam beberapa hari terakhir bertepatan dengan sentimen yang beragam. di antaranya laporan inflasi as yang melandai hingga kebijakan as untuk menstabilkan sistem perbankan. ""penurunan nilai usd akan berdampak pada harga aset kripto, terutama bitcoin yang memiliki korelasi cukup kuat. ketika usd menguat, harga bitcoin relatif turun dan ketika nilai mata uang usd menurun, harga bitcoin cenderung menguat,"" kata panji dalam keterangan tertulisnya, selasa (11/4). adapun pasar aset kripto mulai bergerak naik pada awal 2023 setelah melihat data tingkat inflasi as yang mulai turun sejak akhir 2022. melandainya inflasi ini memberikan harapan adanya pelonggaran kebijakan moneter oleh the federal reserve. bitcoin kembali mendapatkan momentum pada akhir maret menyusul krisis kesulitan likuiditas yang dialami silicon valley bank dan signature bank di amerika serikat. di mana hal ini membuat investor mengalihkan aset mereka ke jenis aset lain seperti bitcoin. panji menganalisis, setelah tembus us$30,000, maka harga terdekat resistance bitcoin di target bakal mencapai us$30,700 hingga kamis (12/4). sementara dalam satu minggu ke depan atau minggu (16/4), bitcoin diprediksi akan menguji harga di kisaran us$32,500 melanjutkan momentum bullish. untuk itu, kata panji, penting bagi investor untuk memilih platform jual beli aset kripto yang legal dan berizin dari bappebti. salah satu pilihan platform investasi kripto yang bisa digunakan yakni ajaib kripto. ajaib kripto merupakan platform jual beli aset kripto dengan transaksi yang mudah, aman, dan telah memperoleh izin dari bappebti. ""sesuaikan gaya investasi dengan profil risiko masing-masing dengan menerapkan strategi take profit dan memanfaatkan fitur stop loss yang telah tersedia di ajaib kripto untuk meminimalisir kerugian saat berinvestasi,"" ujar panji. berkenan menguatnya harga bitcoin, ajaib kripto pun membebaskan biaya untuk setiap transaksi jual dan beli aset kripto bitcoin. langkah ini membuat ajaib kripto menjadi platform investasi aset kripto pertama di tanah air yang menggratiskan transaksi bitcoin. strategic communication lead ajaib group iwan kurniawan menyatakan program biaya transaksi 0 persen untuk transaksi jual dan beli bitcoin di ajaib kripto berlaku untuk seluruh pelanggan baru dan lama ajaib kripto. ""seluruh pelanggan ajaib kripto dapat melakukan pembelian dan penjualan aset kripto bitcoin btc/idr dan btc/usdt tanpa dikenakan biaya transaksi dari ajaib kripto,"" ujar iwan. tidak ada ketentuan batasan dan kuota per pelanggan, sehingga pelanggan dapat melakukan transaksi jual dan beli bitcoin gratis biaya transaksi selama program berlaku,"" tambahnya."
RANS Mau IPO, Analis: Bisnis Hiburan Tak Pernah Mati, Tapi Cepat Berubah;"Laporan Wartawan Tribunnews.com, Yanuar Riezqi Yovanda TRIBUNNEWS.COM, JAKARTA - RANS Entertainment milik Raffi Ahmad dan Nagita Slavina sudah mewacanakan penawaran umum perdana saham atau initial public offering (IPO) di Bursa Efek Indonesia, meski belum ada dokumen yang masuk. Associate Director of Research and Investment Pilarmas Investindo Sekuritas Maximilianus Nico Demus mengatakan, aksi korporasi tersebut akan berdampak positif terhadap RANS. ""Jadi, mengenai wacana IPO RANS disampaikan mau perkuat fundamentalnya tentu jadi momen positif. Betul disampaikan Raffi, fokus perkuat fundamental dan kalau bicara nama siapa tidak kenal dia,"" ujarnya saat dihubungi Tribunnews.com, Minggu (9/4/2023). Selain itu, IPO tentu bakal menciptakan valuasi lebih besar ke depannya dan kalau bicara industri hiburan juga tidak ada habisnya. ""Industri hiburan salah satu yang tidak pernah mati. Ikuti zaman dengan konten kreatif,"" kata Nico. Sementara, IPO RANS dinilainya juga menarik dari sisi peluang investasi, terutama karena mereka lebih fokus terhadap digital.   .recads_wrapper{height:134px;position:relative;margin:10px 0 30px;padding:10px 15px;overflow:hidden;box-shadow:0 0 10px rgb(0 0 0 / 20%);}.recads_title{margin-bottom:10px;font-size:16px;font-weight:700}.arjW-list{overflow-x:scroll;overflow-y:hidden;white-space:nowrap;width:auto;padding:10px 0;position:relative;display:flex;scroll-snap-type:x;flex-wrap:nowrap}.recads_item{scroll-snap-align:start;width:280px;flex:0 0 280px;margin-right:20px;display: flex;white-space: normal;gap: 10px;}.recads_item a {display:flex;white-space:normal;gap:10px;}.recads_image{position:relative;height:auto}.recads_image img{width:auto;height: 73px!important;max-width:165px!important;border-radius:8px}.article_datas_title{font-size:14px;font-weight:700;line-height:1.2;margin:0;overflow:hidden;display:-webkit-box;-webkit-line-clamp:4;-webkit-box-orient:vertical;}.arjW-img-overlay{position:absolute;z-index:3;bottom:8px;left:0;padding:0 0 0 10px}.arjW-img-overlay>img{width:auto;height: 16px!important;}.recads_image::after{z-index:2;position:absolute;top:50%;bottom:4px;left:0;right:0;content:'';background:linear-gradient(to top,#d6d6d6,transparent);width:100%;border-radius: 8px;}             BERITA REKOMENDASI           ""Emtek juga mau investasi di RANS, berarti yang dibangun RANS dilirik dalam industri hiburan digital, seperti diketahui penetrasi digital cepat, dinamis dan pangsa pasarnya luas. Industri ini masih mampu ciptakan bisnis yang bagus,"" tuturnya. Kendati demikian, Nico menambahkan, satu-satunya tantangan utama yang ada di industri hiburan adalah cukup sering berubah. ""Industri ini cukup fragile, cepat berubah terlalu dinamis. Oleh sebab itu, sejauh mana RANS mampu kembangkan konten kreatif, mampu ikuti zaman, dan ciptakan tren jadi nilai tambah RANS,"" pungkasnya.";09-04-2023;https://www.tribunnews.com/bisnis/2023/04/09/rans-mau-ipo-analis-bisnis-hiburan-tak-pernah-mati-tapi-cepat-berubah;"laporan wartawan tribunnews.com, yanuar riezqi yovanda tribunnews.com, jakarta - rans entertainment milik raffi ahmad dan nagita slavina sudah mewacanakan penawaran umum perdana saham atau initial public offering (ipo) di bursa efek indonesia, meski belum ada dokumen yang masuk. associate director of research and investment pilarmas investindo sekuritas maximilianus nico demus mengatakan, aksi korporasi tersebut akan berdampak positif terhadap rans. ""jadi, mengenai wacana ipo rans disampaikan mau perkuat fundamentalnya tentu jadi momen positif. betul disampaikan raffi, fokus perkuat fundamental dan kalau bicara nama siapa tidak kenal dia,"" ujarnya saat dihubungi tribunnews.com, minggu (9/4/2023). selain itu, ipo tentu bakal menciptakan valuasi lebih besar ke depannya dan kalau bicara industri hiburan juga tidak ada habisnya. ""industri hiburan salah satu yang tidak pernah mati. ikuti zaman dengan konten kreatif,"" kata nico. sementara, ipo rans dinilainya juga menarik dari sisi peluang investasi, terutama karena mereka lebih fokus terhadap digital. berita rekomendasi ""emtek juga mau investasi di rans, berarti yang dibangun rans dilirik dalam industri hiburan digital, seperti diketahui penetrasi digital cepat, dinamis dan pangsa pasarnya luas. industri ini masih mampu ciptakan bisnis yang bagus,"" tuturnya. kendati demikian, nico menambahkan, satu-satunya tantangan utama yang ada di industri hiburan adalah cukup sering berubah. ""industri ini cukup fragile, cepat berubah terlalu dinamis. oleh sebab itu, sejauh mana rans mampu kembangkan konten kreatif, mampu ikuti zaman, dan ciptakan tren jadi nilai tambah rans,"" pungkasnya."
KUR BNI 2023: Pengertian, Jenis dan Syarat;"TRIBUNNEWS.COM – Berikut pengertian Kredit Usaha Rakyat (KUR) Bank BNI, syarat hingga jenis KUR terbaru di 2023. Tahun 2023, bunga KUR BNI sebesar 6 persen per tahun, atau 0,5 persen per bulan. KUR adalah kredit atau pinjaman pemerintah yang bertujuan untuk memajukan UMKM. Program pinjaman pemerintah ini memiliki bunga pinjaman rendah. Jenis-jenis KUR  Terdapat tiga jenis KUR yang disediakan oleh pemerintah untuk masyarakat. Ketiga jenis KUR adalah mikro, retail, dan TKI. 1. KUR Mikro  .recads_wrapper{height:134px;position:relative;margin:10px 0 30px;padding:10px 15px;overflow:hidden;box-shadow:0 0 10px rgb(0 0 0 / 20%);}.recads_title{margin-bottom:10px;font-size:16px;font-weight:700}.arjW-list{overflow-x:scroll;overflow-y:hidden;white-space:nowrap;width:auto;padding:10px 0;position:relative;display:flex;scroll-snap-type:x;flex-wrap:nowrap}.recads_item{scroll-snap-align:start;width:280px;flex:0 0 280px;margin-right:20px;display: flex;white-space: normal;gap: 10px;}.recads_item a {display:flex;white-space:normal;gap:10px;}.recads_image{position:relative;height:auto}.recads_image img{width:auto;height: 73px!important;max-width:165px!important;border-radius:8px}.article_datas_title{font-size:14px;font-weight:700;line-height:1.2;margin:0;overflow:hidden;display:-webkit-box;-webkit-line-clamp:4;-webkit-box-orient:vertical;}.arjW-img-overlay{position:absolute;z-index:3;bottom:8px;left:0;padding:0 0 0 10px}.arjW-img-overlay>img{width:auto;height: 16px!important;}.recads_image::after{z-index:2;position:absolute;top:50%;bottom:4px;left:0;right:0;content:'';background:linear-gradient(to top,#d6d6d6,transparent);width:100%;border-radius: 8px;}             BERITA REKOMENDASI           KUR mikro adalah jenis pinjaman untuk pengusaha kecil berskala mikro, dengan besaran maksimal pinjamannya yaitu Rp25 juta. Jumlah ini bisa berbeda tergantung kebijakan bank penyalurnya. Modal akan dipinjamkan kepada usaha kecil yang dinilai produktif dan prospektif dari segi profit. Karena, bank penyalur harus mempertimbangkan kesanggupan peminjam dalam memenuhi tanggung jawabnya. Ada beberapa syarat yang harus dipenuhi peminjam atau debitur sebelum mengajukan program KUR. Syarat tersebut antara lain keseriusan peminjam dalam menjalankan usahanya, utamanya di 3 bulan terakhir, peminjam pernah mengikuti pelatihan kewirausahaan yang dibuktikan dengan sertifikat, dan usaha yang dijalankan harus masuk kategori usaha produktif. Selain itu, ada dua kategori pelunasan pinjaman KUR Mikro, yaitu 3 tahun untuk usaha kredit modal kerja dan 5 tahun untuk usaha kredit investasi. 2. KUR Retail KUR retail adalah pinjaman yang ditujukan untuk pengusaha kalangan menengah yang berpotensi membayar cicilan dengan bunga flat atau anuitas setara. Batas maksimal pinjaman KUR retail sebanyak Rp500 juta. Selain batas maksimal, KUR retail juga menawarkan jangka waktu pengembalian yang cenderung lebih lama. Batas waktu untuk pinjaman pembiayaan modal kerja yaitu 4 tahun dan pembiayaan investasi selama 5 tahun. Dari segi syarat, pengajuan KUR retail dan mikro relatif sama. Hanya saja, bagi yang ingin mengajukan KUR retail dituntut untuk memiliki agunan atau jaminan. 3. KUR TKI Selain untuk pengusaha, ternyata sasaran KUR adalah siapapun yang membutuhkan modal awal, termasuk TKI. KUR TKI adalah bantuan permodalan untuk Tenaga Kerja Indonesia (TKI) yang ingin bekerja di luar negeri tetapi tidak memiliki modal awal. Batas maksimal pinjaman untuk jenis KUR ini yaitu Rp25 juta. Jangka waktu pengembaliannya paling lama 3 tahun setelah dana cair. Dengan adanya pinjaman jenis ini, masyarakat yang ingin bekerja di luar negeri tak perlu khawatir jika belum memiliki modal awal. Dokumen yang harus dipersiapkan untuk mengajukan KUR TKI adalah KTP, KK, surat keterangan domisili dan surat keterangan sehat dari dokter. (Tribunnews.com/Mikael Dafit Adi Prasetyo)";12-04-2023;https://www.tribunnews.com/bisnis/2023/04/12/kur-bni-2023-pengertian-jenis-dan-syarat;tribunnews.com – berikut pengertian kredit usaha rakyat (kur) bank bni, syarat hingga jenis kur terbaru di 2023. tahun 2023, bunga kur bni sebesar 6 persen per tahun, atau 0,5 persen per bulan. kur adalah kredit atau pinjaman pemerintah yang bertujuan untuk memajukan umkm. program pinjaman pemerintah ini memiliki bunga pinjaman rendah. jenis-jenis kur terdapat tiga jenis kur yang disediakan oleh pemerintah untuk masyarakat. ketiga jenis kur adalah mikro, retail, dan tki. 1. kur mikro berita rekomendasi kur mikro adalah jenis pinjaman untuk pengusaha kecil berskala mikro, dengan besaran maksimal pinjamannya yaitu rp25 juta. jumlah ini bisa berbeda tergantung kebijakan bank penyalurnya. modal akan dipinjamkan kepada usaha kecil yang dinilai produktif dan prospektif dari segi profit. karena, bank penyalur harus mempertimbangkan kesanggupan peminjam dalam memenuhi tanggung jawabnya. ada beberapa syarat yang harus dipenuhi peminjam atau debitur sebelum mengajukan program kur. syarat tersebut antara lain keseriusan peminjam dalam menjalankan usahanya, utamanya di 3 bulan terakhir, peminjam pernah mengikuti pelatihan kewirausahaan yang dibuktikan dengan sertifikat, dan usaha yang dijalankan harus masuk kategori usaha produktif. selain itu, ada dua kategori pelunasan pinjaman kur mikro, yaitu 3 tahun untuk usaha kredit modal kerja dan 5 tahun untuk usaha kredit investasi. 2. kur retail kur retail adalah pinjaman yang ditujukan untuk pengusaha kalangan menengah yang berpotensi membayar cicilan dengan bunga flat atau anuitas setara. batas maksimal pinjaman kur retail sebanyak rp500 juta. selain batas maksimal, kur retail juga menawarkan jangka waktu pengembalian yang cenderung lebih lama. batas waktu untuk pinjaman pembiayaan modal kerja yaitu 4 tahun dan pembiayaan investasi selama 5 tahun. dari segi syarat, pengajuan kur retail dan mikro relatif sama. hanya saja, bagi yang ingin mengajukan kur retail dituntut untuk memiliki agunan atau jaminan. 3. kur tki selain untuk pengusaha, ternyata sasaran kur adalah siapapun yang membutuhkan modal awal, termasuk tki. kur tki adalah bantuan permodalan untuk tenaga kerja indonesia (tki) yang ingin bekerja di luar negeri tetapi tidak memiliki modal awal. batas maksimal pinjaman untuk jenis kur ini yaitu rp25 juta. jangka waktu pengembaliannya paling lama 3 tahun setelah dana cair. dengan adanya pinjaman jenis ini, masyarakat yang ingin bekerja di luar negeri tak perlu khawatir jika belum memiliki modal awal. dokumen yang harus dipersiapkan untuk mengajukan kur tki adalah ktp, kk, surat keterangan domisili dan surat keterangan sehat dari dokter. (tribunnews.com/mikael dafit adi prasetyo)
