Title;Content;Date;URL;Cleaned Article
 BI Kembali Tahan Suku Bunga Acuan di Posisi 5,75 Persen Pada September ;"Bank Indonesia (BI) mempertahankan suku bunga acuan BI-7 Day Reverse Repo Rate (BI7DRR) di 5,75 persen dalam Rapat Dewan Gubernur (RDG) yang berlangsung pada 20-21 September 2023. Dengan demikian, suku bunga Deposit Facility tetap sebesar 5 persen, dan suku bunga Lending Facility tetap sebesar 6,5 persen. ""Rapat Dewan Gubernur, RDG Bank Indonesia pada 20 dan 21 September memutuskan untuk mempertahankan BI 7 Days Reverse Repo Rate sebesar 5,75 persen,"" ujar Gubernur Bank Indonesia Perry Warjiyo dalam konferensi pers, Kamis (21/9).  ADVERTISEMENT   SCROLL TO CONTINUE WITH CONTENT  Ia menambahkan keputusan ini dilakukan karena BI tetap konsisten dengan stance kebijakan moneter preemptive dan forward looking. Kebijakan dilakukan untuk memastikan terus berlanjutnya penurunan ekspektasi inflasi dan inflasi ke depan.   ""Keputusan mempertahankan BI7DRR ini sebagai konsistensi kebijakan moneter untuk memastikan inflasi tetap terkendali dalam kisaran sasaran 3 plus minus 1 persen pada sisa 2023 dan turun menjadi 2,5 plus minus 1 persen pada 2024,"" pungkas Perry. Sebelumnya, pada Rapat Dewan Gubernur BI periode Agustus 2023, BI juga menahan suku bunga tetap di 5,75 persen. BI terakhir menaikkan suku bunga pada Januari 2023 sebesar 25 basis poin dari 5,5 persen menjadi 5,75 persen. [Gambas:Video CNN] ";21-09-2023;https://www.cnnindonesia.com/ekonomi/20230921142113-78-1001974/bi-kembali-tahan-suku-bunga-acuan-di-posisi-575-persen-pada-september;"bank indonesia (bi) mempertahankan suku bunga acuan bi-7 day reverse repo rate (bi7drr) di 5,75 persen dalam rapat dewan gubernur (rdg) yang berlangsung pada 20-21 september 2023. dengan demikian, suku bunga deposit facility tetap sebesar 5 persen, dan suku bunga lending facility tetap sebesar 6,5 persen. ""rapat dewan gubernur, rdg bank indonesia pada 20 dan 21 september memutuskan untuk mempertahankan bi 7 days reverse repo rate sebesar 5,75 persen,"" ujar gubernur bank indonesia perry warjiyo dalam konferensi pers, kamis (21/9). ia menambahkan keputusan ini dilakukan karena bi tetap konsisten dengan stance kebijakan moneter preemptive dan forward looking. kebijakan dilakukan untuk memastikan terus berlanjutnya penurunan ekspektasi inflasi dan inflasi ke depan. ""keputusan mempertahankan bi7drr ini sebagai konsistensi kebijakan moneter untuk memastikan inflasi tetap terkendali dalam kisaran sasaran 3 plus minus 1 persen pada sisa 2023 dan turun menjadi 2,5 plus minus 1 persen pada 2024,"" pungkas perry. sebelumnya, pada rapat dewan gubernur bi periode agustus 2023, bi juga menahan suku bunga tetap di 5,75 persen. bi terakhir menaikkan suku bunga pada januari 2023 sebesar 25 basis poin dari 5,5 persen menjadi 5,75 persen. "
 Rupiah Tersungkur ke Rp15.490 per Dolar AS Sore Ini ;"Nilai tukar rupiah ditutup di level Rp15.490 per dolar AS pada Selasa (26/9) sore. Mata uang Garuda melemah 87,5 poin atau minus 0,57 persen dari perdagangan sebelumnya. Senada, kurs referensi Bank Indonesia (BI) Jakarta Interbank Spot Dollar Rate (Jisdor) menempatkan rupiah melemah ke posisi Rp15.464 per dolar AS pada perdagangan hari ini. Mata uang di kawasan Asia terpantau ramai-ramai bergerak di zona merah. Dolar Singapura melemah 0,13 persen, rupee India minus 0,1 persen, peso Filipina minus 0,33 persen, dan bath Thailand minus 0,36 persen.  ADVERTISEMENT   SCROLL TO CONTINUE WITH CONTENT   Lalu, won Korea Selatan minus 0,93 persen, dolar Hong Kong minus 0,02 persen, ringgit Malaysia minus 0,1 persen, dan yuan China stagnan Senada, mayoritas mata uang negara maju bergerak di zona merah. Tercatat, dolar Australia melemah 0,2 persen, franc Swiss minus 0,11 persen, dolar Kanada minus 0,25 persen, poundsterling Inggris 0,25 persen, dan Euro Eropa stagnan. Analis DCFX Futures Lukman Leong mengatakan rupiah melemah oleh sentimen risk off di pasar.   Menurutnya, investor masih mengantisipasi sinyal kenaikan suku bunga oleh bank sentral AS (The Fed). ""Investor merespon pernyataan hawkish The Fed Kashkari yang semakin meningkatkan ekspektasi akan kenaikan suku bunga lainnya dari The Fed,"" kata Lukman kepada CNNIndonesia.com. Selain itu, kata dia, investor juga masih mencermati kenaikan data inflasi indeks harga belanja personal (PCE) AS pekan ini. [Gambas:Video CNN] ";26-09-2023;https://www.cnnindonesia.com/ekonomi/20230926155749-78-1003998/rupiah-tersungkur-ke-rp15490-per-dolar-as-sore-ini;"nilai tukar rupiah ditutup di level rp15.490 per dolar as pada selasa (26/9) sore. mata uang garuda melemah 87,5 poin atau minus 0,57 persen dari perdagangan sebelumnya. senada, kurs referensi bank indonesia (bi) jakarta interbank spot dollar rate (jisdor) menempatkan rupiah melemah ke posisi rp15.464 per dolar as pada perdagangan hari ini. mata uang di kawasan asia terpantau ramai-ramai bergerak di zona merah. dolar singapura melemah 0,13 persen, rupee india minus 0,1 persen, peso filipina minus 0,33 persen, dan bath thailand minus 0,36 persen. lalu, won korea selatan minus 0,93 persen, dolar hong kong minus 0,02 persen, ringgit malaysia minus 0,1 persen, dan yuan china stagnan senada, mayoritas mata uang negara maju bergerak di zona merah. tercatat, dolar australia melemah 0,2 persen, franc swiss minus 0,11 persen, dolar kanada minus 0,25 persen, poundsterling inggris 0,25 persen, dan euro eropa stagnan. analis dcfx futures lukman leong mengatakan rupiah melemah oleh sentimen risk off di pasar. menurutnya, investor masih mengantisipasi sinyal kenaikan suku bunga oleh bank sentral as (the fed). ""investor merespon pernyataan hawkish the fed kashkari yang semakin meningkatkan ekspektasi akan kenaikan suku bunga lainnya dari the fed,"" kata lukman kepada cnnindonesia.com. selain itu, kata dia, investor juga masih mencermati kenaikan data inflasi indeks harga belanja personal (pce) as pekan ini. "
 Kata Pengamat soal APBN Jadi Jaminan Utang Kereta Cepat ;"Menteri Keuangan Sri Mulyani memastikan pemerintah memberikan penjaminan pinjaman untuk proyek pembangunan Kereta Cepat Jakarta - Bandung (KCJB). Komitmen itu tertuang dalam Peraturan Menteri Keuangan (PMK) Republik Indonesia Nomor 89 Tahun 2023 tentang Tata Cara Pelaksanaan Pemberian Penjaminan Pemerintah untuk Percepatan Penyelenggaraan Prasarana dan Sarana Kereta Cepat Antara Jakarta dan Bandung. Beleid diteken Sri Mulyani pada 31 Agustus lalu. Beleid mengatur soal penyediaan jaminan pemerintah bagi pencarian pendanaan dalam rangka menutup kenaikan atau perubahan biaya Proyek Kereta Cepat Jakarta-Bandung.  ADVERTISEMENT   SCROLL TO CONTINUE WITH CONTENT   Penjaminan diberikan terhadap seluruh kewajiban keuangan PT KAI yang timbul akibat pembengkakan biaya proyek tersebut, baik pokok pinjaman, bunga atau biaya lain yang timbul akibat utang-utang tersebut. Jaminan diberikan dengan mempertimbangkan berbagai prinsip. ""Kemampuan keuangan negara, kesinambungan fiskal dan pengelolaan risiko fiskal,"" kata beleid itu. Sri Mulyani mengatakan penjaminan proyek KCJB diatur dalam Peraturan Presiden Nomor 39 Tahun 2021. Penjaminan diberikan karena terjadi pembengkakan biaya proyek yang memicu lahirnya pinjaman tambahan.  Biaya pembangunan KCJB memang membengkak. Dalam proposal penawaran yang disampaikan pemerintah China ke Indonesia pada 2015 lalu, Negeri Tirai Bambu menawarkan biaya pembangunan proyek hanya US$5,13 miliar. Namun, Wakil Menteri BUMN II Kartika Wirjoatmodjo mengatakan biaya itu kemudian bengkak US$1,2 miliar atau sekitar Rp18,24 triliun (asumsi kurs Rp15.200 per dolar AS). PMK Nomor 89 Tahun 2023 tadi pun sempat ramai dikritik karena disinyalir pemerintah menggadaikan APBN. Namun, hal ini ditepis oleh Staf Khusus Menteri Keuangan Yustinus Prastowo. Menurut Prastowo, PMK Nomor 89 Tahun 2023 hanya penjaminan biasa. Ia mengatakan pemerintah sudah biasa memberikan penjaminan proyek infrastruktur.  ""Lalu masalahnya di mana? Tidak ada. Selama ini dijamin aman karena tata kelola dan manajemen risiko sangat dijaga. Yang bermasalah itu pikiran jorok, seolah APBN digadaikan ke China!,"" kata Yustinus dalam akun twitternya @prastow, Selasa (19/9). Ia menjelaskan pemerintah memberikan penjaminan kepada PT Kereta Api Indonesia atau KAI sebagai pemegang saham mayoritas KCJB agar dapat meningkatkan reputasinya ke pemberi pinjaman. Tujuannya untuk meningkatkan kepercayaan pemberi pinjaman terhadap proyek KCJB. ""Jelas ya, yang meminjam PT KAI ke kreditur, bukan pemerintah, apalagi seolah APBN langsung digunakan,"" katanya. Menanggapi hal tersebut, Ekonom Center of Reform on Economics (Core) Indonesia Yusuf Rendy Manilet menjelaskan sebenarnya keterlibatan APBN dalam proyek KCJB ini sebagai jaminan jika PT KAI di kemudian hari akan melakukan pinjaman.  ""Sehingga APBN di sini seperti semacam letter of guarantee yang kemudian seharusnya bisa menekan cost of borrowing ketika kemudian kereta api cepat membutuhkan pendanaan di kemudian hari,"" katanya kepada CNNIndonesia.com, Rabu (20/9). Meski demikian, kata Yusuf, keterlibatan APBN akhirnya memunculkan kontijensi risk yang kemudian bisa muncul dari proyek KCJB. Memang, APBN tidak serta merta menalangi kebutuhan dana yang semisal dibutuhkan dalam perjalanan operasional kereta api cepat ini. Namun, hal ini tidak menutup fakta bahwa ada risiko kontingensi yang kemudian harus ditanggung oleh APBN dari kesepakatan ataupun kebijakan ini. Oleh karena, menurut Yusuf sebenarnya perlu yang dipastikan adalah skenario-skenario operasional dari KCJB perlu dipastikan berjalan sesuai dengan rencana.  ""Misal di sisi target penumpang, apakah kemudian target penumpang per hari per bulan ataupun per tahun itu mencapai sesuai proyeksi sebelumnya,"" kata Yusuf. ""Kalaupun misalnya tidak tercapai apa bentuk mitigasinya? Bentuk mitigasi inilah yang juga akan berkorelasi terhadap risiko yang muncul dari kebijakan ini,"" sambungnya. Yusuf juga menyebut KCJB akan berpotensi meningkat kinerja perekonomian di daerah yang terdapat stasiun. Pada muaranya ketika meningkatkan perekonomian akan berpotensi memunculkan titik-titik ekonomi baru. Nah, titik-titik ekonomi baru inilah yang kemudian perlu dipantau. Apakah dia bisa berjalan sesuai dengan proyeksi atau tidak. ""Karena sama seperti argumen penumpang di atas, ini akan juga berkorelasi dengan risiko yang bisa muncul dalam operasional kereta api cepat ini sehingga mitigasi yang handal akan mengurangi risiko yang kemudian bisa muncul ke APBN melalui kebijakan ini,"" jelas Yusuf.  Bersambung ke halaman berikutnya... Sementara itu, Analis Senior Indonesia Strategic and Economic Action Institution Ronny P Sasmita menilai PMK Nomor 89 Tahun 2023 hanya hanya formalisasi dari isu yang sudah lama bergulir bahwa China meminta jaminan APBN untuk utang kereta cepat. Perkara lazim atau tidak, Ronny menilai hal itu lazim dalam konteks investasi China. Pasalnya, China biasa melakukan tekanan seperti itu kepada negara lain yang menerima investasi dan utang dari negaranya. Ia menjelaskan China memerlukan jaminan atas kepastian pengembalian dananya di masa depan. Pasalnya, dana yang dipakai perbankan China untuk dipinjamkan kepada BUMM Negeri Tirai Bambu untuk investasi di luar negeri adalah berupa Sovereign Leverage Fund, atau SLF.  ""Jadi dana yang dipinjamkan dan diinvestasikan bukanlah milik pemerintah China, tapi bagian dari foreign exchange reserves atau devisa, alias milik pengusaha eksportir China yang ada di bank sentral China,"" ucap Ronny. Di China, sambung Ronny, devisa tidak dipegang oleh perusahaan eksportir, tapi ditahan di bank sentral. Kemudian, bank sentral akan memberikan dolar kepada pengusaha sesuai kebutuhan impor dan bayar utang saja. ""Sisanya akan dikembalikan dalam bentuk yuan, bukan dolar, meskipun eksportir mendapat dolar dari aktivitas ekspor,"" imbuh Ronny. Dengan kata lain, bank sentral China mencetak yuan untuk dikembalikan kepada eksportir, sementara dolarnya ditahan. [Gambas:Photo CNN] Lalu, dolar itulah yang dipakai China untuk Belt and Road Initiative, untuk investasi di luar negeri, untuk membiayai bank BUMN China memberikan pinjaman kepada pengusaha di negara lain, atau mengakuisisi perusahaan strategis di luar negeri. Hal ini lazim disebut sebagai Sovereign Leverage Fund (SLF). Artinya, dana tersebut tidak bisa dipinjamkan secara cuma-cuma, tapi secara komersial di mana bunganya akan sulit dinegosiasikan di satu sisi karena bank sentral China juga harus membayar bunga kepada pemilik devisa. Selain itu, tingkat kepastian pengembalian dananya harus sangat tinggi. Sebab, dana itu bukan dana milik pemerintah. ""Oleh karena itu, China membutuhkan jaminan kuat, utamanya APBN,"" ucap Ronny. [Gambas:Video CNN] ";21-09-2023;https://www.cnnindonesia.com/ekonomi/20230921062558-92-1001727/kata-pengamat-soal-apbn-jadi-jaminan-utang-kereta-cepat;"menteri keuangan sri mulyani memastikan pemerintah memberikan penjaminan pinjaman untuk proyek pembangunan kereta cepat jakarta - bandung (kcjb). komitmen itu tertuang dalam peraturan menteri keuangan (pmk) republik indonesia nomor 89 tahun 2023 tentang tata cara pelaksanaan pemberian penjaminan pemerintah untuk percepatan penyelenggaraan prasarana dan sarana kereta cepat antara jakarta dan bandung. beleid diteken sri mulyani pada 31 agustus lalu. beleid mengatur soal penyediaan jaminan pemerintah bagi pencarian pendanaan dalam rangka menutup kenaikan atau perubahan biaya proyek kereta cepat jakarta-bandung. penjaminan diberikan terhadap seluruh kewajiban keuangan pt kai yang timbul akibat pembengkakan biaya proyek tersebut, baik pokok pinjaman, bunga atau biaya lain yang timbul akibat utang-utang tersebut. jaminan diberikan dengan mempertimbangkan berbagai prinsip. ""kemampuan keuangan negara, kesinambungan fiskal dan pengelolaan risiko fiskal,"" kata beleid itu. sri mulyani mengatakan penjaminan proyek kcjb diatur dalam peraturan presiden nomor 39 tahun 2021. penjaminan diberikan karena terjadi pembengkakan biaya proyek yang memicu lahirnya pinjaman tambahan. biaya pembangunan kcjb memang membengkak. dalam proposal penawaran yang disampaikan pemerintah china ke indonesia pada 2015 lalu, negeri tirai bambu menawarkan biaya pembangunan proyek hanya us$5,13 miliar. namun, wakil menteri bumn ii kartika wirjoatmodjo mengatakan biaya itu kemudian bengkak us$1,2 miliar atau sekitar rp18,24 triliun (asumsi kurs rp15.200 per dolar as). pmk nomor 89 tahun 2023 tadi pun sempat ramai dikritik karena disinyalir pemerintah menggadaikan apbn. namun, hal ini ditepis oleh staf khusus menteri keuangan yustinus prastowo. menurut prastowo, pmk nomor 89 tahun 2023 hanya penjaminan biasa. ia mengatakan pemerintah sudah biasa memberikan penjaminan proyek infrastruktur. ""lalu masalahnya di mana? tidak ada. selama ini dijamin aman karena tata kelola dan manajemen risiko sangat dijaga. yang bermasalah itu pikiran jorok, seolah apbn digadaikan ke china!,"" kata yustinus dalam akun twitternya @prastow, selasa (19/9). ia menjelaskan pemerintah memberikan penjaminan kepada pt kereta api indonesia atau kai sebagai pemegang saham mayoritas kcjb agar dapat meningkatkan reputasinya ke pemberi pinjaman. tujuannya untuk meningkatkan kepercayaan pemberi pinjaman terhadap proyek kcjb. ""jelas ya, yang meminjam pt kai ke kreditur, bukan pemerintah, apalagi seolah apbn langsung digunakan,"" katanya. menanggapi hal tersebut, ekonom center of reform on economics (core) indonesia yusuf rendy manilet menjelaskan sebenarnya keterlibatan apbn dalam proyek kcjb ini sebagai jaminan jika pt kai di kemudian hari akan melakukan pinjaman. ""sehingga apbn di sini seperti semacam letter of guarantee yang kemudian seharusnya bisa menekan cost of borrowing ketika kemudian kereta api cepat membutuhkan pendanaan di kemudian hari,"" katanya kepada cnnindonesia.com, rabu (20/9). meski demikian, kata yusuf, keterlibatan apbn akhirnya memunculkan kontijensi risk yang kemudian bisa muncul dari proyek kcjb. memang, apbn tidak serta merta menalangi kebutuhan dana yang semisal dibutuhkan dalam perjalanan operasional kereta api cepat ini. namun, hal ini tidak menutup fakta bahwa ada risiko kontingensi yang kemudian harus ditanggung oleh apbn dari kesepakatan ataupun kebijakan ini. oleh karena, menurut yusuf sebenarnya perlu yang dipastikan adalah skenario-skenario operasional dari kcjb perlu dipastikan berjalan sesuai dengan rencana. ""misal di sisi target penumpang, apakah kemudian target penumpang per hari per bulan ataupun per tahun itu mencapai sesuai proyeksi sebelumnya,"" kata yusuf. ""kalaupun misalnya tidak tercapai apa bentuk mitigasinya? bentuk mitigasi inilah yang juga akan berkorelasi terhadap risiko yang muncul dari kebijakan ini,"" sambungnya. yusuf juga menyebut kcjb akan berpotensi meningkat kinerja perekonomian di daerah yang terdapat stasiun. pada muaranya ketika meningkatkan perekonomian akan berpotensi memunculkan titik-titik ekonomi baru. nah, titik-titik ekonomi baru inilah yang kemudian perlu dipantau. apakah dia bisa berjalan sesuai dengan proyeksi atau tidak. ""karena sama seperti argumen penumpang di atas, ini akan juga berkorelasi dengan risiko yang bisa muncul dalam operasional kereta api cepat ini sehingga mitigasi yang handal akan mengurangi risiko yang kemudian bisa muncul ke apbn melalui kebijakan ini,"" jelas yusuf. bersambung ke halaman berikutnya... sementara itu, analis senior indonesia strategic and economic action institution ronny p sasmita menilai pmk nomor 89 tahun 2023 hanya hanya formalisasi dari isu yang sudah lama bergulir bahwa china meminta jaminan apbn untuk utang kereta cepat. perkara lazim atau tidak, ronny menilai hal itu lazim dalam konteks investasi china. pasalnya, china biasa melakukan tekanan seperti itu kepada negara lain yang menerima investasi dan utang dari negaranya. ia menjelaskan china memerlukan jaminan atas kepastian pengembalian dananya di masa depan. pasalnya, dana yang dipakai perbankan china untuk dipinjamkan kepada bumm negeri tirai bambu untuk investasi di luar negeri adalah berupa sovereign leverage fund, atau slf. ""jadi dana yang dipinjamkan dan diinvestasikan bukanlah milik pemerintah china, tapi bagian dari foreign exchange reserves atau devisa, alias milik pengusaha eksportir china yang ada di bank sentral china,"" ucap ronny. di china, sambung ronny, devisa tidak dipegang oleh perusahaan eksportir, tapi ditahan di bank sentral. kemudian, bank sentral akan memberikan dolar kepada pengusaha sesuai kebutuhan impor dan bayar utang saja. ""sisanya akan dikembalikan dalam bentuk yuan, bukan dolar, meskipun eksportir mendapat dolar dari aktivitas ekspor,"" imbuh ronny. dengan kata lain, bank sentral china mencetak yuan untuk dikembalikan kepada eksportir, sementara dolarnya ditahan. [gambas:photo cnn] lalu, dolar itulah yang dipakai china untuk belt and road initiative, untuk investasi di luar negeri, untuk membiayai bank bumn china memberikan pinjaman kepada pengusaha di negara lain, atau mengakuisisi perusahaan strategis di luar negeri. hal ini lazim disebut sebagai sovereign leverage fund (slf). artinya, dana tersebut tidak bisa dipinjamkan secara cuma-cuma, tapi secara komersial di mana bunganya akan sulit dinegosiasikan di satu sisi karena bank sentral china juga harus membayar bunga kepada pemilik devisa. selain itu, tingkat kepastian pengembalian dananya harus sangat tinggi. sebab, dana itu bukan dana milik pemerintah. ""oleh karena itu, china membutuhkan jaminan kuat, utamanya apbn,"" ucap ronny. "
 BI Catat Transaksi QRIS mencapai Rp18,33 T per Agustus 2023 ;"Bank Indonesia (BI) mencatat nilai transaksi QRIS mencapai Rp5.098,46 triliun per Agustus 2023. Gubernur BU Perry Warjiyo mengatakan capaian tersebut tumbuh 28,38 persen (yoy). ""Dengan jumlah pengguna 40,05 juta dan jumlah merchant 28,38 juta yang sebagian besar merupakan UMKM,"" ucap Perry dalam konferensi pers, Kamis (21/9).  ADVERTISEMENT   SCROLL TO CONTINUE WITH CONTENT   Menurut Perry, kinerja transaksi ekonomi dan keuangan digital tetap kuat didukung oleh sistem pembayaran yang aman, lancar, dan andal. Ia menyebut nilai transaksi uang elektronik (UE) meningkat 8,62 persen (yoy) menjadi Rp38,51 triliun pada Agustus 2023. Sementara, nilai transaksi digital banking tumbuh sebesar 11,87 persen (yoy) menjadi Rp5.098,46 triliun.   ""Bank Indonesia terus mendorong akselerasi digitalisasi sistem pembayaran dan perluasan kerja sama sistem pembayaran antarnegara guna mendorong inklusi ekonomi keuangan serta perluasan ekonomi dan keuangan digital,"" kata Perry. Adapun untuk nilai transaksi pembayaran menggunakan kartu ATM, kartu debit, dan kartu kredit mencapai Rp679,16 triliun atau turun sebesar 6 persen (yoy). Dari sisi pengelolaan uang rupiah, jumlah uang kartal yang diedarkan (UYD) meningkat 4,66 persen (yoy) menjadi Rp944,70 triliun pada Agustus 2023. Perry mengatakan pihaknya terus memastikan ketersediaan uang rupiah dengan kualitas yang terjaga di seluruh Tanah Air. ""Hal ini dilakukan melalui program pengedaran uang Rupiah ke daerah terluar, terdepan, terpencil (3T), serta melalui kegiatan kas keliling, Kas titipan, dan ekspedisi rupiah berdaulat,"" tandasnya. [Gambas:Video CNN] ";21-09-2023;https://www.cnnindonesia.com/ekonomi/20230921184900-78-1002146/bi-catat-transaksi-qris-mencapai-rp1833-t-per-agustus-2023;"bank indonesia (bi) mencatat nilai transaksi qris mencapai rp5.098,46 triliun per agustus 2023. gubernur bu perry warjiyo mengatakan capaian tersebut tumbuh 28,38 persen (yoy). ""dengan jumlah pengguna 40,05 juta dan jumlah merchant 28,38 juta yang sebagian besar merupakan umkm,"" ucap perry dalam konferensi pers, kamis (21/9). menurut perry, kinerja transaksi ekonomi dan keuangan digital tetap kuat didukung oleh sistem pembayaran yang aman, lancar, dan andal. ia menyebut nilai transaksi uang elektronik (ue) meningkat 8,62 persen (yoy) menjadi rp38,51 triliun pada agustus 2023. sementara, nilai transaksi digital banking tumbuh sebesar 11,87 persen (yoy) menjadi rp5.098,46 triliun. ""bank indonesia terus mendorong akselerasi digitalisasi sistem pembayaran dan perluasan kerja sama sistem pembayaran antarnegara guna mendorong inklusi ekonomi keuangan serta perluasan ekonomi dan keuangan digital,"" kata perry. adapun untuk nilai transaksi pembayaran menggunakan kartu atm, kartu debit, dan kartu kredit mencapai rp679,16 triliun atau turun sebesar 6 persen (yoy). dari sisi pengelolaan uang rupiah, jumlah uang kartal yang diedarkan (uyd) meningkat 4,66 persen (yoy) menjadi rp944,70 triliun pada agustus 2023. perry mengatakan pihaknya terus memastikan ketersediaan uang rupiah dengan kualitas yang terjaga di seluruh tanah air. ""hal ini dilakukan melalui program pengedaran uang rupiah ke daerah terluar, terdepan, terpencil (3t), serta melalui kegiatan kas keliling, kas titipan, dan ekspedisi rupiah berdaulat,"" tandasnya. "
