Title;Content;Date;URL;Cleaned Article
 Sri Mulyani Bakal Andalkan Pembiayaan Non Utang Tahun Depan ;"Menteri Keuangan Sri Mulyani menyatakan sumber pembiayaan non-utang bakal menjadi andalan pada tahun depan. Pembiayaan yang dimaksudnya meliputi saldo kas badan layanan umum (BLU), saldo anggaran lebih (SAL), dan sisa lebih perhitungan anggaran (SiLPa). Ani, akrab sapaannya, mengaku bakal mengoptimalkan sumber pembiayaan dari dalam negeri. Ia memproyeksikan pada tahun depan akan banyak sentimen negatif luar yang bakal memicu gejolak pasar global. Jika harus menarik pembiayaan dari lelang surat utang negara, Ani menyebut bahwa lelang bakal dilakukan secara hati-hati dengan timing (waktu) sesuai dinamika pasar.  ADVERTISEMENT   SCROLL TO CONTINUE WITH CONTENT  ""Kita akan mengandalkan sumber pembiayaan non utang, seperti saldo kas BLU, SAL dan SiLPA dan tentu kita terus koordinasi dengan Bank Indonesia (BI) dan otoritas terkait,"" imbuh dia pada keterangan pers daring, Senin (29/11). Ani membeberkan beberapa dinamika global yang harus diwaspadai meliputi varian baru omicron covid-19, tingginya inflasi yang berdampak pada harga konsumsi, kemungkinan tapering The Fed, lonjakan harga komoditas, serta ketegangan geopolitik. ""Kita akan terus jaga pembiayaan secara hati-hati karena tahun depan seperti kami sampaikan, terjadi beberapa dinamika global yang harus kita waspadai,"" jelasnya. Selain itu, ia menyatakan pemerintah juga bakal mengoptimalkan pendapatan sumber daya alam (SDA) di tengah kenaikan harga komoditas. Lalu, memperluas penerimaan basis perpajakan lewat Undang-undang Harmonisasi Peraturan Perpajakan (UU HPP). Dia merinci untuk tahun depan pendapatan negara sesuai dengan UU APBN ditetapkan sebesar Rp1.846,1 triliun yang terdiri dari sisi perpajakan Rp1.510 triliun, Pendapatan Negara Bukan Pajak (PNBP) Rp335,55 triliun, dan hibah Rp600 miliar. Sedangkan untuk belanja tahun depan dicanangkan sebesar Rp2.714 triliun dengan rincian belanja pemerintah pusat Rp1.944,5 triliun dan anggaran transfer ke daerah dan dana desa (TKDD) sebesar Rp769,6 triliun. [Gambas:Video CNN] ";29-11-2021;https://www.cnnindonesia.com/ekonomi/20211129155912-532-727477/sri-mulyani-bakal-andalkan-pembiayaan-non-utang-tahun-depan;"menteri keuangan sri mulyani menyatakan sumber pembiayaan non-utang bakal menjadi andalan pada tahun depan. pembiayaan yang dimaksudnya meliputi saldo kas badan layanan umum (blu), saldo anggaran lebih (sal), dan sisa lebih perhitungan anggaran (silpa). ani, akrab sapaannya, mengaku bakal mengoptimalkan sumber pembiayaan dari dalam negeri. ia memproyeksikan pada tahun depan akan banyak sentimen negatif luar yang bakal memicu gejolak pasar global. jika harus menarik pembiayaan dari lelang surat utang negara, ani menyebut bahwa lelang bakal dilakukan secara hati-hati dengan timing (waktu) sesuai dinamika pasar. ""kita akan mengandalkan sumber pembiayaan non utang, seperti saldo kas blu, sal dan silpa dan tentu kita terus koordinasi dengan bank indonesia (bi) dan otoritas terkait,"" imbuh dia pada keterangan pers daring, senin (29/11). ani membeberkan beberapa dinamika global yang harus diwaspadai meliputi varian baru omicron covid-19, tingginya inflasi yang berdampak pada harga konsumsi, kemungkinan tapering the fed, lonjakan harga komoditas, serta ketegangan geopolitik. ""kita akan terus jaga pembiayaan secara hati-hati karena tahun depan seperti kami sampaikan, terjadi beberapa dinamika global yang harus kita waspadai,"" jelasnya. selain itu, ia menyatakan pemerintah juga bakal mengoptimalkan pendapatan sumber daya alam (sda) di tengah kenaikan harga komoditas. lalu, memperluas penerimaan basis perpajakan lewat undang-undang harmonisasi peraturan perpajakan (uu hpp). dia merinci untuk tahun depan pendapatan negara sesuai dengan uu apbn ditetapkan sebesar rp1.846,1 triliun yang terdiri dari sisi perpajakan rp1.510 triliun, pendapatan negara bukan pajak (pnbp) rp335,55 triliun, dan hibah rp600 miliar. sedangkan untuk belanja tahun depan dicanangkan sebesar rp2.714 triliun dengan rincian belanja pemerintah pusat rp1.944,5 triliun dan anggaran transfer ke daerah dan dana desa (tkdd) sebesar rp769,6 triliun. "
 Grab IPO di Bursa Saham AS, Raup Rp64 Triliun ;"Grab Holdings Limited, perusahaan rintisan (startup) asal Singapura, melakukan IPO atau melantai di bursa saham AS pada hari ini, Kamis (2/12). Grab masuk melalui bursa saham Nasdaq dan berhasil meraup dana segar hingga US$4,5 miliar atau setara Rp64 triliun (kurs Rp14.377 per dolar). Nilai tersebut berasal dari hasil penggabungan antara Grab dengan Altimeter Growth Corp. ""Penggabungan bisnis tersebut telah disetujui oleh pemegang saham Altimeter dalam rapat khusus yang diadakan pada 30 November lalu. Saham Grab diperkirakan mulai diperdagangkan di Nasdaq pada 2 Desember 2021 dengan kode saham GRAB,"" terang Nasdaq dikutip dari situs resmi, Kamis (2/12).  ADVERTISEMENT   SCROLL TO CONTINUE WITH CONTENT  Nasdaq mengklaim nilai tersebut menjadikan Grab sebagai perusahaan asal Asia Tenggara yang berhasil meraup dana terbesar sepanjang sejarah. CEO Grab Anthony Tan berharap kehadiran perusahaannya di bursa efek AS dapat memberikan perhatian lebih dan mendorong kesempatan berkembang lebih baik lagi. ""Evolusi kami menjadi superapp didorong oleh masalah sehari-hari yang kami ingin selesaikan dan pertumbuhan layanan ekosistem digital membuat semuanya berubah,"" jelasnya. CEO Altimeter mengatakan Grab merupakan perusahaan yang ikonik dan memiliki misi untuk menyelesaikan masalah orang-orang dan masyarakat selama ini. Grab dinilai dapat mengkombinasikan jasa transportasi online, pengiriman, dan pembayaran dalam satu aplikasi. Counterpoint Global Morgan Stanley yang membantu Grab memasuki pasar saham AS menilai perusahaan ini memiliki pertumbuhan investasi yang unik di pasar Asia Tenggara. ""Kami sangat senang dapat membantu memunculkan platform teknologi inovatif di Asia Tenggara,"" kata Head of Counterpoint Global Morgan Stanley Dennis Lynch. Grab mengklaim telah menyelesaikan 1 miliar transaksi pada pertengahan tahun ini. Mereka juga mengaku sebagai perusahaan dengan permintaan terbesar dan pengiriman makanan terbanyak dengan lebih dari 2 juta partner. Pasar perusahaan ini diperkirakan tumbuh hingga US$180 miliar pada 2025 mendatang. [Gambas:Video CNN] ";02-12-2021;https://www.cnnindonesia.com/ekonomi/20211202150530-92-729045/grab-ipo-di-bursa-saham-as-raup-rp64-triliun;"grab holdings limited, perusahaan rintisan (startup) asal singapura, melakukan ipo atau melantai di bursa saham as pada hari ini, kamis (2/12). grab masuk melalui bursa saham nasdaq dan berhasil meraup dana segar hingga us$4,5 miliar atau setara rp64 triliun (kurs rp14.377 per dolar). nilai tersebut berasal dari hasil penggabungan antara grab dengan altimeter growth corp. ""penggabungan bisnis tersebut telah disetujui oleh pemegang saham altimeter dalam rapat khusus yang diadakan pada 30 november lalu. saham grab diperkirakan mulai diperdagangkan di nasdaq pada 2 desember 2021 dengan kode saham grab,"" terang nasdaq dikutip dari situs resmi, kamis (2/12). nasdaq mengklaim nilai tersebut menjadikan grab sebagai perusahaan asal asia tenggara yang berhasil meraup dana terbesar sepanjang sejarah. ceo grab anthony tan berharap kehadiran perusahaannya di bursa efek as dapat memberikan perhatian lebih dan mendorong kesempatan berkembang lebih baik lagi. ""evolusi kami menjadi superapp didorong oleh masalah sehari-hari yang kami ingin selesaikan dan pertumbuhan layanan ekosistem digital membuat semuanya berubah,"" jelasnya. ceo altimeter mengatakan grab merupakan perusahaan yang ikonik dan memiliki misi untuk menyelesaikan masalah orang-orang dan masyarakat selama ini. grab dinilai dapat mengkombinasikan jasa transportasi online, pengiriman, dan pembayaran dalam satu aplikasi. counterpoint global morgan stanley yang membantu grab memasuki pasar saham as menilai perusahaan ini memiliki pertumbuhan investasi yang unik di pasar asia tenggara. ""kami sangat senang dapat membantu memunculkan platform teknologi inovatif di asia tenggara,"" kata head of counterpoint global morgan stanley dennis lynch. grab mengklaim telah menyelesaikan 1 miliar transaksi pada pertengahan tahun ini. mereka juga mengaku sebagai perusahaan dengan permintaan terbesar dan pengiriman makanan terbanyak dengan lebih dari 2 juta partner. pasar perusahaan ini diperkirakan tumbuh hingga us$180 miliar pada 2025 mendatang. "
         Catat! Aturan Pre-Closing Pasar Saham Baru yang Dirombak BEI    ;"PT Bursa Efek Indonesia (BEI) melakukan penyesuai mekanisme pre opening dan pre closing perdagangan saham. Pre opening sendiri yakni sesi perdagangan untuk pembentukan harga pembukaan, sementara pre closing yakni sesi perdagangan untuk pembentukan harga penutupan. Direktur Perdagangan dan Pengaturan Anggota Bursa BEI Laksono W Widodo menjelaskan, pada metode yang baru, pelaku pasar tak bisa melihat order selama sesi tersebut berlangsung. ""Dengan metode baru selama sesi pre opening dan pre closing berlangsung para pelaku pasar dan investor tidak dapat melihat order-order yang dimasukkan selama sesi berlangsung,"" katanya dalam konferensi pers, Senin (6/12/2021).      ADVERTISEMENT         SCROLL TO CONTINUE WITH CONTENT    Sehingga, lanjutnya, pelaku pasar seolah-olah melihat order kosong. Tapi, BEI menambah fitur baru yakni Indicative Equilibrium Price (IEP) dan Indicative Equilibrium Volume (IEV). Lewat fitur IEP, pelaku pasar bisa melihat indikasi harga pembukaan atau penutupan yang akan terbentuk. Sementara, melalui IEV pelaku pasar bisa melihat indikasi volume yang dapat dijumpai pada harga pembukaan atau harga penutupan. ""Jadi kalau kita lihat kosong, seolah-olah kosong order book-nya. Untuk itu diberikan kisi-kisi yang disebut IEP dan IEV itu adalah kira-kira berapa sih harga pembukaan dan harga penutupan yang terbentuk, itu IEP,"" ujarnya. ""Dan juga kurang lebih indikasi volume yang diperjumpakan pada harga pembukaan dan penutupan,"" tambahnya. BEI juga menambahkan fitur baru yakni random closing atau penutupan acak dalam 2 menit perdagangan terakhir. ""Bisa saja market itu bener-bener tutup jam 15.00 untuk pembentukan harga atau bisa juga 14.59,"" sambungnya. Dalam keterangan BEI dijelaskan, ada sejumlah tujuan dari penerapan fitur-fitur ini. Pertama, mengoptimalisasi pembentukan harga pembukaan dan harga penutupan yang lebih wajar pada sesi pre opening dan sesi pre closing sesuai dengan kondisi pasar. Kedua, meredam terjadinya manipulasi pergerakan harga saham yang tajam pada saat sesi pembukaan dan sesi penutupan. Ketiga, menyempurnakan transparansi pembentukan harga pembukaan dan penutupan kepada pelaku pasar. Keempat, meningkatkan likuiditas transaksi pada sesi pembukaan dan penutupan. Terakhir, merupakan best practice di bursa lain.";06-12-2021;https://finance.detik.com/bursa-dan-valas/d-5842776/catat-aturan-pre-closing-pasar-saham-baru-yang-dirombak-bei;"pt bursa efek indonesia (bei) melakukan penyesuai mekanisme pre opening dan pre closing perdagangan saham. pre opening sendiri yakni sesi perdagangan untuk pembentukan harga pembukaan, sementara pre closing yakni sesi perdagangan untuk pembentukan harga penutupan. direktur perdagangan dan pengaturan anggota bursa bei laksono w widodo menjelaskan, pada metode yang baru, pelaku pasar tak bisa melihat order selama sesi tersebut berlangsung. ""dengan metode baru selama sesi pre opening dan pre closing berlangsung para pelaku pasar dan investor tidak dapat melihat order-order yang dimasukkan selama sesi berlangsung,"" katanya dalam konferensi pers, senin (6/12/2021). sehingga, lanjutnya, pelaku pasar seolah-olah melihat order kosong. tapi, bei menambah fitur baru yakni indicative equilibrium price (iep) dan indicative equilibrium volume (iev). lewat fitur iep, pelaku pasar bisa melihat indikasi harga pembukaan atau penutupan yang akan terbentuk. sementara, melalui iev pelaku pasar bisa melihat indikasi volume yang dapat dijumpai pada harga pembukaan atau harga penutupan. ""jadi kalau kita lihat kosong, seolah-olah kosong order book-nya. untuk itu diberikan kisi-kisi yang disebut iep dan iev itu adalah kira-kira berapa sih harga pembukaan dan harga penutupan yang terbentuk, itu iep,"" ujarnya. ""dan juga kurang lebih indikasi volume yang diperjumpakan pada harga pembukaan dan penutupan,"" tambahnya. bei juga menambahkan fitur baru yakni random closing atau penutupan acak dalam 2 menit perdagangan terakhir. ""bisa saja market itu bener-bener tutup jam 15.00 untuk pembentukan harga atau bisa juga 14.59,"" sambungnya. dalam keterangan bei dijelaskan, ada sejumlah tujuan dari penerapan fitur-fitur ini. pertama, mengoptimalisasi pembentukan harga pembukaan dan harga penutupan yang lebih wajar pada sesi pre opening dan sesi pre closing sesuai dengan kondisi pasar. kedua, meredam terjadinya manipulasi pergerakan harga saham yang tajam pada saat sesi pembukaan dan sesi penutupan. ketiga, menyempurnakan transparansi pembentukan harga pembukaan dan penutupan kepada pelaku pasar. keempat, meningkatkan likuiditas transaksi pada sesi pembukaan dan penutupan. terakhir, merupakan best practice di bursa lain."
         Dolar AS Mulai Menjinak Terhadap Rupiah, Begini Pergerakannya    ;Kurs dolar Amerika Serikat (AS) terhadap rupiah hari ini melemah. Mengutip data RTI, Selasa (30/11/2021), dolar AS pagi ini bergerak di level Rp 14.302 alias turun 29 poin (0,2%) dibandingkan kemarin. Jika dilihat selama sepekan terakhir, kurs dolar AS masih bergerak menguat. Namun hari ini pergerakannya baru menurun. Dolar AS tercatat menguat 0,34% selama sepekan terakhir. Pergerakannya ada di rentang Rp 14.250-14.402.      ADVERTISEMENT         SCROLL TO CONTINUE WITH CONTENT    Sementara dibandingkan selama sebulan terakhir, dolar AS masih menguat 0,39%. Pergerakannya ada di rentang Rp 14.171-14.402. Tak cuma kalah saing dengan rupiah, dolar AS pagi ini juga terkoreksi terhadap mata uang lainnya. Mata uang Paman Sam paling kuat ditekan oleh won Korsel, baht Thailand, dan dolar Selandia Baru. Sebaliknya rupiah pagi ini terpantau mayoritas menguat terhadap mata uang lainnya. Rupiah hanya kalah dari won Korsel dan paling kuat menekan yen Jepang, dolar Taiwan, dan dolar AS. Simak juga Video: Jokowi: Inflasi Tetap 3%, Nilai Tukar Rp 14.350 per Dolar AS  [Gambas:Video 20detik] ;30-11-2021;https://finance.detik.com/bursa-dan-valas/d-5833180/dolar-as-mulai-menjinak-terhadap-rupiah-begini-pergerakannya;kurs dolar amerika serikat (as) terhadap rupiah hari ini melemah. mengutip data rti, selasa (30/11/2021), dolar as pagi ini bergerak di level rp 14.302 alias turun 29 poin (0,2%) dibandingkan kemarin. jika dilihat selama sepekan terakhir, kurs dolar as masih bergerak menguat. namun hari ini pergerakannya baru menurun. dolar as tercatat menguat 0,34% selama sepekan terakhir. pergerakannya ada di rentang rp 14.250-14.402. sementara dibandingkan selama sebulan terakhir, dolar as masih menguat 0,39%. pergerakannya ada di rentang rp 14.171-14.402. tak cuma kalah saing dengan rupiah, dolar as pagi ini juga terkoreksi terhadap mata uang lainnya. mata uang paman sam paling kuat ditekan oleh won korsel, baht thailand, dan dolar selandia baru. sebaliknya rupiah pagi ini terpantau mayoritas menguat terhadap mata uang lainnya. rupiah hanya kalah dari won korsel dan paling kuat menekan yen jepang, dolar taiwan, dan dolar as. simak juga video: jokowi: inflasi tetap 3%, nilai tukar rp 14.350 per dolar as 
         Heboh soal Tapering, Apa Sih Itu? Tape Kering?    ;Tapering, satu kata yang belakangan ini sedang dikhawatirkan banyak pelaku pasar. Lalu apa itu tapering? Mengapa begitu ditakutkan pelaku pasar? Mengutip Investopedia, Selasa (7/12/2021), tapering merupakan salah satu senjata yang dimiliki bank sentral sebuah negara. Senjata itu akan menjadi menyeramkan jika digunakan bank sentral negara besar seperti Federal Reserve di Amerika Serikat (AS), karena dampaknya akan merembet ke mana-mana. Tapering merupakan kebijakan bank sentral dengan cara mengurangi pembelian aset seperti obligasi (surat utang). Kebijakan ini merupakan kebalikan dari senjata yang namanya pelonggaran quantitative easing (QE).      ADVERTISEMENT         SCROLL TO CONTINUE WITH CONTENT    The Fed atau bank sentral AS sudah melakukan pelonggaran untuk merangsang ekonomi AS yang sebelumnya loyo dihantam pandemi COVID-19. Kebijakan yang dilakukan di antaranya penurunan suku bunga dan melakukan 'pencetakan uang' dengan membeli US treasury hingga mencapai US$ 120 miliar per bulannya. Nah ketika kebijakan itu sudah berhasil dan ekonomi mulai membaik, untuk mencegah mesin ekonomi terlalu panas maka tapering dilakukan. Belakangan ini ada kabar bahwa tapering dipercepat. Ya tentu saja. Jika terjadi taper tantrum, investor-investor dunia yang memiliki uang jumbo akan menarik uangnya dari negara-negara berkembang seperti Indonesia. Alasannya sederhana, yang namanya investor pasti berburu cuan. Nah ketika taper tantrum, penempatan uangnya di AS akan lebih menguntungkan bagi mereka. Sebab suku bunga acuan AS akan naik. Ketika dana asing keluar dari Indonesia dalam jumlah besar dan terus menerus, sudah pasti akan mengguncangkan dunia investasi dan keuangan di dalam negeri. Sebab ketika para investor global yang menarik uangnya dari Indonesia, mereka membutuhkan dolar AS yang banyak. Jika permintaan dolar AS meningkat signifikan, maka nilainya akan naik dan rupiah yang kita cintai akan semakin lemah. Ngerinya lagi, psikologis pelaku pasar akan ikut panik.;07-12-2021;https://finance.detik.com/berita-ekonomi-bisnis/d-5843918/heboh-soal-tapering-apa-sih-itu-tape-kering;tapering, satu kata yang belakangan ini sedang dikhawatirkan banyak pelaku pasar. lalu apa itu tapering? mengapa begitu ditakutkan pelaku pasar? mengutip investopedia, selasa (7/12/2021), tapering merupakan salah satu senjata yang dimiliki bank sentral sebuah negara. senjata itu akan menjadi menyeramkan jika digunakan bank sentral negara besar seperti federal reserve di amerika serikat (as), karena dampaknya akan merembet ke mana-mana. tapering merupakan kebijakan bank sentral dengan cara mengurangi pembelian aset seperti obligasi (surat utang). kebijakan ini merupakan kebalikan dari senjata yang namanya pelonggaran quantitative easing (qe). the fed atau bank sentral as sudah melakukan pelonggaran untuk merangsang ekonomi as yang sebelumnya loyo dihantam pandemi covid-19. kebijakan yang dilakukan di antaranya penurunan suku bunga dan melakukan 'pencetakan uang' dengan membeli us treasury hingga mencapai us$ 120 miliar per bulannya. nah ketika kebijakan itu sudah berhasil dan ekonomi mulai membaik, untuk mencegah mesin ekonomi terlalu panas maka tapering dilakukan. belakangan ini ada kabar bahwa tapering dipercepat. ya tentu saja. jika terjadi taper tantrum, investor-investor dunia yang memiliki uang jumbo akan menarik uangnya dari negara-negara berkembang seperti indonesia. alasannya sederhana, yang namanya investor pasti berburu cuan. nah ketika taper tantrum, penempatan uangnya di as akan lebih menguntungkan bagi mereka. sebab suku bunga acuan as akan naik. ketika dana asing keluar dari indonesia dalam jumlah besar dan terus menerus, sudah pasti akan mengguncangkan dunia investasi dan keuangan di dalam negeri. sebab ketika para investor global yang menarik uangnya dari indonesia, mereka membutuhkan dolar as yang banyak. jika permintaan dolar as meningkat signifikan, maka nilainya akan naik dan rupiah yang kita cintai akan semakin lemah. ngerinya lagi, psikologis pelaku pasar akan ikut panik.
