Title;Content;Date;URL;Cleaned Article
         Manfaat dan Efek Samping dari Naiknya Suku Bunga Acuan BI    ;"Bank Indonesia (BI) telah menaikkan suku bunga acuan sebesar 25 bps pada Rapat Dewan Gubernur (RDG) yang digelar 18-19 Januari 2023 kemarin. BI menyebut, bunga acuan ini diharapkan bisa mengatasi tekanan inflasi dan menurunkan ekspektasi inflasi. Praktisi Perbankan Abiwodo menyebutkan memang BI 7days reverse repo rate (BI7DRR) ini masih awam di telinga masyarakat. Sebelumnya istilah ini dikenal dengan BI rate. Dia menjelaskan, saat masih menggunakan BI rate ang yang dipegang bank umum di BI tidak bisa langsung ditarik. Bank harus menunggu setahun sebelum mereka dapat menarik uangnya. Oleh karena itu jumlah uang beredar tidak segera bertambah, begitu juga sebaliknya. Jika BI menaikkan BI rate, inflasi mungkin tidak akan langsung turun. Pertumbuhan ekonomi yang diharapkan cepat tercapai, tidak segera terkabul karena butuh waktu lebih lama untuk memulihkan.      ADVERTISEMENT         SCROLL TO CONTINUE WITH CONTENT    Namun, sejak 19 Agustus 2016, BI mengganti istilah tersebut menjadi BI7DRR dengan tujuan agar pengelolaan suku bunga lebih efektif. Lembaga perbankan tidak lagi harus menunggu hingga satu tahun untuk mencairkan dananya. Bank dapat menarik uangnya setelah disimpan di BI selama 7 hari (mungkin 14 hari, 21 hari, dst). Abiwodo menjelaskan dengan system BI7DRR tentunya mempengaruhi kelancaran penyaluran kredit perbankan kepada masyarakat. Dengan perubahan suku bunga yang tiba-tiba, risiko gagal bayar pinjaman dapat diminimalkan. Pertumbuhan ekonomi yang diinginkan akhirnya segera tercapai. ""Adanya BI7DRR bisa berpengaruh terhadap banyak bidang. Mulai dari perbankan, sektor riil, hingga pasar uang. Tak heran apabila publik sangat menaruh perhatian terhadap pergerakan kenaikan BI7DRR,"" kata Abiwodo dalam keterangannya, Minggu (29/1/2023). Dia mengungkapkan dengan kenaikan 25 bps, maka BI7DRR menjadi 5,75%. Suku bunga Deposit Facility (DF) sebesar 5,00% dan suku bunga Lending Facility (LF) menjadi sebesar 6,5%. Langkah tersebut seperti melahirkan kebijakan terkait dengan upaya stabilisasi nilai tukar Rupiah. Kebijakan ini terus diperkuat dengan tujuan untuk mengendalikan inflasi barang impor. Dirasa efektif untuk dilakukan dalam mendukung tujuan kenaikan bunga BI7DRR. Mengapa demikian? Lantaran langkah tersebut bisa mengurangi dampak buruk dari kuatnya dolar AS. Menurut dia langkah ini juga berkaitan dengan tingginya ketidakpastian di pasar keuangan global. ""Ingat! Saat ini dunia juga tengah dilanda resesi perekonomian. Apabila segala upaya tersebut tak dilakukan dengan baik, maka bisa mengganggu ketahanan perbankan dan berbagai sektor lainnya di Indonesia,"" ujar dia. Dia mengatakan naiknya bunga acuan ini adalah langkah tepat jelang rapat Fed pada 1 Februari mendatang. Ada banyak dampak yang ditimbulkan dari kenaikan bunga BI7DRR terhadap ketahanan perbankan. Anda pasti penasaran bukan apa saja dampaknya? ""Salah satu dampaknya, bank akan menyesuaikan Suku Bunga Dasar Kredit (SBDK)-prime lending rate alhasil bank semakin berat dalam penyaluran kredit. Penyaluran kredit dapat terpuruk dan membuat pertumbuhan sektor riil terhambat. Bahkan juga bisa memicu penurunan peluang terbukanya lapangan kerja baru,"" ujar Abiwodo. ""Disamping itu, biaya kreditnya akan mengalami peningkatan. Pembengkakan biaya ini sebenarnya dampak langsung dari kebijakan moneter yang semakin ketat. Di sisi lain, masyarakat cenderung lebih memilih menabung untuk mengalokasikan uang. Kalo sudah begini, diharapkan perputaran uang di masyarakat melemah yang pada akhirnya dapat menekan inflasi,"" tambah Abiwodo dalam keterangannya. Berkaitan dengan dampak yang ditimbulkan, sebenarnya pemerintah dan BI tengah menjalin kerjasama untuk daur ulang devisa hasil dari ekspor. Langkah ini bisa berefek positif pada mata uang Rupiah untuk menurunkan inflasi hingga 4% di akhir tahun. Pada dasarnya, ada banyak upaya penting untuk menyikapi kenaikan BI7DRR. Kenapa hal ini penting? Jelas penting, sebab bisa meminimalisir dampak negatif yang ditimbulkan sekaligus membangun dampak positifnya. Kenaikan bunga BI7DRR membuat bank memberikan biaya lebih mahal, pun masyarakat cenderung mengurangi kredit atau pinjaman bank. Alih-alih deposan justru meningkat. Kenaikan bunga BI7DRR nyatanya berdampak pada berbagai bidang kehidupan. Tak terkecuali pula berdampak terhadap ketahanan perbankan. Akan tetapi jika kita mampu menyikapinya dengan baik, maka dampak buruknya bisa diminimalisir seoptimal mungkin. Sebagai pihak yang mengendalikan fluktuasi nilai rupiah, pengendalian inflasi dan kebijakan moneter lainnya, BI berperan penting dalam menetapkan pedoman BI rate yang kini namanya menjadi BI7DRR untuk menjaga stabilitas (pro-stability). Kebijakan tersebut berdampak besar terhadap perekonomian nasional secara umum. ""Dengan memahami peran BI7DRR dalam perekonomian nasional, kita dapat mengambil keputusan dan pilihan yang tepat terhadap perubahan sistem keuangan negara,"" jelas Abiwodo. ";29-01-2023;https://finance.detik.com/moneter/d-6540443/manfaat-dan-efek-samping-dari-naiknya-suku-bunga-acuan-bi;"bank indonesia (bi) telah menaikkan suku bunga acuan sebesar 25 bps pada rapat dewan gubernur (rdg) yang digelar 18-19 januari 2023 kemarin. bi menyebut, bunga acuan ini diharapkan bisa mengatasi tekanan inflasi dan menurunkan ekspektasi inflasi. praktisi perbankan abiwodo menyebutkan memang bi 7days reverse repo rate (bi7drr) ini masih awam di telinga masyarakat. sebelumnya istilah ini dikenal dengan bi rate. dia menjelaskan, saat masih menggunakan bi rate ang yang dipegang bank umum di bi tidak bisa langsung ditarik. bank harus menunggu setahun sebelum mereka dapat menarik uangnya. oleh karena itu jumlah uang beredar tidak segera bertambah, begitu juga sebaliknya. jika bi menaikkan bi rate, inflasi mungkin tidak akan langsung turun. pertumbuhan ekonomi yang diharapkan cepat tercapai, tidak segera terkabul karena butuh waktu lebih lama untuk memulihkan. namun, sejak 19 agustus 2016, bi mengganti istilah tersebut menjadi bi7drr dengan tujuan agar pengelolaan suku bunga lebih efektif. lembaga perbankan tidak lagi harus menunggu hingga satu tahun untuk mencairkan dananya. bank dapat menarik uangnya setelah disimpan di bi selama 7 hari (mungkin 14 hari, 21 hari, dst). abiwodo menjelaskan dengan system bi7drr tentunya mempengaruhi kelancaran penyaluran kredit perbankan kepada masyarakat. dengan perubahan suku bunga yang tiba-tiba, risiko gagal bayar pinjaman dapat diminimalkan. pertumbuhan ekonomi yang diinginkan akhirnya segera tercapai. ""adanya bi7drr bisa berpengaruh terhadap banyak bidang. mulai dari perbankan, sektor riil, hingga pasar uang. tak heran apabila publik sangat menaruh perhatian terhadap pergerakan kenaikan bi7drr,"" kata abiwodo dalam keterangannya, minggu (29/1/2023). dia mengungkapkan dengan kenaikan 25 bps, maka bi7drr menjadi 5,75%. suku bunga deposit facility (df) sebesar 5,00% dan suku bunga lending facility (lf) menjadi sebesar 6,5%. langkah tersebut seperti melahirkan kebijakan terkait dengan upaya stabilisasi nilai tukar rupiah. kebijakan ini terus diperkuat dengan tujuan untuk mengendalikan inflasi barang impor. dirasa efektif untuk dilakukan dalam mendukung tujuan kenaikan bunga bi7drr. mengapa demikian? lantaran langkah tersebut bisa mengurangi dampak buruk dari kuatnya dolar as. menurut dia langkah ini juga berkaitan dengan tingginya ketidakpastian di pasar keuangan global. ""ingat! saat ini dunia juga tengah dilanda resesi perekonomian. apabila segala upaya tersebut tak dilakukan dengan baik, maka bisa mengganggu ketahanan perbankan dan berbagai sektor lainnya di indonesia,"" ujar dia. dia mengatakan naiknya bunga acuan ini adalah langkah tepat jelang rapat fed pada 1 februari mendatang. ada banyak dampak yang ditimbulkan dari kenaikan bunga bi7drr terhadap ketahanan perbankan. anda pasti penasaran bukan apa saja dampaknya? ""salah satu dampaknya, bank akan menyesuaikan suku bunga dasar kredit (sbdk)-prime lending rate alhasil bank semakin berat dalam penyaluran kredit. penyaluran kredit dapat terpuruk dan membuat pertumbuhan sektor riil terhambat. bahkan juga bisa memicu penurunan peluang terbukanya lapangan kerja baru,"" ujar abiwodo. ""disamping itu, biaya kreditnya akan mengalami peningkatan. pembengkakan biaya ini sebenarnya dampak langsung dari kebijakan moneter yang semakin ketat. di sisi lain, masyarakat cenderung lebih memilih menabung untuk mengalokasikan uang. kalo sudah begini, diharapkan perputaran uang di masyarakat melemah yang pada akhirnya dapat menekan inflasi,"" tambah abiwodo dalam keterangannya. berkaitan dengan dampak yang ditimbulkan, sebenarnya pemerintah dan bi tengah menjalin kerjasama untuk daur ulang devisa hasil dari ekspor. langkah ini bisa berefek positif pada mata uang rupiah untuk menurunkan inflasi hingga 4% di akhir tahun. pada dasarnya, ada banyak upaya penting untuk menyikapi kenaikan bi7drr. kenapa hal ini penting? jelas penting, sebab bisa meminimalisir dampak negatif yang ditimbulkan sekaligus membangun dampak positifnya. kenaikan bunga bi7drr membuat bank memberikan biaya lebih mahal, pun masyarakat cenderung mengurangi kredit atau pinjaman bank. alih-alih deposan justru meningkat. kenaikan bunga bi7drr nyatanya berdampak pada berbagai bidang kehidupan. tak terkecuali pula berdampak terhadap ketahanan perbankan. akan tetapi jika kita mampu menyikapinya dengan baik, maka dampak buruknya bisa diminimalisir seoptimal mungkin. sebagai pihak yang mengendalikan fluktuasi nilai rupiah, pengendalian inflasi dan kebijakan moneter lainnya, bi berperan penting dalam menetapkan pedoman bi rate yang kini namanya menjadi bi7drr untuk menjaga stabilitas (pro-stability). kebijakan tersebut berdampak besar terhadap perekonomian nasional secara umum. ""dengan memahami peran bi7drr dalam perekonomian nasional, kita dapat mengambil keputusan dan pilihan yang tepat terhadap perubahan sistem keuangan negara,"" jelas abiwodo. "
Selasa Pagi, Rupiah Melemah Tipis di Level Rp 14.990 per Dolar AS;"Laporan Wartawan Tribunnews.com, Ismoyo TRIBUNNEWS.COM, JAKARTA - Nilai tukar mata uang rupiah terhadap dolar Amerika Serikat (AS) di level Rp 14.990 pada Selasa (31/1/2023) pagi pukul 10.07 WIB. Jika dicermati lebih detail, nilai tukar mata uang Garuda menguat tipis 19 poin. Di mana sebelumnya pada kemarin (30/1/2023), nilai tukar rupiah di level Rp 14.971. Pengamat Pasar Keuangan Ibrahim Assuaibi sebelumnya mengatakan, rupiah hari ini (31/1/2023) masih akan berfluktuasi dan cenderung menguat.  ""Dalam perdagangan sore (kemarin), mata uang rupiah ditutup menguat 14 point walaupun sebelumnya sempat menguat 15 point di level Rp 14.971 dari penutupan sebelumnya di level Rp 14.985,"" ucap Ibrahim dalam analisanya, Senin (30/1/2023). ""Sedangkan untuk perdagangan besok, mata uang rupiah kemungkinan dibuka berfluktuatif namun ditutup menguat direntang Rp 14.950 hingga Rp 14.990,"" sambungnya.  .recads_wrapper{height:134px;position:relative;margin:10px 0 30px;padding:10px 15px;overflow:hidden;box-shadow:0 0 10px rgb(0 0 0 / 20%);}.recads_title{margin-bottom:10px;font-size:16px;font-weight:700}.arjW-list{overflow-x:scroll;overflow-y:hidden;white-space:nowrap;width:auto;padding:10px 0;position:relative;display:flex;scroll-snap-type:x;flex-wrap:nowrap}.recads_item{scroll-snap-align:start;width:280px;flex:0 0 280px;margin-right:20px;display: flex;white-space: normal;gap: 10px;}.recads_item a {display:flex;white-space:normal;gap:10px;}.recads_image{position:relative;height:auto}.recads_image img{width:auto;height: 73px!important;max-width:165px!important;border-radius:8px}.article_datas_title{font-size:14px;font-weight:700;line-height:1.2;margin:0;overflow:hidden;display:-webkit-box;-webkit-line-clamp:4;-webkit-box-orient:vertical;}.arjW-img-overlay{position:absolute;z-index:3;bottom:8px;left:0;padding:0 0 0 10px}.arjW-img-overlay>img{width:auto;height: 16px!important;}.recads_image::after{z-index:2;position:absolute;top:50%;bottom:4px;left:0;right:0;content:'';background:linear-gradient(to top,#d6d6d6,transparent);width:100%;border-radius: 8px;}             BERITA REKOMENDASI           Ibrahim juga membeberkan pelemahan rupiah pada kemarin dipengaruhi sejumlah faktor, baik eksternal maupun internal. Untuk faktor eksternal, fluktuasi rupiah terdorong sentimen indeks dolar AS dan wacana kebijakan The Fed terkait suku bunga. Sementara untuk faktor internal, pengutan rupiah terdorong Bank Indonesia (BI) yang mengakui tetap waspada dan optimistis untuk pertumbuhan perekonomian Indonesia dalam menghadapi gejolak global yang tidak menentu. Pertumbuhan ekonomi di 2023 diperkirakan di kisaran 4,5-5,3 persen, kemungkinan bisa mengarah ke 5 persen. Hal tersebut terjadi jika konsumsi masyarakat meningkat signifikan. Sedangkan inflasi inti pada semester pertama 2023 dipastikan berada di bawah 4 persen. Kemudian inflasi Indeks Harga Konsumen (IHK) kembali ke dalam sasaran di bawah 4 persen pada semester kedua 2023. Dibandingkan dengan negara-negara didunia yang inflasinya masih tinggi.";31-01-2023;https://www.tribunnews.com/bisnis/2023/01/31/selasa-pagi-rupiah-melemah-tipis-di-level-rp-14990-per-dolar-as;"laporan wartawan tribunnews.com, ismoyo tribunnews.com, jakarta - nilai tukar mata uang rupiah terhadap dolar amerika serikat (as) di level rp 14.990 pada selasa (31/1/2023) pagi pukul 10.07 wib. jika dicermati lebih detail, nilai tukar mata uang garuda menguat tipis 19 poin. di mana sebelumnya pada kemarin (30/1/2023), nilai tukar rupiah di level rp 14.971. pengamat pasar keuangan ibrahim assuaibi sebelumnya mengatakan, rupiah hari ini (31/1/2023) masih akan berfluktuasi dan cenderung menguat. ""dalam perdagangan sore (kemarin), mata uang rupiah ditutup menguat 14 point walaupun sebelumnya sempat menguat 15 point di level rp 14.971 dari penutupan sebelumnya di level rp 14.985,"" ucap ibrahim dalam analisanya, senin (30/1/2023). ""sedangkan untuk perdagangan besok, mata uang rupiah kemungkinan dibuka berfluktuatif namun ditutup menguat direntang rp 14.950 hingga rp 14.990,"" sambungnya. berita rekomendasi ibrahim juga membeberkan pelemahan rupiah pada kemarin dipengaruhi sejumlah faktor, baik eksternal maupun internal. untuk faktor eksternal, fluktuasi rupiah terdorong sentimen indeks dolar as dan wacana kebijakan the fed terkait suku bunga. sementara untuk faktor internal, pengutan rupiah terdorong bank indonesia (bi) yang mengakui tetap waspada dan optimistis untuk pertumbuhan perekonomian indonesia dalam menghadapi gejolak global yang tidak menentu. pertumbuhan ekonomi di 2023 diperkirakan di kisaran 4,5-5,3 persen, kemungkinan bisa mengarah ke 5 persen. hal tersebut terjadi jika konsumsi masyarakat meningkat signifikan. sedangkan inflasi inti pada semester pertama 2023 dipastikan berada di bawah 4 persen. kemudian inflasi indeks harga konsumen (ihk) kembali ke dalam sasaran di bawah 4 persen pada semester kedua 2023. dibandingkan dengan negara-negara didunia yang inflasinya masih tinggi."
Main Hall BEI Kembali Dibuka, Anak-anak TK Ramaikan Pembukaan Perdagangan Saham;"Laporan Wartawan Tribunnews.com, Yanuar Riezqi Yovanda TRIBUNNEWS.COM, JAKARTA -- Main Hall Bursa Efek Indonesia (BEI) kembali dibuka untuk berbagai kegiatan terkait edukasi dan aktivitas pasar modal bagi masyarakat umum. Hal ini dilakukan dalam rangka meningkatkan pemahaman masyarakat mengenai investasi di pasar modal dan menindaklanjuti dihapusnya Pemberlakuan Pembatasan Kegiatan Masyarakat (PPKM). ""Kita bisa berkumpul bersama pada pembukaan perdagangan Bursa Efek Indonesia (BEI) untuk masyarakat umum setelah 2 tahun dibatasi akibat pandemi Covid-19,"" ujar Direktur Utama BEI Iman Rachman di Gedung BEI, Senin (30/1/2023). Iman mengatakan, yang unik dari pembukaan perdagangan saham di Main Hall BEI hari ini adalah diramaikan anak-anak TK Labschool Rawamangun sebagai investor pasar modal masa depan. ""Lebih istimewa lagi karena perdagangan hari ini dibuka oleh adik-adik sekalian. Adik-adik sekalian selama ini Main Hall jadi saksi sejarah perkembangan pasar modal Indonesia,"" katanya.  Lebih lanjut, dia menambahkan, Main Hall BEI juga sering menjadi tempat wisata edukasi terkait pasar modal kepada pelajar hingga mahasiswa.  .recads_wrapper{height:134px;position:relative;margin:10px 0 30px;padding:10px 15px;overflow:hidden;box-shadow:0 0 10px rgb(0 0 0 / 20%);}.recads_title{margin-bottom:10px;font-size:16px;font-weight:700}.arjW-list{overflow-x:scroll;overflow-y:hidden;white-space:nowrap;width:auto;padding:10px 0;position:relative;display:flex;scroll-snap-type:x;flex-wrap:nowrap}.recads_item{scroll-snap-align:start;width:280px;flex:0 0 280px;margin-right:20px;display: flex;white-space: normal;gap: 10px;}.recads_item a {display:flex;white-space:normal;gap:10px;}.recads_image{position:relative;height:auto}.recads_image img{width:auto;height: 73px!important;max-width:165px!important;border-radius:8px}.article_datas_title{font-size:14px;font-weight:700;line-height:1.2;margin:0;overflow:hidden;display:-webkit-box;-webkit-line-clamp:4;-webkit-box-orient:vertical;}.arjW-img-overlay{position:absolute;z-index:3;bottom:8px;left:0;padding:0 0 0 10px}.arjW-img-overlay>img{width:auto;height: 16px!important;}.recads_image::after{z-index:2;position:absolute;top:50%;bottom:4px;left:0;right:0;content:'';background:linear-gradient(to top,#d6d6d6,transparent);width:100%;border-radius: 8px;}             BERITA REKOMENDASI           ""Selain itu, jadi tujuan wisata edukasi baik sekolah maupun universitas. Setiap pekan terima 20 kunjungan dari sekolah dasar hingga perguruan tinggi,"" pungkas Iman.";30-01-2023;https://www.tribunnews.com/bisnis/2023/01/30/main-hall-bei-kembali-dibuka-anak-anak-tk-ramaikan-pembukaan-perdagangan-saham;"laporan wartawan tribunnews.com, yanuar riezqi yovanda tribunnews.com, jakarta -- main hall bursa efek indonesia (bei) kembali dibuka untuk berbagai kegiatan terkait edukasi dan aktivitas pasar modal bagi masyarakat umum. hal ini dilakukan dalam rangka meningkatkan pemahaman masyarakat mengenai investasi di pasar modal dan menindaklanjuti dihapusnya pemberlakuan pembatasan kegiatan masyarakat (ppkm). ""kita bisa berkumpul bersama pada pembukaan perdagangan bursa efek indonesia (bei) untuk masyarakat umum setelah 2 tahun dibatasi akibat pandemi covid-19,"" ujar direktur utama bei iman rachman di gedung bei, senin (30/1/2023). iman mengatakan, yang unik dari pembukaan perdagangan saham di main hall bei hari ini adalah diramaikan anak-anak tk labschool rawamangun sebagai investor pasar modal masa depan. ""lebih istimewa lagi karena perdagangan hari ini dibuka oleh adik-adik sekalian. adik-adik sekalian selama ini main hall jadi saksi sejarah perkembangan pasar modal indonesia,"" katanya. lebih lanjut, dia menambahkan, main hall bei juga sering menjadi tempat wisata edukasi terkait pasar modal kepada pelajar hingga mahasiswa. berita rekomendasi ""selain itu, jadi tujuan wisata edukasi baik sekolah maupun universitas. setiap pekan terima 20 kunjungan dari sekolah dasar hingga perguruan tinggi,"" pungkas iman."
