Title;Content;Date;URL;Cleaned Article
Ini Strategi Jitu Angkasa Pura II Lepas dari Jerat Kerugian Triliunan Rupiah Sepanjang Pandemi Covid-19;"JAKARTA, KOMPAS.com - Selama pandemi Covid-19, PT Angkasa Pura II (Persero) menjadi salah satu yang paling terdampak pandemi. Namun, perlahan perseroan mampu memulihkan diri. Terbukti sepanjang 2022, perusahaan pelat merah ini dapat membukukan laba bersih Rp 91,90 miliar, dari tahun sebelumnya mengalami kerugian sebesar Rp 3,79 triliun. Perolehan laba bersih itu, diikuti dengan membaiknya laba usaha perseroan dari rugi Rp 2,52 triliun menjadi laba Rp 934,11 miliar di 2022. Kinerja positif laba usaha ini didorong oleh pendapatan perseroan yang meningkat 54,55 persen secara tahunan menjadi Rp 8,41 triliun.  President Director AP II Muhammad Awaluddin mengatakan, perbaikan kinerja ini karena perseroan dan para pemangku kepentingan mampu mengelola pertumbuhan permintaan penerbangan dengan baik. Sebab di 2022, jumlah penumpang mulai kembali normal seperti sebelum pandemi seiring dengan membaiknya kondisi pandemi di Indonesia. Jumlah penumpang telah mencapai sekitar 70 persen dari 2019. Sementara pada 2020 dan 2021, jumlah penumpang pesawat menukik tajam akibat pembatasan perjalanan di seluruh dunia. Saat itu, jumlah penumpang hanya mencapai 40 persen dari 2019. ""AP II bersinergi erat dengan seluruh pihak untuk memastikan periode pemulihan pada 2022 berjalan baik,"" ujarnya dalam keterangan tertulis, Kamis (11/5/2023). Kendati jumlah penumpang pesawat mulai tumbuh, namun tetap diperlukan upaya lain guna mendorong kinerja keuangan perusahaan.  ""Lalu lintas penerbangan pada awal 2022 sudah menunjukkan tren positif, tetapi masih di bawah 2019 saat belum ada pandemi. Karena itu AP II juga menjalankan strategi lainnya guna mendorong pemulihan bisnis,"" ucapnya.     Salah satu strategi mempercepat pemulihan bisnis yang dijalankan AP II adalah pemanfaatan aset melalui tiga program yakni asset optimization program (brown field asset), asset acceleration program (asset under construction), dan asset utilization program (green field asset).   Strategi pemanfaatan aset yang dijalankan berhasil pada 2022, di mana pendapatan dari konsesi naik 28 persen dibandingkan 2021, lalu bisnis hotel naik 71 persen dan bisnis lounge meroket 224 persen.  ""Setelah di tengah pandemi pada 2020 dan 2021, AP II kini telah berhasil lepas dari hasil negatif dengan membukukan keuntungan pada 2022. Kami optimistis pada 2023 laba bersih akan kembali meningkat,"" kata Awaluddin. ";12-05-2023;https://money.kompas.com/read/2023/05/12/073000726/ini-strategi-jitu-angkasa-pura-ii-lepas-dari-jerat-kerugian-triliunan-rupiah?page=all;"jakarta,selama pandemi covid-19, pt angkasa pura ii (persero) menjadi salah satu yang paling terdampak pandemi. namun, perlahan perseroan mampu memulihkan diri. terbukti sepanjang 2022, perusahaan pelat merah ini dapat membukukan laba bersih rp 91,90 miliar, dari tahun sebelumnya mengalami kerugian sebesar rp 3,79 triliun. perolehan laba bersih itu, diikuti dengan membaiknya laba usaha perseroan dari rugi rp 2,52 triliun menjadi laba rp 934,11 miliar di 2022. kinerja positif laba usaha ini didorong oleh pendapatan perseroan yang meningkat 54,55 persen secara tahunan menjadi rp 8,41 triliun. president director ap ii muhammad awaluddin mengatakan, perbaikan kinerja ini karena perseroan dan para pemangku kepentingan mampu mengelola pertumbuhan permintaan penerbangan dengan baik. sebab di 2022, jumlah penumpang mulai kembali normal seperti sebelum pandemi seiring dengan membaiknya kondisi pandemi di indonesia. jumlah penumpang telah mencapai sekitar 70 persen dari 2019. sementara pada 2020 dan 2021, jumlah penumpang pesawat menukik tajam akibat pembatasan perjalanan di seluruh dunia. saat itu, jumlah penumpang hanya mencapai 40 persen dari 2019. ""ap ii bersinergi erat dengan seluruh pihak untuk memastikan periode pemulihan pada 2022 berjalan baik,"" ujarnya dalam keterangan tertulis, kamis (11/5/2023). kendati jumlah penumpang pesawat mulai tumbuh, namun tetap diperlukan upaya lain guna mendorong kinerja keuangan perusahaan. ""lalu lintas penerbangan pada awal 2022 sudah menunjukkan tren positif, tetapi masih di bawah 2019 saat belum ada pandemi. karena itu ap ii juga menjalankan strategi lainnya guna mendorong pemulihan bisnis,"" ucapnya. salah satu strategi mempercepat pemulihan bisnis yang dijalankan ap ii adalah pemanfaatan aset melalui tiga program yakni asset optimization program (brown field asset), asset acceleration program (asset under construction), dan asset utilization program (green field asset). strategi pemanfaatan aset yang dijalankan berhasil pada 2022, di mana pendapatan dari konsesi naik 28 persen dibandingkan 2021, lalu bisnis hotel naik 71 persen dan bisnis lounge meroket 224 persen. ""setelah di tengah pandemi pada 2020 dan 2021, ap ii kini telah berhasil lepas dari hasil negatif dengan membukukan keuntungan pada 2022. kami optimistis pada 2023 laba bersih akan kembali meningkat,"" kata awaluddin. "
Harga Emas Naik Turun, Apa Penyebabnya?;KOMPAS.com - Harga emas bisa naik atau turun dipengaruhi oleh sejumlah faktor. Harga emas sangat dinamis, dan cenderung selalu naik dari tahun ke tahun. Emas telah menjadi salah satu jenis logam mulai yang paling dipilih masyarakat untuk berinvestasi, karena dianggap lebih aman dibandingkan terjun langsung ke saham maupun obligasi. Lantas, apa yang membuat harga emas bisa naik dan turun? Dilansir dari laman resmi Otoritas Jasa Keuangan (OJK), terdapat beberapa faktor yang membuat harga emas naik dan turun seperti inflasi, kebijakan moneter, penawaran dan permintaan, kondisi global, hingga nilai tukar dolar Amerika Serikat. Inflasi adalah salah satu utama yang membuat harga-harga barang semakin naik, termasuk harga emas. Semakin tinggi tingkat inflasi maka harga emas semakin mahal. Hal tersebut disebabkan masyarakat memilih untuk menyimpan asetnya dengan memilih berinvestasi emas yang harganya cenderung stabil dan lebih aman. Emas yang semakin diminati pasar pun akan membuat harga emas meningkat. Harga emas sangat dipengaruhi oleh kebijakan moneter yang diambil oleh bank sentral Amerika Serikat (Federal System atau dikenal The Fed). Kebijakan moneter merupakan kebijakan menaikkan atau menurunkan suku bunga. Suku bunga The Fed yang turun, membuat harga emas berpotensi naik. Ini karena dolar menjadi tidak menarik lagi sebagai pilihan investasi dan masyarakat memilih menempatkan uangnya dalam berinvestasi emas.   Hukum penawaran dan permintaan berlaku pada harga emas. Semakin besar permintaan dibandingkan penawaran, membuat salah satu logam mulia ini akan naik. Sebaliknya, harga emas akan turun jika penawarannya lebih tinggi dibandingkan permintaannya. Kondisi politik, ekonomi, krisis, resesi, hingga perang menjadi salah satu pemicu naik turunnya harga emas. Kondisi ekonomi yang aecau, krisis, atau perang membuat harga emas melonjak naik. Ketidakpastian kondisi global membuat para investor beralih menginvestasikan dana yang dimiliki ke dalam aset aman seperti emas. Setidaknya terdapat tiga alasan emas bisa dipilih sebagai suatu investasi di tengah kondisi ekonomi yang tidak menentu. Yaitu nilai emas tetap terjaga di tengah inflasi atau deflasi, nilai emas tetap terjaga meskipun terjadi krisis ekonomi atau perang, hingga permintaan emas yang tidak berkurang di tengah ketersediaannya yang terbatas. Harga emas dalam negeri mengacu harga emas internasional yang dikonversi dari dolar AS ke mata uang rupiah. Sehingga, harga emas sangat dipengaruhi pergerakan rupiah terhadap dolar AS. Jika nilai tukar rupiah terhadap dolar AS melemah, maka harga emas lokal menguat, Sebaliknya, nilai tukar rupiah yang melemah, membuat harga emas lokal cenderung turun. Nah, begitulah ulasan mengenai faktor-faktor yang mempengaruhi naik turunnya harga emas. Sebelum memilih berinvestasi emas, pastikan investor telah mengetahui mengenai investasi tersebut termasuk kelebihan dan kekurangannya.  ;11-05-2023;https://money.kompas.com/read/2023/05/11/100300426/harga-emas-naik-turun-apa-penyebabnya-;harga emas bisa naik atau turun dipengaruhi oleh sejumlah faktor. harga emas sangat dinamis, dan cenderung selalu naik dari tahun ke tahun. emas telah menjadi salah satu jenis logam mulai yang paling dipilih masyarakat untuk berinvestasi, karena dianggap lebih aman dibandingkan terjun langsung ke saham maupun obligasi. lantas, apa yang membuat harga emas bisa naik dan turun? dilansir dari laman resmi otoritas jasa keuangan (ojk), terdapat beberapa faktor yang membuat harga emas naik dan turun seperti inflasi, kebijakan moneter, penawaran dan permintaan, kondisi global, hingga nilai tukar dolar amerika serikat. inflasi adalah salah satu utama yang membuat harga-harga barang semakin naik, termasuk harga emas. semakin tinggi tingkat inflasi maka harga emas semakin mahal. hal tersebut disebabkan masyarakat memilih untuk menyimpan asetnya dengan memilih berinvestasi emas yang harganya cenderung stabil dan lebih aman. emas yang semakin diminati pasar pun akan membuat harga emas meningkat. harga emas sangat dipengaruhi oleh kebijakan moneter yang diambil oleh bank sentral amerika serikat (federal system atau dikenal the fed). kebijakan moneter merupakan kebijakan menaikkan atau menurunkan suku bunga. suku bunga the fed yang turun, membuat harga emas berpotensi naik. ini karena dolar menjadi tidak menarik lagi sebagai pilihan investasi dan masyarakat memilih menempatkan uangnya dalam berinvestasi emas. hukum penawaran dan permintaan berlaku pada harga emas. semakin besar permintaan dibandingkan penawaran, membuat salah satu logam mulia ini akan naik. sebaliknya, harga emas akan turun jika penawarannya lebih tinggi dibandingkan permintaannya. kondisi politik, ekonomi, krisis, resesi, hingga perang menjadi salah satu pemicu naik turunnya harga emas. kondisi ekonomi yang aecau, krisis, atau perang membuat harga emas melonjak naik. ketidakpastian kondisi global membuat para investor beralih menginvestasikan dana yang dimiliki ke dalam aset aman seperti emas. setidaknya terdapat tiga alasan emas bisa dipilih sebagai suatu investasi di tengah kondisi ekonomi yang tidak menentu. yaitu nilai emas tetap terjaga di tengah inflasi atau deflasi, nilai emas tetap terjaga meskipun terjadi krisis ekonomi atau perang, hingga permintaan emas yang tidak berkurang di tengah ketersediaannya yang terbatas. harga emas dalam negeri mengacu harga emas internasional yang dikonversi dari dolar as ke mata uang rupiah. sehingga, harga emas sangat dipengaruhi pergerakan rupiah terhadap dolar as. jika nilai tukar rupiah terhadap dolar as melemah, maka harga emas lokal menguat, sebaliknya, nilai tukar rupiah yang melemah, membuat harga emas lokal cenderung turun. nah, begitulah ulasan mengenai faktor-faktor yang mempengaruhi naik turunnya harga emas. sebelum memilih berinvestasi emas, pastikan investor telah mengetahui mengenai investasi tersebut termasuk kelebihan dan kekurangannya. 
             Kinerja IHSG 10 Tahun Terakhir, di 4 Tahun Ini Jeblok            ;"Jakarta, CNBC Indonesia - Pertumbuhan pasar modal Indonesia cenderung melambat. Hal itu tercermin dari Indeks Harga Saham Gabungan (IHSG) hingga April 2023 di level 6.915 dengan mencatat pertumbuhan sebesar 0,95%. Capaian tersebut lebih rendah jika dibandingkan pertumbuhan pada tahun 2022 yang sebesar 4,09%, yang mana sempat menyentuh level tertinggi pada 13 September 2023 di level 7.318. Berdasarkan catatan Bursa Efek Indonesia (BEI) dalam kurun waktu 10 tahun terakhir IHSG sempat mengalami penurunan 4 kali di tahun 2013, 2015, 2018 dan 2020. Jika mengacu data tahun 2013, IHSG mengalami kenaikan meskipun cenderung bergerak berfluktuasi. Saat itu pertumbuhan IHSG turun 0,98% karena kebijakan suku bunga The Fed yang menjadi sentimen negatif bagi pasar saham RI. Namun, tahun 2014 berhasil pulih, bahkan IHSG langsung meroket tumbuh 22,29%. Kemudian, pada tahun 2015, IHSG kembali anjlok 12,13% karena perlambatan ekonomi di China. Hal itu berhasil diperbaiki pada tahun berikutnya dengan mencatat pertumbuhan sebesar 15,32% di tahun 2016 dan di 2017 IHSG terus tumbuh 19,99%. Pada 2018, pasar saham RI digemparkan dengan isu perdagangan antara Amerika dan China hingva membuat IHSG jatuh 2,54%. Pada tahun 2019 berhasil tetap tumbuh 1,70% meski lebih rendah dari tahun sebelumnya. Pada masa pandemi, tahun 2020 lalu IHSG digoyang karena adanya pandemi Covid-19 yang memberikan efek domino pada kinerja perusahaan. Saat itu IHSG anjlok 5,09%. Namun berhasil bangkit pada tahun berikutnya yang sebesar 10,08%. Adapun total nilai kapitalisasi pasar saham pada akhir tahun 2021 tercatat sebesar Rp 8.255,62 triliun atau mengalami peningkatan sebesar 18,4% (yoy). Bursa Efek Indonesia (BEI) telah melakukan normalisasi jam perdagangan saham per 3 April 2023 setelah dihantam pandemi. Namun, dampak dari kebijakan tersebut dinilai belum terasa lantaran rata-rata nilai transaksi harian (RNTH) tercatat sebesar Rp 8,45 triliun. Direktur Pengembangan BEI Jeffrey Hendrik mengatakan, kebijakan tersebut memang belum berdampak langsung pada pertumbuhan RNTH. Pasalnya, berdasarkan studi yang telah dilakukan sebelum melakukan normalisasi jam perdagangan tersebut, menunjukkan transaksi tinggi terjadi di awal dan akhir perdagangan. ""Karena studi kita sebelum normalisasi kalu pola perilaku investor memang akan tinggi di awal perdagangan dan akhir. Membentuk U. Normalisasi itu bukan tujuan utamanya untuk RNTH,"" ujarnya di Restoran Batik Kuring Jakarta, Senin (3/4). Jeffrey menjabarkan, dalam meningkatkan transaksi investor di pasar modal, BEI telah melakukan diskusi serta literasi baik ke investor lokal, institusi, maupun asing. ""Banyak hal yang kita lakukan dari seluruh segmen ritel kita atau investor institusi kita mauoun asing. Instutusi tetap kita lakukan diskusi, investor ritel edukasi, inklusi, dan aktivasi untuk ketiga kelompok itu,"" jelasnya. Jeffrey mengatakan lebih jauh, untuk meningkatkan investor institusi, pihaknya melakukan pendekatan berbeda terkait dengan pandangan para investor terhadap perekonomian tahun ini. Sementara pendekatan untuk investor asing, BEI telah beberapa kali melakukan roadshow dan diskusi di bursa regional, sekaligus mencari produk yang dikembangkan untuk meningkatkan transaksi di pasar modal. ""Sehingga aktivitas transaksi lokal maupun asing meningkat. Tentunya investor ritel salah satunya berinvestagsi secara rasional. Sehingga investasi yang dilakukan adalah yang baik,"" imbuhnya. Dalam kesempatan yang sama, Direktur Penilaian Perusahaan BEI I Gede Nyoman Yetna mengatakan, dalam upaya meningkatkan RNTH juga berdasarkan dari sisi suplai dan demand. Dalam pemenuhan sisi suplai, BEI melakukan sosialisasi ke daerah-daerah untuk merekomendasikan perusaahan melantai di hursa. ""Ketemu di daerah meyakinkan bursa tempat yang tepat untuk naik kelas dengan berbagai pihak,"" pungkasnya. ";15-05-2023;https://www.cnbcindonesia.com/market/20230515085445-17-437268/kinerja-ihsg-10-tahun-terakhir-di-4-tahun-ini-jeblok;"pertumbuhan pasar modal indonesia cenderung melambat. hal itu tercermin dari indeks harga saham gabungan (ihsg) hingga april 2023 di level 6.915 dengan mencatat pertumbuhan sebesar 0,95%. capaian tersebut lebih rendah jika dibandingkan pertumbuhan pada tahun 2022 yang sebesar 4,09%, yang mana sempat menyentuh level tertinggi pada 13 september 2023 di level 7.318. berdasarkan catatan bursa efek indonesia (bei) dalam kurun waktu 10 tahun terakhir ihsg sempat mengalami penurunan 4 kali di tahun 2013, 2015, 2018 dan 2020. jika mengacu data tahun 2013, ihsg mengalami kenaikan meskipun cenderung bergerak berfluktuasi. saat itu pertumbuhan ihsg turun 0,98% karena kebijakan suku bunga the fed yang menjadi sentimen negatif bagi pasar saham ri. namun, tahun 2014 berhasil pulih, bahkan ihsg langsung meroket tumbuh 22,29%. kemudian, pada tahun 2015, ihsg kembali anjlok 12,13% karena perlambatan ekonomi di china. hal itu berhasil diperbaiki pada tahun berikutnya dengan mencatat pertumbuhan sebesar 15,32% di tahun 2016 dan di 2017 ihsg terus tumbuh 19,99%. pada 2018, pasar saham ri digemparkan dengan isu perdagangan antara amerika dan china hingva membuat ihsg jatuh 2,54%. pada tahun 2019 berhasil tetap tumbuh 1,70% meski lebih rendah dari tahun sebelumnya. pada masa pandemi, tahun 2020 lalu ihsg digoyang karena adanya pandemi covid-19 yang memberikan efek domino pada kinerja perusahaan. saat itu ihsg anjlok 5,09%. namun berhasil bangkit pada tahun berikutnya yang sebesar 10,08%. adapun total nilai kapitalisasi pasar saham pada akhir tahun 2021 tercatat sebesar rp 8.255,62 triliun atau mengalami peningkatan sebesar 18,4% (yoy). bursa efek indonesia (bei) telah melakukan normalisasi jam perdagangan saham per 3 april 2023 setelah dihantam pandemi. namun, dampak dari kebijakan tersebut dinilai belum terasa lantaran rata-rata nilai transaksi harian (rnth) tercatat sebesar rp 8,45 triliun. direktur pengembangan bei jeffrey hendrik mengatakan, kebijakan tersebut memang belum berdampak langsung pada pertumbuhan rnth. pasalnya, berdasarkan studi yang telah dilakukan sebelum melakukan normalisasi jam perdagangan tersebut, menunjukkan transaksi tinggi terjadi di awal dan akhir perdagangan. ""karena studi kita sebelum normalisasi kalu pola perilaku investor memang akan tinggi di awal perdagangan dan akhir. membentuk u. normalisasi itu bukan tujuan utamanya untuk rnth,"" ujarnya di restoran batik kuring jakarta, senin (3/4). jeffrey menjabarkan, dalam meningkatkan transaksi investor di pasar modal, bei telah melakukan diskusi serta literasi baik ke investor lokal, institusi, maupun asing. ""banyak hal yang kita lakukan dari seluruh segmen ritel kita atau investor institusi kita mauoun asing. instutusi tetap kita lakukan diskusi, investor ritel edukasi, inklusi, dan aktivasi untuk ketiga kelompok itu,"" jelasnya. jeffrey mengatakan lebih jauh, untuk meningkatkan investor institusi, pihaknya melakukan pendekatan berbeda terkait dengan pandangan para investor terhadap perekonomian tahun ini. sementara pendekatan untuk investor asing, bei telah beberapa kali melakukan roadshow dan diskusi di bursa regional, sekaligus mencari produk yang dikembangkan untuk meningkatkan transaksi di pasar modal. ""sehingga aktivitas transaksi lokal maupun asing meningkat. tentunya investor ritel salah satunya berinvestagsi secara rasional. sehingga investasi yang dilakukan adalah yang baik,"" imbuhnya. dalam kesempatan yang sama, direktur penilaian perusahaan bei i gede nyoman yetna mengatakan, dalam upaya meningkatkan rnth juga berdasarkan dari sisi suplai dan demand. dalam pemenuhan sisi suplai, bei melakukan sosialisasi ke daerah-daerah untuk merekomendasikan perusaahan melantai di hursa. ""ketemu di daerah meyakinkan bursa tempat yang tepat untuk naik kelas dengan berbagai pihak,"" pungkasnya. "
             20 Saham Ini Jadi Penggerak Utama IHSG Sepanjang April 2023            ;Jakarta, CNBC Indonesia - Penting bagi investor untuk mencermati leading & lagging stocks. Sebab keduanya mencerminkan kinerja suatu saham yang dapat menjadi pertimbangan investor dalam menentukan pilihannya, apakah ingin membeli, menahan, atau menjual. Saham leading, berarti kinerja saham tersebut menggerakkan pasar secara keseluruhan. Sementara saham laggard adalah saham yang relatif berkinerja buruk terhadap pasar. Laggard akan memiliki imbal hasil yang lebih rendah dari rata-rata dibandingkan dengan pasar.   Lantas apa saja saham yang mendorong pergerakan Indeks Harga Saham Gabungan (IHSG)? Mengutip data Bursa Efek Indonesia (BEI) pada Senin (15/5/2023), berikut top 20 leading per April 2023. Leading Stocks 1. BBRI - 45,32 poin (7,82%) 2. ASII - 34,89 poin (12,50%) 3. TLKM - 23,14 poin (4,68%) 4. BBCA - 21,19 poin (3,43%) 5. BYAN - 13,92 poin (3,49%) 6. ADRO - 7,61 poin (7,93%) 7. TOWR - 5,46 poin (10,81%) 8. ICBP - 3,57 poin (6,02%) 9. NCKL+ - 3,17 poin (12,40%) 10. INDF - 2,78 poin (4,03%) 11. BANK - 2,59 poin (16,67%) 12. FILM - 2,46 poin (79,41%) 13. BMRI - 2,32 poin (0,48%) 14. GGRM - 1,97 poin (9,42%) 15. BSDE - 1,67 poin (8,67%) 16. INCO - 1,67 poin (4,89%) 17. PTBA - 1,47 poin (3,76%) 18. IMAS - 1,47 poin (102,58%) 19. BBNI - 1,42 poin (0,80%) 20. AKRA - 1,33 poin (4,52%);15-05-2023;https://www.cnbcindonesia.com/market/20230515103026-17-437308/20-saham-ini-jadi-penggerak-utama-ihsg-sepanjang-april-2023;penting bagi investor untuk mencermati leading & lagging stocks. sebab keduanya mencerminkan kinerja suatu saham yang dapat menjadi pertimbangan investor dalam menentukan pilihannya, apakah ingin membeli, menahan, atau menjual. saham leading, berarti kinerja saham tersebut menggerakkan pasar secara keseluruhan. sementara saham laggard adalah saham yang relatif berkinerja buruk terhadap pasar. laggard akan memiliki imbal hasil yang lebih rendah dari rata-rata dibandingkan dengan pasar. lantas apa saja saham yang mendorong pergerakan indeks harga saham gabungan (ihsg)? mengutip data bursa efek indonesia (bei) pada senin (15/5/2023), berikut top 20 leading per april 2023. leading stocks 1. bbri - 45,32 poin (7,82%) 2. asii - 34,89 poin (12,50%) 3. tlkm - 23,14 poin (4,68%) 4. bbca - 21,19 poin (3,43%) 5. byan - 13,92 poin (3,49%) 6. adro - 7,61 poin (7,93%) 7. towr - 5,46 poin (10,81%) 8. icbp - 3,57 poin (6,02%) 9. nckl+ - 3,17 poin (12,40%) 10. indf - 2,78 poin (4,03%) 11. bank - 2,59 poin (16,67%) 12. film - 2,46 poin (79,41%) 13. bmri - 2,32 poin (0,48%) 14. ggrm - 1,97 poin (9,42%) 15. bsde - 1,67 poin (8,67%) 16. inco - 1,67 poin (4,89%) 17. ptba - 1,47 poin (3,76%) 18. imas - 1,47 poin (102,58%) 19. bbni - 1,42 poin (0,80%) 20. akra - 1,33 poin (4,52%)
