Title;Content;Date;URL;Cleaned Article
 Wall Street Tergelincir Dari Rekor Tertinggi ;Tiga indeks acuan Wall Street tergelincir dari rekor tertingginya pada pembukaan perdagangan Selasa (9/2) waktu setempat. Ini menyusul laporan pendapatan kuartalan beberapa perusahaan yang mengecewakan. Sebelumnya pada Senin (8/2) optimisme investor atas prospek pemulihan ekonomi yang lebih cepat membuat indeks mencapai ke rekor tertingginya. Dow Jones Industrial Average naik 237,52 poin atau 0,76 persen menjadi 31.385,76. Indeks S&P 500 naik 28,76 poin atau 0,74 persen menjadi 3.915,59 dan Nasdaq Composite menguat 131,35 poin atau 0,95 persen menjadi 13.987,64.  ADVERTISEMENT   SCROLL TO CONTINUE WITH CONTENT  Sementara kemarin, indeks Dow Jones Industrial Average dibuka turun 25,9 poin atau 0,08 persen ke posisi 31.359,88, Indeks S&P 500 turun 5,1 poin atau 0,13 persen pada pembukaan menjadi 3.910,49, dan Nasdaq Composite turun 20,8 poin atau 0,15 menjadi menjadi 13.966,815 pada pembukaan perdagangan. Melansir Reuters, Saham Take-Two Interactive Software Inc turun hampir 4 persen usai produsen videogame itu membukukan penurunan dalam penjualan kuartalan. Kemudian saham pembuat lipstik Gucci, Coty Inc, turun 2,4 persen karena permintaan yang lemah untuk produk makeup, dan menghapus jutaan dari pendapatan kuartalannya. Di sisi lain, investor juga masih menunggu keputusan dari paket stimulus tambahan untuk penanganan pandemi covid-19 yang direncanakan mencapai sebesar US$1,9 triliun oleh Presiden AS Joe Biden. [Gambas:Video CNN] Sebelumnya laporan pendapatan perusahaan yang dan dukungan moneter serta fiskal telah mengangkat Dow dan S&P 500 enam hari berjalan. Namun analis telah memperingatkan risiko dari varian virus corona baru dan gangguan apa pun dalam peluncuran vaksin. Data perekonomian AS yang dirilis pekan lalu menunjukkan pertumbuhan pasar tenaga kerja yang lebih lambat dari perkiraan, menggarisbawahi kebutuhan akan lebih banyak bantuan pemerintah untuk mengatasi dampak pandemi covid-19. Sementara itu, kasus baru virus sekarang telah turun selama empat minggu berturut-turut ke level terendah sejak awal November, meski adanya kekhawatiran varian baru virus dapat memperlambat atau membalikkan kemajuan ini.;09-02-2021;https://www.cnnindonesia.com/ekonomi/20210209183335-92-604368/wall-street-tergelincir-dari-rekor-tertinggi;tiga indeks acuan wall street tergelincir dari rekor tertingginya pada pembukaan perdagangan selasa (9/2) waktu setempat. ini menyusul laporan pendapatan kuartalan beberapa perusahaan yang mengecewakan. sebelumnya pada senin (8/2) optimisme investor atas prospek pemulihan ekonomi yang lebih cepat membuat indeks mencapai ke rekor tertingginya. dow jones industrial average naik 237,52 poin atau 0,76 persen menjadi 31.385,76. indeks s&p 500 naik 28,76 poin atau 0,74 persen menjadi 3.915,59 dan nasdaq composite menguat 131,35 poin atau 0,95 persen menjadi 13.987,64. sementara kemarin, indeks dow jones industrial average dibuka turun 25,9 poin atau 0,08 persen ke posisi 31.359,88, indeks s&p 500 turun 5,1 poin atau 0,13 persen pada pembukaan menjadi 3.910,49, dan nasdaq composite turun 20,8 poin atau 0,15 menjadi menjadi 13.966,815 pada pembukaan perdagangan. melansir reuters, saham take-two interactive software inc turun hampir 4 persen usai produsen videogame itu membukukan penurunan dalam penjualan kuartalan. kemudian saham pembuat lipstik gucci, coty inc, turun 2,4 persen karena permintaan yang lemah untuk produk makeup, dan menghapus jutaan dari pendapatan kuartalannya. di sisi lain, investor juga masih menunggu keputusan dari paket stimulus tambahan untuk penanganan pandemi covid-19 yang direncanakan mencapai sebesar us$1,9 triliun oleh presiden as joe biden. sebelumnya laporan pendapatan perusahaan yang dan dukungan moneter serta fiskal telah mengangkat dow dan s&p 500 enam hari berjalan. namun analis telah memperingatkan risiko dari varian virus corona baru dan gangguan apa pun dalam peluncuran vaksin. data perekonomian as yang dirilis pekan lalu menunjukkan pertumbuhan pasar tenaga kerja yang lebih lambat dari perkiraan, menggarisbawahi kebutuhan akan lebih banyak bantuan pemerintah untuk mengatasi dampak pandemi covid-19. sementara itu, kasus baru virus sekarang telah turun selama empat minggu berturut-turut ke level terendah sejak awal november, meski adanya kekhawatiran varian baru virus dapat memperlambat atau membalikkan kemajuan ini.
 Kronologi Dugaan Korupsi di BPJS Ketenagakerjaan ;"Kejaksaan Agung (Kejagung) menggeledah kantor pusat BPJS Ketenagakerjaan pada 18 Januari 2021 lalu. Penggeledahan terkait dugaan korupsi dalam pengelolaan dana investasi di badan eks PT Jamsostek tersebut. Tak tanggung-tanggung, nilai investasi yang sedang diselidiki Kejagung mencapai Rp43 triliun yang ditempatkan di saham dan reksa dana. Nilai investasi itu disebut-sebut menjadi potensi kerugian negara. Kejagung telah memeriksa pejabat dan karyawan BPJS Ketenagakerjaan secara maraton. Kejagung juga memeriksa sejumlah perusahaan manajer investasi dan perusahaan sekuritas yang berhubungan dengan investasi BPJS Ketenagakerjaan.  ADVERTISEMENT   SCROLL TO CONTINUE WITH CONTENT  Sejauh ini, Kejagung belum memberikan pernyataan lebih lanjut terkait dugaan korupsi seperti apa yang dilakukan oleh BPJS Ketenagakerjaan. Sementara, Badan Pemeriksa Keuangan (BPK) juga masih memeriksa keuangan lembaga tersebut. Manajemen BPJS Ketenagakerjaan buka suara perihal dugaan korupsi dalam pengelolaan dana investasi. Deputi Direktur Bidang Humas dan Antara Lembaga BPJS Ketenagakerjaan Irvansyah Utoh Banja menuturkan mayoritas dana yang dikelola BPJS Ketenagakerjaan ditempatkan di surat utang. ""Aset alokasi per 31 Desember 2020 sebagai berikut, surat utang 64 persen, saham 17 persen, deposito 10 persen, reksa dana 8 persen, dan investasi langsung sebesar satu persen,"" papar Utoh kepada CNNIndonesia.com, dikutip Kamis (11/2). Khusus saham, mayoritas portofolionya ditempatkan di saham-saham LQ45. Sementara, Utoh mengklaim penempatan dana di reksa dana juga berdasarkan underlying asset yang memiliki fundamental yang kuat dan likuiditas cukup kokoh. [Gambas:Video CNN] ""Sehingga kualitas aset investasi sangat baik, dan pengelolaan dana tidak pernah mengalami kendala likuiditas dan selalu dapat memenuhi kewajiban klaim kepada peserta,"" jelas Utoh. Ia menyatakan total dana yang dikelola BPJS Ketenagakerjaan sebesar Rp486,38 triliun. Dari situ, hasil investasi yang didapat sebesar Rp32,3 triliun dengan tingkat pengembalian investasi (yield on investment/YOI) 7,38 persen. Memang, Irvan mengakui ada penurunan nilai investasi (unrealized loss) sepanjang Agustus-September 2020 sebesar Rp43 triliun. Hal itu terjadi karena Indeks Harga Saham Gabungan (IHSG) anjlok hingga ke level 3.900 pada Maret 2020 silam. ""Namun, seiring dengan membaiknya IHSG, unrealized loss tersebut turun menjadi Rp14 triliun pada posisi Januari 2021 dan akan terus membaik, seiring perbaikan IHSG,"" ucap Utoh. Ia menjelaskan unrealized loss merupakan kondisi penurunan nilai aset investasi saham atau reksa dana sebagai dampak dari fluktuasi pasar modal yang tidak bersifat statis. Unrealized loss, sambung Utoh, tidak bisa disebut kerugian selama tidak dilakukan realisasi penjualan aset investasi saham atau reksa dana tersebut. ""BPJS Ketenagakerjaan hanya melakukan realisasi penjualan aset investasi pada saham atau reksa dana yang dipastikan telah membukukan keuntungan,"" ujarnya. Menurutnya, unrealized loss merupakan risiko yang tidak dapat dihindarkan oleh investor, termasuk BPJS Ketenagakerjaan. Hal ini khususnya untuk investor yang menempatkan dana di saham dan reksa dana. Terpisah, Presiden Konfederasi Serikat Pekerja Indonesia (KSPI) Said Iqbal mengaku tak terima dengan YOI yang sebesar 7,38 persen. Menurut dia, YOI seharusnya bisa mencapai 9 persen-10 persen. ""Ini memang di atas bunga deposito hasil investasinya, tapi kenapa tidak 9 persen, 10 persen. Ini akibat salah kelola jadi patut diduga korupsi dan ada potensi kehilangan keuntungan,"" kata Said. Ia menduga ada beberapa skema kesalahan pengelolaan investasi yang berpotensi dilakukan BPJS Ketenagakerjaan. Pertama, penempatan dana di saham bodong. Said menyatakan tak ada informasi jelas dari BPJS Ketenagakerjaan terkait penempatan dana investasi. Misalnya, BPJS Ketenagakerjaan membeli saham LQ45, tapi tak dirinci saham LQ45 apa saja yang dibeli oleh BPJS Ketenagakerjaan. ""Dasar pertimbangannya apa, tidak pernah dijelaskan,"" imbuh Said. Kedua, ada pemberian komisi kepada pihak yang menentukan investasi di BPJS Ketenagakerjaan. Dengan demikian, keputusan penempatan investasi bukan berdasarkan fundamental dari masing-masing saham, tapi karena komisi itu.  Ketua Umum Asosiasi Pengusaha Indonesia (Apindo) Hariyadi B Sukamdani BPJS Ketenagakerjaan telah mengklarifikasi secara langsung kepada Apindo terkait isu tersebut dan memastikan dana pekerja aman. Ia menyatakan BPJS Ketenagakerjaan juga sudah memberikan klarifikasi terkait unrealized loss pada periode Agustus-September 2020 yang diperkirakan Rp43 triliun. Menurutnya, pengelolaan investasi BPJS Ketenagakerjaan dilakukan dengan profesional sesuai dengan regulasi yang berlaku. Ia juga menegaskan kasus tersebut tidak bisa disamakan dengan kasus yang terjadi di dua BUMN lain, seperti Jiwasraya atau Asabri.";14-02-2021;https://www.cnnindonesia.com/ekonomi/20210214122415-78-606059/kronologi-dugaan-korupsi-di-bpjs-ketenagakerjaan;"kejaksaan agung (kejagung) menggeledah kantor pusat bpjs ketenagakerjaan pada 18 januari 2021 lalu. penggeledahan terkait dugaan korupsi dalam pengelolaan dana investasi di badan eks pt jamsostek tersebut. tak tanggung-tanggung, nilai investasi yang sedang diselidiki kejagung mencapai rp43 triliun yang ditempatkan di saham dan reksa dana. nilai investasi itu disebut-sebut menjadi potensi kerugian negara. kejagung telah memeriksa pejabat dan karyawan bpjs ketenagakerjaan secara maraton. kejagung juga memeriksa sejumlah perusahaan manajer investasi dan perusahaan sekuritas yang berhubungan dengan investasi bpjs ketenagakerjaan. sejauh ini, kejagung belum memberikan pernyataan lebih lanjut terkait dugaan korupsi seperti apa yang dilakukan oleh bpjs ketenagakerjaan. sementara, badan pemeriksa keuangan (bpk) juga masih memeriksa keuangan lembaga tersebut. manajemen bpjs ketenagakerjaan buka suara perihal dugaan korupsi dalam pengelolaan dana investasi. deputi direktur bidang humas dan antara lembaga bpjs ketenagakerjaan irvansyah utoh banja menuturkan mayoritas dana yang dikelola bpjs ketenagakerjaan ditempatkan di surat utang. ""aset alokasi per 31 desember 2020 sebagai berikut, surat utang 64 persen, saham 17 persen, deposito 10 persen, reksa dana 8 persen, dan investasi langsung sebesar satu persen,"" papar utoh kepada cnnindonesia.com, dikutip kamis (11/2). khusus saham, mayoritas portofolionya ditempatkan di saham-saham lq45. sementara, utoh mengklaim penempatan dana di reksa dana juga berdasarkan underlying asset yang memiliki fundamental yang kuat dan likuiditas cukup kokoh. ""sehingga kualitas aset investasi sangat baik, dan pengelolaan dana tidak pernah mengalami kendala likuiditas dan selalu dapat memenuhi kewajiban klaim kepada peserta,"" jelas utoh. ia menyatakan total dana yang dikelola bpjs ketenagakerjaan sebesar rp486,38 triliun. dari situ, hasil investasi yang didapat sebesar rp32,3 triliun dengan tingkat pengembalian investasi (yield on investment/yoi) 7,38 persen. memang, irvan mengakui ada penurunan nilai investasi (unrealized loss) sepanjang agustus-september 2020 sebesar rp43 triliun. hal itu terjadi karena indeks harga saham gabungan (ihsg) anjlok hingga ke level 3.900 pada maret 2020 silam. ""namun, seiring dengan membaiknya ihsg, unrealized loss tersebut turun menjadi rp14 triliun pada posisi januari 2021 dan akan terus membaik, seiring perbaikan ihsg,"" ucap utoh. ia menjelaskan unrealized loss merupakan kondisi penurunan nilai aset investasi saham atau reksa dana sebagai dampak dari fluktuasi pasar modal yang tidak bersifat statis. unrealized loss, sambung utoh, tidak bisa disebut kerugian selama tidak dilakukan realisasi penjualan aset investasi saham atau reksa dana tersebut. ""bpjs ketenagakerjaan hanya melakukan realisasi penjualan aset investasi pada saham atau reksa dana yang dipastikan telah membukukan keuntungan,"" ujarnya. menurutnya, unrealized loss merupakan risiko yang tidak dapat dihindarkan oleh investor, termasuk bpjs ketenagakerjaan. hal ini khususnya untuk investor yang menempatkan dana di saham dan reksa dana. terpisah, presiden konfederasi serikat pekerja indonesia (kspi) said iqbal mengaku tak terima dengan yoi yang sebesar 7,38 persen. menurut dia, yoi seharusnya bisa mencapai 9 persen-10 persen. ""ini memang di atas bunga deposito hasil investasinya, tapi kenapa tidak 9 persen, 10 persen. ini akibat salah kelola jadi patut diduga korupsi dan ada potensi kehilangan keuntungan,"" kata said. ia menduga ada beberapa skema kesalahan pengelolaan investasi yang berpotensi dilakukan bpjs ketenagakerjaan. pertama, penempatan dana di saham bodong. said menyatakan tak ada informasi jelas dari bpjs ketenagakerjaan terkait penempatan dana investasi. misalnya, bpjs ketenagakerjaan membeli saham lq45, tapi tak dirinci saham lq45 apa saja yang dibeli oleh bpjs ketenagakerjaan. ""dasar pertimbangannya apa, tidak pernah dijelaskan,"" imbuh said. kedua, ada pemberian komisi kepada pihak yang menentukan investasi di bpjs ketenagakerjaan. dengan demikian, keputusan penempatan investasi bukan berdasarkan fundamental dari masing-masing saham, tapi karena komisi itu. ketua umum asosiasi pengusaha indonesia (apindo) hariyadi b sukamdani bpjs ketenagakerjaan telah mengklarifikasi secara langsung kepada apindo terkait isu tersebut dan memastikan dana pekerja aman. ia menyatakan bpjs ketenagakerjaan juga sudah memberikan klarifikasi terkait unrealized loss pada periode agustus-september 2020 yang diperkirakan rp43 triliun. menurutnya, pengelolaan investasi bpjs ketenagakerjaan dilakukan dengan profesional sesuai dengan regulasi yang berlaku. ia juga menegaskan kasus tersebut tidak bisa disamakan dengan kasus yang terjadi di dua bumn lain, seperti jiwasraya atau asabri."
         IHSG Masih Kuat Nanjak, Parkir di Level 6.273    ;Indeks Harga Saham Gabungan (IHSG) siang ini parkir di level 6.273 atau naik 51 poin (0,82%). Indeks LQ45 juga naik 9 poin (0,96%) ke level 962.  IHSG hingga siang ini berada di level tertingginya di 6.283 dan terendahnya di 6.244. Sebanyak 294 saham naik, 174 saham turun, dan 157 stagnan.      ADVERTISEMENT         SCROLL TO CONTINUE WITH CONTENT    Pada pembukaan pagi tadi, IHSG dibuka di zona hijau. IHSG menguat 21 poin (0,35%) ke level 6.244. Sementara itu bursa Amerika Serikat (AS) ditutup menguat. Dow Jones ditutup 31,458.40 (+0.09%), NASDAQ ditutup 14,095.47 (+0.50%), S&P 500 ditutup 3,934.83 (+0.47%). Namun data ekonomi menunjukkan bahwa index kepercayaan konsumen mulai melemah ke level 76,2 dari sebelumnya 79 pada bulan Januari. Penurunan tersebut dikontribusikan oleh penduduk dengan tingkat pendapatan sebesar US$ 75,000. Selain itu angka 76,2 berada di bawah konsensus yaitu 80. Surutnya kepercayaan konsumen seiring dengan terusnya mundur paket stimulus yang akan diberikan pemerintah ke penduduk. Bursa Asia dibuka menguat. Index China dan Hong Kong masih tutup untuk perayaan imlek Ekonomi Jepang tercatat bertumbuh 12.7% YoY pada bulan Oktober ke Desember pada tahun 2020, angka tersebut di atas konsensus yakni 9,5% YoY. Berikut pergerakan bursa Asia pagi ini: * Indeks Nikkei naik 538 poin ke level 30.058 * Indeks Hang Seng libur * Indeks Shanghai libur * Indeks Strait Times menguat 8 poin ke 2.934 ;15-02-2021;https://finance.detik.com/bursa-dan-valas/d-5374245/ihsg-masih-kuat-nanjak-parkir-di-level-6-273;indeks harga saham gabungan (ihsg) siang ini parkir di level 6.273 atau naik 51 poin (0,82%). indeks lq45 juga naik 9 poin (0,96%) ke level 962. ihsg hingga siang ini berada di level tertingginya di 6.283 dan terendahnya di 6.244. sebanyak 294 saham naik, 174 saham turun, dan 157 stagnan. pada pembukaan pagi tadi, ihsg dibuka di zona hijau. ihsg menguat 21 poin (0,35%) ke level 6.244. sementara itu bursa amerika serikat (as) ditutup menguat. dow jones ditutup 31,458.40 (+0.09%), nasdaq ditutup 14,095.47 (+0.50%), s&p 500 ditutup 3,934.83 (+0.47%). namun data ekonomi menunjukkan bahwa index kepercayaan konsumen mulai melemah ke level 76,2 dari sebelumnya 79 pada bulan januari. penurunan tersebut dikontribusikan oleh penduduk dengan tingkat pendapatan sebesar us$ 75,000. selain itu angka 76,2 berada di bawah konsensus yaitu 80. surutnya kepercayaan konsumen seiring dengan terusnya mundur paket stimulus yang akan diberikan pemerintah ke penduduk. bursa asia dibuka menguat. index china dan hong kong masih tutup untuk perayaan imlek ekonomi jepang tercatat bertumbuh 12.7% yoy pada bulan oktober ke desember pada tahun 2020, angka tersebut di atas konsensus yakni 9,5% yoy. berikut pergerakan bursa asia pagi ini: * indeks nikkei naik 538 poin ke level 30.058 * indeks hang seng libur * indeks shanghai libur * indeks strait times menguat 8 poin ke 2.934 
         Ngiler! Modal 10 Juta, Punya Saham Ini Bisa Untung Rp 100 Juta    ;Pendatang baru di pasar modal, saham PT Bank Net Indonesia Syariah Tbk (BANK) terus bergerak liar. Bahkan jika dihitung dari harga IPO, saham BANK sudah naik sampai 987%. Seandainya beli saat IPO, sudah berapa ya keuntungannya? Hari ini saham BANK tak bergerak dan berada di level Rp 1.120. Sebab PT Bursa Efek Indonesia (BEI) memutuskan untuk membekukan sementara (suspensi) terhadap saham BANK yang sudah menguat sangat tinggi. Beberapa hari ini saham BANK bahkan naik sampai mentok atau menyentuh level auto reject atas (ARA). Kemarin misalnya saham BANK tercatat naik 23,76%, kemudian pada 15 Februari 2021 tercatat naik 24,83%.      ADVERTISEMENT         SCROLL TO CONTINUE WITH CONTENT    Emiten ini sendiri baru mencatatkan saham perdananya pada 1 Februari 2021. Saat itu harga IPO saham BANK Rp 103 per lembar. Jika dihitung dengan harga saat ini saham BANK sudah naik 987%. Bayangkan dalam 2 minggu sudah naik hampir 1.000%. Seandainya membeli saham BANK di harga IPO Rp 103 sebanyak Rp 10 juta saja. Artinya saat itu bisa mendapatkan 97.000 lembar saham BANK. Jika dikalikan dengan harga saat ini Rp 1.120 maka 97.000 saham BANK itu kini nilainya mencapai Rp 108.640.000. Artinya dengan modal Rp 10 juta dalam 2 minggu sudah dapat untung bersih Rp 98.640.000. Tapi tentu itu kenyataannya tidak seindah itu. Sebab tidak mudah untuk membeli saham IPO. Anda harus berebut jatah saat penawaran umum saham perdana dilakukan. BEI sendiri sudah 2 kali menjatuhkan suspensi kepada saham ini. Pertama kali dilakukan pada Kamis pekan lalu dan sebelumnya sudah masuk dalam daftar saham yang bergerak di luar kebiasaan atau unusual market activity (UMA). Simak juga video 'Saran Perencana Keuangan Aidil Akbar Jika Rugi Investasi Saham':   [Gambas:Video 20detik] ;17-02-2021;https://finance.detik.com/bursa-dan-valas/d-5377088/ngiler-modal-10-juta-punya-saham-ini-bisa-untung-rp-100-juta;pendatang baru di pasar modal, saham pt bank net indonesia syariah tbk (bank) terus bergerak liar. bahkan jika dihitung dari harga ipo, saham bank sudah naik sampai 987%. seandainya beli saat ipo, sudah berapa ya keuntungannya? hari ini saham bank tak bergerak dan berada di level rp 1.120. sebab pt bursa efek indonesia (bei) memutuskan untuk membekukan sementara (suspensi) terhadap saham bank yang sudah menguat sangat tinggi. beberapa hari ini saham bank bahkan naik sampai mentok atau menyentuh level auto reject atas (ara). kemarin misalnya saham bank tercatat naik 23,76%, kemudian pada 15 februari 2021 tercatat naik 24,83%. emiten ini sendiri baru mencatatkan saham perdananya pada 1 februari 2021. saat itu harga ipo saham bank rp 103 per lembar. jika dihitung dengan harga saat ini saham bank sudah naik 987%. bayangkan dalam 2 minggu sudah naik hampir 1.000%. seandainya membeli saham bank di harga ipo rp 103 sebanyak rp 10 juta saja. artinya saat itu bisa mendapatkan 97.000 lembar saham bank. jika dikalikan dengan harga saat ini rp 1.120 maka 97.000 saham bank itu kini nilainya mencapai rp 108.640.000. artinya dengan modal rp 10 juta dalam 2 minggu sudah dapat untung bersih rp 98.640.000. tapi tentu itu kenyataannya tidak seindah itu. sebab tidak mudah untuk membeli saham ipo. anda harus berebut jatah saat penawaran umum saham perdana dilakukan. bei sendiri sudah 2 kali menjatuhkan suspensi kepada saham ini. pertama kali dilakukan pada kamis pekan lalu dan sebelumnya sudah masuk dalam daftar saham yang bergerak di luar kebiasaan atau unusual market activity (uma). simak juga video 'saran perencana keuangan aidil akbar jika rugi investasi saham': 
