Title;Content;Date;URL;Cleaned Article
Tas Emas Lagi Viral, Bisa Jadi Tren Investasi Masa Depan;"Laporan Wartawan Tribunnews, Fitri Wulandari TRIBUNNEWS.COM, JAKARTA - Saat ini ada begitu banyak hal dan barang yang dapat dijadikan inspirasi dalam menciptakan kreasi bernilai seni dan ekonomi tinggi. Mulai dari busana hingga aksesoris pelengkap seperti kacamata, shawl, topi hingga tas. Saat ini memang tengah viral tas yang berlapiskan emas atau terbuat dari emas dan sengaja didesain khusus sesuai dengan permintaan para peminatnya.  Terkait tren tas jenis handbag yang kini berlapis atau terbuat dari emas ini, HWT Gold pun menghadirkan tas yang terbuat dari material emas. Hendry selaku Marketing Manager HWT Gold mengatakan bahwa tas ini dapat dikenakan dalam berbagai acara penting. Selain untuk melengkapi penampilan, si pemakai tentu akan menjadi pusat perhatian.  .recads_wrapper{height:134px;position:relative;margin:10px 0 30px;padding:10px 15px;overflow:hidden;box-shadow:0 0 10px rgb(0 0 0 / 20%);}.recads_title{margin-bottom:10px;font-size:16px;font-weight:700}.arjW-list{overflow-x:scroll;overflow-y:hidden;white-space:nowrap;width:auto;padding:10px 0;position:relative;display:flex;scroll-snap-type:x;flex-wrap:nowrap}.recads_item{scroll-snap-align:start;width:280px;flex:0 0 280px;margin-right:20px;display: flex;white-space: normal;gap: 10px;}.recads_item a {display:flex;white-space:normal;gap:10px;}.recads_image{position:relative;height:auto}.recads_image img{width:auto;height: 73px!important;max-width:165px!important;border-radius:8px}.article_datas_title{font-size:14px;font-weight:700;line-height:1.2;margin:0;overflow:hidden;display:-webkit-box;-webkit-line-clamp:4;-webkit-box-orient:vertical;}.arjW-img-overlay{position:absolute;z-index:3;bottom:8px;left:0;padding:0 0 0 10px}.arjW-img-overlay>img{width:auto;height: 16px!important;}.recads_image::after{z-index:2;position:absolute;top:50%;bottom:4px;left:0;right:0;content:'';background:linear-gradient(to top,#d6d6d6,transparent);width:100%;border-radius: 8px;}             BERITA REKOMENDASI           Tas yang seluruhnya terbuat dari emas ini pun dihadirkan dalam acara bertajuk 'HWT Gold Beauty Makeover Party' di Phinisi Boat Restaurant Talassa, Jakarta, 1 Juli lalu. ""Tas ini diinspirasi oleh desain minimalis nan glamor yang dapat dikenakan untuk menghadiri acara-acara penting. Dengan bahan full emas, orang yang mengenakannya pasti akan menjadi pusat perhatian di acara tersebut,"" kata Hendry, dalam keterangannya, Senin (21/8/2023). Dalam acara yang mengusung konsep Phinisi Boat Party itu, brand emas ini menghadirkan Puteri Indonesia 2023, Farhana Nariswari. Perlu diketahui, brand ini telah menjadi sponsor resmi untuk Mahkota Puteri Indonesia sejak 2007. Namun untuk tahun ini, brand tersebut mempersembahkan Mahkota Borobudur yang dikenakan oleh Farhana sejak malam penobatannya sebagai Puteri Indonesia. Dalam acara yang digelar HWT Gold, penampilan Farhana pun menjadi sorotan karena tampak mengenakan tas emas viral yang terbuat dari emas 16K dengan berat sekitar 380 gram dan memiliki nilai mencapai Rp 300 juta. Tas ini tidak hanya menarik perhatian, namun juga memikat karena memiliki keindahan serta kemewahan yang terpancar dari material utamanya yakni emas. Hendry menuturkan, tas emas ini terlihat eksklusif dan memberikan kesan 'prestige' bagi siapapun yang mengenakannya. Karena tidak hanya menonjolkan keindahan, namun juga memiliki desain modis nan elegan dan classy. Kehadiran tas emas HWT ini disebut-sebut menghebohkan industri mode lantaran tidak hanya dapat menjadi fashion statement saja, namun juga instrumen investasi. ""Puteri Indonesia mengenakan tas tersebut dan tampil memukau, tas ini juga dapat menjadi instrumen investasi selayaknya emas pada umumnya,"" papar Hendry. Terkait instrumen investasi, kata dia, nilai emas selama ini cenderung naik tiap tahunnya. Sehingga dapat menjadi investasi yang menjanjikan di masa depan. ""Di mana ia (tas ini) memiliki future value yang tinggi karena nilai emas yang cenderung naik di tahun-tahun mendatang dan tahan inflasi. Jadi tidak hanya tampil modis, tetapi bisa menjadi salah satu peluang untuk memberikan keuntungan dalam berinvestasi di masa depan,"" jelas Hendry. (*)";22-08-2023;https://m.tribunnews.com/bisnis/2023/08/22/tas-emas-lagi-viral-bisa-jadi-tren-investasi-masa-depan?page=1;"laporan wartawan tribunnews, fitri wulandari tribunnews.com, jakarta - saat ini ada begitu banyak hal dan barang yang dapat dijadikan inspirasi dalam menciptakan kreasi bernilai seni dan ekonomi tinggi. mulai dari busana hingga aksesoris pelengkap seperti kacamata, shawl, topi hingga tas. saat ini memang tengah viral tas yang berlapiskan emas atau terbuat dari emas dan sengaja didesain khusus sesuai dengan permintaan para peminatnya. terkait tren tas jenis handbag yang kini berlapis atau terbuat dari emas ini, hwt gold pun menghadirkan tas yang terbuat dari material emas. hendry selaku marketing manager hwt gold mengatakan bahwa tas ini dapat dikenakan dalam berbagai acara penting. selain untuk melengkapi penampilan, si pemakai tentu akan menjadi pusat perhatian. berita rekomendasi tas yang seluruhnya terbuat dari emas ini pun dihadirkan dalam acara bertajuk 'hwt gold beauty makeover party' di phinisi boat restaurant talassa, jakarta, 1 juli lalu. ""tas ini diinspirasi oleh desain minimalis nan glamor yang dapat dikenakan untuk menghadiri acara-acara penting. dengan bahan full emas, orang yang mengenakannya pasti akan menjadi pusat perhatian di acara tersebut,"" kata hendry, dalam keterangannya, senin (21/8/2023). dalam acara yang mengusung konsep phinisi boat party itu, brand emas ini menghadirkan puteri indonesia 2023, farhana nariswari. perlu diketahui, brand ini telah menjadi sponsor resmi untuk mahkota puteri indonesia sejak 2007. namun untuk tahun ini, brand tersebut mempersembahkan mahkota borobudur yang dikenakan oleh farhana sejak malam penobatannya sebagai puteri indonesia. dalam acara yang digelar hwt gold, penampilan farhana pun menjadi sorotan karena tampak mengenakan tas emas viral yang terbuat dari emas 16k dengan berat sekitar 380 gram dan memiliki nilai mencapai rp 300 juta. tas ini tidak hanya menarik perhatian, namun juga memikat karena memiliki keindahan serta kemewahan yang terpancar dari material utamanya yakni emas. hendry menuturkan, tas emas ini terlihat eksklusif dan memberikan kesan 'prestige' bagi siapapun yang mengenakannya. karena tidak hanya menonjolkan keindahan, namun juga memiliki desain modis nan elegan dan classy. kehadiran tas emas hwt ini disebut-sebut menghebohkan industri mode lantaran tidak hanya dapat menjadi fashion statement saja, namun juga instrumen investasi. ""puteri indonesia mengenakan tas tersebut dan tampil memukau, tas ini juga dapat menjadi instrumen investasi selayaknya emas pada umumnya,"" papar hendry. terkait instrumen investasi, kata dia, nilai emas selama ini cenderung naik tiap tahunnya. sehingga dapat menjadi investasi yang menjanjikan di masa depan. ""di mana ia (tas ini) memiliki future value yang tinggi karena nilai emas yang cenderung naik di tahun-tahun mendatang dan tahan inflasi. jadi tidak hanya tampil modis, tetapi bisa menjadi salah satu peluang untuk memberikan keuntungan dalam berinvestasi di masa depan,"" jelas hendry. (*)"
Cara Cek BI Checking atau SLIK OJK Secara Online di idebku.ojk.go.id, Ini Syaratnya;"TRIBUNNEWS.COM - Berikut ini cara mengecek BI checking secara online. Untuk mengecek BI checking atau SLIK OJK dapat dilakukan melalui laman idebku.ojk.go.id. Informasi SLIK OJK sangat diperlukan bagi Anda yang ingin mengajukan permohonan kredit rumah atau kendaraan. Mengutip laman resmi OJK, ​SLIK merupakan sistem informasi yang dikelola oleh OJK untuk mendukung pelaksanaan tugas pengawasan dan layanan informasi di bidang keuangan. SLIK dapat dimanfaatkan untuk memperlancar proses penyediaan dana, penerapan manajemen risiko kedit atau pembiayaan, penilaian kualitas debitur. Selain itu, juga untuk pengelolaan sumber daya manusia pada Pelapor SLIK, verifikasi untuk kerja sama Pelapor SLIK dengan pihak ketiga, dan meningkatkan disiplin industri keuangan. Lantas, bagaimana cara BI checking atau SLIK OJK?  .recads_wrapper{height:134px;position:relative;margin:10px 0 30px;padding:10px 15px;overflow:hidden;box-shadow:0 0 10px rgb(0 0 0 / 20%);}.recads_title{margin-bottom:10px;font-size:16px;font-weight:700}.arjW-list{overflow-x:scroll;overflow-y:hidden;white-space:nowrap;width:auto;padding:10px 0;position:relative;display:flex;scroll-snap-type:x;flex-wrap:nowrap}.recads_item{scroll-snap-align:start;width:280px;flex:0 0 280px;margin-right:20px;display: flex;white-space: normal;gap: 10px;}.recads_item a {display:flex;white-space:normal;gap:10px;}.recads_image{position:relative;height:auto}.recads_image img{width:auto;height: 73px!important;max-width:165px!important;border-radius:8px}.article_datas_title{font-size:14px;font-weight:700;line-height:1.2;margin:0;overflow:hidden;display:-webkit-box;-webkit-line-clamp:4;-webkit-box-orient:vertical;}.arjW-img-overlay{position:absolute;z-index:3;bottom:8px;left:0;padding:0 0 0 10px}.arjW-img-overlay>img{width:auto;height: 16px!important;}.recads_image::after{z-index:2;position:absolute;top:50%;bottom:4px;left:0;right:0;content:'';background:linear-gradient(to top,#d6d6d6,transparent);width:100%;border-radius: 8px;}             BERITA REKOMENDASI           BI checking atau SLIK OJK dapat dilakukan secara online maupun offline.  Laman idebku.ojk.go.id untuk BI checking atau SLIK OJK.  Masyarakat dapat mendatangi langsung kantok OJK setempat untuk mendapatkan SLIK OJK. Sementara untuk pengajuan secara online dilakukan melalui laman https://idebku.ojk.go.id. Adapun syarat yang perlu disiapkan untuk mengajukan SLIK OJK secara online, sebagai berikut: 1. Debitur Perseorangan KTP untuk Warga Negara Indonesia dan Paspor bagi Warga Negara Asing (WNA). 2. Debitur Badan Usaha - Identitas Pengurus (KTP untuk WNI, Paspor untuk WNA) - NPWP badan usaha - Akta pendirian/anggaran dasar pertama - Perubahan anggaran dasar terakhir yang menunjukkan perubahan kepengurusan Badan Usaha. 3. Debitur yang meninggal dunia - Identitas ahli waris (KTP untuk WNI, Paspor untuk WNA) - Dokumen asli yang menerangkan kematian debitur yang dikeluarkan oleh pihak berwenang; dan - Dokumen yang menunjukkan hubungan kekeluargaan/ahli waris. Cara Cek BI Checking atau SLIK OJK Berikut ini tata cara BI Checking atau SLIK OJK secara online: - Buka aplikasi melalui laman web https://idebku.ojk.go.id; - Klik menu ""Pendaftaran"" pada halaman utama aplikasi iDebKu OJK; - Cek Ketersediaan layanan dengan mengisi seluruh kolom; - Kemudian klik ""Selanjutnya""; - Silakan mengisi data registrasi secara lengkap dan benar; - Klik ""Selanjutnya"" apabila data isian telah lengkap dan benar; - Unggah foto/scan dokumen asli persyaratan permintaan iDeb; - Selanjutnya, pemohon mengunggah foto diri dengan memperagakan instruksi yang diminta pada aplikasi; - Setelah pendaftaran berhasil, pemohon akan menerima email dari OJK yang memuat antara lain informasi nomor pendaftaran; - Pemohon dapat melakukan pengecekan status permohonan pada menu ""Status Layanan"" dengan isi nomor pendaftaran; - OJK akan memproses permohonan iDeb dan mengirimkan hasil iDeb melalui email pemohon paling lambat 1 hari kerja setelah pendaftaran dilakukan. (Tribunnews.com/Yurika)";22-08-2023;https://m.tribunnews.com/bisnis/2023/08/22/cara-cek-bi-checking-atau-slik-ojk-secara-online-di-idebkuojkgoid-ini-syaratnya?page=2;"tribunnews.com - berikut ini cara mengecek bi checking secara online. untuk mengecek bi checking atau slik ojk dapat dilakukan melalui laman idebku.ojk.go.id. informasi slik ojk sangat diperlukan bagi anda yang ingin mengajukan permohonan kredit rumah atau kendaraan. mengutip laman resmi ojk, ​slik merupakan sistem informasi yang dikelola oleh ojk untuk mendukung pelaksanaan tugas pengawasan dan layanan informasi di bidang keuangan. slik dapat dimanfaatkan untuk memperlancar proses penyediaan dana, penerapan manajemen risiko kedit atau pembiayaan, penilaian kualitas debitur. selain itu, juga untuk pengelolaan sumber daya manusia pada pelapor slik, verifikasi untuk kerja sama pelapor slik dengan pihak ketiga, dan meningkatkan disiplin industri keuangan. lantas, bagaimana cara bi checking atau slik ojk? berita rekomendasi bi checking atau slik ojk dapat dilakukan secara online maupun offline. laman idebku.ojk.go.id untuk bi checking atau slik ojk. masyarakat dapat mendatangi langsung kantok ojk setempat untuk mendapatkan slik ojk. sementara untuk pengajuan secara online dilakukan melalui laman . adapun syarat yang perlu disiapkan untuk mengajukan slik ojk secara online, sebagai berikut: 1. debitur perseorangan ktp untuk warga negara indonesia dan paspor bagi warga negara asing (wna). 2. debitur badan usaha - identitas pengurus (ktp untuk wni, paspor untuk wna) - npwp badan usaha - akta pendirian/anggaran dasar pertama - perubahan anggaran dasar terakhir yang menunjukkan perubahan kepengurusan badan usaha. 3. debitur yang meninggal dunia - identitas ahli waris (ktp untuk wni, paspor untuk wna) - dokumen asli yang menerangkan kematian debitur yang dikeluarkan oleh pihak berwenang; dan - dokumen yang menunjukkan hubungan kekeluargaan/ahli waris. cara cek bi checking atau slik ojk berikut ini tata cara bi checking atau slik ojk secara online: - buka aplikasi melalui laman web ; - klik menu ""pendaftaran"" pada halaman utama aplikasi idebku ojk; - cek ketersediaan layanan dengan mengisi seluruh kolom; - kemudian klik ""selanjutnya""; - silakan mengisi data registrasi secara lengkap dan benar; - klik ""selanjutnya"" apabila data isian telah lengkap dan benar; - unggah foto/scan dokumen asli persyaratan permintaan ideb; - selanjutnya, pemohon mengunggah foto diri dengan memperagakan instruksi yang diminta pada aplikasi; - setelah pendaftaran berhasil, pemohon akan menerima email dari ojk yang memuat antara lain informasi nomor pendaftaran; - pemohon dapat melakukan pengecekan status permohonan pada menu ""status layanan"" dengan isi nomor pendaftaran; - ojk akan memproses permohonan ideb dan mengirimkan hasil ideb melalui email pemohon paling lambat 1 hari kerja setelah pendaftaran dilakukan. (tribunnews.com/yurika)"
Kopi Robusta Asal Sumatera Selatan Tembus Pasar Ekspor Jepang;"Laporan Wartawan Tribunnews.com, Reynas Abdila TRIBUNNEWS.COM, JAKARTA - Djono Darmaputera (60) pedagang kopi UMKM bercerita tentang usahanya Sahang Mas yang salah satunya memasarkan produk kopi dengan merek Benua. Kopi Benua diolah dari biji kopi perkebunan bubuk robusta asal Semendo, Sumatera Selatan (Sumsel) pertama yang mendapatkan Standar Nasional Indonesia (SNI). Bagi Djono, kopi tak hanya soal bisnis. Ia memiliki antusiasme tinggi untuk kembali mengangkat kopi Sumsel, yang menjadi salah satu daerah penghasil kopi di Indonesia.Usaha Sahang Mas, yang ditekuni Djono sejak 1998, awalnya memasarkan produk lada, cokelat, dan berbagai bahan makanan lainnya.Pada 2019, Djono yang secara gigih terus mengembangkan usahanya, membawa Sahang Mas menjadi salah satu usaha mikro, kecil, dan menengah (UMKM) yang memperoleh binaan dari Sampoerna Entrepreneurship Training Center (SETC). SETC merupakan program pemberdayaan UMKM yang digagas PT HM Sampoerna Tbk. (Sampoerna) di bawah Payung Program Keberlanjutan “Sampoerna Untuk Indonesia” (SUI).Pembinaan tersebut membuahkan hasil bahkan, kini Djono dapat mengekspor produknya ke luar negeri. Pada Agustus 2023, Djono membawa produk kopinya, Kopi Benua, dalam pameran Wellness Food Japan 2023 di Tokyo, Jepang, bersama beberapa produk UMKM lain bekerja sama dengan mitra tanggung jawab sosial perusahaan Business & Export Development Organization (BEDO).Tahun ini, selain kopi Benua, SETC memilih Bali Pure dan Padma Herbal dari Bali, Dede Satoe dari Surabaya, dan Togato Coffee dari Medan untuk berpartisipasi pada pameran itu.Bagi Djono, kesempatan berpartisipasi Wellness Food Japan 2023 merupakan peluang besar untuk memperkenalkan cita rasa khas kopi Semendo melalui Kopi Benua.   .recads_wrapper{height:134px;position:relative;margin:10px 0 30px;padding:10px 15px;overflow:hidden;box-shadow:0 0 10px rgb(0 0 0 / 20%);}.recads_title{margin-bottom:10px;font-size:16px;font-weight:700}.arjW-list{overflow-x:scroll;overflow-y:hidden;white-space:nowrap;width:auto;padding:10px 0;position:relative;display:flex;scroll-snap-type:x;flex-wrap:nowrap}.recads_item{scroll-snap-align:start;width:280px;flex:0 0 280px;margin-right:20px;display: flex;white-space: normal;gap: 10px;}.recads_item a {display:flex;white-space:normal;gap:10px;}.recads_image{position:relative;height:auto}.recads_image img{width:auto;height: 73px!important;max-width:165px!important;border-radius:8px}.article_datas_title{font-size:14px;font-weight:700;line-height:1.2;margin:0;overflow:hidden;display:-webkit-box;-webkit-line-clamp:4;-webkit-box-orient:vertical;}.arjW-img-overlay{position:absolute;z-index:3;bottom:8px;left:0;padding:0 0 0 10px}.arjW-img-overlay>img{width:auto;height: 16px!important;}.recads_image::after{z-index:2;position:absolute;top:50%;bottom:4px;left:0;right:0;content:'';background:linear-gradient(to top,#d6d6d6,transparent);width:100%;border-radius: 8px;}             BERITA REKOMENDASI           “Saya senang sekali mendapatkan kesempatan ini dari SETC dan BEDO. Sebelumnya tidak kebayang sama sekali bisa membawa kopi Semendo sampai ke Jepang, tapi akhirnya bisa karena difasilitasi Sampoerna,” ujar Djono dalam keterangan, Selasa (22/8/2023).Dalam Wellness Food Japan 2023, Sahang Mas memamerkan “Kopi Benua” dan kopi dengan campuran jahe dan pasak bumi. “Menyesuaikan tema, herbal drink, saya racik kopinya bersama jahe dan pasak bumi. Dan kopi bubuk saya sendiri, khas dari Semendo,” lanjut Djono.Setelah mengikuti Wellness Food Japan 2023, ia berharap, kopi Semendo bisa lebih dikenal.Selama ini, kopi Semendo lebih banyak diekspor dalam bentuk mentah berupa biji kopi. Dalam beberapa tahun ini, Djono berupaya mengembangkannya agar kopi Sumatera Selatan lebih memiliki nilai tambah.“Dipasarkan ada yang roasting, ada yang bubuk. Tidak hanya mentah. Pasarnya belum sampai ekspor, ini sedang penjajakan,” kata dia.";22-08-2023;https://www.tribunnews.com/bisnis/2023/08/22/kopi-robusta-asal-sumatera-selatan-tembus-pasar-ekspor-jepang;laporan wartawan tribunnews.com, reynas abdila tribunnews.com, jakarta - djono darmaputera (60) pedagang kopi umkm bercerita tentang usahanya sahang mas yang salah satunya memasarkan produk kopi dengan merek benua. kopi benua diolah dari biji kopi perkebunan bubuk robusta asal semendo, sumatera selatan (sumsel) pertama yang mendapatkan standar nasional indonesia (sni). bagi djono, kopi tak hanya soal bisnis. ia memiliki antusiasme tinggi untuk kembali mengangkat kopi sumsel, yang menjadi salah satu daerah penghasil kopi di indonesia.usaha sahang mas, yang ditekuni djono sejak 1998, awalnya memasarkan produk lada, cokelat, dan berbagai bahan makanan lainnya.pada 2019, djono yang secara gigih terus mengembangkan usahanya, membawa sahang mas menjadi salah satu usaha mikro, kecil, dan menengah (umkm) yang memperoleh binaan dari sampoerna entrepreneurship training center (setc). setc merupakan program pemberdayaan umkm yang digagas pt hm sampoerna tbk. (sampoerna) di bawah payung program keberlanjutan “sampoerna untuk indonesia” (sui).pembinaan tersebut membuahkan hasil bahkan, kini djono dapat mengekspor produknya ke luar negeri. pada agustus 2023, djono membawa produk kopinya, kopi benua, dalam pameran wellness food japan 2023 di tokyo, jepang, bersama beberapa produk umkm lain bekerja sama dengan mitra tanggung jawab sosial perusahaan business & export development organization (bedo).tahun ini, selain kopi benua, setc memilih bali pure dan padma herbal dari bali, dede satoe dari surabaya, dan togato coffee dari medan untuk berpartisipasi pada pameran itu.bagi djono, kesempatan berpartisipasi wellness food japan 2023 merupakan peluang besar untuk memperkenalkan cita rasa khas kopi semendo melalui kopi benua. berita rekomendasi “saya senang sekali mendapatkan kesempatan ini dari setc dan bedo. sebelumnya tidak kebayang sama sekali bisa membawa kopi semendo sampai ke jepang, tapi akhirnya bisa karena difasilitasi sampoerna,” ujar djono dalam keterangan, selasa (22/8/2023).dalam wellness food japan 2023, sahang mas memamerkan “kopi benua” dan kopi dengan campuran jahe dan pasak bumi. “menyesuaikan tema, herbal drink, saya racik kopinya bersama jahe dan pasak bumi. dan kopi bubuk saya sendiri, khas dari semendo,” lanjut djono.setelah mengikuti wellness food japan 2023, ia berharap, kopi semendo bisa lebih dikenal.selama ini, kopi semendo lebih banyak diekspor dalam bentuk mentah berupa biji kopi. dalam beberapa tahun ini, djono berupaya mengembangkannya agar kopi sumatera selatan lebih memiliki nilai tambah.“dipasarkan ada yang roasting, ada yang bubuk. tidak hanya mentah. pasarnya belum sampai ekspor, ini sedang penjajakan,” kata dia.
