Title;Content;Date;URL;Cleaned Article
Produksi Gas Perlu Digenjot agar RI Tidak Jadi Net Importir di 2024;"JAKARTA, KOMPAS.com - Satuan Kerja Khusus Pelaksana Kegiatan Usaha Hulu Minyak dan Gas Bumi (SKK Migas) menilai, Indonesia memiliki potensi menjadi net importir gas di 2042. Hal itu bisa terjadi jika pengembangan lapangan migas terus tertunda sehingga tidak ada peningkatan produksi gas.   Maka salah satu upaya yang perlu dilakukan adalah mencari cadangan gas baru untuk menggenjot produksi. Dengan demikian, dapat memenuhi kebutuhan gas di dalam negeri yang meningkat seiring dengan tumbuhnya perekonomian Indonesia.   ""Potensi gas harus segera diproduksikan sehingga kekhawatiran potensi menjadi net importir gas di 2042 tidak terjadi, dan produksi gas terus meningkat memenuhi kebutuhan domestik hingga mampu mendukung pencapaian target net emission zero di 2060,"" ujar Wakil Kepala SKK Migas, Nanang Abdul Manaf dalam medie briefing di Jakarta, Rabu (23/8/2023).   Ia menuturkan, mengacu pada BP Outlook 2021, reserves to production gas Indonesia dua kali lebih besar dibandingkan minyak bumi. Oleh sebab itu, potensi gas yang tinggi tersebut perlu dioptimalkan.  SKK Migas mencatat, lebih dari 50 persen sumur eksplorasi yang dibor menemukan cadangan gas baru, bahkan di tahun 2022 success ratio mencapai 81 persen dan hingga semester I-2023 success ratio mencapai 100 persen.  Sementara 70 persen dari total plan of development (PoD) yang diajukan merupakan pengembangan lapangan gas.  Dari sisi salur gas, alokasi gas untuk domestik juga terus mengalami peningkatan dalam 10 tahun terakhir. Bahkan sejak 2012, porsi salur gas bagi sektor domestik lebih besar dibanding alokasi untuk ekspor.   Hingga Juni 2023, produksi gas nasional yang dialokasikan untuk domestik di tahun ini mencapai 3.636,82 BBTUD, sementara porsi gas yang diekspor mencapai 1.960,71 BBTUD.   ""Pemerintah berkomitmen untuk terus memenuhi kebutuhan dalam negeri, di mana salur gas untuk domestik saat ini sudah mencapai 65 persen,"" kata Nanang.  Pada kesempatan yang sama, Country Head Indonesia Rystad Energy Sofwan Hadi mengatakan, produksi gas alam Indonesia saat ini masih memang mampu memenuhi kebutuhan domestik, bahkan bisa diekspor ke negara lain.  Namun, berdasarkan hasil riset dan analisis Rystad Energy, produksi gas alam dari lapangan-lapangan yang ada sekarang diperkirakan hanya berkontribusi 35 persen dari total produksi yang dibutuhkan untuk memenuhi kebutuhan domestik dalam 20 tahun ke depan.  Sementara 65 persen sisanya berasal dari produksi lapangan-lapangan gas baru.   ""Data ini menunjukkan peran penting kegiatan eksplorasi secara masif dan pengembangan lapangan migas baru untuk menunda beban impor,” kata Sofwan.   Sejauh ini, beberapa lapangan gas baru sedang dalam proses pengembangan, antara lain Lapangan Andaman di lepas pantai Aceh, Lapangan Mako di kawasan Natuna, IDD Fase 2 (Gendalo dan Gendang) di Kalimantan Timur, Asap Kido Merah di Papua dan Lapangan Abadi, Masela di Maluku.  Produksi gas dari lapangan-lapangan yang baru dikembangkan tersebut diproyeksikan akan memberikan kontribusi sekitar 60 persen bagi produksi gas nasional di 2030, dan naik menjadi 80 persen di 2035.  ";23-08-2023;https://money.kompas.com/read/2023/08/23/201000926/produksi-gas-perlu-digenjot-agar-ri-tidak-jadi-net-importir-di-2024?page=all;"jakarta,satuan kerja khusus pelaksana kegiatan usaha hulu minyak dan gas bumi (skk migas) menilai, indonesia memiliki potensi menjadi net importir gas di 2042. hal itu bisa terjadi jika pengembangan lapangan migas terus tertunda sehingga tidak ada peningkatan produksi gas. maka salah satu upaya yang perlu dilakukan adalah mencari cadangan gas baru untuk menggenjot produksi. dengan demikian, dapat memenuhi kebutuhan gas di dalam negeri yang meningkat seiring dengan tumbuhnya perekonomian indonesia. ""potensi gas harus segera diproduksikan sehingga kekhawatiran potensi menjadi net importir gas di 2042 tidak terjadi, dan produksi gas terus meningkat memenuhi kebutuhan domestik hingga mampu mendukung pencapaian target net emission zero di 2060,"" ujar wakil kepala skk migas, nanang abdul manaf dalam medie briefing di jakarta, rabu (23/8/2023). ia menuturkan, mengacu pada bp outlook 2021, reserves to production gas indonesia dua kali lebih besar dibandingkan minyak bumi. oleh sebab itu, potensi gas yang tinggi tersebut perlu dioptimalkan. skk migas mencatat, lebih dari 50 persen sumur eksplorasi yang dibor menemukan cadangan gas baru, bahkan di tahun 2022 success ratio mencapai 81 persen dan hingga semester i-2023 success ratio mencapai 100 persen. sementara 70 persen dari total plan of development (pod) yang diajukan merupakan pengembangan lapangan gas. dari sisi salur gas, alokasi gas untuk domestik juga terus mengalami peningkatan dalam 10 tahun terakhir. bahkan sejak 2012, porsi salur gas bagi sektor domestik lebih besar dibanding alokasi untuk ekspor. hingga juni 2023, produksi gas nasional yang dialokasikan untuk domestik di tahun ini mencapai 3.636,82 bbtud, sementara porsi gas yang diekspor mencapai 1.960,71 bbtud. ""pemerintah berkomitmen untuk terus memenuhi kebutuhan dalam negeri, di mana salur gas untuk domestik saat ini sudah mencapai 65 persen,"" kata nanang. pada kesempatan yang sama, country head indonesia rystad energy sofwan hadi mengatakan, produksi gas alam indonesia saat ini masih memang mampu memenuhi kebutuhan domestik, bahkan bisa diekspor ke negara lain. namun, berdasarkan hasil riset dan analisis rystad energy, produksi gas alam dari lapangan-lapangan yang ada sekarang diperkirakan hanya berkontribusi 35 persen dari total produksi yang dibutuhkan untuk memenuhi kebutuhan domestik dalam 20 tahun ke depan. sementara 65 persen sisanya berasal dari produksi lapangan-lapangan gas baru. ""data ini menunjukkan peran penting kegiatan eksplorasi secara masif dan pengembangan lapangan migas baru untuk menunda beban impor,” kata sofwan. sejauh ini, beberapa lapangan gas baru sedang dalam proses pengembangan, antara lain lapangan andaman di lepas pantai aceh, lapangan mako di kawasan natuna, idd fase 2 (gendalo dan gendang) di kalimantan timur, asap kido merah di papua dan lapangan abadi, masela di maluku. produksi gas dari lapangan-lapangan yang baru dikembangkan tersebut diproyeksikan akan memberikan kontribusi sekitar 60 persen bagi produksi gas nasional di 2030, dan naik menjadi 80 persen di 2035. "
Apa Alasan Indonesia Belum Masuk BRICS?;"JAKARTA, KOMPAS.com - Indonesia belum berencana untuk masuk ke dalam kelompok BRICS.  BRICS adalah perkumpulan negara-negara berkembang utama di dunia. Saat ini anggota BRICS adalah Brasil, Rusia, India, China, dan Afrika Selatan.  Presiden Joko Widodo (Jokowi) mengatakan, Indonesia belum akan masuk menjadi anggota baru BRICS. Padahal, Jokowi telah hadir dalam Konferensi Tingkat Tinggi (KTT) BRICS di Johannesburg, Afrika Selatan, Kamis (b24/8/2023).  Adapun, negara yang ingin masuk ke dalam BRICS harus menyampaikan surat expression of interest atau pernyataan minat. Sementara itu, menurutnya, hingga saat ini Indonesia belum menyampaikan surat yang dimaksud.  ""Sampai saat ini memang Indonesia belum menyampaikan surat tersebut,"" ujar Jokowi dalam keterangannya yang disiarkan di kanal YouTube Sekretariat Presiden, dikutip Jumat (25/8/2023).  Jokowi menambahkan, Indonesia masih mengkaji lebih lanjut soal kemungkinan bergabung jadi anggota BRICS.  Tak hanya itu, pemerintah Indonesia juga akan mengalkulasi mengenai berbagai hal terkait keanggotaan dalam organisasi tersebut.   Dari sebab itu, Jokowi menekankan, Indonesia tidak ingin terburu-buru mengajukan diri menjadi bagian dari BRICS.  Baca juga: BRICS Bakal Tambah 6 Anggota Baru Tahun Depan, Simak Daftarnya  Namun, Jokowi mengatakan, saat ini hubungan Indonesia dengan lima negara anggota BRICS terjalin dengan sangat baik. ""Hubungan kita dengan lima negara anggota BRICS juga sangat baik dan terutama di bidang ekonomi,"" ujarnya.  Sebagai informasi, organisasi ini disebut-sebut tandingan dari blok negara-negara ekonomi maju G7 yang beranggotakan Amerika Serikat, Prancis, Italia, Inggris, Jepang, Kanada, dan Jerman.  Banyak negara disebut berminat untuk masuk ke dalam BRICS. Sekurang-kurangnya terdapat 23 negara yang telah resmi mengajukan permohonan keanggotaan BRICS.  Sementara, tahun depan BRICS akan memiliki enam anggota baru yakni Argentina, Mesir, Ethiopia, Iran, Arab Saudi, dan Uni Emirat Arab.   Saat ini, negara-negara BRICS menyumbang hampir 42 persen dari total populasi global, 25 persen dari total ekonomi global, dan 20 persen dari total perdagangan global.   Pada 2022, gabungan dari kelima negara anggota BRICS memiliki lebih dari 14 persen hak suara (voting power) di Bank Dunia serta lebih dari 14 persen dari total saham di Dana Moneter Internasional (IMF). ";25-08-2023;https://money.kompas.com/read/2023/08/25/204000926/apa-alasan-indonesia-belum-masuk-brics-;"jakarta,indonesia belum berencana untuk masuk ke dalam kelompok brics. brics adalah perkumpulan negara-negara berkembang utama di dunia. saat ini anggota brics adalah brasil, rusia, india, china, dan afrika selatan. presiden joko widodo (jokowi) mengatakan, indonesia belum akan masuk menjadi anggota baru brics. padahal, jokowi telah hadir dalam konferensi tingkat tinggi (ktt) brics di johannesburg, afrika selatan, kamis (b24/8/2023). adapun, negara yang ingin masuk ke dalam brics harus menyampaikan surat expression of interest atau pernyataan minat. sementara itu, menurutnya, hingga saat ini indonesia belum menyampaikan surat yang dimaksud. ""sampai saat ini memang indonesia belum menyampaikan surat tersebut,"" ujar jokowi dalam keterangannya yang disiarkan di kanal youtube sekretariat presiden, dikutip jumat (25/8/2023). jokowi menambahkan, indonesia masih mengkaji lebih lanjut soal kemungkinan bergabung jadi anggota brics. tak hanya itu, pemerintah indonesia juga akan mengalkulasi mengenai berbagai hal terkait keanggotaan dalam organisasi tersebut. dari sebab itu, jokowi menekankan, indonesia tidak ingin terburu-buru mengajukan diri menjadi bagian dari brics. baca juga: brics bakal tambah 6 anggota baru tahun depan, simak daftarnya namun, jokowi mengatakan, saat ini hubungan indonesia dengan lima negara anggota brics terjalin dengan sangat baik. ""hubungan kita dengan lima negara anggota brics juga sangat baik dan terutama di bidang ekonomi,"" ujarnya. sebagai informasi, organisasi ini disebut-sebut tandingan dari blok negara-negara ekonomi maju g7 yang beranggotakan amerika serikat, prancis, italia, inggris, jepang, kanada, dan jerman. banyak negara disebut berminat untuk masuk ke dalam brics. sekurang-kurangnya terdapat 23 negara yang telah resmi mengajukan permohonan keanggotaan brics. sementara, tahun depan brics akan memiliki enam anggota baru yakni argentina, mesir, ethiopia, iran, arab saudi, dan uni emirat arab. saat ini, negara-negara brics menyumbang hampir 42 persen dari total populasi global, 25 persen dari total ekonomi global, dan 20 persen dari total perdagangan global. pada 2022, gabungan dari kelima negara anggota brics memiliki lebih dari 14 persen hak suara (voting power) di bank dunia serta lebih dari 14 persen dari total saham di dana moneter internasional (imf). "
             Menakar Efek Hawkish The Fed            ;Jakarta, CNBC Indonesia -Pejabat The Fed terus melihat risiko inflasi yang mungkin membutuhkan lebih banyak kenaikan suku bunga. Lantas, apakah The Fed akan terus bersikap hawkish dalam waktu dekat? Menurut Chief Economist Juwai IQI Shan Saeed, The Fed tidak akan menaikkan suku bunga acuan dan akan terus bersikap dovish. Karenanya, kondisi saat ini membuat pasar menjadi tak menentu. Selengkapnya saksikan Andhi Shalini dan Savira Wardoyo bersama Chief Economist Juwai IQI Shan Saeed di Program Closing Bell CNBC Indonesia;21-08-2023;https://www.cnbcindonesia.com/market/20230821161208-19-464735/menakar-efek-hawkish-the-fed;jakarta, cnbc indonesia -pejabat the fed terus melihat risiko inflasi yang mungkin membutuhkan lebih banyak kenaikan suku bunga. lantas, apakah the fed akan terus bersikap hawkish dalam waktu dekat? menurut chief economist juwai iqi shan saeed, the fed tidak akan menaikkan suku bunga acuan dan akan terus bersikap dovish. karenanya, kondisi saat ini membuat pasar menjadi tak menentu. selengkapnya saksikan andhi shalini dan savira wardoyo bersama chief economist juwai iqi shan saeed di program closing bell cnbc indonesia
             Dunia Memanas, Sektor Energi Makin Mengganas!            ;"Jakarta, CNBC Indonesia - Indeks sektor energi (IDXENERGY) menjadi satu dari dua sektor yang menghijau saat Indeks Harga Saham Gabungan (IHSG) merosot dan meninggalkan level psikologis 6.900 pada Jumat (18/8/2023). Menurut data Bursa Efek Indonesia (BEI), IHSG ambles 0,59% ke 6.859,91, melanjutkan penurunan 0,21% pada Rabu (16/8) lalu. Dalam sepekan, IHSG turun 0,48% dan dalam sebulan melemah 0,06%. Dari 11 indeks sektoral, 9 indeks memerah. Hanya IDXENERGY dan infrastruktur (IDXINFRA) yang menghijau, masing-masing 0,39% dan 0,07%.  Kenaikan IDXENERGY ditopang oleh emiten-emiten yang berkaitan dengan batu bara yang menguat seiring kenaikan harga komoditasnya. Emiten kapal yang mengangkut komoditas batu bara dan migas juga ikut melompat tinggi hari ini, seperti RIGS yang terbang 18,64% dan SOCI 14,92%. Sedangkan, saham perdagangan batu bara SGER dan ARII melonjak 12,92% dan 9,41%. Saham anak usaha Adaro (ADRO), ADMR, juga terungkit 6,31%. ADRO sendiri naik 0,79%. Demikian belasan emiten batu bara dan migas lainnya. Soal batu bara, harga komoditas ini terus melanjutkan penguatan selama 10 hari beruntun dengan menguat hingga 11,4%. Harga batu bara bahkan mampu menembus US% 160 pada pekan lalu. Merujuk pada Refinitiv, harga batu bara ICE Newcastle kontrak September ditutup di posisi US$ 160,75 per ton atau naik 3,04% pada perdagangan Jumat lalu(18/8/2023). Harga tersebut adalah yang tertinggi sejak 23 Mei 2023 atau tiga bulan terakhir. Harga batu bara terus melonjak sejak Juli karena suhu udara yang mendidih. Tak hanya China, suhu mendidih juga melanda Vietnam hingga Eropa. Kondisi ini membuat penggunaan listrik meningkat sehingga kebutuhan batu bara pun naik Data Badan Pusat Statistik (BPS) menunjukkan volume ekspor batu bara mencapai 231,83 juta ton pada Januari-Juli 2023 atau naik 4,8%. India menjadi pasar terbesar dari sisi volume dengan angka mencapai 56,11 juta ton. Jumlah tersebut turun 23,13%. Berikutnya ada China dengan permintaan menyentuh 48,47 juta ton atau melonjak 61,7% pada Januari-Juli 2023. Penguatan batu bara juga ditopang oleh aksi mogok pekerja gas alam cair (Liquified Natural Gas) Australia. Pekerja di fasilitas Chevron Gorgon dan Wheatstone (LNG) di Australia akan mulai memberikan suara mulai Jumat pekan ini untuk memutuskan terkait aksi mogok karena perselisihan mengenai upah dan kondisi kerja, aliansi serikat pekerja dikatakan. Regulator ketenagakerjaan Australia pekan lalu membuka jalan bagi aksi mogok di fasilitas tersebut dengan melakukan ""pemilihan suara yang dilindungi,"" yang memberikan kesempatan kepada karyawan untuk secara diam-diam memilih apakah akan memulai aksi industri yang dilindungi atau tidak. Aksi mogok pekerja Australia ukup berisiko signifikan pada harga komoditas energi, sebab berkurangnya produksi akan mengganggu pasokan Australia. Gas yang merupakan substitusi bahan bakar energi dari fosil, batu bara, berpotensi turut mengalami kenaikan harga jika pekerja Australia memutuskan penghentian. Sentimen utama dalam pasar global batu bara juga dipengaruhi oleh aktivitas perdagangan di pasar batu bara termal di Asia, yang diperkirakan akan mengalami pelemahan kembali dalam minggu ini. Perkiraan pasar menunjukkan kecenderungan ""wait and see"" karena para pembeli sedang menantikan sinyal positif yang lebih kuat. Pelemahan ini disebabkan oleh melemahnya permintaan listrik dan aktivitas industri di kawasan Asia yang dipimpin oleh China. Pertengahan musim panas di China telah mengakibatkan penurunan permintaan listrik di negara tersebut. Selain itu, harapan akan adanya kenaikan harga batu bara domestik akibat topan juga belum terwujud. Dari sisi pasokan, stok batu bara di pabrik-pabrik China relatif tinggi. Pada awalnya, penimbunan stok dilakukan karena khawatir akan gangguan pasokan akibat dampak topan. Dengan pasokan yang melimpah, diharapkan bahwa Negeri Tirai Bambu akan mengalami permintaan yang lemah pada bulan September-Oktober. Pelemahan permintaan ini juga berkaitan dengan redanya konsumsi listrik setelah berakhirnya musim panas. Beralih ke India, tingginya penggunaan bahan bakar energi menyebabkan karbondioksida semester pertama tahun ini menjadi yang tertinggi sepanjang sejarah. Utilitas India menggunakan campuran batu bara domestik kelas rendah ditambah impor untuk pembangkit listrik dan pengiriman batu bara ke konsumen batu bara terbesar kedua dapat memberikan indikator utama potensi emisi dari pembangkit listrik pesisir utama, yang merupakan salah satu yang terbesar di negara tersebut. Sekitar 80% impor batubara termal India selama paruh pertama tahun 2023 berasal dari Indonesia, Afrika Selatan, dan Rusia, yang dikenal terutama mengekspor. batubara termal berkualitas rendah yang mengeluarkan CO2 dan sulfur dioksida saat dibakar di pembangkit listrik. CNBC INDONESIA RESEARCH [email protected]";21-08-2023;https://www.cnbcindonesia.com/research/20230820230910-128-464479/dunia-memanas-sektor-energi-makin-mengganas;"indeks sektor energi (idxenergy) menjadi satu dari dua sektor yang menghijau saat indeks harga saham gabungan (ihsg) merosot dan meninggalkan level psikologis 6.900 pada jumat (18/8/2023). menurut data bursa efek indonesia (bei), ihsg ambles 0,59% ke 6.859,91, melanjutkan penurunan 0,21% pada rabu (16/8) lalu. dalam sepekan, ihsg turun 0,48% dan dalam sebulan melemah 0,06%. dari 11 indeks sektoral, 9 indeks memerah. hanya idxenergy dan infrastruktur (idxinfra) yang menghijau, masing-masing 0,39% dan 0,07%. kenaikan idxenergy ditopang oleh emiten-emiten yang berkaitan dengan batu bara yang menguat seiring kenaikan harga komoditasnya. emiten kapal yang mengangkut komoditas batu bara dan migas juga ikut melompat tinggi hari ini, seperti rigs yang terbang 18,64% dan soci 14,92%. sedangkan, saham perdagangan batu bara sger dan arii melonjak 12,92% dan 9,41%. saham anak usaha adaro (adro), admr, juga terungkit 6,31%. adro sendiri naik 0,79%. demikian belasan emiten batu bara dan migas lainnya. soal batu bara, harga komoditas ini terus melanjutkan penguatan selama 10 hari beruntun dengan menguat hingga 11,4%. harga batu bara bahkan mampu menembus us% 160 pada pekan lalu. merujuk pada refinitiv, harga batu bara ice newcastle kontrak september ditutup di posisi us$ 160,75 per ton atau naik 3,04% pada perdagangan jumat lalu(18/8/2023). harga tersebut adalah yang tertinggi sejak 23 mei 2023 atau tiga bulan terakhir. harga batu bara terus melonjak sejak juli karena suhu udara yang mendidih. tak hanya china, suhu mendidih juga melanda vietnam hingga eropa. kondisi ini membuat penggunaan listrik meningkat sehingga kebutuhan batu bara pun naik data badan pusat statistik (bps) menunjukkan volume ekspor batu bara mencapai 231,83 juta ton pada januari-juli 2023 atau naik 4,8%. india menjadi pasar terbesar dari sisi volume dengan angka mencapai 56,11 juta ton. jumlah tersebut turun 23,13%. berikutnya ada china dengan permintaan menyentuh 48,47 juta ton atau melonjak 61,7% pada januari-juli 2023. penguatan batu bara juga ditopang oleh aksi mogok pekerja gas alam cair (liquified natural gas) australia. pekerja di fasilitas chevron gorgon dan wheatstone (lng) di australia akan mulai memberikan suara mulai jumat pekan ini untuk memutuskan terkait aksi mogok karena perselisihan mengenai upah dan kondisi kerja, aliansi serikat pekerja dikatakan. regulator ketenagakerjaan australia pekan lalu membuka jalan bagi aksi mogok di fasilitas tersebut dengan melakukan ""pemilihan suara yang dilindungi,"" yang memberikan kesempatan kepada karyawan untuk secara diam-diam memilih apakah akan memulai aksi industri yang dilindungi atau tidak. aksi mogok pekerja australia ukup berisiko signifikan pada harga komoditas energi, sebab berkurangnya produksi akan mengganggu pasokan australia. gas yang merupakan substitusi bahan bakar energi dari fosil, batu bara, berpotensi turut mengalami kenaikan harga jika pekerja australia memutuskan penghentian. sentimen utama dalam pasar global batu bara juga dipengaruhi oleh aktivitas perdagangan di pasar batu bara termal di asia, yang diperkirakan akan mengalami pelemahan kembali dalam minggu ini. perkiraan pasar menunjukkan kecenderungan ""wait and see"" karena para pembeli sedang menantikan sinyal positif yang lebih kuat. pelemahan ini disebabkan oleh melemahnya permintaan listrik dan aktivitas industri di kawasan asia yang dipimpin oleh china. pertengahan musim panas di china telah mengakibatkan penurunan permintaan listrik di negara tersebut. selain itu, harapan akan adanya kenaikan harga batu bara domestik akibat topan juga belum terwujud. dari sisi pasokan, stok batu bara di pabrik-pabrik china relatif tinggi. pada awalnya, penimbunan stok dilakukan karena khawatir akan gangguan pasokan akibat dampak topan. dengan pasokan yang melimpah, diharapkan bahwa negeri tirai bambu akan mengalami permintaan yang lemah pada bulan september-oktober. pelemahan permintaan ini juga berkaitan dengan redanya konsumsi listrik setelah berakhirnya musim panas. beralih ke india, tingginya penggunaan bahan bakar energi menyebabkan karbondioksida semester pertama tahun ini menjadi yang tertinggi sepanjang sejarah. utilitas india menggunakan campuran batu bara domestik kelas rendah ditambah impor untuk pembangkit listrik dan pengiriman batu bara ke konsumen batu bara terbesar kedua dapat memberikan indikator utama potensi emisi dari pembangkit listrik pesisir utama, yang merupakan salah satu yang terbesar di negara tersebut. sekitar 80% impor batubara termal india selama paruh pertama tahun 2023 berasal dari indonesia, afrika selatan, dan rusia, yang dikenal terutama mengekspor. batubara termal berkualitas rendah yang mengeluarkan co2 dan sulfur dioksida saat dibakar di pembangkit listrik. cnbc indonesia research [email protected]"
             Jokowi Ungkap Postur APBN 2024, Pasar Yakin IHSG Tembus 8.400            ;Jakarta, CNBC Indonesia- Presiden Jokowi dalam Sidang Tahunan DPR/DPD menyampaikan asumsi makro pemerintah atas RUU Tentang APBN Tahun Anggaran 2024 beserta Nota Keuangannya pada 16 Agustus 2023. Ditargetkan pertumbuhan ekonomi RI 2024 sebesar 5,2% dengan Inflasi di kisaran 2,8% dan Rupiah berada di Rp 15.000/USD. Selain itu pendapatan negara ditargetkan Rp 2.781 Triliun dengan belanja negara Rp 3.304 Triliun. Menilik postur RAPBN 2024, CIO PT Mandiri Manajemen Investasi, Ernawan R Salimsyah menilai bahwa asumsi pemerintah ini diupayakan untuk menjaga momentum pertumbuhan sekaligus realistis mengantisipasi guncangan global. Ernawan juga memandang optimisme terhadap kemampuan APBN 2024 menopang pertumbuhan ekonomi sehingga dapat mendorong penguatan pasar keuangan dan dunia industri domestik. Di proyeksi IHSG bisa melesat ke 7.400 di akhir 2023 dan tembus 8.400 di 2024. Seperti apa pelaku pasar melihat postur RAPBN 2024? Bagaimana dampaknya terhadap pasar keuangan domestik? Selengkapnya simak dialog Safrina Nasution dengan Chief Investment Officer PT Mandiri Manajemen Investasi, Ernawan R Salimsyah dalam Power Lunch,CNBCIndonesia (Jum'at, 18/08/2023);18-08-2023;https://www.cnbcindonesia.com/market/20230818133629-19-464091/jokowi-ungkap-postur-apbn-2024-pasar-yakin-ihsg-tembus-8400;jakarta, cnbc indonesia- presiden jokowi dalam sidang tahunan dpr/dpd menyampaikan asumsi makro pemerintah atas ruu tentang apbn tahun anggaran 2024 beserta nota keuangannya pada 16 agustus 2023. ditargetkan pertumbuhan ekonomi ri 2024 sebesar 5,2% dengan inflasi di kisaran 2,8% dan rupiah berada di rp 15.000/usd. selain itu pendapatan negara ditargetkan rp 2.781 triliun dengan belanja negara rp 3.304 triliun. menilik postur rapbn 2024, cio pt mandiri manajemen investasi, ernawan r salimsyah menilai bahwa asumsi pemerintah ini diupayakan untuk menjaga momentum pertumbuhan sekaligus realistis mengantisipasi guncangan global. ernawan juga memandang optimisme terhadap kemampuan apbn 2024 menopang pertumbuhan ekonomi sehingga dapat mendorong penguatan pasar keuangan dan dunia industri domestik. di proyeksi ihsg bisa melesat ke 7.400 di akhir 2023 dan tembus 8.400 di 2024. seperti apa pelaku pasar melihat postur rapbn 2024? bagaimana dampaknya terhadap pasar keuangan domestik? selengkapnya simak dialog safrina nasution dengan chief investment officer pt mandiri manajemen investasi, ernawan r salimsyah dalam power lunch,cnbcindonesia (jum'at, 18/08/2023)
