Title;Content;Date;URL;Cleaned Article
 Sri Mulyani Tambah Uang Makan PNS hingga Rp500 Ribu per Bulan ;"Menteri Keuangan Sri Mulyani memberikan tambahan uang makan hingga Rp500 ribu per bulan bagi setiap PNS yang ada di Kementerian/Lembaga (K/L) pada 2024 nanti demi meningkatkan daya tahan tubuh. Kebijakan itu diatur dalam Peraturan Menteri Keuangan Nomor 49 Tahun 2023 tentang Standar Biaya Masukan Tahun Anggaran 2024 yang berlaku sejak diundangkan pada 3 Mei 2023. Anggaran uang makan tambahan ini masuk dalam satuan biaya makanan penambah daya tahan tubuh. Di mana setiap PNS akan menerima nilai berbeda berdasarkan wilayah kerjanya.  ADVERTISEMENT   SCROLL TO CONTINUE WITH CONTENT   ""Satuan biaya makanan penambah daya tahan tubuh merupakan satuan biaya yang digunakan untuk kebutuhan biaya pengadaan makanan/minuman bergizi yang dapat menambah/meningkatkan/mempertahankan daya tahan tubuh Pegawai ASN yang diberi tugas melaksanakan pekerjaan tugas dan fungsi kantor yang dapat memberikan dampak buruk bagi kesehatan pegawai dimaksud,"" tulis PMK tersebut yang dikutip, Senin (15/5). Berdasarkan lampiran PMK 49/2023 ini, biaya penambah daya tahan tubuh ditetapkan mulai Rp18 ribu-Rp25 ribu per orang per hari, artinya sebulan sekitar Rp396 ribu-Rp550 ribu per bulan (asumsi 22 hari kerja). Satuan biaya ini tertinggi untuk PNS yang berada di daerah Papua, Papua Barat, sampai Papua Pegunungan, yakni Rp25 ribu per hari. Sedangkan, terendah Rp18 ribu per hari ada di berbagai wilayah di Indonesia, seperti Jambi, Sumatera hingga Kalimantan Selatan.  Untuk PNS di DKI Jakarta yang dikenal dengan penerima tunjangan kinerja terbesar diantara provinsi lainnya, menerima biaya makanan penambah daya tahan tubuh sebesar Rp19 ribu per orang per hari atau Rp418 ribu per bulan. Biaya tersebut adalah tambahan yang diberikan setiap bulannya di luar kenikmatan lainnya, misalnya tunjangan keluarga hingga tunjangan kinerja. Selain itu, dalam aturan ini Sri Mulyani juga mengatur nilai maksimal yang bisa disusun K/L untuk perjalanan dinas dalam dan luar negeri, rapat di luar kantor serta uang lembur PNS. Nilai yang tercantum merupakan satuan biaya maksimal yang dijadikan patokan oleh K/L untuk menyusun anggaran 2024.  [Gambas:Video CNN] ";15-05-2023;https://www.cnnindonesia.com/ekonomi/20230515070634-532-949516/sri-mulyani-tambah-uang-makan-pns-hingga-rp500-ribu-per-bulan;"menteri keuangan sri mulyani memberikan tambahan uang makan hingga rp500 ribu per bulan bagi setiap pns yang ada di kementerian/lembaga (k/l) pada 2024 nanti demi meningkatkan daya tahan tubuh. kebijakan itu diatur dalam peraturan menteri keuangan nomor 49 tahun 2023 tentang standar biaya masukan tahun anggaran 2024 yang berlaku sejak diundangkan pada 3 mei 2023. anggaran uang makan tambahan ini masuk dalam satuan biaya makanan penambah daya tahan tubuh. di mana setiap pns akan menerima nilai berbeda berdasarkan wilayah kerjanya. ""satuan biaya makanan penambah daya tahan tubuh merupakan satuan biaya yang digunakan untuk kebutuhan biaya pengadaan makanan/minuman bergizi yang dapat menambah/meningkatkan/mempertahankan daya tahan tubuh pegawai asn yang diberi tugas melaksanakan pekerjaan tugas dan fungsi kantor yang dapat memberikan dampak buruk bagi kesehatan pegawai dimaksud,"" tulis pmk tersebut yang dikutip, senin (15/5). berdasarkan lampiran pmk 49/2023 ini, biaya penambah daya tahan tubuh ditetapkan mulai rp18 ribu-rp25 ribu per orang per hari, artinya sebulan sekitar rp396 ribu-rp550 ribu per bulan (asumsi 22 hari kerja). satuan biaya ini tertinggi untuk pns yang berada di daerah papua, papua barat, sampai papua pegunungan, yakni rp25 ribu per hari. sedangkan, terendah rp18 ribu per hari ada di berbagai wilayah di indonesia, seperti jambi, sumatera hingga kalimantan selatan. untuk pns di dki jakarta yang dikenal dengan penerima tunjangan kinerja terbesar diantara provinsi lainnya, menerima biaya makanan penambah daya tahan tubuh sebesar rp19 ribu per orang per hari atau rp418 ribu per bulan. biaya tersebut adalah tambahan yang diberikan setiap bulannya di luar kenikmatan lainnya, misalnya tunjangan keluarga hingga tunjangan kinerja. selain itu, dalam aturan ini sri mulyani juga mengatur nilai maksimal yang bisa disusun k/l untuk perjalanan dinas dalam dan luar negeri, rapat di luar kantor serta uang lembur pns. nilai yang tercantum merupakan satuan biaya maksimal yang dijadikan patokan oleh k/l untuk menyusun anggaran 2024. "
 Daftar Lowongan Lulusan SMA/SMK Rekrutmen Bersama BUMN 2023 ;"Rekrutmen Bersama BUMN (RBB) 2023 resmi dibuka pada Kamis (11/5). Tahun ini, RBB pun kembali membuka lowongan untuk lulusan SMA/SMK sederajat. Forum Human Capital Indonesia (FHCI) BUMN mengungkapkan pada tahun ini pihaknya secara total menyediakan lebih dari 2.000 lowongan di berbagai perusahaan pelat merah. ""Terbuka lebih dari 2.000+ lowongan pekerjaan dan diikuti oleh lebih dari 120+ Perusahaan BUMN Group untuk jenjang SMA/Sederajat, D3, S1/D4, dan S2,"" tulis FHCI BUMN dalam unggahan akun Instagram resmi @fhci.bumn.  ADVERTISEMENT   SCROLL TO CONTINUE WITH CONTENT   Terdapat sejumlah tahapan yang harus dilalui pelamar pada Rekrutmen Bersama BUMN tahun ini. Seluruh proses rekrutmen ini tentunya gratis alias tidak dipungut biaya. Adapun pendaftaran dilakukan melalui situs resmi https://rekrutmenbersama.fhcibumn.id/. Mengutip laman resminya, berikut daftar lowongan untuk lulusan SMA/SMK sederajat dalam RRB 2023; - Engineering Staff PT Bahana Pembinaan Usaha Indonesia (Persero) - PT Asuransi Jiwa IFG - PT Mitrasraya AdhijasaJurusan: SMA/SMK - Manajemen Teknik, SMA/SMK - Pendidikan Teknik Elektro, SMA/SMK - Teknik Elektro, SMA/SMK - Teknik Listrik, SMA/SMK - Teknik Mesin - Teknisi Perum PPDJurusan: SMA/SMK - Teknik Mekanik, SMA/SMK - Teknik Mesin, SMA/SMK - Teknik Mesin/Otomotif, SMA/SMK - Teknik Otomotif, SMA/SMK - Teknik Transportasi  - Account Officer - Bandar Lampung PT Bank Rakyat Indonesia (Persero) Tbk - PT Permodalan Nasional MadaniJurusan : Semua Jurusan - Staf Pengelolaan SDH Perum PerhutaniJurusan: SMA/SMK - kehutanan - Sales Marketing PT Bank Rakyat Indonesia (Persero) Tbk - PT Pegadaian - PT Pegadaian Galeri Dua EmpatJurusan : Semua Jurusan - Teknisi Maintenance LRT Jabodebek PT Industri Kereta Api (Persero) - PT INKA MULTI SOLUSI - PT INKA MULTI SOLUSI SERVICEJurusan: SMA/SMK - Manajemen Teknik, SMA/SMK - Manajemen Teknik Industri, SMA/SMK - Teknik Elektro, SMA/SMK - Teknik Industri, SMA/SMK - Teknik Ketenagalistrikan, SMA/SMK - Teknik Listrik, SMA/SMK - Teknik Mekatronika, SMA/SMK - Teknik Mesin, SMA/SMK - Teknik Otomasi, SMA/SMK - Teknik Tenaga Listrik, SMA/SMK - Teknik Transportasi  - Teknisi Backshop dan Overhaul LRT Jabodebek PT Industri Kereta Api (Persero) - PT INKA MULTI SOLUSI - PT INKA MULTI SOLUSI SERVICEJurusan: SMA/SMK - Manajemen Teknik, SMA/SMK - Manajemen Teknik Industri, SMA/SMK - Teknik Elektro, SMA/SMK - Teknik Industri, SMA/SMK - Teknik Mekatronika, SMA/SMK - Teknik Mesin, SMA/SMK - Teknik Otomasi, SMA/SMK - Teknik Tenaga Listrik, SMA/SMK - Teknik Transportasi - Staf Humas dan Pelaporan Perum PerhutaniJurusan: SMA/SMK - Desain Komunikasi Visual, SMA/SMK - DKV Media Baru, SMA/SMK - Teknik Elektro Multimedia Dan Jaringan - Surveyor PT Pembangunan Perumahan (Persero) Tbk - PT PP Presisi Tbk - PT Lancarjaya Mandiri AbadiJurusan : SMA/SMK - Teknik Ekonomi Konstruksi (Quantity Surveyor) - Helper Elektrik PT Pembangunan Perumahan (Persero) Tbk - PT PP Presisi Tbk - PT Lancarjaya Mandiri AbadiJurusan: Semua Jurusan     - Operator Warehouse PT Pembangunan Perumahan (Persero) Tbk - PT PP Presisi Tbk - PT Lancarjaya Mandiri AbadiJurusan: Semua Jurusan - Mekanik Dump Truk PT Pembangunan Perumahan (Persero) Tbk - PT PP Presisi Tbk - PT Lancarjaya Mandiri AbadiJurusan: Semua Jurusan - Assistant Manager Floor PT Aviasi Pariwisata Indonesia (Persero) - PT SarinahJurusan: Semua Jurusan - Account Officer - Solo PT Bank Rakyat Indonesia (Persero) Tbk - PT Permodalan Nasional MadaniJurusan: Semua Jurusan - Account Officer - Bojonegoro PT Bank Rakyat Indonesia (Persero) Tbk - PT Permodalan Nasional MadaniJurusan: Semua Jurusan  - Account Officer - Tegal PT Bank Rakyat Indonesia (Persero) Tbk - PT Permodalan Nasional MadaniJurusan: Semua Jurusan - Account Officer - Banyuwangi PT Bank Rakyat Indonesia (Persero) Tbk - PT Permodalan Nasional MadaniJurusan: Semua Jurusan - Account Officer - Baubau PT Bank Rakyat Indonesia (Persero) Tbk - PT Permodalan Nasional MadaniJurusan: Semua Jurusan - Account Officer - Padang PT Bank Rakyat Indonesia (Persero) Tbk - PT Permodalan Nasional MadaniJurusan: Semua Jurusan - Account Officer - Kendari PT Bank Rakyat Indonesia (Persero) Tbk - PT Permodalan Nasional MadaniJurusan: Semua Jurusan  [Gambas:Video CNN]  - Account Officer - Medan PT Bank Rakyat Indonesia (Persero) Tbk - PT Permodalan Nasional MadaniJurusan: Semua Jurusan - Account Officer - Tulungagung PT Bank Rakyat Indonesia (Persero) Tbk - PT Permodalan Nasional MadaniJurusan: Semua Jurusan - Operator Forklift PT Pelabuhan Indonesia (Persero)Jurusan: Semua Jurusan - Operator Truck Tronton PT Pelabuhan Indonesia (Persero)Jurusan: Semua Jurusan - Yard Operation Assistant PT Pelabuhan Indonesia (Persero)Jurusan: Semua Jurusan - Gate Inspector PT Pelabuhan Indonesia (Persero)Jurusan: Semua Jurusan";12-05-2023;https://www.cnnindonesia.com/ekonomi/20230512070802-92-948567/daftar-lowongan-lulusan-sma-smk-rekrutmen-bersama-bumn-2023;"rekrutmen bersama bumn (rbb) 2023 resmi dibuka pada kamis (11/5). tahun ini, rbb pun kembali membuka lowongan untuk lulusan sma/smk sederajat. forum human capital indonesia (fhci) bumn mengungkapkan pada tahun ini pihaknya secara total menyediakan lebih dari 2.000 lowongan di berbagai perusahaan pelat merah. ""terbuka lebih dari 2.000+ lowongan pekerjaan dan diikuti oleh lebih dari 120+ perusahaan bumn group untuk jenjang sma/sederajat, d3, s1/d4, dan s2,"" tulis fhci bumn dalam unggahan akun instagram resmi @fhci.bumn. terdapat sejumlah tahapan yang harus dilalui pelamar pada rekrutmen bersama bumn tahun ini. seluruh proses rekrutmen ini tentunya gratis alias tidak dipungut biaya. adapun pendaftaran dilakukan melalui situs resmi /. mengutip laman resminya, berikut daftar lowongan untuk lulusan sma/smk sederajat dalam rrb 2023; - engineering staff pt bahana pembinaan usaha indonesia (persero) - pt asuransi jiwa ifg - pt mitrasraya adhijasajurusan: sma/smk - manajemen teknik, sma/smk - pendidikan teknik elektro, sma/smk - teknik elektro, sma/smk - teknik listrik, sma/smk - teknik mesin - teknisi perum ppdjurusan: sma/smk - teknik mekanik, sma/smk - teknik mesin, sma/smk - teknik mesin/otomotif, sma/smk - teknik otomotif, sma/smk - teknik transportasi - account officer - bandar lampung pt bank rakyat indonesia (persero) tbk - pt permodalan nasional madanijurusan : semua jurusan - staf pengelolaan sdh perum perhutanijurusan: sma/smk - kehutanan - sales marketing pt bank rakyat indonesia (persero) tbk - pt pegadaian - pt pegadaian galeri dua empatjurusan : semua jurusan - teknisi maintenance lrt jabodebek pt industri kereta api (persero) - pt inka multi solusi - pt inka multi solusi servicejurusan: sma/smk - manajemen teknik, sma/smk - manajemen teknik industri, sma/smk - teknik elektro, sma/smk - teknik industri, sma/smk - teknik ketenagalistrikan, sma/smk - teknik listrik, sma/smk - teknik mekatronika, sma/smk - teknik mesin, sma/smk - teknik otomasi, sma/smk - teknik tenaga listrik, sma/smk - teknik transportasi - teknisi backshop dan overhaul lrt jabodebek pt industri kereta api (persero) - pt inka multi solusi - pt inka multi solusi servicejurusan: sma/smk - manajemen teknik, sma/smk - manajemen teknik industri, sma/smk - teknik elektro, sma/smk - teknik industri, sma/smk - teknik mekatronika, sma/smk - teknik mesin, sma/smk - teknik otomasi, sma/smk - teknik tenaga listrik, sma/smk - teknik transportasi - staf humas dan pelaporan perum perhutanijurusan: sma/smk - desain komunikasi visual, sma/smk - dkv media baru, sma/smk - teknik elektro multimedia dan jaringan - surveyor pt pembangunan perumahan (persero) tbk - pt pp presisi tbk - pt lancarjaya mandiri abadijurusan : sma/smk - teknik ekonomi konstruksi (quantity surveyor) - helper elektrik pt pembangunan perumahan (persero) tbk - pt pp presisi tbk - pt lancarjaya mandiri abadijurusan: semua jurusan - operator warehouse pt pembangunan perumahan (persero) tbk - pt pp presisi tbk - pt lancarjaya mandiri abadijurusan: semua jurusan - mekanik dump truk pt pembangunan perumahan (persero) tbk - pt pp presisi tbk - pt lancarjaya mandiri abadijurusan: semua jurusan - assistant manager floor pt aviasi pariwisata indonesia (persero) - pt sarinahjurusan: semua jurusan - account officer - solo pt bank rakyat indonesia (persero) tbk - pt permodalan nasional madanijurusan: semua jurusan - account officer - bojonegoro pt bank rakyat indonesia (persero) tbk - pt permodalan nasional madanijurusan: semua jurusan - account officer - tegal pt bank rakyat indonesia (persero) tbk - pt permodalan nasional madanijurusan: semua jurusan - account officer - banyuwangi pt bank rakyat indonesia (persero) tbk - pt permodalan nasional madanijurusan: semua jurusan - account officer - baubau pt bank rakyat indonesia (persero) tbk - pt permodalan nasional madanijurusan: semua jurusan - account officer - padang pt bank rakyat indonesia (persero) tbk - pt permodalan nasional madanijurusan: semua jurusan - account officer - kendari pt bank rakyat indonesia (persero) tbk - pt permodalan nasional madanijurusan: semua jurusan - account officer - medan pt bank rakyat indonesia (persero) tbk - pt permodalan nasional madanijurusan: semua jurusan - account officer - tulungagung pt bank rakyat indonesia (persero) tbk - pt permodalan nasional madanijurusan: semua jurusan - operator forklift pt pelabuhan indonesia (persero)jurusan: semua jurusan - operator truck tronton pt pelabuhan indonesia (persero)jurusan: semua jurusan - yard operation assistant pt pelabuhan indonesia (persero)jurusan: semua jurusan - gate inspector pt pelabuhan indonesia (persero)jurusan: semua jurusan"
         2 WNI Ditangkap di Singapura Bawa Uang Tunai Rp 394 Juta, Ini Aturannya    ;"Sebanyak dua wanita asal Indonesia (WNI) ditangkap otoritas Singapura karena membawa uang tunai dalam bentuk mata uang asing senilai SG$ 35.600 atau Rp 394,5 juta (kurs Rp 11.082) tanpa melapor. Keduanya diamankan setelah turun dari kapal feri di Singapore Cruise Centre. Insiden itu terjadi pada Rabu (10/5) pekan lalu, namun petugas Immigration and Checkpoints Authority (ICA) Singapura baru merilis insiden itu dalam pernyataan via Facebook pada Senin (15/5) waktu setempat. Dilansir The Straits Times, Selasa (16/5/2023), dijelaskan bahwa uang tunai itu dibungkus dalam kantong plastik kemudian dibagi menjadi tiga tumpukan yang ditempatkan di dalam dua koper dan satu tas ransel. Keberadaan uang tunai diketahui saat kedua WNI tersebut melewati pemeriksaan X-Ray.      ADVERTISEMENT         SCROLL TO CONTINUE WITH CONTENT    Petugas ICA di lokasi kemudian melakukan pemeriksaan secara menyeluruh terhadap seluruh barang bawaan mereka. Kedua WNI itu lalu diserahkan ke polisi untuk diselidiki lebih lanjut, termasuk guna mengetahui asal muasal dan tujuan membawa uang tunai tersebut. Supaya kejadian tidak berulang, ada baiknya mengetahui aturan membawa uang tunai ke negara orang seperti Singapura. Dikutip dari situs Kedutaan Besar Singapura, setiap pelancong yang masuk atau meninggalkan Singapura wajib mengajukan laporan ke polisi jika hendak membawa uang fisik atau surat berharga yang nilainya lebih dari SG$ 20 ribu atau setara Rp 221 juta. Syarat itu juga berlaku jika orang tersebut membawa uang tunai atau surat berharga atas nama orang lain. Jika ketahuan melanggar, pelancong dapat dikenakan denda hingga SG$ 50 ribu atau setara Rp 553 juta, hukuman penjara maksimal tiga tahun, atau keduanya. Barang-barang yang tidak dilaporkan itu juga bisa disita oleh otoritas setempat. ""Persyaratan pelaporan ini merupakan bagian dari upaya memerangi pencucian uang internasional dan pendanaan terorisme,"" tegas ICA.  Lihat juga Video 'Seorang Kakek di Lombok Bawa Uang Rp 43 Juta Dalam Plastik':   [Gambas:Video 20detik] ";16-05-2023;https://finance.detik.com/moneter/d-6722978/2-wni-ditangkap-di-singapura-bawa-uang-tunai-rp-394-juta-ini-aturannya;"sebanyak dua wanita asal indonesia (wni) ditangkap otoritas singapura karena membawa uang tunai dalam bentuk mata uang asing senilai sg$ 35.600 atau rp 394,5 juta (kurs rp 11.082) tanpa melapor. keduanya diamankan setelah turun dari kapal feri di singapore cruise centre. insiden itu terjadi pada rabu (10/5) pekan lalu, namun petugas immigration and checkpoints authority (ica) singapura baru merilis insiden itu dalam pernyataan via facebook pada senin (15/5) waktu setempat. dilansir the straits times, selasa (16/5/2023), dijelaskan bahwa uang tunai itu dibungkus dalam kantong plastik kemudian dibagi menjadi tiga tumpukan yang ditempatkan di dalam dua koper dan satu tas ransel. keberadaan uang tunai diketahui saat kedua wni tersebut melewati pemeriksaan x-ray. petugas ica di lokasi kemudian melakukan pemeriksaan secara menyeluruh terhadap seluruh barang bawaan mereka. kedua wni itu lalu diserahkan ke polisi untuk diselidiki lebih lanjut, termasuk guna mengetahui asal muasal dan tujuan membawa uang tunai tersebut. supaya kejadian tidak berulang, ada baiknya mengetahui aturan membawa uang tunai ke negara orang seperti singapura. dikutip dari situs kedutaan besar singapura, setiap pelancong yang masuk atau meninggalkan singapura wajib mengajukan laporan ke polisi jika hendak membawa uang fisik atau surat berharga yang nilainya lebih dari sg$ 20 ribu atau setara rp 221 juta. syarat itu juga berlaku jika orang tersebut membawa uang tunai atau surat berharga atas nama orang lain. jika ketahuan melanggar, pelancong dapat dikenakan denda hingga sg$ 50 ribu atau setara rp 553 juta, hukuman penjara maksimal tiga tahun, atau keduanya. barang-barang yang tidak dilaporkan itu juga bisa disita oleh otoritas setempat. ""persyaratan pelaporan ini merupakan bagian dari upaya memerangi pencucian uang internasional dan pendanaan terorisme,"" tegas ica. lihat juga video 'seorang kakek di lombok bawa uang rp 43 juta dalam plastik': "
