Title;Content;Date;URL;Cleaned Article
             Kamu Bakal Kipasan Duit Kalau Beli 10 Saham Ini Sebelum Imlek            ;Jakarta, CNBC Indonesia - Membeli saham multibagger alias saham dengan cuan hingga ratusan persen adalah impian banyak orang. Ada beberapa saham yang menjadi bagger karena sentimen seperti aksi korporasi atau peningkatan fundamental dan valuasi perusahaan. Namun ada juga yang naik fantastis karena masuk wajan penggorengan 'bandar' alias investor berkantong tebal. Ketika indeks pasar secara luas atau Indeks Harga Saham Gabungan (IHSG) menguat 1,15% pekan ini. Beberapa saham menawarkan capital gain lebih dari 50% ketika perdagangan hanya berjalan singkat 4 hari saja karena ada libur perayaan tahun baru Imlek.  Namun saham-saham yang naiknya fantastis ini didominasi oleh saham yang belum lama melantai di bursa nasional. Volume transaksinya pun rendah alias tak likuid. Ada bahkan yang sebelumnya di level gocap kemudian bangkit.  Saham PT Indointernet Tbk (EDGE) memimpin top gainers pekan ini dengan apresiasi harga sebesar 106%. EDGE barulah melantai di bursa saham domestik pada 8 Februari atau tepat di awal pekan ini.   Saham kedua dengan cuan fantastis adalah PT Djasa Ubersakti Tbk (PTDU). Dalam sepekan harga saham ini naik 94%. PTDU merupakan perusahaan yang bergerak di sektor konstruksi dan resmi melantai di bursa sejak 8 Desember lalu.  Namun harganya sudah naik gila-gilaan. Bayangkan saja saham ini dihargai Rp 100/unit dan kini sudah tembus Rp 2.060/unit. Artinya ada kenaikan sampai 20 kali lipat. Bisa dihitung kan cuan dari saham ini berapa kalau dapat mengantre di saat penawaran perdana (IPO) dan tetap di-hold sampai saat ini.  Kemudian saham dengan kenaikan fantastis selanjutnya adalah PT Bank Net Indonesia Syariah Tbk (BANK). Di pekan ini harga saham BANK melesat 84%. BANK merupakan salah satu emiten perbankan yang melayani nasabah dan debitur dengan prinsip syariah tetapi menggunakan model bisnis bank digital. Sentimen terkait praktik bank digital menjadi katalis positif bagi harga saham BANK. Namun sayang seribu sayang, kenaikan yang sudah tidak wajar membuat kedua saham ini (PTDU dan BANK) masuk radar BEI hingga kemarin akhirnya mendapatkan suspensi dari otoritas bursa. Selanjutnya ada saham PT Natura City Development Tbk (CITY) dan PT Sanurhasta Mitra Tbk (MINA). Keduanya naik 58%. Menariknya saham MINA sebelumnya berada di level gocap alias Rp 50/unit.  Namun setelah sekian lama tertidur, saham MINA tercatat membukukan kenaikan volume transaksi yang signifikan sehingga mengerek harganya naik. Bahkan saham MINA sempat naik ke level tertingginya di Rp 110/unit sebelum akhirnya jatuh di level auto reject bawah (ARB) pada perdagangan kemarin.   Lima saham di atas memang memberikan cuan yang fantastis. Namun transaksinya tidak benar-benar mencerminkan dinamika permintaan dan penawaran terhadap suatu saham atau bahkan kinerja fundamental perusahaan yang membaik atau prospek yang cerah. Sementara itu jika menengok saham-saham yang namanya sudah tak asing dan likuid. Lima saham paling cuan sepekan memberikan imbal hasil berupa capital gain di kisaran 20-30%. Berikut adalah saham-saham tersebut : Itama Ranoraya/IRRA (+31,61%) Bank BRI Agroniaga/AGRO (+31,06%) Central Omega/DKFT (+23,08%) MD Pictures/FILM (+19,86%) Antan/ANTM (+19,58%)   Terlihat dari jajaran saham di atas adalah saham-saham yang sebelumnya menghuni ARB Club (auto reject bawah) beruntun seperti saham PT Itama Ranoraya Tbk (IRRA) yang sempat melonjak signifikan ketika berita vaksinasi sedang hangat-hangatnya diperbincangkan.  Kemudian dua saham yang memiliki unit usaha berupa pertambangan nikel yakni PT Central Omega Resources Tbk (DKFT) dan PT Aneka Tambang Tbk (ANTM) juga menguat akibat sentimen kenaikan harga nikel yang kini sudah mendekati level US$ 18.500/ton. Saham PT Bank Rakyat Indonesia Agroniaga Tnk (AGRO) melesat karena berdasarkan informasi yang beredar bakal dijadikan sebagai bank digital. Terakhir ada saham PT MD Pictures Tbk (FILM) yang fenomenal. Harganya sempat bergerak liar ketika salah satu investor yang sudah malang melintang di dunia persilatan, eh maksudnya dunia pasar modal banyak mencuit soal saham ini di media sosialnya.  Di pekan ini saham yang paling banyak diborong asing adalah saham PT Bank Rakyat Indonesia Tbk (BBRI). Sepekan asing mengkoleksi saham BBRI sampai Rp 1,1 triliun. Rencana akuisisi Pegadaian dan PT PNM yang bakal meningkatkan valuasi, laba dan efisiensi serta sinergi dengan BBRI membuat saham bank dengan aset terbesar di Indonesia ini dilirik asing untuk dikoleksi.   TIM RISET CNBC INDONESIA ;12-02-2021;https://www.cnbcindonesia.com/market/20210212093054-17-222919/kamu-bakal-kipasan-duit-kalau-beli-10-saham-ini-sebelum-imlek;jakarta, cnbc indonesia - membeli saham multibagger alias saham dengan cuan hingga ratusan persen adalah impian banyak orang. ada beberapa saham yang menjadi bagger karena sentimen seperti aksi korporasi atau peningkatan fundamental dan valuasi perusahaan. namun ada juga yang naik fantastis karena masuk wajan penggorengan 'bandar' alias investor berkantong tebal. ketika indeks pasar secara luas atau indeks harga saham gabungan (ihsg) menguat 1,15% pekan ini. beberapa saham menawarkan capital gain lebih dari 50% ketika perdagangan hanya berjalan singkat 4 hari saja karena ada libur perayaan tahun baru imlek. namun saham-saham yang naiknya fantastis ini didominasi oleh saham yang belum lama melantai di bursa nasional. volume transaksinya pun rendah alias tak likuid. ada bahkan yang sebelumnya di level gocap kemudian bangkit. saham pt indointernet tbk (edge) memimpin top gainers pekan ini dengan apresiasi harga sebesar 106%. edge barulah melantai di bursa saham domestik pada 8 februari atau tepat di awal pekan ini. saham kedua dengan cuan fantastis adalah pt djasa ubersakti tbk (ptdu). dalam sepekan harga saham ini naik 94%. ptdu merupakan perusahaan yang bergerak di sektor konstruksi dan resmi melantai di bursa sejak 8 desember lalu. namun harganya sudah naik gila-gilaan. bayangkan saja saham ini dihargai rp 100/unit dan kini sudah tembus rp 2.060/unit. artinya ada kenaikan sampai 20 kali lipat. bisa dihitung kan cuan dari saham ini berapa kalau dapat mengantre di saat penawaran perdana (ipo) dan tetap di-hold sampai saat ini. kemudian saham dengan kenaikan fantastis selanjutnya adalah pt bank net indonesia syariah tbk (bank). di pekan ini harga saham bank melesat 84%. bank merupakan salah satu emiten perbankan yang melayani nasabah dan debitur dengan prinsip syariah tetapi menggunakan model bisnis bank digital. sentimen terkait praktik bank digital menjadi katalis positif bagi harga saham bank. namun sayang seribu sayang, kenaikan yang sudah tidak wajar membuat kedua saham ini (ptdu dan bank) masuk radar bei hingga kemarin akhirnya mendapatkan suspensi dari otoritas bursa. selanjutnya ada saham pt natura city development tbk (city) dan pt sanurhasta mitra tbk (mina). keduanya naik 58%. menariknya saham mina sebelumnya berada di level gocap alias rp 50/unit. namun setelah sekian lama tertidur, saham mina tercatat membukukan kenaikan volume transaksi yang signifikan sehingga mengerek harganya naik. bahkan saham mina sempat naik ke level tertingginya di rp 110/unit sebelum akhirnya jatuh di level auto reject bawah (arb) pada perdagangan kemarin. lima saham di atas memang memberikan cuan yang fantastis. namun transaksinya tidak benar-benar mencerminkan dinamika permintaan dan penawaran terhadap suatu saham atau bahkan kinerja fundamental perusahaan yang membaik atau prospek yang cerah. sementara itu jika menengok saham-saham yang namanya sudah tak asing dan likuid. lima saham paling cuan sepekan memberikan imbal hasil berupa capital gain di kisaran 20-30%. berikut adalah saham-saham tersebut : itama ranoraya/irra (+31,61%) bank bri agroniaga/agro (+31,06%) central omega/dkft (+23,08%) md pictures/film (+19,86%) antan/antm (+19,58%) terlihat dari jajaran saham di atas adalah saham-saham yang sebelumnya menghuni arb club (auto reject bawah) beruntun seperti saham pt itama ranoraya tbk (irra) yang sempat melonjak signifikan ketika berita vaksinasi sedang hangat-hangatnya diperbincangkan. kemudian dua saham yang memiliki unit usaha berupa pertambangan nikel yakni pt central omega resources tbk (dkft) dan pt aneka tambang tbk (antm) juga menguat akibat sentimen kenaikan harga nikel yang kini sudah mendekati level us$ 18.500/ton. saham pt bank rakyat indonesia agroniaga tnk (agro) melesat karena berdasarkan informasi yang beredar bakal dijadikan sebagai bank digital. terakhir ada saham pt md pictures tbk (film) yang fenomenal. harganya sempat bergerak liar ketika salah satu investor yang sudah malang melintang di dunia persilatan, eh maksudnya dunia pasar modal banyak mencuit soal saham ini di media sosialnya. di pekan ini saham yang paling banyak diborong asing adalah saham pt bank rakyat indonesia tbk (bbri). sepekan asing mengkoleksi saham bbri sampai rp 1,1 triliun. rencana akuisisi pegadaian dan pt pnm yang bakal meningkatkan valuasi, laba dan efisiensi serta sinergi dengan bbri membuat saham bank dengan aset terbesar di indonesia ini dilirik asing untuk dikoleksi. tim riset cnbc indonesia 
             Saham BANK Ramai Transaksi, 'Bandar' Sudah Mulai Distribusi?            ;"Jakarta, CNBC Indonesia - Saham PT Bank Net Syariah Tbk (BANK) terus melesat kencang sejak melantai di bursa saham alias Initial Public Offering (IPO). Sejak melantai 1 Februari 2020 di harga Rp 103/unit, saham BANK sudah terbang 703,88%. Fenomena saham IPO yang terbang tinggi memang sering terjadi di bursa lokal. Hal ini terjadi karena saham yang beredar di pasar tidak tersebar merata dan hanya dikuasai oleh segelintir pelaku pasar saja. Oleh karena itu segelintir pelaku pasar tersebut akan dengan mudah mendorong harga saham ke satu arah dalam kasus ni naik ratusan persen alias cornering. Tentu saja hal ini dilakukan bukan tanpa tujuan, biasanya harga saham dikerek naik agar sahamnya atraktif dan diborong oleh para investor terutama investor ritel. Selama 6 hari awal perdagangan sendiri volume saham BANK tergolong sepi karena para oknum tersebut masih mengerek naik harga sahamnya untuk nanti dijual di harga tinggi. Akan tetapi pada 2 hari perdagangan terakhir volume perdagangan sudah tergolong ramai yang mengindikasikan para pelaku pasar yang menguasai saham BANK sudah melakukan aksi jualan. Pada perdagangan kemarin lusa volume transaksi mencapai 700 ribu lot sedangkan kemarin mencapai 1,3 juta lot.   Apabila melirik para broker pembeli saham BANK sejak melantai terpantau broker PT Mirae Asset Sekuritas (YP), PT Mandiri Sekuritas (CC), dan PT Indopremier Sekuritas (PD) yang paling banyak memborong saham BANK masing-masing 142 ribu lot, 137 ribu lot, dan 109 ribu lot. Ketiga broker ini sendiri merupakan broker yang paling banyak digunakan oleh para investor ritel. Sedangkan penjualan dilakukan oleh PT Pilarmas Investindo Sekuritas (PO), PT NH Korindo Sekuritas (XA) yang merupakan underwriter BANK, dan PT Semesta Indovest Sekuritas (MG). Ketiga broker tersebut melakukan penjualan masing-masing 500 ribu lot, 189 ribu lot, dan 141 ribu lot. Saham BANK sendiri terpaksa disuspensi bursa pada perdagangan hari ini karena terus melesat kencang dan masuk Unusual Market Activity (UMA) alias pergerakan pasar yang tidak wajar. Sebelumnya, Bank Net Indonesia Syariah menawarkan sebanyak 5 miliar saham biasa atau setara 37,90% dari jumlah modal disetor dengan harga penawaran umum Rp 103 per saham. Dengan demikian, dari IPO ini, perseroan meraih dana segar sebesar Rp 515 miliar. Direktur BANK, Basuki Hidayat mengatakan, seluruh dana yang dihimpun dari IPO akan digunakan untuk modal kerja perseroan. Bersamaan dengan IPO, perseroan juga menerbitkan waran seri pertama sebanyak 2,8 miliar atau sebesar 34,17% dari modal disetor dengan harga pelaksanaan Rp 110. Dengan demikian, perseroan akan memperoleh tambahan modal sebesar Rp 308 miliar. Menurut Basuki, perseroan akan akan membuka akses layanan perbankan syariah yang berbasis digital, menggunakan teknologi informasi dalam mengembangkan produk-produk pendanaan, pembiayaan dan jasa perbankan lainnya. ""Dengan pencatatan perdana saham Bank Net Indonesia Syariah memiliki peluang lebih besar dalam melakukan ekspansi usaha seperti penguatan modal dan penambahan portofolio investasi,"" katanya.   TIM RISET CNBC INDONESIA";11-02-2021;https://www.cnbcindonesia.com/market/20210211075840-17-222606/saham-bank-ramai-transaksi-bandar-sudah-mulai-distribusi;"saham pt bank net syariah tbk (bank) terus melesat kencang sejak melantai di bursa saham alias initial public offering (ipo). sejak melantai 1 februari 2020 di harga rp 103/unit, saham bank sudah terbang 703,88%. fenomena saham ipo yang terbang tinggi memang sering terjadi di bursa lokal. hal ini terjadi karena saham yang beredar di pasar tidak tersebar merata dan hanya dikuasai oleh segelintir pelaku pasar saja. oleh karena itu segelintir pelaku pasar tersebut akan dengan mudah mendorong harga saham ke satu arah dalam kasus ni naik ratusan persen alias cornering. tentu saja hal ini dilakukan bukan tanpa tujuan, biasanya harga saham dikerek naik agar sahamnya atraktif dan diborong oleh para investor terutama investor ritel. selama 6 hari awal perdagangan sendiri volume saham bank tergolong sepi karena para oknum tersebut masih mengerek naik harga sahamnya untuk nanti dijual di harga tinggi. akan tetapi pada 2 hari perdagangan terakhir volume perdagangan sudah tergolong ramai yang mengindikasikan para pelaku pasar yang menguasai saham bank sudah melakukan aksi jualan. pada perdagangan kemarin lusa volume transaksi mencapai 700 ribu lot sedangkan kemarin mencapai 1,3 juta lot. apabila melirik para broker pembeli saham bank sejak melantai terpantau broker pt mirae asset sekuritas (yp), pt mandiri sekuritas (cc), dan pt indopremier sekuritas (pd) yang paling banyak memborong saham bank masing-masing 142 ribu lot, 137 ribu lot, dan 109 ribu lot. ketiga broker ini sendiri merupakan broker yang paling banyak digunakan oleh para investor ritel. sedangkan penjualan dilakukan oleh pt pilarmas investindo sekuritas (po), pt nh korindo sekuritas (xa) yang merupakan underwriter bank, dan pt semesta indovest sekuritas (mg). ketiga broker tersebut melakukan penjualan masing-masing 500 ribu lot, 189 ribu lot, dan 141 ribu lot. saham bank sendiri terpaksa disuspensi bursa pada perdagangan hari ini karena terus melesat kencang dan masuk unusual market activity (uma) alias pergerakan pasar yang tidak wajar. sebelumnya, bank net indonesia syariah menawarkan sebanyak 5 miliar saham biasa atau setara 37,90% dari jumlah modal disetor dengan harga penawaran umum rp 103 per saham. dengan demikian, dari ipo ini, perseroan meraih dana segar sebesar rp 515 miliar. direktur bank, basuki hidayat mengatakan, seluruh dana yang dihimpun dari ipo akan digunakan untuk modal kerja perseroan. bersamaan dengan ipo, perseroan juga menerbitkan waran seri pertama sebanyak 2,8 miliar atau sebesar 34,17% dari modal disetor dengan harga pelaksanaan rp 110. dengan demikian, perseroan akan memperoleh tambahan modal sebesar rp 308 miliar. menurut basuki, perseroan akan akan membuka akses layanan perbankan syariah yang berbasis digital, menggunakan teknologi informasi dalam mengembangkan produk-produk pendanaan, pembiayaan dan jasa perbankan lainnya. ""dengan pencatatan perdana saham bank net indonesia syariah memiliki peluang lebih besar dalam melakukan ekspansi usaha seperti penguatan modal dan penambahan portofolio investasi,"" katanya. tim riset cnbc indonesia"
             Sssttt... Ada Saham Bank yang Menarik Selain BBCA & BBRI Lho            ;"Jakarta, CNBC Indonesia - Sektor perbankan menjadi salah satu sektor penopang bobot Indeks Harga Saham Gabungan (IHSG). Prospek saham bank ke depan diperkirakan cerah, meskipun masih dalam situasi pandemi Covid-19.Saham PT Bank Central Asia Tbk (BBCA) dan PT Bank Rakyat Indonesia (Persero) Tbk (BBRI) menjadi salah satu saham yang menjanjikan dan berpotensi menghasilkan 'cuan'.Namun, ternyata masih ada saham yang menarik bagi para investor selain BBCA maupun BBRI. Misalnya, saham Bank Syariah Indonesia, dengan kode saham BRIS.""Ini menarik karena bank syariah dikatakan merger dan kita lihat ini bank satu-satunya di Indonesia yang akan besar, dan kita lihat secara prospek sangat baik,"" kata Head of Online Trading Ciptadana Sekuritas Zabrina Raissa dalam program InvesTime CNBC Indonesia, kemarin.  ""Tapi memang market mengapresiasi kondisi dan news sentiment yang menghiasi perbankan syariah. Sehingga kita lihat saham perbankan syariah juga mengalami kenaikan signifikan. Tapi jangka mid and long term, ada prospek yang baik,"" lanjutnya.Selain itu, beberapa emiten perbankan yang perlu mendapatkan perhatian adalah perbankan yang mulai merambah bisnis digital seperti BTPN, maupun Bank Jago (ARTO).""Bank Arto ini menarik dan kita lihat kembali lagi kondisi di mana perbankan di Indonesia era digital, salah satu Bank Arto giat melakukan transformasi, di tambah adanya Go-Jek masuk ke Arto. Menarik sekali,"" ujar Zabrina.""BTPN, jenius bisa dikatakan sukses juga. Dari bank BCA juga transformasi digital dan produk digital lainnya, BRI juga,"" jelasnya.";12-02-2021;https://www.cnbcindonesia.com/mymoney/20210212190845-72-223013/sssttt-ada-saham-bank-yang-menarik-selain-bbca-bbri-lho;"sektor perbankan menjadi salah satu sektor penopang bobot indeks harga saham gabungan (ihsg). prospek saham bank ke depan diperkirakan cerah, meskipun masih dalam situasi pandemi covid-19.saham pt bank central asia tbk (bbca) dan pt bank rakyat indonesia (persero) tbk (bbri) menjadi salah satu saham yang menjanjikan dan berpotensi menghasilkan 'cuan'.namun, ternyata masih ada saham yang menarik bagi para investor selain bbca maupun bbri. misalnya, saham bank syariah indonesia, dengan kode saham bris.""ini menarik karena bank syariah dikatakan merger dan kita lihat ini bank satu-satunya di indonesia yang akan besar, dan kita lihat secara prospek sangat baik,"" kata head of online trading ciptadana sekuritas zabrina raissa dalam program investime cnbc indonesia, kemarin. ""tapi memang market mengapresiasi kondisi dan news sentiment yang menghiasi perbankan syariah. sehingga kita lihat saham perbankan syariah juga mengalami kenaikan signifikan. tapi jangka mid and long term, ada prospek yang baik,"" lanjutnya.selain itu, beberapa emiten perbankan yang perlu mendapatkan perhatian adalah perbankan yang mulai merambah bisnis digital seperti btpn, maupun bank jago (arto).""bank arto ini menarik dan kita lihat kembali lagi kondisi di mana perbankan di indonesia era digital, salah satu bank arto giat melakukan transformasi, di tambah adanya go-jek masuk ke arto. menarik sekali,"" ujar zabrina.""btpn, jenius bisa dikatakan sukses juga. dari bank bca juga transformasi digital dan produk digital lainnya, bri juga,"" jelasnya."
             Live Now! Cek Nih Saham-saham Cuan di Tahun Kerbau Logam            ;Jakarta, CNBC Indonesia - Indeks Harga Saham Gabungan (IHSG) ditutup naik 0,77% di level 6.270 pada perdagangan Senin ini (15/2/2021) usai libur panjang Tahun Baru China alias Imlek pekan lalu. Dalam sepekan terakhir perdagangan akumulatif, indeks acuan Bursa Efek Indonesia (BEI) ini sudah cuan nyaris 2%. Di tahun Kerbau Logam, dalam penanggalan China ini, investor tentu bertanya-tanya, saham mana saja yang prospektif dalam jangka pendek sebulan ini dan jangka panjang? Biar gak penasaran, simak pembahasannya bersama Hendriko Gani, analis Sucor Sekuritas, LIVE, Senin malam ini (15/2/2021), mulai pukul 18.20 WIB dalam program InvesTime CNBC Indonesia.  ;15-02-2021;https://www.cnbcindonesia.com/mymoney/20210215152144-72-223418/live-now-cek-nih-saham-saham-cuan-di-tahun-kerbau-logam;indeks harga saham gabungan (ihsg) ditutup naik 0,77% di level 6.270 pada perdagangan senin ini (15/2/2021) usai libur panjang tahun baru china alias imlek pekan lalu. dalam sepekan terakhir perdagangan akumulatif, indeks acuan bursa efek indonesia (bei) ini sudah cuan nyaris 2%. di tahun kerbau logam, dalam penanggalan china ini, investor tentu bertanya-tanya, saham mana saja yang prospektif dalam jangka pendek sebulan ini dan jangka panjang? biar gak penasaran, simak pembahasannya bersama hendriko gani, analis sucor sekuritas, live, senin malam ini (15/2/2021), mulai pukul 18.20 wib dalam program investime cnbc indonesia. 
             Live Now! Berburu Cuan Saham Perbankan, Begini Rahasianya            ;Jakarta, CNBC Indonesia - Sektor perbankan adalah salah satu sektor penopang bobot Indeks Harga Saham Gabungan (IHSG). Betapa tidak, dari hanya dua emiten perbankan yakni PT Bank Central Asia Tbk (BBCA) dan PT Bank Rakyat Indonesia (Persero) Tbk (BBRI) kapitalisasi pasarnya jumbo. Data BEI mencatat, kapitalisasi BBCA Rp 848,13 miliar dan BBRI Rp 577,26 triliun artinya keduanya menyumbang Rp 1.425 triliun ke IHSG. Lantas bagaimana mencermati sektor ini, saham bank mana saja yang prospektif? Simak pembahasan bersama Head of Online Trading Ciptadana Sekuritas, Zabrina Raissa, LIVE, Kamis malam ini (11/2/2021) pukul 18.18 WIB, dalam program InvesTime CNBC Indonesia.   ;11-02-2021;https://www.cnbcindonesia.com/mymoney/20210211155016-72-222785/live-now-berburu-cuan-saham-perbankan-begini-rahasianya;jakarta, cnbc indonesia - sektor perbankan adalah salah satu sektor penopang bobot indeks harga saham gabungan (ihsg). betapa tidak, dari hanya dua emiten perbankan yakni pt bank central asia tbk (bbca) dan pt bank rakyat indonesia (persero) tbk (bbri) kapitalisasi pasarnya jumbo. data bei mencatat, kapitalisasi bbca rp 848,13 miliar dan bbri rp 577,26 triliun artinya keduanya menyumbang rp 1.425 triliun ke ihsg. lantas bagaimana mencermati sektor ini, saham bank mana saja yang prospektif? simak pembahasan bersama head of online trading ciptadana sekuritas, zabrina raissa, live, kamis malam ini (11/2/2021) pukul 18.18 wib, dalam program investime cnbc indonesia. 
             Gokil! Masuk Indeks MSCI, ANTM Tancap Gas & Diborong Investor            ;Jakarta, CNBC Indonesia - Setelah resmi masuk kedalam indeks MSCI Global Standard di Indonesia, saham PT Aneka Tambang Tbk (ANTM) langsung melesat pada awal perdagangan sesi I Rabu (10/2/2021) hari ini. Tercatat pada pukul 09:10 WIB, saham ANTM berhasil melesat 2,93% ke level Rp 2.810/unit. Nilai transaksi saham ANTM pun sudah mencapai Rp 573 miliar dengan volume transaksi yang diperdagangkan sebanyak 206 juta lembar saham.  Tak ketinggalan momen, investor asing pun masuk melalui pasar reguler sebanyak Rp 40,3 miliar. Melesatnya saham ANTM pagi hari ini tak lepas dari sentimen positif dari masuknya saham emiten pertambangan emas tersebut kedalam MSCI Global Standard Index di Indonesia. Per Selasa 9 Februari 2021, indeks yang dibuat oleh MSCI Inc. tersebut resmi dirilis update terbarunya dan efektif hingga 26 Februari 2021 mendatang.   Sebagai informasi MSCI Inc. yang dulunya bernama Morgan Stanley Capital International dan MSCI Barra adalah pembuat indeks dari mulai pasar saham, pasar obligasi, pasar hedge fund, dan perangkat analisis pasar keuangan lain. Posisi saham ANTM di indeks MSCI tersebut mendepak posisi yang sebelumnya diduduki oleh PT Ace Hardware Tbk (ACES), sehingga per 9 Februari 2021, ACES tak lagi menjadi saham yang terdaftar di MSCI Global Standard Index di Indonesia. Di kawasan Asia, penambahan terbaru paling banyak di MSCI Global Standard Index tersebut adalah China, di mana 14 saham baru masuk ke dalam indeks tersebut dan 3 saham keluar dari indeks tersebut. Secara lebih rinci di kawasan Asia, update terbaru dari MSCI Global Standard Index diantaranya penambahan 1 emiten di Indonesia, penambahan 1 di Taiwan, dan 14 di China. Sedangkan yang didepak antara lain 1 di Indonesia, 1 di Taiwan, dan 3 di China. ;10-02-2021;https://www.cnbcindonesia.com/market/20210210091937-17-222339/gokil-masuk-indeks-msci-antm-tancap-gas-diborong-investor;setelah resmi masuk kedalam indeks msci global standard di indonesia, saham pt aneka tambang tbk (antm) langsung melesat pada awal perdagangan sesi i rabu (10/2/2021) hari ini. tercatat pada pukul 09:10 wib, saham antm berhasil melesat 2,93% ke level rp 2.810/unit. nilai transaksi saham antm pun sudah mencapai rp 573 miliar dengan volume transaksi yang diperdagangkan sebanyak 206 juta lembar saham. tak ketinggalan momen, investor asing pun masuk melalui pasar reguler sebanyak rp 40,3 miliar. melesatnya saham antm pagi hari ini tak lepas dari sentimen positif dari masuknya saham emiten pertambangan emas tersebut kedalam msci global standard index di indonesia. per selasa 9 februari 2021, indeks yang dibuat oleh msci inc. tersebut resmi dirilis update terbarunya dan efektif hingga 26 februari 2021 mendatang. sebagai informasi msci inc. yang dulunya bernama morgan stanley capital international dan msci barra adalah pembuat indeks dari mulai pasar saham, pasar obligasi, pasar hedge fund, dan perangkat analisis pasar keuangan lain. posisi saham antm di indeks msci tersebut mendepak posisi yang sebelumnya diduduki oleh pt ace hardware tbk (aces), sehingga per 9 februari 2021, aces tak lagi menjadi saham yang terdaftar di msci global standard index di indonesia. di kawasan asia, penambahan terbaru paling banyak di msci global standard index tersebut adalah china, di mana 14 saham baru masuk ke dalam indeks tersebut dan 3 saham keluar dari indeks tersebut. secara lebih rinci di kawasan asia, update terbaru dari msci global standard index diantaranya penambahan 1 emiten di indonesia, penambahan 1 di taiwan, dan 14 di china. sedangkan yang didepak antara lain 1 di indonesia, 1 di taiwan, dan 3 di china. 
