Title;Content;Date;URL;Cleaned Article
 Corona Buat Kinerja Sektor Properti Terpukul ; ADVERTISEMENT   SCROLL TO CONTINUE WITH CONTENT ;15-05-2020;https://www.cnnindonesia.com/ekonomi/20200515192225-92-503920/corona-buat-kinerja-sektor-properti-terpukul;
 Protokol New Normal KAI untuk Calon Penumpang Kereta ; ADVERTISEMENT   SCROLL TO CONTINUE WITH CONTENT ;18-05-2020;https://www.cnnindonesia.com/ekonomi/20200518092346-92-504349/protokol-new-normal-kai-untuk-calon-penumpang-kereta;
 Kebijakan Moneter BI Kurang 'Greget' Lawan Corona ; ADVERTISEMENT   SCROLL TO CONTINUE WITH CONTENT ;19-05-2020;https://www.cnnindonesia.com/ekonomi/20200519131353-532-504893/kebijakan-moneter-bi-kurang-greget-lawan-corona;
Hari Ini GISTET 500 kV Tambun 2 dan SUTET 500 kV Tambun 2 Incomer Diberi Tegangan Pertama;"Laporan Wartawan Tribunnews.com, Reynas Abdila TRIBUNNEWS.COM, JAKARTA - PT PLN (Persero) Unit Induk Pembangunan Jawa Bagian Barat melangsungkan pemberian tegangan pertama (energize) pada proyek Gas Insulated Substation Tegangan Ekstra Tinggi (GISTET) 500 kV Tambun 2 serta transmisi Saluran udara tegangan ekstra tinggi (SUTET) 500 kV Tambun 2 Incomer pada Sabtu (16/5/2020). Adapun GISTET 500 kV Tambun 2 dan SUTET 500 kV Tambun 2 Incomer ini merupakan bagian dari proyek strategis nasional dalam meningkatkan keandalan kelistrikan di pulau Jawa, khususnya di DKI Jakarta dan sekitarnya. GISTET 500 kV Tambun 2 dibangun dengan menggunakan teknologi Gas Insulated Substation untuk meningkatkan keandalan operasi dari gardu induk 500 kV. Sementara SUTET 500 kV Tambun 2 Incomer akan mendapatkan pasokan listrik dari SUTET 500 kV Muara Tawar arah Tambun 2 serta jalur Cibinong arah Tambun 2. Manager Unit Pelaksana Proyek Jaringan Jawa Bagian Barat 2, Rifki Santoso menyampaikan bahwa keberhasilan energize ini merupakan komitmen PLN untuk menerangi negeri. “Di tengah pandemi Covid-19 ini, tidak menyurutkan semangat kami untuk bisa menyelesaikan kedua project ini. Untuk GISTET 500 kV Tambun 2 & GIS 150 kV Tambun 2 akan menjadi pasokan listrik pelanggan di wilayah Jakarta Timur, Bekasi dan Tambun,” papar Rifky, Sabtu (16/5/2020).  .recads_wrapper{height:134px;position:relative;margin:10px 0 30px;padding:10px 15px;overflow:hidden;box-shadow:0 0 10px rgb(0 0 0 / 20%);}.recads_title{margin-bottom:10px;font-size:16px;font-weight:700}.arjW-list{overflow-x:scroll;overflow-y:hidden;white-space:nowrap;width:auto;padding:10px 0;position:relative;display:flex;scroll-snap-type:x;flex-wrap:nowrap}.recads_item{scroll-snap-align:start;width:280px;flex:0 0 280px;margin-right:20px;display: flex;white-space: normal;gap: 10px;}.recads_item a {display:flex;white-space:normal;gap:10px;}.recads_image{position:relative;height:auto}.recads_image img{width:auto;height: 73px!important;max-width:165px!important;border-radius:8px}.article_datas_title{font-size:14px;font-weight:700;line-height:1.2;margin:0;overflow:hidden;display:-webkit-box;-webkit-line-clamp:4;-webkit-box-orient:vertical;}.arjW-img-overlay{position:absolute;z-index:3;bottom:8px;left:0;padding:0 0 0 10px}.arjW-img-overlay>img{width:auto;height: 16px!important;}.recads_image::after{z-index:2;position:absolute;top:50%;bottom:4px;left:0;right:0;content:'';background:linear-gradient(to top,#d6d6d6,transparent);width:100%;border-radius: 8px;}             BERITA REKOMENDASI           “Penyelesaian kedua proyek ini akan mendukung pengurangan BPP (Biaya Pokok Produksi) serta akan mengevakuasi daya dari GITET 500 kV Bekasi yang saat ini sudah overload,” sambungnya. Adanya Penyelesaian proyek GISTET 500 kV Tambun 2 & SUTET 500 kV Tambun 2 Incomer mendukung keandalan operasi kelistrikan dengan memperkuat saluran transmisi 500 kV Jawa Bali. Selain itu, menekan BPP pembelian listrik dari pembangkit swasta sesuai dengan nawacita program pemerintah. Pada momen yang sama, PLN UIP JBB juga memberikan bantuan sembako kepada para pekerja yang berpartisipasi dalam penyelesaian kedua proyek ini. Bantuan paket sembako diberikan kepada pekerja yang tidak kenal lelah dan tetap menyelesaikan proyek di tahun 2020 di tengah wabah pandemi Covid-19.";16-05-2020;https://www.tribunnews.com/bisnis/2020/05/16/hari-ini-gistet-500-kv-tambun-2-dan-sutet-500-kv-tambun-2-incomer-diberi-tegangan-pertama;laporan wartawan tribunnews.com, reynas abdila tribunnews.com, jakarta - pt pln (persero) unit induk pembangunan jawa bagian barat melangsungkan pemberian tegangan pertama (energize) pada proyek gas insulated substation tegangan ekstra tinggi (gistet) 500 kv tambun 2 serta transmisi saluran udara tegangan ekstra tinggi (sutet) 500 kv tambun 2 incomer pada sabtu (16/5/2020). adapun gistet 500 kv tambun 2 dan sutet 500 kv tambun 2 incomer ini merupakan bagian dari proyek strategis nasional dalam meningkatkan keandalan kelistrikan di pulau jawa, khususnya di dki jakarta dan sekitarnya. gistet 500 kv tambun 2 dibangun dengan menggunakan teknologi gas insulated substation untuk meningkatkan keandalan operasi dari gardu induk 500 kv. sementara sutet 500 kv tambun 2 incomer akan mendapatkan pasokan listrik dari sutet 500 kv muara tawar arah tambun 2 serta jalur cibinong arah tambun 2. manager unit pelaksana proyek jaringan jawa bagian barat 2, rifki santoso menyampaikan bahwa keberhasilan energize ini merupakan komitmen pln untuk menerangi negeri. “di tengah pandemi covid-19 ini, tidak menyurutkan semangat kami untuk bisa menyelesaikan kedua project ini. untuk gistet 500 kv tambun 2 & gis 150 kv tambun 2 akan menjadi pasokan listrik pelanggan di wilayah jakarta timur, bekasi dan tambun,” papar rifky, sabtu (16/5/2020). berita rekomendasi “penyelesaian kedua proyek ini akan mendukung pengurangan bpp (biaya pokok produksi) serta akan mengevakuasi daya dari gitet 500 kv bekasi yang saat ini sudah overload,” sambungnya. adanya penyelesaian proyek gistet 500 kv tambun 2 & sutet 500 kv tambun 2 incomer mendukung keandalan operasi kelistrikan dengan memperkuat saluran transmisi 500 kv jawa bali. selain itu, menekan bpp pembelian listrik dari pembangkit swasta sesuai dengan nawacita program pemerintah. pada momen yang sama, pln uip jbb juga memberikan bantuan sembako kepada para pekerja yang berpartisipasi dalam penyelesaian kedua proyek ini. bantuan paket sembako diberikan kepada pekerja yang tidak kenal lelah dan tetap menyelesaikan proyek di tahun 2020 di tengah wabah pandemi covid-19.
40 Ribu Lebih Pekerja Seni dan Kreatif Terdampak Covid-19, Kemenparekraf Ambil Langkah Cepat;"KOMPAS.com – Kementerian Pariwisata dan Ekonomi Kreatif (Kemenparekraf)/Badan Pariwisata dan Ekonomi Kreatif (Baparekraf) menemukan, sebanyak 44.295 pekerja seni dan kreatif terkena dampak pandemi Covid-19. Menghadapi situasi ini, Menteri Pariwisata dan Ekonomi Kreatif (Menparekraf) Wishnutama Kusubandio segera mengambil langkah untuk memberikan bantuan kepada pekerja sektor seni dan kreatif. “Selain sektor pariwisata, kami juga mengusulkan para pekerja seni dan kreatif untuk mendapatkan bantuan, sebagaimana amanat Presiden Joko Widodo dalam rapat terbatas tentang penanganan dampak Covid-19 yang telah menyetujui agar dapat diberikan bantuan sosial kepada pekerja seni dan kreatif,"" kata Wishnutama dalam keterangan resmi diterima Kompas.com, Sabtu (23/5/2020). Lebih lanjut Wishnutama menjelaskan, sebetulnya program bantuan sudah dimulai sejak pertengahan April lalu lewat pengumpulan dan pemutakhiran data pekerja pariwisata dan ekonomi kreatif yang terdampak Covid-19. Datanya sendiri merupakan gabungan dari Kemenparekraf dengan Kementerian Pendidikan dan Kebudayaan (Kemendikbud). Kedua laporan ini kini tengah menjalani proses verifikasi di Kementerian Sosial untuk implementasinya. ""Kami mengapresiasi dukungan dan kerjasama baik Menteri Sosial dan jajarannya yang telah membantu proses tanpa mengurangi akuntabilitas agar para pekerja seni dan kreatif yang terdampak Covid-19 mendapat bantuan,"" kata Wishnutama. Ke depan, Kemenparekraf/Baparekraf sendiri akan terus menggulirkan program mandiri guna membantu pekerja pariwisata dan ekonomi kreatif terdampak Covid-19. Adapun program dimaksud berupa pendampingan dan pelatihan daring sebagai upaya upskilling dan reskilling SDM pariwisata dan ekonomi kreatif. Dengan demikian, para pekerja sektor pariwisata dan ekonomi kreatif bisa memperoleh pengetahuan tambahan dan kompetensi agar nantinya siap kembali bekerja usai pandemi. ""Saya menekankan bahwa Kemenparekraf/Baparekraf akan terus menjalankan program mitigasi lainnya guna mengatasi dampak Covid-19 terhadap pekerja pariwisata dan ekonomi kreatif termasuk berkoordinasi dengan kementerian/lembaga terkait,"" kata Wishnutama. ";23-05-2020;https://travel.kompas.com/read/2020/05/23/171852427/40-ribu-lebih-pekerja-seni-dan-kreatif-terdampak-covid-19-kemenparekraf-ambil;"kementerian pariwisata dan ekonomi kreatif (kemenparekraf)/badan pariwisata dan ekonomi kreatif (baparekraf) menemukan, sebanyak 44.295 pekerja seni dan kreatif terkena dampak pandemi covid-19. menghadapi situasi ini, menteri pariwisata dan ekonomi kreatif (menparekraf) wishnutama kusubandio segera mengambil langkah untuk memberikan bantuan kepada pekerja sektor seni dan kreatif. “selain sektor pariwisata, kami juga mengusulkan para pekerja seni dan kreatif untuk mendapatkan bantuan, sebagaimana amanat presiden joko widodo dalam rapat terbatas tentang penanganan dampak covid-19 yang telah menyetujui agar dapat diberikan bantuan sosial kepada pekerja seni dan kreatif,"" kata wishnutama dalam keterangan resmi diterima kompas.com, sabtu (23/5/2020). lebih lanjut wishnutama menjelaskan, sebetulnya program bantuan sudah dimulai sejak pertengahan april lalu lewat pengumpulan dan pemutakhiran data pekerja pariwisata dan ekonomi kreatif yang terdampak covid-19. datanya sendiri merupakan gabungan dari kemenparekraf dengan kementerian pendidikan dan kebudayaan (kemendikbud). kedua laporan ini kini tengah menjalani proses verifikasi di kementerian sosial untuk implementasinya. ""kami mengapresiasi dukungan dan kerjasama baik menteri sosial dan jajarannya yang telah membantu proses tanpa mengurangi akuntabilitas agar para pekerja seni dan kreatif yang terdampak covid-19 mendapat bantuan,"" kata wishnutama. ke depan, kemenparekraf/baparekraf sendiri akan terus menggulirkan program mandiri guna membantu pekerja pariwisata dan ekonomi kreatif terdampak covid-19. adapun program dimaksud berupa pendampingan dan pelatihan daring sebagai upaya upskilling dan reskilling sdm pariwisata dan ekonomi kreatif. dengan demikian, para pekerja sektor pariwisata dan ekonomi kreatif bisa memperoleh pengetahuan tambahan dan kompetensi agar nantinya siap kembali bekerja usai pandemi. ""saya menekankan bahwa kemenparekraf/baparekraf akan terus menjalankan program mitigasi lainnya guna mengatasi dampak covid-19 terhadap pekerja pariwisata dan ekonomi kreatif termasuk berkoordinasi dengan kementerian/lembaga terkait,"" kata wishnutama. "
Intip Cara Ciputra Bertahan di Tengah Krisis;"JAKARTA, KOMPAS.com - Krisis Covid-19 memaksa para pengembang properti bekerja ekstra keras dan cerdas melakukan terobosan-terobosan demi mempertahankan kelangsungan bisnisnya. Ciputra Group adalah salah satu kelompok usaha pengembang yang menyadari bahwa krisis selalu melahirkan terobosan dan kreativitas. Krisis juga diyakini tak menutup seluruh peluang dan potensi untuk terus berkembang di tengah ketidakpastian. ""Selalu ada kans, dan potensi untuk keluar dari keterpurukan,"" ujar Direktur Ciputra Group Johan Giam dalam rilisnya kepada Kompas.com, Rabu (20/5/2020). Dengan menggenjot intensifikasi pemanfaatan media sosial seperti Facebook, Twitter, Instagram, Youtub, dan diskusi interaktif secara virtual, Ciputra mencatat penjualan positif atas produk-produknya. Terbaru, mereka membukukan Rp 55 miliar di CitraGarden Puri, Jakarta Barat, hanya dalam waktu sehari.  Kisah keberhasilan ini berlanjut di proyek CitraGarden Gowa, Makassar, Sulawesi Selatan. Rumah yang terjual pada Kuartal I-2020 lebih tinggi 20 persen ketimbang periode yang sama tahun lalu. “Dari Januari hingga Mei 2020 ini, rata-rata kami bisa menjual 15 unit rumah. Dalam kondisi seperti ini, hasil demikian tentu sangat kami syukuri. Minat dan kebutuhan masyakarat terhadap hunian di Gowa dan Makassar masih sangat besar,"" kata Johan. Menurut Johan, perubahan perilaku belanja properti masyarakat selama Pandemi, harus diikuti pengembang agar produknya laku. Mereka tertarik dan banyak melakukan kunjungan virtual, alih-alih datang langsung ke lokasi proyek. Meskipun demikian, Ciputra Group tetap melayani kunjungan fisik dengan penerapan protokol kesehatan. Selain intensifikasi pemasaran digital, faktor lain yang membuat pengembang ini bertahan adalah produk yang dijual disesuaikan dengan kebutuhan pasar. ""Kebutuhan terbanyak pasar Makassar itu rumah dengan harga terjangkau sekitar Rp 400 juta-Rp 500 juta. Ini yang membuat pasar tertarik,"" imbuh Deputy Project Manager Citra Garden Gowa Ilham. Segmen pasarnya adalah pasangan muda dan pembeli rumah pertama. Oleh karena itu, tipe rumah yang ditawarkan pun tidak terlalu besar, hanya 35/66 meter persegi di klaster Primera, Distrik Vintari Park. Selain strategi harga, Ciputra juga menawarkan keringanan berupa uang muka yang bisa diakses hanya Rp 3,5 juta selama lima kali, dan subsidi provisi KPR satu persen. CitraGarden Gowa dibangun di atas lahan seluas 27 hektar, dan telah terbangun 8 klaster residensial yakni Green Perilla, Orange Tangerine, Red Petunia, Yellow Celosia, Silver Cloves, Ivory Palm, Bronze Astelia, dan Golden Tulip yang merupakan pembangunan Tahap I. Sementara kawasan komersial, yakni Ruko Flavour Walk Tahap 1 dan 2, sudah terserap seluruhnya.     ";21-05-2020;https://properti.kompas.com/read/2020/05/21/080000321/intip-cara-ciputra-bertahan-di-tengah-krisis;"jakarta, kompas.com - krisis covid-19 memaksa para pengembang properti bekerja ekstra keras dan cerdas melakukan terobosan-terobosan demi mempertahankan kelangsungan bisnisnya. ciputra group adalah salah satu kelompok usaha pengembang yang menyadari bahwa krisis selalu melahirkan terobosan dan kreativitas. krisis juga diyakini tak menutup seluruh peluang dan potensi untuk terus berkembang di tengah ketidakpastian. ""selalu ada kans, dan potensi untuk keluar dari keterpurukan,"" ujar direktur ciputra group johan giam dalam rilisnya kepada kompas.com, rabu (20/5/2020). dengan menggenjot intensifikasi pemanfaatan media sosial seperti facebook, twitter, instagram, youtub, dan diskusi interaktif secara virtual, ciputra mencatat penjualan positif atas produk-produknya. terbaru, mereka membukukan rp 55 miliar di citragarden puri, jakarta barat, hanya dalam waktu sehari. kisah keberhasilan ini berlanjut di proyek citragarden gowa, makassar, sulawesi selatan. rumah yang terjual pada kuartal i-2020 lebih tinggi 20 persen ketimbang periode yang sama tahun lalu. “dari januari hingga mei 2020 ini, rata-rata kami bisa menjual 15 unit rumah. dalam kondisi seperti ini, hasil demikian tentu sangat kami syukuri. minat dan kebutuhan masyakarat terhadap hunian di gowa dan makassar masih sangat besar,"" kata johan. menurut johan, perubahan perilaku belanja properti masyarakat selama pandemi, harus diikuti pengembang agar produknya laku. mereka tertarik dan banyak melakukan kunjungan virtual, alih-alih datang langsung ke lokasi proyek. meskipun demikian, ciputra group tetap melayani kunjungan fisik dengan penerapan protokol kesehatan. selain intensifikasi pemasaran digital, faktor lain yang membuat pengembang ini bertahan adalah produk yang dijual disesuaikan dengan kebutuhan pasar. ""kebutuhan terbanyak pasar makassar itu rumah dengan harga terjangkau sekitar rp 400 juta-rp 500 juta. ini yang membuat pasar tertarik,"" imbuh deputy project manager citra garden gowa ilham. segmen pasarnya adalah pasangan muda dan pembeli rumah pertama. oleh karena itu, tipe rumah yang ditawarkan pun tidak terlalu besar, hanya 35/66 meter persegi di klaster primera, distrik vintari park. selain strategi harga, ciputra juga menawarkan keringanan berupa uang muka yang bisa diakses hanya rp 3,5 juta selama lima kali, dan subsidi provisi kpr satu persen. citragarden gowa dibangun di atas lahan seluas 27 hektar, dan telah terbangun 8 klaster residensial yakni green perilla, orange tangerine, red petunia, yellow celosia, silver cloves, ivory palm, bronze astelia, dan golden tulip yang merupakan pembangunan tahap i. sementara kawasan komersial, yakni ruko flavour walk tahap 1 dan 2, sudah terserap seluruhnya. "
Kenali Pusing yang Bisa Jadi Gejala Kanker Otak;KOMPAS.com – Pusing atau nyeri kepala bisa disebabkan oleh banyak hal. Serangkaian sensasi seolah-olah ruangan berputar, kehilangan keseimbangan, dan lemas ini sebenarnya bukanlah suatu penyakit. Pusing hanya menjadi gejala yang timbul akibat adanya kondisi medis yang mendasari. Nyeri kepala ini juga bisa terjadi karena pengaruh faktor eksternal, seperti efek samping dari minum obat-obatan tertentu, konsumsi alkohol, termasuk benturan kepala dengan benda keras. Namun, patut menjadi kewaspadaan lebih, pusing dapat berkaitan erat dengan gejala beberapa penyakit mematikan, seperti kanker otak. Secara garis besar otak manusia terbagi menjadi tiga bagian, yakni: Masing-masing bagian tersebut dapat terbagi lagi menjadi bagian-bagian yang lebih kecil, lebih kecil lagi, dan lebih kecil lagi. Ruang antarbagian pada otak terisi oleh cairan otak yang disebut cerebrospinal fluid. Sedangkan bagian luarnya, terlindungi oleh tiga lapis selaput otak (meninges) ditambah tulang tengkorak. Seperti pada bagian-bagian tubuh lain, otak bisa juga terkenan tumor maupun kanker. Bedanya, jika pada bagian tubuh lain, tumor jinak kadang tidak mengganggu dan tidak berbahaya, sementara di otak bisa sangat mengganggu dan membahayakan nyawa. Melansir Buku Agar Otak Sehat (2) (2013) oleh Pangkalan Ide, otak memiliki bagian dan fungsi yang berbeda-beda, sehingga gejala yang timbul akibat kanker otak juga bisa berlainan. Namun, secara garis besar, semua jenis kanker otak bisa menimbulkan gejala pusing atau nyeri kepala. Para ahli memperkirakan bahwa 1 persen penyebab terjadinya nyeri kepala adalah karena terjadinya kanker otak. Sementara diperkirakan pula 30 persen gejala awal terjadinya tumor otak dan kanker otak adalah mengalami nyeri pada kepala. Sedangkan, gejala lanjut diketemukan pada 70 persen kasus. ;17-05-2020;https://health.kompas.com/read/2020/05/17/180200068/kenali-pusing-yang-bisa-jadi-gejala-kanker-otak?page=all;pusing atau nyeri kepala bisa disebabkan oleh banyak hal. serangkaian sensasi seolah-olah ruangan berputar, kehilangan keseimbangan, dan lemas ini sebenarnya bukanlah suatu penyakit. pusing hanya menjadi gejala yang timbul akibat adanya kondisi medis yang mendasari. nyeri kepala ini juga bisa terjadi karena pengaruh faktor eksternal, seperti efek samping dari minum obat-obatan tertentu, konsumsi alkohol, termasuk benturan kepala dengan benda keras. namun, patut menjadi kewaspadaan lebih, pusing dapat berkaitan erat dengan gejala beberapa penyakit mematikan, seperti kanker otak. secara garis besar otak manusia terbagi menjadi tiga bagian, yakni: masing-masing bagian tersebut dapat terbagi lagi menjadi bagian-bagian yang lebih kecil, lebih kecil lagi, dan lebih kecil lagi. ruang antarbagian pada otak terisi oleh cairan otak yang disebut cerebrospinal fluid. sedangkan bagian luarnya, terlindungi oleh tiga lapis selaput otak (meninges) ditambah tulang tengkorak. seperti pada bagian-bagian tubuh lain, otak bisa juga terkenan tumor maupun kanker. bedanya, jika pada bagian tubuh lain, tumor jinak kadang tidak mengganggu dan tidak berbahaya, sementara di otak bisa sangat mengganggu dan membahayakan nyawa. melansir buku agar otak sehat (2) (2013) oleh pangkalan ide, otak memiliki bagian dan fungsi yang berbeda-beda, sehingga gejala yang timbul akibat kanker otak juga bisa berlainan. namun, secara garis besar, semua jenis kanker otak bisa menimbulkan gejala pusing atau nyeri kepala. para ahli memperkirakan bahwa 1 persen penyebab terjadinya nyeri kepala adalah karena terjadinya kanker otak. sementara diperkirakan pula 30 persen gejala awal terjadinya tumor otak dan kanker otak adalah mengalami nyeri pada kepala. sedangkan, gejala lanjut diketemukan pada 70 persen kasus. 
